ALGN,ALGN:UW,BBG000BRNWJ1,"BioScrip (BIOS) Q2 Loss Wider Than Expected, Revenues Miss",2017-08-09 13:46:01 +0000,https://finance.yahoo.com/news/bioscrip-bios-q2-loss-wider-134601031.html?.tsrc=rss,BioScrip (BIOS) continues to disappoint in Q2 mainly due to its strategic shift to focus on growing its core revenue mix.
ALGN,ALGN:UW,BBG000BRNWJ1,"BioTelemetry (BEAT) Q2 Earnings Top, Revenues Meet Estimates",2017-08-09 13:42:01 +0000,https://finance.yahoo.com/news/biotelemetry-beat-q2-earnings-top-134201006.html?.tsrc=rss,BioTelemetry (BEAT) rides high on all its segments in Q2. The company is also putting in efforts in product innovation through research and development.
ALGN,ALGN:UW,BBG000BRNWJ1,Myriad Genetics (MYGN) Beats on Q4 Earnings & Revenues,2017-08-09 13:20:01 +0000,https://finance.yahoo.com/news/myriad-genetics-mygn-beats-q4-132001972.html?.tsrc=rss,"Myriad Genetics (MYGN) rides high on strength in Molecular diagnostics with significant contributions from GeneSight. Also, hereditary cancer testing continues to witness sequential growth."
ALGN,ALGN:UW,BBG000BRNWJ1,"Penumbra (PEN) Loss Meets Estimates, Revenues Beat in Q2",2017-08-09 12:32:12 +0000,https://finance.yahoo.com/news/penumbra-pen-loss-meets-estimates-123212827.html?.tsrc=rss,Penumbra (PEN) witnessed strong growth across all its geographies and product lines in Q2. New product launches raise hope.
ALGN,ALGN:UW,BBG000BRNWJ1,5 ‘Strong Buy’ Stocks Wall Street Is 100% Sure Of,2017-08-08 23:34:18 +0000,http://articlefeeds.nasdaq.com/~r/nasdaq/symbols/~3/FQt3XpDiAoo/5-strong-buy-stocks-wall-street-is-100-sure-of-cm829122,InvestorPlace Stock Market News Stock Advice amp Trading Tips Which top stocks are Wall Street analysts the most bullish on Stocks with no hold or sell ratings and a pure strong buy analyst consensus These are the stocks that make the most compelling investing opportunities and
ALGN,ALGN:UW,BBG000BRNWJ1,5 Strong Buy Stocks Surging Again,2017-08-08 21:36:07 +0000,http://articlefeeds.nasdaq.com/~r/nasdaq/symbols/~3/-YA0H-ReSYc/5-strong-buy-stocks-surging-again-cm829068,Stocks continued to rally off of Friday s jobs number until mid morning today After Europe closed the US market stalled out and most major market averages ran out of gas Even solid earnings out of retailers like Michael Kors couldn t provide enough fuel as markets sold off into the
ALGN,ALGN:UW,BBG000BRNWJ1,"CVS Health (CVS) Q2 Earnings Beat, '17 Guidance Narrowed",2017-08-08 19:36:23 +0000,http://articlefeeds.nasdaq.com/~r/nasdaq/symbols/~3/LRz8EzXTAag/cvs-health-cvs-q2-earnings-beat-17-guidance-narrowed-cm828983,CVS Health Corporation s CVS second quarter 2017 adjusted earnings per share EPS of 1 33 were up a nominal 0 8 on a year over year basis The quarter s adjusted EPS also exceeded the Zacks Consensus Estimate by 2 cents Earnings performance was sluggish year over year on
ALGN,ALGN:UW,BBG000BRNWJ1,"Henry Schein (HSIC) Q2 Earnings & Revenues Beat, View Intact",2017-08-08 16:41:11 +0000,http://articlefeeds.nasdaq.com/~r/nasdaq/symbols/~3/sw5UtJ6EkUo/henry-schein-hsic-q2-earnings-revenues-beat-view-intact-cm828870,Henry Schein Inc HSIC reported adjusted earnings per share EPS of 1 75 in the second quarter of 2017 up 6 7 year over year Adjusted EPS also surpassed the Zacks Consensus Estimate of 1 73 The year over year upside in earnings was driven by strong revenue growth Henry Schein s
ALGN,ALGN:UW,BBG000BRNWJ1,"Henry Schein (HSIC) Q2 Earnings & Revenues Beat, View Intact",2017-08-08 14:14:02 +0000,https://finance.yahoo.com/news/henry-schein-hsic-q2-earnings-141402866.html?.tsrc=rss,"Henry Schein (HSIC) maintained its stellar performance in Q2 as well, courtesy of strength in all of its business segments."
ALGN,ALGN:UW,BBG000BRNWJ1,"Bio-Rad (BIO) Misses Q2 Earnings & Sales, Margin Declines",2017-08-08 13:39:41 +0000,http://articlefeeds.nasdaq.com/~r/nasdaq/symbols/~3/2cKc47gHlDU/bio-rad-bio-misses-q2-earnings-sales-margin-declines-cm828705,Bio Rad Laboratories Inc BIO reported second quarter 2017 earnings of 17 cents per share a huge decline from the year ago earnings of 61 cents The quarter s figure also missed the Zacks Consensus Estimate of 63 cents by a wide margin Notably net income in the second quarter was hit
ALGN,ALGN:UW,BBG000BRNWJ1,"Orthofix (OFIX) Earnings Meet, Sales Beat Estimates in Q2",2017-08-08 12:50:12 +0000,https://finance.yahoo.com/news/orthofix-ofix-earnings-meet-sales-125012604.html?.tsrc=rss,"Orthofix (OFIX) rides high on strength in Biologics and Spine Fixation businesses. Moreover, raised full-year 2017 guidance buoys optimism."
ALGN,ALGN:UW,BBG000BRNWJ1,"Haemonetics (HAE) Q1 Earnings Beat, Revenues Miss Estimates",2017-08-08 12:31:12 +0000,https://finance.yahoo.com/news/haemonetics-hae-q1-earnings-beat-123112531.html?.tsrc=rss,Haemonetics (HAE) rides high on Plasma and Haemonetics Management franchises strength in Q1.
ALGN,ALGN:UW,BBG000BRNWJ1,"Bio-Rad (BIO) Misses Q2 Earnings & Sales, Margin Declines",2017-08-08 12:17:12 +0000,https://finance.yahoo.com/news/bio-rad-bio-misses-q2-121712797.html?.tsrc=rss,Bio-Rad&apos;s (BIO) sales declined on ERP-related disruption. Margin pressure continues.
ALGN,ALGN:UW,BBG000BRNWJ1,Why Align Technology's Shares Soared 11.4% In July,2017-08-08 01:37:01 +0000,http://articlefeeds.nasdaq.com/~r/nasdaq/symbols/~3/C3B3Kp3axT4/why-align-technologys-shares-soared-114-in-july-cm828437,What happened After Align Technology NASDAQ ALGN reported case shipments had notched another quarterly increase the company s shares 160 climbed 11 4 in July 160 according to S amp P Global Market Intelligence So what Growing global demand has turned
ALGN,ALGN:UW,BBG000BRNWJ1,3 Stocks With Costco Wholesale-Like Return Potential,2017-08-08 00:50:00 +0000,http://finance.yahoo.com/r/320e055b-f402-3190-a446-d27e789e5de4/3-stocks-with-costco-wholesale-like-return-potenti.aspx?yptr=yahoo&.tsrc=rss,The warehouse club has provided investors with solid returns over the past decade. These three stocks could do the same.
ALGN,ALGN:UW,BBG000BRNWJ1,Why Align Technology&apos;s Shares Soared 11.4% In July,2017-08-07 23:45:00 +0000,http://finance.yahoo.com/r/c20b2198-580c-33fb-8bbe-0f89b0089c97/why-align-technologys-shares-soared-114-in-july.aspx?yptr=yahoo&.tsrc=rss,The maker of clear dental aligners reported grinningly good second-quarter results.
ALGN,ALGN:UW,BBG000BRNWJ1,Cardiovascular Systems Rides on Innovation Amid Several Woes,2017-08-07 11:43:11 +0000,https://finance.yahoo.com/news/cardiovascular-systems-rides-innovation-amid-114311281.html?.tsrc=rss,Cardiovascular Systems&apos; (CSII) low operating expenses and strong revenue performance contributed to the upside in Q2 earnings.
ALGN,ALGN:UW,BBG000BRNWJ1,Corporate News Blog - RTI Surgical(R) Divests Cardiothoracic Closure Business to A&E Medical Corp.,2017-08-07 11:10:00 +0000,https://finance.yahoo.com/news/corporate-news-blog-rti-surgical-111000436.html?.tsrc=rss,"Research Desk Line-up: Align Technology Post Earnings Coverage LONDON, UK / ACCESSWIRE / August 7, 2017 / Pro-Trader Daily takes a look at the latest corporate events and news making the headlines for ..."
ALGN,ALGN:UW,BBG000BRNWJ1,Pacific Biosciences (PACB) Posts Wider-than-Expected Q2 Loss,2017-08-04 20:32:08 +0000,https://finance.yahoo.com/news/pacific-biosciences-pacb-posts-wider-203208358.html?.tsrc=rss,"Pacific Biosciences (PACB) posted a dull quarter with revenues declining in Q2. However, the company continues to anticipate 35% to 45% growth in product and service revenues for the year."
ALGN,ALGN:UW,BBG000BRNWJ1,"Align Technology, Acacia Research, Apple, Amazon and Alphabet highlighted as Zacks Bull and Bear of the Day",2017-08-04 15:31:03 +0000,https://finance.yahoo.com/news/align-technology-acacia-research-apple-153103593.html?.tsrc=rss,"Align Technology, Acacia Research, Apple, Amazon and Alphabet highlighted as Zacks Bull and Bear of the Day"
ALGN,ALGN:UW,BBG000BRNWJ1,"Bruker (BRKR) Q2 Earnings & Revenues Beat Estimates, View Up",2017-08-04 15:06:19 +0000,http://articlefeeds.nasdaq.com/~r/nasdaq/symbols/~3/_p1__M9P3OY/bruker-brkr-q2-earnings-revenues-beat-estimates-view-up-cm827176,Bruker Corporation BRKR reported adjusted earnings per share EPS of 23 cents in the second quarter of 2017 up 15 from the year ago figure Adjusted EPS also beat the Zacks Consensus Estimate of 20 cents Excluding one time adjustments Bruker reported net income of 23 4 million or 15
ALGN,ALGN:UW,BBG000BRNWJ1,Wright Medical Group (WMGI) Q2 Loss Narrower than Expected,2017-08-04 13:26:01 +0000,https://finance.yahoo.com/news/wright-medical-group-wmgi-q2-132601833.html?.tsrc=rss,Wright Medical Group N.V. (WMGI) posted narrower-than-expected loss on account of strong growth in the U.S.
ALGN,ALGN:UW,BBG000BRNWJ1,Inogen (INGN) Beats Earnings and Revenue Estimates in Q2,2017-08-04 13:23:01 +0000,https://finance.yahoo.com/news/inogen-ingn-beats-earnings-revenue-132301529.html?.tsrc=rss,"Inogen (INGN) delivers better-than-expected results in Q2 with significant contributions from the Business-to-Business segment. Moreover, raised guidance buoys optimism."
ALGN,ALGN:UW,BBG000BRNWJ1,"Illumina (ILMN) Rides on New Products, Low Margin a Concern",2017-08-04 12:50:12 +0000,https://finance.yahoo.com/news/illumina-ilmn-rides-products-low-125012835.html?.tsrc=rss,Illumina (ILMN) continues to grow in high-potential genetic research market through innovation and product launches.
ALGN,ALGN:UW,BBG000BRNWJ1,"Bruker (BRKR) Q2 Earnings & Revenues Beat Estimates, View Up",2017-08-04 12:49:12 +0000,https://finance.yahoo.com/news/bruker-brkr-q2-earnings-revenues-124912468.html?.tsrc=rss,"Bruker (BRKR) delivers a better-than-expected Q2, largely driven by strength in CALID Group and BEST. Moreover, a raised guidance buoys optimism."
ALGN,ALGN:UW,BBG000BRNWJ1,"Hologic (HOLX) Beats on 3Q Earnings, Cuts Revenue Guidance",2017-08-03 17:03:17 +0000,http://articlefeeds.nasdaq.com/~r/nasdaq/symbols/~3/SC-emx57q8w/hologic-holx-beats-on-3q-earnings-cuts-revenue-guidance-cm826654,Hologic Inc HOLX reported third quarter fiscal 2017 adjusted earnings per share EPS of 50 cents down 1 9 year over year However adjusted EPS beat the Zacks Consensus Estimate by a penny and remained at the upper end of the company s guidance of 48 50 cents Strong top line growth led
ALGN,ALGN:UW,BBG000BRNWJ1,"Cardiovascular Systems (CSII) Posts Q4 Earnings, Revenues Top",2017-08-03 13:04:27 +0000,http://articlefeeds.nasdaq.com/~r/nasdaq/symbols/~3/lne4jjFpAyQ/cardiovascular-systems-csii-posts-q4-earnings-revenues-top-cm826315,Cardiovascular Systems Inc CSII reported adjusted earnings per share of 2 cents in fourth quarter fiscal 2017 reflecting massive improvement from the year ago quarter s adjusted loss of 15 cents a share The quarter s number compared favorably with the Zacks Consensus Estimate of a loss of
ALGN,ALGN:UW,BBG000BRNWJ1,"Align Technology Expands Its Presence in Raleigh, North Carolina With Larger Office to Support Continued Headcount Growth",2017-08-03 12:30:00 +0000,https://finance.yahoo.com/news/align-technology-expands-presence-raleigh-123000302.html?.tsrc=rss,"Align Technology, Inc. , makers of the Invisalign® system, the most advanced clear aligner system in the world, and iTero® intraoral scanners, has opened a larger office in Raleigh, North Carolina to accommodate ..."
ALGN,ALGN:UW,BBG000BRNWJ1,"Cardiovascular Systems (CSII) Posts Q4 Earnings, Revenues Top",2017-08-03 12:09:12 +0000,https://finance.yahoo.com/news/cardiovascular-systems-csii-posts-q4-120912845.html?.tsrc=rss,Cardiovascular Systems&apos; (CSII) lower operating expenses drove the year-over-year improvement in Q4 earnings.
ALGN,ALGN:UW,BBG000BRNWJ1,"Illumina (ILMN) Tops Q2 Earnings & Revenues, Raises View",2017-08-02 17:00:03 +0000,http://articlefeeds.nasdaq.com/~r/nasdaq/symbols/~3/_QwcM1s8DKM/illumina-ilmn-tops-q2-earnings-revenues-raises-view-cm825877,Illumina Inc ILMN reported adjusted earnings per share EPS of 82 cents in the second quarter of 2017 which beat the Zacks Consensus Estimate by 20 6 The reported figure also surpassed the company s guided range of 65 70 cents Adjusted earnings however lagged the year ago number by 4
ALGN,ALGN:UW,BBG000BRNWJ1,Genomic Health (GHDX) Posts Wider-than-Expected Loss in Q2,2017-08-02 16:58:27 +0000,http://articlefeeds.nasdaq.com/~r/nasdaq/symbols/~3/0rFXrAfhzU0/genomic-health-ghdx-posts-wider-than-expected-loss-in-q2-cm825846,Genomic Health Inc GHDX reported second quarter 2017 loss per share of 8 cents reflecting an improvement from the year ago quarter s loss of 18 cents The quarter s number is however wider than the Zacks Consensus Estimate of a loss of 6 cents Net loss in the reported quarter was 2
ALGN,ALGN:UW,BBG000BRNWJ1,"ResMed (RMD) Q4 Earnings Top, 2020 Strategic Goals on Track",2017-08-02 16:01:23 +0000,http://articlefeeds.nasdaq.com/~r/nasdaq/symbols/~3/mijwzBY9tuQ/resmed-rmd-q4-earnings-top-2020-strategic-goals-on-track-cm825774,ResMed Inc 160 RMD announced fourth quarter fiscal 2017 adjusted earnings per share EPS of 77 cents up 4 1 from the prior year quarter level Earnings also beat the Zacks Consensus Estimate by 2 cents Including one time items ResMed reported EPS of 71 cents in the quarter up 20 4
ALGN,ALGN:UW,BBG000BRNWJ1,"Illumina (ILMN) Tops Q2 Earnings & Revenues, Raises View",2017-08-02 14:25:02 +0000,https://finance.yahoo.com/news/illumina-ilmn-tops-q2-earnings-142502015.html?.tsrc=rss,Illumina (ILMN) delivers an impressive Q2 on strong uptake of sequencing consumables and microarrays and continued adoption of NovaSeq platform. A raised guidance buoys optimism.
ALGN,ALGN:UW,BBG000BRNWJ1,Roundtable: 1 Stock I Can't Wait to Buy on a Pullback,2017-08-02 13:57:28 +0000,http://articlefeeds.nasdaq.com/~r/nasdaq/symbols/~3/E-qci0fy4f8/roundtable-1-stock-i-cant-wait-to-buy-on-a-pullback-cm825535,We don t often find ourselves hoping for stocks that we like or own to fall But all of us have a price that s too high to pay and three of our Foolish investors have identified stocks that they wouldn t mind taking a tumble so that they can finally buy shares Of course this
ALGN,ALGN:UW,BBG000BRNWJ1,DaVita (DVA) Beats Earnings and Revenue Estimates in Q2,2017-08-02 12:16:12 +0000,https://finance.yahoo.com/news/davita-dva-beats-earnings-revenue-121612931.html?.tsrc=rss,DaVita&apos;s (DVA) stable performance across its businesses was the key highlight of the second quarter.
ALGN,ALGN:UW,BBG000BRNWJ1,Roundtable: 1 Stock I Can&apos;t Wait to Buy on a Pullback,2017-08-02 12:00:00 +0000,http://finance.yahoo.com/r/6e4957c3-636f-3dcd-9a6b-9edea30ab750/roundtable-1-stock-i-cant-wait-to-buy-on-a-pullbac.aspx?yptr=yahoo&.tsrc=rss,"Liquor, braces, and Latin America are all on our investors&apos; minds. Here&apos;s why they&apos;re praying for a pullback."
ALGN,ALGN:UW,BBG000BRNWJ1,"IDEXX Laboratories (IDXX) Q2 Earnings & Revenues Top, View Up",2017-08-01 17:00:32 +0000,http://articlefeeds.nasdaq.com/~r/nasdaq/symbols/~3/kpf49JlIDGQ/idexx-laboratories-idxx-q2-earnings-revenues-top-view-up-cm825085,IDEXX Laboratories Inc 160 IDXX recorded second quarter 2017 earnings per share EPS of 95 cents up 28 up 30 at constant exchange rate or CER year over year on a reported basis Further the reported figure surpassed the Zacks Consensus Estimate of 85 cents Strong top line growth
ALGN,ALGN:UW,BBG000BRNWJ1,VWR Corp (VWR) Beats Earnings & Revenue Estimates in Q2,2017-08-01 17:00:08 +0000,http://articlefeeds.nasdaq.com/~r/nasdaq/symbols/~3/DXTcU2nvKIw/vwr-corp-vwr-beats-earnings-revenue-estimates-in-q2-cm825078,VWR Corporation VWR reported second quarter 2017 adjusted earnings per share EPS of 49 cents reflecting a 16 7 rise from the year ago figure Earnings also surpassed the Zacks Consensus Estimate of 44 cents on a strong top line performance Including one time items the company
ALGN,ALGN:UW,BBG000BRNWJ1,VWR Corp (VWR) Beats Earnings & Revenue Estimates in Q2,2017-08-01 14:35:02 +0000,https://finance.yahoo.com/news/vwr-corp-vwr-beats-earnings-143502528.html?.tsrc=rss,VWR Corp (VWR) reported an impressive Q2 and is presently awaiting a merger with Avantor.
ALGN,ALGN:UW,BBG000BRNWJ1,"IDEXX Laboratories (IDXX) Q2 Earnings & Revenues Top, View Up",2017-08-01 14:29:02 +0000,https://finance.yahoo.com/news/idexx-laboratories-idxx-q2-earnings-142902115.html?.tsrc=rss,"IDEXX Laboratories (IDXX) rides high on strength across all segments in Q2 with significant contributions from the Companion Animal Group business. Moreover, a raised guidance buoys optimism."
ALGN,ALGN:UW,BBG000BRNWJ1,"Hill-Rom Holdings (HRC) Beats Q3 Earnings, Misses Revenues",2017-08-01 13:54:01 +0000,https://finance.yahoo.com/news/hill-rom-holdings-hrc-beats-135401825.html?.tsrc=rss,Hill-Rom Holdings (HRC) rides high on international growth and product innovation.
ALGN,ALGN:UW,BBG000BRNWJ1,Align Technology Was the S&P 500’s Top Gainer on July 28,2017-08-01 13:13:12 +0000,http://finance.yahoo.com/r/59f7ae15-2388-3cb6-91fd-a9ca28859018/align-technology-sp-500s-top-gainer-july-28?utm_source=yahoo&utm_medium=feed&yptr=yahoo&.tsrc=rss,Align Technology recorded revenue of $356.5 million in 2Q17—growth of 32.3% from $269.4 million recorded in 2Q16.
ALGN,ALGN:UW,BBG000BRNWJ1,"Company News For July 31, 2017",2017-07-31 14:25:02 +0000,https://finance.yahoo.com/news/company-news-july-31-2017-142502639.html?.tsrc=rss,"Companies in the news are: EXPE,MRK,ALGN,MAT"
ALGN,ALGN:UW,BBG000BRNWJ1,Chopping Through the Amazon Report,2017-07-31 13:53:31 +0000,http://articlefeeds.nasdaq.com/~r/nasdaq/symbols/~3/bvXbV1-S-pg/chopping-through-the-amazon-report-cm823972,All in all the market held up well to Amazon s disappointing report from yesterday afternoon The major indices started the session deeply in the red but spent the rest of the day slowly but surely trekking higher The Dow managed to finish on the positive side and the losses for
ALGN,ALGN:UW,BBG000BRNWJ1,"NuVasive (NUVA) Beats on Q2 Earnings, Retains 2017 View",2017-07-31 13:07:01 +0000,https://finance.yahoo.com/news/nuvasive-nuva-beats-q2-earnings-130701000.html?.tsrc=rss,"NuVasive (NUVA) rides high on continued growth in international business in Q2. Also, the company has worked on revamping its organizational structure."
ALGN,ALGN:UW,BBG000BRNWJ1,"Omnicell (OMCL) Earnings Meet, Revenues Beat Estimates in Q2",2017-07-31 13:03:01 +0000,https://finance.yahoo.com/news/omnicell-omcl-earnings-meet-revenues-130301936.html?.tsrc=rss,Omnicell (OMCL) benefited from high XT revenues and strength in IV Solutions in Q2.
ALGN,ALGN:UW,BBG000BRNWJ1,AmerisourceBergen (ABC) Q3 Earnings: Will It Disappoint?,2017-07-31 11:40:11 +0000,https://finance.yahoo.com/news/amerisourcebergen-abc-q3-earnings-disappoint-114011673.html?.tsrc=rss,AmerisourceBergen&apos;s (ABC) third-quarter performance face risks from reduced contract renewals and lower generic inflation.
ALGN,ALGN:UW,BBG000BRNWJ1,Here's Why Align Technology Marched Higher Again Today,2017-07-28 21:58:55 +0000,http://articlefeeds.nasdaq.com/~r/nasdaq/symbols/~3/sGVv_nl9Ywk/heres-why-align-technology-marched-higher-again-today-cm823668,What happened Shares of Align Technology Inc NASDAQ ALGN an orthodontic device company rose about 10 during Friday s session Record results released after the bell on Thursday should keep investors smiling all through the weekend So what Just as the analysts who
ALGN,ALGN:UW,BBG000BRNWJ1,The Hot Stock: Align Technology Soars 10%,2017-07-28 21:34:00 +0000,http://finance.yahoo.com/r/7dfd09be-dfde-3d15-86eb-82f0ed9550e9/the-hot-stock-align-technology-soars-10-1501277648?mod=yahoobarrons&ru=yahoo&yptr=yahoo&.tsrc=rss,"Align Technology (ALGN) soared to the top of the S&P 500 today after the dental-products company beat earnings forecasts and raised its guidance. Align Technology gained 10% to $173.06 today, while the ..."
ALGN,ALGN:UW,BBG000BRNWJ1,"Noteworthy Friday Option Activity: CACC, ALGN, BOFI",2017-07-28 20:58:33 +0000,http://articlefeeds.nasdaq.com/~r/nasdaq/symbols/~3/qUSDZoRHBMY/noteworthy-friday-option-activity-cacc-algn-bofi-cm823631,Looking at options trading activity among components of the Russell 3000 index there is noteworthy activity today in Credit Acceptance Corp Symbol CACC where a total volume of 3 207 contracts has been traded thus far today a contract volume which is representative of approximately 320
ALGN,ALGN:UW,BBG000BRNWJ1,Here&apos;s Why Align Technology Marched Higher Again Today,2017-07-28 20:47:00 +0000,http://finance.yahoo.com/r/b08013ff-36f6-31d3-839c-64f601f0b66f/heres-why-align-technology-marched-higher-again-to.aspx?yptr=yahoo&.tsrc=rss,Another sparkling earnings report is pushing its stock price to new highs.
ALGN,ALGN:UW,BBG000BRNWJ1,Amazon and Starbucks sink while Align Technology climbs,2017-07-28 20:29:29 +0000,https://finance.yahoo.com/news/amazon-starbucks-sink-while-align-202929178.html?.tsrc=rss,"Stocks that moved substantially or traded heavily Friday: Amazon.com Inc., down $25.96 to $1,020.04 The online retailer's second-quarter profit fell short of expectations as it invested more money in its ..."
ALGN,ALGN:UW,BBG000BRNWJ1,Inside Align Technology's Q2 Beat And Raise: Teen Segment Could See An Inflection Point,2017-07-28 20:20:20 +0000,https://finance.yahoo.com/news/inside-align-technologys-q2-beat-202020650.html?.tsrc=rss,"Align Technology, Inc. (NASDAQ: ALGN ) shares soared after reporting record second-quarter results that saw a solid earnings and sales beat. Align, which is the manufacturer of Invisalign, could see an ..."
ALGN,ALGN:UW,BBG000BRNWJ1,"GNC Holdings (GNC) Tops Q2 Earnings, Misses Sales Estimates",2017-07-28 17:01:37 +0000,http://articlefeeds.nasdaq.com/~r/nasdaq/symbols/~3/5lwGmCQxJbo/gnc-holdings-gnc-tops-q2-earnings-misses-sales-estimates-cm823386,GNC Holdings Inc GNC reported second quarter 2017 adjusted earnings per share EPS of 41 cents reflecting a massive 48 1 year over year deterioration However the quarter s adjusted EPS surpassed the Zacks Consensus Estimate of 40 cents by a penny The year over year decline can
ALGN,ALGN:UW,BBG000BRNWJ1,Abaxis (ABAX) Misses Earnings & Revenue Estimates in Q1,2017-07-28 16:59:44 +0000,http://articlefeeds.nasdaq.com/~r/nasdaq/symbols/~3/oJeZZw7bvr0/abaxis-abax-misses-earnings-revenue-estimates-in-q1-cm823361,Abaxis Inc 160 ABAX a global provider of point of care blood analyzers reported first quarter fiscal 2018 adjusted earnings per share of 28 cents below the Zacks Consensus Estimate of 32 cents Also it was also 6 7 below the year ago figure Total Revenue In the fiscal
ALGN,ALGN:UW,BBG000BRNWJ1,"S&P 500 Movers: FLS, ALGN",2017-07-28 16:02:47 +0000,http://articlefeeds.nasdaq.com/~r/nasdaq/symbols/~3/rgUKb8bkhMk/sp-500-movers-fls-algn-cm823289,In early trading on Friday shares of Align Technology ALGN topped the list of the day s best performing components of the S amp P 500 index trading up 7 2 Year to date Align Technology registers a 75 4 gain And the worst performing S amp P 500 component thus far on the day
ALGN,ALGN:UW,BBG000BRNWJ1,UPDATE: Invisalign maker Align stocks surge 8% after earnings blow past estimates,2017-07-28 15:15:46 +0000,http://finance.yahoo.com/r/3972c990-6b13-3a1e-b374-df32ade0f3aa/Story.aspx?guid=422276DD-A7C6-49A4-BE85-D244D0B0C0BE&siteid=yhoof2&yptr=yahoo&.tsrc=rss,"Align Technology Inc. shares surged 9% Friday to lead S&P 500 gainers, after the maker of Invisalign dental braces blew past second-quarter earnings estimates. San Jose, California-based Align said late ..."
ALGN,ALGN:UW,BBG000BRNWJ1,Abaxis (ABAX) Misses Earnings & Revenue Estimates in Q1,2017-07-28 15:15:03 +0000,https://finance.yahoo.com/news/abaxis-abax-misses-earnings-revenue-151503526.html?.tsrc=rss,"Despite Abaxis&apos; lackluster performance in the fiscal first quarter, its new marketing strategies and recent launches buoy optimism."
ALGN,ALGN:UW,BBG000BRNWJ1,"GNC Holdings (GNC) Tops Q2 Earnings, Misses Sales Estimates",2017-07-28 15:04:03 +0000,https://finance.yahoo.com/news/gnc-holdings-gnc-tops-q2-150403247.html?.tsrc=rss,Sluggish performance by the U.S. & Canada international and manufacturing/wholesale segments marred second-quarter results for GNC Holdings (GNC).
ALGN,ALGN:UW,BBG000BRNWJ1,"QIAGEN (QGEN) Beats on Earnings & Sales in Q2, Raises View",2017-07-28 15:02:37 +0000,http://articlefeeds.nasdaq.com/~r/nasdaq/symbols/~3/uaIUMs9VG-I/qiagen-qgen-beats-on-earnings-sales-in-q2-raises-view-cm823313,QIAGEN 160 N V 160 QGEN reported second quarter 2017 adjusted earnings per share considering restructuring expenses as one time item of 30 cents up 25 year over year The reported figure beat the Zacks Consensus Estimate by a penny At constant exchange rate or CER the company
ALGN,ALGN:UW,BBG000BRNWJ1,Merit Medical Systems (MMSI) Worth a Look: Stock Gains 7.7%,2017-07-28 14:04:00 +0000,http://articlefeeds.nasdaq.com/~r/nasdaq/symbols/~3/JOagKriczt4/merit-medical-systems-mmsi-worth-a-look-stock-gains-77-cm823059,Merit Medical Systems Inc MMSI was a big mover last session as the company saw its shares rise almost 8 on the day The upside was driven by the company s integration of the Argon critical care business and Catheter Connections assets Also this led to far more shares changing hands than
ALGN,ALGN:UW,BBG000BRNWJ1,Align Technology (ALGN) Beats on Q2 Earnings and Revenues,2017-07-28 13:48:01 +0000,https://finance.yahoo.com/news/align-technology-algn-beats-q2-134801381.html?.tsrc=rss,Align Technology (ALGN) rides high in Q2 banking on robust growth in the Invisalign space.
ALGN,ALGN:UW,BBG000BRNWJ1,Align Technology Remains Firmly Positive After Early Rally,2017-07-28 13:16:00 +0000,http://articlefeeds.nasdaq.com/~r/nasdaq/symbols/~3/75z08faYtyY/align-technology-remains-firmly-positive-after-early-rally-20170728-00984,Align Technology Remains Firmly Positive After Early Rally
