ALGN,ALGN:UW,BBG000BRNWJ1,"ALIGN TECHNOLOGY INC Files SEC form 8-K, Entry into a Material Definitive Agreement, Creation of a Direct Financial O",2017-02-13 22:23:43 +0000,http://biz.yahoo.com/e/170213/algn8-k.html,"ALIGN TECHNOLOGY INC Files SEC form 8-K, Entry into a Material Definitive Agreement, Creation of a Direct Financial O"
ALGN,ALGN:UW,BBG000BRNWJ1,Align Technology to Speak at Upcoming Financial Conference,2017-02-13 13:30:00 +0000,http://finance.yahoo.com/news/align-technology-speak-upcoming-financial-133000351.html,"[Marketwired] - Align Technology, Inc. today announced that John Morici, chief financial officer of Align Technology is scheduled to speak at the Leerink Global Healthcare Conference. The presentation, as noted below, ..."
ALGN,ALGN:UW,BBG000BRNWJ1,"ALIGN TECHNOLOGY INC Files SEC form 8-K, Change in Directors or Principal Officers",2017-02-06 21:27:15 +0000,http://biz.yahoo.com/e/170206/algn8-k.html,"ALIGN TECHNOLOGY INC Files SEC form 8-K, Change in Directors or Principal Officers"
ALGN,ALGN:UW,BBG000BRNWJ1,Post Earnings Coverage as Align Technology's Revenue Soared 27.3%; Record $1 Billion Annual Revenue,2017-02-06 13:15:00 +0000,http://finance.yahoo.com/news/post-earnings-coverage-align-technologys-131500418.html,"[Accesswire] - Upcoming AWS Coverage on Masimo LONDON, UK / ACCESSWIRE / February 6, 2017 / Active Wall St. announces its post-earnings coverage on Align Technology, Inc. (NASDAQ: ALGN ). The Company posted its fourth ..."
ALGN,ALGN:UW,BBG000BRNWJ1,"ETFs with exposure to Align Technology, Inc. : February 3, 2017",2017-02-03 15:22:58 +0000,http://www.capitalcube.com/blog/index.php/etfs-with-exposure-to-align-technology-inc-february-3-2017/,"ETFs with exposure to Align Technology, Inc. : February 3, 2017"
ALGN,ALGN:UW,BBG000BRNWJ1,"Align Technology, Inc. :ALGN-US: Earnings Analysis: 2016 By the Numbers : February 2, 2017",2017-02-02 16:00:42 +0000,http://www.capitalcube.com/blog/index.php/align-technology-inc-algn-us-earnings-analysis-2016-by-the-numbers-february-2-2017/,"Align Technology, Inc. :ALGN-US: Earnings Analysis: 2016 By the Numbers : February 2, 2017"
ALGN,ALGN:UW,BBG000BRNWJ1,"Align Technology, Inc. :ALGN-US: Earnings Analysis: Q4, 2016 By the Numbers : February 2, 2017",2017-02-02 14:54:41 +0000,http://www.capitalcube.com/blog/index.php/align-technology-inc-algn-us-earnings-analysis-q4-2016-by-the-numbers-february-2-2017/,"Align Technology, Inc. :ALGN-US: Earnings Analysis: Q4, 2016 By the Numbers : February 2, 2017"
ALGN,ALGN:UW,BBG000BRNWJ1,"Align Technology, Inc. breached its 50 day moving average in a Bullish Manner : ALGN-US : February 2, 2017",2017-02-02 12:26:13 +0000,http://www.capitalcube.com/blog/index.php/align-technology-inc-breached-its-50-day-moving-average-in-a-bullish-manner-algn-us-february-2-2017/,"Align Technology, Inc. breached its 50 day moving average in a Bullish Manner : ALGN-US : February 2, 2017"
ALGN,ALGN:UW,BBG000BRNWJ1,Align Technology (ALGN) Q4 Earnings and Revenues in Line,2017-02-01 15:36:32 +0000,http://articlefeeds.nasdaq.com/~r/nasdaq/symbols/~3/4lIHY6G5fGA/align-technology-algn-q4-earnings-and-revenues-in-line-cm741503,Adjusting for 8 cents of foreign currency translation related impact Align Technology Inc ALGN reported adjusted earnings of 67 cents per share in the fourth quarter of 2016 up 11 6 from 60 cents in the year ago quarter Earnings were at the upper end of the company s guided range of 64
ALGN,ALGN:UW,BBG000BRNWJ1,Align Technology (ALGN) Q4 Earnings and Revenues in Line,2017-02-01 13:33:01 +0000,http://finance.yahoo.com/news/align-technology-algn-q4-earnings-133301624.html,Align Technology (ALGN) Q4 Earnings and Revenues in Line
ALGN,ALGN:UW,BBG000BRNWJ1,Align Technology Inc. Reports Record Revenue in Q4,2017-02-01 00:31:29 +0000,http://articlefeeds.nasdaq.com/~r/nasdaq/symbols/~3/QhyO5rWdTUA/align-technology-inc-reports-record-revenue-in-q4-cm741213,Align Technology NASDAQ ALGN 160 shareholders had plenty of reasons to be happy in 2016 The orthodontic device maker s 160 stock soared nearly 50 last year Align easily surpassed earnings expectations in the first three quarters of 2016 The company announced its fourth
ALGN,ALGN:UW,BBG000BRNWJ1,Align Technology Inc. Reports Record Revenue in Q4,2017-01-31 23:29:21 +0000,http://www.fool.com/investing/2017/01/31/align-technology-inc-reports-record-revenue-in-q4.aspx?source=yahoo-2&utm_campaign=article&utm_medium=feed&utm_source=yahoo-2,Align Technology Inc. Reports Record Revenue in Q4
ALGN,ALGN:UW,BBG000BRNWJ1,Align Technology meets 4Q profit forecasts,2017-01-31 21:24:46 +0000,http://sg.finance.yahoo.com/news/align-technology-meets-4q-profit-212446724.html,Align Technology meets 4Q profit forecasts
ALGN,ALGN:UW,BBG000BRNWJ1,Align Technology Files Patent Infringement Lawsuit Against ClearCorrect and Your Smile Direct in United Kingdom,2017-01-31 21:00:00 +0000,http://finance.yahoo.com/news/align-technology-files-patent-infringement-210000995.html,"[Marketwired] - Align Technology, Inc. today announced that it has filed a lawsuit against ClearCorrect Holdings, Inc., and ClearCorrect Operating, LLC and Your Smile Direct LTD of Dublin, Ireland for..."
ALGN,ALGN:UW,BBG000BRNWJ1,Align Technology Announces Fourth Quarter and Year Ended 2016 Results,2017-01-31 21:00:00 +0000,http://finance.yahoo.com/news/align-technology-announces-fourth-quarter-210000222.html,"[Marketwired] - Align Technology, Inc. Record 2016 revenues of $1.1 billion, up 27.7% year-over-year, and diluted EPS of $2.332016 Invisalign case shipments of 708.5 thousand cases, up 21.5% year-over-yearQ4 revenues ..."
ALGN,ALGN:UW,BBG000BRNWJ1,"Earnings Reaction History: Align Technology, Inc., 71.4% Follow-Through Indicator, 5.6% Sensitive",2017-01-31 19:51:29 +0000,http://articlefeeds.nasdaq.com/~r/nasdaq/symbols/~3/vKQ3YjHD3UE/earnings-reaction-history-align-technology-inc-714-follow-through-indicator-56-sensitive-cm741095,Expected Earnings Release 01 31 2017 After hoursExpected Earnings Release 01 31 2017 After hours Avg Extended Hours Dollar Volume 5 491 289Avg Extended Hours Dollar Volume 5 491 289 Align Technology Inc ALGN is due to issue its quarterly earnings report in the
ALGN,ALGN:UW,BBG000BRNWJ1,Q4 2016 Align Technology Inc Earnings Release - 4:00 pm ET,2017-01-31 12:07:07 +0000,http://biz.yahoo.com/research/earncal/20170131.html?t=algn,Q4 2016 Align Technology Inc Earnings Release - 4:00 pm ET
ALGN,ALGN:UW,BBG000BRNWJ1,"Notable Friday Option Activity: AXON, ATSG, ALGN",2017-01-27 21:33:07 +0000,http://articlefeeds.nasdaq.com/~r/nasdaq/symbols/~3/3bcoYtHlIeI/notable-friday-option-activity-axon-atsg-algn-cm739612,Among the underlying components of the Russell 3000 index we saw noteworthy options trading volume today in Axovant Sciences Ltd Symbol AXON where a total of 2 074 contracts have traded so far representing approximately 207 400 underlying shares That amounts to about 99 4 of AXON
ALGN,ALGN:UW,BBG000BRNWJ1,"Magee Thomson Investment Partners Llc Buys Charles Schwab Corp, Zions Bancorp, Flex Ltd, Sells ...",2017-01-26 15:30:33 +0000,http://articlefeeds.nasdaq.com/~r/nasdaq/symbols/~3/HCHI1ydO12A/magee-thomson-investment-partners-llc-buys-charles-schwab-corp-zions-bancorp-flex-ltd-sells-cm738659,Magee Thomson Investment Partners Llc Charles Schwab New Purchases SCHW ZION FLEX FANG ANET FLXN EMES REI QTNA NPTN Added Positions GKOS VMC MSFT AMOT USCR TRVN TIS SUPN SQNS RDHL Reduced Positions AYI AMZN NOW FB MTSI MBLY
ALGN,ALGN:UW,BBG000BRNWJ1,"Noteworthy Thursday Option Activity: ALGN, EL, CSCO",2017-01-19 22:37:44 +0000,http://articlefeeds.nasdaq.com/~r/nasdaq/symbols/~3/ARXyfiKiLEk/noteworthy-thursday-option-activity-algn-el-csco-cm735697,Looking at options trading activity among components of the Russell 3000 index there is noteworthy activity today in Align Technology Inc Symbol ALGN where a total volume of 2 687 contracts has been traded thus far today a contract volume which is representative of approximately 268
ALGN,ALGN:UW,BBG000BRNWJ1,Align Poised On Global Expansion & Invisalign Teen Growth,2017-01-11 13:52:52 +0000,http://articlefeeds.nasdaq.com/~r/nasdaq/symbols/~3/A08HafuX1mE/align-poised-on-global-expansion-invisalign-teen-growth-cm732040,On Jan 10 2017 we issued an updated research report on California based Align Technology Inc ALGN a developer of aligner therapy intra oral scanners and CAD CAM computer aided design and computer aided manufacturing digital services Over the past six months Align broadly
ALGN,ALGN:UW,BBG000BRNWJ1,Align Poised On Global Expansion & Invisalign Teen Growth,2017-01-11 12:13:12 +0000,http://finance.yahoo.com/news/align-poised-global-expansion-invisalign-121312168.html,Align Poised On Global Expansion & Invisalign Teen Growth
ALGN,ALGN:UW,BBG000BRNWJ1,"Align Technology, Inc. – Value Analysis (NASDAQ:ALGN) : January 10, 2017",2017-01-10 15:28:06 +0000,http://www.capitalcube.com/blog/index.php/align-technology-inc-value-analysis-nasdaqalgn-january-10-2017/,"Align Technology, Inc. – Value Analysis (NASDAQ:ALGN) : January 10, 2017"
ALGN,ALGN:UW,BBG000BRNWJ1,Illumina (ILMN) Launches NovaSeq Series for $100 Genome,2017-01-10 14:55:59 +0000,http://articlefeeds.nasdaq.com/~r/nasdaq/symbols/~3/wFQo8r60y_E/illumina-ilmn-launches-novaseq-series-for-100-genome-cm731461,Illumina Inc ILMN a global provider of next generation sequencing NGS technology recently unveiled the NovaSeq Series a scalable sequencing solution expected to enable a 100 genome This set of research platform redefines high throughput sequencing easy use low per sample costs
ALGN,ALGN:UW,BBG000BRNWJ1,"QIAGEN (QGEN) Buys OmicSoft, Expands Bioinformatics Suite",2017-01-10 13:51:23 +0000,http://articlefeeds.nasdaq.com/~r/nasdaq/symbols/~3/lWHV3uSWZtY/qiagen-qgen-buys-omicsoft-expands-bioinformatics-suite-cm731478,Global assay technologies major QIAGEN N V QGEN recently announced the acquisition of Cary NC based OmicSoft Corporation The deal will provide QIAGEN access to OmicSoft s powerful multi omics data management infrastructure solutions as well as omics data bank The deal will also
ALGN,ALGN:UW,BBG000BRNWJ1,Illumina (ILMN) Launches NovaSeq Series for $100 Genome,2017-01-10 12:58:12 +0000,http://finance.yahoo.com/news/illumina-ilmn-launches-novaseq-series-125812778.html,Illumina (ILMN) Launches NovaSeq Series for $100 Genome
ALGN,ALGN:UW,BBG000BRNWJ1,"QIAGEN (QGEN) Buys OmicSoft, Expands Bioinformatics Suite",2017-01-10 12:26:12 +0000,http://finance.yahoo.com/news/qiagen-qgen-buys-omicsoft-expands-122612867.html,"QIAGEN (QGEN) Buys OmicSoft, Expands Bioinformatics Suite"
ALGN,ALGN:UW,BBG000BRNWJ1,Align Technology Appoints Lynn Pendergrass to Newly Created Role of Vice President of the Americas Region,2017-01-09 22:00:00 +0000,http://finance.yahoo.com/news/align-technology-appoints-lynn-pendergrass-220000101.html,"[Marketwired] - Align Technology, Inc. today announced that Lynn Pendergrass will join the company on February 27, 2017 in the newly created position of vice president and managing director of the Americas region, reporting ..."
ALGN,ALGN:UW,BBG000BRNWJ1,LLabCorp: Reimbursement Scenario a Drag Amid Other Woes,2017-01-09 15:53:58 +0000,http://articlefeeds.nasdaq.com/~r/nasdaq/symbols/~3/xi6ZqlnO2p0/llabcorp-reimbursement-scenario-a-drag-amid-other-woes-cm730991,On Jan 09 we issued an updated research report on Burlington NC based Laboratory Corporation of America Holdings LH or LabCorp The company is a major player in the healthcare diagnostics space providing comprehensive clinical laboratory services and end to end drug development
ALGN,ALGN:UW,BBG000BRNWJ1,ResMed and Dr. Oz Form SleepScore Labs for Sleep Disorders,2017-01-09 14:53:54 +0000,http://articlefeeds.nasdaq.com/~r/nasdaq/symbols/~3/iQqOqpQX5Hs/resmed-and-dr-oz-form-sleepscore-labs-for-sleep-disorders-cm730925,ResMed Inc RMD a global manufacturer of medical devices recently formed a joint venture with renowned surgeon and television host Dr Mehmet Oz and private equity firm Pegasus Capital Advisors L P The alliance resulted in the formation of SleepScore Labs which is mainly focused
ALGN,ALGN:UW,BBG000BRNWJ1,LLabCorp: Reimbursement Scenario a Drag Amid Other Woes,2017-01-09 13:49:01 +0000,http://finance.yahoo.com/news/llabcorp-reimbursement-scenario-drag-amid-134901064.html,LLabCorp: Reimbursement Scenario a Drag Amid Other Woes
ALGN,ALGN:UW,BBG000BRNWJ1,"Align Technology, Inc. breached its 50 day moving average in a Bearish Manner : ALGN-US : January 9, 2017",2017-01-09 13:06:12 +0000,http://www.capitalcube.com/blog/index.php/align-technology-inc-breached-its-50-day-moving-average-in-a-bearish-manner-algn-us-january-9-2017/,"Align Technology, Inc. breached its 50 day moving average in a Bearish Manner : ALGN-US : January 9, 2017"
ALGN,ALGN:UW,BBG000BRNWJ1,ResMed and Dr. Oz Form SleepScore Labs for Sleep Disorders,2017-01-09 12:30:12 +0000,http://finance.yahoo.com/news/resmed-dr-oz-form-sleepscore-123012299.html,"[Zacks] - ResMed Inc. (RMD) recently formed a joint venture with renowned surgeon and television host Dr. Mehmet Oz and private equity firm Pegasus Capital Advisors, L.P."
ALGN,ALGN:UW,BBG000BRNWJ1,Myriad Genetics: Evidence Street Reviews EndoPredict Test,2017-01-06 14:40:53 +0000,http://articlefeeds.nasdaq.com/~r/nasdaq/symbols/~3/NAH1keVCtHI/myriad-genetics-evidence-street-reviews-endopredict-test-cm730235,Myriad Genetics Inc MYGN a leading molecular diagnostics and personalized medicine company recently announced that Blue Cross Blue Shield Association s technical assessment provider Evidence Street has reviewed its EndoPredict assay It is Myriad Genetics second generation multi gene
ALGN,ALGN:UW,BBG000BRNWJ1,Myriad Genetics: Evidence Street Reviews EndoPredict Test,2017-01-06 12:57:12 +0000,http://finance.yahoo.com/news/myriad-genetics-evidence-street-reviews-125712897.html,Myriad Genetics: Evidence Street Reviews EndoPredict Test
ALGN,ALGN:UW,BBG000BRNWJ1,"Walgreens Boots (WBA) Beats Q1 Earnings, Trims EPS View",2017-01-05 17:38:22 +0000,http://articlefeeds.nasdaq.com/~r/nasdaq/symbols/~3/QCaJ449FYY8/walgreens-boots-wba-beats-q1-earnings-trims-eps-view-cm729863,Walgreens Boots Alliance Inc WBA reported adjusted earnings per share EPS of 1 10 in first quarter fiscal 2017 up 6 8 from the year ago quarter Adjusted EPS also beat the Zacks Consensus Estimate slightly by 0 9 On a reported basis net earnings came in at 1 05 billion a decrease
ALGN,ALGN:UW,BBG000BRNWJ1,"Walgreens Boots (WBA) Beats Q1 Earnings, Trims EPS View",2017-01-05 15:23:03 +0000,http://finance.yahoo.com/news/walgreens-boots-wba-beats-q1-152303381.html,"Walgreens Boots (WBA) Beats Q1 Earnings, Trims EPS View"
ALGN,ALGN:UW,BBG000BRNWJ1,ResMed Achieves Key Milestone in Sleep-Disordered Breathing,2017-01-05 13:39:41 +0000,http://articlefeeds.nasdaq.com/~r/nasdaq/symbols/~3/udb_9aH5PuM/resmed-achieves-key-milestone-in-sleep-disordered-breathing-cm729644,While remote patient monitoring market is growing fast to become a 30 billion industry by 2020 tech analyst firm Berg Insight s data renowned sleep disordered breathing SDB company ResMed Inc RMD recently achieved a significant milestone in this respect After one billion nights of
ALGN,ALGN:UW,BBG000BRNWJ1,"Bruker Buys SCiLS, Expands in Mass Spectrometry Imaging",2017-01-05 13:39:38 +0000,http://articlefeeds.nasdaq.com/~r/nasdaq/symbols/~3/MzphpatRgoI/bruker-buys-scils-expands-in-mass-spectrometry-imaging-cm729643,Bruker Corporation BRKR a major player in the field of life science materials research systems and associated products has recently announced the acquisition of Bremen Germany based software solutions developer SCiLS GmbH Financial terms of the deal have been kept under wraps We
ALGN,ALGN:UW,BBG000BRNWJ1,"Bruker Buys InVivo Biotech, Boosts MALDI Biotyper Suite",2017-01-05 13:39:25 +0000,http://articlefeeds.nasdaq.com/~r/nasdaq/symbols/~3/fQuR56WYCzY/bruker-buys-invivo-biotech-boosts-maldi-biotyper-suite-cm729686,Bruker Corporation BRKR a renowned name in the field of proprietary life science and materials research systems recently announced the buyout of InVivo Biotech Services GmbH This Hennigsdorf Germany based company is a molecular biology contract manufacturing organization CMO and a
ALGN,ALGN:UW,BBG000BRNWJ1,"Bruker Buys InVivo Biotech, Boosts MALDI Biotyper Suite",2017-01-05 12:07:12 +0000,http://finance.yahoo.com/news/bruker-buys-invivo-biotech-boosts-120712123.html,"Bruker Buys InVivo Biotech, Boosts MALDI Biotyper Suite"
ALGN,ALGN:UW,BBG000BRNWJ1,"Bruker Buys SCiLS, Expands in Mass Spectrometry Imaging",2017-01-05 11:56:11 +0000,http://finance.yahoo.com/news/bruker-buys-scils-expands-mass-115611813.html,"Bruker Buys SCiLS, Expands in Mass Spectrometry Imaging"
ALGN,ALGN:UW,BBG000BRNWJ1,ResMed Achieves Key Milestone in Sleep-Disordered Breathing,2017-01-05 11:52:11 +0000,http://finance.yahoo.com/news/resmed-achieves-key-milestone-sleep-115211811.html,"[Zacks] - After one billion nights of sleep data was downloaded using ResMed's remote patient monitoring platform AirView, the company reached a landmark in the field of sleep research and treatment of sleep apnea."
ALGN,ALGN:UW,BBG000BRNWJ1,Hologic (HOLX) Receives PMA for Aptima HIV-1 Quant Assay,2017-01-04 15:41:40 +0000,http://articlefeeds.nasdaq.com/~r/nasdaq/symbols/~3/cwHC3-qtyfg/hologic-holx-receives-pma-for-aptima-hiv-1-quant-assay-cm729204,Diagnostic instruments major Hologic Inc HOLX recently announced the receipt of the FDA s Premarket Approval PMA for its Aptima HIV 1 Quant assay This viral load monitoring assay falls under the company s Diagnostic Solutions division It is a nucleic acid amplification test for
ALGN,ALGN:UW,BBG000BRNWJ1,Hologic (HOLX) Receives PMA for Aptima HIV-1 Quant Assay,2017-01-04 13:39:01 +0000,http://finance.yahoo.com/news/hologic-holx-receives-pma-aptima-133901772.html,Hologic (HOLX) Receives PMA for Aptima HIV-1 Quant Assay
ALGN,ALGN:UW,BBG000BRNWJ1,IDEXX Laboratories (IDXX) Set to Join the S&P 500 Index,2017-01-04 13:38:15 +0000,http://articlefeeds.nasdaq.com/~r/nasdaq/symbols/~3/c-FdUm9XMPQ/idexx-laboratories-idxx-set-to-join-the-sp-500-index-cm729125,Delaware NJ based IDEXX Laboratories Inc IDXX is scheduled to join the coveted S amp P 500 benchmark after the market closes on Jan 4 This developer manufacturer and distributer of products and services primarily for the companion animal veterinary livestock and poultry water
ALGN,ALGN:UW,BBG000BRNWJ1,Illumina Fettered With Losses: Can It Bounce Back in 2017?,2017-01-03 15:02:15 +0000,http://articlefeeds.nasdaq.com/~r/nasdaq/symbols/~3/UKLFDPDBDxg/illumina-fettered-with-losses-can-it-bounce-back-in-2017-cm728496,Investors are constantly on the lookout for newer strategies to rake in market beating returns One easy way to gauge where the stock is headed in 2017 is to go through its performance in relation to the peer group or industry in the year gone by However the below par performance by the stocks
ALGN,ALGN:UW,BBG000BRNWJ1,"Align Technology to Announce Fourth Quarter and Fiscal Year 2016 Results on January 31, 2017",2017-01-03 14:13:08 +0000,http://www.publicnow.com/view/BE5812E18C1AD46BCBC6215F1083F8232C80704E,"[at noodls] - SAN JOSE, CA -- (Marketwired) -- 01/03/17 -- Align Technology, Inc.(NASDAQ: ALGN)announced today that the Company will report fourth quarter and fiscal year 2016 financial results on Tuesday, January 31, ..."
ALGN,ALGN:UW,BBG000BRNWJ1,Masimo to Launch Advanced Monitoring Technologies in India,2017-01-03 13:58:39 +0000,http://articlefeeds.nasdaq.com/~r/nasdaq/symbols/~3/itSerpgeioA/masimo-to-launch-advanced-monitoring-technologies-in-india-cm728510,Irvine CA based Masimo MASI announced that it will launch Advanced Monitoring Technologies in the Indian market The company has decided to introduce its proprietary Rad 97 Pulse CO Oximeter and Next Generation SedLine Brain Function Monitoring in India Masimo rallied 71 98 over the
ALGN,ALGN:UW,BBG000BRNWJ1,"Align Technology to Announce Fourth Quarter and Fiscal Year 2016 Results on January 31, 2017",2017-01-03 13:30:00 +0000,http://finance.yahoo.com/news/align-technology-announce-fourth-quarter-133000990.html,"[Marketwired] - Align Technology, Inc. announced today that the Company will report fourth quarter and fiscal year 2016 financial results on Tuesday, January 31, 2017 after the close of market. Financial results will ..."
ALGN,ALGN:UW,BBG000BRNWJ1,Illumina Fettered With Losses: Can It Bounce Back in 2017?,2017-01-03 13:02:01 +0000,http://finance.yahoo.com/news/illumina-fettered-losses-bounce-back-130201572.html,Illumina Fettered With Losses: Can It Bounce Back in 2017?
ALGN,ALGN:UW,BBG000BRNWJ1,Masimo to Launch Advanced Monitoring Technologies in India,2017-01-03 12:31:12 +0000,http://finance.yahoo.com/news/masimo-launch-advanced-monitoring-technologies-123112960.html,Masimo to Launch Advanced Monitoring Technologies in India
ALGN,ALGN:UW,BBG000BRNWJ1,OPKO Health (OPK) Reports Failure in hGH-CTP Phase 3,2017-01-02 15:58:16 +0000,http://articlefeeds.nasdaq.com/~r/nasdaq/symbols/~3/uN9EeRgX0_g/opko-health-opk-reports-failure-in-hgh-ctp-phase-3-cm728370,Diversified healthcare company OPKO Health Inc OPK announced failure in its data analysis of the Phase 3 Clinical Study of hGH CTP in Growth Hormone Deficient Adults The study of hGH CTP in adults with growth hormone deficiency demonstrated no statistical difference versus placebo In
ALGN,ALGN:UW,BBG000BRNWJ1,Abaxis (ABAX) Veterinary Prospects Bright: Should You Hold?,2017-01-02 14:58:10 +0000,http://articlefeeds.nasdaq.com/~r/nasdaq/symbols/~3/XPekTfN9fRg/abaxis-abax-veterinary-prospects-bright-should-you-hold-cm728334,On Jan 2 2017 Abaxis Inc ABAX a leading manufacturer of portable medical and veterinary blood analysis systems was upgraded to a Zacks Rank 3 Hold Why the Upgrade We believe the upgrade was primarily driven by Abaxis rising share price in the last six months The
ALGN,ALGN:UW,BBG000BRNWJ1,OPKO Health (OPK) Reports Failure in hGH-CTP Phase 3,2017-01-02 13:23:01 +0000,http://finance.yahoo.com/news/opko-health-opk-reports-failure-132301719.html,OPKO Health (OPK) Reports Failure in hGH-CTP Phase 3
ALGN,ALGN:UW,BBG000BRNWJ1,Abaxis (ABAX) Veterinary Prospects Bright: Should You Hold?,2017-01-02 12:53:12 +0000,http://finance.yahoo.com/news/abaxis-abax-veterinary-prospects-bright-125312734.html,Abaxis (ABAX) Veterinary Prospects Bright: Should You Hold?
ALGN,ALGN:UW,BBG000BRNWJ1,Is Baxter Poised to Counter Low Cyclophosphamide Sales?,2016-12-30 17:01:09 +0000,http://articlefeeds.nasdaq.com/~r/nasdaq/symbols/~3/TSwRSMqgIw4/is-baxter-poised-to-counter-low-cyclophosphamide-sales-cm727964,On Dec 30 we issued an updated research report on Deerfield IL based Baxter International Inc BAX a global medical technology company and leading provider of renal and hospital products Over the past six months Baxter outperformed the broader market in terms of price
ALGN,ALGN:UW,BBG000BRNWJ1,CryoLife (CRY) Now a Strong Buy on Solid Estimate Revisions,2016-12-30 16:02:56 +0000,http://articlefeeds.nasdaq.com/~r/nasdaq/symbols/~3/4A9BN9Nmt7U/cryolife-cry-now-a-strong-buy-on-solid-estimate-revisions-cm727856,On Dec 27 CryoLife Inc CRY was upgraded to a Zacks Rank 1 Strong Buy Headquartered in Kennesaw GA the company manufactures and distributes medical devices worldwide Why the Upgrade The stock represents a stellar year to date gain of almost 79 5 way better than the
ALGN,ALGN:UW,BBG000BRNWJ1,NuVasive (NUVA) Wins MHLW Approval for XLIF Device Suite,2016-12-30 15:01:56 +0000,http://articlefeeds.nasdaq.com/~r/nasdaq/symbols/~3/bOWPcIvD2U0/nuvasive-nuva-wins-mhlw-approval-for-xlif-device-suite-cm727905,Leading medical device company NuVasive Inc NUVA recently announced the receipt of approval from the Japanese Ministry of Health Labour and Welfare MHLW for instruments used in the eXtreme Lateral Interbody Fusion XLIF procedure These devices fall under the company s global
ALGN,ALGN:UW,BBG000BRNWJ1,Alere (ALR) Appeals to Reinstate Medicare Billing Privilege,2016-12-30 15:01:51 +0000,http://articlefeeds.nasdaq.com/~r/nasdaq/symbols/~3/ivSHV4f7EaA/alere-alr-appeals-to-reinstate-medicare-billing-privilege-cm727903,Waltham MA based Alere Inc ALR a leading player in rapid diagnostic tests announced that it has recently appealed to the Administrative Law Judge at the Centers for Medicare amp Medicaid Services for reinstatement of Medicare billing privilege For the last six months the
ALGN,ALGN:UW,BBG000BRNWJ1,Is Baxter Poised to Counter Low Cyclophosphamide Sales?,2016-12-30 14:34:02 +0000,http://finance.yahoo.com/news/baxter-poised-counter-low-cyclophosphamide-143402008.html,Is Baxter Poised to Counter Low Cyclophosphamide Sales?
ALGN,ALGN:UW,BBG000BRNWJ1,CryoLife (CRY) Now a Strong Buy on Solid Estimate Revisions,2016-12-30 13:54:01 +0000,http://finance.yahoo.com/news/cryolife-cry-now-strong-buy-135401370.html,CryoLife (CRY) Now a Strong Buy on Solid Estimate Revisions
ALGN,ALGN:UW,BBG000BRNWJ1,Alere (ALR) Appeals to Reinstate Medicare Billing Privilege,2016-12-30 13:30:01 +0000,http://finance.yahoo.com/news/alere-alr-appeals-reinstate-medicare-133001608.html,Alere (ALR) Appeals to Reinstate Medicare Billing Privilege
ALGN,ALGN:UW,BBG000BRNWJ1,NuVasive (NUVA) Wins MHLW Approval for XLIF Device Suite,2016-12-30 13:28:01 +0000,http://finance.yahoo.com/news/nuvasive-nuva-wins-mhlw-approval-132801422.html,NuVasive (NUVA) Wins MHLW Approval for XLIF Device Suite
ALGN,ALGN:UW,BBG000BRNWJ1,Nutrisystem Declares Multi-Brand Marketing Approach for '17,2016-12-29 13:59:46 +0000,http://articlefeeds.nasdaq.com/~r/nasdaq/symbols/~3/8BQTks0y4JQ/nutrisystem-declares-multi-brand-marketing-approach-for-17-cm727273,Weight management products and service provider Nutrisystem Inc NTRI announced that it will focus on a multi brand marketing approach with two new distinct programs Nutrisystem Lean13 and the South Beach Diet in 2017 A glimpse at the stock price movement reveals a solid trend
