ALGN,ALGN:UW,BBG000BRNWJ1,Bio-Rad (BIO) Scores a Strong Buy Right Now: Here&apos;s How,2017-06-22 13:49:01 +0000,https://finance.yahoo.com/news/bio-rad-bio-scores-strong-134901829.html?.tsrc=rss,"Bio-Rad Laboratories, Inc. (BIO) has rallied 12.9% over the last three months, ahead of the S&P 500&apos;s 4.3% gain."
ALGN,ALGN:UW,BBG000BRNWJ1,Why Investors Should Buy Edwards Lifesciences (EW) Right Now,2017-06-22 13:45:01 +0000,https://finance.yahoo.com/news/why-investors-buy-edwards-lifesciences-134501072.html?.tsrc=rss,Leading CA-based medical equipment major Edwards Lifesciences Corporation (EW) is currently on a healthy growth trajectory.
ALGN,ALGN:UW,BBG000BRNWJ1,Why Quest Diagnostics (DGX) is a Suitable Pick for Investors,2017-06-22 13:45:01 +0000,https://finance.yahoo.com/news/why-quest-diagnostics-dgx-suitable-134501584.html?.tsrc=rss,"Madison, NJ-based Quest Diagnostics, Inc. (DGX), a provider of commercial laboratory services, has been on a growth trajectory of late."
ALGN,ALGN:UW,BBG000BRNWJ1,Baxter (BAX) Scales 52-Week High: What&apos;s Behind the Rally,2017-06-22 13:04:01 +0000,https://finance.yahoo.com/news/baxter-bax-scales-52-week-130401692.html?.tsrc=rss,"Baxter International Inc. (BAX) scaled a new 52-week high of $60.47 on Jun 21, closing a bit lower at $60.05."
ALGN,ALGN:UW,BBG000BRNWJ1,Teladoc (TDOC) to Raise Debt for Best Doctors Acquisition,2017-06-21 15:25:01 +0000,http://articlefeeds.nasdaq.com/~r/nasdaq/symbols/~3/MbXKFW0YwzQ/teladoc-tdoc-to-raise-debt-for-best-doctors-acquisition-cm806186,Teladoc 160 Inc 160 TDOC announced recently that it would offer senior notes worth 200 million with the year of maturity fixed as 2022 160 The company also expects to provide the initial purchaser an option to buy up to an additional 30 million aggregate principal amount of notes
ALGN,ALGN:UW,BBG000BRNWJ1,Why Investors Should Retain Molina Healthcare (MOH) Stock,2017-06-21 15:24:38 +0000,http://articlefeeds.nasdaq.com/~r/nasdaq/symbols/~3/rP_1_D3K5Jo/why-investors-should-retain-molina-healthcare-moh-stock-cm806180,Molina Healthcare Inc s MOH consistent operating performance is backed by its steady increase in premiums and service revenues effective inorganic growth initiatives and solid fundamentals Well reflective of the tailwinds year to date shares of Molina Healthcare gained 28
ALGN,ALGN:UW,BBG000BRNWJ1,"GNC Holdings Continues to Gain from New GNC, Global Revenue",2017-06-21 15:18:03 +0000,https://finance.yahoo.com/news/gnc-holdings-continues-gain-gnc-151803282.html?.tsrc=rss,"On Jun 20 2017, we issued an updated research report on Pittsburgh, PA-based GNC Holdings, Inc. (GNC)."
ALGN,ALGN:UW,BBG000BRNWJ1,"Invisalign® Brand Teams Up With Superstar Athletes Gabrielle Reece, Laird Hamilton, And Their Daughter Reece To Inspire Others To Focus On Achieving Their Personal Goals And Wellbeing",2017-06-21 14:47:00 +0000,https://finance.yahoo.com/news/invisalign-brand-teams-superstar-athletes-144700510.html?.tsrc=rss,"SAN JOSE, Calif., June 21, 2017 /PRNewswire/ -- Align Technology, Inc. (ALGN) today announced its Invisalign® brand has teamed up with volleyball champion Gabrielle (Gabby) Reece, surf legend Laird Hamilton and their active teenage daughter Reece, to talk about the benefits of Invisalign treatment.  This iconic family in the world of health and wellness began their orthodontic treatment with Invisalign clear aligners in May 2017 and will share their first-hand experience as Invisalign brand ambassadors."
ALGN,ALGN:UW,BBG000BRNWJ1,Hologic (HOLX) Gets FDA Clearance for Aptima HSV 1 & 2 Test,2017-06-21 14:25:55 +0000,http://articlefeeds.nasdaq.com/~r/nasdaq/symbols/~3/y8nwerWkTOk/hologic-holx-gets-fda-clearance-for-aptima-hsv-1-2-test-cm806101,Leading diagnostics player Hologic Inc HOLX recently received FDA approval for the commercial launch of the Aptima Herpes Simplex Virus HSV 1 amp 2 molecular assay on the fully automated Panther system The test can now be used to detect and differentiate between HSV 1 and HSV 2
ALGN,ALGN:UW,BBG000BRNWJ1,PerkinElmer (PKI) to Acquire German Firm EUROIMMUN for $1.3B,2017-06-21 13:46:01 +0000,https://finance.yahoo.com/news/perkinelmer-pki-acquire-german-firm-134601498.html?.tsrc=rss,PerkinElmer Inc. (PKI) recently announced that it will acquire EUROIMMUN Medical Laboratory Diagnostics AG for approximately $1.3 billion in cash.
ALGN,ALGN:UW,BBG000BRNWJ1,PAREXEL Announces Acquisition by Pamplona Capital for $5B,2017-06-21 13:43:01 +0000,https://finance.yahoo.com/news/parexel-announces-acquisition-pamplona-capital-134301120.html?.tsrc=rss,"PAREXEL International Corporation (PRXL) recently announced that it has agreed to be acquired by Pamplona Capital Management, LLP."
ALGN,ALGN:UW,BBG000BRNWJ1,"Medtronic CRT Devices Improve Therapy Delivery, Cut Costs",2017-06-21 12:50:12 +0000,https://finance.yahoo.com/news/medtronic-crt-devices-improve-therapy-125012240.html?.tsrc=rss,Medtronic plc (MDT) recently announced positive data on cardiac resynchronization therapy (CRT) devices within its Cardiac and Vascular segment.
ALGN,ALGN:UW,BBG000BRNWJ1,Hologic (HOLX) Gets FDA Clearance for Aptima HSV 1 & 2 Test,2017-06-21 12:47:12 +0000,https://finance.yahoo.com/news/hologic-holx-gets-fda-clearance-124712873.html?.tsrc=rss,"Hologic, Inc. (HOLX) recently received FDA approval for the commercial launch of the Aptima Herpes Simplex Virus (HSV) 1 & 2 molecular assay on the fully automated Panther system."
ALGN,ALGN:UW,BBG000BRNWJ1,"Genomic Health Cancer Tests Strong, Operating Expenses a Woe",2017-06-21 12:29:12 +0000,https://finance.yahoo.com/news/genomic-health-cancer-tests-strong-122912554.html?.tsrc=rss,"On Jun 19, we issued an updated research report on Redwood City, CA-based Genomic Health Inc (GHDX), a global cancer research company with a focus on advanced molecular diagnostics."
ALGN,ALGN:UW,BBG000BRNWJ1,"Align Technology (ALGN) Enters the S&P 500 Index, Stock Up",2017-06-20 16:25:40 +0000,http://articlefeeds.nasdaq.com/~r/nasdaq/symbols/~3/pkBgRCzBl0s/align-technology-algn-enters-the-sp-500-index-stock-up-cm805736,Align Technology Inc ALGN the California based dental major has joined the coveted S amp P 500 benchmark after the market closed on Jun 16 This clear aligner therapy intra oral scanners and CAD CAM computer aided design and computer aided manufacturing digital services maker was
ALGN,ALGN:UW,BBG000BRNWJ1,"Teladoc (TDOC) to Buy Best Doctors, Stock Hits New High",2017-06-20 16:24:30 +0000,http://articlefeeds.nasdaq.com/~r/nasdaq/symbols/~3/7KG32cESg0A/teladoc-tdoc-to-buy-best-doctors-stock-hits-new-high-cm805713,Teladoc Inc TDOC a premier telehealth services provider has inked a definitive agreement to acquire Best Doctors a leader in medical consultation Teladoc has picked up Best Doctors given its wide network of more than 500 000 world renowned experts spanning 450 medical specialties
ALGN,ALGN:UW,BBG000BRNWJ1,ResMed (RMD) at 52-Week High: What's Driving the Stock?,2017-06-20 15:26:22 +0000,http://articlefeeds.nasdaq.com/~r/nasdaq/symbols/~3/QzRyokcm3Qk/resmed-rmd-at-52-week-high-whats-driving-the-stock-cm805604,Share price of ResMed Inc RMD scaled a new 52 week high of 79 22 on Jun 19 eventually closing a bit lower at 78 91 The company has gained 28 1 over the past six months ahead of the S amp P 500 s 7 6 gain The stock has a market cap of 11 19 billion Comparison with Broader
ALGN,ALGN:UW,BBG000BRNWJ1,Luminex (LMNX) Scores a Strong Buy Right Now: Here's How,2017-06-20 15:25:09 +0000,http://articlefeeds.nasdaq.com/~r/nasdaq/symbols/~3/kDTOABJJNK8/luminex-lmnx-scores-a-strong-buy-right-now-heres-how-cm805565,Based in Austin TX Luminex Corporation LMNX develops manufactures and markets a proprietary technology that simplifies biological testing for the life sciences industry 160 It has rallied 13 5 over the last three months ahead of the S amp P 500 s 4 1 gain and also better than the
ALGN,ALGN:UW,BBG000BRNWJ1,Interesting ALGN Put And Call Options For August 18th,2017-06-20 15:22:56 +0000,http://articlefeeds.nasdaq.com/~r/nasdaq/symbols/~3/JnbHYtgIBLM/interesting-algn-put-and-call-options-for-august-18th-cm805712,Investors in Align Technology Inc Symbol ALGN saw new options become available this week for the August 18th expiration At Stock Options Channel our YieldBoost formula has looked up and down the ALGN options chain for the new August 18th contracts and identified one put and one
ALGN,ALGN:UW,BBG000BRNWJ1,Walgreens-Greater Than AIDS Unite to Serve Against HIV/AIDS,2017-06-20 14:34:02 +0000,https://finance.yahoo.com/news/walgreens-greater-aids-unite-serve-143402227.html?.tsrc=rss,"Walgreens Boots Alliance, Inc. (WBA) recently teamed up with Greater Than AIDS, a national public information response, focused on the U.S. domestic HIV/AIDS epidemic."
ALGN,ALGN:UW,BBG000BRNWJ1,"Align Technology (ALGN) Enters the S&P 500 Index, Stock Up",2017-06-20 13:59:01 +0000,https://finance.yahoo.com/news/align-technology-algn-enters-p-135901252.html?.tsrc=rss,"Align Technology, Inc. (ALGN), the California-based dental major has joined the coveted S&P 500 benchmark, after the market closed on Jun 16."
ALGN,ALGN:UW,BBG000BRNWJ1,Luminex (LMNX) Scores a Strong Buy Right Now: Here&apos;s How,2017-06-20 13:48:01 +0000,https://finance.yahoo.com/news/luminex-lmnx-scores-strong-buy-134801059.html?.tsrc=rss,"With solid growth prospects, Luminex Corporation (LMNX) carries a Zacks Rank #1 (Strong Buy) which is an attractive pick at present."
ALGN,ALGN:UW,BBG000BRNWJ1,ResMed (RMD) at 52-Week High: What&apos;s Driving the Stock?,2017-06-20 13:28:01 +0000,https://finance.yahoo.com/news/resmed-rmd-52-week-high-132801606.html?.tsrc=rss,"Share price of ResMed Inc. (RMD) scaled a new 52-week high of $79.22 on Jun 19, eventually closing a bit lower at $78.91."
ALGN,ALGN:UW,BBG000BRNWJ1,PAREXEL to Launch Connected Journey Data-Driven Services,2017-06-20 12:38:12 +0000,https://finance.yahoo.com/news/parexel-launch-connected-journey-data-123812022.html?.tsrc=rss,"PAREXEL International Corporation (PRXL) recently announced the launch of its proprietary data-driven services, Connected Journey."
ALGN,ALGN:UW,BBG000BRNWJ1,"ETFs with exposure to Align Technology, Inc. : June 19, 2017",2017-06-19 18:52:25 +0000,http://finance.yahoo.com/r/87122c44-f347-338b-bfda-bc568498cc65/etfs-with-exposure-to-align-technology-inc-june-19-2017?yptr=yahoo&.tsrc=rss,"Categories:  ETFs Yahoo FinanceClick here to see latest analysis ETFs with exposure to Align Technology, Inc. Here are 5 ETFs with the largest exposure to ALGN-US. Comparing the performance and risk of Align Technology, Inc. with the ETFs that have exposure to it gives us some ETF choices that could give us similar returns with lower volatility. Ticker ... Read more
<b>(Read more...)</b>"
ALGN,ALGN:UW,BBG000BRNWJ1,"Zacks.com featured highlights: Gray Television, H&R Block, Align Technology, Raymond James Financial and KLA-Tencor",2017-06-19 15:24:25 +0000,http://articlefeeds.nasdaq.com/~r/nasdaq/symbols/~3/bxwoL6b60Mg/zackscom-featured-highlights-gray-television-hr-block-align-technology-raymond-james-financial-and-kla-tencor-cm805026,For Immediate Release Chicago IL June 19 2017 Stocks in this week s article include 160 Gray Television Inc NYSE GTN Free Report H amp R Block Inc NYSE HRB Free Report Align Technology Inc NASDAQ ALGN Free Report Raymond James Financial Inc
ALGN,ALGN:UW,BBG000BRNWJ1,"Medtronic Posts Positive Result on Reactive ATP, Grows in AF",2017-06-19 13:43:01 +0000,https://finance.yahoo.com/news/medtronic-posts-positive-result-reactive-134301605.html?.tsrc=rss,Medtronic&apos;s (MDT) Reactive ATP therapy slows the progression of AF in patients who are being implanted with cardiac devices.
ALGN,ALGN:UW,BBG000BRNWJ1,"Zacks.com featured highlights: Gray Television, H&R Block, Align Technology, Raymond James Financial and KLA-Tencor",2017-06-19 13:30:01 +0000,https://finance.yahoo.com/news/zacks-com-featured-highlights-gray-133001528.html?.tsrc=rss,"Zacks.com featured highlights: Gray Television, H&R Block, Align Technology, Raymond James Financial and KLA-Tencor"
ALGN,ALGN:UW,BBG000BRNWJ1,Inogen (INGN) Scores a Strong Buy Right Now: Here's How,2017-06-19 13:23:02 +0000,http://articlefeeds.nasdaq.com/~r/nasdaq/symbols/~3/Xc4iI4z2vxE/inogen-ingn-scores-a-strong-buy-right-now-heres-how-cm804977,Goleta CA based Inogen Inc INGN a provider of portable oxygen concentrators POC is on a healthy growth trajectory of late It has rallied 96 6 over the past one year ahead of the S amp P 500 s 14 4 gain The stock has a market cap of 1 9 billion Also the company represented a
ALGN,ALGN:UW,BBG000BRNWJ1,"Universal Health Grows on Acquisitions, Rising Debt a Drag",2017-06-19 13:08:01 +0000,https://finance.yahoo.com/news/universal-health-grows-acquisitions-rising-130801412.html?.tsrc=rss,"Universal Health Services, Inc.&apos;s (UHS)s inorganic strategies substantially make it well positioned for long-term growth."
ALGN,ALGN:UW,BBG000BRNWJ1,Inogen (INGN) Scores a Strong Buy Right Now: Here&apos;s How,2017-06-19 12:03:12 +0000,https://finance.yahoo.com/news/inogen-ingn-scores-strong-buy-120312222.html?.tsrc=rss,"Goleta, CA-based Inogen Inc. (INGN), a provider of portable oxygen concentrators (POC), is on a healthy growth trajectory of late."
ALGN,ALGN:UW,BBG000BRNWJ1,Hologic Receives Extended FDA Clearance for SculpSure in US,2017-06-19 11:37:11 +0000,https://finance.yahoo.com/news/hologic-receives-extended-fda-clearance-113711285.html?.tsrc=rss,"Hologic, Inc. (HOLX) declared that the company&apos;s subsidiary Cynosure has received FDA&apos;s expanded clearance for SculpSure."
ALGN,ALGN:UW,BBG000BRNWJ1,"After Hours Most Active for Jun 16, 2017 :  YHOO, TDC, ANSS, GE, PAAS, ALGN, SSRI, HLT, F, XOM, T, CSCO",2017-06-16 20:58:45 +0000,http://articlefeeds.nasdaq.com/~r/nasdaq/symbols/~3/7Bc1V1h1BrA/after-hours-most-active-for-jun-16-2017-yhoo-tdc-anss-ge-paas-algn-ssri-hlt-f-xom-t-csco-cm804610,The NASDAQ 100 After Hours Indicator is down 88 to 5 680 6 The total After hours volume is currently 305 346 423 shares traded The following are the most active stocks for the after hours session Yahoo Inc YHOO is 0 22 at 52 80 with 42 102 083 shares
ALGN,ALGN:UW,BBG000BRNWJ1,Why Does Intuitive Surgical Score as a Strong Buy Right Now,2017-06-16 20:00:08 +0000,https://finance.yahoo.com/news/why-does-intuitive-surgical-score-200008846.html?.tsrc=rss,"Over the last three months, Intuitive Surgical Inc. (ISRG) was trading consistently ahead of the S&P 500 Index."
ALGN,ALGN:UW,BBG000BRNWJ1,"Align Technology, Inc. :ALGN-US: Earnings Analysis: Q1, 2017 By the Numbers : June 16, 2017",2017-06-16 15:54:13 +0000,http://finance.yahoo.com/r/fabca688-d298-31c8-b8ba-cb769fbbdd6c/align-technology-inc-algn-us-earnings-analysis-q1-2017-by-the-numbers-june-16-2017?yptr=yahoo&.tsrc=rss,"Categories:  Yahoo FinanceGet free summary analysis Align Technology, Inc. reports financial results for the quarter ended March 31, 2017. We analyze the earnings along side the following peers of Align Technology, Inc. – DENTSPLY SIRONA, Inc., BIOLASE, Inc., 3M Company and Danaher Corporation (XRAY-US, BIOL-US, MMM-US and DHR-US) that have also reported for this period. Highlights Summary ... Read more
<b>(Read more...)</b>"
ALGN,ALGN:UW,BBG000BRNWJ1,5 Momentum Stocks to Scoop Up Gains Using Driehaus Strategy,2017-06-16 15:11:18 +0000,http://articlefeeds.nasdaq.com/~r/nasdaq/symbols/~3/9pU1JJslUxA/5-momentum-stocks-to-scoop-up-gains-using-driehaus-strategy-cm804315,Risk taking investors always look for strategies that lead to attractive returns from momentum stocks Here we have used Driehaus strategy based on the buy high and sell higher principle that helped the genius earn a place in Barron s All Century Team Portfolios such as that of The
ALGN,ALGN:UW,BBG000BRNWJ1,5 Momentum Stocks to Scoop Up Gains Using Driehaus Strategy,2017-06-16 13:18:01 +0000,https://finance.yahoo.com/news/5-momentum-stocks-scoop-gains-131801257.html?.tsrc=rss,Risk-taking investors may use Driehaus Strategy to get strong returns by investing in momentum stocks.
ALGN,ALGN:UW,BBG000BRNWJ1,Align Technology to Be Added to the S&P 500 Index,2017-06-16 12:30:00 +0000,https://finance.yahoo.com/news/align-technology-added-p-500-123000778.html?.tsrc=rss,"Align Technology, Inc. today announced that Standard & Poor's will add the Company to the S&P 500 Index after the close of trading on Friday, June 16, 2017. Align will be added to the S&P 500 GICS Health ..."
ALGN,ALGN:UW,BBG000BRNWJ1,DaVita (DVA) Rolls Out Alliance Site Network for CKD Trial,2017-06-16 11:50:11 +0000,https://finance.yahoo.com/news/davita-dva-rolls-alliance-network-115011657.html?.tsrc=rss,"DaVita Inc (DVA), through its subsidiary DaVita Clinical Research (DCR), recently announced the expansion of its research services to include Alliance Site Network."
ALGN,ALGN:UW,BBG000BRNWJ1,Here's Why Phibro Animal Health Is Worth Buying Right Now,2017-06-15 21:07:10 +0000,http://articlefeeds.nasdaq.com/~r/nasdaq/symbols/~3/97d_DsBJo2M/heres-why-phibro-animal-health-is-worth-buying-right-now-cm804071,Phibro Animal Health Corporation PAHC headquartered in New Jersey is a leading global diversified animal health and mineral nutrition company It has rallied 24 2 over the past three months ahead of the S amp P 500 s mere 2 6 gain The stock has a market cap of 1 4 billion Also over
ALGN,ALGN:UW,BBG000BRNWJ1,Here&apos;s Why Phibro Animal Health Is Worth Buying Right Now,2017-06-15 19:03:07 +0000,https://finance.yahoo.com/news/apos-why-phibro-animal-health-190307437.html?.tsrc=rss,"Phibro Animal Health Corporation (PAHC), has rallied 24.2% over the past three months, ahead of the S&P 500&apos;s mere 2.6% gain."
ALGN,ALGN:UW,BBG000BRNWJ1,"MDY, ALGN, RMD, ANSS: ETF Inflow Alert",2017-06-15 18:10:37 +0000,http://articlefeeds.nasdaq.com/~r/nasdaq/symbols/~3/PSTg-nZMVQw/mdy-algn-rmd-anss-etf-inflow-alert-cm803964,Looking today at week over week shares outstanding changes among the universe of ETFs covered at ETF Channel one standout is the SPDR S amp P MIDCAP 400 ETF Symbol MDY where we have detected an approximate 232 7 million dollar inflow that s a 1 2 increase week over week in
ALGN,ALGN:UW,BBG000BRNWJ1,"Abbott Laboratories Up on EPD & Buyouts, Pediatric Weak",2017-06-15 15:11:17 +0000,http://articlefeeds.nasdaq.com/~r/nasdaq/symbols/~3/4XXrBU7SQgI/abbott-laboratories-up-on-epd-buyouts-pediatric-weak-cm803788,On Jun 14 we issued an updated research report on Illinois based Abbott Laboratories 160 ABT It is a leading distributor of health care products and services across the globe The company currently carries a Zacks Rank 2 Buy For the majority of the last one month Abbott has
ALGN,ALGN:UW,BBG000BRNWJ1,LabCorp to Grow in Precision Med with Cancer Diagnostics Lab,2017-06-15 13:45:01 +0000,https://finance.yahoo.com/news/labcorp-grow-precision-med-cancer-134501737.html?.tsrc=rss,"LabCorp&apos;s (LH) Covance drug development business has recently opened a companion diagnostics laboratory in Morrisville, North Carolina to expand capabilities in precision medicine field."
ALGN,ALGN:UW,BBG000BRNWJ1,"Abbott Laboratories Up on EPD & Buyouts, Pediatric Weak",2017-06-15 13:26:01 +0000,https://finance.yahoo.com/news/abbott-laboratories-epd-buyouts-pediatric-132601384.html?.tsrc=rss,"On Jun 14, we issued an updated research report on Illinois-based Abbott Laboratories (ABT). It is a leading distributor of health care products and services across the globe."
ALGN,ALGN:UW,BBG000BRNWJ1,"Henry Schein Grows on Strategic Buyouts, Competition Rife",2017-06-15 13:22:01 +0000,https://finance.yahoo.com/news/henry-schein-grows-strategic-buyouts-132201937.html?.tsrc=rss,"On Jun 15, we issued an updated research report on Melville, NY-based Henry Schein, Inc. (HSIC)."
ALGN,ALGN:UW,BBG000BRNWJ1,Align Technology Sreelakshmi Kolli Named a 2017 Honoree for Bay Area CIO of the Year,2017-06-15 12:30:00 +0000,https://finance.yahoo.com/news/align-technology-sreelakshmi-kolli-named-123000674.html?.tsrc=rss,"Align Technology, Inc. , today announced that Sreelakshmi Kolli, Align's vice president, Information Technology has been selected as an honoree for the Bay Area CIO of the Year in the Innovation and Transformation ..."
ALGN,ALGN:UW,BBG000BRNWJ1,"Haemonetics Rides on Solid Plasma, Slows Blood Center Growth",2017-06-14 22:06:56 +0000,http://articlefeeds.nasdaq.com/~r/nasdaq/symbols/~3/W1MXA-QW8bw/haemonetics-rides-on-solid-plasma-slows-blood-center-growth-cm803549,On Jun 13 we issued an updated research report on Haemonetics Corporation HAE a Braintree MA based leading provider of blood management solutions to customers encompassing blood and plasma collectors hospitals and health care providers globally For the past three months Haemonetics
ALGN,ALGN:UW,BBG000BRNWJ1,"Haemonetics Rides on Solid Plasma, Slows Blood Center Growth",2017-06-14 20:11:08 +0000,https://finance.yahoo.com/news/haemonetics-rides-solid-plasma-slows-201108607.html?.tsrc=rss,"On Jun 13, we issued an updated research report on Haemonetics Corporation (HAE)."
ALGN,ALGN:UW,BBG000BRNWJ1,FDA Passes Zimmer Biomet's (ZBH) Zhejiang Facility Issue,2017-06-14 14:12:42 +0000,http://articlefeeds.nasdaq.com/~r/nasdaq/symbols/~3/YPRmebaHAKU/fda-passes-zimmer-biomets-zbh-zhejiang-facility-issue-cm803147,Zimmer Biomet Holdings Inc ZBH revealed with a sigh of relief that the U S Food and Drug Administration FDA has finally resolved the long standing issue related to the company s Zhejiang China manufacturing facility According to the musculoskeletal major the FDA has closed out
ALGN,ALGN:UW,BBG000BRNWJ1,Civitas Solutions (CIVI) Extends ADH Platform to New Jersey,2017-06-14 13:50:01 +0000,https://finance.yahoo.com/news/civitas-solutions-civi-extends-adh-135001382.html?.tsrc=rss,"Civitas Solutions, Inc. (CIVI) recently announced that it has expanded its platform of Adult Day Health services to the state of New Jersey."
ALGN,ALGN:UW,BBG000BRNWJ1,Medtronic Resource Centre Opens for Diabetic People in Canada,2017-06-14 13:39:01 +0000,https://finance.yahoo.com/news/medtronic-centre-opens-diabetic-people-133901571.html?.tsrc=rss,Medtronic plc (MDT) announced that its subsidiary has opened its first Canadian Medtronic Resource Centre to serve diabetic patients in Surrey BC and nearby.
ALGN,ALGN:UW,BBG000BRNWJ1,"Hill-Rom Rides High on Solid Prospects, Asia-Pacific a Drag",2017-06-14 13:34:01 +0000,https://finance.yahoo.com/news/hill-rom-rides-high-solid-133401474.html?.tsrc=rss,"On Jun 11, we issued an updated research report on Batesville, IN-based Hill-Rom Holdings, Inc. (HRC) -- a leading global medical device company."
ALGN,ALGN:UW,BBG000BRNWJ1,Becton (BDX) with FlowJo to Provide Cloud Platform Services,2017-06-14 13:10:15 +0000,http://articlefeeds.nasdaq.com/~r/nasdaq/symbols/~3/pAyj3EK8AD0/becton-bdx-with-flowjo-to-provide-cloud-platform-services-cm803104,Leading global medical technology company Becton Dickinson and Company BDX popularly known as BD recently announced that it has entered into an agreement with FlowJo LLC a life science informatics and data analysis company Per the agreement the companies would offer the cloud
ALGN,ALGN:UW,BBG000BRNWJ1,Inside Align Technology’s Market Expansion Strategy,2017-06-14 13:06:19 +0000,http://finance.yahoo.com/r/a083ef26-35bc-3408-baf9-e612e497e0fa/focus-teen-segment-market-expansion-strategy-may-drive-revenue-growth-align-technology?utm_source=yahoo&utm_medium=feed&yptr=yahoo&.tsrc=rss,"In 1Q17, Align Technology (ALGN) also witnessed a robust rise of around 45.2% in volumes of Invisalign sold in Asia-Pacific markets on a YoY basis."
ALGN,ALGN:UW,BBG000BRNWJ1,FDA Passes Zimmer Biomet&apos;s (ZBH) Zhejiang Facility Issue,2017-06-14 12:17:12 +0000,https://finance.yahoo.com/news/fda-passes-zimmer-biomet-apos-121712632.html?.tsrc=rss,"Zimmer Biomet Holdings, Inc. (ZBH) revealed that the U.S. Food and Drug Administration (FDA) has closed out its &apos;Warning Letter&apos; related to the company&apos;s Zhejiang, China manufacturing facility."
ALGN,ALGN:UW,BBG000BRNWJ1,Understanding Align Technology’s Growing Position in International Markets,2017-06-14 11:36:50 +0000,http://finance.yahoo.com/r/d7956f1d-f8d7-35b4-94bf-2b23a983fee6/align-technology-continues-strengthen-market-position-international-markets-2017?utm_source=yahoo&utm_medium=feed&yptr=yahoo&.tsrc=rss,"In 1Q17, Align Technology (ALGN) witnessed an 11.4% sequential rise in the volume of Invisalign cases used by doctors in international markets."
ALGN,ALGN:UW,BBG000BRNWJ1,Becton (BDX) with FlowJo to Provide Cloud Platform Services,2017-06-14 11:20:11 +0000,https://finance.yahoo.com/news/becton-bdx-flowjo-cloud-platform-112011231.html?.tsrc=rss,"Becton, Dickinson and Company (BDX), popularly known as BD, recently announced that it has entered into an agreement with FlowJo, LLC."
ALGN,ALGN:UW,BBG000BRNWJ1,"Mead Johnson-Reckitt Move to Merge, Deal Closes on Jun 15",2017-06-13 16:31:01 +0000,http://articlefeeds.nasdaq.com/~r/nasdaq/symbols/~3/frTqZH3MJ8c/mead-johnson-reckitt-move-to-merge-deal-closes-on-jun-15-cm802776,Mead Johnson Nutrition Company MJN the Enfamil infant formula maker is fast moving toward concluding the agreement of acquisition with renowned British consumer products maker Reckitt Benckiser Group Post clearance of the final regulatory hurdle the company announced Jun15 as the
ALGN,ALGN:UW,BBG000BRNWJ1,"PetMed Express' New Order Sales Increase, Competition Rife",2017-06-13 15:33:48 +0000,http://articlefeeds.nasdaq.com/~r/nasdaq/symbols/~3/POsccxfPtUA/petmed-express-new-order-sales-increase-competition-rife-cm802705,On Jun 12 we issued an updated research report on Pompano Beach FL based PetMed Express Inc PETS Operating as 1 800 PetMeds the company is a leading nationwide pet pharmacy PetMed currently sports a Zacks Rank 1 Strong Buy Over the past three months PetMed has been trading above
