ALXN,ALXN:UW,BBG000G32HL2,"Alexion Appoints Ludwig Hantson, Ph.D., as Chief Executive Officer",2017-03-27 10:30:00 +0000,http://finance.yahoo.com/news/alexion-appoints-ludwig-hantson-ph-103000807.html?.tsrc=rss,"Alexion Pharmaceuticals, Inc. today announced that its Board of Directors has appointed Ludwig N. Hantson, Ph.D., as Chief Executive Officer and member of the Board of Directors, effective immediately."
ALXN,ALXN:UW,BBG000G32HL2,Wall Street Might Open Broadly Lower,2017-03-27 08:48:00 +0000,http://articlefeeds.nasdaq.com/~r/nasdaq/symbols/~3/iATlTlH-Bhk/wall-street-might-open-broadly-lower-20170327-00545,Wall Street Might Open Broadly Lower
ALXN,ALXN:UW,BBG000G32HL2,Alexion Names Ludwig Hantson CEO - Quick Facts,2017-03-27 06:40:00 +0000,http://articlefeeds.nasdaq.com/~r/nasdaq/symbols/~3/M_oPY0_39a0/alexion-names-ludwig-hantson-ceo--quick-facts-20170327-00215,Alexion Names Ludwig Hantson CEO - Quick Facts
ALXN,ALXN:UW,BBG000G32HL2,Omeros: Power in the Pipeline,2017-03-24 15:01:54 +0000,http://articlefeeds.nasdaq.com/~r/nasdaq/symbols/~3/ZwzzmtTmkDg/omeros-power-in-the-pipeline-cm765189,Although 2016 could be considered more of a year to forget for Omeros NASDAQ OMER investors 2017 has the potential to be this company s best year by far The combination of solid execution on revenue growth along with the start of a pivotal phase 3 trial could see shares
ALXN,ALXN:UW,BBG000G32HL2,Omeros: Power in the Pipeline,2017-03-24 13:02:00 +0000,https://www.fool.com/investing/2017/03/24/omeros-power-in-the-pipeline.aspx,Omeros: Power in the Pipeline
ALXN,ALXN:UW,BBG000G32HL2,Alexion (ALXN) Files for Soliris' Label Expansion in Japan,2017-03-23 17:01:05 +0000,http://articlefeeds.nasdaq.com/~r/nasdaq/symbols/~3/DV3h0VCCvic/alexion-alxn-files-for-soliris-label-expansion-in-japan-cm764766,Alexion Pharmaceuticals Inc ALXN announced that it has submitted an application to Japan s Ministry of Labour and Welfare MHLW for the label expansion for Soliris to treat patients with refractory generalized myasthenia gravis gMG who are anti acetylcholine receptor
ALXN,ALXN:UW,BBG000G32HL2,Alexion (ALXN) Files for Soliris' Label Expansion in Japan,2017-03-23 14:16:02 +0000,http://finance.yahoo.com/news/alexion-alxn-files-soliris-label-141602567.html?.tsrc=rss,"Alexion Pharmaceuticals, Inc. (ALXN) announced that it has submitted an application to Japan's Ministry of Labour and Welfare (MHLW) for the label expansion for Soliris to treat patients with refractory generalized myasthenia gravis (gMG)."
ALXN,ALXN:UW,BBG000G32HL2,Alexion (ALXN) Files for Soliris' Label Expansion in Japan,2017-03-23 14:16:02 +0000,http://finance.yahoo.com/news/alexion-alxn-files-soliris-label-141602567.html,Alexion (ALXN) Files for Soliris' Label Expansion in Japan
ALXN,ALXN:UW,BBG000G32HL2,Health Care Sector Update for 03/23/2017: ALXN,2017-03-23 13:38:18 +0000,http://articlefeeds.nasdaq.com/~r/nasdaq/symbols/~3/EavEiuBizPc/health-care-sector-update-for-03232017-alxn-cm764561,Top Health care stocks Top Health care stocks JNJ flatJNJ flat PFE flatPFE flat ABT flatABT flat MRK flatMRK flat AMGN 0 1 AMGN 0 1 Health care shares were mainly unchanged in pre market trade on Thursday Health care shares were mainly unchanged in pre market trade on Thursday
ALXN,ALXN:UW,BBG000G32HL2,"Biotech Premarket Movers: Insys, Ultragenyx, Alexion",2017-03-23 13:36:00 +0000,https://www.thestreet.com/story/14056918/1/biotech-premarket-movers-insys-ultragenyx-alexion.html?puc=yahoo&cm_ven=YAHOO,"Biotech Premarket Movers: Insys, Ultragenyx, Alexion"
ALXN,ALXN:UW,BBG000G32HL2,Alexion Submits Application in Japan for Soliris® (Eculizumab) as a Potential Treatment for Patients with Refractory Generalized Myasthenia Gravis (gMG),2017-03-22 20:05:00 +0000,http://au.finance.yahoo.com/news/alexion-submits-application-japan-soliris-200500871.html,"[Business Wire] - NEW HAVEN, Conn.--(BUSINESSWIRE)-- Alexion Pharmaceuticals, Inc. (NASDAQ:ALXN - News) announced today that it has submitted an application to Japan’s Ministry of Labour and Welfare (MHLW) to extend the indication for Soliris® (eculizumab) as a potential treatment for patients with refractory generalized myasthenia gravis (gMG) who are anti-acetylcholine receptor (AChR) antibody-positive. “We look forward to working with the Japanese health authorities to bring this potentially life-transforming treatment to patients in Japan who are suffering and in urgent need of an effective therapy,” said Martin Mackay, Ph.D., Executive Vice President and Global Head of R&D at Alexion."
ALXN,ALXN:UW,BBG000G32HL2,Alexion Submits Application in Japan for Soliris® (Eculizumab) as a Potential Treatment for Patients with Refractory Generalized Myasthenia Gravis (gMG),2017-03-22 20:05:00 +0000,http://finance.yahoo.com/news/alexion-submits-application-japan-soliris-200500535.html?.tsrc=rss,"Alexion Pharmaceuticals, Inc. announced today that it has submitted an application to Japan’s Ministry of Labour and Welfare to extend the indication for Soliris®  as a potential treatment for patients with refractory generalized myasthenia gravis who are anti-acetylcholine receptor antibody-positive."
ALXN,ALXN:UW,BBG000G32HL2,"Commit To Buy Alexion Pharmaceuticals At $75, Earn 5.1% Using Options",2017-03-22 17:07:36 +0000,http://articlefeeds.nasdaq.com/~r/nasdaq/symbols/~3/PN9HMjYpVEs/commit-to-buy-alexion-pharmaceuticals-at-75-earn-51-using-options-cm764180,Investors considering a purchase of Alexion Pharmaceuticals Inc Symbol ALXN stock but cautious about paying the going market price of 119 16 share might benefit from considering selling puts among the alternative strategies at their disposal One interesting put contract in particular
ALXN,ALXN:UW,BBG000G32HL2,Alexion Pharmaceuticals Enters Oversold Territory (ALXN),2017-03-21 18:07:57 +0000,http://articlefeeds.nasdaq.com/~r/nasdaq/symbols/~3/DFkIRegm66Q/alexion-pharmaceuticals-enters-oversold-territory-alxn-cm763656,Legendary investor Warren Buffett advises to be fearful when others are greedy and be greedy when others are fearful One way we can try to measure the level of fear in a given stock is through a technical analysis indicator called the Relative Strength Index or RSI which measures momentum on
ALXN,ALXN:UW,BBG000G32HL2,Look Under The Hood: BBH Has 12% Upside,2017-03-20 15:07:40 +0000,http://articlefeeds.nasdaq.com/~r/nasdaq/symbols/~3/lm6cnY1F0oc/look-under-the-hood-bbh-has-12-upside-cm762798,Looking at the underlying holdings of the ETFs in our coverage universe at ETF Channel we have compared the trading price of each holding against the average analyst 12 month forward target price and computed the weighted average implied analyst target price for the ETF itself For the
ALXN,ALXN:UW,BBG000G32HL2,Alexion (ALXN) Licenses Artubus Technology for Rare Diseases,2017-03-18 00:05:23 +0000,http://articlefeeds.nasdaq.com/~r/nasdaq/symbols/~3/e11LHetXY08/alexion-alxn-licenses-artubus-technology-for-rare-diseases-cm762482,Alexion Pharmaceuticals Inc ALXN has recently licensed Arbutus Biopharma Corporation s ABUS proprietary lipid nanoparticle LNP technology for use in one of former s rare disease programs The agreement enables Alexion to address the delivery of therapeutic application of messenger
ALXN,ALXN:UW,BBG000G32HL2,Alexion (ALXN) Licenses Artubus Technology for Rare Diseases,2017-03-17 22:01:10 +0000,http://finance.yahoo.com/news/alexion-alxn-licenses-artubus-technology-220110869.html,Alexion (ALXN) Licenses Artubus Technology for Rare Diseases
ALXN,ALXN:UW,BBG000G32HL2,Alexion (ALXN) Licenses Artubus Technology for Rare Diseases,2017-03-17 22:01:10 +0000,http://finance.yahoo.com/news/alexion-alxn-licenses-artubus-technology-220110869.html?.tsrc=rss,"Alexion Pharmaceuticals, Inc. (ALXN) has recently licensed Arbutus Biopharma proprietary LNP technology for use in rare disease programs."
ALXN,ALXN:UW,BBG000G32HL2,Close Update: Stocks Limp Into Friday's Close But Hang Onto Slim Gains For the Week,2017-03-17 21:25:48 +0000,http://articlefeeds.nasdaq.com/~r/nasdaq/symbols/~3/dg3G0v0XPS0/close-update-stocks-limp-into-fridays-close-but-hang-onto-slim-gains-for-the-week-cm762454,Wall Street was largely directionless on Friday with the benchmark averages hugging the flatline Continued profit taking pressure in the financial sector in the wake of the Federal Open Market Committee meeting this week was offset by gains in defensive sectors and industrial shares Shallow
ALXN,ALXN:UW,BBG000G32HL2,Midday Update: Market Indices Flat But Set to Close The Week Higher,2017-03-17 17:25:56 +0000,http://articlefeeds.nasdaq.com/~r/nasdaq/symbols/~3/SuUNiXRDNIw/midday-update-market-indices-flat-but-set-to-close-the-week-higher-cm762327,The benchmark averages were anchored to the flatline on Friday as steep losses in the healthcare and financial sectors were offset by strength in industrials utilities and material stocks Data on production and confidence of the U S consumer were briefly supportive but failed to generate
ALXN,ALXN:UW,BBG000G32HL2,Alexion Buys LNP Drug Delivery Tech from Arbutus,2017-03-17 15:43:00 +0000,http://www.investopedia.com/news/alexion-buys-lnp-tech-arbutus-alxn-abus/?partner=YahooSA,Alexion Buys LNP Drug Delivery Tech from Arbutus
ALXN,ALXN:UW,BBG000G32HL2,Alexion Buys LNP Drug Delivery Tech from Arbutus,2017-03-17 15:43:00 +0000,http://finance.yahoo.com/r/b6c943bc-043c-3188-a639-fe1d2c154b74/alexion-buys-lnp-tech-arbutus-alxn-abus?partner=YahooSA&yptr=yahoo&.tsrc=rss,Alexion hopes to use Arbutus' lipid nanoparticle technology for targeted drug delivery.
ALXN,ALXN:UW,BBG000G32HL2,Mid-Morning Market Update: Markets Edge Higher; Tiffany Earnings Top Estimates,2017-03-17 15:21:09 +0000,http://articlefeeds.nasdaq.com/~r/nasdaq/symbols/~3/87f2TufHB8g/mid-morning-market-update-markets-edge-higher-tiffany-earnings-top-estimates-cm762287,Following the market opening Friday the Dow traded up 0 07 percent to 20 950 20 while the NASDAQ gained 0 01 percent to 5 901 52 The S amp P also rose gaining 0 04 percent to 2 382 30 Leading and Lagging Sectors Basic materials shares climbed 0 56 percent in trading on
ALXN,ALXN:UW,BBG000G32HL2,Futures Cautiously Higher Ahead of Production Data,2017-03-17 13:45:52 +0000,http://articlefeeds.nasdaq.com/~r/nasdaq/symbols/~3/41FVKF6ZbpI/futures-cautiously-higher-ahead-of-production-data-cm762114,Stock futures are marginally higher ahead of Friday s open with Wall Street waiting for cues from this morning s series of economic data as well as the impact the day s expiration of stock index futures and options and stock futures and options will have on trading Gains in the energy
ALXN,ALXN:UW,BBG000G32HL2,Arbutus Licenses LNP Delivery Technology to Alexion for Use in Single Messenger RNA Product Candidate,2017-03-16 21:00:00 +0000,http://finance.yahoo.com/news/arbutus-licenses-lnp-delivery-technology-210000761.html?.tsrc=rss,"VANCOUVER, British Columbia and DOYLESTOWN, Pa., March 16, 2017-- Arbutus Biopharma Corporation, an industry-leading therapeutic solutions company focused on developing a cure for chronic hepatitis B virus ..."
ALXN,ALXN:UW,BBG000G32HL2,Arbutus Licenses LNP Delivery Technology to Alexion for Use in Single Messenger RNA Product Candidate,2017-03-16 21:00:00 +0000,http://finance.yahoo.com/news/arbutus-licenses-lnp-delivery-technology-210000761.html,"[GlobeNewswire] - VANCOUVER, British Columbia and DOYLESTOWN, Pa., March 16, 2017-- Arbutus Biopharma Corporation, an industry-leading therapeutic solutions company focused on developing a cure for chronic hepatitis B virus ..."
ALXN,ALXN:UW,BBG000G32HL2,Catalyst Pharma Neuromuscular Drug Succeeds In Study,2017-03-15 19:17:00 +0000,http://finance.yahoo.com/r/e09b4639-ba24-3633-a116-80d22aad1d9f/catalyst-pharma-neuromuscular-drug-succeeds-cprx?partner=YahooSA&yptr=yahoo&.tsrc=rss,Catalyst stock hit a 52-week high after its Firdapse drug reported positive study results.
ALXN,ALXN:UW,BBG000G32HL2,Pharmaceutical company to lay off more than 200 employees,2017-03-15 10:04:52 +0000,http://finance.yahoo.com/news/pharmaceutical-company-lay-off-more-100452216.html?.tsrc=rss,A Connecticut pharmaceutical company has announced it plans to lay off more than 200 employees in the coming weeks. The New Haven Register reports (http://bit.ly/2nqZlIS ) that a spokeswoman for Alexion ...
ALXN,ALXN:UW,BBG000G32HL2,Pharmaceutical company to lay off more than 200 employees,2017-03-15 10:04:52 +0000,http://sg.finance.yahoo.com/news/pharmaceutical-company-lay-off-more-100452197.html,Pharmaceutical company to lay off more than 200 employees
ALXN,ALXN:UW,BBG000G32HL2,"Alexion Trims Workforce, Scraps R&D Programs",2017-03-14 16:55:00 +0000,http://finance.yahoo.com/r/08dc0166-6319-30fe-9798-eba422b3c86c/alexion-trims-workforce-scraps-rd-programs-alxn?partner=YahooSA&yptr=yahoo&.tsrc=rss,Alexion has planned a restructuring to optimize its workforce and reassess its R&D programs.
ALXN,ALXN:UW,BBG000G32HL2,"Alexion Trims Workforce, Scraps R&D Programs",2017-03-14 16:55:00 +0000,http://www.investopedia.com/news/alexion-trims-workforce-scraps-rd-programs-alxn/?partner=YahooSA,"Alexion Trims Workforce, Scraps R&D Programs"
ALXN,ALXN:UW,BBG000G32HL2,Alexion Pharmaceuticals Cuts 7% of Workforce,2017-03-14 13:42:00 +0000,https://www.thestreet.com/story/14042157/1/alexion-pharmaceuticals-cuts-7-of-workforce.html?puc=yahoo&cm_ven=YAHOO,Alexion Pharmaceuticals Cuts 7% of Workforce
ALXN,ALXN:UW,BBG000G32HL2,Why Did the Healthcare Sector Fall on March 13?,2017-03-14 11:39:11 +0000,http://marketrealist.com/2017/03/healthcare-sector-decline-march-13/?utm_source=yahoo&utm_medium=feed,Why Did the Healthcare Sector Fall on March 13?
ALXN,ALXN:UW,BBG000G32HL2,England Says No to Drugs That Cost More Than Your Car (or Home),2017-03-14 05:00:00 +0000,https://www.bloomberg.com/news/articles/2017-03-14/england-says-no-to-drugs-that-cost-more-than-your-car-or-home?cmpid=yhoo.headline,England Says No to Drugs That Cost More Than Your Car (or Home)
ALXN,ALXN:UW,BBG000G32HL2,Alexion to cut 7 pct of workforce,2017-03-13 22:17:25 +0000,http://finance.yahoo.com/news/alexion-cut-7-pct-workforce-221725460.html,Alexion to cut 7 pct of workforce
ALXN,ALXN:UW,BBG000G32HL2,Stock market holds its ground as Fed rate decision looms,2017-03-13 20:36:26 +0000,http://www.marketwatch.com/News/Story/Story.aspx?guid=25ABC4EA-07CB-11E7-9134-706AC7433493&siteid=yhoof2,[at MarketWatch] - The U.S. stock market closes marginally higher after switching between small gains and losses on Monday as investors refrained from making sizable bets ahead of a Federal Reserve meeting that is widely ...
ALXN,ALXN:UW,BBG000G32HL2,"Noteworthy Monday Option Activity: ALXN, ANTM, PN",2017-03-13 17:05:55 +0000,http://articlefeeds.nasdaq.com/~r/nasdaq/symbols/~3/mJxGEiHAiq0/noteworthy-monday-option-activity-alxn-antm-pn-cm760052,Among the underlying components of the Russell 3000 index we saw noteworthy options trading volume today in Alexion Pharmaceuticals Inc Symbol ALXN where a total of 25 562 contracts have traded so far representing approximately 2 6 million underlying shares That amounts to about 116 8
ALXN,ALXN:UW,BBG000G32HL2,"Nasdaq 100 Movers: TSCO, CTRP",2017-03-13 16:07:18 +0000,http://articlefeeds.nasdaq.com/~r/nasdaq/symbols/~3/Ky2mxc6meA8/nasdaq-100-movers-tsco-ctrp-cm759966,In early trading on Monday shares of Ctrip com International CTRP topped the list of the day s best performing components of the Nasdaq 100 index trading up 2 6 Year to date Ctrip com International registers a 23 8 gain And the worst performing Nasdaq 100 component thus far on
ALXN,ALXN:UW,BBG000G32HL2,Alexion's sBLA for Soliris Receives FDA Acknowledgement,2017-03-11 00:14:44 +0000,http://articlefeeds.nasdaq.com/~r/nasdaq/symbols/~3/XC95fOoMveg/alexions-sbla-for-soliris-receives-fda-acknowledgement-cm759433,Alexion Pharmaceuticals Inc ALXN announced that the FDA on Mar 9 has accepted the supplemental Biologics License Application sBLA to expand the indication for Soliris for the potential treatment of 160 patients with refractory generalized myasthenia gravis gMG who
ALXN,ALXN:UW,BBG000G32HL2,Alexion's sBLA for Soliris Receives FDA Acknowledgement,2017-03-10 15:55:03 +0000,http://finance.yahoo.com/news/alexions-sbla-soliris-receives-fda-165504475.html,Alexion's sBLA for Soliris Receives FDA Acknowledgement
ALXN,ALXN:UW,BBG000G32HL2,"3 Big Stock Charts for Thursday: CA, Inc. (CA), Autodesk, Inc. (ADSK) and Alexion Pharmaceuticals, Inc. (ALXN)",2017-03-09 19:16:17 +0000,http://articlefeeds.nasdaq.com/~r/nasdaq/symbols/~3/3tbYbk45z4M/3-big-stock-charts-for-thursday-ca-inc-ca-autodesk-inc-adsk-and-alexion-pharmaceuticals-inc-alxn-cm758770,InvestorPlace Stock Market News Stock Advice amp Trading Tips We re starting to see more technical snags in the bull market that initiated after the results of the election in November All sectors are beginning to see dealers take profits or worse knock stocks out of
ALXN,ALXN:UW,BBG000G32HL2,ALXN Crosses Below Key Moving Average Level,2017-03-08 23:12:49 +0000,http://articlefeeds.nasdaq.com/~r/nasdaq/symbols/~3/2rBjbQ0ogTQ/alxn-crosses-below-key-moving-average-level-cm758168,In trading on Wednesday shares of Alexion Pharmaceuticals Inc Symbol ALXN crossed below their 200 day moving average of 128 28 changing hands as low as 126 17 per share Alexion Pharmaceuticals Inc shares are currently trading down about 1 4 on the day The chart below shows the one
ALXN,ALXN:UW,BBG000G32HL2,FDA Accepts sBLA Filing of Soliris® (Eculizumab) as a Potential Treatment for Patients with Refractory Generalized Myasthenia Gravis (gMG),2017-03-08 11:30:00 +0000,http://finance.yahoo.com/news/fda-accepts-sbla-filing-soliris-113000927.html,"[Business Wire] - Alexion Pharmaceuticals, Inc. announced today that the U.S. Food and Drug Administration has accepted for review the Company’s supplemental Biologics License Application to extend the indication for Soliris® as a potential treatment for patients with refractory generalized myasthenia gravis who are anti-acetylcholine receptor antibody-positive."
ALXN,ALXN:UW,BBG000G32HL2,Is This the Right Time to Invest in Biotech Stocks?,2017-03-07 14:16:32 +0000,http://articlefeeds.nasdaq.com/~r/nasdaq/symbols/~3/XB4ddS57gBw/is-this-the-right-time-to-invest-in-biotech-stocks-cm757033,The biotech industry was once a Wall Street favorite chalking up impressive gains until 2015 when the drug pricing issue started weighing on the sector However a look at the industry s year to date YTD price performance indicates that the sector is showing signs of recovery But will the
ALXN,ALXN:UW,BBG000G32HL2,Alexion Pharmaceuticals To Participate In Raymond James Conference At 1:05 PM ET,2017-03-07 12:05:00 +0000,http://articlefeeds.nasdaq.com/~r/nasdaq/symbols/~3/t-t2oDjjQ-0/alexion-pharmaceuticals-to-participate-in-raymond-james-conference-at-105-pm-et-20170307-01044,Alexion Pharmaceuticals To Participate In Raymond James Conference At 1:05 PM ET
ALXN,ALXN:UW,BBG000G32HL2,Alexion Pharmaceuticals To Participate In Cowen & Co Conference At 1:20 PM ET,2017-03-06 12:19:00 +0000,http://articlefeeds.nasdaq.com/~r/nasdaq/symbols/~3/Gzst7uaI_xY/alexion-pharmaceuticals-to-participate-in-cowen--co-conference-at-120-pm-et-20170306-00952,Alexion Pharmaceuticals To Participate In Cowen & Co Conference At 1:20 PM ET
ALXN,ALXN:UW,BBG000G32HL2,"ALEXION PHARMACEUTICALS INC Files SEC form 8-K, Change in Directors or Principal Officers, Financial Statements and E",2017-03-02 21:53:33 +0000,http://biz.yahoo.com/e/170302/alxn8-k.html,"ALEXION PHARMACEUTICALS INC Files SEC form 8-K, Change in Directors or Principal Officers, Financial Statements and E"
ALXN,ALXN:UW,BBG000G32HL2,"Leonard Bell, M.D., Alexion’s Founder, Announces Plans to Retire as Chairman and Board Member",2017-03-02 21:05:00 +0000,http://finance.yahoo.com/news/leonard-bell-m-d-alexion-210500971.html,"[Business Wire] - Leonard Bell, M.D., Founder of Alexion Pharmaceuticals Inc. , has informed the Board of Directors that he will not stand for reelection as a Board member and will retire as Chairman of the Board and as a Director at the end of his term, effective as of the Annual Meeting of Shareholders scheduled for May 10, 2017."
ALXN,ALXN:UW,BBG000G32HL2,Alexion Board Plans To Appoint David Brennan To Succeed Bell As Chairman,2017-03-02 17:24:00 +0000,http://articlefeeds.nasdaq.com/~r/nasdaq/symbols/~3/3ymegx2bYdg/alexion-board-plans-to-appoint-david-brennan-to-succeed-bell-as-chairman-20170302-01638,Alexion Board Plans To Appoint David Brennan To Succeed Bell As Chairman
ALXN,ALXN:UW,BBG000G32HL2,Regeneron Could See a Modest Rise in Net Profit Margins in 2017,2017-03-01 15:37:18 +0000,http://marketrealist.com/2017/02/regeneron-expected-witness-modest-rise-net-profit-margins-2017/?utm_source=yahoo&utm_medium=feed,Regeneron Could See a Modest Rise in Net Profit Margins in 2017
ALXN,ALXN:UW,BBG000G32HL2,Alexion Expects This to Be Big Medicine in 2017,2017-03-01 12:36:04 +0000,http://marketrealist.com/2017/02/alexion-pharmaceuticals-expects-alxn-1210-prove-potent-next-generation-c5-inhibitor/?utm_source=yahoo&utm_medium=feed,Alexion Expects This to Be Big Medicine in 2017
ALXN,ALXN:UW,BBG000G32HL2,Will Alexion’s Research Make Gains in the Inhibitor Space?,2017-02-28 15:36:43 +0000,http://marketrealist.com/2017/02/alexion-pharmaceuticals-continues-advance-research-programs-complement-inhibitor-space/?utm_source=yahoo&utm_medium=feed,Will Alexion’s Research Make Gains in the Inhibitor Space?
ALXN,ALXN:UW,BBG000G32HL2,Alnylam Pharmaceuticals Advances Its Patisiran Research Program,2017-02-28 14:09:18 +0000,http://marketrealist.com/2017/02/alnylam-pharmaceuticals-continues-advance-patisiran-research-program-2017/?utm_source=yahoo&utm_medium=feed,Alnylam Pharmaceuticals Advances Its Patisiran Research Program
ALXN,ALXN:UW,BBG000G32HL2,What Alexion Expects from Its Metabolic Disease Drugs in 2017,2017-02-28 14:07:34 +0000,http://marketrealist.com/2017/02/alexion-pharmaceuticals-expects-solid-performance-metabolic-disease-drugs-2017/?utm_source=yahoo&utm_medium=feed,What Alexion Expects from Its Metabolic Disease Drugs in 2017
ALXN,ALXN:UW,BBG000G32HL2,"Drug Stocks Q4 Earnings Lineup for Mar 1: MYL, KERX & More",2017-02-28 13:51:22 +0000,http://articlefeeds.nasdaq.com/~r/nasdaq/symbols/~3/G_ZaqJbYxoY/drug-stocks-q4-earnings-lineup-for-mar-1-myl-kerx-more-cm754034,With the curtains almost down on the Q4 earnings season we believe this quarter has turned out to be a good one with growth on track to be the highest in the last two years As of Feb 17 2017 411 S amp P 500 members accounting for 88 4 of the index s total market capitalization have
ALXN,ALXN:UW,BBG000G32HL2,Understanding Alexion’s Profit Margin Trend in 2017,2017-02-28 12:37:55 +0000,http://marketrealist.com/2017/02/alexion-pharmaceuticals-expected-witness-rise-profit-margins-2017/?utm_source=yahoo&utm_medium=feed,Understanding Alexion’s Profit Margin Trend in 2017
ALXN,ALXN:UW,BBG000G32HL2,Alexion’s Soliris: Gauging Patient Demand,2017-02-27 21:05:46 +0000,http://marketrealist.com/2017/02/soliris-expected-witness-rise-patient-demand-2017/?utm_source=yahoo&utm_medium=feed,Alexion’s Soliris: Gauging Patient Demand
ALXN,ALXN:UW,BBG000G32HL2,What to Expect from Alexion’s Revenue in 2017,2017-02-27 19:35:50 +0000,http://marketrealist.com/2017/02/alexion-pharmaceuticals-expected-witness-solid-revenue-growth-2017/?utm_source=yahoo&utm_medium=feed,What to Expect from Alexion’s Revenue in 2017
ALXN,ALXN:UW,BBG000G32HL2,Inside Alexion’s Latest Analyst Recommendations,2017-02-27 18:00:09 +0000,http://marketrealist.com/2017/02/analysts-recommendations-alexion-pharmaceuticals-2017/?utm_source=yahoo&utm_medium=feed,Inside Alexion’s Latest Analyst Recommendations
ALXN,ALXN:UW,BBG000G32HL2,"IBB, REGN, ILMN, ALXN: Large Outflows Detected at ETF",2017-02-27 17:50:39 +0000,http://articlefeeds.nasdaq.com/~r/nasdaq/symbols/~3/xZP75Ngulx8/ibb-regn-ilmn-alxn-large-outflows-detected-at-etf-cm753678,Looking today at week over week shares outstanding changes among the universe of ETFs covered at ETF Channel one standout is the iShares Nasdaq Biotechnology ETF Symbol IBB where we have detected an approximate 217 6 million dollar outflow that s a 2 6 decrease week over week
ALXN,ALXN:UW,BBG000G32HL2,Alexion to Present at Upcoming Investor Conferences,2017-02-27 15:21:00 +0000,http://finance.yahoo.com/news/alexion-present-upcoming-investor-conferences-152100046.html,"[Business Wire] - Alexion Pharmaceuticals, Inc. today announced that management will present at two upcoming investor conferences:"
ALXN,ALXN:UW,BBG000G32HL2,Inside Vertex’s Revenue Expectations for 2017,2017-02-24 20:35:48 +0000,http://marketrealist.com/2017/02/vertex-pharmaceuticals-expected-witness-solid-revenue-growth-2017/?utm_source=yahoo&utm_medium=feed,Inside Vertex’s Revenue Expectations for 2017
ALXN,ALXN:UW,BBG000G32HL2,Vertex Expects Modest Revenue Growth in This,2017-02-24 19:06:02 +0000,http://marketrealist.com/2017/02/vertex-pharmaceuticals-expects-modest-revenue-growth-orkambi-2017/?utm_source=yahoo&utm_medium=feed,Vertex Expects Modest Revenue Growth in This
ALXN,ALXN:UW,BBG000G32HL2,ALEXION PHARMACEUTICALS INC Financials,2017-02-22 18:04:21 +0000,http://finance.yahoo.com/q/is?s=alxn,ALEXION PHARMACEUTICALS INC Financials
ALXN,ALXN:UW,BBG000G32HL2,"Drug Stocks Q4 Earnings Slated for Feb 23: BMRN, ICPT & More",2017-02-22 15:12:02 +0000,http://articlefeeds.nasdaq.com/~r/nasdaq/symbols/~3/KcgF6FkWn34/drug-stocks-q4-earnings-slated-for-feb-23-bmrn-icpt-more-cm751080,The fourth quarter earnings season is drawing to a close with results from 411 S amp P 500 members or 82 2 of the index s total membership already out as of Feb 22 2017 according to the latest Earnings Preview report Total earnings for these 411 index members were up 8 from the year
