ALXN,ALXN:UW,BBG000G32HL2,What's in the Cards for Exelixis (EXEL) in Q2 Earnings?,2017-07-24 17:09:11 +0000,http://articlefeeds.nasdaq.com/~r/nasdaq/symbols/~3/tPDyd3kQAmk/whats-in-the-cards-for-exelixis-exel-in-q2-earnings-cm820318,Exelixis Inc EXEL is scheduled to report second quarter 2017 results on Aug 2 after the market closes Exelixis track record is outstanding The company has surpassed expectations in all the four trailing quarters with an average positive earnings surprise of 512 1
ALXN,ALXN:UW,BBG000G32HL2,Is Celgene (CELG) Poised For a Beat This Earnings Season?,2017-07-24 16:09:14 +0000,http://articlefeeds.nasdaq.com/~r/nasdaq/symbols/~3/xNhWO-IuSHA/is-celgene-celg-poised-for-a-beat-this-earnings-season-cm820167,Celgene Corporation CELG is scheduled to report second quarter 2017 results on Jul 27 before the opening bell Last quarter the company beat expectations by 4 08 Celgene has outperformed the Zacksclassified industry in the year so far The stock has gained 19 during this
ALXN,ALXN:UW,BBG000G32HL2,Biogen Earnings Preview: Analysis,2017-07-24 16:07:00 +0000,http://finance.yahoo.com/r/99a4bfb0-9025-3519-98ec-0e9f84c65026/biogen-earnings-preview-analysis?partner=YahooSA&yptr=yahoo&.tsrc=rss,Revenue and earnings probably declined in the latest quarter
ALXN,ALXN:UW,BBG000G32HL2,"Biotechs On A Hot Streak, And Could Be &apos;Cooking With Gas&apos;",2017-07-21 20:14:03 +0000,http://finance.yahoo.com/r/a8195dfd-eb98-3013-9614-baa8c81e7481/biotechs-on-a-hot-streak-and-could-be-cooking-with-gas?src=A00220&yptr=yahoo&.tsrc=rss,IBD&apos;s 439-company Biotech industry group is now ranked fourth out of 197. How far can the rally go?
ALXN,ALXN:UW,BBG000G32HL2,Are Options Traders Betting on a Big Move in Alexion Pharmaceuticals (ALXN) Stock?,2017-07-21 16:13:46 +0000,http://articlefeeds.nasdaq.com/~r/nasdaq/symbols/~3/4Dw35SjtEhg/are-options-traders-betting-on-a-big-move-in-alexion-pharmaceuticals-alxn-stock-cm819367,Investors in Alexion Pharmaceuticals Inc ALXN need to pay close attention to the stock based on moves in the options market lately That is because the August 18 2017 65Put had some of the highest implied volatility of all equity options today What is Implied Volatility
ALXN,ALXN:UW,BBG000G32HL2,Are Options Traders Betting on a Big Move in Alexion Pharmaceuticals (ALXN) Stock?,2017-07-21 13:42:01 +0000,https://finance.yahoo.com/news/options-traders-betting-big-move-134201280.html?.tsrc=rss,"Investors in Alexion Pharmaceuticals, Inc. (ALXN) need to pay close attention to the stock based on moves in the options market lately."
ALXN,ALXN:UW,BBG000G32HL2,S&P 500 Analyst Moves: ALXN,2017-07-20 17:05:52 +0000,http://articlefeeds.nasdaq.com/~r/nasdaq/symbols/~3/q1ULTYJRSPs/sp-500-analyst-moves-alxn-cm818798,The latest tally of analyst opinions from the major brokerage houses shows that among the components of the S amp P 500 index Alexion Pharmaceuticals ALXN is now the 120 analyst pick moving up by 2 spots This rank is formed by averaging the analyst opinions for each component
ALXN,ALXN:UW,BBG000G32HL2,Is a Beat in Store for Alexion (ALXN) this Earnings Season?,2017-07-20 17:03:55 +0000,http://articlefeeds.nasdaq.com/~r/nasdaq/symbols/~3/XFqLvluNQmc/is-a-beat-in-store-for-alexion-alxn-this-earnings-season-cm818766,Alexion Pharmaceuticals Inc ALXN is scheduled to report second quarter 2017 results on Jul 160 27 before the opening bell In the last reported quarter Alexion s earnings surpassed Zacks Consensus Estimate Alexion s track record is excellent as the company has consistently
ALXN,ALXN:UW,BBG000G32HL2,Is a Beat in Store for Alexion (ALXN) this Earnings Season?,2017-07-20 15:31:03 +0000,https://finance.yahoo.com/news/beat-store-alexion-alxn-earnings-153103207.html?.tsrc=rss,"Alexion Pharmaceuticals, Inc.&apos;s (ALXN) drugs like Soliris and Strensiq have been performing well. Let&apos;s see if these lead the company to an earnings beat."
ALXN,ALXN:UW,BBG000G32HL2,Is Gilead (GILD) Poised for a Beat This Earnings Season?,2017-07-20 14:08:33 +0000,http://articlefeeds.nasdaq.com/~r/nasdaq/symbols/~3/Dj8ghdNt3vo/is-gilead-gild-poised-for-a-beat-this-earnings-season-cm818541,Gilead Sciences Inc GILD is scheduled to report second quarter 2017 results on Jul 26 after the market closes Last quarter the company beat expectations by 0 92 Gilead Sciences Inc Price and EPS Surprise Gilead Sciences Inc Price and EPS
ALXN,ALXN:UW,BBG000G32HL2,"Robbins Arroyo LLP Is Investigating the Officers and Directors of Alexion Pharmaceuticals, Inc. (ALXN) on Behalf of Shareholders",2017-07-19 18:08:00 +0000,https://finance.yahoo.com/news/robbins-arroyo-llp-investigating-officers-180800477.html?.tsrc=rss,"Shareholder rights law firm Robbins Arroyo LLP is investigating whether certain officers and directors of Alexion Pharmaceuticals, Inc. breached their fiduciary duties to shareholders."
ALXN,ALXN:UW,BBG000G32HL2,"Biotech Stock Roundup: Vertex Boosted by CF Data, FDA Nod for Gilead, Puma Drugs",2017-07-19 14:06:52 +0000,http://articlefeeds.nasdaq.com/~r/nasdaq/symbols/~3/vPIIyQZEiWc/biotech-stock-roundup-vertex-boosted-by-cf-data-fda-nod-for-gilead-puma-drugs-cm818047,Key highlights this week include impressive data from Vertex s VRTX cystic fibrosis CF pipeline while companies like Gilead GILD and Puma PBYI got FDA approval for their hepatitis C virus HCV and breast cancer treatments respectively 160 Recap of the Week s Most Important
ALXN,ALXN:UW,BBG000G32HL2,Wall Street’s 5 Hottest Biotech Stocks Right Now,2017-07-17 23:45:52 +0000,http://articlefeeds.nasdaq.com/~r/nasdaq/symbols/~3/Pr9S-b3dxaE/wall-streets-5-hottest-biotech-stocks-right-now-cm817217,InvestorPlace Stock Market News Stock Advice amp Trading Tips Biotech stocks recently experienced their best week since the start of 2017 The biotechnology sector spiked following news that President Donald Trump plans to address drug prices with an executive order rather than
ALXN,ALXN:UW,BBG000G32HL2,"Alexion May Report A Weak Quarter, But The Stock's Still A Buy: Instinet",2017-07-17 19:41:00 +0000,http://finance.yahoo.com/r/62d0877f-b2a2-3f8d-b226-edaeedc1cf7e/alexion-may-report-a-weak-quarter-but-the-stocks-still-a-buy-instinet-1500320487?mod=yahoobarrons&ru=yahoo&yptr=yahoo&.tsrc=rss,"Instinet's Christopher Marai and his team have a preview of Alexion Pharmaceuticals' (ALXN) upcoming earnings report, and while they expect EPS and revenue to come in a bit shy of the Street's expectations, ..."
ALXN,ALXN:UW,BBG000G32HL2,[$$] Biotechs in Focus Ahead of Earnings,2017-07-17 15:15:00 +0000,http://finance.yahoo.com/r/622b6d9d-e661-32f7-87f9-7dae41ef33e0/biotechs-in-focus-ahead-of-earnings-1500304501?mod=yahoobarrons&ru=yahoo&yptr=yahoo&.tsrc=rss,"Credit Suisse  Heading into the quarter, Biogen and Alexion Pharmaceuticals are in focus in our coverage universe.  Key products of focus for the quarter include Regeneron’s (REGN) newly launched Dupixent, Biogen/Ionis Pharmaceuticals’ (IONS) Spinraza now in its second full quarter and Alexion’s (ALXN) Soliris."
ALXN,ALXN:UW,BBG000G32HL2,"XBI, CLVS, EXEL, ALXN: Large Inflows Detected at ETF",2017-07-13 16:51:26 +0000,http://articlefeeds.nasdaq.com/~r/nasdaq/symbols/~3/n377MjGb2Vs/xbi-clvs-exel-alxn-large-inflows-detected-at-etf-cm815708,Looking today at week over week shares outstanding changes among the universe of ETFs covered at ETF Channel one standout is the SPDR S amp P Biotech ETF Symbol XBI where we have detected an approximate 196 6 million dollar inflow that s a 5 4 increase week over week in outstanding
ALXN,ALXN:UW,BBG000G32HL2,Biotech 2Q17: It's Mostly all Gravy,2017-07-13 13:46:00 +0000,http://finance.yahoo.com/r/fc9f4171-9d0c-316f-9b64-af53d2daab53/biotech-2q17-its-mostly-all-gravy-1499953599?mod=yahoobarrons&ru=yahoo&yptr=yahoo&.tsrc=rss,"There's still a big question mark around healthcare policy, but drug pricing concerns have abated and investor sentiment appears to be improving. Exchange-traded funds tracking biotechnology stocks are ..."
ALXN,ALXN:UW,BBG000G32HL2,Cramer's lightning round: Companies that do this are too desperate for me,2017-07-11 22:50:30 +0000,http://finance.yahoo.com/r/cdd1d68d-2a2d-302c-aee0-3905b78707ae/104579630?__source=yahoo%7Cfinance%7Cheadline%7Cheadline%7Cstory&par=yahoo&doc=104579630&yptr=yahoo&.tsrc=rss,"Jim Cramer rattles off his take on callers' favorite stocks at lightning speed, including this telecom name."
ALXN,ALXN:UW,BBG000G32HL2,Cramer&apos;s lightning round: Companies that do this are too desperate for me,2017-07-11 22:50:30 +0000,https://finance.yahoo.com/news/cramer-apos-lightning-round-companies-225030330.html?.tsrc=rss,"Jim Cramer rattles off his take on callers&apos; favorite stocks at lightning speed, including this telecom name."
ALXN,ALXN:UW,BBG000G32HL2,Spiros Segalas Commentary on Alexion Pharmaceuticals,2017-07-11 16:44:36 +0000,http://articlefeeds.nasdaq.com/~r/nasdaq/symbols/~3/J9_bmp4WRb0/spiros-segalas-commentary-on-alexion-pharmaceuticals-cm814565,NASDAQ ALXN Spiros Segalas Trades Portfolio Premium Members This article first appeared on GuruFocus This article first appeared
ALXN,ALXN:UW,BBG000G32HL2,5 Top Multibagger Biotech Stocks to Buy in the 2nd Half,2017-07-11 15:51:18 +0000,http://articlefeeds.nasdaq.com/~r/nasdaq/symbols/~3/YuwPUF1jU7Q/5-top-multibagger-biotech-stocks-to-buy-in-the-2nd-half-cm814468,After a dreadful 2016 biotech stocks have sprung back to life this year as possibilities of a draconian crackdown on drug prices ease out The unveiling of a health care refurbish plan by Senate Republicans in the meanwhile has reinstated investors confidence in the Republicans ability
ALXN,ALXN:UW,BBG000G32HL2,"Alexion to Report Second Quarter 2017 Results and Strategic Update on Thursday, July 27, 2017",2017-07-11 14:00:00 +0000,https://finance.yahoo.com/news/alexion-report-second-quarter-2017-140000434.html?.tsrc=rss,"Alexion Pharmaceuticals, Inc. today announced that the Company will report its financial results for the second quarter 2017 on Thursday, July 27, 2017 before the US financial markets open."
ALXN,ALXN:UW,BBG000G32HL2,What Analysts Recommend for BioMarin Pharmaceuticals,2017-07-10 13:07:54 +0000,http://finance.yahoo.com/r/cf02b496-4085-3899-b066-ca212cbdc160/what-analysts-recommend-for-biomarin-pharmaceuticals?utm_source=yahoo&utm_medium=feed&yptr=yahoo&.tsrc=rss,"A total of 20 analysts were analyzing BioMarin Pharmaceuticals in July 2017. Six analysts recommended a “strong buy,” while nine analysts suggested a “buy.”"
ALXN,ALXN:UW,BBG000G32HL2,3 Stocks With Huge Business Advantages,2017-07-09 12:34:00 +0000,http://finance.yahoo.com/r/6a666c24-0b14-3318-ae0c-f7bc58222296/3-stocks-with-huge-business-advantages.aspx?yptr=yahoo&.tsrc=rss,These companies are running circles around their competitors.
ALXN,ALXN:UW,BBG000G32HL2,Alexion Investigation Believed to Have 'Minimal Impact',2017-07-07 20:35:00 +0000,http://finance.yahoo.com/r/be7a3050-ecaf-3166-a771-df327f4739f8/alexion-investigation-believed-to-have-quot-minimal-impact-quot.html?puc=yahoo&cm_ven=YAHOO&yptr=yahoo&.tsrc=rss,"Investors shouldn't ruffle their feathers. At least, not yet."
ALXN,ALXN:UW,BBG000G32HL2,Alexion Pharmaceuticals: Nothing to See Here?,2017-07-07 15:58:00 +0000,http://finance.yahoo.com/r/a4450d62-5311-3a0b-ba77-d44df4f4329b/alexion-pharmaceuticals-nothing-to-see-here-1499443119?mod=yahoobarrons&ru=yahoo&yptr=yahoo&.tsrc=rss,"Yesterday, Bloomberg reported that the U.S. Department of Health and Human Services was also investigating  Alexion Pharmaceuticals (ALXN) sales practices, helping to send shares down 3.2% on the day.  Alexion's sales practices have been a huge concern, and resulted not only in an investigation, but the replacement of nearly the entire C-suite as well.  Morgan Stanley's Matthew Harrison and team explain why: Alexion clarified that this is related to a previously disclosed Massachusetts U.S. Attorney’s Office investigation into drug assistance programs in which multiple pharmaceutical companies are involved...While any investigation is concerning, the details suggest relatively modest risk...Given most investors fear a significant new investigation around Soliris sales practices, the details of this investigation appear more moderate, esp."
ALXN,ALXN:UW,BBG000G32HL2,"Biotech Movers: Alexion, Arena, Novavax",2017-07-07 13:40:00 +0000,http://finance.yahoo.com/r/7d13ac06-006b-3d10-9fb0-cf19294ea6df/biotech-movers-alexion-arena-novavax.html?puc=yahoo&cm_ven=YAHOO&yptr=yahoo&.tsrc=rss,"Alexion, Arena and Novavax were among the biotech stock movers ahead of the market open on Friday, July 7."
ALXN,ALXN:UW,BBG000G32HL2,"Alexion Reportedly Being Investigated by HHS, Shares Slip",2017-07-07 13:06:01 +0000,https://finance.yahoo.com/news/alexion-reportedly-being-investigated-hhs-130601552.html?.tsrc=rss,"Shares of Alexion Pharmaceuticals, Inc. (ALXN) were down more than 3% on Thursday after a Bloomberg report stated that it is under investigation by the U.S. Department of Health and Human Services&apos; (HHS) Office of Inspector General (OIG)."
ALXN,ALXN:UW,BBG000G32HL2,The Market In 5 Minutes,2017-07-07 13:05:09 +0000,https://finance.yahoo.com/news/market-5-minutes-130509991.html?.tsrc=rss,"IN THE NEWS Benzinga Alexion Pharmaceuticals, Inc. (NASDAQ: ALXN ) shares plunged nearly 5 percent Thursday on news that it was under investigation by the U.S. Department of Health and Human Services’ ..."
ALXN,ALXN:UW,BBG000G32HL2,Alexion Pharma Stock Dives On Report It&apos;s Under Federal Scrutiny,2017-07-06 21:51:47 +0000,http://finance.yahoo.com/r/7e206972-6858-34f0-a0eb-1b4a979506ed/alexion-pharma-stock-dives-on-report-its-under-federal-scrutiny?src=A00220&yptr=yahoo&.tsrc=rss,Alexion stock toppled Thursday after Health and Human Services confirmed it has an open and ongoing investigation into the rare disease biotech.
ALXN,ALXN:UW,BBG000G32HL2,Alexion Pharmaceuticals reportedly under investigation by HHS,2017-07-06 21:37:20 +0000,https://finance.yahoo.com/news/alexion-pharmaceuticals-reportedly-under-investigation-213720602.html?.tsrc=rss,"The Department of Health and Human Services&apos; Inspector General is investigating Alexion Pharmaceuticals, Bloomberg reports."
ALXN,ALXN:UW,BBG000G32HL2,Alexion Pharmaceuticals reportedly under investigation by HHS,2017-07-06 21:37:20 +0000,http://finance.yahoo.com/r/a6828c4d-fb0a-3a11-8865-1370b1bdbaa8/104571461?__source=yahoo%7Cfinance%7Cheadline%7Cheadline%7Cstory&par=yahoo&doc=104571461&yptr=yahoo&.tsrc=rss,"The Department of Health and Human Services' Inspector General is investigating Alexion Pharmaceuticals, Bloomberg reports."
ALXN,ALXN:UW,BBG000G32HL2,Alexion stock drops 3.6% on Bloomberg report that it's under investigation,2017-07-06 19:56:34 +0000,http://finance.yahoo.com/r/34613204-9fa9-3328-b888-ae4265aa093b/Story.aspx?guid=081FEA4D-6B7C-4A96-8501-021AD5C5721E&siteid=yhoof2&yptr=yahoo&.tsrc=rss,Alexion Pharmaceuticals Inc. shares dropped 3.5% to $120.62 in heavy Thursday afternoon trade after Bloomberg reported that the company is under investigation by the Department of Health and Human Services' ...
ALXN,ALXN:UW,BBG000G32HL2,Alexion shares down amid HHS investigation,2017-07-06 19:44:00 +0000,https://finance.yahoo.com/video/alexion-shares-down-amid-hhs-194400684.html?.tsrc=rss,CNBC's Meg Tirrell reports that Alexion Pharmaceuticals is being investigated by US Department of Health and Human Services Inspector General.
ALXN,ALXN:UW,BBG000G32HL2,Alexion Says U.S. Health Inspector General Is Part of DOJ Probe,2017-07-06 19:05:35 +0000,http://finance.yahoo.com/r/e28cff53-1c51-3ea6-8522-4cf47aeccd32/alexion-under-investigation-by-u-s-office-of-inspector-general?utm_source=yahoo&utm_medium=bd&utm_campaign=headline&trackingId=yhoo.headline&yptr=yahoo&.tsrc=rss,"Alexion Pharmaceuticals Inc. is under investigation by the U.S. Department of Health and Human Services’ Office of Inspector General, related to a probe of the drugmaker’s support for charities that aid ..."
ALXN,ALXN:UW,BBG000G32HL2,3 Hot Biotech Stocks Ready for the Sector’s Next Breakout,2017-07-06 15:50:09 +0000,http://articlefeeds.nasdaq.com/~r/nasdaq/symbols/~3/Qmh4wSz1ycA/3-hot-biotech-stocks-ready-for-the-sectors-next-breakout-cm812546,InvestorPlace Stock Market News Stock Advice amp Trading Tips Biotech stocks and pharmaceutical stocks have been in the political crosshairs for more than a year The threat of government controls left the group attractively valued into 2017 but the potential for headline risks has
ALXN,ALXN:UW,BBG000G32HL2,"Noteworthy ETF Outflows: XBI, CLVS, EXEL, ALXN",2017-07-05 16:45:20 +0000,http://articlefeeds.nasdaq.com/~r/nasdaq/symbols/~3/pDZmOw0HFkE/noteworthy-etf-outflows-xbi-clvs-exel-alxn-cm811897,Looking today at week over week shares outstanding changes among the universe of ETFs covered at ETF Channel one standout is the SPDR S amp P Biotech ETF Symbol XBI where we have detected an approximate 155 9 million dollar outflow that s a 4 2 decrease week over week from 48 000 000
ALXN,ALXN:UW,BBG000G32HL2,Alexion Reaches Funding Agreement with NICE and NHS England for Strensiq® (asfotase alfa) for Patients with Pediatric-onset Hypophosphatasia (HPP),2017-07-05 08:00:00 +0000,https://finance.yahoo.com/news/alexion-reaches-funding-agreement-nice-080000804.html?.tsrc=rss,"Alexion Pharmaceuticals, Inc. today announced that it has reached a national funding agreement with the National Institute for Health and Care Excellence and the National Health Service England based on a Managed Access Agreement , which provides access to Strensiq® for patients in England with pediatric-onset hypophosphatasia , regardless of their current age."
ALXN,ALXN:UW,BBG000G32HL2,"Alexion Reaches Funding Agreement With NICE, NHS For Strensiq - Quick Facts",2017-07-05 04:11:00 +0000,http://articlefeeds.nasdaq.com/~r/nasdaq/symbols/~3/TwzyxqGhY28/alexion-reaches-funding-agreement-with-nice-nhs-for-strensiq--quick-facts-20170705-00112,"Alexion Reaches Funding Agreement With NICE, NHS For Strensiq - Quick Facts"
ALXN,ALXN:UW,BBG000G32HL2,3 Reasons Why Gilead Sciences Shouldn't Buy Vertex Pharmaceuticals,2017-07-03 15:45:29 +0000,http://articlefeeds.nasdaq.com/~r/nasdaq/symbols/~3/pXLFFlUxL1E/3-reasons-why-gilead-sciences-shouldnt-buy-vertex-pharmaceuticals-cm811188,The idea of a 160 marriage between Gilead Sciences NASDAQ GILD and Vertex Pharmaceuticals NASDAQ VRTX has been repeatedly floated by analysts for the better part of the last two years After all a deal to buy Vertex would easily fall within Gilead s price range and
ALXN,ALXN:UW,BBG000G32HL2,3 Best-Performing Stocks in June,2017-07-03 14:47:50 +0000,http://articlefeeds.nasdaq.com/~r/nasdaq/symbols/~3/Z3qgs2BQpj0/3-best-performing-stocks-in-june-cm811117,June was a quiet month for the S amp P 500 The famous index ended the month down less than 1 from where it started However not every company from the index had muted returns In fact three stocks Signet Jewelers Limited NYSE SIG Alexion Pharmaceuticals
ALXN,ALXN:UW,BBG000G32HL2,3 Best-Performing Stocks in June,2017-07-03 13:02:00 +0000,http://finance.yahoo.com/r/b00d27f7-a159-3a48-beb5-45c353c8849f/3-best-performing-stocks-in-june.aspx?yptr=yahoo&.tsrc=rss,"Here&apos;s why Signet Jewelers Limited, Alexion Pharmaceuticals, and Acuity Brands all posted gains of 20% or more during the month."
ALXN,ALXN:UW,BBG000G32HL2,Biogen: Insiders Are Buying. Should You Be Too?,2017-06-30 18:30:00 +0000,http://finance.yahoo.com/r/90c2bb1f-4863-3941-8e9f-da5b474eda9e/biogen-insiders-are-buying-should-you-be-too-1498847436?mod=yahoobarrons&ru=yahoo&yptr=yahoo&.tsrc=rss,"As former Fidelity Investments star Peter Lynch once observed, “Insiders might sell their shares for any number of reasons, but they buy them for only one: They think the price will rise.” Keeping that thought in mind, the biotechnology analysts at Cowen -- Phil Nadeau, Eric Schmidt and Joseph Thome -- analyzed the Form 4 SEC filings and open market transactions by insiders for the 10 largest biotechnology companies over the past decade and gauged the stock’s performance over the one-, three-, six- and 12-month period following the transactions.  What did they find?"
ALXN,ALXN:UW,BBG000G32HL2,Analysts Anticipate QQQ Will Reach $151,2017-06-30 14:39:15 +0000,http://articlefeeds.nasdaq.com/~r/nasdaq/symbols/~3/noaESHpFRDQ/analysts-anticipate-qqq-will-reach-151-cm810451,Looking at the underlying holdings of the ETFs in our coverage universe at ETF Channel we have compared the trading price of each holding against the average analyst 12 month forward target price and computed the weighted average implied analyst target price for the ETF itself For
ALXN,ALXN:UW,BBG000G32HL2,2 Fastest Growing Biotech Stocks,2017-06-28 21:04:07 +0000,http://articlefeeds.nasdaq.com/~r/nasdaq/symbols/~3/UG9yk_buRn4/2-fastest-growing-biotech-stocks-cm809607,Even though biotech has been sky rocketing over the last five years the industry s eye popping growth spurt isn t showing any signs of slowing down In fact EvaluatePharma estimates that global prescription drug sales will rise at an astounding compound annual growth rate or CAGR
ALXN,ALXN:UW,BBG000G32HL2,2 Fastest Growing Biotech Stocks,2017-06-28 19:44:00 +0000,http://finance.yahoo.com/r/cad7a982-1e33-37a0-9e6a-b887c86853c3/3-fastest-growing-pharma-stocks.aspx?yptr=yahoo&.tsrc=rss,"Celgene and Alexion Pharmaceuticals are biotech&apos;s brightest stars, but can they continue to outshine their peers?"
ALXN,ALXN:UW,BBG000G32HL2,Where to find value in health-care stocks ahead of Senate...,2017-06-28 16:39:00 +0000,https://finance.yahoo.com/video/where-value-health-care-stocks-163900033.html?.tsrc=rss,CNBC's Landon Dowdy reports on the health care sector moves ahead of the Senate health-care bill vote. The “Fast Money Halftime Report” traders weigh in.
ALXN,ALXN:UW,BBG000G32HL2,Here's Why Ra Pharmaceuticals Inc. Tumbled as Much as 32% Today,2017-06-27 21:51:48 +0000,http://articlefeeds.nasdaq.com/~r/nasdaq/symbols/~3/vEeVX2bLX44/heres-why-ra-pharmaceuticals-inc-tumbled-as-much-as-32-today-cm809083,What happened Shares of Ra Pharmaceuticals NASDAQ RARX a clinical stage drug developer with a keen focus on developing therapies to treat rare diseases tumbled as much as 32 on Tuesday after announcing its initial data for its phase 2 trials involving experimental
ALXN,ALXN:UW,BBG000G32HL2,Here&apos;s Why Ra Pharmaceuticals Inc. Tumbled as Much as 32% Today,2017-06-27 20:24:00 +0000,http://finance.yahoo.com/r/65dc7762-e2bc-35bf-97a3-956e67079bc4/heres-why-ra-pharmaceuticals-inc-tumbled-as-much-a.aspx?yptr=yahoo&.tsrc=rss,Investors find fault in Ra&apos;s phase 2 initial data for its lead drug.
ALXN,ALXN:UW,BBG000G32HL2,SPDR S&P Biotech ETF Experiences Big Inflow,2017-06-27 16:51:20 +0000,http://articlefeeds.nasdaq.com/~r/nasdaq/symbols/~3/MZr0g5PMcjY/spdr-sp-biotech-etf-experiences-big-inflow-cm808861,Looking today at week over week shares outstanding changes among the universe of ETFs covered at ETF Channel one standout is the SPDR S amp P Biotech ETF Symbol XBI where we have detected an approximate 264 2 million dollar inflow that s a 7 4 increase week over week in outstanding
ALXN,ALXN:UW,BBG000G32HL2,3 Top Stocks on Sale This Summer,2017-06-26 12:51:27 +0000,http://articlefeeds.nasdaq.com/~r/nasdaq/symbols/~3/HaAmPn9jFkQ/3-top-stocks-on-sale-this-summer-cm807926,Believe it or not the bull market rally recently logged its eighth birthday Since bottoming out in March 2009 the broad market indexes have catapulted to new all time highs Over the trailing one year period the broad based S amp P 500 has galloped higher by more than
ALXN,ALXN:UW,BBG000G32HL2,3 Top Stocks on Sale This Summer,2017-06-26 11:26:00 +0000,http://finance.yahoo.com/r/b9b56f95-089e-31a4-8d6d-2cb5fcd9f9d2/3-top-stocks-on-sale-this-summer.aspx?yptr=yahoo&.tsrc=rss,It could be time for long-term investors to go shopping.
ALXN,ALXN:UW,BBG000G32HL2,"Top Stock Reports for Oracle, Allergan & Abbott",2017-06-23 19:49:25 +0000,http://articlefeeds.nasdaq.com/~r/nasdaq/symbols/~3/z0besSxmumY/top-stock-reports-for-oracle-allergan-abbott-cm807616,Friday June 23 2017 The Zacks Research Daily presents the best research output of our analyst team Today s Research Daily features new research reports on 12 major stocks including Oracle ORCL Allergan AGN and Abbott ABT These research reports have been hand picked from
ALXN,ALXN:UW,BBG000G32HL2,Alexion Receives Positive CHMP Opinion for Soliris® (Eculizumab) for the Treatment of Patients with Refractory Generalized Myasthenia Gravis (gMG) in the European Union,2017-06-23 12:00:00 +0000,https://finance.yahoo.com/news/alexion-receives-positive-chmp-opinion-120000732.html?.tsrc=rss,"Alexion Pharmaceuticals, Inc. announced today that the Committee for Medicinal Products for Human Use of the European Medicines Agency has adopted a positive opinion to extend the current therapeutic indication for Soliris® to include the treatment of refractory generalized myasthenia gravis in patients who are anti-acetylcholine receptor antibody-positive."
ALXN,ALXN:UW,BBG000G32HL2,Alexion Pharma: CHMP Issues Positive Opinion For Soliris - Quick Facts,2017-06-23 08:08:00 +0000,http://articlefeeds.nasdaq.com/~r/nasdaq/symbols/~3/wNPF2MQ-Dtg/alexion-pharma-chmp-issues-positive-opinion-for-soliris--quick-facts-20170623-00296,Alexion Pharma: CHMP Issues Positive Opinion For Soliris - Quick Facts
ALXN,ALXN:UW,BBG000G32HL2,Bullish Two Hundred Day Moving Average Cross - ALXN,2017-06-21 22:20:49 +0000,http://articlefeeds.nasdaq.com/~r/nasdaq/symbols/~3/NPjlMPAczJ4/bullish-two-hundred-day-moving-average-cross-alxn-cm806560,In trading on Wednesday shares of Alexion Pharmaceuticals Inc Symbol ALXN crossed above their 200 day moving average of 123 03 changing hands as high as 123 72 per share Alexion Pharmaceuticals Inc shares are currently trading up about 3 8 on the day The chart below shows the one
