ALXN,ALXN:UW,BBG000G32HL2,"Pre-Market Most Active for Dec 12, 2016 :  OPHT, CHK, SDRL, AKAO, BAC, PBR, WLL, ALXN, UGP, ORIG, TVIX, QQQ",2016-12-12 13:56:30 +0000,http://articlefeeds.nasdaq.com/~r/nasdaq/symbols/~3/4hrIJvRbCZY/pre-market-most-active-for-dec-12-2016-opht-chk-sdrl-akao-bac-pbr-wll-alxn-ugp-orig-tvix-qqq-cm719936,The NASDAQ 100 Pre Market Indicator is down 9 45 to 4 886 45 The total Pre Market volume is currently 9 855 189 shares traded The following are the most active stocks for the pre market session Ophthotech Corporation OPHT is 31 86 at 6 91 with 3 374 256
ALXN,ALXN:UW,BBG000G32HL2,"Alexion Pharmaceuticals says CEO, CFO resign, shares slump",2016-12-12 13:41:00 +0000,http://finance.yahoo.com/news/alexion-pharmaceuticals-says-ceo-cfo-134100576.html,"Alexion Pharmaceuticals says CEO, CFO resign, shares slump"
ALXN,ALXN:UW,BBG000G32HL2,"Alexion Pharmaceuticals says CEO, CFO resigns",2016-12-12 12:57:02 +0000,http://finance.yahoo.com/news/alexion-pharmaceuticals-says-ceo-cfo-125702774.html,"Alexion Pharmaceuticals says CEO, CFO resigns"
ALXN,ALXN:UW,BBG000G32HL2,Alexion CEO and CFO leave company as accounting probe nears completion,2016-12-12 12:50:48 +0000,http://www.marketwatch.com/News/Story/Story.aspx?guid=EC97F8FE-F9A1-4A86-9DF1-3A7DD2BFF5DE&siteid=yhoof2,Alexion CEO and CFO leave company as accounting probe nears completion
ALXN,ALXN:UW,BBG000G32HL2,Alexion’s Board of Directors Announces New Leadership Appointments,2016-12-12 12:29:00 +0000,http://finance.yahoo.com/news/alexion-board-directors-announces-leadership-122900754.html,"[Business Wire] - The Board of Directors of Alexion Pharmaceuticals, Inc. announced today that it has named David Brennan as Interim Chief Executive Officer, effective immediately. Mr. Brennan is the former Chief Executive Officer and Executive Director of AstraZeneca PLC and has been a member of the Alexion Board of Directors since July 2014."
ALXN,ALXN:UW,BBG000G32HL2,Alexion Names New CEO and CFO -- 4th Update,2016-12-12 10:23:00 +0000,http://articlefeeds.nasdaq.com/~r/nasdaq/symbols/~3/oUS7q5_K1r0/alexion-names-new-ceo-and-cfo--4th-update-20161212-00555,Alexion Names New CEO and CFO -- 4th Update
ALXN,ALXN:UW,BBG000G32HL2,Alexion Names New CEO and CFO -- 3rd Update,2016-12-12 10:14:00 +0000,http://articlefeeds.nasdaq.com/~r/nasdaq/symbols/~3/5mnUFP2RHQM/alexion-names-new-ceo-and-cfo--3rd-update-20161212-00546,Alexion Names New CEO and CFO -- 3rd Update
ALXN,ALXN:UW,BBG000G32HL2,Alexion CEO and CFO Depart -- 2nd Update,2016-12-12 09:00:00 +0000,http://articlefeeds.nasdaq.com/~r/nasdaq/symbols/~3/sb5qZu_Z8ns/alexion-ceo-and-cfo-depart--2nd-update-20161212-00431,Alexion CEO and CFO Depart -- 2nd Update
ALXN,ALXN:UW,BBG000G32HL2,Alexion Names New CEO and CFO,2016-12-12 08:45:00 +0000,http://articlefeeds.nasdaq.com/~r/nasdaq/symbols/~3/OaIaf3jzLOQ/alexion-names-new-ceo-and-cfo-20161212-00556,Alexion Names New CEO and CFO
ALXN,ALXN:UW,BBG000G32HL2,Alexion CEO and CFO Depart,2016-12-12 08:45:00 +0000,http://articlefeeds.nasdaq.com/~r/nasdaq/symbols/~3/DJaQwCr6aE0/alexion-ceo-and-cfo-depart-20161212-00389,Alexion CEO and CFO Depart
ALXN,ALXN:UW,BBG000G32HL2,Alexion CEO and CFO Depart -- Update,2016-12-12 08:42:00 +0000,http://articlefeeds.nasdaq.com/~r/nasdaq/symbols/~3/FCs0B3gxGW4/alexion-ceo-and-cfo-depart--update-20161212-00396,Alexion CEO and CFO Depart -- Update
ALXN,ALXN:UW,BBG000G32HL2,Alexion Pharma Names David Brennan As Interim CEO; David Anderson Appointed CFO,2016-12-12 07:41:00 +0000,http://articlefeeds.nasdaq.com/~r/nasdaq/symbols/~3/EWsg0cRGL3A/alexion-pharma-names-david-brennan-as-interim-ceo-david-anderson-appointed-cfo-20161212-00244,Alexion Pharma Names David Brennan As Interim CEO; David Anderson Appointed CFO
ALXN,ALXN:UW,BBG000G32HL2,"SHAREHOLDER ALERT: Khang & Khang LLP Announces Securities Class Action Lawsuit against Alexion Pharmaceuticals, Inc. and Encourages Investors with Losses to Contact the Firm",2016-12-10 03:04:00 +0000,http://finance.yahoo.com/news/shareholder-alert-khang-khang-llp-030400068.html,"[Accesswire] - IRVINE, CA / ACCESSWIRE / December 9, 2016 / Khang & Khang LLP (the ""Firm"") announces the filing of a class action lawsuit against Alexion Pharmaceuticals, Inc. (""Alexion"" or the ""Company"") ..."
ALXN,ALXN:UW,BBG000G32HL2,"SHAREHOLDER ALERT: Pomerantz Law Firm Reminds Shareholders with Losses on their Investment in Alexion Pharmaceuticals, Inc. of Class Action Lawsuit and Upcoming Deadline - ALXN",2016-12-10 01:10:00 +0000,http://finance.yahoo.com/news/shareholder-alert-pomerantz-law-firm-011000295.html,"[Accesswire] - NEW YORK, NY / ACCESSWIRE / December 9, 2016 / Pomerantz LLP announces that a class action lawsuit has been filed against Alexion Pharmaceuticals, Inc. (""Alexion"" or the ""Company"") ..."
ALXN,ALXN:UW,BBG000G32HL2,ALXN Makes Bullish Cross Above Critical Moving Average,2016-12-09 22:56:01 +0000,http://articlefeeds.nasdaq.com/~r/nasdaq/symbols/~3/AoJYwZWovNk/alxn-makes-bullish-cross-above-critical-moving-average-cm719625,In trading on Friday shares of Alexion Pharmaceuticals Inc Symbol ALXN crossed above their 200 day moving average of 132 82 changing hands as high as 134 06 per share Alexion Pharmaceuticals Inc shares are currently trading up about 4 8 on the day The chart below shows the one
ALXN,ALXN:UW,BBG000G32HL2,"INVESTOR NOTICE: Lundin Law PC Announces Securities Class Action Lawsuit against Alexion Pharmaceuticals, Inc. Limited and Encourages Investors with Losses to Contact the Firm",2016-12-09 20:41:00 +0000,http://finance.yahoo.com/news/investor-notice-lundin-law-pc-204100807.html,"[Accesswire] - LOS ANGELES, CA / ACCESSWIRE / December 9, 2016 / Lundin Law PC , a shareholder rights firm, announces the filing of a class action lawsuit against Alexion Pharmaceuticals, Inc. (""Alexion"" or ..."
ALXN,ALXN:UW,BBG000G32HL2,"INVESTOR ALERT: Bronstein, Gewirtz & Grossman, LLC Reminds Investors of Class Action Against Alexion Pharmaceuticals, Inc. (ALXN) & Lead Plaintiff Deadline - January 17, 2017",2016-12-09 15:38:00 +0000,http://finance.yahoo.com/news/investor-alert-bronstein-gewirtz-grossman-153800239.html,"[Accesswire] - NEW YORK, NY / ACCESSWIRE / December 9, 2016 / Bronstein, Gewirtz & Grossman, LLC reminds investors that a class action lawsuit has been filed against Alexion Pharmaceuticals, Inc. (""Alexion"" ..."
ALXN,ALXN:UW,BBG000G32HL2,Why Stocks Move When Execs Cancel Presentation Appearances,2016-12-07 20:58:30 +0000,http://finance.yahoo.com/news/why-stocks-move-execs-cancel-205830009.html,Why Stocks Move When Execs Cancel Presentation Appearances
ALXN,ALXN:UW,BBG000G32HL2,"INVESTOR ALERT: Khang & Khang LLP Announces Securities Class Action Lawsuit against Alexion Pharmaceuticals, Inc. and Encourages Investors with Losses to Contact the Firm",2016-12-07 20:11:00 +0000,http://finance.yahoo.com/news/investor-alert-khang-khang-llp-201100572.html,"[Accesswire] - IRVINE, CA / ACCESSWIRE / December 7, 2016 / Khang & Khang LLP (the ""Firm"") announces the filing of a class action lawsuit against Alexion Pharmaceuticals, Inc. (""Alexion"" or the ""Company"") ..."
ALXN,ALXN:UW,BBG000G32HL2,"The Law Offices of Howard G. Smith Announces the Filing of a Securities Class Action on Behalf of Alexion Pharmaceuticals, Inc. Investors and Encourages Investors to Contact the Firm",2016-12-07 18:33:00 +0000,http://finance.yahoo.com/news/law-offices-howard-g-smith-183300141.html,"[Business Wire] - Law Offices of Howard G. Smith announces that a class action lawsuit has been filed on behalf of investors who purchased Alexion Pharmaceuticals, Inc. securities between February 10, 2014 and November 9, 2016, inclusive ."
ALXN,ALXN:UW,BBG000G32HL2,"SHAREHOLDER ALERT: Levi & Korsinsky, LLP Notifies Shareholders of Alexion Pharmaceuticals, Inc. of Commencement of a Class Action Lawsuit and a Lead Plaintiff Deadline of January 17, 2017 - ALXN",2016-12-07 16:20:00 +0000,http://finance.yahoo.com/news/shareholder-alert-levi-korsinsky-llp-162000325.html,"[Accesswire] - NEW YORK, NY / ACCESSWIRE / December 7, 2016 / The following statement is being issued by Levi & Korsinsky, LLP: To: All persons or entities who purchased or otherwise acquired securities of Alexion Pharmaceuticals, ..."
ALXN,ALXN:UW,BBG000G32HL2,Alexion Pharma To Present At The Citi Global Conference; Webcast At 11:00 AM ET,2016-12-07 10:00:00 +0000,http://articlefeeds.nasdaq.com/~r/nasdaq/symbols/~3/M5BxwLLCLGA/alexion-pharma-to-present-at-the-citi-global-conference-webcast-at-1100-am-et-20161207-00628,Alexion Pharma To Present At The Citi Global Conference; Webcast At 11:00 AM ET
ALXN,ALXN:UW,BBG000G32HL2,"SHAREHOLDER NOTICE: Lundin Law PC Announces Securities Class Action Lawsuit against Alexion Pharmaceuticals, Inc. Limited and Encourages Investors with Losses to Contact the Firm",2016-12-06 20:25:00 +0000,http://finance.yahoo.com/news/shareholder-notice-lundin-law-pc-202500058.html,"[Accesswire] - LOS ANGELES, CA / ACCESSWIRE / December 6, 2016 / Lundin Law PC , a shareholder rights firm, announces the filing of a class action lawsuit against Alexion Pharmaceuticals, Inc. (""Alexion"" or ..."
ALXN,ALXN:UW,BBG000G32HL2,"SHAREHOLDER ALERT - Bronstein, Gewirtz & Grossman, LLC Reminds Investors of Class Action Against Alexion Pharmaceuticals, Inc. (ALXN) & Lead Plaintiff Deadline - January 17, 2017",2016-12-06 16:47:00 +0000,http://finance.yahoo.com/news/shareholder-alert-bronstein-gewirtz-grossman-164700019.html,"[Accesswire] - NEW YORK, NY / ACCESSWIRE / December 6, 2016 / Bronstein, Gewirtz & Grossman, LLC reminds investors that a class action lawsuit has been filed against Alexion Pharmaceuticals, Inc. (""Alexion"" ..."
ALXN,ALXN:UW,BBG000G32HL2,"SHAREHOLDER ALERT: Khang & Khang LLP Announces Securities Class Action Lawsuit against Alexion Pharmaceuticals, Inc. and Encourages Investors with Losses to Contact the Firm",2016-12-06 16:21:00 +0000,http://finance.yahoo.com/news/shareholder-alert-khang-khang-llp-162100233.html,"[Accesswire] - IRVINE, CA / ACCESSWIRE / December 6, 2016 / Khang & Khang LLP (the ""Firm"") announces the filing of a class action lawsuit against Alexion Pharmaceuticals, Inc. (""Alexion"" or the ""Company"") ..."
ALXN,ALXN:UW,BBG000G32HL2,"SHAREHOLDER ALERT - Bronstein, Gewirtz & Grossman, LLC Reminds Investors of Class Action Against Alexion Pharmaceuticals, Inc. (ALXN) and Lead Plaintiff Deadline: January 17, 2017",2016-12-06 15:07:00 +0000,http://finance.yahoo.com/news/shareholder-alert-bronstein-gewirtz-grossman-150700247.html,"[Accesswire] - NEW YORK, NY / ACCESSWIRE / December 6, 2016 / Bronstein, Gewirtz & Grossman, LLC reminds investors that a class action lawsuit has been filed against Alexion Pharmaceuticals, Inc. (""Alexion"" ..."
ALXN,ALXN:UW,BBG000G32HL2,"INVESTOR NOTICE: Lundin Law PC Announces Securities Class Action Lawsuit against Alexion Pharmaceuticals, Inc. Limited and Encourages Investors with Losses to Contact the Firm",2016-12-05 21:35:00 +0000,http://finance.yahoo.com/news/investor-notice-lundin-law-pc-213500182.html,"[Accesswire] - LOS ANGELES, CA / ACCESSWIRE / December 5, 2016 / Lundin Law PC , a shareholder rights firm, announces the filing of a class action lawsuit against Alexion Pharmaceuticals, Inc. (""Alexion"" or ..."
ALXN,ALXN:UW,BBG000G32HL2,"INVESTOR ALERT - Bronstein, Gewirtz & Grossman, LLC Reminds Investors of Class Action Against Alexion Pharmaceuticals, Inc. (ALXN) & Lead Plaintiff Deadline - January 17, 2017",2016-12-05 17:32:00 +0000,http://finance.yahoo.com/news/investor-alert-bronstein-gewirtz-grossman-173200627.html,"[Accesswire] - NEW YORK, NY / ACCESSWIRE / December 5, 2016 / Bronstein, Gewirtz & Grossman, LLC reminds investors that a class action lawsuit has been filed against Alexion Pharmaceuticals, Inc. (""Alexion"" ..."
ALXN,ALXN:UW,BBG000G32HL2,Alexion Presents Data from Ultra-Rare Blood Disorder Study,2016-12-05 14:05:02 +0000,http://finance.yahoo.com/news/alexion-presents-data-ultra-rare-140502739.html,Alexion Presents Data from Ultra-Rare Blood Disorder Study
ALXN,ALXN:UW,BBG000G32HL2,New Data from ALXN1210 Dose-Escalation Study Presented at ASH Show Rapid and Sustained Reductions in LDH in Patients with Paroxysmal Nocturnal Hemoglobinuria (PNH),2016-12-04 17:00:00 +0000,http://finance.yahoo.com/news/data-alxn1210-dose-escalation-study-170000673.html,"[Business Wire] - Alexion Pharmaceuticals, Inc. announced today that new data from an ongoing Phase 1/2 dose-escalation study of ALXN1210 in patients with paroxysmal nocturnal hemoglobinuria showed rapid and sustained reductions in lactate dehydrogenase , a direct marker of hemolysis , in patients treated with once-monthly dosing."
ALXN,ALXN:UW,BBG000G32HL2,"INVESTOR ALERT: Khang & Khang LLP Announces Securities Class Action Lawsuit against Alexion Pharmaceuticals, Inc. and Encourages Investors with Losses to Contact the Firm",2016-12-03 02:48:00 +0000,http://finance.yahoo.com/news/investor-alert-khang-khang-llp-024800340.html,"[Accesswire] - IRVINE, CA / ACCESSWIRE / December 2, 2016 / Khang & Khang LLP (the ""Firm"") announces the filing of a class action lawsuit against Alexion Pharmaceuticals, Inc. (""Alexion"" or the ""Company"") ..."
ALXN,ALXN:UW,BBG000G32HL2,"SHAREHOLDER ALERT: Pomerantz Law Firm Reminds Shareholders with Losses on their Investment in Alexion Pharmaceuticals, Inc. of Class Action Lawsuit and Upcoming Deadline – ALXN",2016-12-03 01:00:00 +0000,http://finance.yahoo.com/news/shareholder-alert-pomerantz-law-firm-010000104.html,"[GlobeNewswire] - NEW YORK, Dec. 02, 2016-- Pomerantz LLP announces that a class action lawsuit has been filed against Alexion Pharmaceuticals, Inc. and certain of its officers. The class action, filed in United States ..."
ALXN,ALXN:UW,BBG000G32HL2,"SHAREHOLDER NOTICE: Lundin Law PC Announces Securities Class Action Lawsuit against Alexion Pharmaceuticals, Inc. Limited and Encourages Investors with Losses to Contact the Firm",2016-12-01 20:11:00 +0000,http://finance.yahoo.com/news/shareholder-notice-lundin-law-pc-201100838.html,"[Accesswire] - LOS ANGELES, CA / ACCESSWIRE / December 1, 2016 / Lundin Law PC , a shareholder rights firm, announces the filing of a class action lawsuit against Alexion Pharmaceuticals, Inc. (""Alexion"" or ..."
ALXN,ALXN:UW,BBG000G32HL2,"Is Alexion Pharmaceuticals, Inc. (ALXN) a Good Stock To Buy?",2016-12-01 19:03:49 +0000,http://www.insidermonkey.com/blog/is-alexion-pharmaceuticals-inc-alxn-a-good-stock-to-buy-2-490851/,"Is Alexion Pharmaceuticals, Inc. (ALXN) a Good Stock To Buy?"
ALXN,ALXN:UW,BBG000G32HL2,"Lifshitz & Miller Law Firm Announces Investigation of Alexion Pharmaceuticals, Inc., Blue Nile, Inc., Hill International, Inc., InfuSystem Holdings Inc., Rent-A-Center, Inc., Treehouse Foods, Inc. and Viking Investments Group, Inc.",2016-12-01 16:45:00 +0000,http://finance.yahoo.com/news/lifshitz-miller-law-firm-announces-164500760.html,"[PR Newswire] - NEW YORK, Dec.1, 2016 /PRNewswire/ -- Alexion Pharmaceuticals, Inc. (ALXN) Lifshitz & Miller announces investigation on behalf of ALXN investors concerning whether ALXN violated federal securities laws ..."
ALXN,ALXN:UW,BBG000G32HL2,"ETFs with exposure to Alexion Pharmaceuticals, Inc. : December 1, 2016",2016-12-01 15:46:52 +0000,http://www.capitalcube.com/blog/index.php/etfs-with-exposure-to-alexion-pharmaceuticals-inc-december-1-2016/,"ETFs with exposure to Alexion Pharmaceuticals, Inc. : December 1, 2016"
ALXN,ALXN:UW,BBG000G32HL2,"SHAREHOLDER ALERT: Khang & Khang LLP Announces Securities Class Action Lawsuit against Alexion Pharmaceuticals, Inc. and Encourages Investors with Losses to Contact the Firm",2016-11-30 20:40:00 +0000,http://finance.yahoo.com/news/shareholder-alert-khang-khang-llp-204000144.html,"[Accesswire] - IRVINE, CA / ACCESSWIRE / November 30, 2016 / Khang & Khang LLP (the ""Firm"") announces the filing of a class action lawsuit against Alexion Pharmaceuticals, Inc. (""Alexion"" or the ""Company"") ..."
ALXN,ALXN:UW,BBG000G32HL2,"INVESTOR ALERT: Levi & Korsinsky, LLP Notifies Shareholders of Alexion Pharmaceuticals, Inc. of a Class Action Lawsuit and a Lead Plaintiff Deadline of January 17, 2017 -- ALXN",2016-11-30 17:12:23 +0000,http://finance.yahoo.com/news/investor-alert-levi-korsinsky-llp-171223376.html,"[Marketwired] - The following statement is being issued by Levi & Korsinsky, LLP: To: All persons or entities who purchased or otherwise acquired securities of Alexion Pharmaceuticals, Inc. between February 10, 2014......"
ALXN,ALXN:UW,BBG000G32HL2,"Alexion Pharmaceuticals, Inc. breached its 50 day moving average in a Bullish Manner : ALXN-US : November 30, 2016",2016-11-30 12:13:05 +0000,http://www.capitalcube.com/blog/index.php/alexion-pharmaceuticals-inc-breached-its-50-day-moving-average-in-a-bullish-manner-alxn-us-november-30-2016/,"Alexion Pharmaceuticals, Inc. breached its 50 day moving average in a Bullish Manner : ALXN-US : November 30, 2016"
ALXN,ALXN:UW,BBG000G32HL2,"U.S. Stocks Edge Higher, Led by Health-Care Gains",2016-11-30 05:10:38 +0000,http://www.wsj.com/articles/stocks-pressured-by-commodity-prices-1480408410?ru=yahoo?mod=yahoo_itp,"U.S. Stocks Edge Higher, Led by Health-Care Gains"
ALXN,ALXN:UW,BBG000G32HL2,"Why Thor Industries, Alexion Pharmaceuticals, and Berry Plastics Jumped Today",2016-11-29 23:54:19 +0000,http://articlefeeds.nasdaq.com/~r/nasdaq/symbols/~3/UDJ7_f68Q4Y/why-thor-industries-alexion-pharmaceuticals-and-berry-plastics-jumped-today-cm715414,Tuesday was a solid day for the stock market as major market benchmarks regained a bit of their lost ground from yesterday s session Within the stock market crosscurrents hit various sectors A drop in oil hurt many energy companies but strength in the healthcare industry helped
ALXN,ALXN:UW,BBG000G32HL2,"Why Thor Industries, Alexion Pharmaceuticals, and Berry Plastics Jumped Today",2016-11-29 22:19:05 +0000,http://www.fool.com/investing/2016/11/29/why-thor-industries-alexion-pharmaceuticals-and-be.aspx?source=yahoo-2&utm_campaign=article&utm_medium=feed&utm_source=yahoo-2,"Why Thor Industries, Alexion Pharmaceuticals, and Berry Plastics Jumped Today"
ALXN,ALXN:UW,BBG000G32HL2,"Market Close Report: NASDAQ Composite index closes at 5,379.92 up 11.11 points",2016-11-29 21:48:58 +0000,http://articlefeeds.nasdaq.com/~r/nasdaq/symbols/~3/Sqs3dVptu4s/market-close-report-nasdaq-composite-index-closes-at-537992-up-1111-points-cm715368,Tuesday s session closes with the NASDAQ Composite Index at 5 379 92 The total shares traded for the NASDAQ was over 1 78 billion Declining stocks led advancers by 1 05 to 1 ratio There were 1395 advancers and 1459 decliners for the day On the NASDAQ Stock Exchange 74 stocks reached a 52
ALXN,ALXN:UW,BBG000G32HL2,The Hot Stock: Alexion Pharmaceuticals Jumps 5.2%,2016-11-29 21:15:00 +0000,http://blogs.barrons.com/stockstowatchtoday/2016/11/29/the-hot-stock-alexion-pharmaceuticals-jumps-5-2/?mod=yahoobarrons&ru=yahoo,The Hot Stock: Alexion Pharmaceuticals Jumps 5.2%
ALXN,ALXN:UW,BBG000G32HL2,Mid-Day Market Update: U.S. Stocks Turn Higher; Nivalis Therapeutics Shares Tumble After Failed Drug Trial,2016-11-29 18:17:59 +0000,http://articlefeeds.nasdaq.com/~r/nasdaq/symbols/~3/5CzkObvrE_4/mid-day-market-update-us-stocks-turn-higher-nivalis-therapeutics-shares-tumble-after-failed-drug-trial-cm715265,Midway through trading Tuesday the Dow traded up 0 15 percent to 19 126 46 while the NASDAQ climbed 0 62 percent to 5 401 98 The S amp P also rose gaining 0 32 percent to 2 208 67 Leading and Lagging Sectors On Tuesday healthcare shares gained by 0 58 percent Meanwhile
ALXN,ALXN:UW,BBG000G32HL2,Healthcare Stocks Help Nasdaq Reach New Heights,2016-11-29 17:31:00 +0000,https://www.thestreet.com/story/13907958/1/healthcare-stocks-help-nasdaq-reach-new-heights.html?puc=yahoo&cm_ven=YAHOO,Healthcare Stocks Help Nasdaq Reach New Heights
ALXN,ALXN:UW,BBG000G32HL2,Stocks Subdued by Lower Commodities Prices,2016-11-29 16:31:50 +0000,http://www.wsj.com/articles/stocks-pressured-by-commodity-prices-1480408410?mod=yahoo_hs,Stocks Subdued by Lower Commodities Prices
ALXN,ALXN:UW,BBG000G32HL2,"INVESTOR NOTICE: Lundin Law PC Announces Securities Class Action Lawsuit against Alexion Pharmaceuticals, Inc. Limited and Encourages Investors with Losses to Contact the Firm",2016-11-29 15:57:00 +0000,http://finance.yahoo.com/news/investor-notice-lundin-law-pc-155700439.html,"[Accesswire] - LOS ANGELES, CA / ACCESSWIRE / November 29, 2016 / Lundin Law PC , a shareholder rights firm, announces the filing of a class action lawsuit against Alexion Pharmaceuticals, Inc. (""Alexion"" or ..."
ALXN,ALXN:UW,BBG000G32HL2,"SHAREHOLDER ALERT - Bronstein, Gewirtz & Grossman, LLC Notifies Investors of Class Action Against Alexion Pharmaceuticals, Inc. (ALXN) and Lead Plaintiff Deadline: January 17, 2017",2016-11-29 15:04:00 +0000,http://finance.yahoo.com/news/shareholder-alert-bronstein-gewirtz-grossman-150400868.html,"[Accesswire] - NEW YORK, NY / ACCESSWIRE / November 29, 2016 / Bronstein, Gewirtz & Grossman, LLC notifies investors that a class action lawsuit has been filed against Alexion Pharmaceuticals, Inc. (""Alexion"" ..."
ALXN,ALXN:UW,BBG000G32HL2,Alexion to Present at the Citi 2016 Global Healthcare Conference,2016-11-29 15:00:00 +0000,http://finance.yahoo.com/news/alexion-present-citi-2016-global-150000406.html,"[Business Wire] - Alexion Pharmaceuticals, Inc. today announced that management will present at the Citi 2016 Global Healthcare Conference on Wednesday, December 7, 2016 at 11:00 a.m., Eastern Time."
ALXN,ALXN:UW,BBG000G32HL2,"Lawsuit for Investors in Alexion Pharmaceuticals, Inc. (NASDAQ:ALXN) shares announced by Shareholders Foundation",2016-11-29 14:45:00 +0000,http://finance.yahoo.com/news/lawsuit-investors-alexion-pharmaceuticals-inc-144500434.html,"[GlobeNewswire] - SAN DIEGO, Nov. 29, 2016-- The Shareholders Foundation, Inc. announces that a lawsuit was filed in New York on behalf of certain purchasers of shares of Alexion Pharmaceuticals, Inc. over alleged Securities ..."
ALXN,ALXN:UW,BBG000G32HL2,"Analysts' Actions -- Goldman Sachs, Johnson & Johnson, Pfizer and More",2016-11-29 13:16:00 +0000,http://finance.yahoo.com/news/analysts-actions-goldman-sachs-johnson-131600699.html,"Analysts' Actions -- Goldman Sachs, Johnson & Johnson, Pfizer and More"
ALXN,ALXN:UW,BBG000G32HL2,Stocks Subdued by Lower Commodities Prices,2016-11-29 04:15:00 +0000,http://articlefeeds.nasdaq.com/~r/nasdaq/symbols/~3/CDfpL_imP_A/stocks-subdued-by-lower-commodities-prices-20161129-00225,Stocks Subdued by Lower Commodities Prices
ALXN,ALXN:UW,BBG000G32HL2,U.S. Stocks Edge Higher,2016-11-29 04:15:00 +0000,http://articlefeeds.nasdaq.com/~r/nasdaq/symbols/~3/Q1JqbSj5Qc4/us-stocks-edge-higher-20161129-00864,U.S. Stocks Edge Higher
ALXN,ALXN:UW,BBG000G32HL2,"INVESTOR ALERT: Khang & Khang LLP Announces Securities Class Action Lawsuit against Alexion Pharmaceuticals, Inc. and Encourages Investors with Losses to Contact the Firm",2016-11-28 18:58:00 +0000,http://finance.yahoo.com/news/investor-alert-khang-khang-llp-185800170.html,"[Accesswire] - IRVINE, CA / ACCESSWIRE / November 28, 2016 / Khang & Khang LLP (the ""Firm"") announces the filing of a class action lawsuit against Alexion Pharmaceuticals, Inc. (""Alexion"" or the ""Company"") ..."
ALXN,ALXN:UW,BBG000G32HL2,"SHAREHOLDER ALERT: Brower Piven Notifies Investors of Class Action Lawsuit And Encourages Those Who Have Losses In Excess Of $100,000 From Investment In Alexion Pharmaceuticals, Inc. To Contact Brower Piven Before The Lead Plaintiff Deadlin",2016-11-27 11:00:00 +0000,http://finance.yahoo.com/news/shareholder-alert-brower-piven-notifies-110000299.html,"[GlobeNewswire] - STEVENSON, Md., Nov. 27, 2016-- The securities litigation law firm of Brower Piven, A Professional Corporation, announces that a class action lawsuit has been commenced in the United States District Court ..."
ALXN,ALXN:UW,BBG000G32HL2,Should You Buy General Growth Properties Inc (GGP)?,2016-11-27 02:34:56 +0000,http://www.insidermonkey.com/blog/should-you-buy-general-growth-properties-inc-ggp-492725/,Should You Buy General Growth Properties Inc (GGP)?
ALXN,ALXN:UW,BBG000G32HL2,"SHAREHOLDER ALERT: Pomerantz Law Firm Reminds Shareholders with Losses on their Investment in Alexion Pharmaceuticals, Inc. of Class Action Lawsuit and Upcoming Deadline - ALXN",2016-11-26 01:00:00 +0000,http://finance.yahoo.com/news/shareholder-alert-pomerantz-law-firm-010000474.html,"[PR Newswire] - NEW YORK, Nov. 25, 2016 /PRNewswire/ -- Pomerantz LLP announces that a class action lawsuit has been filed against Alexion Pharmaceuticals, Inc. (""Alexion"" or the ""Company"")(NASDAQ: ALXN) and certain of its officers. The class action, filed in United States District Court, Southern District of New York, and docketed under 16-cv-08946, is on behalf of a class consisting of all persons or entities who purchased or otherwise acquired Alexion between February 10, 2014 and November 9, 2016, both dates inclusive (the ""Class Period""), seeking to recover compensable damages caused by Defendants' violations of the federal securities laws and to pursue remedies under Sections 10(b) and 20(a) of the Securities Exchange Act of 1934 (the ""Exchange Act"") and Rule 10b-5 promulgated thereunder. If you are a shareholder who purchased Alexion during the Class Period, you have until January 17, 2017 to ask the Court to appoint you as Lead Plaintiff for the class. A copy of the Complaint can be obtained at www.pomerantzlaw.com. To discuss this action, contact Robert S. Willoughby at rswilloughby@pomlaw.com or 888.476.6529 (or 888.4-POMLAW), toll free, ext."
