ARRY,ARRY:US,BBG000C52TW3,"Zacks Investment Ideas feature highlights: Array BioPharma, BHP Billition, MSC Industrial Direct, Rio Tinto and Vantiv",2017-01-16 14:30:02 +0000,http://finance.yahoo.com/news/zacks-investment-ideas-feature-highlights-143002661.html,"Zacks Investment Ideas feature highlights: Array BioPharma, BHP Billition, MSC Industrial Direct, Rio Tinto and Vantiv"
ARRY,ARRY:US,BBG000C52TW3,Array BioPharma (ARRY) Jumps: Stock Adds 7.5% in Session,2017-01-16 13:30:01 +0000,http://finance.yahoo.com/news/array-biopharma-arry-jumps-stock-133001445.html,Array BioPharma (ARRY) Jumps: Stock Adds 7.5% in Session
ARRY,ARRY:US,BBG000C52TW3,Nasdaq Hits New High as Dow Jones Industrial Average Lags,2017-01-13 22:37:09 +0000,http://articlefeeds.nasdaq.com/~r/nasdaq/symbols/~3/W1bOhTje7M0/nasdaq-hits-new-high-as-dow-jones-industrial-average-lags-cm733522,Bank stocks boosted the broader stock market following well received earnings reports but it wasn t enough to keep the 160 Dow Jones Industrial Average DJIA afloat In fact the Dow erased its midday gains putting the 20 000 mark further in the rearview mirror ahead of the long
ARRY,ARRY:US,BBG000C52TW3,Mid-Afternoon Market Update: Dow Turns Negative; Sanchez Energy Shares Spike Higher,2017-01-13 20:56:35 +0000,http://articlefeeds.nasdaq.com/~r/nasdaq/symbols/~3/-GwORAWhxyY/mid-afternoon-market-update-dow-turns-negative-sanchez-energy-shares-spike-higher-cm733497,Toward the end of trading Friday the Dow traded down 0 13 percent to 19 864 29 while the NASDAQ climbed 0 48 percent to 5 573 96 The S amp P also rose gaining 0 13 percent to 2 273 27 Leading and Lagging Sectors Healthcare shares gained around 0 43 percent in trading on
ARRY,ARRY:US,BBG000C52TW3,"Friday's ETF Movers: XBI, GDXJ",2017-01-13 19:37:37 +0000,http://articlefeeds.nasdaq.com/~r/nasdaq/symbols/~3/GMOI-mdCAYA/fridays-etf-movers-xbi-gdxj-cm733435,In trading on Friday the SPDR S amp P Biotech ETF XBI is outperforming other ETFs up about 1 9 on the day Components of that ETF showing particular strength include shares of Amicus Therapeutics FOLD up about 9 8 and shares of Array Biopharma ARRY up about 8 8 on the
ARRY,ARRY:US,BBG000C52TW3,Array BioPharma To Present At J.P. Morgan Conference ; Webcast At 11:30 AM ET,2017-01-11 10:31:00 +0000,http://articlefeeds.nasdaq.com/~r/nasdaq/symbols/~3/Ixp1BXc86wk/array-biopharma-to-present-at-jp-morgan-conference--webcast-at-1130-am-et-20170111-00527,Array BioPharma To Present At J.P. Morgan Conference ; Webcast At 11:30 AM ET
ARRY,ARRY:US,BBG000C52TW3,"After ARIAD's Acquisition, These 3 Cancer Drug Stocks Could Be Next",2017-01-10 18:52:46 +0000,http://articlefeeds.nasdaq.com/~r/nasdaq/symbols/~3/E305Mk4Dbx0/after-ariads-acquisition-these-3-cancer-drug-stocks-could-be-next-cm731788,Japanese drugmaker Takeda Pharmaceutical Company NASDAQOTH TKPYY 160 announced yesterday that it s acquiring ARIAD Pharmaceuticals NASDAQ ARIA 160 for 24 per share or 5 2 billion The deal removes yet another commercial stage cancer drugmaker from the market and
ARRY,ARRY:US,BBG000C52TW3,"After ARIAD's Acquisition, These 3 Cancer Drug Stocks Could Be Next",2017-01-10 17:21:07 +0000,http://www.fool.com/investing/2017/01/10/3-cancer-stocks-that-could-be-next-to-get-acquired.aspx?source=yahoo-2&utm_campaign=article&utm_medium=feed&utm_source=yahoo-2,"After ARIAD's Acquisition, These 3 Cancer Drug Stocks Could Be Next"
ARRY,ARRY:US,BBG000C52TW3,Why Array BioPharma Inc Stock Surged 108.3% in 2016,2017-01-09 16:52:48 +0000,http://articlefeeds.nasdaq.com/~r/nasdaq/symbols/~3/DBxrRSFI7Nc/why-array-biopharma-inc-stock-surged-1083-in-2016-cm731078,Image source Getty Images What happened Cancer focused Array Biopharma Inc NASDAQ ARRY delighted investors with a stellar 108 3 gain last year according to data from S amp P Global Market Intelligence Positive developments for its late stage drug development
ARRY,ARRY:US,BBG000C52TW3,Why Array BioPharma Inc Stock Surged 108.3% in 2016,2017-01-09 15:26:24 +0000,http://www.fool.com/investing/2017/01/09/why-array-biopharma-inc-stock-surged-1083-in-2016.aspx?source=yahoo-2&utm_campaign=article&utm_medium=feed&utm_source=yahoo-2,Why Array BioPharma Inc Stock Surged 108.3% in 2016
ARRY,ARRY:US,BBG000C52TW3,Array BioPharma To Present At The Annual J.P. Morgan Healthcare Conference,2017-01-03 14:00:00 +0000,http://finance.yahoo.com/news/array-biopharma-present-annual-j-140000544.html,"[PR Newswire] - BOULDER, Colo., Jan. 3, 2017 /PRNewswire/ -- Array BioPharma Inc. (Nasdaq: ARRY) today announced that its Chief Executive Officer, Ron Squarer, will speak at the Annual J.P. Morgan Healthcare Conference ..."
ARRY,ARRY:US,BBG000C52TW3,"ARRAY BIOPHARMA INC Files SEC form 8-K, Entry into a Material Definitive Agreement, Termination of a Material Definit",2016-12-23 21:04:22 +0000,http://biz.yahoo.com/e/161223/arry8-k.html,"ARRAY BIOPHARMA INC Files SEC form 8-K, Entry into a Material Definitive Agreement, Termination of a Material Definit"
ARRY,ARRY:US,BBG000C52TW3,"Commit To Purchase Array BioPharma At $4, Earn 13.8% Using Options",2016-12-22 17:58:07 +0000,http://articlefeeds.nasdaq.com/~r/nasdaq/symbols/~3/uZeKd4krc4Q/commit-to-purchase-array-biopharma-at-4-earn-138-using-options-cm725221,Investors considering a purchase of Array BioPharma Inc Symbol ARRY shares but tentative about paying the going market price of 8 60 share might benefit from considering selling puts among the alternative strategies at their disposal One interesting put contract in particular is
ARRY,ARRY:US,BBG000C52TW3,Is Array Biopharma Inc (ARRY) A Good Stock To Buy?,2016-12-11 14:39:34 +0000,http://www.insidermonkey.com/blog/is-array-biopharma-inc-arry-a-good-stock-to-buy-2-500391/,Is Array Biopharma Inc (ARRY) A Good Stock To Buy?
ARRY,ARRY:US,BBG000C52TW3,Why Array BioPharma Rose 32.5% in November,2016-12-03 20:33:56 +0000,http://www.fool.com/investing/2016/12/03/why-array-biopharma-rose-32-in-november.aspx?source=yahoo-2&utm_campaign=article&utm_medium=feed&utm_source=yahoo-2,Why Array BioPharma Rose 32.5% in November
ARRY,ARRY:US,BBG000C52TW3,Array BioPharma To Present At The Piper Jaffray Annual Healthcare Conference,2016-11-22 15:00:00 +0000,http://finance.yahoo.com/news/array-biopharma-present-piper-jaffray-150000212.html,"[PR Newswire] - BOULDER, Colo., Nov. 22, 2016 /PRNewswire/ -- Array BioPharma Inc. (Nasdaq: ARRY) today announced that its Chief Executive Officer, Ron Squarer, will speak at the Piper Jaffray Annual Healthcare conference. The ..."
ARRY,ARRY:US,BBG000C52TW3,Trade of the Day: Array BioPharma (NASDAQ:ARRY),2016-11-17 16:53:22 +0000,http://articlefeeds.nasdaq.com/~r/nasdaq/symbols/~3/R0OmZOxxvFY/trade-of-the-day-array-biopharma-nasdaqarry-cm710648,InvestorPlace InvestorPlace Stock Market News Stock Advice amp Trading Tips Shares of Array BioPharma 160 NASDAQ ARRY could be on the move today as CEO Ron Squarer is speaking at the Jefferies 2016 Global Healthcare Conference with talking
ARRY,ARRY:US,BBG000C52TW3,"Is Redmile Group Right to Bet on Array Biopharma Inc (ARRY), Amicus Therapeutics, Inc. (FOLD) & Two Other Stocks?",2016-11-15 17:27:29 +0000,http://www.insidermonkey.com/blog/is-redmile-group-right-to-bet-on-array-biopharma-inc-arry-amicus-therapeutics-inc-fold-two-other-stocks-487363/,"Is Redmile Group Right to Bet on Array Biopharma Inc (ARRY), Amicus Therapeutics, Inc. (FOLD) & Two Other Stocks?"
ARRY,ARRY:US,BBG000C52TW3,Array BioPharma To Present At Stifel Healthcare Conferences; Webcast At 10:15 AM,2016-11-15 09:15:00 +0000,http://articlefeeds.nasdaq.com/~r/nasdaq/symbols/~3/MXUofsWGwag/array-biopharma-to-present-at-stifel-healthcare-conferences-webcast-at-1015-am-20161115-00726,Array BioPharma To Present At Stifel Healthcare Conferences; Webcast At 10:15 AM
ARRY,ARRY:US,BBG000C52TW3,Array Biopharma Inc (ARRY) Updates On COLUMBUS Phase 3 And It’s Impressive,2016-11-10 16:07:49 +0000,http://www.insidermonkey.com/blog/array-biopharma-inc-arry-updates-on-columbus-phase-3-and-its-impressive-486778/,Array Biopharma Inc (ARRY) Updates On COLUMBUS Phase 3 And It’s Impressive
ARRY,ARRY:US,BBG000C52TW3,Array Biopharma Inc (ARRY) Stock: Gaining Big On Clinical Data,2016-11-10 08:06:24 +0000,http://www.insidermonkey.com/blog/array-biopharma-inc-arry-stock-gaining-big-on-clinical-data-486368/,Array Biopharma Inc (ARRY) Stock: Gaining Big On Clinical Data
ARRY,ARRY:US,BBG000C52TW3,The Market Offers Some Opportunities but They're Disappearing Fast,2016-11-09 15:19:00 +0000,http://realmoney.thestreet.com/articles/11/09/2016/market-offers-some-opportunities-theyre-disappearing-fast?puc=yahoo&cm_ven=YAHOO,The Market Offers Some Opportunities but They're Disappearing Fast
ARRY,ARRY:US,BBG000C52TW3,"ARRAY BIOPHARMA INC Files SEC form 8-K, Other Events, Financial Statements and Exhibits",2016-11-09 15:17:46 +0000,http://biz.yahoo.com/e/161109/arry8-k.html,"ARRAY BIOPHARMA INC Files SEC form 8-K, Other Events, Financial Statements and Exhibits"
ARRY,ARRY:US,BBG000C52TW3,COLUMBUS Phase 3 Study Results in BRAF-Mutant Melanoma Presented at Society for Melanoma Research Annual Congress,2016-11-09 15:00:00 +0000,http://finance.yahoo.com/news/columbus-phase-3-study-results-150000489.html,"[PR Newswire] - BOULDER, Colo., and CASTRES, France, Nov. 9, 2016 /PRNewswire/ -- Array BioPharma (Nasdaq: ARRY) and Pierre Fabre today jointly announced new results from the pivotal Phase 3 COLUMBUS trial of binimetinib ..."
ARRY,ARRY:US,BBG000C52TW3,Array BioPharma To Present At The Stifel 2016 Healthcare And Jefferies 2016 Global Healthcare Conferences,2016-11-08 19:00:00 +0000,http://finance.yahoo.com/news/array-biopharma-present-stifel-2016-190000266.html,"[PR Newswire] - BOULDER, Colo., Nov. 8, 2016 /PRNewswire/ -- Array BioPharma Inc. (Nasdaq: ARRY) today announced that its Chief Executive Officer, Ron Squarer, will speak at the following upcoming conferences. The public ..."
ARRY,ARRY:US,BBG000C52TW3,7 Analyst Stocks Under $10 for Massive Upside Projections,2016-11-06 15:15:56 +0000,http://247wallst.com/investing/2016/11/06/7-analyst-stocks-under-10-for-massive-upside-projections/,7 Analyst Stocks Under $10 for Massive Upside Projections
ARRY,ARRY:US,BBG000C52TW3,"Top Analyst Upgrades and Downgrades: Agrium, Array BioPharma, Encana, GoPro, 3D Systems and More",2016-11-04 12:50:37 +0000,http://247wallst.com/investing/2016/11/04/top-analyst-upgrades-and-downgrades-agrium-array-biopharma-encana-gopro-3d-systems-and-more/,"Top Analyst Upgrades and Downgrades: Agrium, Array BioPharma, Encana, GoPro, 3D Systems and More"
ARRY,ARRY:US,BBG000C52TW3,"ARRAY BIOPHARMA INC Files SEC form 10-Q, Quarterly Report",2016-11-03 12:38:37 +0000,http://biz.yahoo.com/e/161103/arry10-q.html,"ARRAY BIOPHARMA INC Files SEC form 10-Q, Quarterly Report"
ARRY,ARRY:US,BBG000C52TW3,Edited Transcript of ARRY earnings conference call or presentation 1-Nov-16 1:00pm GMT,2016-11-01 20:01:52 +0000,http://finance.yahoo.com/news/edited-transcript-arry-earnings-conference-200152498.html,Edited Transcript of ARRY earnings conference call or presentation 1-Nov-16 1:00pm GMT
ARRY,ARRY:US,BBG000C52TW3,Array Biopharma Inc Earnings Call scheduled for 9:00 am ET today,2016-11-01 13:00:00 +0000,http://biz.yahoo.com/cc/1/154511.html,Array Biopharma Inc Earnings Call scheduled for 9:00 am ET today
ARRY,ARRY:US,BBG000C52TW3,Array BioPharma reports 1Q loss,2016-11-01 12:30:51 +0000,http://sg.finance.yahoo.com/news/array-biopharma-reports-1q-loss-123051594.html,Array BioPharma reports 1Q loss
ARRY,ARRY:US,BBG000C52TW3,Array BioPharma Reports Financial Results For The First Quarter Of Fiscal 2017,2016-11-01 12:14:53 +0000,http://www.publicnow.com/view/0333C90FCEA98D7E118C4E86032B00CD4E4B0D3B,"[at noodls] - BOULDER, Colo., Nov. 1, 2016 /PRNewswire/ -- Array BioPharma Inc. (Nasdaq: ARRY), a biopharmaceutical company focused on the discovery, development and commercialization of targeted small molecule cancer ..."
ARRY,ARRY:US,BBG000C52TW3,"ARRAY BIOPHARMA INC Files SEC form 8-K, Results of Operations and Financial Condition, Financial Statements and Exhib",2016-11-01 12:03:17 +0000,http://biz.yahoo.com/e/161101/arry8-k.html,"ARRAY BIOPHARMA INC Files SEC form 8-K, Results of Operations and Financial Condition, Financial Statements and Exhib"
ARRY,ARRY:US,BBG000C52TW3,Q1 2017 Array Biopharma Inc Earnings Release - Before Market Open,2016-11-01 11:07:06 +0000,http://biz.yahoo.com/research/earncal/20161101.html?t=arry,Q1 2017 Array Biopharma Inc Earnings Release - Before Market Open
ARRY,ARRY:US,BBG000C52TW3,Array BioPharma Q1 17 Earnings Conference Call At 9:00 AM ET,2016-11-01 08:00:00 +0000,http://articlefeeds.nasdaq.com/~r/nasdaq/symbols/~3/amJx-_ttlG4/array-biopharma-q1-17-earnings-conference-call-at-900-am-et-20161101-01692,Array BioPharma Q1 17 Earnings Conference Call At 9:00 AM ET
ARRY,ARRY:US,BBG000C52TW3,"Take a Chill Pill: If Clinton Wins, Drug-Price Controls Aren't Guaranteed",2016-10-31 18:09:00 +0000,http://realmoney.thestreet.com/articles/10/31/2016/take-chill-pill-if-clinton-wins-drug-price-controls-arent-guaranteed?puc=yahoo&cm_ven=YAHOO,"Take a Chill Pill: If Clinton Wins, Drug-Price Controls Aren't Guaranteed"
ARRY,ARRY:US,BBG000C52TW3,"Research Reports on Biotech Equities -- Mast Therapeutics, Array BioPharma, Galena Biopharma, and Clovis Oncology",2016-10-31 15:08:00 +0000,http://finance.yahoo.com/news/research-reports-biotech-equities-mast-150800017.html,"[PR Newswire] - Growing concerns that a victory by Democratic nominee Hillary Clinton in the presidential election will result in tighter regulations on pricing for new drugs, continues to disturb the Biotechnology arena, which has already tanked 15.53% this year, as per Investopedia data. Today, Stock-Callers.com reviews the performances of Mast Therapeutics Inc. (NYSE MKT: MSTX), Array BioPharma Inc. (ARRY), Galena Biopharma Inc. (GALE), and Clovis Oncology Inc. (CLVS) to see how they have fared over the last few trading sessions. Shares in California headquartered Mast Therapeutics Inc. ended Friday's session flat at $0.08 with a total trading volume of 2.78 million shares. Shares of the Company, which develops therapies for serious or life-threatening diseases with significant unmet needs, have a Relative Strength Index (RSI) of 32.10."
ARRY,ARRY:US,BBG000C52TW3,Array BioPharma And Pierre Fabre To Present Phase 3 COLUMBUS Trial At Society For Melanoma Research Annual Congress,2016-10-25 20:31:00 +0000,http://finance.yahoo.com/news/array-biopharma-pierre-fabre-present-203100437.html,"[PR Newswire] - BOULDER, Colo., and CASTRES, France, Oct. 25, 2016 /PRNewswire/ -- Array BioPharma (NASDAQ: ARRY) and Pierre Fabre announced today that results from the Phase 3 COLUMBUS trial of binimetinib and encorafenib ..."
ARRY,ARRY:US,BBG000C52TW3,"Array BioPharma To Report Financial Results For The First Quarter Of Fiscal 2017 On November 1, 2016",2016-10-25 15:25:01 +0000,http://www.publicnow.com/view/0129FFDFD487D0FB1F2F71D97328524356DEBE0F,"[at noodls] - BOULDER, Colo., Oct. 25, 2016 /PRNewswire/ -- Array BioPharma Inc. (Nasdaq: ARRY) will report financial results for the first quarter of fiscal 2017 and hold a conference call to discuss those results ..."
ARRY,ARRY:US,BBG000C52TW3,Array BioPharma (ARRY) is in Overbought Territory: What's Next?,2016-10-14 16:43:37 +0000,http://articlefeeds.nasdaq.com/~r/nasdaq/symbols/~3/Y35FzUA1oHE/array-biopharma-arry-is-in-overbought-territory-whats-next-cm693531,Array BioPharma Inc ARRY has moved higher as of late but there could definitely be trouble on the horizon for this company That is because ARRY is now in overbought territory with an RSI value of 72 03 What is RSI 160 160 160 160 160 160 RSI stands for Relative
ARRY,ARRY:US,BBG000C52TW3,Array BioPharma (ARRY) is in Overbought Territory: What's Next?,2016-10-14 14:10:02 +0000,http://finance.yahoo.com/news/array-biopharma-arry-overbought-territory-141002020.html,Array BioPharma (ARRY) is in Overbought Territory: What's Next?
ARRY,ARRY:US,BBG000C52TW3,"ETF’s with exposure to Array BioPharma, Inc. : October 11, 2016",2016-10-11 14:05:20 +0000,http://www.capitalcube.com/blog/index.php/etfs-with-exposure-to-array-biopharma-inc-october-11-2016/,"ETF’s with exposure to Array BioPharma, Inc. : October 11, 2016"
ARRY,ARRY:US,BBG000C52TW3,Why Array BioPharma Skyrocketed 91% in September,2016-10-10 17:19:57 +0000,http://articlefeeds.nasdaq.com/~r/nasdaq/symbols/~3/HkkL6aAl2ww/why-array-biopharma-skyrocketed-91-in-september-cm691183,Image source Getty Images What happened After reporting that the FDA has accepted its application for approval of binimetinib and delivering positive trial results from a study of binimetinib and encorafenib combination therapy shares in Array BioPharma NASDAQ
ARRY,ARRY:US,BBG000C52TW3,Why Array BioPharma Skyrocketed 91% in September,2016-10-10 15:21:06 +0000,http://www.fool.com/investing/2016/10/10/why-array-biopharma-skyrocketed-91-in-september.aspx?source=yahoo-2&utm_campaign=article&utm_medium=feed&utm_source=yahoo-2,Why Array BioPharma Skyrocketed 91% in September
ARRY,ARRY:US,BBG000C52TW3,3 Cancer Drugs That Could Get an FDA OK Next Year,2016-10-09 16:20:44 +0000,http://articlefeeds.nasdaq.com/~r/nasdaq/symbols/~3/PW6HQYKqJMg/3-cancer-drugs-that-could-get-an-fda-ok-next-year-cm690778,Image source Getty Images Significant spending on cancer research and development could be about to pay off for Clovis Oncology NASDAQ CLVS Array BioPharma NASDAQ ARRY and Ariad Pharmaceuticals NASDAQ ARIA All three of these companies are preparing for
ARRY,ARRY:US,BBG000C52TW3,3 Cancer Drugs That Could Get an FDA OK Next Year,2016-10-09 15:13:33 +0000,http://www.fool.com/investing/2016/10/09/3-cancer-drugs-that-could-get-a-fda-ok-next-year.aspx?source=yahoo-2&utm_campaign=article&utm_medium=feed&utm_source=yahoo-2,3 Cancer Drugs That Could Get an FDA OK Next Year
ARRY,ARRY:US,BBG000C52TW3,6 Best Performing Drug Stocks of September,2016-10-03 14:47:16 +0000,http://articlefeeds.nasdaq.com/~r/nasdaq/symbols/~3/5jt2X9_U-eY/6-best-performing-drug-stocks-of-september-cm687686,Pharma and biotech stocks have been under a lot of pressure over the last few quarters with the NYSE ARCA Pharmaceutical Index and the NASDAQ Biotechnology index declining 4 1 and 11 7 respectively so far in 2016 Factors like the drug pricing controversy and a changing competitive
ARRY,ARRY:US,BBG000C52TW3,Array BioPharma Announces Closing of Public Offering and Full Exercise of Option to Purchase Additional Shares,2016-10-03 14:36:02 +0000,http://www.publicnow.com/view/62BDC19FCCC55306256AA5A9938DFE21F1729EC5,"[at noodls] - BOULDER, Colo., Oct. 3, 2016 /PRNewswire/ -- Array BioPharma Inc. (NasdaqGM: ARRY) announced today the closing of its underwritten public offering of 21,160,000 shares of its common stock, which includes ..."
ARRY,ARRY:US,BBG000C52TW3,6 Best Performing Drug Stocks of September,2016-10-03 12:39:12 +0000,http://finance.yahoo.com/news/6-best-performing-drug-stocks-123912721.html,6 Best Performing Drug Stocks of September
ARRY,ARRY:US,BBG000C52TW3,Top 6 Biopharma Gainers of the Past Week,2016-10-02 14:05:42 +0000,http://247wallst.com/healthcare-business/2016/10/02/top-6-biopharma-gainers-of-the-past-week/,Top 6 Biopharma Gainers of the Past Week
ARRY,ARRY:US,BBG000C52TW3,5 Top Performing Stocks of the Best ETF of Q3,2016-09-30 15:24:59 +0000,http://articlefeeds.nasdaq.com/~r/nasdaq/symbols/~3/1i38wrWT5co/5-top-performing-stocks-of-the-best-etf-of-q3-cm687111,After a huge sell off at the start of the year the biotech sector has made a strong comeback with BioShares Biotechnology Clinical Trials Fund BBC topping the list of the best performing ETFs of 3Q16 The fund delivered impressive returns of about 29 6 in the quarter and has a Zacks ETF Rank
ARRY,ARRY:US,BBG000C52TW3,Array Announces $100M Public Offering (ARRY),2016-09-30 03:12:00 +0000,http://www.investopedia.com/news/array-announces-100m-public-offering-arry/?partner=YahooSA,Array Announces $100M Public Offering (ARRY)
ARRY,ARRY:US,BBG000C52TW3,Array BioPharma Reports Positive Results (ARRY),2016-09-28 21:55:00 +0000,http://www.investopedia.com/news/array-biopharma-reports-positive-results-arry/?partner=YahooSA,Array BioPharma Reports Positive Results (ARRY)
ARRY,ARRY:US,BBG000C52TW3,"ARRAY BIOPHARMA INC Files SEC form 8-K, Entry into a Material Definitive Agreement, Other Events, Financial Statement",2016-09-28 20:50:37 +0000,http://biz.yahoo.com/e/160928/arry8-k.html,"ARRAY BIOPHARMA INC Files SEC form 8-K, Entry into a Material Definitive Agreement, Other Events, Financial Statement"
ARRY,ARRY:US,BBG000C52TW3,"Why Wells Fargo, Select Comfort, Array Biopharma, American Express, and More Are Trending",2016-09-28 13:59:03 +0000,http://www.insidermonkey.com/blog/why-wells-fargo-select-comfort-array-biopharma-american-express-and-more-are-trending-477278/,"Why Wells Fargo, Select Comfort, Array Biopharma, American Express, and More Are Trending"
ARRY,ARRY:US,BBG000C52TW3,"Pre-Market Most Active for Sep 28, 2016 :  GXP, ARRY, SNY, LN, BBRY, DB, SEED, TWTR, COTY, QQQ, AAPL, SRPT",2016-09-28 12:51:09 +0000,http://articlefeeds.nasdaq.com/~r/nasdaq/symbols/~3/umHCRPi5m0A/pre-market-most-active-for-sep-28-2016-gxp-arry-sny-ln-bbry-db-seed-twtr-coty-qqq-aapl-srpt-cm685782,The NASDAQ 100 Pre Market Indicator is up 3 14 to 4 869 85 The total Pre Market volume is currently 8 329 979 shares traded The following are the most active stocks for the pre market session Great Plains Energy Inc GXP is 0 35 at 26 81 with 3 177 250 shares
ARRY,ARRY:US,BBG000C52TW3,Array BioPharma Announces Pricing of Public Offering of Common Stock,2016-09-28 01:39:07 +0000,http://www.publicnow.com/view/BE401854E6031C76E0372672777F650778B222FB,"[at noodls] - BOULDER, Colo., Sept. 27, 2016 /PRNewswire/ -- Array BioPharma Inc. (Nasdaq: ARRY) announced today the pricing of an underwritten public offering of 18,400,000 shares of its common stock at a public offering ..."
ARRY,ARRY:US,BBG000C52TW3,3 Reasons to Buy Array Biopharma,2016-09-28 00:21:24 +0000,http://articlefeeds.nasdaq.com/~r/nasdaq/symbols/~3/ovgCRTDeCuU/3-reasons-to-buy-array-biopharma-cm685701,Image source Array BioPharma Array BioPharma Inc NASDAQ ARRY shares are soaring recently following a slate of good news Is there more room left to run Read on to find out why I think if management delivers on these three catalysts this stock can trade higher No
ARRY,ARRY:US,BBG000C52TW3,3 Reasons to Buy Array Biopharma,2016-09-27 22:20:00 +0000,http://www.fool.com/investing/2016/09/27/3-reasons-to-buy-array-biopharma.aspx?source=yahoo-2&utm_campaign=article&utm_medium=feed&utm_source=yahoo-2,3 Reasons to Buy Array Biopharma
ARRY,ARRY:US,BBG000C52TW3,Array BioPharma Prices Offering Of 18.40 Mln Shares At $6.25/shr,2016-09-27 21:38:00 +0000,http://articlefeeds.nasdaq.com/~r/nasdaq/symbols/~3/jq5e_h_Ug0w/array-biopharma-prices-offering-of-1840-mln-shares-at-625shr-20160927-00758,Array BioPharma Prices Offering Of 18.40 Mln Shares At $6.25/shr
ARRY,ARRY:US,BBG000C52TW3,Array BioPharma Announces Proposed Public Offering of Common Stock,2016-09-27 20:39:05 +0000,http://www.publicnow.com/view/4105EDA1E1D46C9C4977887EE8E826AD41CE8D5C,"[at noodls] - BOULDER, Colo., Sept. 27, 2016 /PRNewswire/ -- Array BioPharma (Nasdaq: ARRY) today announced that it has commenced an underwritten public offering of $100 million of shares of its common stock. Array ..."
ARRY,ARRY:US,BBG000C52TW3,"ProNAi Therapeutics Inc. (DNAI), Ballard Power Systems Inc. (USA) (BLDP) & More: Major Hype Surrounding These Stocks Today",2016-09-27 18:01:25 +0000,http://www.insidermonkey.com/blog/pronai-therapeutics-inc-dnai-ballard-power-systems-inc-usa-bldp-more-major-hype-surrounding-these-stocks-today-477197/,"ProNAi Therapeutics Inc. (DNAI), Ballard Power Systems Inc. (USA) (BLDP) & More: Major Hype Surrounding These Stocks Today"
ARRY,ARRY:US,BBG000C52TW3,2 Longs And 2 Shorts to Watch,2016-09-27 17:00:16 +0000,http://articlefeeds.nasdaq.com/~r/nasdaq/symbols/~3/oH4cfiLHY6k/2-longs-and-2-shorts-to-watch-cm685486,"Array BioPharma Inc. ( ARRY ) had an explosive move on Monday, up $2.96, or 81%, to $6.61, on 101 million shares.  The company said its melanoma treatment met its primary goal in a late-stage trial.  Afterhours the stock was trading even higher, and looks like it has more room to run.  There's key resistance between"
ARRY,ARRY:US,BBG000C52TW3,"Array BioPharma (ARRY) Stock Up, JPMorgan Raises Price Target on Drug Success",2016-09-27 16:50:00 +0000,https://www.thestreet.com/story/13753677/1/array-biopharma-arry-stock-up-jpmorgan-raises-price-target-on-drug-success.html?puc=yahoo&cm_ven=YAHOO,"Array BioPharma (ARRY) Stock Up, JPMorgan Raises Price Target on Drug Success"
ARRY,ARRY:US,BBG000C52TW3,"Momentum Carries Lululemon Lower, Pushes Biotech Names Higher",2016-09-27 15:49:00 +0000,http://www.forbes.com/sites/greatspeculations/2016/09/27/momentum-carries-lululemon-lower-pushes-biotech-names-higher/?utm_source=yahoo&utm_medium=partner&utm_campaign=yahootix&partner=yahootix,"Momentum Carries Lululemon Lower, Pushes Biotech Names Higher"
ARRY,ARRY:US,BBG000C52TW3,Array (ARRY) Hits 52-Week High on Positive Phase III Data,2016-09-27 15:24:10 +0000,http://articlefeeds.nasdaq.com/~r/nasdaq/symbols/~3/fAmlk8KAmqk/array-arry-hits-52-week-high-on-positive-phase-iii-data-cm685278,Array BioPharma Inc ARRY along with its partner Pierre Fabre announced positive top line data from part 1 of the phase III study COLUMBUS on a combination of encorafenib BRAF inhibitor and binimetinib MEK inhibitor for the treatment of BRAF mutant advanced unresectable or
