ARRY,ARRY:US,BBG000C52TW3,"Array BioPharma, Bristol-Myers Squibb to collaborate on cancer drug research",2017-05-30 20:14:25 +0000,http://finance.yahoo.com/r/eafc7427-b9a0-372f-a20d-db941a725516/array-biopharma-bristol-myers-squibb-to.html?ana=yahoo&yptr=yahoo&.tsrc=rss,"Array BioPharma and pharmaceutical giant Bristol-Myers Squibb will test the effectiveness of Array’s drug binimetinib in combination with a Bristol-Myers’ immunotherapy drug as a treatment for some kinds of colorectal cancer.  The research partnership, announced Tuesday, is the second announced this month by Boulder-based Array BioPharma Inc. (ARRY) for testing binimetinib as part of a treatment for colorectal cancer cases with metastatic tumors.  The new pact with New York City-based Bristol-Myers Squibb will have both companies supporting early-phase clinical trials testing binimetinib in combination with Bristol-Myers cancer drug Opdivo and added as a third drug used in combination with Opdivo and Yervoy."
ARRY,ARRY:US,BBG000C52TW3,Biotech Movers: Array Shares Rise on Bristol-Myers Collaboration,2017-05-30 13:29:00 +0000,http://finance.yahoo.com/r/b29d834b-7687-35ad-88dd-539b3df20949/biotech-movers-array-shares-rise-on-bristol-myers-collaboration.html?puc=yahoo&cm_ven=YAHOO&yptr=yahoo&.tsrc=rss,"Array BioPharma, Advaxis, Merrimack Pharmaceuticals and Insys Therapeutics were among the biotech stock movers in premarket trading on Tuesday."
ARRY,ARRY:US,BBG000C52TW3,"Pre-Market Most Active for May 30, 2017 :  NOK, ORAN, NVO, ATW, NVDA, F, NE, PSDV, TVIX, ARRY, CCN, VOD",2017-05-30 13:00:48 +0000,http://articlefeeds.nasdaq.com/~r/nasdaq/symbols/~3/-nHGGOUze6w/pre-market-most-active-for-may-30-2017-nok-oran-nvo-atw-nvda-f-ne-psdv-tvix-arry-ccn-vod-cm796024,The NASDAQ 100 Pre Market Indicator is down 2 67 to 5 785 69 The total Pre Market volume is currently 5 605 637 shares traded The following are the most active stocks for the pre market session Nokia Corporation NOK is 0 1 at 6 28 with 1 557 823 shares traded
ARRY,ARRY:US,BBG000C52TW3,Array BioPharma and Bristol-Myers Squibb Announce Strategic Collaboration,2017-05-30 10:59:00 +0000,https://finance.yahoo.com/news/array-biopharma-bristol-myers-squibb-105900638.html?.tsrc=rss,"BOULDER, Colo. and NEW YORK, May 30, 2017 /PRNewswire/ --  Array BioPharma (Nasdaq: ARRY) and Bristol-Myers Squibb Company (NYSE:BMY) today announced the companies have entered into a clinical research ..."
ARRY,ARRY:US,BBG000C52TW3,How Two Biotechs Fell On Cancer Partnerships With Bristol-Myers,2017-05-30 09:17:00 +0000,http://finance.yahoo.com/r/8f0075c4-8c0e-3b53-abc6-099ece5296bc/how-these-biotechs-split-on-cancer-partnerships-with-bristol-myers?src=A00220&yptr=yahoo&.tsrc=rss,Array and Advaxis shares tumbled more than 3% in action Tuesday after the firms announced partnerships with Bristol.
ARRY,ARRY:US,BBG000C52TW3,"Array BioPharma, Bristol-Myers Squibb Announce Strategic Collaboration",2017-05-30 07:15:00 +0000,http://articlefeeds.nasdaq.com/~r/nasdaq/symbols/~3/AsazgK3NuVg/array-biopharma-bristolmyers-squibb-announce-strategic-collaboration-20170530-00298,"Array BioPharma, Bristol-Myers Squibb Announce Strategic Collaboration"
ARRY,ARRY:US,BBG000C52TW3,"After Hours Most Active for May 18, 2017 :  ETE, EPD, BX, BAC, MPLX, ODP, NGL, QQQ, FB, AMAT, INTC, ARRY",2017-05-18 21:01:23 +0000,http://articlefeeds.nasdaq.com/~r/nasdaq/symbols/~3/npzLtdakn3k/after-hours-most-active-for-may-18-2017-ete-epd-bx-bac-mplx-odp-ngl-qqq-fb-amat-intc-arry-cm791565,The NASDAQ 100 After Hours Indicator is up 4 95 to 5 631 26 The total After hours volume is currently 49 368 094 shares traded The following are the most active stocks for the after hours session Energy Transfer Equity L P ETE is 0 0256 at 18 00 with 5 273
ARRY,ARRY:US,BBG000C52TW3,Blog Coverage: Mirna Announced Reverse Merger Agreement,2017-05-17 12:15:00 +0000,https://finance.yahoo.com/news/blog-coverage-mirna-announced-reverse-121500772.html?.tsrc=rss,"Upcoming AWS Coverage on Array BioPharma Post-Earnings Results LONDON, UK / ACCESSWIRE / May 17, 2017 / Active Wall St. blog coverage looks at the headline from Mirna Therapeutics Inc. (NASDAQ: MIRN ) ..."
ARRY,ARRY:US,BBG000C52TW3,Edited Transcript of ARRY earnings conference call or presentation 10-May-17 1:00pm GMT,2017-05-16 21:30:59 +0000,https://finance.yahoo.com/news/edited-transcript-arry-earnings-conference-123613074.html?.tsrc=rss,Q3 2017 Array Biopharma Inc Earnings Call
ARRY,ARRY:US,BBG000C52TW3,Today's Research Reports on Stocks to Watch: Array Biopharma and Verastem,2017-05-11 12:00:00 +0000,http://finance.yahoo.com/news/todays-research-reports-stocks-watch-120000278.html?.tsrc=rss,"NEW YORK, NY / ACCESSWIRE / May 11, 2017 / U.S. markets were relatively quiet Wednesday as investors analyzed the latest batch of corporate earnings. Additionally, President Trump on Wednesday announced ..."
ARRY,ARRY:US,BBG000C52TW3,"Gainers & Losers Of May 10: CUR, TEAR, PRTO, CXRX, DERM...",2017-05-10 22:51:00 +0000,http://articlefeeds.nasdaq.com/~r/nasdaq/symbols/~3/VoFUIUbQ_DM/gainers--losers-of-may-10-cur-tear-prto-cxrx-derm-20170510-01922,"Gainers & Losers Of May 10: CUR, TEAR, PRTO, CXRX, DERM..."
ARRY,ARRY:US,BBG000C52TW3,"Health Care Sector Update for 05/10/2017: ARRY,MTBC,CXRX",2017-05-10 20:40:38 +0000,http://articlefeeds.nasdaq.com/~r/nasdaq/symbols/~3/8xEN1ropxkY/health-care-sector-update-for-05102017-arrymtbccxrx-cm787497,Top Health Care StocksTop Health Care Stocks JNJ 0 32 JNJ 0 32 PFE 0 09 PFE 0 09 ABT 0 41 ABT 0 41 MRK 0 98 MRK 0 98 AMGN 1 68 AMGN 1 68 Health care stocks were mostly lower today with shares of health care companies in the S amp P 500 losing less than 0 3 in value although
ARRY,ARRY:US,BBG000C52TW3,Here's Why the Market's Overlooking Array Biopharma Inc.'s Earnings Miss Today,2017-05-10 19:04:25 +0000,http://articlefeeds.nasdaq.com/~r/nasdaq/symbols/~3/logbT26aSdQ/heres-why-the-markets-overlooking-array-biopharma-incs-earnings-miss-today-cm787408,What happened Shares of Array Biopharma Inc NASDAQ ARRY a biotech with several new drug candidates in late development stages is surging after the release of clinical trial results along with an earnings report Despite slight misses on the top and bottom lines at 11 a m
ARRY,ARRY:US,BBG000C52TW3,"Array Biopharma Sees Positive Study Results From COLUMBUS Phase 2, But Commercialization May Prove Daunting",2017-05-10 17:12:13 +0000,http://finance.yahoo.com/news/array-biopharma-sees-positive-study-171213701.html?.tsrc=rss,"Following Array Biopharma Inc (NASDAQ: ARRY ) reporting positive top line results from part 2 of a late-stage study of its combo treatment candidate for metastatic and BRAF-mutant melanoma, Leerink thinks ..."
ARRY,ARRY:US,BBG000C52TW3,Mid-Day Market Update: Crude Oil Down 3%; Proteon Therapeutics Shares Spike Higher,2017-05-10 17:10:27 +0000,http://articlefeeds.nasdaq.com/~r/nasdaq/symbols/~3/A6v_hCvbD4U/mid-day-market-update-crude-oil-down-3-proteon-therapeutics-shares-spike-higher-cm787357,Midway through trading Wednesday the Dow traded down 0 08 percent to 20 959 85 while the NASDAQ declined 0 12 percent to 6 113 15 The S amp P also rose gaining 0 02 percent to 2 397 31 Leading and Lagging Sectors Energy sector was the top gainer in the US market on Wednesday
ARRY,ARRY:US,BBG000C52TW3,Here&apos;s Why the Market&apos;s Overlooking Array Biopharma Inc.&apos;s Earnings Miss Today,2017-05-10 17:00:00 +0000,http://finance.yahoo.com/r/a629a994-d16f-304d-a8a2-5260b5ecf8af/heres-why-the-markets-overlooking-array-biopharma.aspx?yptr=yahoo&.tsrc=rss,"Array Biopharma&apos;s financial results get the back seat today, while clinical-trial results ride shotgun."
ARRY,ARRY:US,BBG000C52TW3,Mid-Morning Market Update: Markets Open Lower; NVIDIA Beats Q1 Estimates,2017-05-10 15:40:26 +0000,http://articlefeeds.nasdaq.com/~r/nasdaq/symbols/~3/MgcyHOG8EGI/mid-morning-market-update-markets-open-lower-nvidia-beats-q1-estimates-cm787273,Following the market opening Wednesday the Dow traded down 0 21 percent to 20 931 08 while the NASDAQ declined 0 08 percent to 6 115 92 The S amp P also fell dropping 0 04 percent to 2 395 87 Leading and Lagging Sectors Energy sector was the top gainer in the US market
ARRY,ARRY:US,BBG000C52TW3,"Pre-Market Most Active for May 10, 2017 :  WSTC, NVDA, AUO, YELP, MYL, ANF, MT, OPK, SKX, AAPL, INN, ARRY",2017-05-10 13:01:00 +0000,http://articlefeeds.nasdaq.com/~r/nasdaq/symbols/~3/Uo9lhulF7D4/pre-market-most-active-for-may-10-2017-wstc-nvda-auo-yelp-myl-anf-mt-opk-skx-aapl-inn-arry-cm787015,The NASDAQ 100 Pre Market Indicator is up 2 74 to 5 681 05 The total Pre Market volume is currently 9 197 629 shares traded The following are the most active stocks for the pre market session West Corporation WSTC is 0 98 at 23 13 with 4 579 964 shares traded
ARRY,ARRY:US,BBG000C52TW3,Investor Network: Array BioPharma Inc. to Host Earnings Call,2017-05-10 12:30:00 +0000,http://finance.yahoo.com/news/investor-network-array-biopharma-inc-123000740.html?.tsrc=rss,"NEW YORK, NY / ACCESSWIRE / May 10, 2017 / Array BioPharma Inc. (NASDAQ: ARRY ) will be discussing their earnings results in their Q3 Earnings Call to be held May 10, 2017 at 9:00 AM Eastern Time. To listen ..."
ARRY,ARRY:US,BBG000C52TW3,Array BioPharma reports 3Q loss,2017-05-10 12:14:30 +0000,http://finance.yahoo.com/news/array-biopharma-reports-3q-loss-121430223.html?.tsrc=rss,"The Boulder, Colorado-based company said it had a loss of 21 cents per share. The results did not meet Wall Street expectations. The average estimate of eight analysts surveyed by Zacks Investment Research ..."
ARRY,ARRY:US,BBG000C52TW3,Array BioPharma Reports Financial Results For The Third Quarter Of Fiscal 2017,2017-05-10 12:00:00 +0000,http://finance.yahoo.com/news/array-biopharma-reports-financial-results-120000686.html?.tsrc=rss,"BOULDER, Colo., May 10, 2017 /PRNewswire/ -- COLUMBUS / BRAF-mutant melanoma Part 2 demonstrates positive results and New Drug Application (NDA) filing on track for June or July 2017 New Binimetinib / ..."
ARRY,ARRY:US,BBG000C52TW3,"ARRY Hits Trial Goals, DEPO Falls On Q1 Results, SAGE Awaits Data In Q3",2017-05-10 01:58:00 +0000,http://articlefeeds.nasdaq.com/~r/nasdaq/symbols/~3/Zfgxi_f0tJk/arry-hits-trial-goals-depo-falls-on-q1-results-sage-awaits-data-in-q3-20170510-00077,"ARRY Hits Trial Goals, DEPO Falls On Q1 Results, SAGE Awaits Data In Q3"
ARRY,ARRY:US,BBG000C52TW3,Array BioPharma Announces Positive Top-Line Results from Part 2 of the Phase 3 COLUMBUS Study of Binimetinib and Encorafenib for BRAF-Mutant Melanoma,2017-05-09 20:01:00 +0000,http://finance.yahoo.com/news/array-biopharma-announces-positive-top-200100947.html?.tsrc=rss,"BOULDER, Colo., May 9, 2017 /PRNewswire/ -- Array BioPharma (Nasdaq: ARRY) today announced top-line results from Part 2 of the Phase 3 COLUMBUS study evaluating binimetinib, a MEK inhibitor, and encorafenib, ..."
ARRY,ARRY:US,BBG000C52TW3,Array BioPharma Announces Strategic Collaboration with Merck,2017-05-08 12:00:00 +0000,http://finance.yahoo.com/news/array-biopharma-announces-strategic-collaboration-120000006.html?.tsrc=rss,"BOULDER, Colo., May 8, 2017 /PRNewswire/ -- Array BioPharma Inc. (ARRY) announced today that it has entered into a clinical trial collaboration agreement with Merck (known as MSD outside the United States and Canada) to investigate the safety and efficacy of Array's MEK inhibitor, binimetinib, with Merck's anti-PD-1 therapy, KEYTRUDA® (pembrolizumab), in metastatic colorectal cancer patients with microsatellite stable tumors (MSS CRC)."
ARRY,ARRY:US,BBG000C52TW3,Array BioPharma To Collaborate With Merck To Study Binimetinib & Keytruda,2017-05-08 08:21:00 +0000,http://articlefeeds.nasdaq.com/~r/nasdaq/symbols/~3/KoPaFWPCj3Y/array-biopharma-to-collaborate-with-merck-to-study-binimetinib--keytruda-20170508-00583,Array BioPharma To Collaborate With Merck To Study Binimetinib & Keytruda
ARRY,ARRY:US,BBG000C52TW3,"Biotech Movers: Myriad Genetics, Spectrum Pharmaceuticals, Array BioPharma",2017-05-03 14:09:00 +0000,http://finance.yahoo.com/r/d9fdad7d-97e7-373c-ab5a-b92f887243b5/biotech-movers-myriad-genetics-spectrum-pharmaceuticals-array-biopharma.html?puc=yahoo&cm_ven=YAHOO&yptr=yahoo&.tsrc=rss,"Myriad Genetics, Spectrum Pharmaceuticals and Array BioPharma were among the biotech stock movers in early trading on Wednesday."
ARRY,ARRY:US,BBG000C52TW3,"Array Biopharma To Report Financial Results For The Third Quarter Of Fiscal 2017 On May 10, 2017",2017-05-03 12:00:00 +0000,http://finance.yahoo.com/news/array-biopharma-report-financial-results-120000693.html?.tsrc=rss,"BOULDER, Colo., May 3, 2017 /PRNewswire/ -- Array BioPharma Inc. (Nasdaq:  ARRY) will report financial results for the third quarter of fiscal 2017 and hold a conference call to discuss those results on ..."
ARRY,ARRY:US,BBG000C52TW3,Array BioPharma Breaks Below 200-Day Moving Average - Notable for ARRY,2017-05-02 22:26:10 +0000,http://articlefeeds.nasdaq.com/~r/nasdaq/symbols/~3/rSCb-I7lOiE/array-biopharma-breaks-below-200-day-moving-average-notable-for-arry-cm783072,In trading on Tuesday shares of Array BioPharma Inc Symbol ARRY crossed below their 200 day moving average of 7 49 changing hands as low as 7 08 per share Array BioPharma Inc shares are currently trading down about 16 on the day The chart below shows the one year performance of
ARRY,ARRY:US,BBG000C52TW3,"After Hours Most Active for May 2, 2017 :  TWLO, AAPL, V, GE, OCLR, BMY, NBL, INTC, MSFT, SYF, ARRY, MU",2017-05-02 20:56:07 +0000,http://articlefeeds.nasdaq.com/~r/nasdaq/symbols/~3/Z10_laMuoEQ/after-hours-most-active-for-may-2-2017-twlo-aapl-v-ge-oclr-bmy-nbl-intc-msft-syf-arry-mu-cm783059,The NASDAQ 100 After Hours Indicator is down 14 98 to 5 629 09 The total After hours volume is currently 41 884 707 shares traded The following are the most active stocks for the after hours session Twilio Inc TWLO is 10 06 at 23 88 with 3 312 317 shares
ARRY,ARRY:US,BBG000C52TW3,Shalini Sharp Joins Array BioPharma Board of Directors,2017-04-27 18:00:00 +0000,http://finance.yahoo.com/news/shalini-sharp-joins-array-biopharma-180000236.html?.tsrc=rss,"BOULDER, Colo., April 27, 2017 /PRNewswire/ -- Array BioPharma Inc. (ARRY) today announced that Shalini Sharp, Chief Financial Officer and Executive Vice President of Ultragenyx Pharmaceutical Inc., joined the company's Board of Directors, effective April 27, 2017.  Ms. Sharp has served as Chief Financial Officer of Ultragenyx, a biopharmaceutical company focused on rare diseases, since 2012, where she is responsible for leading the corporate finance, strategy, and information technology functions and is a member of the company's executive leadership team.  Ms. Sharp brings nearly 20 years of experience in the life sciences industry."
ARRY,ARRY:US,BBG000C52TW3,Array BioPharma Enters Oversold Territory (ARRY),2017-04-21 22:02:34 +0000,http://articlefeeds.nasdaq.com/~r/nasdaq/symbols/~3/6dS3S5rJGn4/array-biopharma-enters-oversold-territory-arry-cm777362,Legendary investor Warren Buffett advises to be fearful when others are greedy and be greedy when others are fearful One way we can try to measure the level of fear in a given stock is through a technical analysis indicator called the Relative Strength Index or RSI which measures momentum on
ARRY,ARRY:US,BBG000C52TW3,"If You Don't Buy These 5 Stocks Before Their Looming Breakout, It's Your Loss",2017-04-20 22:22:00 +0000,http://finance.yahoo.com/r/244447e3-f947-3080-ad66-4a11cd405378/trading-5-hot-charts-set-to-break-out-soon-for-profit.html?puc=yahoo&cm_ven=YAHOO&yptr=yahoo&.tsrc=rss,Here's how to potentially rake in some fat profits off a number of hot breakout setups.
ARRY,ARRY:US,BBG000C52TW3,"After Hours Most Active for Apr 19, 2017 :  GE, EBAY, LC, PFE, SWNC, GIMO, QCOM, WLL, ARRY, YHOO, MSFT, CMCSA",2017-04-19 21:02:47 +0000,http://articlefeeds.nasdaq.com/~r/nasdaq/symbols/~3/qaUNlOpPGII/after-hours-most-active-for-apr-19-2017-ge-ebay-lc-pfe-swnc-gimo-qcom-wll-arry-yhoo-msft-cmcsa-cm776117,The NASDAQ 100 After Hours Indicator is up 2 62 to 5 402 26 The total After hours volume is currently 28 682 345 shares traded The following are the most active stocks for the after hours session General Electric Company GE is unchanged at 30 00 with 1 569 108
ARRY,ARRY:US,BBG000C52TW3,Today's Research Reports on Biotech Stocks to Watch: Array Biopharma and ImmunoGen,2017-04-17 11:30:00 +0000,http://finance.yahoo.com/news/todays-research-reports-biotech-stocks-113000670.html?.tsrc=rss,"NEW YORK, NY / ACCESSWIRE / April 17, 2017 / The Biotech Industry has continued to provide solid gains for investors in 2017, despite all the negative attention the industry has received due to drug pricing ..."
ARRY,ARRY:US,BBG000C52TW3,Do Options Traders Know Something About Array BioPharma (ARRY) Stock We Don't?,2017-04-07 14:58:40 +0000,http://articlefeeds.nasdaq.com/~r/nasdaq/symbols/~3/vtiyw0ij8E0/do-options-traders-know-something-about-array-biopharma-arry-stock-we-dont-cm771286,Investors in Array BioPharma Inc ARRY need to pay close attention to the stock based on moves in the options market lately That is because the April 21 st 2017 13 Put had some of the highest implied volatility of all equity options today What is Implied Volatility Implied
ARRY,ARRY:US,BBG000C52TW3,Do Options Traders Know Something About Array BioPharma (ARRY) Stock We Don&apos;t?,2017-04-07 12:48:12 +0000,http://finance.yahoo.com/news/options-traders-know-something-array-124812386.html?.tsrc=rss,Investors in Array BioPharma Inc. (ARRY) need to pay close attention to the stock based on moves in the options market lately.
ARRY,ARRY:US,BBG000C52TW3,Oversold Conditions For Array BioPharma (ARRY),2017-03-29 18:00:21 +0000,http://articlefeeds.nasdaq.com/~r/nasdaq/symbols/~3/WLHPOoTr4xA/oversold-conditions-for-array-biopharma-arry-cm767355,Legendary investor Warren Buffett advises to be fearful when others are greedy and be greedy when others are fearful One way we can try to measure the level of fear in a given stock is through a technical analysis indicator called the Relative Strength Index or RSI which measures momentum on
ARRY,ARRY:US,BBG000C52TW3,Array BioPharma's NDA for Cancer Drug Withdrawn; Shares Down,2017-03-22 16:10:42 +0000,http://articlefeeds.nasdaq.com/~r/nasdaq/symbols/~3/WqNeqUhC1IU/array-biopharmas-nda-for-cancer-drug-withdrawn-shares-down-cm764107,Shares of Array BioPharma Inc ARRY slipped 2 30 after the company announced that it has withdrawn its new drug application NDA for its pipeline candidate binimetinib from the FDA s Division of Oncology Products 2 The candidate was being evaluated as a monotherapy for the treatment
ARRY,ARRY:US,BBG000C52TW3,Will Array Biopharma's Melanoma Drugs Keep the Stock Soaring?,2017-03-22 15:08:05 +0000,http://articlefeeds.nasdaq.com/~r/nasdaq/symbols/~3/bTcOXFQCIcQ/will-array-biopharmas-melanoma-drugs-keep-the-stock-soaring-cm764036,Success in trials of new drugs for metastatic melanoma propelled the stock of Array Biopharma NASDAQ ARRY 115 in 2016 However after a string of successes Array hit a setback earlier this week It withdrew its first ever new drug application Fortunately there s more to
ARRY,ARRY:US,BBG000C52TW3,"Biotech Stock Roundup: Amgen Down on Repatha Data, Nektar Surges on Pain Results",2017-03-22 14:09:32 +0000,http://articlefeeds.nasdaq.com/~r/nasdaq/symbols/~3/veBMJx2G_Gg/biotech-stock-roundup-amgen-down-on-repatha-data-nektar-surges-on-pain-results-cm764070,Biotech stocks were hit by the release of the Budget Blueprint for 2018 which could require companies to shell out higher fees for regulatory reviews Moreover the budget proposes a reduction of 5 8 billion in the National Institutes of Health s NIH spending Other key updates include Amgen
ARRY,ARRY:US,BBG000C52TW3,Array BioPharma's NDA for Cancer Drug Withdrawn; Shares Down,2017-03-22 13:58:01 +0000,http://finance.yahoo.com/news/array-biopharmas-nda-cancer-drug-135801044.html?.tsrc=rss,"Shares of Array BioPharma Inc. (ARRY) slipped 2.30% after the company announced that it has withdrawn its new drug application (NDA) for its pipeline candidate, binimetinib, from the FDA's Division of Oncology Products 2."
ARRY,ARRY:US,BBG000C52TW3,Array BioPharma's NDA for Cancer Drug Withdrawn; Shares Down,2017-03-22 13:58:01 +0000,http://finance.yahoo.com/news/array-biopharmas-nda-cancer-drug-135801044.html,Array BioPharma's NDA for Cancer Drug Withdrawn; Shares Down
ARRY,ARRY:US,BBG000C52TW3,Will Array Biopharma's Melanoma Drugs Keep the Stock Soaring?,2017-03-22 13:42:00 +0000,https://www.fool.com/investing/2017/03/22/will-array-biopharmas-melanoma-drugs-keep-the-stoc.aspx,Will Array Biopharma's Melanoma Drugs Keep the Stock Soaring?
ARRY,ARRY:US,BBG000C52TW3,Will Array Biopharma's Melanoma Drugs Keep the Stock Soaring?,2017-03-22 13:42:00 +0000,http://finance.yahoo.com/r/47abb204-746a-3667-abce-1318aca182e9/will-array-biopharmas-melanoma-drugs-keep-the-stoc.aspx?yptr=yahoo&.tsrc=rss,"A setback this week illustrates the challenges, but Array still has plenty of opportunity."
ARRY,ARRY:US,BBG000C52TW3,"After Hours Most Active for Mar 20, 2017 :  LYG, BAC, GM, MTG, MPC, HPQ, INTC, AAPL, CSCO, FOLD, MSFT, ARRY",2017-03-20 20:56:16 +0000,http://articlefeeds.nasdaq.com/~r/nasdaq/symbols/~3/oh9nw22e0l4/after-hours-most-active-for-mar-20-2017-lyg-bac-gm-mtg-mpc-hpq-intc-aapl-csco-fold-msft-arry-cm763155,The NASDAQ 100 After Hours Indicator is down 25 to 5 413 06 The total After hours volume is currently 34 505 353 shares traded The following are the most active stocks for the after hours session Lloyds Banking Group Plc LYG is 0 01 at 3 49 with 10 780 719
ARRY,ARRY:US,BBG000C52TW3,"How to Trade Monday's Most Active Stocks - AMD, Esperion Therapeutics, Nokia and More",2017-03-20 18:03:00 +0000,http://finance.yahoo.com/r/d0798c90-f870-3f75-aed5-62416f0bacc4/how-to-trade-monday-s-most-active-stocks-amd-esperion-therapeutics-nokia-and-more.html?puc=yahoo&cm_ven=YAHOO&yptr=yahoo&.tsrc=rss,Here's how to trade six of the most active names on the market this afternoon.
ARRY,ARRY:US,BBG000C52TW3,"How to Trade Monday's Most Active Stocks - AMD, Esperion Therapeutics, Nokia and More",2017-03-20 18:03:00 +0000,https://www.thestreet.com/story/14051858/1/how-to-trade-monday-s-most-active-stocks-amd-esperion-therapeutics-nokia-and-more.html?puc=yahoo&cm_ven=YAHOO,"How to Trade Monday's Most Active Stocks - AMD, Esperion Therapeutics, Nokia and More"
ARRY,ARRY:US,BBG000C52TW3,Array Biopharma Withdraws Cancer Drug Application,2017-03-20 16:38:00 +0000,http://finance.yahoo.com/r/2ce7478a-f9e1-3cca-b2e4-ed87fb8450f3/array-biopharma-withdraws-binimetinib-nda-arry?partner=YahooSA&yptr=yahoo&.tsrc=rss,Array withdrew the FDA application for its skin cancer drug binimetinib after poor Phase 3 results.
ARRY,ARRY:US,BBG000C52TW3,Array Biopharma Withdraws Cancer Drug Application,2017-03-20 16:38:00 +0000,http://www.investopedia.com/news/array-biopharma-withdraws-binimetinib-nda-arry/?partner=YahooSA,Array Biopharma Withdraws Cancer Drug Application
ARRY,ARRY:US,BBG000C52TW3,"Apple, Array Biopharma, Alaska Air, and More: Here’s Why These Five Stocks Are in the Spotlight",2017-03-20 13:42:03 +0000,http://www.insidermonkey.com/blog/apple-array-biopharma-alaska-air-and-more-heres-why-these-five-stocks-are-in-the-spotlight-567549/,"Apple, Array Biopharma, Alaska Air, and More: Here’s Why These Five Stocks Are in the Spotlight"
ARRY,ARRY:US,BBG000C52TW3,"Apple, Array Biopharma, Alaska Air, and More: Here’s Why These Five Stocks Are in the Spotlight",2017-03-20 13:42:03 +0000,http://finance.yahoo.com/r/41274dba-a145-3873-b524-7684a88c60e8/apple-array-biopharma-alaska-air-and-more-heres-why-these-five-stocks-are-in-the-spotlight-567549?yptr=yahoo&.tsrc=rss,"It’s the beginning of a new week and the three major indexes look once again to open relatively flat. Although the U.K. plans to start the Brexit next week, investors are complacent as the overall U.S,. economy remains robust. In this article, let’s analyze why Apple Inc. (NASDAQ:AAPL), Tableau Software Inc (NYSE:DATA), Microsoft Corporation (NASDAQ:MSFT), Array Biopharma […]"
ARRY,ARRY:US,BBG000C52TW3,"Biotech Premarket Movers: CytomX, Aevi, Esperion",2017-03-20 13:35:00 +0000,https://www.thestreet.com/story/14051101/1/biotech-premarket-movers.html?puc=yahoo&cm_ven=YAHOO,"Biotech Premarket Movers: CytomX, Aevi, Esperion"
ARRY,ARRY:US,BBG000C52TW3,"Biotech Premarket Movers: CytomX, Aevi, Esperion",2017-03-20 13:35:00 +0000,http://finance.yahoo.com/r/d957a75f-2e6c-359f-bc07-1e3a49d0dab9/biotech-premarket-movers.html?puc=yahoo&cm_ven=YAHOO&yptr=yahoo&.tsrc=rss,"CytomX Therapeutics, Aevi Genomic Medicine and Esperion Therapeutics were among the biotech stock movers in premarket trading on Monday."
ARRY,ARRY:US,BBG000C52TW3,Array BioPharma Climbs Off Worst Levels But Continues To Post Notable Loss,2017-03-20 13:20:00 +0000,http://articlefeeds.nasdaq.com/~r/nasdaq/symbols/~3/O2p3Dt3rsl4/array-biopharma-climbs-off-worst-levels-but-continues-to-post-notable-loss-20170320-00874,Array BioPharma Climbs Off Worst Levels But Continues To Post Notable Loss
ARRY,ARRY:US,BBG000C52TW3,"Pre-Market Most Active for Mar 20, 2017 :  LYG, ARRY, ESPR, GNMX, HMC, NKTR, DB, SNY, SYT, BAC, ARLZ, ASML",2017-03-20 12:56:10 +0000,http://articlefeeds.nasdaq.com/~r/nasdaq/symbols/~3/1oVAyHtq-SU/pre-market-most-active-for-mar-20-2017-lyg-arry-espr-gnmx-hmc-nktr-db-sny-syt-bac-arlz-asml-cm762731,The NASDAQ 100 Pre Market Indicator is up 3 9 to 5 412 66 The total Pre Market volume is currently 9 534 783 shares traded The following are the most active stocks for the pre market session Lloyds Banking Group Plc LYG is 0 01 at 3 48 with 2 017 450 shares
