ARRY,ARRY:US,BBG000C52TW3,"3 Stocks to Watch Tuesday: Kite Pharma Inc (KITE), Array Biopharma Inc (ARRY) and Mylan NV (MYL)",2016-09-27 15:21:00 +0000,http://articlefeeds.nasdaq.com/~r/nasdaq/symbols/~3/-F4eWgk9_5M/3-stocks-to-watch-tuesday-kite-pharma-inc-kite-array-biopharma-inc-arry-and-mylan-nv-myl-cm685270,InvestorPlace InvestorPlace Stock Market News Stock Advice amp Trading Tips Monday was a straight up lousy day for the major U S stock indices on a day that saw oil slip 4 sending energy stocks broadly down 1 3 The S amp P 500 Index fell 0 86 the Dow
ARRY,ARRY:US,BBG000C52TW3,"ETF’s with exposure to Array BioPharma, Inc. : September 27, 2016",2016-09-27 13:51:38 +0000,http://www.capitalcube.com/blog/index.php/etfs-with-exposure-to-array-biopharma-inc-september-27-2016/,"ETF’s with exposure to Array BioPharma, Inc. : September 27, 2016"
ARRY,ARRY:US,BBG000C52TW3,Array (ARRY) Hits 52-Week High on Positive Phase III Data,2016-09-27 13:42:01 +0000,http://finance.yahoo.com/news/array-arry-hits-52-week-134201633.html,Array (ARRY) Hits 52-Week High on Positive Phase III Data
ARRY,ARRY:US,BBG000C52TW3,"Pre-Market Most Active for Sep 27, 2016 :  RICE, ARRY, TWTR, MPW, DB, LYG, GI, XIV, QQQ, TVIX, AAPL, NVAX",2016-09-27 12:51:05 +0000,http://articlefeeds.nasdaq.com/~r/nasdaq/symbols/~3/_iKIXzIABXM/pre-market-most-active-for-sep-27-2016-rice-arry-twtr-mpw-db-lyg-gi-xiv-qqq-tvix-aapl-nvax-cm684994,The NASDAQ 100 Pre Market Indicator is up 3 48 to 4 820 65 The total Pre Market volume is currently 6 767 304 shares traded The following are the most active stocks for the pre market session Rice Energy Inc RICE is 1 9 at 25 24 with 1 781 561 shares traded
ARRY,ARRY:US,BBG000C52TW3,"Top Analyst Upgrades and Downgrades: CBOE, Comcast, GW Pharma, Hormel, Vonage, Wells Fargo and Many More",2016-09-27 12:45:04 +0000,http://247wallst.com/investing/2016/09/27/top-analyst-upgrades-and-downgrades-cboe-comcast-gw-pharma-hormel-vonage-wells-fargo-and-many-more/,"Top Analyst Upgrades and Downgrades: CBOE, Comcast, GW Pharma, Hormel, Vonage, Wells Fargo and Many More"
ARRY,ARRY:US,BBG000C52TW3,"ARRY Hits COLUMBUS Goals, KITE Flies After-hrs, FDA Places Hold On CVM Trial",2016-09-27 02:18:00 +0000,http://articlefeeds.nasdaq.com/~r/nasdaq/symbols/~3/KUQnhvR44UY/arry-hits-columbus-goals-kite-flies-afterhrs-fda-places-hold-on-cvm-trial-20160927-00041,"ARRY Hits COLUMBUS Goals, KITE Flies After-hrs, FDA Places Hold On CVM Trial"
ARRY,ARRY:US,BBG000C52TW3,"Why Array Biopharma Inc (ARRY), Sally Beauty Holdings, Inc. (SBH) and Twitter Inc (TWTR) Are 3 of Today’s Best Stocks",2016-09-26 23:21:09 +0000,http://articlefeeds.nasdaq.com/~r/nasdaq/symbols/~3/7MbXRMYzOuc/why-array-biopharma-inc-arry-sally-beauty-holdings-inc-sbh-and-twitter-inc-twtr-are-3-of-todays-best-stocks-cm684894,InvestorPlace InvestorPlace Stock Market News Stock Advice amp Trading Tips Perhaps displaying a case of nerves ahead of the first presidential debate between Democratic nominee Hillary Clinton and Republican nominee Donald Trump investors sold equities
ARRY,ARRY:US,BBG000C52TW3,"Why Array BioPharma, Chemtura, and GW Pharmaceuticals Jumped Today",2016-09-26 23:21:06 +0000,http://articlefeeds.nasdaq.com/~r/nasdaq/symbols/~3/D7B8pfwnyZc/why-array-biopharma-chemtura-and-gw-pharmaceuticals-jumped-today-cm684892,Image source Getty Images Volatility is returning to the stock market and investors felt the downward side of that equation on Monday Major market benchmarks fell as much as 1 as investors tried to prepare for the first U S Presidential debate tonight Although few
ARRY,ARRY:US,BBG000C52TW3,"Why Array BioPharma, Chemtura, and GW Pharmaceuticals Jumped Today",2016-09-26 22:03:00 +0000,http://www.fool.com/investing/2016/09/26/why-array-biopharma-chemtura-and-gw-pharmaceutical.aspx?source=yahoo-2-news&utm_campaign=article&utm_medium=feed&utm_source=yahoo-2-news,"Why Array BioPharma, Chemtura, and GW Pharmaceuticals Jumped Today"
ARRY,ARRY:US,BBG000C52TW3,"Health Care Sector Update for 09/26/2016: MSON,ARRY,PTIE",2016-09-26 20:21:27 +0000,http://articlefeeds.nasdaq.com/~r/nasdaq/symbols/~3/_eHxDhansUc/health-care-sector-update-for-09262016-msonarryptie-cm684816,Top Health Care StocksTop Health Care Stocks JNJ 0 8 JNJ 0 8 PFE 1 7 PFE 1 7 MRK 1 4 MRK 1 4 ABT 1 4 ABT 1 4 AMGN 0 7 AMGN 0 7 Health care stocks were sinking Monday afternoon with the NYSE Health Care Index NYP falling about 1 2 while shares of health care companies in
ARRY,ARRY:US,BBG000C52TW3,Mid-Afternoon Market Update: Dow Falls 150 Points; Himax Technologies Shares Slide After Nomura Downgrade,2016-09-26 19:46:11 +0000,http://articlefeeds.nasdaq.com/~r/nasdaq/symbols/~3/XSipKP2n1X0/mid-afternoon-market-update-dow-falls-150-points-himax-technologies-shares-slide-after-nomura-downgrade-cm684813,Toward the end of trading Monday the Dow traded down 0 83 percent to 18 109 35 while the NASDAQ declined 0 88 percent to 5 258 98 The S amp P also fell dropping 0 79 percent to 2 147 64 Leading and Lagging Sectors Monday afternoon energy shares slipped by just 0 1
ARRY,ARRY:US,BBG000C52TW3,Array Biopharma Inc (ARRY) Surges 60% as Shorts Get Squeezed,2016-09-26 19:22:18 +0000,http://articlefeeds.nasdaq.com/~r/nasdaq/symbols/~3/1ccGt4mi0bg/array-biopharma-inc-arry-surges-60-as-shorts-get-squeezed-cm684751,InvestorPlace InvestorPlace Stock Market News Stock Advice amp Trading Tips Array Biopharma Inc 160 NASDAQ ARRY is one of the few stocks moving anywhere Monday as the markets await the first presidential debate between Hillary Clinton and
ARRY,ARRY:US,BBG000C52TW3,Mid-Day Market Update: Crude Oil Up 3.3%; Chemtura Shares Surge Following Acquisition News,2016-09-26 18:16:11 +0000,http://articlefeeds.nasdaq.com/~r/nasdaq/symbols/~3/ZVuWRW5lDQM/mid-day-market-update-crude-oil-up-33-chemtura-shares-surge-following-acquisition-news-cm684715,Midway through trading Monday the Dow traded down 0 79 percent to 18 116 61 while the NASDAQ declined 0 79 percent to 5 264 04 The S amp P also fell dropping 0 69 percent to 2 149 82 Leading and Lagging Sectors On Monday basic materials shares rose 0 06 percent Meanwhile
ARRY,ARRY:US,BBG000C52TW3,"Health Care Sector Update for 09/26/2016: GLPG,ARRY,PTIE",2016-09-26 18:01:03 +0000,http://articlefeeds.nasdaq.com/~r/nasdaq/symbols/~3/zJAwv4ui3Ck/health-care-sector-update-for-09262016-glpgarryptie-cm684712,Top Health Care StocksTop Health Care Stocks JNJ 0 93 JNJ 0 93 PFE 1 78 PFE 1 78 MRK 1 20 MRK 1 20 ABT 1 50 ABT 1 50 AMGN 0 91 AMGN 0 91 Health care stocks were sinking Monday afternoon with the NYSE Health Care Index falling about 1 1 while shares of health care companies in
ARRY,ARRY:US,BBG000C52TW3,"Midday Update: Wall Street Remains Defensive on Banking Sector Losses, Ahead of Presidential Debate",2016-09-26 17:01:26 +0000,http://articlefeeds.nasdaq.com/~r/nasdaq/symbols/~3/j6hoF774S9M/midday-update-wall-street-remains-defensive-on-banking-sector-losses-ahead-of-presidential-debate-cm684664,Shares were lower for a second straight day on Monday disregarding a rally in oil futures as banking stocks tumbled in sympathy with Deutsche Bank DB and Wall Street braced for tonight s presidential debate between Republican candidate Donald Trump and Democratic candidate
ARRY,ARRY:US,BBG000C52TW3,"Why Investors Are Buzzing About Yum, Twitter, GM, RetailMeNot, and Array Biopharma Today",2016-09-26 16:49:49 +0000,http://www.insidermonkey.com/blog/why-investors-are-buzzing-about-yum-twitter-gm-retailmenot-and-array-biopharma-today-476895/,"Why Investors Are Buzzing About Yum, Twitter, GM, RetailMeNot, and Array Biopharma Today"
ARRY,ARRY:US,BBG000C52TW3,Why Array BioPharma Inc Is Surging Today,2016-09-26 16:11:43 +0000,http://www.fool.com/investing/2016/09/26/duplicatedaily-10er-hit-duplicate.aspx?source=yahoo-2&utm_campaign=article&utm_medium=feed&utm_source=yahoo-2,Why Array BioPharma Inc Is Surging Today
ARRY,ARRY:US,BBG000C52TW3,Array Biopharma Shares Soar on Melanoma Trial’s Early Results,2016-09-26 16:10:10 +0000,http://finance.yahoo.com/news/array-biopharma-shares-soar-melanoma-161010590.html,Array Biopharma Shares Soar on Melanoma Trial’s Early Results
ARRY,ARRY:US,BBG000C52TW3,"Array BioPharma (ARRY) Stock Soars on Drug Success, Piper Jaffray Ups Price Target",2016-09-26 15:50:00 +0000,https://www.thestreet.com/story/13751828/1/array-biopharma-arry-stock-soars-on-drug-success-piper-jaffray-ups-price-target.html?puc=yahoo&cm_ven=YAHOO,"Array BioPharma (ARRY) Stock Soars on Drug Success, Piper Jaffray Ups Price Target"
ARRY,ARRY:US,BBG000C52TW3,Mid-Morning Market Update: Markets Open Lower; Cal-Maine Posts Wider-Than-Expected Loss,2016-09-26 15:11:27 +0000,http://articlefeeds.nasdaq.com/~r/nasdaq/symbols/~3/b4lkFj-IVxc/mid-morning-market-update-markets-open-lower-cal-maine-posts-wider-than-expected-loss-cm684495,Following the market opening Monday the Dow traded down 0 77 percent to 18 120 00 while the NASDAQ declined 0 76 percent to 5 265 61 The S amp P also fell dropping 0 65 percent to 2 150 56 Leading and Lagging Sectors Monday morning basic materials shares rose 0 10
ARRY,ARRY:US,BBG000C52TW3,4 Biopharma Companies Moving on Monday Ahead of the Presidential Debate,2016-09-26 14:15:44 +0000,http://247wallst.com/healthcare-business/2016/09/26/4-biopharma-companies-moving-on-monday-ahead-of-the-presidential-debate/,4 Biopharma Companies Moving on Monday Ahead of the Presidential Debate
ARRY,ARRY:US,BBG000C52TW3,"Stocks to Watch: Chemtura, Deutsche Bank, Array BioPharma",2016-09-26 13:20:44 +0000,http://blogs.wsj.com/moneybeat/2016/09/26/stocks-to-watch-chemtura-deutsche-bank-array-biopharma/?mod=yahoo_hs,"Stocks to Watch: Chemtura, Deutsche Bank, Array BioPharma"
ARRY,ARRY:US,BBG000C52TW3,"Pre-Market Most Active for Sep 26, 2016 :  TWTR, DB, ARRY, CHMT, AZN, LYG, HSBC, AAPL, NVAX, XIV, QQQ, TVIX",2016-09-26 13:01:00 +0000,http://articlefeeds.nasdaq.com/~r/nasdaq/symbols/~3/ezd1kd7wtWw/pre-market-most-active-for-sep-26-2016-twtr-db-arry-chmt-azn-lyg-hsbc-aapl-nvax-xiv-qqq-tvix-cm684362,The NASDAQ 100 Pre Market Indicator is down 11 43 to 4 847 48 The total Pre Market volume is currently 5 973 698 shares traded The following are the most active stocks for the pre market session Twitter Inc TWTR is 0 75 at 21 87 with 931 457 shares traded TWTR
ARRY,ARRY:US,BBG000C52TW3,Array Biopharma Inc Conference Call regarding Phase 3 COLUMBUS study scheduled for 9:00 am ET today,2016-09-26 13:00:00 +0000,http://biz.yahoo.com/cc/4/153844.html,Array Biopharma Inc Conference Call regarding Phase 3 COLUMBUS study scheduled for 9:00 am ET today
ARRY,ARRY:US,BBG000C52TW3,Array BioPharma and Pierre Fabre Announce COLUMBUS Phase 3 Study of Encorafenib plus Binimetinib For BRAF-Mutant Melanoma Met Primary Endpoint,2016-09-26 11:19:06 +0000,http://www.publicnow.com/view/2C702A6E4E5484D5160238561F26BFC70402309D,"[at noodls] - BOULDER, Colo., Sept. 26, 2016 /PRNewswire/ -- Array BioPharma (Nasdaq: ARRY) and Pierre Fabre today jointly announced top-line results from Part 1 of the Phase 3 COLUMBUS (Combined LGX818 Used with MEK162 ..."
ARRY,ARRY:US,BBG000C52TW3,"ARRAY BIOPHARMA INC Files SEC form 8-K, Other Events, Financial Statements and Exhibits",2016-09-26 11:02:39 +0000,http://biz.yahoo.com/e/160926/arry8-k.html,"ARRAY BIOPHARMA INC Files SEC form 8-K, Other Events, Financial Statements and Exhibits"
ARRY,ARRY:US,BBG000C52TW3,"Array,Pierre Fabre Report COLUMBUS Phase 3 Study Of Encorafenib Plus Binimetinib",2016-09-26 07:09:00 +0000,http://articlefeeds.nasdaq.com/~r/nasdaq/symbols/~3/0Hc7WybSbnw/arraypierre-fabre-report-columbus-phase-3-study-of-encorafenib-plus-binimetinib-20160926-00260,"Array,Pierre Fabre Report COLUMBUS Phase 3 Study Of Encorafenib Plus Binimetinib"
ARRY,ARRY:US,BBG000C52TW3,"Array,Pierre Fabre Report COLUMBUS Phase 3 Study Of Encorafenib Plus Binimetinib",2016-09-26 07:09:00 +0000,http://articlefeeds.nasdaq.com/~r/nasdaq/symbols/~3/BmR0HFNHrCM/arraypierre-fabre-report-columbus-phase-3-study-of-encorafenib-plus-binimetinib-20160926-00261,"Array,Pierre Fabre Report COLUMBUS Phase 3 Study Of Encorafenib Plus Binimetinib"
ARRY,ARRY:US,BBG000C52TW3,3 Biotechs That Could Be M&A Targets,2016-09-24 17:20:43 +0000,http://articlefeeds.nasdaq.com/~r/nasdaq/symbols/~3/NmRMs_S2siU/3-biotechs-that-could-be-ma-targets-cm684176,Image source Getty Images After Pfizer Inc agreed to pay 14 times forecast sales for 2016 160 to acquire cancer drugmaking pure play Medivation last month shares in other cancer focused biotech companies shot higher While it doesn t make sense to buy shares in all
ARRY,ARRY:US,BBG000C52TW3,3 Biotechs That Could Be M&A Targets,2016-09-24 16:09:27 +0000,http://www.fool.com/investing/2016/09/24/3-biotechs-that-could-be-ma-targets.aspx?source=yahoo-2&utm_campaign=article&utm_medium=feed&utm_source=yahoo-2,3 Biotechs That Could Be M&A Targets
ARRY,ARRY:US,BBG000C52TW3,5 Stocks Insiders Love Right Now,2016-09-21 17:38:00 +0000,https://www.thestreet.com/story/13747715/1/5-stocks-insiders-love-right-now.html?puc=yahoo&cm_ven=YAHOO,5 Stocks Insiders Love Right Now
ARRY,ARRY:US,BBG000C52TW3,"Array BioPharma, Inc. – Value Analysis (NASDAQ:ARRY) : September 21, 2016",2016-09-21 15:23:11 +0000,http://www.capitalcube.com/blog/index.php/array-biopharma-inc-value-analysis-nasdaqarry-september-21-2016/,"Array BioPharma, Inc. – Value Analysis (NASDAQ:ARRY) : September 21, 2016"
ARRY,ARRY:US,BBG000C52TW3,"Array BioPharma, Inc. breached its 50 day moving average in a Bullish Manner : ARRY-US : September 20, 2016",2016-09-20 12:13:32 +0000,http://www.capitalcube.com/blog/index.php/array-biopharma-inc-breached-its-50-day-moving-average-in-a-bullish-manner-arry-us-september-20-2016/,"Array BioPharma, Inc. breached its 50 day moving average in a Bullish Manner : ARRY-US : September 20, 2016"
ARRY,ARRY:US,BBG000C52TW3,Do You Have These Biotech Stocks In Your Portfolio?,2016-09-19 14:13:00 +0000,http://articlefeeds.nasdaq.com/~r/nasdaq/symbols/~3/_61YoYvqeDo/do-you-have-these-biotech-stocks-in-your-portfolio-20160919-00807,Do You Have These Biotech Stocks In Your Portfolio?
ARRY,ARRY:US,BBG000C52TW3,10 Analyst Stock Picks Under $10 for Massive Upside,2016-09-18 14:15:15 +0000,http://247wallst.com/investing/2016/09/18/10-analyst-stock-picks-under-10-for-massive-upside/,10 Analyst Stock Picks Under $10 for Massive Upside
ARRY,ARRY:US,BBG000C52TW3,Array BioPharma To Present At The Morgan Stanley Global Healthcare Conference,2016-09-17 09:38:06 +0000,http://www.publicnow.com/view/EAD7184608B6DF4DB76FE70CFF439C24C3057D69,"[at noodls] - BOULDER, Colo., Sept. 6, 2016 /PRNewswire/ -- Array BioPharma Inc. (Nasdaq: ARRY) today announced that its Chief Executive Officer, Ron Squarer, will present at the 2016 Morgan Stanley Global Healthcare ..."
ARRY,ARRY:US,BBG000C52TW3,Array BioPharma Announces FDA Acceptance of Binimetinib NDA for Patients with Advanced NRAS-Mutant Melanoma,2016-09-17 09:18:05 +0000,http://www.publicnow.com/view/297F8AF2B745982643C16FE97E8365DDF815790C,"[at noodls] - BOULDER, Colo., Sept. 1, 2016 /PRNewswire/ -- Array BioPharma (Nasdaq: ARRY) today announced that the FDA has accepted its New Drug Application (NDA) for binimetinib with a target action date under the ..."
ARRY,ARRY:US,BBG000C52TW3,Array BioPharma To Present At The Wells Fargo Securities Healthcare Conference,2016-09-17 09:18:05 +0000,http://www.publicnow.com/view/E0503A9216F2DD5A9A0C436C4F336C9F2C503F95,"[at noodls] - BOULDER, Colo., Aug. 31, 2016 /PRNewswire/ -- Array BioPharma Inc. (Nasdaq: ARRY) today announced that its Chief Executive Officer, Ron Squarer, will present at the Wells Fargo Securities Healthcare Conference ..."
ARRY,ARRY:US,BBG000C52TW3,Array Secures SPA Agreement With FDA for Colorectal Cancer Trial (ARRY),2016-09-15 00:25:00 +0000,http://www.investopedia.com/news/array-secures-spa-agreement-fda-colorectal-cancer-trial-arry/?partner=YahooSA,Array Secures SPA Agreement With FDA for Colorectal Cancer Trial (ARRY)
ARRY,ARRY:US,BBG000C52TW3,"Why Sarepta, Glu Mobile, Harmony Gold and 2 Other Stocks Are On The Move Today",2016-09-14 16:08:15 +0000,http://www.insidermonkey.com/blog/why-sarepta-glu-mobile-harmony-gold-and-2-other-stocks-are-on-the-move-today-474605/,"Why Sarepta, Glu Mobile, Harmony Gold and 2 Other Stocks Are On The Move Today"
ARRY,ARRY:US,BBG000C52TW3,Key FDA Decisions and Trial Results Coming in the Next 2 Months,2016-09-14 12:20:11 +0000,http://247wallst.com/healthcare-business/2016/09/14/key-fda-decisions-and-trial-results-coming-in-the-next-2-months/,Key FDA Decisions and Trial Results Coming in the Next 2 Months
ARRY,ARRY:US,BBG000C52TW3,Array BioPharma Announces Phase 3 BEACON CRC SPA Agreement with FDA,2016-09-14 11:48:07 +0000,http://www.publicnow.com/view/83616103A34DA18A474FFB930443E87DE8C9EAE2,"[at noodls] - BOULDER, Colo., Sept. 14, 2016 /PRNewswire/ -- Array BioPharma (Nasdaq: ARRY) announced today that it has reached agreement with the U.S. Food and Drug Administration (FDA) regarding a Special Protocol ..."
ARRY,ARRY:US,BBG000C52TW3,"ARRAY BIOPHARMA INC Files SEC form 8-K, Other Events, Financial Statements and Exhibits",2016-09-14 11:33:04 +0000,http://biz.yahoo.com/e/160914/arry8-k.html,"ARRAY BIOPHARMA INC Files SEC form 8-K, Other Events, Financial Statements and Exhibits"
ARRY,ARRY:US,BBG000C52TW3,Stryker To Present At Morgan Stanley Global Conference; Webcast At 8:45 AM ET,2016-09-14 07:45:00 +0000,http://articlefeeds.nasdaq.com/~r/nasdaq/symbols/~3/zivmY_w-NHM/stryker-to-present-at-morgan-stanley-global-conference-webcast-at-845-am-et-20160914-00286,Stryker To Present At Morgan Stanley Global Conference; Webcast At 8:45 AM ET
ARRY,ARRY:US,BBG000C52TW3,Array BioPharma To Present At Morgan Stanley Conference; Webcast At 8:45 AM ET,2016-09-14 07:45:00 +0000,http://articlefeeds.nasdaq.com/~r/nasdaq/symbols/~3/heQShJ7oIgM/array-biopharma-to-present-at-morgan-stanley-conference-webcast-at-845-am-et-20160914-00287,Array BioPharma To Present At Morgan Stanley Conference; Webcast At 8:45 AM ET
ARRY,ARRY:US,BBG000C52TW3,Why Array Biopharma May Become a Winner (ARRY),2016-09-12 17:55:00 +0000,http://www.investopedia.com/news/why-array-biopharma-may-become-winner-arry/?partner=YahooSA,Why Array Biopharma May Become a Winner (ARRY)
ARRY,ARRY:US,BBG000C52TW3,How To Approach Momentum Trading Like A Pro,2016-09-11 20:00:04 +0000,http://www.investopedia.com/articles/active-trading/021815/importance-managing-risk-momentum-markets.asp?rp=y&partner=YahooSA,[at Investopedia] - Momentum markets generate high-reward high-risk environments that confound traders until they employ specific risk management practices.
ARRY,ARRY:US,BBG000C52TW3,"Array BioPharma, Inc. breached its 50 day moving average in a Bullish Manner : ARRY-US : September 9, 2016",2016-09-09 12:12:46 +0000,http://www.capitalcube.com/blog/index.php/array-biopharma-inc-breached-its-50-day-moving-average-in-a-bullish-manner-arry-us-september-9-2016/,"Array BioPharma, Inc. breached its 50 day moving average in a Bullish Manner : ARRY-US : September 9, 2016"
ARRY,ARRY:US,BBG000C52TW3,Array BioPharma To Participate In Wells Fargo Healthcare Conference At 9:50 AM,2016-09-07 08:52:00 +0000,http://articlefeeds.nasdaq.com/~r/nasdaq/symbols/~3/tpK2QM0FtCo/array-biopharma-to-participate-in-wells-fargo-healthcare-conference-at-950-am-20160907-00540,Array BioPharma To Participate In Wells Fargo Healthcare Conference At 9:50 AM
ARRY,ARRY:US,BBG000C52TW3,Array BioPharma To Present At The Morgan Stanley Global Healthcare Conference,2016-09-06 15:29:02 +0000,http://www.publicnow.com/view/34B4F280DF14BFB09F1FEEFC1DF29D770F5CB9B2,"[at noodls] - BOULDER, Colo., Sept. 6, 2016 /PRNewswire/ -- Array BioPharma Inc. (Nasdaq: ARRY) today announced that its Chief Executive Officer, Ron Squarer, will present at the 2016 Morgan Stanley Global Healthcare ..."
ARRY,ARRY:US,BBG000C52TW3,5 Speculative Biotech Analyst Stocks Under $10 With Massive Upside,2016-09-04 14:40:44 +0000,http://247wallst.com/healthcare-business/2016/09/04/5-speculative-biotech-analyst-stocks-under-10-with-massive-upside/,5 Speculative Biotech Analyst Stocks Under $10 With Massive Upside
ARRY,ARRY:US,BBG000C52TW3,"ARRAY BIOPHARMA INC Files SEC form 8-K, Entry into a Material Definitive Agreement, Creation of a Direct Financial Ob",2016-09-02 20:19:37 +0000,http://biz.yahoo.com/e/160902/arry8-k.html,"ARRAY BIOPHARMA INC Files SEC form 8-K, Entry into a Material Definitive Agreement, Creation of a Direct Financial Ob"
ARRY,ARRY:US,BBG000C52TW3,What Are Array Biopharma Inc (ARRY)’s Chances Of PDUFA Success?,2016-09-02 18:33:58 +0000,http://www.insidermonkey.com/blog/what-are-array-biopharma-inc-arrys-chances-of-pdufa-success-472106/,What Are Array Biopharma Inc (ARRY)’s Chances Of PDUFA Success?
ARRY,ARRY:US,BBG000C52TW3,Array (ARRY) Oncology Drug Accepted for Review in the U.S.,2016-09-02 15:22:44 +0000,http://articlefeeds.nasdaq.com/~r/nasdaq/symbols/~3/sQUdwgmSqHM/array-arry-oncology-drug-accepted-for-review-in-the-us-cm674007,Array BioPharma ARRY announced that the FDA has accepted a New Drug Application NDA for its pipeline candidate binimetinib The NDA was submitted in Jun 2016 based on positive results from the phase III trial NEMO which compared binimetinib with dacarbazine in unresectable or
ARRY,ARRY:US,BBG000C52TW3,Array (ARRY) Oncology Drug Accepted for Review in the U.S.,2016-09-02 13:29:01 +0000,http://finance.yahoo.com/news/array-arry-oncology-drug-accepted-132901453.html,Array (ARRY) Oncology Drug Accepted for Review in the U.S.
ARRY,ARRY:US,BBG000C52TW3,8 Major FDA Decisions and Trial Results to Watch for in September,2016-09-02 11:40:11 +0000,http://247wallst.com/healthcare-business/2016/09/02/8-major-fda-decisions-and-trial-results-to-watch-for-in-september/,8 Major FDA Decisions and Trial Results to Watch for in September
ARRY,ARRY:US,BBG000C52TW3,Array BioPharma Announces FDA Acceptance of Binimetinib NDA for Patients with Advanced NRAS-Mutant Melanoma,2016-09-01 12:23:06 +0000,http://www.publicnow.com/view/240880723E5EE020C271725BDD0273000D489614,"[at noodls] - BOULDER, Colo., Sept. 1, 2016 /PRNewswire/ -- Array BioPharma (Nasdaq: ARRY) today announced that the FDA has accepted its New Drug Application (NDA) for binimetinib with a target action date under the ..."
ARRY,ARRY:US,BBG000C52TW3,"ARRAY BIOPHARMA INC Files SEC form 8-K, Other Events, Financial Statements and Exhibits",2016-09-01 12:04:21 +0000,http://biz.yahoo.com/e/160901/arry8-k.html,"ARRAY BIOPHARMA INC Files SEC form 8-K, Other Events, Financial Statements and Exhibits"
ARRY,ARRY:US,BBG000C52TW3,Array BioPharma Announces FDA Acceptance of Binimetinib NDA for Patients with Advanced NRAS-Mutant Melanoma,2016-09-01 12:00:00 +0000,http://finance.yahoo.com/news/array-biopharma-announces-fda-acceptance-120000931.html,"[PR Newswire] - BOULDER, Colo., Sept. 1, 2016 /PRNewswire/ -- Array BioPharma (ARRY) today announced that the FDA has accepted its New Drug Application (NDA) for binimetinib with a target action date under the Prescription Drug User Fee Act (PDUFA) of June 30, 2017. Array completed its NDA submission of binimetinib in late June 2016 based on findings from the pivotal Phase 3 NEMO (NRAS MELANOMA AND MEK INHIBITOR) trial in patients with NRAS-mutant melanoma. The FDA also indicated that it plans to hold an advisory committee meeting (ODAC) as part of the review process. As previously reported, Array is currently preparing for an Application Orientation Meeting (AOM) with the FDA in September 2016, which it expects will include a discussion of the NDA package including clinical risk / benefit."
ARRY,ARRY:US,BBG000C52TW3,Array BioPharma Says FDA Accepts Binimetinib NDA,2016-09-01 08:04:00 +0000,http://articlefeeds.nasdaq.com/~r/nasdaq/symbols/~3/D3ieewqk22w/array-biopharma-says-fda-accepts-binimetinib-nda-20160901-00388,Array BioPharma Says FDA Accepts Binimetinib NDA
ARRY,ARRY:US,BBG000C52TW3,Array (ARRY) Presents Positive Cardiovascular Trial Data,2016-08-31 17:12:22 +0000,http://articlefeeds.nasdaq.com/~r/nasdaq/symbols/~3/JTF5Gej1NXE/array-arry-presents-positive-cardiovascular-trial-data-cm672940,"Array BioPharmaARRY presented results from a phase II study on its pipeline candidate, ARRY 797, at the European Society of Cardiology Congress 2016 in Rome, Italy.  ARRY 797 is an oral, selective p38 mitogen activated protein"
ARRY,ARRY:US,BBG000C52TW3,Array (ARRY) Presents Positive Cardiovascular Trial Data,2016-08-31 15:28:03 +0000,http://finance.yahoo.com/news/array-arry-presents-positive-cardiovascular-152803482.html,Array (ARRY) Presents Positive Cardiovascular Trial Data
ARRY,ARRY:US,BBG000C52TW3,Array BioPharma To Present At The Wells Fargo Securities Healthcare Conference,2016-08-31 13:23:04 +0000,http://www.publicnow.com/view/08E9E8D53DF8C01701E12682EDE5AE2493787DBB,"[at noodls] - BOULDER, Colo., Aug. 31, 2016 /PRNewswire/ -- Array BioPharma Inc. (Nasdaq: ARRY) today announced that its Chief Executive Officer, Ron Squarer, will present at the Wells Fargo Securities Healthcare Conference ..."
ARRY,ARRY:US,BBG000C52TW3,Array BioPharma To Present At The Wells Fargo Securities Healthcare Conference,2016-08-31 13:00:00 +0000,http://finance.yahoo.com/news/array-biopharma-present-wells-fargo-130000230.html,"[PR Newswire] - BOULDER, Colo., Aug. 31, 2016 /PRNewswire/ -- Array BioPharma Inc. (Nasdaq: ARRY) today announced that its Chief Executive Officer, Ron Squarer, will present at the Wells Fargo Securities Healthcare Conference ..."
ARRY,ARRY:US,BBG000C52TW3,Array BioPharma Continues Its Silent Rally With Mid-Stage Trial Win,2016-08-30 16:20:37 +0000,http://247wallst.com/healthcare-business/2016/08/30/array-biopharma-continues-its-silent-rally-with-mid-stage-trial-win/,Array BioPharma Continues Its Silent Rally With Mid-Stage Trial Win
