RESULT_COUNT: 435,PAGE_SIZE: 10000,CURRENT_PAGE: 1,TOTAL_PAGES: 1,API_CALL_CREDITS: 1
TICKER,FIGI_TICKER,FIGI,TITLE,PUBLICATION_DATE,URL,SUMMARY
ARRY,ARRY:US,BBG000C52TW3,Today's Research Reports on Trending Tickers: Array BioPharma and Spectrum Pharmaceuticals,2017-10-18 12:00:00 +0000,https://finance.yahoo.com/news/todays-research-reports-trending-tickers-120000662.html?.tsrc=rss,"NEW YORK, NY / ACCESSWIRE / October 18, 2017 / The Dow Jones Industrial Average crossed the 23,000 plateau for the first time ever on Tuesday as investors digested the latest batch of corporate earnings. ..."
ARRY,ARRY:US,BBG000C52TW3,"After Hours Most Active for Oct 16, 2017 :  NFLX, PE, F, MAR, ISBC, LB, GE, SYF, LUV, CMCSA, QQQ, ARRY",2017-10-16 21:05:40 +0000,http://articlefeeds.nasdaq.com/~r/nasdaq/symbols/~3/VGRwBDcu-6g/after-hours-most-active-for-oct-16-2017-nflx-pe-f-mar-isbc-lb-ge-syf-luv-cmcsa-qqq-arry-cm860357,The NASDAQ 100 After Hours Indicator is up 1 08 to 6 115 61 The total After hours volume is currently 51 926 396 shares traded The following are the most active stocks for the after hours session Netflix Inc NFLX is 3 45 at 206 13 with 2 928 313 shares traded
ARRY,ARRY:US,BBG000C52TW3,Loxo Oncology Fights Cancer With 'Tumor Agnostic' Approach,2017-10-16 13:18:31 +0000,http://articlefeeds.nasdaq.com/~r/nasdaq/symbols/~3/ZWZQE2Dkqv4/loxo-oncology-fights-cancer-with-tumor-agnostic-approach-cm859981,The potential cancer cure disclosures that propelled Loxo Oncology LOXO stock up 43 one day in June and an additional 15 one day in September indicate innovation in cancer research and treatment that many investors say could keep Loxo aloft ibd display video id
ARRY,ARRY:US,BBG000C52TW3,"ETFs with exposure to Array BioPharma, Inc. : October 9, 2017",2017-10-09 15:16:47 +0000,http://finance.yahoo.com/r/37f02baa-f04f-3b43-84f9-05b0c02b0b9e/etfs-with-exposure-to-array-biopharma-inc-october-9-2017?yptr=yahoo&.tsrc=rss,"Categories:  ETFs Yahoo FinanceClick here to see latest analysis ETFs with exposure to Array BioPharma, Inc. Here are 5 ETFs with the largest exposure to ARRY-US. Comparing the performance and risk of Array BioPharma, Inc. with the ETFs that have exposure to it gives us some ETF choices that could give us similar returns with lower volatility. Ticker ... Read more
<b>(Read more...)</b>"
ARRY,ARRY:US,BBG000C52TW3,See what the IHS Markit Score report has to say about Array Biopharma Inc.,2017-10-09 12:03:51 +0000,https://finance.yahoo.com/news/see-ihs-markit-score-report-120351609.html?.tsrc=rss,Array Biopharma Inc NASDAQ NMS:ARRY
ARRY,ARRY:US,BBG000C52TW3,Steven Cohen Doubles Down on Sickle Cell Disease Therapeutics Company Global Blood,2017-10-05 12:47:14 +0000,http://articlefeeds.nasdaq.com/~r/nasdaq/symbols/~3/r0n3RUTT4eM/steven-cohen-doubles-down-on-sickle-cell-disease-therapeutics-company-global-blood-cm855548,On Oct 2 Steven Cohen Trades Portfolio increased his Global Blood Therapeutics Inc GBT position according to GuruFocus real time picks On Oct 2 Steven Cohen Trades Portfolio increased hisGlobal Blood Therapeutics Inc Global Blood Therapeutics Inc
ARRY,ARRY:US,BBG000C52TW3,See what the IHS Markit Score report has to say about Array Biopharma Inc.,2017-10-04 12:02:47 +0000,https://finance.yahoo.com/news/see-ihs-markit-score-report-120330947.html?.tsrc=rss,Array Biopharma Inc NASDAQ NMS:ARRY
ARRY,ARRY:US,BBG000C52TW3,See what the IHS Markit Score report has to say about Array Biopharma Inc.,2017-10-02 12:02:21 +0000,https://finance.yahoo.com/news/see-ihs-markit-score-report-120221439.html?.tsrc=rss,Array Biopharma Inc NASDAQ NMS:ARRY
ARRY,ARRY:US,BBG000C52TW3,See what the IHS Markit Score report has to say about Array Biopharma Inc.,2017-09-29 12:04:09 +0000,https://finance.yahoo.com/news/see-ihs-markit-score-report-120409904.html?.tsrc=rss,Array Biopharma Inc NASDAQ NMS:ARRY
ARRY,ARRY:US,BBG000C52TW3,"After Hours Most Active for Sep 28, 2017 :  BAC, F, INTC, NWL, CPN, WFC, NEE^R, ARRY, HOMB, ACWI, ZNGA, CSX",2017-09-28 21:02:49 +0000,http://articlefeeds.nasdaq.com/~r/nasdaq/symbols/~3/6cw_7ehcKdo/after-hours-most-active-for-sep-28-2017-bac-f-intc-nwl-cpn-wfc-neer-arry-homb-acwi-znga-csx-cm852868,The NASDAQ 100 After Hours Indicator is up 97 to 5 934 04 The total After hours volume is currently 41 787 336 shares traded The following are the most active stocks for the after hours session Bank of America Corporation BAC is 0 02 at 25 47 with 5 495 109
ARRY,ARRY:US,BBG000C52TW3,Today's Research Reports on Trending Tickers: Array BioPharma and Horizon Pharma,2017-09-28 12:00:00 +0000,https://finance.yahoo.com/news/todays-research-reports-trending-tickers-120000760.html?.tsrc=rss,"NEW YORK, NY / ACCESSWIRE / September 28, 2017 / Large-cap and small-cap stocks soared to new intra-day records Wednesday as financial stocks surged after Republicans released details on tax reform. The ..."
ARRY,ARRY:US,BBG000C52TW3,See what the IHS Markit Score report has to say about Array Biopharma Inc.,2017-09-26 12:04:11 +0000,https://finance.yahoo.com/news/see-ihs-markit-score-report-120411569.html?.tsrc=rss,"The last change in the short interest score occurred more than 1 month ago and implies that there has been little change in sentiment among investors who seek to profit from falling equity prices.  Index (PMI) data, output in the Healthcare sector is rising."
ARRY,ARRY:US,BBG000C52TW3,"Cramer's lightning round: I like Altria Group, but it's n...",2017-09-20 23:07:00 +0000,https://finance.yahoo.com/video/cramers-lightning-round-altria-group-230700924.html?.tsrc=rss,"Jim Cramer flies through his take on callers' favorite stocks, including one tobacco giant."
ARRY,ARRY:US,BBG000C52TW3,Array BioPharma To Present At The 2017 Cantor Fitzgerald Global Healthcare Conference,2017-09-19 14:00:00 +0000,https://finance.yahoo.com/news/array-biopharma-present-2017-cantor-140000376.html?.tsrc=rss,"BOULDER, Colo. , Sept. 19, 2017 /PRNewswire/ -- Array BioPharma Inc. (Nasdaq: ARRY) today announced that its Chief Executive Officer, Ron Squarer , will present at the 2017 Cantor Fitzgerald Global Healthcare ..."
ARRY,ARRY:US,BBG000C52TW3,Array BioPharma Announces Closing of Public Offering and Full Exercise of Option to Purchase Additional Shares,2017-09-19 13:09:00 +0000,https://finance.yahoo.com/news/array-biopharma-announces-closing-public-130900472.html?.tsrc=rss,"BOULDER, Colo. , Sept. 19, 2017 /PRNewswire/ -- Array BioPharma Inc. (Nasdaq: ARRY) announced today the closing of its underwritten public offering of 24,069,766 shares of its common stock, which includes ..."
ARRY,ARRY:US,BBG000C52TW3,Mirati Skyrockets On Positive Data - Biotech Movers,2017-09-15 13:24:00 +0000,http://finance.yahoo.com/r/ae6cdd3f-2ec6-3589-9763-88f295a53130/mirati-jumps-on-positive-data.html?puc=yahoo&cm_ven=YAHOO&yptr=yahoo&.tsrc=rss,The San Diego firm is scheduled to present positive preliminary data for two clinical studies of sitravatinib in non-small cell lung cancer at a symposium in Chicago on Friday.
ARRY,ARRY:US,BBG000C52TW3,"Pre-Market Most Active for Sep 15, 2017 :  ARRY, NOK, CS, SKM, TTOO, TVIX, NVDA, STAR, USLV, MFGP, MRNS, CUK",2017-09-15 12:55:17 +0000,http://articlefeeds.nasdaq.com/~r/nasdaq/symbols/~3/kHFVT3m3gcs/pre-market-most-active-for-sep-15-2017-arry-nok-cs-skm-ttoo-tvix-nvda-star-uslv-mfgp-mrns-cuk-cm846180,The NASDAQ 100 Pre Market Indicator is up 97 to 5 969 79 The total Pre Market volume is currently 4 576 758 shares traded The following are the most active stocks for the pre market session Array BioPharma Inc ARRY is 0 42 at 11 22 with 581 922 shares traded
ARRY,ARRY:US,BBG000C52TW3,Today's Research Reports on Stocks to Watch: Halozyme Therapeutics and Array Biopharma,2017-09-15 12:20:00 +0000,https://finance.yahoo.com/news/todays-research-reports-stocks-watch-122000173.html?.tsrc=rss,"NEW YORK, NY / ACCESSWIRE / September 15, 2017 / Shares of Halozyme hit a new high yesterday and closed the day up over 20% after announcing not one, but three big pieces of news that had traders excited. ..."
ARRY,ARRY:US,BBG000C52TW3,Array BioPharma Announces Pricing of Public Offering of Common Stock,2017-09-14 23:17:00 +0000,https://finance.yahoo.com/news/array-biopharma-announces-pricing-public-231700256.html?.tsrc=rss,"The offering is expected to close on or about September 19, 2017, subject to customary closing conditions.  Array also granted the underwriters a 30-day option to purchase up to 3,139,534 additional shares of common stock.  All of the shares sold in the offering are being sold by Array."
ARRY,ARRY:US,BBG000C52TW3,Array BioPharma Shows Significant Rebound After Initial Sell-Off,2017-09-14 15:54:00 +0000,http://articlefeeds.nasdaq.com/~r/nasdaq/symbols/~3/Y_aAMksyNjg/array-biopharma-shows-significant-rebound-after-initial-selloff-20170914-01138,Array BioPharma Shows Significant Rebound After Initial Sell-Off
ARRY,ARRY:US,BBG000C52TW3,Colorado biotech plans $200 million stock offering,2017-09-14 13:53:34 +0000,http://finance.yahoo.com/r/23a47952-ac89-3985-8b86-eb658942669d/colorado-biotech-plans-200-million-stock-offering.html?ana=yahoo&yptr=yahoo&.tsrc=rss,"A Boulder biotech said it's commenced an underwritten public offering of about $200 million of its stock.  Array BioPharma Inc. said it's begun an offering of $175 million of shares of its common stock, and it's giving underwriters the option to buy up to an additional $26 million in shares.  In the SEC filing, Array officials said the company's stock price will probably not remain stable."
ARRY,ARRY:US,BBG000C52TW3,Array BioPharma Slides on Secondary Offering,2017-09-14 13:15:15 +0000,https://finance.yahoo.com/news/array-biopharma-slides-secondary-offering-131515289.html?.tsrc=rss,Array BioPharma saw its shares turn negative early on Thursday after the firm announced a secondary offering.
ARRY,ARRY:US,BBG000C52TW3,Array BioPharma shares slide on secondary offering announcement,2017-09-13 21:13:16 +0000,http://finance.yahoo.com/r/9afa60a7-cf5c-3f85-8fca-5b113cdd4b98/Story.aspx?guid=B15DCD02-346E-4923-A248-AD7771B6B2AA&siteid=yhoof2&yptr=yahoo&.tsrc=rss,Array BioPharma Inc.  shares fell in the extended session Wednesday after the drug developer announced a secondary offering of its shares. Array shares fell 7.9% to $9.70 after hours. The company ...
ARRY,ARRY:US,BBG000C52TW3,Array BioPharma Announces Proposed Public Offering of Common Stock,2017-09-13 20:01:00 +0000,https://finance.yahoo.com/news/array-biopharma-announces-proposed-public-200100153.html?.tsrc=rss,"BOULDER, Colo., Sept. 13, 2017 /PRNewswire/ -- Array BioPharma Inc. (ARRY) today announced that it has commenced an underwritten public offering of $175,000,000 of shares of its common stock.  Array BioPharma also intends to grant the underwriters a 30-day option to purchase up to an additional $26,250,000 of shares of its common stock offered in the public offering.  All of the shares in the offering are to be sold by Array BioPharma."
ARRY,ARRY:US,BBG000C52TW3,Array's NDAs for Melanoma Combo Accepted for Review by FDA,2017-09-13 16:39:03 +0000,http://articlefeeds.nasdaq.com/~r/nasdaq/symbols/~3/-x6R-Qh33tw/arrays-ndas-for-melanoma-combo-accepted-for-review-by-fda-cm845165,Array BioPharma ARRY announced that the FDA has accepted for review its two New Drug Applications NDAs seeking approval for the combination of binimetinib 45 mg twice daily and encorafenib 450 mg once daily COMBO450 to treat patients with BRAF mutant advanced unresectable or
ARRY,ARRY:US,BBG000C52TW3,Steven Cohen Dives Into Array BioPharma,2017-09-13 16:08:24 +0000,https://finance.yahoo.com/news/steven-cohen-dives-array-biopharma-160824588.html?.tsrc=rss,Guru keeps adding to positions in health care industry
ARRY,ARRY:US,BBG000C52TW3,Array&apos;s NDAs for Melanoma Combo Accepted for Review by FDA,2017-09-13 14:47:02 +0000,https://finance.yahoo.com/news/array-apos-ndas-melanoma-combo-144702392.html?.tsrc=rss,"Array BioPharma&apos;s (ARRY) new drug applications for the combination of binimetinib and encorafenib to treat melanoma, accepted for review by the FDA."
ARRY,ARRY:US,BBG000C52TW3,Array BioPharma Announces FDA Acceptance For Review Of Binimetinib And Encorafenib New Drug Applications For Patients With Advanced BRAF-mutant Melanoma,2017-09-12 13:09:00 +0000,https://finance.yahoo.com/news/array-biopharma-announces-fda-acceptance-130900028.html?.tsrc=rss,"BOULDER, Colo. , Sept. 12, 2017 /PRNewswire/ -- Array BioPharma (Nasdaq: ARRY) today announced that the U.S. Food and Drug Administration (FDA) has accepted for review its New Drug Applications (NDAs) ..."
ARRY,ARRY:US,BBG000C52TW3,3 Soaring Healthcare Stocks With Very Bullish News Sentiment,2017-09-12 13:07:27 +0000,http://articlefeeds.nasdaq.com/~r/nasdaq/symbols/~3/6sWZqo5stVQ/3-soaring-healthcare-stocks-with-very-bullish-news-sentiment-cm844204,"Shutterstock photo    What’s the effect of news— good   or   bad —on a stock’s price? A recent study by data scientists at the Fed revealed that positive news stories increase stock returns quickly, but negative stories have a long-delayed reaction. Specifically, positive news affects stock prices within a week."
ARRY,ARRY:US,BBG000C52TW3,See what the IHS Markit Score report has to say about Array Biopharma Inc.,2017-09-12 12:02:42 +0000,https://finance.yahoo.com/news/see-ihs-markit-score-report-120242318.html?.tsrc=rss,"The last change in the short interest score occurred more than 1 month ago and implies that there has been little change in sentiment among investors who seek to profit from falling equity prices.  Index (PMI) data, output in the Healthcare sector is rising."
ARRY,ARRY:US,BBG000C52TW3,"ETFs with exposure to Array BioPharma, Inc. : September 12, 2017",2017-09-12 00:56:20 +0000,http://finance.yahoo.com/r/d59d16f4-ca91-327e-8ca1-664e09593784/etfs-with-exposure-to-array-biopharma-inc-september-12-2017?yptr=yahoo&.tsrc=rss,"Categories:  ETFs Yahoo FinanceClick here to see latest analysis ETFs with exposure to Array BioPharma, Inc. Here are 5 ETFs with the largest exposure to ARRY-US. Comparing the performance and risk of Array BioPharma, Inc. with the ETFs that have exposure to it gives us some ETF choices that could give us similar returns with lower volatility. Ticker ... Read more
<b>(Read more...)</b>"
ARRY,ARRY:US,BBG000C52TW3,Array BioPharma And Others Shine At The ESMO 2017 Congress,2017-09-11 17:30:48 +0000,https://finance.yahoo.com/news/array-biopharma-others-shine-esmo-173048019.html?.tsrc=rss,"The 2017 ESMO Congress wraps up on Tuesday in Madrid, Spain. On Monday, Jefferies issued a handful of flash notes related to companies presenting at the conference. Here’s a breakdown of the highlights. ..."
ARRY,ARRY:US,BBG000C52TW3,Today's Research Reports on Stocks to Watch: Array BioPharma and Kura Oncology,2017-09-11 12:10:00 +0000,https://finance.yahoo.com/news/todays-research-reports-stocks-watch-121000318.html?.tsrc=rss,"NEW YORK, NY / ACCESSWIRE / September 11, 2017 / It was a positive day for both Array BioPharma (NASDAQ: ARRY ) and Kura Oncology (NASDAQ: KURA ) this past Friday, after the companies released encouraging ..."
ARRY,ARRY:US,BBG000C52TW3,"New Hope For AZN's Old Drug, More About BMY's Opdivo, IMDZ On Watch",2017-09-11 00:58:00 +0000,http://articlefeeds.nasdaq.com/~r/nasdaq/symbols/~3/YSrwGw-FWiI/new-hope-for-azns-old-drug-more-about-bmys-opdivo-imdz-on-watch-20170911-00011,"New Hope For AZN's Old Drug, More About BMY's Opdivo, IMDZ On Watch"
ARRY,ARRY:US,BBG000C52TW3,Phase 3 COLUMBUS Part 2 Results in BRAF-Mutant Melanoma Presented at European Society for Medical Oncology Congress,2017-09-09 13:30:00 +0000,https://finance.yahoo.com/news/phase-3-columbus-part-2-133000061.html?.tsrc=rss,- Median PFS for patients on combination of binimetinib (45 mg) plus encorafenib (300 mg) was 12.9 months versus 9.2 months for patients on encorafenib (300 mg) - - Generally well-tolerated and safety ...
ARRY,ARRY:US,BBG000C52TW3,Array Resumes Trades After Unveiling Data In Colon Cancer Trial,2017-09-08 20:35:43 +0000,http://finance.yahoo.com/r/4bc470db-f522-37cd-b744-a9942aa809b6/array-halted-pending-news-ahead-of-key-data-in-cancer-trials-2?src=A00220&yptr=yahoo&.tsrc=rss,Array shares were halted early Friday pending news likely tied to data regarding its Phase 3 trials in colon cancer and melanoma.
ARRY,ARRY:US,BBG000C52TW3,"Array BioPharma, Inc. :ARRY-US: Earnings Analysis: Q4, 2017 By the Numbers : September 8, 2017",2017-09-08 20:31:48 +0000,http://finance.yahoo.com/r/fee2fa14-a9c8-3728-8450-84c55436847d/array-biopharma-inc-arry-us-earnings-analysis-q4-2017-by-the-numbers-september-8-2017?yptr=yahoo&.tsrc=rss,"Categories:  Yahoo FinanceGet free summary analysis Array BioPharma, Inc. reports financial results for the quarter ended June 30, 2017. We analyze the earnings along side the following peers of Array BioPharma, Inc. – Celgene Corporation, Amgen Inc., Novartis AG Sponsored ADR, Astrazeneca PLC Sponsored ADR, Onconova Therapeutics Inc., Eli Lilly and Company and Cascadian Therapeutics Inc. (CELG-US, ... Read more
<b>(Read more...)</b>"
ARRY,ARRY:US,BBG000C52TW3,Phase 3 BEACON CRC Safety Lead-In Results in BRAF-Mutant Colorectal Cancer Presented at European Society for Medical Oncology Congress,2017-09-08 16:58:00 +0000,https://finance.yahoo.com/news/phase-3-beacon-crc-safety-165800464.html?.tsrc=rss,"- 41% confirmed ORR for patients on combination of binimetinib, encorafenib and cetuximab - - Median duration of treatment was 5.6 months at time of analysis and 76% of patients remain on study treatment ..."
ARRY,ARRY:US,BBG000C52TW3,Array BioPharma Seems to Be in a New Uptrend,2017-09-08 12:14:00 +0000,http://finance.yahoo.com/r/cbeeed9e-f26c-35cd-90dc-70a37819b190/array-biopharma-seems-be-new-uptrend?puc=yahoo&cm_ven=YAHOO&yptr=yahoo&.tsrc=rss,I really like how these three charts are shaping up on Array.
ARRY,ARRY:US,BBG000C52TW3,What's Behind Array Biopharma Inc.'s 31% Rally in August?,2017-09-06 21:51:57 +0000,http://articlefeeds.nasdaq.com/~r/nasdaq/symbols/~3/0UKajaOtY2g/whats-behind-array-biopharma-incs-31-rally-in-august-cm841969,What happened Shares of Array Biopharma Inc NASDAQ ARRY a biopharmaceutical company developing new cancer therapies gained 30 5 in August according to data from S amp P Global Market Intelligence More details from new drug candidates that could become this company
ARRY,ARRY:US,BBG000C52TW3,"Notable Wednesday Option Activity: TRTN, DAL, ARRY",2017-09-06 20:51:06 +0000,http://articlefeeds.nasdaq.com/~r/nasdaq/symbols/~3/QI5f_NjzcU8/notable-wednesday-option-activity-trtn-dal-arry-cm841906,Looking at options trading activity among components of the Russell 3000 index there is noteworthy activity today in Triton International Ltd Symbol TRTN where a total volume of 1 944 contracts has been traded thus far today a contract volume which is representative of approximately 194
ARRY,ARRY:US,BBG000C52TW3,What&apos;s Behind Array Biopharma Inc.&apos;s 31% Rally in August?,2017-09-06 19:10:00 +0000,http://finance.yahoo.com/r/140b1d1d-c371-3f70-a7b1-db7143d5d839/why-array-biopharma-inc-stock-swelled-31-in-august.aspx?yptr=yahoo&.tsrc=rss,The company&apos;s lead candidates took another step forward last month.
ARRY,ARRY:US,BBG000C52TW3,See what the IHS Markit Score report has to say about Array Biopharma Inc.,2017-09-06 12:02:31 +0000,https://finance.yahoo.com/news/see-ihs-markit-score-report-120231029.html?.tsrc=rss,Array Biopharma Inc NASDAQ NMS:ARRY
ARRY,ARRY:US,BBG000C52TW3,Array BioPharma To Present At Wells Fargo Conference; Webcast At 9:05 AM ET,2017-09-06 08:06:00 +0000,http://articlefeeds.nasdaq.com/~r/nasdaq/symbols/~3/YUB08TxHbwE/array-biopharma-to-present-at-wells-fargo-conference-webcast-at-905-am-et-20170906-00569,Array BioPharma To Present At Wells Fargo Conference; Webcast At 9:05 AM ET
ARRY,ARRY:US,BBG000C52TW3,Array Biopharma To Present BEACON CRC Safety Lead-in And COLUMBUS Part 2 Results At European Society For Medical Oncology Congress (ESMO),2017-08-30 12:00:00 +0000,https://finance.yahoo.com/news/array-biopharma-present-beacon-crc-120000449.html?.tsrc=rss,"- Array to host investor reception and webcast during ESMO on September 9 - BOULDER, Colo. , Aug. 30, 2017 /PRNewswire/ -- Array BioPharma Inc. (Nasdaq: ARRY), a biopharmaceutical company focused on the ..."
ARRY,ARRY:US,BBG000C52TW3,Array BioPharma To Present At The 2017 Wells Fargo Healthcare Conference,2017-08-28 18:00:00 +0000,https://finance.yahoo.com/news/array-biopharma-present-2017-wells-180000156.html?.tsrc=rss,"BOULDER, Colo. , Aug. 28, 2017 /PRNewswire/ -- Array BioPharma Inc. (Nasdaq: ARRY) today announced that its Chief Executive Officer, Ron Squarer , will present at the 2017 Wells Fargo Healthcare Conference.  ..."
ARRY,ARRY:US,BBG000C52TW3,"Friday's ETF Movers: OIH, XBI",2017-08-25 20:40:41 +0000,http://articlefeeds.nasdaq.com/~r/nasdaq/symbols/~3/RO3_0Y9iRhE/fridays-etf-movers-oih-xbi-cm837393,In trading on Friday the Oil Services ETF OIH is outperforming other ETFs up about 1 8 on the day Components of that ETF showing particular strength include shares of Carbo Ceramics CRR up about 6 9 and shares of Oceaneering International OII up about 4 5 on the
ARRY,ARRY:US,BBG000C52TW3,"ETFs with exposure to Array BioPharma, Inc. : August 24, 2017",2017-08-24 18:58:17 +0000,http://finance.yahoo.com/r/3f640c0a-6279-3e50-bf50-0fe89b1536e1/etfs-with-exposure-to-array-biopharma-inc-august-24-2017?yptr=yahoo&.tsrc=rss,"Categories:  ETFs Yahoo FinanceClick here to see latest analysis ETFs with exposure to Array BioPharma, Inc. Here are 5 ETFs with the largest exposure to ARRY-US. Comparing the performance and risk of Array BioPharma, Inc. with the ETFs that have exposure to it gives us some ETF choices that could give us similar returns with lower volatility. Ticker ... Read more
<b>(Read more...)</b>"
ARRY,ARRY:US,BBG000C52TW3,Harry Boxer: These three biotech stocks are breaking out,2017-08-24 16:51:09 +0000,http://finance.yahoo.com/r/fd52447e-7e8d-31dc-b7ea-0975a7ddfa5d/Story.aspx?guid=FCE75884-88E5-11E7-BE2B-E61E532BE66C&siteid=yhoof2&yptr=yahoo&.tsrc=rss,"In focus: Array BioPharma, Immunomedics and Spark Therapeutics."
ARRY,ARRY:US,BBG000C52TW3,Array BioPharma (ARRY) Looks Good: Stock Adds 5.9% in Session,2017-08-24 14:43:11 +0000,http://articlefeeds.nasdaq.com/~r/nasdaq/symbols/~3/IjcpwFf9wiU/array-biopharma-arry-looks-good-stock-adds-59-in-session-cm836445,Array BioPharma Inc ARRY was a big mover last session as the company saw its shares rise nearly 6 on the day The move came on solid volume too with far more shares changing hands than in a normal session This continues the recent uptrend for the company as the stock is now up 22 3 in
ARRY,ARRY:US,BBG000C52TW3,Array BioPharma (ARRY) Looks Good: Stock Adds 5.9% in Session,2017-08-24 12:44:12 +0000,https://finance.yahoo.com/news/array-biopharma-arry-looks-good-124412647.html?.tsrc=rss,"Array BioPharma (ARRY) shares rose nearly 6% in the last trading session, amid huge volumes."
ARRY,ARRY:US,BBG000C52TW3,See what the IHS Markit Score report has to say about Array Biopharma Inc.,2017-08-23 12:02:48 +0000,https://finance.yahoo.com/news/see-ihs-markit-score-report-120248549.html?.tsrc=rss,Array Biopharma Inc NASDAQ NMS:ARRY
ARRY,ARRY:US,BBG000C52TW3,"3 Big Stock Charts for Wednesday: Amazon.com, Inc. (AMZN), Array Biopharma Inc (ARRY) and Paychex, Inc. (PAYX)",2017-08-16 21:35:17 +0000,http://articlefeeds.nasdaq.com/~r/nasdaq/symbols/~3/CuHoDq0xH20/3-big-stock-charts-for-wednesday-amazoncom-inc-amzn-array-biopharma-inc-arry-and-paychex-inc-payx-cm833040,InvestorPlace Stock Market News Stock Advice amp Trading Tips The market s indecisive moves have stocks bouncing around like a loose golf ball in a trunk Volatility with little actual movement is what drives traders absolutely nuts which is why we re maintaining a vigil
ARRY,ARRY:US,BBG000C52TW3,Edited Transcript of ARRY earnings conference call or presentation 9-Aug-17 1:00pm GMT,2017-08-16 18:21:16 +0000,https://finance.yahoo.com/news/edited-transcript-arry-earnings-conference-023033818.html?.tsrc=rss,Q4 2017 Array Biopharma Inc Earnings Call
ARRY,ARRY:US,BBG000C52TW3,"3 Big Stock Charts for Wednesday: Amazon.com, Inc. (AMZN), Array Biopharma Inc (ARRY) and Paychex, Inc. (PAYX)",2017-08-16 17:05:28 +0000,https://finance.yahoo.com/news/3-big-stock-charts-wednesday-170528758.html?.tsrc=rss,"Today’s three big stock charts look at the technical pictures for Amazon.com, Inc.(NASDAQ:AMZN), Array Biopharma Inc (NASDAQ:ARRY) and Paychex, Inc. (NASDAQ:PAYX) as each of these companies are trading in their own technical worlds that are providing clearer signals than the market in terms of tradable moves.  Overhead resistance in the form of the stock’s round-numbered $1,000 price has held, triggering selling pressure last week that rolled Amazon stock back lower.  Array Biopharma is showing signs that the recent rally is one that is likely to gain even more momentum, here’s why."
ARRY,ARRY:US,BBG000C52TW3,See what the IHS Markit Score report has to say about Array Biopharma Inc.,2017-08-16 12:02:12 +0000,https://finance.yahoo.com/news/see-ihs-markit-score-report-120431571.html?.tsrc=rss,Array Biopharma Inc NASDAQ NMS:ARRY
ARRY,ARRY:US,BBG000C52TW3,Array BioPharma Appoints Curtis Oltmans As General Counsel,2017-08-14 21:00:00 +0000,https://finance.yahoo.com/news/array-biopharma-appoints-curtis-oltmans-210000615.html?.tsrc=rss,"BOULDER, Colo. , Aug. 14, 2017 /PRNewswire/ -- Array BioPharma (NASDAQ: ARRY), a biopharmaceutical company focused on the discovery, development and commercialization of targeted small molecule drugs to ..."
