AVXS,AVXS:UW,BBG00BWQPDY9,Cytokinetics SMA Drug Did Well in Early Study,2017-03-22 19:10:00 +0000,http://finance.yahoo.com/r/5fde6a56-de77-3033-b86e-a00d416750a1/cytokinetics-sma-drug-did-well-early-study-cytk?partner=YahooSA&yptr=yahoo&.tsrc=rss,"Cytokinetics' spinal muscular atrophy drug, CK-2127107, improved muscle function in a pre-clinical study."
AVXS,AVXS:UW,BBG00BWQPDY9,Cytokinetics SMA Drug Did Well in Early Study,2017-03-22 19:10:00 +0000,http://www.investopedia.com/news/cytokinetics-sma-drug-did-well-early-study-cytk/?partner=YahooSA,Cytokinetics SMA Drug Did Well in Early Study
AVXS,AVXS:UW,BBG00BWQPDY9,Billionaires' Best Healthcare Stock Picks of 2017 (So Far),2017-03-21 19:02:00 +0000,http://finance.yahoo.com/r/9f08b028-c429-393a-9ff5-1ffec2af0934/billionaires-best-healthcare-stock-picks-of-2017-s.aspx?yptr=yahoo&.tsrc=rss,"Why billionaire investors are loving Immunomedics, Achaogen, AveXis, Exact Sciences, and Clovis Oncology this year."
AVXS,AVXS:UW,BBG00BWQPDY9,Billionaires' Best Healthcare Stock Picks of 2017 (So Far),2017-03-21 19:02:00 +0000,https://www.fool.com/investing/2017/03/21/billionaires-best-healthcare-stock-picks-of-2017-s.aspx,Billionaires' Best Healthcare Stock Picks of 2017 (So Far)
AVXS,AVXS:UW,BBG00BWQPDY9,"AveXis, Inc. (AVXS) Looks Good: Stock Moves 15.4% Higher",2017-03-20 14:09:36 +0000,http://articlefeeds.nasdaq.com/~r/nasdaq/symbols/~3/6IW2Nkoidfg/avexis-inc-avxs-looks-good-stock-moves-154-higher-cm762741,AveXis Inc AVXS was a big mover last session as the company saw its shares rise above 15 on the day The upside was due to continuation of the rally triggered by the announcement of Phase 1 trial of AVXS 101 in spinal muscular atrophy SMA Type 1 Also this led to far more shares
AVXS,AVXS:UW,BBG00BWQPDY9,"AveXis, Inc. (AVXS) Looks Good: Stock Moves 15.4% Higher",2017-03-20 12:20:12 +0000,http://finance.yahoo.com/news/avexis-inc-avxs-looks-good-122012222.html?.tsrc=rss,"AveXis, Inc. (AVXS) shares rise above 15% in the last trading session."
AVXS,AVXS:UW,BBG00BWQPDY9,"AveXis, Inc. (AVXS) Looks Good: Stock Moves 15.4% Higher",2017-03-20 12:20:12 +0000,http://finance.yahoo.com/news/avexis-inc-avxs-looks-good-122012222.html,"AveXis, Inc. (AVXS) Looks Good: Stock Moves 15.4% Higher"
AVXS,AVXS:UW,BBG00BWQPDY9,"Notable Friday Option Activity: STZ, AVXS, GNMX",2017-03-17 21:06:32 +0000,http://articlefeeds.nasdaq.com/~r/nasdaq/symbols/~3/IVOFQ2Aptro/notable-friday-option-activity-stz-avxs-gnmx-cm762423,Among the underlying components of the Russell 3000 index we saw noteworthy options trading volume today in Constellation Brands Inc Symbol STZ where a total of 8 527 contracts have traded so far representing approximately 852 700 underlying shares That amounts to about 49 1 of STZ
AVXS,AVXS:UW,BBG00BWQPDY9,AveXis Inc Stock Is Spiking Again Today -- Here's Why,2017-03-17 17:06:28 +0000,http://articlefeeds.nasdaq.com/~r/nasdaq/symbols/~3/8XeRZwRxVLo/avexis-inc-stock-is-spiking-again-today-heres-why-cm762301,What happened Shares of AveXis Inc NASDAQ AVXS a clinical stage biotech company developing gene therapies are adding to a tremendous run up this year with a 16 8 gain as of 11 30 a m EDT during Friday s session Yesterday afternoon the company included phase 1 trial data
AVXS,AVXS:UW,BBG00BWQPDY9,AveXis Inc Stock Is Spiking Again Today -- Here's Why,2017-03-17 15:44:00 +0000,https://www.fool.com/investing/2017/03/17/avexis-inc-stock-is-spiking-again-today-heres-why.aspx,AveXis Inc Stock Is Spiking Again Today -- Here's Why
AVXS,AVXS:UW,BBG00BWQPDY9,AveXis Inc Stock Is Spiking Again Today -- Here's Why,2017-03-17 15:44:00 +0000,http://finance.yahoo.com/r/a3a340b7-9a55-3ce1-a087-4a71920bf288/avexis-inc-stock-is-spiking-again-today-heres-why.aspx?yptr=yahoo&.tsrc=rss,Fourth-quarter earnings included a clinical trial update that has Biogen and Ionis Pharmaceuticals investors nervous.
AVXS,AVXS:UW,BBG00BWQPDY9,"AveXis, Esperion and Amgen Among Biotech Movers",2017-03-17 15:03:00 +0000,http://finance.yahoo.com/r/d0065230-449a-37a1-a801-70aa4119c150/avexis-esperion-and-amgen-among-biotech-movers.html?puc=yahoo&cm_ven=YAHOO&yptr=yahoo&.tsrc=rss,"AveXis, Esperion Therapeutics, Medicines Co. and Amgen were among the biotech stock movers Friday morning."
AVXS,AVXS:UW,BBG00BWQPDY9,"[video]AveXis, Esperion and Amgen Among Biotech Movers",2017-03-17 15:03:00 +0000,https://www.thestreet.com/story/14049078/1/avexis-esperion-and-amgen-among-biotech-movers.html?puc=yahoo&cm_ven=YAHOO,"[video]AveXis, Esperion and Amgen Among Biotech Movers"
AVXS,AVXS:UW,BBG00BWQPDY9,AveXis Reports Positive Data for SMA Gene Therapy,2017-03-17 14:25:00 +0000,http://www.investopedia.com/news/avexis-sma-gene-drug-reports-positive-data-avxs/?partner=YahooSA,AveXis Reports Positive Data for SMA Gene Therapy
AVXS,AVXS:UW,BBG00BWQPDY9,AveXis Reports Positive Data for SMA Gene Therapy,2017-03-17 14:25:00 +0000,http://finance.yahoo.com/r/e8ce9b8d-5315-3a31-84f7-0382a5aa767a/avexis-sma-gene-drug-reports-positive-data-avxs?partner=YahooSA&yptr=yahoo&.tsrc=rss,"AveXis' spinal muscular atrophy drug, AVXS-101, reported encouraging results from a Phase 1 trial."
AVXS,AVXS:UW,BBG00BWQPDY9,AveXis Offers Easily The Best Treatment Option For SMA Type-1 Patients,2017-03-17 13:53:16 +0000,http://finance.yahoo.com/news/avexis-offers-easily-best-treatment-135316896.html,AveXis Offers Easily The Best Treatment Option For SMA Type-1 Patients
AVXS,AVXS:UW,BBG00BWQPDY9,AveXis Offers Easily The Best Treatment Option For SMA Type-1 Patients,2017-03-17 13:53:16 +0000,http://finance.yahoo.com/news/avexis-offers-easily-best-treatment-135316896.html?.tsrc=rss,"AveXis Inc (NASDAQ: AVXS ) announced top-line data from the phase I study for AVXS-101, an AAV  -based gene therapy , for spinal muscular atrophy  type 1. AVXS-101 could ..."
AVXS,AVXS:UW,BBG00BWQPDY9,AveXis Holding On To Substantial Gain In Afternoon Trading,2017-03-17 13:41:00 +0000,http://articlefeeds.nasdaq.com/~r/nasdaq/symbols/~3/hA-4bbOxIkw/avexis-holding-on-to-substantial-gain-in-afternoon-trading-20170317-00677,AveXis Holding On To Substantial Gain In Afternoon Trading
AVXS,AVXS:UW,BBG00BWQPDY9,"Stock Futures Hold Gains; Adobe, Tiffany, Steel Dynamics Climb",2017-03-17 12:48:22 +0000,http://www.investors.com/market-trend/stock-market-today/stock-futures-hold-tight-gains-boing-pops-on-apache-contract/?src=A00220A,"Stock Futures Hold Gains; Adobe, Tiffany, Steel Dynamics Climb"
AVXS,AVXS:UW,BBG00BWQPDY9,PBM Capital Group has completed the sale of a majority interest in Breas Medical Group to Fosun Pharma,2017-03-17 12:00:00 +0000,http://uk.finance.yahoo.com/news/pbm-capital-group-completed-sale-120000733.html,PBM Capital Group has completed the sale of a majority interest in Breas Medical Group to Fosun Pharma
AVXS,AVXS:UW,BBG00BWQPDY9,Edited Transcript of AVXS earnings conference call or presentation 16-Mar-17 8:30pm GMT,2017-03-17 10:57:47 +0000,http://finance.yahoo.com/news/edited-transcript-avxs-earnings-conference-105747141.html?.tsrc=rss,Q4 2016 AveXis Inc Earnings Call
AVXS,AVXS:UW,BBG00BWQPDY9,Edited Transcript of AVXS earnings conference call or presentation 16-Mar-17 8:30pm GMT,2017-03-17 10:57:47 +0000,http://finance.yahoo.com/news/edited-transcript-avxs-earnings-conference-105747141.html,Edited Transcript of AVXS earnings conference call or presentation 16-Mar-17 8:30pm GMT
AVXS,AVXS:UW,BBG00BWQPDY9,"Futures Steady: 2 'A' Stocks Set To Soar, 1 Mule Ready To Kick",2017-03-17 04:02:22 +0000,http://finance.yahoo.com/r/d9f9443c-00ae-3d31-a499-4b3aba499f7e/dow-sp-500-futures-steady-2-a-stocks-set-to-soar-1-mule-ready-to-kick?src=A00220A&yptr=yahoo&.tsrc=rss,"Stock futures signaled little change, but Adobe and biotech AveXis should jump to highs, while MuleSoft IPO debuts."
AVXS,AVXS:UW,BBG00BWQPDY9,"Futures Steady: 2 'A' Stocks Set To Soar, 1 Mule Ready To Kick",2017-03-17 04:02:22 +0000,http://www.investors.com/market-trend/stock-market-today/dow-sp-500-futures-steady-2-a-stocks-set-to-soar-1-mule-ready-to-kick/?src=A00220A,"Futures Steady: 2 'A' Stocks Set To Soar, 1 Mule Ready To Kick"
AVXS,AVXS:UW,BBG00BWQPDY9,"AVXS Abuzz, PTCT Slammed For Emflaza Deal, INNL Scouts For Buyer",2017-03-17 02:23:00 +0000,http://articlefeeds.nasdaq.com/~r/nasdaq/symbols/~3/bxNIUdejHpo/avxs-abuzz-ptct-slammed-for-emflaza-deal-innl-scouts-for-buyer-20170317-00039,"AVXS Abuzz, PTCT Slammed For Emflaza Deal, INNL Scouts For Buyer"
AVXS,AVXS:UW,BBG00BWQPDY9,"After-hours buzz: ADBE, AVXS, GOOS & more",2017-03-16 21:51:57 +0000,http://www.cnbc.com/id/104346949?__source=yahoo%7cfinance%7cheadline%7cheadline%7cstory&par=yahoo&doc=104346949,[at CNBC] - See which stocks are posting big moves after the bell.
AVXS,AVXS:UW,BBG00BWQPDY9,"After-hours buzz: ADBE, AVXS, GOOS & more",2017-03-16 21:51:57 +0000,http://finance.yahoo.com/news/hours-buzz-adbe-avxs-goos-215157013.html?.tsrc=rss,See which stocks are posting big moves after the bell.
AVXS,AVXS:UW,BBG00BWQPDY9,AveXis reports 4Q loss,2017-03-16 21:12:40 +0000,http://finance.yahoo.com/news/avexis-reports-4q-loss-211240704.html?.tsrc=rss,"On a per-share basis, the Bannockburn, Illinois-based company said it had a loss of 92 cents. The results missed Wall Street expectations. The average estimate of three analysts surveyed by Zacks Investment ..."
AVXS,AVXS:UW,BBG00BWQPDY9,AveXis reports 4Q loss,2017-03-16 21:12:40 +0000,http://finance.yahoo.com/news/avexis-reports-4q-loss-211240704.html,AveXis reports 4Q loss
AVXS,AVXS:UW,BBG00BWQPDY9,AveXis Inc Earnings Call scheduled for 4:30 pm ET today,2017-03-16 20:30:00 +0000,http://biz.yahoo.com/cc/8/156078.html,AveXis Inc Earnings Call scheduled for 4:30 pm ET today
AVXS,AVXS:UW,BBG00BWQPDY9,"AVEXIS, INC. Files SEC form 8-K, Results of Operations and Financial Condition, Regulation FD Disclosure, Financial S",2017-03-16 20:21:40 +0000,http://biz.yahoo.com/e/170316/avxs8-k.html,"AVEXIS, INC. Files SEC form 8-K, Results of Operations and Financial Condition, Regulation FD Disclosure, Financial S"
AVXS,AVXS:UW,BBG00BWQPDY9,4:08 pm AveXis misses by $0.19; reports topline results from the Phase 1 trial of AVXS-101 in SMA Type 1,2017-03-16 20:08:00 +0000,http://finance.yahoo.com/news/inplay-briefing-com-055139997.html#avxs,4:08 pm AveXis misses by $0.19; reports topline results from the Phase 1 trial of AVXS-101 in SMA Type 1
AVXS,AVXS:UW,BBG00BWQPDY9,AveXis Reports Topline Results from Phase 1 Trial of AVXS-101 in SMA Type 1 and Fourth Quarter and Full Year 2016 Financial and Operating Results,2017-03-16 20:05:00 +0000,http://finance.yahoo.com/news/avexis-reports-topline-results-phase-200500701.html?.tsrc=rss,–No new treatment-related safety or tolerability findings–– No new events reported and 15 of 15 patients event-free at 13.6 months of age; majority of patients receiving proposed therapeutic dose sit unassisted–– ...
AVXS,AVXS:UW,BBG00BWQPDY9,AveXis Reports Topline Results from Phase 1 Trial of AVXS-101 in SMA Type 1 and Fourth Quarter and Full Year 2016 Financial and Operating Results,2017-03-16 20:05:00 +0000,http://finance.yahoo.com/news/avexis-reports-topline-results-phase-200500701.html,[GlobeNewswire] - –No new treatment-related safety or tolerability findings–– No new events reported and 15 of 15 patients event-free at 13.6 months of age; majority of patients receiving proposed therapeutic dose sit unassisted–– ...
AVXS,AVXS:UW,BBG00BWQPDY9,"After-Hours Earnings Report for March 16, 2017 :  ADBE, AVXS, CAL, MG, OMER, PTCT, BTX, VSLR, CALA, VRAY, WLB, EXA",2017-03-16 18:52:04 +0000,http://articlefeeds.nasdaq.com/~r/nasdaq/symbols/~3/rPJGey0LdqE/after-hours-earnings-report-for-march-16-2017-adbe-avxs-cal-mg-omer-ptct-btx-vslr-cala-vray-wlb-exa-cm761835,The following companies are expected to report earnings after hours on 03 16 2017 Visit our Earnings Calendar for a full list of expected earnings releases Adobe Systems Incorporated ADBE is reporting for the quarter ending February 28 2017 The
AVXS,AVXS:UW,BBG00BWQPDY9,Q4 2016 AveXis Inc Earnings Release - After Market Close,2017-03-16 11:07:03 +0000,http://biz.yahoo.com/research/earncal/20170316.html?t=avxs,Q4 2016 AveXis Inc Earnings Release - After Market Close
AVXS,AVXS:UW,BBG00BWQPDY9,What's In Store For AVXS Today?,2017-03-16 05:18:00 +0000,http://articlefeeds.nasdaq.com/~r/nasdaq/symbols/~3/qhESsE5F0XA/whats-in-store-for-avxs-today-20170316-00169,What's In Store For AVXS Today?
AVXS,AVXS:UW,BBG00BWQPDY9,"5 Earnings Short-Squeeze Plays: Tiffany, Athene and More",2017-03-14 18:05:00 +0000,http://finance.yahoo.com/r/d41d09a4-cc70-3dad-8525-a90c775c79cc/5-earnings-short-squeeze-plays-tiffany-athene-and-more.html?puc=yahoo&cm_ven=YAHOO&yptr=yahoo&.tsrc=rss,These heavily shorted stocks could get squeezed higher if they report positive earnings this week.
AVXS,AVXS:UW,BBG00BWQPDY9,"5 Earnings Short-Squeeze Plays: Tiffany, Athene and More",2017-03-14 18:05:00 +0000,https://www.thestreet.com/story/14042475/1/5-earnings-short-squeeze-plays-tiffany-athene-and-more.html?puc=yahoo&cm_ven=YAHOO,"5 Earnings Short-Squeeze Plays: Tiffany, Athene and More"
AVXS,AVXS:UW,BBG00BWQPDY9,"Noteworthy Thursday Option Activity: AVXS, IBM, OMER",2017-03-09 18:12:59 +0000,http://articlefeeds.nasdaq.com/~r/nasdaq/symbols/~3/O9K5rYHraNg/noteworthy-thursday-option-activity-avxs-ibm-omer-cm758641,Among the underlying components of the Russell 3000 index we saw noteworthy options trading volume today in AveXis Inc Symbol AVXS where a total of 2 133 contracts have traded so far representing approximately 213 300 underlying shares That amounts to about 74 6 of AVXS s average
AVXS,AVXS:UW,BBG00BWQPDY9,Blog Coverage Heat Biologics Acquires Controlling Stake in Immuno-Oncology Company Pelican Therapeutics,2017-03-09 13:15:00 +0000,http://finance.yahoo.com/news/blog-coverage-heat-biologics-acquires-131500148.html?.tsrc=rss,"Upcoming AWS Coverage on AveXis Post-Earnings Results LONDON, UK / ACCESSWIRE / March 9, 2017 / Active Wall St. blog coverage looks at the headline from Heat Biologics, Inc. (NASDAQ: HTBX ) (""Heat"") ..."
AVXS,AVXS:UW,BBG00BWQPDY9,Blog Coverage Heat Biologics Acquires Controlling Stake in Immuno-Oncology Company Pelican Therapeutics,2017-03-09 13:15:00 +0000,http://finance.yahoo.com/news/blog-coverage-heat-biologics-acquires-131500148.html,"[Accesswire] - Upcoming AWS Coverage on AveXis Post-Earnings Results LONDON, UK / ACCESSWIRE / March 9, 2017 / Active Wall St. blog coverage looks at the headline from Heat Biologics, Inc. (NASDAQ: HTBX ) (""Heat"") ..."
AVXS,AVXS:UW,BBG00BWQPDY9,"AveXis to Report Topline Phase 1 Trial Results in SMA Type 1 and Fourth Quarter and Full Year 2016 Financial and Operating Results on March 16, 2017",2017-03-09 13:00:00 +0000,http://finance.yahoo.com/news/avexis-report-topline-phase-1-130000878.html?.tsrc=rss,"--Conference call and webcast on March 16 at 4:30 p.m. EDT--. CHICAGO, March 09, 2017-- AveXis, Inc., a clinical-stage gene therapy company developing treatments for patients suffering from rare and life-threatening ..."
AVXS,AVXS:UW,BBG00BWQPDY9,"AveXis to Report Topline Phase 1 Trial Results in SMA Type 1 and Fourth Quarter and Full Year 2016 Financial and Operating Results on March 16, 2017",2017-03-09 13:00:00 +0000,http://finance.yahoo.com/news/avexis-report-topline-phase-1-130000878.html,"[GlobeNewswire] - --Conference call and webcast on March 16 at 4:30 p.m. EDT--. CHICAGO, March 09, 2017-- AveXis, Inc., a clinical-stage gene therapy company developing treatments for patients suffering from rare and life-threatening ..."
AVXS,AVXS:UW,BBG00BWQPDY9,Puma Leads Massive Biotech Surge As Esperion Hits 15-Month High,2017-03-08 21:26:56 +0000,http://www.investors.com/news/technology/puma-leads-massive-biotech-surge-as-esperion-hits-15-month-high/?src=A00220A,Puma Leads Massive Biotech Surge As Esperion Hits 15-Month High
AVXS,AVXS:UW,BBG00BWQPDY9,Puma Leads Massive Biotech Surge As Esperion Hits 15-Month High,2017-03-08 21:26:56 +0000,http://finance.yahoo.com/r/854c6c59-6440-3d2f-a760-5c994a4d9f36/puma-leads-massive-biotech-surge-as-esperion-hits-15-month-high?src=A00220A&yptr=yahoo&.tsrc=rss,"Esperion stock hit a 15-month high Wednesday on a broad biotech surge that saw Puma, AveXis and Bluebird leap."
AVXS,AVXS:UW,BBG00BWQPDY9,5 Things Biogen's CEO Just Said That You Don't Want to Miss,2017-03-07 23:14:13 +0000,http://articlefeeds.nasdaq.com/~r/nasdaq/symbols/~3/pa4DV7hwBJ0/5-things-biogens-ceo-just-said-that-you-dont-want-to-miss-cm757608,Despite headwinds for its multiple sclerosis MS franchise Biogen NASDAQ BIIB has been on a roll lately The biotech won U S regulatory approval for spinal muscular atrophy SMA drug Spinraza in December It also spun off its hemophilia business into a new company
AVXS,AVXS:UW,BBG00BWQPDY9,AveXis to Present Results from Phase 1 Trial of AVXS-101 in SMA Type 1 at AAN Annual Meeting,2017-03-02 21:05:00 +0000,http://finance.yahoo.com/news/avexis-present-results-phase-1-210500463.html,"[GlobeNewswire] - CHICAGO, March 02, 2017-- AveXis, Inc., a clinical-stage gene therapy company developing treatments for patients suffering from rare and life-threatening neurological genetic diseases, today announced ..."
AVXS,AVXS:UW,BBG00BWQPDY9,AveXis to Present Results from Phase 1 Trial of AVXS-101 in SMA Type 1 at AAN Annual Meeting,2017-03-02 21:05:00 +0000,http://finance.yahoo.com/news/avexis-present-results-phase-1-210500463.html?.tsrc=rss,"CHICAGO, March 02, 2017-- AveXis, Inc., a clinical-stage gene therapy company developing treatments for patients suffering from rare and life-threatening neurological genetic diseases, today announced ..."
AVXS,AVXS:UW,BBG00BWQPDY9,"Boxer Capital, LLC Buys AveXis, BeiGene, Alnylam Pharmaceuticals, Sells Biomarin ...",2017-02-17 20:51:26 +0000,http://articlefeeds.nasdaq.com/~r/nasdaq/symbols/~3/XwYgiiI0jBI/boxer-capital-llc-buys-avexis-beigene-alnylam-pharmaceuticals-sells-biomarin-cm749825,Boxer Capital LLC New Purchases ALNY ALXN SBBP SNSS BLPH RXDX Added Positions AVXS BGNE MDCO Reduced Positions SGEN CLVS ARDM Sold Out BMRN RIGL HRTX EBIO EPIX New Purchases ALNY ALXN SBBP SNSS BLPH RXDX
AVXS,AVXS:UW,BBG00BWQPDY9,3 Stocks Setting Up for Major Breakouts,2017-02-17 19:26:00 +0000,http://finance.yahoo.com/r/3df4cabc-4f2c-3e95-a0bd-14bb9fc68be8/5-stocks-setting-up-for-major-breakouts.html?puc=yahoo&cm_ven=YAHOO&yptr=yahoo&.tsrc=rss,Here's how to rake in the gains off some potential major breakouts.
AVXS,AVXS:UW,BBG00BWQPDY9,3 Stocks Setting Up for Major Breakouts,2017-02-17 19:26:00 +0000,https://www.thestreet.com/story/14006716/1/5-stocks-setting-up-for-major-breakouts.html?puc=yahoo&cm_ven=YAHOO,3 Stocks Setting Up for Major Breakouts
AVXS,AVXS:UW,BBG00BWQPDY9,AveXis Appoints Rick Modi as Senior Vice President and Chief Business Officer,2017-02-15 13:00:00 +0000,http://finance.yahoo.com/news/avexis-appoints-rick-modi-senior-130000783.html?.tsrc=rss,"CHICAGO, Feb. 15, 2017-- AveXis, Inc., a clinical-stage gene therapy company developing treatments for patients suffering from rare and life-threatening neurological genetic diseases, today announced the ..."
AVXS,AVXS:UW,BBG00BWQPDY9,AveXis Appoints Rick Modi as Senior Vice President and Chief Business Officer,2017-02-15 13:00:00 +0000,http://finance.yahoo.com/news/avexis-appoints-rick-modi-senior-130000783.html,"[GlobeNewswire] - CHICAGO, Feb. 15, 2017-- AveXis, Inc., a clinical-stage gene therapy company developing treatments for patients suffering from rare and life-threatening neurological genetic diseases, today announced the ..."
AVXS,AVXS:UW,BBG00BWQPDY9,Abeona: Preparing For Liftoff - The Next Avexis?,2017-02-14 15:18:20 +0000,http://articlefeeds.nasdaq.com/~r/nasdaq/symbols/~3/-b2MqGaF2SE/abeona-preparing-for-liftoff-the-next-avexis-cm747604,By World s Greatest ByWorld s Greatest Executive Summary and Investment Thesis Executive Summary and Investment ThesisExecutive Summary and Investment Thesis Abeona Therapeutics ABEO is a biotechnology company with a number of early and late stage assets This week the company
AVXS,AVXS:UW,BBG00BWQPDY9,"[$$] Venrock Refuels, and Goes Back on the Hunt",2017-02-09 23:53:18 +0000,https://www.wsj.com/articles/venrock-refuels-and-goes-back-on-the-hunt-1486684393?mod=yahoo_hs,"[$$] Venrock Refuels, and Goes Back on the Hunt"
AVXS,AVXS:UW,BBG00BWQPDY9,Chardan Analyst Suggests An AveXis-Ionis Pair Trade,2017-02-06 15:41:43 +0000,http://finance.yahoo.com/news/chardan-analyst-suggests-avexis-ionis-154143342.html,Chardan Analyst Suggests An AveXis-Ionis Pair Trade
AVXS,AVXS:UW,BBG00BWQPDY9,Health Care Sector Update for 02/06/2017: AVXS,2017-02-06 14:57:19 +0000,http://articlefeeds.nasdaq.com/~r/nasdaq/symbols/~3/9QFFEZeijMo/health-care-sector-update-for-02062017-avxs-cm743542,Top Health care stocks Top Health care stocks JNJ 0 3 JNJ 0 3 PFE 0 1 PFE 0 1 ABT flatABT flat MRK 0 5 MRK 0 5 AMGN 0 4 AMGN 0 4 Health care shares were mainly lower in pre market trade on Monday Health care shares were mainly lower in pre market trade on Monday
AVXS,AVXS:UW,BBG00BWQPDY9,"AVEXIS, INC. Files SEC form 8-K, Other Events, Financial Statements and Exhibits",2017-02-06 13:27:48 +0000,http://biz.yahoo.com/e/170206/avxs8-k.html,"AVEXIS, INC. Files SEC form 8-K, Other Events, Financial Statements and Exhibits"
AVXS,AVXS:UW,BBG00BWQPDY9,AveXis Announces Single-Arm Design for European Pivotal Study of AVXS-101 in SMA Type 1 Patients,2017-02-06 13:00:00 +0000,http://finance.yahoo.com/news/avexis-announces-single-arm-design-130000763.html,"[GlobeNewswire] - CHICAGO, Feb. 06, 2017-- AveXis, Inc., a clinical-stage gene therapy company developing treatments for patients suffering from rare and life-threatening neurological genetic diseases, today announced that ..."
AVXS,AVXS:UW,BBG00BWQPDY9,AveXis Gene Therapy AVXS-101 Granted Access into EMA PRIME Program for Spinal Muscular Atrophy Type 1,2017-01-31 13:00:00 +0000,http://finance.yahoo.com/news/avexis-gene-therapy-avxs-101-130000117.html,"[GlobeNewswire] - CHICAGO, Jan. 31, 2017-- AveXis, Inc., a clinical-stage gene therapy company developing treatments for patients suffering from rare and life-threatening neurological genetic diseases, today announced that ..."
AVXS,AVXS:UW,BBG00BWQPDY9,Hurry! These 5 Stocks Are About to Break Out Explosively,2017-01-13 19:35:00 +0000,https://www.thestreet.com/story/13953629/1/5-stocks-setting-up-for-explosive-breakout-trades-including-gnc.html?puc=yahoo&cm_ven=YAHOO,Hurry! These 5 Stocks Are About to Break Out Explosively
AVXS,AVXS:UW,BBG00BWQPDY9,"AVEXIS, INC. Files SEC form 8-K, Regulation FD Disclosure, Financial Statements and Exhibits",2017-01-09 14:16:59 +0000,http://biz.yahoo.com/e/170109/avxs8-k.html,"AVEXIS, INC. Files SEC form 8-K, Regulation FD Disclosure, Financial Statements and Exhibits"
AVXS,AVXS:UW,BBG00BWQPDY9,Will 2017 IPO Market Revive After Dismal 2016?,2017-01-03 22:38:21 +0000,http://articlefeeds.nasdaq.com/~r/nasdaq/symbols/~3/zOuZiqbrD_s/will-2017-ipo-market-revive-after-dismal-2016-cm728948,Proceeds from the U S Initial Public Offerings IPOs slowed down in 2016 as 105 IPOs raised only 18 8 billion which was the lowest since 2003 Median deal size of 95 million remained below 100 million for the second consecutive year According to Renaissance Capital the primary
AVXS,AVXS:UW,BBG00BWQPDY9,AveXis to Present at the 35th Annual J.P. Morgan Healthcare Conference,2017-01-03 13:00:00 +0000,http://finance.yahoo.com/news/avexis-present-35th-annual-j-130000612.html,"[GlobeNewswire] - CHICAGO, Jan. 03, 2017-- AveXis, Inc., a clinical-stage gene therapy company developing treatments for patients suffering from rare and life-threatening neurological genetic diseases, today announced Sean ..."
AVXS,AVXS:UW,BBG00BWQPDY9,"Biotech's Top 3 Stock Losers, and Winners, in 2016",2016-12-30 19:23:00 +0000,http://www.forbes.com/sites/luketimmerman/2016/12/30/biotechs-top-3-stock-losers-and-winners-in-2016/?utm_source=yahoo&utm_medium=partner&utm_campaign=yahootix&partner=yahootix,"Biotech's Top 3 Stock Losers, and Winners, in 2016"
AVXS,AVXS:UW,BBG00BWQPDY9,"Top Analyst Upgrades and Downgrades: Biogen, Comerica, Deere, NVIDIA, 21st Century Fox and More",2016-12-29 14:25:38 +0000,http://247wallst.com/investing/2016/12/29/top-analyst-upgrades-and-downgrades-biogen-comerica-deere-nvidia21st-century-fox-and-more/,"Top Analyst Upgrades and Downgrades: Biogen, Comerica, Deere, NVIDIA, 21st Century Fox and More"
AVXS,AVXS:UW,BBG00BWQPDY9,Avexis Inc. (AVXS): RA Capital Management Ups Its Stake,2016-12-27 12:45:39 +0000,http://www.insidermonkey.com/blog/avexis-inc-avxs-ra-capital-management-ups-its-stake-513023/,Avexis Inc. (AVXS): RA Capital Management Ups Its Stake
AVXS,AVXS:UW,BBG00BWQPDY9,AveXis to Use Intended Commercial GMP Product in SMA Type 2 Study,2016-12-21 22:12:08 +0000,http://www.publicnow.com/view/8D476982B5D6485B0B49F95ADD081079641AE260,"[at noodls] - - SMA Type 2 study to initiate in Q2 2017 - - Streamlines development of Type 2 clinical data set - - Conference call and webcast December 21, at 4:30 p.m. EST - CHICAGO, Dec. 21, 2016 (GLOBE NEWSWIRE) ..."
AVXS,AVXS:UW,BBG00BWQPDY9,"AVEXIS, INC. Files SEC form 8-K, Other Events, Financial Statements and Exhibits",2016-12-21 21:08:03 +0000,http://biz.yahoo.com/e/161221/avxs8-k.html,"AVEXIS, INC. Files SEC form 8-K, Other Events, Financial Statements and Exhibits"
AVXS,AVXS:UW,BBG00BWQPDY9,3 Reasons Biogen Inc. Stock Is Set to Soar in 2017,2016-12-20 22:36:26 +0000,http://www.fool.com/investing/2016/12/20/3-reasons-biogen-inc-stock-is-set-to-soar-in-2017.aspx?source=yahoo-2&utm_campaign=article&utm_medium=feed&utm_source=yahoo-2,3 Reasons Biogen Inc. Stock Is Set to Soar in 2017
