AVXS,AVXS:UW,BBG00BWQPDY9,3 Reasons Biogen Inc. Stock Is Set to Soar in 2017,2016-12-20 21:57:06 +0000,http://articlefeeds.nasdaq.com/~r/nasdaq/symbols/~3/8slgPY6_Fy4/3-reasons-biogen-inc-stock-is-set-to-soar-in-2017-cm724261,It s looking like 2016 will turn out to be disappointing for Biogen NASDAQ BIIB shareholders Part of the stock s lackluster performance stemmed from a midstage clinical setback for experimental multiple sclerosis drug opicinumab The broader slowdown for biotech stocks was
AVXS,AVXS:UW,BBG00BWQPDY9,Citron Research On AveXis: This Will Be One Of 2017's Biotech Blowups,2016-12-15 16:03:24 +0000,http://finance.yahoo.com/news/citron-research-avexis-one-2017s-160324347.html,Citron Research On AveXis: This Will Be One Of 2017's Biotech Blowups
AVXS,AVXS:UW,BBG00BWQPDY9,Do Hedge Funds Love ClubCorp Holdings Inc (MYCC)?,2016-12-07 07:36:35 +0000,http://www.insidermonkey.com/blog/do-hedge-funds-love-clubcorp-holdings-inc-mycc-500334/,Do Hedge Funds Love ClubCorp Holdings Inc (MYCC)?
AVXS,AVXS:UW,BBG00BWQPDY9,3 Things You Need to Know About Ionis Pharmaceuticals' Pipeline,2016-12-02 13:03:04 +0000,http://www.fool.com/investing/2016/12/01/3-things-you-need-to-know-about-ionis-pharmaceutic.aspx?source=yahoo-2&utm_campaign=article&utm_medium=feed&utm_source=yahoo-2,3 Things You Need to Know About Ionis Pharmaceuticals' Pipeline
AVXS,AVXS:UW,BBG00BWQPDY9,3 Things You Need to Know About Ionis Pharmaceuticals' Pipeline,2016-12-01 14:17:53 +0000,http://articlefeeds.nasdaq.com/~r/nasdaq/symbols/~3/TeigZk1o1zc/3-things-you-need-to-know-about-ionis-pharmaceuticals-pipeline-cm716200,Few biotechs have as robust of a pipeline as Ionis Pharmaceuticals NASDAQ IONS The company has certainly experienced ups and downs in 2016 with its pipeline candidates but Ionis is ending the year on a good note Wade Walke vice president of corporate communications
AVXS,AVXS:UW,BBG00BWQPDY9,Ionis Pharmaceuticals Inc Back in the Black (for Now),2016-11-11 22:28:30 +0000,http://articlefeeds.nasdaq.com/~r/nasdaq/symbols/~3/fUqj3sxSNoQ/ionis-pharmaceuticals-inc-back-in-the-black-for-now-cm708133,Image source Getty Images Ionis Pharmaceuticals NASDAQ IONS reported third quarter earnings on Wednesday but investors are rightfully focused on the pending approval of Spinraza for spinal muscular atrophy SMA and its progressing pipeline Ionis Pharmaceuticals
AVXS,AVXS:UW,BBG00BWQPDY9,AveXis reports 3Q loss,2016-11-10 22:02:28 +0000,http://sg.finance.yahoo.com/news/avexis-reports-3q-loss-220228251.html,AveXis reports 3Q loss
AVXS,AVXS:UW,BBG00BWQPDY9,AveXis Reports Third Quarter 2016 Financial and Operating Results,2016-11-10 21:11:13 +0000,http://www.publicnow.com/view/A5406A7D0F473A0545E50D4D4D5C6B3DD040526C,[at noodls] - - AVXS-101 demonstrated continued motor function improvement in ongoing study; majority of patients on proposed therapeutic dose achieved key developmental milestones - - Confirmed single-arm design for ...
AVXS,AVXS:UW,BBG00BWQPDY9,"AVEXIS, INC. Files SEC form 8-K, Results of Operations and Financial Condition, Financial Statements and Exhibits",2016-11-10 21:07:12 +0000,http://biz.yahoo.com/e/161110/avxs8-k.html,"AVEXIS, INC. Files SEC form 8-K, Results of Operations and Financial Condition, Financial Statements and Exhibits"
AVXS,AVXS:UW,BBG00BWQPDY9,Drug Stocks Surge on Trump Win: 5 Stocks to Buy Now,2016-11-10 15:56:57 +0000,http://articlefeeds.nasdaq.com/~r/nasdaq/symbols/~3/e8xd6YkfwdM/drug-stocks-surge-on-trump-win-5-stocks-to-buy-now-cm707089,The Presidential election is finally over and the stock market has reacted favorably to Donald Trump s surprise win with the S amp P 500 rising 1 1 the Dow Jones Industrial Average surging 1 4 and the NASDAQ gaining 1 1 Finance energy pharma biotech financial services
AVXS,AVXS:UW,BBG00BWQPDY9,Drug Stocks Surge on Trump Win: 5 Stocks to Buy Now,2016-11-10 13:31:01 +0000,http://finance.yahoo.com/news/drug-stocks-surge-trump-win-133101328.html,Drug Stocks Surge on Trump Win: 5 Stocks to Buy Now
AVXS,AVXS:UW,BBG00BWQPDY9,Q3 2016 AveXis Inc Earnings Release - After Market Close,2016-11-10 12:07:09 +0000,http://biz.yahoo.com/research/earncal/20161110.html?t=avxs,Q3 2016 AveXis Inc Earnings Release - After Market Close
AVXS,AVXS:UW,BBG00BWQPDY9,Should You Sell AveXis (AVXS) Before Earnings?,2016-11-09 17:55:38 +0000,http://articlefeeds.nasdaq.com/~r/nasdaq/symbols/~3/d5S2sV4m4oA/should-you-sell-avexis-avxs-before-earnings-cm706575,Investors are always looking for stocks that are poised to beat at earnings season and AveXis Inc AVXS may be one such company The firm has earnings coming up pretty soon and events are shaping up quite nicely for their report That is because AveXisis seeing favorable earnings
AVXS,AVXS:UW,BBG00BWQPDY9,Teva (TEVA): Can it Keep the Earnings Streak Alive in Q3?,2016-11-09 16:56:45 +0000,http://articlefeeds.nasdaq.com/~r/nasdaq/symbols/~3/83DGZSqKNog/teva-teva-can-it-keep-the-earnings-streak-alive-in-q3-cm706520,Teva Pharmaceutical Industries Ltd TEVA will be reporting third quarter 2016 earnings on Nov 15 before market open Last quarter the company delivered a positive earnings surprise of 5 93 The generic drug maker has been consistently beating earnings expectations The company s
AVXS,AVXS:UW,BBG00BWQPDY9,Should You Sell AveXis (AVXS) Before Earnings?,2016-11-09 15:36:03 +0000,http://finance.yahoo.com/news/sell-avexis-avxs-earnings-153603048.html,Should You Sell AveXis (AVXS) Before Earnings?
AVXS,AVXS:UW,BBG00BWQPDY9,"Drug Stocks Q3 Earnings Roster for Nov 10: AVXS, GBT & BPMC",2016-11-09 13:10:01 +0000,http://finance.yahoo.com/news/drug-stocks-q3-earnings-roster-131001723.html,"Drug Stocks Q3 Earnings Roster for Nov 10: AVXS, GBT & BPMC"
AVXS,AVXS:UW,BBG00BWQPDY9,Adverum (ADVM) Q3 Earnings Preview: What's in the Cards?,2016-11-08 18:33:38 +0000,http://articlefeeds.nasdaq.com/~r/nasdaq/symbols/~3/pq-qRep56m0/adverum-advm-q3-earnings-preview-whats-in-the-cards-cm705445,Adverum Biotechnologies Inc ADVM is expected to report third quarter 2016 results on Nov 14 In the last reported quarter Adverum posted a positive surprise of 5 26 Adverum has a dismal track record with the company missing estimates in three of the last four quarters bringing
AVXS,AVXS:UW,BBG00BWQPDY9,"Spinal Muscular Atrophy in Focus as Biogen, IONS Shoot Up on Data",2016-11-08 13:19:01 +0000,http://finance.yahoo.com/news/spinal-muscular-atrophy-focus-biogen-131901364.html,"Spinal Muscular Atrophy in Focus as Biogen, IONS Shoot Up on Data"
AVXS,AVXS:UW,BBG00BWQPDY9,AveXis to Present at Jefferies 2016 London Healthcare Conference,2016-11-08 13:00:00 +0000,http://finance.yahoo.com/news/avexis-present-jefferies-2016-london-130000325.html,"[GlobeNewswire] - CHICAGO, Nov. 08, 2016-- AveXis, Inc., a clinical-stage gene therapy company developing treatments for patients suffering from rare and life-threatening neurological genetic diseases, today announced that ..."
AVXS,AVXS:UW,BBG00BWQPDY9,Immune Design (IMDZ): Stock to Disappoint in Q3 Earnings?,2016-11-08 00:53:09 +0000,http://articlefeeds.nasdaq.com/~r/nasdaq/symbols/~3/e3YoJaB6ZL4/immune-design-imdz-stock-to-disappoint-in-q3-earnings-cm705326,Immune Design Corp IMDZ is scheduled to report third quarter 2016 results after the market closes on Nov 9 In the last reported quarter Immune Design posted a negative surprise of 4 41 The company reported a wider than expected loss in two of the four trailing quarters and
AVXS,AVXS:UW,BBG00BWQPDY9,Catalyst Pharma (CPRX) Q3 Earnings: Will Stock Surprise?,2016-11-07 16:02:54 +0000,http://articlefeeds.nasdaq.com/~r/nasdaq/symbols/~3/tNcJDvIAfSE/catalyst-pharma-cprx-q3-earnings-will-stock-surprise-cm704908,Catalyst Pharmaceuticals Inc CPRX is scheduled to report third quarter 2016 results on Nov 9 after market close Last quarter the company s loss was narrower than expected Catalyst s performance so far has been mixed The company beat expectations in two of the last four quarters
AVXS,AVXS:UW,BBG00BWQPDY9,Can The Uptrend Continue for AveXis (AVXS)?,2016-11-04 14:13:47 +0000,http://articlefeeds.nasdaq.com/~r/nasdaq/symbols/~3/ZT-ALBExcJU/can-the-uptrend-continue-for-avexis-avxs-cm704042,Investors certainly have to be happy with AveXis Inc AVXS and its short term performance After all the stock has jumped by 33 2 in the past 4 weeks and it is also above its 20 Day Simple Moving Average as well This is certainly a good trend but investors are probably asking
AVXS,AVXS:UW,BBG00BWQPDY9,Can The Uptrend Continue for AveXis (AVXS)?,2016-11-04 13:20:01 +0000,http://finance.yahoo.com/news/uptrend-continue-avexis-avxs-132001904.html,Can The Uptrend Continue for AveXis (AVXS)?
AVXS,AVXS:UW,BBG00BWQPDY9,AveXis Inc (AVXS): Of Course The FDA Didn’t Ask For Placebo Data,2016-11-03 16:09:30 +0000,http://www.insidermonkey.com/blog/avexis-inc-avxs-of-course-the-fda-didnt-ask-for-placebo-data-484792/,AveXis Inc (AVXS): Of Course The FDA Didn’t Ask For Placebo Data
AVXS,AVXS:UW,BBG00BWQPDY9,"CEMP Loses Big As D-Day Nears, AVXS Catches Investors'' Eyes, No Respite For OPXA",2016-11-03 02:18:00 +0000,http://articlefeeds.nasdaq.com/~r/nasdaq/symbols/~3/HYQ7fJGCKSc/cemp-loses-big-as-dday-nears-avxs-catches-investors-eyes-no-respite-for-opxa-20161103-00039,"CEMP Loses Big As D-Day Nears, AVXS Catches Investors'' Eyes, No Respite For OPXA"
AVXS,AVXS:UW,BBG00BWQPDY9,Here's Why AveXis Shot Up 24.5% Today,2016-11-02 19:08:39 +0000,http://articlefeeds.nasdaq.com/~r/nasdaq/symbols/~3/pB5GXe981gQ/heres-why-avexis-shot-up-245-today-cm702731,Image source Getty Images What happened Shares of AveXis NASDAQ AVXS were up over 24 today after the gene therapy biopharma announced 160 plans for a single arm design for a trial to evaluate its leading drug candidate against spinal muscular atrophy or SMA So
AVXS,AVXS:UW,BBG00BWQPDY9,Here's Why AveXis Shot Up 24.5% Today,2016-11-02 17:41:18 +0000,http://www.fool.com/investing/2016/11/02/heres-why-avexis-shot-up-245-today.aspx?source=yahoo-2&utm_campaign=article&utm_medium=feed&utm_source=yahoo-2,Here's Why AveXis Shot Up 24.5% Today
AVXS,AVXS:UW,BBG00BWQPDY9,AveXis Announces Single-Arm Design for U.S. Pivotal Study of AVXS-101 in SMA Type 1 Patients,2016-11-01 20:16:10 +0000,http://www.publicnow.com/view/772AEF35308409F017D80CDF84216624D38CE9C6,"[at noodls] - - Company provides update following receipt of FDA minutes from Type B meeting - - Conference call and webcast November 1 at 4:30 p.m. EDT - CHICAGO, Nov. 01, 2016 (GLOBE NEWSWIRE) -- AveXis, Inc. (NASDAQ:AVXS), ..."
AVXS,AVXS:UW,BBG00BWQPDY9,"AVEXIS, INC. Files SEC form 8-K, Other Events, Financial Statements and Exhibits",2016-11-01 20:10:40 +0000,http://biz.yahoo.com/e/161101/avxs8-k.html,"AVEXIS, INC. Files SEC form 8-K, Other Events, Financial Statements and Exhibits"
AVXS,AVXS:UW,BBG00BWQPDY9,Humana (HUM) Likely to Top Q3 Earnings; Stock to Gain?,2016-11-01 17:16:41 +0000,http://articlefeeds.nasdaq.com/~r/nasdaq/symbols/~3/AqKSgcF0hec/humana-hum-likely-to-top-q3-earnings-stock-to-gain-cm701897,We expect 160 Humana Inc HUM to beat expectations when it reports third quarter results on Nov 4 before the market opens Why a Likely Positive Surprise Our proven model shows that Humana has the right combination of two key ingredients to beat estimates Zacks
AVXS,AVXS:UW,BBG00BWQPDY9,AveXis to Report Third Quarter 2016 Financial and Operating Results,2016-10-31 12:13:08 +0000,http://www.publicnow.com/view/89D882294803E6B4C9690888AFEBB449BCD7B7EA,"[at noodls] - CHICAGO, Oct. 31, 2016 (GLOBE NEWSWIRE) -- AveXis, Inc. (NASDAQ:AVXS), a clinical-stage gene therapy company developing treatments for patients suffering from rare and life-threatening neurological genetic ..."
AVXS,AVXS:UW,BBG00BWQPDY9,"If you want to know which way the market is heading, follow the leaders",2016-10-17 18:27:35 +0000,http://www.marketwatch.com/News/Story/Story.aspx?guid=289AC500-4ED1-46ED-917B-0402209CE1BC&siteid=yhoof2,"If you want to know which way the market is heading, follow the leaders"
AVXS,AVXS:UW,BBG00BWQPDY9,Is AveXis a Major Threat to Ionis Pharmaceuticals?,2016-10-14 13:43:02 +0000,http://articlefeeds.nasdaq.com/~r/nasdaq/symbols/~3/bnW__aKfJbI/is-avexis-a-major-threat-to-ionis-pharmaceuticals-cm693302,Image source AveXis Inc Shares of 160 Ionis Pharmaceuticals Inc NASDAQ IONS 160 have lost about 12 1 of their value since AveXis Inc NASDAQ AVXS shared early evidence that its gene therapy benefited infants with spinal muscular atrophy SMA One of the
AVXS,AVXS:UW,BBG00BWQPDY9,Is AveXis a Major Threat to Ionis Pharmaceuticals?,2016-10-14 11:44:19 +0000,http://www.fool.com/investing/2016/10/14/is-avexis-a-major-threat-to-ionis-pharmaceuticals.aspx?source=yahoo-2&utm_campaign=article&utm_medium=feed&utm_source=yahoo-2,Is AveXis a Major Threat to Ionis Pharmaceuticals?
AVXS,AVXS:UW,BBG00BWQPDY9,"AVEXIS, INC. Files SEC form 8-K, Regulation FD Disclosure, Other Events, Financial Statements and Exhibits",2016-10-11 20:32:16 +0000,http://biz.yahoo.com/e/161011/avxs8-k.html,"AVEXIS, INC. Files SEC form 8-K, Regulation FD Disclosure, Other Events, Financial Statements and Exhibits"
AVXS,AVXS:UW,BBG00BWQPDY9,Biogen Gets Competition for SMA Therapy (BIIB),2016-10-11 19:40:00 +0000,http://www.investopedia.com/news/biogen-gets-competition-sma-therapy-biib/?partner=YahooSA,Biogen Gets Competition for SMA Therapy (BIIB)
AVXS,AVXS:UW,BBG00BWQPDY9,AveXis to Host Webcast Update of Data from Ongoing Phase 1 Clinical Trial of AVXS-101 in Spinal Muscular Atrophy Type 1,2016-10-10 11:13:09 +0000,http://www.publicnow.com/view/14AAFD4250823B439D3913D5C7170EEC02190C11,"[at noodls] - -- Data, Including Developmental Milestones, as of September 15, 2016 as presented by Jerry Mendell, M.D. at the International Annual Congress of the World Muscle Society -- -- Webcast Today, October 10, ..."
AVXS,AVXS:UW,BBG00BWQPDY9,AveXis Reports Interim Data from Ongoing Phase 1 Clinical Trial of AVXS-101 in Spinal Muscular Atrophy Type 1 as Presented at the International Annual Congress of the World Muscle Society,2016-10-08 13:23:05 +0000,http://www.publicnow.com/view/7754BE1DCC311A76CE143AD65CAA573C407B320C,[at noodls] - -- Majority of patients on the proposed therapeutic dose achieved key developmental milestones including sitting unassisted; two patients walking independently -- -- Conference call and webcast October ...
AVXS,AVXS:UW,BBG00BWQPDY9,Video Stock Market Analysis 10/7/16,2016-10-07 20:55:08 +0000,http://finance.yahoo.com/tumblr/blog-video-stock-market-analysis-10716-205513362.html,Video Stock Market Analysis 10/7/16
AVXS,AVXS:UW,BBG00BWQPDY9,A Few Recent IPOs that I am Watching,2016-10-03 15:19:47 +0000,http://finance.yahoo.com/tumblr/blog-a-few-recent-ipos-that-i-am-watching-151949097.html,A Few Recent IPOs that I am Watching
AVXS,AVXS:UW,BBG00BWQPDY9,Red-Hot Biotechs Highlight Jefferies Top Stocks to Buy This Week,2016-09-28 14:35:59 +0000,http://247wallst.com/healthcare-business/2016/09/28/red-hot-biotechs-highlight-jefferies-top-stocks-to-buy-this-week/,Red-Hot Biotechs Highlight Jefferies Top Stocks to Buy This Week
AVXS,AVXS:UW,BBG00BWQPDY9,[$$] Abeona Expands Opportunity With Partnerships,2016-09-23 20:08:00 +0000,http://www.barrons.com/articles/abeona-expands-opportunity-with-partnerships-1474661316?mod=yahoobarrons&ru=yahoo,[$$] Abeona Expands Opportunity With Partnerships
AVXS,AVXS:UW,BBG00BWQPDY9,AveXis (AVXS) Shows Strength: Stock Adds 6.3% in Session,2016-09-20 14:24:55 +0000,http://articlefeeds.nasdaq.com/~r/nasdaq/symbols/~3/CgI5Zey7kM0/avexis-avxs-shows-strength-stock-adds-63-in-session-cm681867,AveXis Inc AVXS was a big mover last session as its shares rose a little over 6 on the day The move came on solid volume too with far more shares changing hands than in a normal session This breaks the recent trend of the company as the stock is now trading above the volatile price
AVXS,AVXS:UW,BBG00BWQPDY9,AveXis (AVXS) Shows Strength: Stock Adds 6.3% in Session,2016-09-20 12:25:12 +0000,http://finance.yahoo.com/news/avexis-avxs-shows-strength-stock-122512922.html,AveXis (AVXS) Shows Strength: Stock Adds 6.3% in Session
AVXS,AVXS:UW,BBG00BWQPDY9,"[$$] Nationwide Children's Hospital, Rev1 Form Seed Fund",2016-09-20 11:30:31 +0000,http://www.wsj.com/articles/nationwide-childrens-hospital-rev1-form-seed-fund-1474371009?mod=yahoo_hs,"[$$] Nationwide Children's Hospital, Rev1 Form Seed Fund"
AVXS,AVXS:UW,BBG00BWQPDY9,These 7 Stocks Are Spiking on Big Volume,2016-09-09 12:24:00 +0000,https://www.thestreet.com/story/13699697/1/these-7-stocks-are-spiking-on-big-volume.html?puc=yahoo&cm_ven=YAHOO,These 7 Stocks Are Spiking on Big Volume
AVXS,AVXS:UW,BBG00BWQPDY9,"Pre-Market Most Active for Sep 8, 2016 :  TWTR, RAD, AZN, SMFG, AMH, SNY, AAPL, TSCO, QQQ, SUNS, TVIX, AVXS",2016-09-08 12:57:17 +0000,http://articlefeeds.nasdaq.com/~r/nasdaq/symbols/~3/hEANc_Mec_A/pre-market-most-active-for-sep-8-2016-twtr-rad-azn-smfg-amh-sny-aapl-tsco-qqq-suns-tvix-avxs-cm676094,The NASDAQ 100 Pre Market Indicator is down 2 55 to 4 829 31 The total Pre Market volume is currently 11 167 721 shares traded The following are the most active stocks for the pre market session Twitter Inc TWTR is 1 02 at 18 85 with 2 270 297 shares traded TWTR
AVXS,AVXS:UW,BBG00BWQPDY9,AveXis Announces Pricing of Public Offering of Common Stock,2016-09-08 12:09:07 +0000,http://www.publicnow.com/view/64D7107E91F192AB062728A575439C9BD804E25F,"[at noodls] - CHICAGO, Sept. 08, 2016 (GLOBE NEWSWIRE) -- AveXis, Inc. (NASDAQ:AVXS) today announced the pricing of an underwritten public offering of 4,250,000 shares of its common stock, 3,960,145 shares of which ..."
AVXS,AVXS:UW,BBG00BWQPDY9,"Health Care Sector Update for 09/07/2016: AVXS,RTRX,ADPT",2016-09-07 16:57:24 +0000,http://articlefeeds.nasdaq.com/~r/nasdaq/symbols/~3/fUyFW1KuUi8/health-care-sector-update-for-09072016-avxsrtrxadpt-cm675742,Top Health Care StocksTop Health Care Stocks JNJ 0 03 JNJ 0 03 PFE 0 00 PFE 0 00 MRK 0 72 MRK 0 72 ABT 0 33 ABT 0 33 AMGN 0 12 AMGN 0 12 Health care stocks were little changed in recent trading Wednesday with the NYSE Health Care Index falling about 0 1 while shares of health
AVXS,AVXS:UW,BBG00BWQPDY9,"AVEXIS, INC. Files SEC form 8-K, Other Events, Financial Statements and Exhibits",2016-09-07 11:03:38 +0000,http://biz.yahoo.com/e/160907/avxs8-k.html,"AVEXIS, INC. Files SEC form 8-K, Other Events, Financial Statements and Exhibits"
AVXS,AVXS:UW,BBG00BWQPDY9,"AveXis Announces Proposed Public Offering of 4,000,000 Shares of Common Stock",2016-09-06 20:09:01 +0000,http://www.publicnow.com/view/35624A85C03E526082E6DE29282826AA56C0D047,"[at noodls] - CHICAGO, Sept. 06, 2016 (GLOBE NEWSWIRE) -- AveXis, Inc. (NASDAQ:AVXS) today announced that it intends to offer and sell, subject to market conditions, 3,566,474 shares of its common stock in an underwritten ..."
AVXS,AVXS:UW,BBG00BWQPDY9,"Street Talk: CREE, AAP & more",2016-08-17 18:49:00 +0000,http://finance.yahoo.com/video/street-talk-cree-aap-more-184900116.html,"Street Talk: CREE, AAP & more"
AVXS,AVXS:UW,BBG00BWQPDY9,RA Capital’s Top Q2 Performers; Predicts Big Things Ahead for Pharma Stocks,2016-08-17 13:33:10 +0000,http://www.insidermonkey.com/blog/ra-capitals-top-q2-performers-predicts-big-things-ahead-for-pharma-stocks-469435/,RA Capital’s Top Q2 Performers; Predicts Big Things Ahead for Pharma Stocks
AVXS,AVXS:UW,BBG00BWQPDY9,Top Biotechs Are Among Jefferies Growth Stock Favorites,2016-08-15 14:20:29 +0000,http://247wallst.com/investing/2016/08/15/top-biotechs-are-among-jefferies-growth-stock-favorites/,Top Biotechs Are Among Jefferies Growth Stock Favorites
AVXS,AVXS:UW,BBG00BWQPDY9,Analysts Are Bullish On These 5 Stocks That Went Public This Year,2016-08-13 12:54:30 +0000,http://finance.yahoo.com/news/analysts-bullish-5-stocks-went-125430038.html,Analysts Are Bullish On These 5 Stocks That Went Public This Year
AVXS,AVXS:UW,BBG00BWQPDY9,"AVEXIS, INC. Files SEC form 10-Q, Quarterly Report",2016-08-12 20:05:07 +0000,http://biz.yahoo.com/e/160812/avxs10-q.html,"AVEXIS, INC. Files SEC form 10-Q, Quarterly Report"
AVXS,AVXS:UW,BBG00BWQPDY9,"Street Talk: UA, BBRY & more",2016-08-12 18:45:00 +0000,http://finance.yahoo.com/video/street-talk-ua-bbry-more-184500373.html,"Street Talk: UA, BBRY & more"
AVXS,AVXS:UW,BBG00BWQPDY9,Edited Transcript of AVXS earnings conference call or presentation 11-Aug-16 8:30pm GMT,2016-08-12 03:36:45 +0000,http://finance.yahoo.com/news/edited-transcript-avxs-earnings-conference-033645657.html,Edited Transcript of AVXS earnings conference call or presentation 11-Aug-16 8:30pm GMT
AVXS,AVXS:UW,BBG00BWQPDY9,"AVXS Walks The Talk, AGN Opens Wallet, Zika Virus Data Lifts AEMD",2016-08-12 01:30:00 +0000,http://articlefeeds.nasdaq.com/~r/nasdaq/symbols/~3/xR3cLWnXEIc/avxs-walks-the-talk-agn-opens-wallet-zika-virus-data-lifts-aemd-20160812-00017,"AVXS Walks The Talk, AGN Opens Wallet, Zika Virus Data Lifts AEMD"
AVXS,AVXS:UW,BBG00BWQPDY9,"AVXS Walks The Talk, AGN Opens Wallet, Zika Virus Data Lifts AEMD",2016-08-12 01:30:00 +0000,http://articlefeeds.nasdaq.com/~r/nasdaq/symbols/~3/W4VOFMRrPOQ/avxs-walks-the-talk-agn-opens-wallet-zika-virus-data-lifts-aemd-20160812-00018,"AVXS Walks The Talk, AGN Opens Wallet, Zika Virus Data Lifts AEMD"
AVXS,AVXS:UW,BBG00BWQPDY9,AveXis reports 2Q loss,2016-08-11 20:36:06 +0000,http://sg.finance.yahoo.com/news/avexis-reports-2q-loss-203606614.html,AveXis reports 2Q loss
AVXS,AVXS:UW,BBG00BWQPDY9,AveXis Reports Second Quarter 2016 Financial and Operating Results and Interim Data from Ongoing Phase 1 Trial of AVXS-101 in Spinal Muscular Atrophy Type 1,2016-08-11 20:21:02 +0000,http://www.publicnow.com/view/36EED175E40A66D5BF76A4AE5066CEC417138A1A,[at noodls] - -- Interim data through July 1 showed no 'events' -- -- Continued motor function improvement with 25% of patients in the proposed therapeutic dose group in the normal range -- -- FDA requested Type B Meeting ...
AVXS,AVXS:UW,BBG00BWQPDY9,"AVEXIS, INC. Files SEC form 8-K, Results of Operations and Financial Condition, Regulation FD Disclosure, Financial S",2016-08-11 20:09:41 +0000,http://biz.yahoo.com/e/160811/avxs8-k.html,"AVEXIS, INC. Files SEC form 8-K, Results of Operations and Financial Condition, Regulation FD Disclosure, Financial S"
AVXS,AVXS:UW,BBG00BWQPDY9,Q2 2016 AveXis Inc Earnings Release - After Market Close,2016-08-11 11:07:04 +0000,http://biz.yahoo.com/research/earncal/20160811.html?t=avxs,Q2 2016 AveXis Inc Earnings Release - After Market Close
AVXS,AVXS:UW,BBG00BWQPDY9,Why AveXis (AVXS) Might Surprise This Earnings Season,2016-08-09 14:39:02 +0000,http://articlefeeds.nasdaq.com/~r/nasdaq/symbols/~3/-_YxVdGv8ic/why-avexis-avxs-might-surprise-this-earnings-season-cm662435,"Investors are always looking for stocks that are poised to beat at earnings season and AveXis, Inc.AVXS may be one such company. The firm has earnings coming up pretty soon, and events are shaping up quite nicely for their"
AVXS,AVXS:UW,BBG00BWQPDY9,Why AveXis (AVXS) Might Surprise This Earnings Season,2016-08-09 12:48:12 +0000,http://finance.yahoo.com/news/why-avexis-avxs-might-surprise-124812142.html,Why AveXis (AVXS) Might Surprise This Earnings Season
AVXS,AVXS:UW,BBG00BWQPDY9,What's in Store for Adverum (ADVM) this Earnings Season?,2016-08-08 17:16:16 +0000,http://articlefeeds.nasdaq.com/~r/nasdaq/symbols/~3/vlZ5R1WvioQ/whats-in-store-for-adverum-advm-this-earnings-season-cm661931,"Adverum Biotechnologies, Inc . ADVM is expected to report second quarter 2016 results on Aug 11. Adverum has a dismal track record with the company missing estimates in all of the last four quarters, bringing the negative average earnings"
AVXS,AVXS:UW,BBG00BWQPDY9,The Race To Cure Spinal Muscular Atrophy,2016-08-05 06:07:00 +0000,http://articlefeeds.nasdaq.com/~r/nasdaq/symbols/~3/oFrvWa6kz24/the-race-to-cure-spinal-muscular-atrophy-20160805-00108,The Race To Cure Spinal Muscular Atrophy
AVXS,AVXS:UW,BBG00BWQPDY9,AveXis to Report Second Quarter 2016 Financial and Operating Results and Interim Data from Ongoing Phase 1 Trial of AVXS-101 in Spinal Muscular Atrophy Type 1,2016-08-02 12:11:13 +0000,http://www.publicnow.com/view/E308E393677E3B72D1DC824459D126925BF8FCC3,"[at noodls] - CHICAGO, Aug. 02, 2016 (GLOBE NEWSWIRE) -- AveXis, Inc. (NASDAQ:AVXS), a clinical-stage gene therapy company developing treatments for patients suffering from rare and life-threatening neurological genetic ..."
AVXS,AVXS:UW,BBG00BWQPDY9,Vishay Intertechnology Q2 16 Earnings Conference Call At 9:00 AM ET,2016-08-02 08:00:00 +0000,http://articlefeeds.nasdaq.com/~r/nasdaq/symbols/~3/b7i9XG_tRe8/vishay-intertechnology-q2-16-earnings-conference-call-at-900-am-et-20160802-00494,Vishay Intertechnology Q2 16 Earnings Conference Call At 9:00 AM ET
AVXS,AVXS:UW,BBG00BWQPDY9,"Ionis Childhood Spine Disorder Drug Notches Pivotal Study Win, Triggers Biogen Option",2016-08-01 16:51:00 +0000,https://www.thestreet.com/story/13659040/1/ionis-childhood-spine-disorder-drug-notches-pivotal-study-win-triggers-biogen-option.html?puc=yahoo&cm_ven=YAHOO,"Ionis Childhood Spine Disorder Drug Notches Pivotal Study Win, Triggers Biogen Option"
AVXS,AVXS:UW,BBG00BWQPDY9,Bigger and better: 2016 IPOs that raised more than $100 million are up over 30%,2016-07-22 23:07:12 +0000,http://articlefeeds.nasdaq.com/~r/nasdaq/symbols/~3/P4CrUASXu84/bigger-and-better-2016-ipos-that-raised-more-than-100-million-are-up-over-30-cm653642,"The 21 IPOs this year that have raised raised over $100 million have delivered investors an average return of 32%, including a first day pop of 14% and an additional 14% in the aftermarket. Most notably, only one IPO"
AVXS,AVXS:UW,BBG00BWQPDY9,"AVXS Making News For The Right Reasons, ONVO Pushing Ahead, XOMA Rises 14%",2016-07-21 00:15:00 +0000,http://articlefeeds.nasdaq.com/~r/nasdaq/symbols/~3/ZV_fQGbrPHM/avxs-making-news-for-the-right-reasons-onvo-pushing-ahead-xoma-rises-14-20160721-00005,"AVXS Making News For The Right Reasons, ONVO Pushing Ahead, XOMA Rises 14%"
