AVXS,AVXS:UW,BBG00BWQPDY9,"Health Care Sector Update for 07/20/2016: AVXS,PGNX,ZFGN",2016-07-20 20:26:10 +0000,http://articlefeeds.nasdaq.com/~r/nasdaq/symbols/~3/n9JU9N74aJA/health-care-sector-update-for-07202016-avxspgnxzfgn-cm652173,"Top Health Care Stocks JNJ +0.10% PFE +0.29% MRK +2.34% ABT +0.43% AMGN +0.52% Health care stocks were mostly higher today, with the NYSE Health Care Index posting a 0.9% gain while shares of health care companies in the"
AVXS,AVXS:UW,BBG00BWQPDY9,"Wednesday Sector Leaders: Biotechnology, Drugs",2016-07-20 16:10:31 +0000,http://articlefeeds.nasdaq.com/~r/nasdaq/symbols/~3/5j_YrqJmcy4/wednesday-sector-leaders-biotechnology-drugs-cm651949,"In trading on Wednesday, biotechnology shares were relative leaders, up on the day by about 1.9%. Leading the group were shares of Kura Oncology ( KURA ), up about 10.6% and shares of AveXis ( AVXS ) up about"
AVXS,AVXS:UW,BBG00BWQPDY9,AveXis Gets FDA Breakthrough Therapy Status For AVXS-101 Gene Replacement Therapy,2016-07-20 14:39:54 +0000,http://finance.yahoo.com/news/avexis-gets-fda-breakthrough-therapy-143954503.html,AveXis Gets FDA Breakthrough Therapy Status For AVXS-101 Gene Replacement Therapy
AVXS,AVXS:UW,BBG00BWQPDY9,"AVEXIS, INC. Files SEC form 8-K, Other Events, Financial Statements and Exhibits",2016-07-20 11:16:18 +0000,http://biz.yahoo.com/e/160720/avxs8-k.html,"AVEXIS, INC. Files SEC form 8-K, Other Events, Financial Statements and Exhibits"
AVXS,AVXS:UW,BBG00BWQPDY9,AveXis Receives U.S. FDA Breakthrough Therapy Designation for AVXS-101 Gene Replacement Therapy for Spinal Muscular Atrophy Type 1,2016-07-20 11:00:00 +0000,http://finance.yahoo.com/news/avexis-receives-u-fda-breakthrough-110000657.html,"[GlobeNewswire] - CHICAGO, July 20, 2016-- AveXis, Inc., a clinical-stage gene therapy company developing treatments for patients suffering from rare and life-threatening neurological genetic diseases, today announced the ..."
AVXS,AVXS:UW,BBG00BWQPDY9,"AveXis Appoints Michael B. Johannesen as Senior Vice President, General Counsel and Chief Compliance Officer",2016-07-11 12:13:09 +0000,http://www.publicnow.com/view/7564C390529FC4420911075304BAAB5779A4CE10,"[at noodls] - CHICAGO, July 11, 2016 (GLOBE NEWSWIRE) -- AveXis, Inc. (Nasdaq:AVXS), a clinical-stage gene therapy company developing treatments for patients suffering from rare and life-threatening neurological genetic ..."
AVXS,AVXS:UW,BBG00BWQPDY9,"AVEXIS, INC. Files SEC form 8-K, Change in Directors or Principal Officers",2016-06-24 21:16:42 +0000,http://biz.yahoo.com/e/160624/avxs8-k.html,"AVEXIS, INC. Files SEC form 8-K, Change in Directors or Principal Officers"
AVXS,AVXS:UW,BBG00BWQPDY9,"Analysts' Actions -- Domino's, McDonald's, Priceline, Tesla and More",2016-06-22 12:07:00 +0000,http://finance.yahoo.com/news/analysts-actions-dominos-mcdonalds-priceline-120700817.html,"Analysts' Actions -- Domino's, McDonald's, Priceline, Tesla and More"
AVXS,AVXS:UW,BBG00BWQPDY9,These 5 Stocks Are Poised for Breakouts,2016-06-10 13:33:00 +0000,https://www.thestreet.com/story/13603660/1/these-5-stocks-are-poised-for-breakouts.html?puc=yahoo&cm_ven=YAHOO,These 5 Stocks Are Poised for Breakouts
AVXS,AVXS:UW,BBG00BWQPDY9,AveXis to Present at Goldman Sachs Annual Global Healthcare Conference and Jefferies 2016 Healthcare Conference,2016-06-06 21:18:06 +0000,http://www.publicnow.com/view/F9AFFE924403E5F1EDA3A457DF26DF1E20A3AFF2,"[at noodls] - CHICAGO, June 06, 2016 (GLOBE NEWSWIRE) -- AveXis, Inc. (NASDAQ:AVXS), a clinical-stage gene therapy company developing novel treatments for patients suffering from rare and life-threatening neurological ..."
AVXS,AVXS:UW,BBG00BWQPDY9,AveXis (AVXS) is in Overbought Territory: What's Next?,2016-06-02 16:57:55 +0000,http://articlefeeds.nasdaq.com/~r/nasdaq/symbols/~3/cJJ131nLrJw/avexis-avxs-is-in-overbought-territory-whats-next-cm629618,"AveXis, Inc.AVXS has moved higher as of late, but there could definitely be trouble on the horizon for this company. That is because AVXS is now in overbought territory with an RSI value of 75.48. What is RSI?        "
AVXS,AVXS:UW,BBG00BWQPDY9,AveXis (AVXS) is in Overbought Territory: What's Next?,2016-06-02 15:04:03 +0000,http://finance.yahoo.com/news/avexis-avxs-overbought-territory-whats-150403414.html,AveXis (AVXS) is in Overbought Territory: What's Next?
AVXS,AVXS:UW,BBG00BWQPDY9,AveXis (AVXS) Looks Good: Stock Adds 6.5% in Session,2016-06-02 14:59:18 +0000,http://articlefeeds.nasdaq.com/~r/nasdaq/symbols/~3/g9oNsS5vsIo/avexis-avxs-looks-good-stock-adds-65-in-session-cm629489,"AveXis, Inc.AVXS was a big mover last session, as the company saw its shares above 6% on the day. The move came on solid volume with far more shares changing hands than in a normal session. This continues the"
AVXS,AVXS:UW,BBG00BWQPDY9,AveXis Presents Pulmonary Data from Ongoing Phase 1 Trial of AVXS-101 in Spinal Muscular Atrophy Type 1,2016-05-16 12:32:07 +0000,http://www.publicnow.com/view/B28C7FC5036DBA6917902C13ECC7CD3F6D916A84,"[at noodls] - CHICAGO, May 16, 2016 (GLOBE NEWSWIRE) -- AveXis, Inc. (NASDAQ:AVXS), a clinical-stage gene therapy company developing novel treatments for patients suffering from rare and life-threatening neurological ..."
AVXS,AVXS:UW,BBG00BWQPDY9,AveXis Reports First Quarter 2016 Financial and Operating Results,2016-05-12 21:27:14 +0000,http://www.publicnow.com/view/2A2623E8151E090944E659AE64FFD103AE98FCDA,"[at noodls] - Encouraging interim data for lead clinical program, AVXS-101, for Spinal Muscular Atrophy Type 1 Conference call May 12 at 4:30 p.m. EDT CHICAGO, May 12, 2016 (GLOBE NEWSWIRE) -- AveXis, Inc. (NASDAQ:AVXS), ..."
AVXS,AVXS:UW,BBG00BWQPDY9,"AveXis (AVXS) Shares March Higher, Can It Continue?",2016-05-12 16:29:03 +0000,http://articlefeeds.nasdaq.com/~r/nasdaq/symbols/~3/NyPJiJr90GE/avexis-avxs-shares-march-higher-can-it-continue-cm620245,"As of late, it has definitely been a great time to be an investor in AveXis, Inc.AVXS . The stock has moved higher by 55.2% in the past month, while it is also above its 20 Day SMA too."
AVXS,AVXS:UW,BBG00BWQPDY9,"Monday Sector Leaders: Drugs, Biotechnology Stocks",2016-05-09 17:16:55 +0000,http://articlefeeds.nasdaq.com/~r/nasdaq/symbols/~3/v-i_mRn5KZk/monday-sector-leaders-drugs-biotechnology-stocks-cm618365,"In trading on Monday, drugs shares were relative leaders, up on the day by about 2.6%. Leading the group were shares of Argos Therapeutics, up about 23.1% and shares of Eagle Pharmaceuticals up about 18.7% on the day."
AVXS,AVXS:UW,BBG00BWQPDY9,AveXis Reports Data from Ongoing Phase 1 Trial of AVXS-101 in Spinal Muscular Atrophy Type 1,2016-05-06 19:34:07 +0000,http://www.publicnow.com/view/754086F1A35DD2A48739A8D2606A9CA80DA5BF03,"[at noodls] - -- Jerry Mendell, MD, Presented Data as of April 1, 2016 at the American Society of Gene & Cell Therapy 19 Annual Meeting -- -- Company to Host Webcast Today at 4:30 p.m. Eastern Daylight Time -- CHICAGO, ..."
AVXS,AVXS:UW,BBG00BWQPDY9,"AveXis to Report First Quarter 2016 Financial Results on Thursday, May 12",2016-05-05 12:21:05 +0000,http://www.publicnow.com/view/75D6094B4A93818B9028ED68252ACEEDE09C77C8,"[at noodls] - CHICAGO, May 05, 2016 (GLOBE NEWSWIRE) -- AveXis, Inc. (NASDAQ:AVXS), a clinical-stage gene therapy company developing treatments for patients suffering from rare and life-threatening neurological genetic ..."
AVXS,AVXS:UW,BBG00BWQPDY9,AveXis to Report Data from Ongoing Phase 1 Clinical Trial of AVXS-101 in Spinal Muscular Atrophy Type 1,2016-04-25 14:14:03 +0000,http://www.publicnow.com/view/17D5CDE73600259448C851C06546DB6C9AD8794E,"[at noodls] - -- Jerry Mendell, M.D., to Present Data as of April 1, 2016 at the American Society of Gene & Cell Therapy 19th Annual Meeting -- -- Company to Host Webcast on Friday, May 6, 2016 at 4:30 p.m. Eastern ..."
AVXS,AVXS:UW,BBG00BWQPDY9,Renaissance Capital's 1Q16 US IPO Market Review,2016-04-01 22:28:20 +0000,http://articlefeeds.nasdaq.com/~r/nasdaq/symbols/~3/nVgjwiVumJY/renaissance-capitals-1q16-us-ipo-market-review-cm598858,"The US IPO market in the 1Q16 hit its lowest levels since the depths of the financial crisis in 2008 2009. Not a single deal priced outside of the health care sector, where eight deals managed to raise $0.7"
AVXS,AVXS:UW,BBG00BWQPDY9,Cracks in the market bring SPACs to the market: Fun facts about SPACs,2016-03-06 09:38:41 +0000,http://articlefeeds.nasdaq.com/~r/nasdaq/symbols/~3/AT-FunnOueY/cracks-in-the-market-bring-spacs-to-the-market-fun-facts-about-spacs-cm585704,"Blank check company Silver Run Acquisition ( SRAQU ) made headlines in the IPO market   partly because little else could   as it completed the year's largest ""IPO"" in an upsized $450 million offering."
AVXS,AVXS:UW,BBG00BWQPDY9,US IPO Weekly Recap: IPO market largely closed; two biotechs go public and break,2016-02-16 14:47:29 +0000,http://articlefeeds.nasdaq.com/~r/nasdaq/symbols/~3/zuWVvH3YkPk/us-ipo-weekly-recap-ipo-market-largely-closed-two-biotechs-go-public-and-break-cm579553,"The IPO market was poised to raise $1.4 billion from four IPOs this past week, but instead two biotechs raised $145 million. A substantial portion of those proceeds came from insiders, and both biotechs broke issue with an average"
AVXS,AVXS:UW,BBG00BWQPDY9,Biotechs lean heavily on insider buying to complete quasi-IPOs,2016-02-12 17:47:36 +0000,http://articlefeeds.nasdaq.com/~r/nasdaq/symbols/~3/5ffWpYTO77I/biotechs-lean-heavily-on-insider-buying-to-complete-quasi-ipos-cm578796,"Accounting for 100% of the four IPOs so far this year, biotechs appeared to be the one sector able to generate demand from public investors. But demand is weaker than it seems. Of the nearly $400 million raised, insiders"
AVXS,AVXS:UW,BBG00BWQPDY9,AveXis prices upsized IPO at $20 midpoint,2016-02-11 00:35:17 +0000,http://articlefeeds.nasdaq.com/~r/nasdaq/symbols/~3/DTDsjyD75JE/avexis-prices-upsized-ipo-at-20-midpoint-cm578265,"AveXis, an early stage biotech developing a gene therapy for spinal muscular atrophy, raised $95 million in an upsized IPO by offering 4.75 million shares at $20, the midpoint of the range of $19 to $21. The company originally"
AVXS,AVXS:UW,BBG00BWQPDY9,Week ahead: Two large and levered IPOs take center stage to raise $1 billion,2016-02-06 05:13:29 +0000,http://articlefeeds.nasdaq.com/~r/nasdaq/symbols/~3/8rkYFCWXyhE/week-ahead-two-large-and-levered-ipos-take-center-stage-to-raise-1-billion-cm575836,"Two large and highly levered IPOs are scheduled to raise a combined $1 billion this week.On the go IPO ""Known as the company that put iPads in airports"", founder led OTG EXP ( OTG ) is looking to fuel its capital intensive"
