BMRN,BMRN:UW,BBG000CZX7N1,BioMarin (BMRN) in Focus: Stock Moves 7% Higher,2017-06-22 14:25:21 +0000,http://articlefeeds.nasdaq.com/~r/nasdaq/symbols/~3/4H0RMT_woYw/biomarin-bmrn-in-focus-stock-moves-7-higher-cm806764,BioMarin Pharmaceutical Inc BMRN was a big mover last session as the company saw its shares rise 7 on the day The move came on solid volume too with far more shares changing hands than in a normal session This breaks the recent trend of the company as the stock is now trading above
BMRN,BMRN:UW,BBG000CZX7N1,BioMarin (BMRN) in Focus: Stock Moves 7% Higher,2017-06-22 12:37:12 +0000,https://finance.yahoo.com/news/biomarin-bmrn-focus-stock-moves-123712065.html?.tsrc=rss,"BioMarin (BMRN) was a big mover last session, as the company saw its shares rise 7% on the day."
BMRN,BMRN:UW,BBG000CZX7N1,"BioMarin Pharmaceutical, Inc. breached its 50 day moving average in a Bearish Manner : BMRN-US : June 16, 2017",2017-06-16 12:38:09 +0000,http://finance.yahoo.com/r/c5aa4530-66b9-36e5-a60d-06ecf6e90521/biomarin-pharmaceutical-inc-breached-its-50-day-moving-average-in-a-bearish-manner-bmrn-us-june-16-2017?yptr=yahoo&.tsrc=rss,"Categories:  ETFs Yahoo FinanceGet full CapitalCube analysis *Disclaimer : This is as of previous day’s closing price. Technical Indicators Below is a quick look at 5 technical indicators for BioMarin Pharmaceutical, Inc.. More studies are available on the Technical Chart. Indicator Signal Closing Price above/below 50 Day Moving Average Bearish Closing Price above/below 200 Day Moving Average Bullish ... Read more
<b>(Read more...)</b>"
BMRN,BMRN:UW,BBG000CZX7N1,BioMarin Announces Acceptance of Late Breaking Abstract at the International Society on Thrombosis and Haemostasis 2017 Congress,2017-06-16 12:31:00 +0000,https://finance.yahoo.com/news/biomarin-announces-acceptance-breaking-abstract-123100594.html?.tsrc=rss,"Oral Presentation to Include Interim Results from its Ongoing Phase 1/2 BMN 270 Clinical Program, a Gene Therapy for Hemophilia A Conference call and web-cast to be held July 11th at 2:30pm CEST/8:30am ..."
BMRN,BMRN:UW,BBG000CZX7N1,"ETFs with exposure to BioMarin Pharmaceutical, Inc. : June 15, 2017",2017-06-15 17:18:50 +0000,http://finance.yahoo.com/r/00ce6701-2ef3-3423-85d3-f6adfacd7a2e/etfs-with-exposure-to-biomarin-pharmaceutical-inc-june-15-2017?yptr=yahoo&.tsrc=rss,"Categories:  ETFs Yahoo FinanceClick here to see latest analysis ETFs with exposure to BioMarin Pharmaceutical, Inc. Here are 5 ETFs with the largest exposure to BMRN-US. Comparing the performance and risk of BioMarin Pharmaceutical, Inc. with the ETFs that have exposure to it gives us some ETF choices that could give us similar returns with lower volatility. Ticker ... Read more
<b>(Read more...)</b>"
BMRN,BMRN:UW,BBG000CZX7N1,"BioMarin Pharmaceutical, Inc. :BMRN-US: Earnings Analysis: Q1, 2017 By the Numbers : June 14, 2017",2017-06-14 13:45:24 +0000,http://finance.yahoo.com/r/b78698ae-bc5c-34e8-bb5b-de120c96ad19/biomarin-pharmaceutical-inc-bmrn-us-earnings-analysis-q1-2017-by-the-numbers-june-14-2017?yptr=yahoo&.tsrc=rss,"Categories:  Yahoo FinanceGet free summary analysis BioMarin Pharmaceutical, Inc. reports financial results for the quarter ended March 31, 2017. We analyze the earnings along side the following peers of BioMarin Pharmaceutical, Inc. – Ultragenyx Pharmaceutical, Inc., Shire PLC Sponsored ADR, Esperion Therapeutics, Inc., Sangamo Therapeutics, Inc., Alexion Pharmaceuticals, Inc., Catalyst Pharmaceuticals, Inc. and Amicus Therapeutics, Inc. (RARE-US, ... Read more
<b>(Read more...)</b>"
BMRN,BMRN:UW,BBG000CZX7N1,7 Reasons Why Prescription Drug Prices Are Extremely Expensive,2017-06-09 11:28:36 +0000,http://articlefeeds.nasdaq.com/~r/nasdaq/symbols/~3/D3tBCPPcZXw/7-reasons-why-prescription-drug-prices-are-extremely-expensive-cm800997,Image source Getty Images Spending on prescription drugs increased by 3 8 in 2016 according 160 to pharmacy benefit manager Express Scripts While that s slower growth than the 5 2 year over year increase experienced in 2015 spending is still headed in the wrong
BMRN,BMRN:UW,BBG000CZX7N1,7 Reasons Why Prescription Drug Prices Are Extremely Expensive,2017-06-09 10:00:00 +0000,http://finance.yahoo.com/r/c69ec843-fa9b-31a8-b497-2f6fdeaf309a/7-reasons-why-prescription-drug-prices-are-extreme.aspx?yptr=yahoo&.tsrc=rss,There are myriad reasons going to the drugstore hurts the wallet.
BMRN,BMRN:UW,BBG000CZX7N1,It takes billions of dollars to bring a new drug to the market; here are some of the reasons why,2017-06-09 00:20:08 +0000,http://finance.yahoo.com/r/b4ea2d68-0a5d-345d-ae1a-957b56f8c364/biotech-2017-price-of-a-new-drug-biomarin.html?ana=yahoo&yptr=yahoo&.tsrc=rss,"In late April, rare disease drug maker BioMarin Pharmaceutical Inc. unveiled its newest biologic offering: a first-in-class drug for a one-in-a-million form of a genetic disorder Batten disease, which attacks the nervous system and kills those affected at ages as young as 8-12 years old.  Also notable: Brineura’s $702,000 list price, which falls to an estimated annual net price of $486,000 after government discounts, rebates and projected usage.  “Pricing is one part art, one part science,” said Jeff Ajer, executive vice president and chief commercial officer for BioMarin."
BMRN,BMRN:UW,BBG000CZX7N1,BioMarin (BMRN) Down 8% Since Earnings Report: Can It Rebound?,2017-06-08 15:31:22 +0000,http://articlefeeds.nasdaq.com/~r/nasdaq/symbols/~3/4uvmSH65LQc/biomarin-bmrn-down-8-since-earnings-report-can-it-rebound-cm800518,A month has gone by since the last earnings report for BioMarin Pharmaceutical Inc BMRN Shares have lost nearly 8 in that time frame underperforming the market Will the recent negative trend continue leading up to the stock s next earnings release or is it due for a breakout Before
BMRN,BMRN:UW,BBG000CZX7N1,BioMarin (BMRN) Down 8% Since Earnings Report: Can It Rebound?,2017-06-08 13:47:01 +0000,https://finance.yahoo.com/news/biomarin-bmrn-down-8-since-134701706.html?.tsrc=rss,BioMarin (BMRN) reported earnings 30 days ago. What&apos;s next for the stock? We take a look at earnings estimates for some clues.
BMRN,BMRN:UW,BBG000CZX7N1,Sum Up The Pieces: BBH Could Be Worth $138,2017-06-06 15:04:25 +0000,http://articlefeeds.nasdaq.com/~r/nasdaq/symbols/~3/eYDDLOKk1zs/sum-up-the-pieces-bbh-could-be-worth-138-cm799307,Looking at the underlying holdings of the ETFs in our coverage universe at ETF Channel we have compared the trading price of each holding against the average analyst 12 month forward target price and computed the weighted average implied analyst target price for the ETF itself For the
BMRN,BMRN:UW,BBG000CZX7N1,"BioMarin Pharmaceutical, Inc. breached its 50 day moving average in a Bullish Manner : BMRN-US : June 5, 2017",2017-06-05 12:44:01 +0000,http://finance.yahoo.com/r/09aa9b60-c48b-3086-b240-fb51998e9e89/biomarin-pharmaceutical-inc-breached-its-50-day-moving-average-in-a-bullish-manner-bmrn-us-june-5-2017?yptr=yahoo&.tsrc=rss,"Categories:  ETFs Yahoo FinanceGet full CapitalCube analysis *Disclaimer : This is as of previous day’s closing price. Technical Indicators Below is a quick look at 5 technical indicators for BioMarin Pharmaceutical, Inc.. More studies are available on the Technical Chart. Indicator Signal Closing Price above/below 50 Day Moving Average Bullish Closing Price above/below 200 Day Moving Average Bullish ... Read more
<b>(Read more...)</b>"
BMRN,BMRN:UW,BBG000CZX7N1,BioMarin's (BMRN) Brineura Approved by European Commission,2017-06-02 17:33:54 +0000,http://articlefeeds.nasdaq.com/~r/nasdaq/symbols/~3/_36tAOoEN_Q/biomarins-bmrn-brineura-approved-by-european-commission-cm798110,BioMarin Pharmaceutical Inc BMRN announced that the European Commission has approved Brineura cerliponase alfa for the treatment of neuronal ceroid lipofuscinosis type 2 CLN2 CLN2 is also known as tripeptidyl peptidase 1 TPP1 deficiency a form of Batten disease and ultra rare
BMRN,BMRN:UW,BBG000CZX7N1,BioMarin&apos;s (BMRN) Brineura Approved by European Commission,2017-06-02 15:14:03 +0000,https://finance.yahoo.com/news/biomarin-apos-bmrn-brineura-approved-151403877.html?.tsrc=rss,BioMarin Pharmaceutical Inc. (BMRN) announced that the European Commission has approved Brineura (cerliponase alfa) for the treatment of neuronal ceroid lipofuscinosis type 2 (CLN2).
BMRN,BMRN:UW,BBG000CZX7N1,Health Care Sector Update for 06/01/2017: BMRN,2017-06-01 13:51:10 +0000,http://articlefeeds.nasdaq.com/~r/nasdaq/symbols/~3/wxlB71vbSlo/health-care-sector-update-for-06012017-bmrn-cm797301,Top Health care stocks Top Health care stocks JNJ flatJNJ flat PFE 0 6 PFE 0 6 ABT 0 5 ABT 0 5 MRK flatMRK flat AMGN 0 2 AMGN 0 2 Health care shares were mixed in pre market trade on Thursday Health care shares were mixed in pre market trade on Thursday In health care
BMRN,BMRN:UW,BBG000CZX7N1,"European Commission Approves Brineura™ (cerliponase alfa), the First Treatment for CLN2 Disease, a Form of Batten Disease and Ultra-Rare Brain Disorder in Children",2017-06-01 12:31:00 +0000,https://finance.yahoo.com/news/european-commission-approves-brineura-cerliponase-123100767.html?.tsrc=rss,"On April 21, 2017, the Committee for Medicinal Products for Human Use (CHMP), the scientific committee of the European Medicines Agency (EMA), adopted a positive opinion for the company's Marketing Authorization Application (MAA) for BrineuraTM (cerliponase alfa) following an accelerated review procedure, reserved for medicinal products expected to be of major public health interest.  The EMA revised process for accelerated assessment came into effect June 1, 2016."
BMRN,BMRN:UW,BBG000CZX7N1,BioMarin Reports Marketing Authorization For Brineura In European Union,2017-06-01 08:43:00 +0000,http://articlefeeds.nasdaq.com/~r/nasdaq/symbols/~3/su2fXXFYhF0/biomarin-reports-marketing-authorization-for-brineura-in-european-union-20170601-00690,BioMarin Reports Marketing Authorization For Brineura In European Union
BMRN,BMRN:UW,BBG000CZX7N1,BioMarin to Attend Upcoming Investor Conference,2017-05-31 10:00:00 +0000,https://finance.yahoo.com/news/biomarin-attend-upcoming-investor-conference-100000976.html?.tsrc=rss,"SAN RAFAEL, Calif., May 31, 2017 /PRNewswire/ -- BioMarin Pharmaceutical Inc. (NASDAQ: BMRN), today announced that Dan Spiegelman, Executive Vice President and Chief Financial Officer, will participate ..."
BMRN,BMRN:UW,BBG000CZX7N1,Ultragenyx Receives Priority Review for rhGUS from FDA,2017-05-24 14:35:00 +0000,http://articlefeeds.nasdaq.com/~r/nasdaq/symbols/~3/kF8pl1tlk8M/ultragenyx-receives-priority-review-for-rhgus-from-fda-cm793872,Ultragenyx Pharmaceutical Inc RARE recently announced that it has submitted regulatory applications in both the U S and the EU for recombinant human beta glucuronidase rhGUS This is an investigational candidate that is being developed for the treatment of mucopolysaccharidosis VII MPS
BMRN,BMRN:UW,BBG000CZX7N1,Ultragenyx Receives Priority Review for rhGUS from FDA,2017-05-24 13:17:01 +0000,https://finance.yahoo.com/news/ultragenyx-receives-priority-review-rhgus-131701283.html?.tsrc=rss,"The FDA has accepted Ultragenyx Pharmaceutical Inc. (RARE)&apos;s BLA for rhGUS on a priority review basis and set a PDUFA action date of Nov 16, 2017."
BMRN,BMRN:UW,BBG000CZX7N1,Why Sangamo Therapeutics Inc. Jumped Higher Today,2017-05-12 20:31:24 +0000,http://articlefeeds.nasdaq.com/~r/nasdaq/symbols/~3/UotegqtYj68/why-sangamo-therapeutics-inc-jumped-higher-today-cm788774,What happened Sangamo Therapeutics NASDAQ SGMO ended the day up 16 after catapulting over 60 higher yesterday following the announcement that Pfizer NYSE PFE licensed Sangamo s hemophilia A gene therapy SB 525 So what The partnership came with a 70
BMRN,BMRN:UW,BBG000CZX7N1,Why Sangamo Therapeutics Inc. Jumped Higher Today,2017-05-12 20:20:00 +0000,http://finance.yahoo.com/r/28138258-1510-36e0-8686-d918f720fc0d/why-sangamo-therapeutics-inc-jumped-higher-today.aspx?yptr=yahoo&.tsrc=rss,"A deal with Pfizer, coupled with some likely short-seller covering, has shares headed higher for the second day in a row."
BMRN,BMRN:UW,BBG000CZX7N1,BioMarin Pharmaceutical Breaks Below 200-Day Moving Average - Notable for BMRN,2017-05-10 17:02:41 +0000,http://articlefeeds.nasdaq.com/~r/nasdaq/symbols/~3/IhnnDryv3os/biomarin-pharmaceutical-breaks-below-200-day-moving-average-notable-for-bmrn-cm787304,In trading on Wednesday shares of BioMarin Pharmaceutical Inc Symbol BMRN crossed below their 200 day moving average of 90 04 changing hands as low as 89 74 per share BioMarin Pharmaceutical Inc shares are currently trading off about 1 4 on the day The chart below shows the one
BMRN,BMRN:UW,BBG000CZX7N1,"Biotech Stock Roundup: Regeneron, BioMarin Report Q1, Kite Down on Patient Death",2017-05-10 14:05:42 +0000,http://articlefeeds.nasdaq.com/~r/nasdaq/symbols/~3/ENZtDOEpGpw/biotech-stock-roundup-regeneron-biomarin-report-q1-kite-down-on-patient-death-cm787163,Kite Pharma s KITE announcement regarding a patient death related to its lead pipeline candidate was the big news in the biotech sector with the company s shares taking a hit Meanwhile major players like Regeneron REGN and BioMarin BMRN reported 1Q results while Regeneron posted a
BMRN,BMRN:UW,BBG000CZX7N1,"Biotech Stock Roundup: Regeneron, BioMarin Report Q1, Kite Down on Patient Death",2017-05-10 12:30:12 +0000,http://finance.yahoo.com/news/biotech-stock-roundup-regeneron-biomarin-123012933.html?.tsrc=rss,Kite&apos;s (KITE) shares were hit by news regarding a patient death resulting from cerebral edema.
BMRN,BMRN:UW,BBG000CZX7N1,BioMarin Pharmaceutical Inc. Moves Toward Profitability,2017-05-09 19:03:56 +0000,http://articlefeeds.nasdaq.com/~r/nasdaq/symbols/~3/thAUdrhEmZI/biomarin-pharmaceutical-inc-moves-toward-profitability-cm786702,BioMarin Pharmaceutical NASDAQ BMRN released earnings last week with solid revenue growth moving the company toward profitability Biomarin Pharmaceutical results The raw numbers Metric Q1
BMRN,BMRN:UW,BBG000CZX7N1,BioMarin Pharmaceutical Inc. Moves Toward Profitability,2017-05-09 17:40:00 +0000,http://finance.yahoo.com/r/ec3519a8-cbdd-3a56-8421-bdae9b63b156/biomarin-pharmaceutical-inc-moves-towards-profitab.aspx?yptr=yahoo&.tsrc=rss,It was a solid first quarter from the orphan-drug expert.
BMRN,BMRN:UW,BBG000CZX7N1,Edited Transcript of BMRN earnings conference call or presentation 4-May-17 8:30pm GMT,2017-05-09 13:10:52 +0000,http://finance.yahoo.com/news/edited-transcript-bmrn-earnings-conference-050933375.html?.tsrc=rss,Q1 2017 Biomarin Pharmaceutical Inc Earnings Call
BMRN,BMRN:UW,BBG000CZX7N1,"BioMarin Pharmaceutical, Inc. breached its 50 day moving average in a Bearish Manner : BMRN-US : May 9, 2017",2017-05-09 13:00:11 +0000,http://finance.yahoo.com/r/30ac61e5-b6bd-3304-9f61-614d57d6b72b/biomarin-pharmaceutical-inc-breached-its-50-day-moving-average-in-a-bearish-manner-bmrn-us-may-9-2017?yptr=yahoo&.tsrc=rss,"Categories:  ETFs Yahoo FinanceClick here to see latest analysis *Disclaimer : This is as of previous day’s closing price. Technical Indicators Below is a quick look at 5 technical indicators for BioMarin Pharmaceutical, Inc.. More studies are available on the Technical Chart. Indicator Signal Closing Price above/below 50 Day Moving Average Bearish Closing Price above/below 200 Day Moving ... Read more
<b>(Read more...)</b>"
BMRN,BMRN:UW,BBG000CZX7N1,BioMarin: Is Profitability On The Horizon?,2017-05-08 18:57:00 +0000,http://finance.yahoo.com/r/cc0a47e1-94b4-33a2-b154-c473e610724a/biomarin-is-profitability-on-the-horizon-1494269871?mod=yahoobarrons&ru=yahoo&yptr=yahoo&.tsrc=rss,"When will BioMarin Pharmaceuticals (BMRN) turn a profit? The drug maker specializes in therapies for rare diseases, and already markets a handful of medications that generated revenue of $1.12 billion ..."
BMRN,BMRN:UW,BBG000CZX7N1,"Market Close Report: Historical high reached as NASDAQ Composite Index closes at 6,100.76.",2017-05-05 20:48:20 +0000,http://articlefeeds.nasdaq.com/~r/nasdaq/symbols/~3/2n1zJsEXAg8/market-close-report-historical-high-reached-as-nasdaq-composite-index-closes-at-610076-cm785296,Friday s session closes with the NASDAQ Composite Index reaching a historical high The index closed at 6 100 76 up 25 42 for the day The index had a previous high 6095 36645 on 05 02 2017 The total shares traded for the NASDAQ was over 2 04 billion Friday s session closes with the
BMRN,BMRN:UW,BBG000CZX7N1,These Biotechs Are Grabbing Bullish Views In Wake Of Earnings,2017-05-05 20:27:13 +0000,http://finance.yahoo.com/r/356aa738-2142-37f4-a2ce-5f0beba0a586/which-biotechs-are-grabbing-bullish-post-q1-views-heres-some-incyte?src=A00220&yptr=yahoo&.tsrc=rss,"Incyte stock toppled to a 10-week low Friday on a fourth consecutive quarter of losses, but it was among a slew of biotechs to grab bullish reports."
BMRN,BMRN:UW,BBG000CZX7N1,"BioMarin (BMRN) Posts Earnings in Q1, Sales Top, Stock Up",2017-05-05 15:25:23 +0000,http://articlefeeds.nasdaq.com/~r/nasdaq/symbols/~3/4E0_JPbrJP8/biomarin-bmrn-posts-earnings-in-q1-sales-top-stock-up-cm784989,BioMarin Pharmaceutical Inc BMRN reported earnings of 3 cents per share in the first quarter of 2017 including stock based compensation expense significantly better than the year ago loss of 36 cents and the Zacks Consensus Estimate of a loss of 30 cents per share Higher gross margins
BMRN,BMRN:UW,BBG000CZX7N1,"BioMarin (BMRN) Posts Earnings in Q1, Sales Top, Stock Up",2017-05-05 14:30:02 +0000,http://finance.yahoo.com/news/biomarin-bmrn-posts-earnings-q1-143002320.html?.tsrc=rss,BioMarin Pharmaceutical Inc. (BMRN) reported earnings of 3 cents per share in the first quarter of 2017.
BMRN,BMRN:UW,BBG000CZX7N1,BioMarin reports 1Q loss,2017-05-04 20:46:37 +0000,http://finance.yahoo.com/news/biomarin-reports-1q-loss-204637674.html?.tsrc=rss,"The San Rafael, California-based company said it had a loss of 9 cents per share. Earnings, adjusted for stock option expense and non-recurring costs, came to 21 cents per share. The results beat Wall ..."
BMRN,BMRN:UW,BBG000CZX7N1,BioMarin Announces First Quarter 2017 Financial Results,2017-05-04 20:02:00 +0000,http://finance.yahoo.com/news/biomarin-announces-first-quarter-2017-200200275.html?.tsrc=rss,"SAN RAFAEL, Calif., May 4, 2017 /PRNewswire/ -- Financial Highlights (in millions of U.S. dollars, except per share data, unaudited) Three Months Ended March 31, 2017 2016 % Change Total BioMarin Revenues ..."
BMRN,BMRN:UW,BBG000CZX7N1,"After-Hours Earnings Report for May 4, 2017 :  ATVI, MNST, ED, CBS, BMRN, MSI, MTD, MRO, PBA, MELI, ANET, Y",2017-05-04 19:19:16 +0000,http://articlefeeds.nasdaq.com/~r/nasdaq/symbols/~3/NN7M6ty9NzU/after-hours-earnings-report-for-may-4-2017-atvi-mnst-ed-cbs-bmrn-msi-mtd-mro-pba-meli-anet-y-cm784449,The following companies are expected to report earnings after hours on 05 04 2017 Visit our Earnings Calendar for a full list of expected earnings releases Activision Blizzard Inc ATVI is reporting for the quarter ending March 31 2017 The toy game
BMRN,BMRN:UW,BBG000CZX7N1,Biomarin Pharmaceutical Q1 17 Earnings Conference Call At 4:30 PM ET,2017-05-04 15:01:00 +0000,http://articlefeeds.nasdaq.com/~r/nasdaq/symbols/~3/z0QdKxcQ8nY/biomarin-pharmaceutical-q1-17-earnings-conference-call-at-430-pm-et-20170504-01676,Biomarin Pharmaceutical Q1 17 Earnings Conference Call At 4:30 PM ET
BMRN,BMRN:UW,BBG000CZX7N1,Investor Network: BioMarin Pharmaceutical Inc. to Host Earnings Call,2017-05-04 14:55:00 +0000,http://finance.yahoo.com/news/investor-network-biomarin-pharmaceutical-inc-145500414.html?.tsrc=rss,"NEW YORK, NY / ACCESSWIRE / May 4, 2017 / BioMarin Pharmaceutical Inc. (NASDAQ: BMRN ) will be discussing their earnings results in their Q1 Earnings Call to be held May 4, 2017 at 4:30 PM Eastern Time. ..."
BMRN,BMRN:UW,BBG000CZX7N1,[$$] Did Gilead Cut Buybacks for Acquisition?,2017-05-04 14:38:00 +0000,http://finance.yahoo.com/r/a32cbbba-8ee9-39e9-bc85-b4887f022975/did-gilead-cut-buybacks-for-acquisition-1493908695?mod=yahoobarrons&ru=yahoo&yptr=yahoo&.tsrc=rss,"Gilead Sciences (GILD) repurchased $565 million of shares in the first quarter, even less than the $1 billion of buybacks in the fourth quarter, indicating that Gilead is holding cash for acquisition that is potentially a midsize biotech.  -- Jing He  To be considered for the Soapbox feature, please submit an original article of less than 1,000 words to research@barrons.com with “Soapbox Submission” in the headline."
BMRN,BMRN:UW,BBG000CZX7N1,Analysts Forecast 12% Upside For BBH,2017-05-04 14:13:09 +0000,http://articlefeeds.nasdaq.com/~r/nasdaq/symbols/~3/W6-sOyMFAsM/analysts-forecast-12-upside-for-bbh-cm784035,Looking at the underlying holdings of the ETFs in our coverage universe at ETF Channel we have compared the trading price of each holding against the average analyst 12 month forward target price and computed the weighted average implied analyst target price for the ETF itself For the
BMRN,BMRN:UW,BBG000CZX7N1,"Biotech Stock Roundup: Amgen, Gilead, Celgene Q1 Earnings, Sunesis Down on Vosaroxin Update",2017-05-03 13:31:22 +0000,http://articlefeeds.nasdaq.com/~r/nasdaq/symbols/~3/6O0dk47b5ew/biotech-stock-roundup-amgen-gilead-celgene-q1-earnings-sunesis-down-on-vosaroxin-update-cm783260,It was all about earnings this week with companies like Amgen AMGN Celgene CELG Vertex AbbVie Alexion and Gilead GILD reporting results So far it looks like a mixed quarter for quite a few companies with earnings topping expectations while revenues fell short Recap of the Week
BMRN,BMRN:UW,BBG000CZX7N1,Why Earnings Season Could Be Great for BioMarin (BMRN),2017-05-03 12:48:12 +0000,http://finance.yahoo.com/news/why-earnings-season-could-great-124812941.html?.tsrc=rss,BioMarin (BMRN) is seeing favorable earnings estimate revision activity and has a positive Zacks Earnings ESP heading into earnings season.
BMRN,BMRN:UW,BBG000CZX7N1,What Lies Ahead for Stericycle (SRCL) this Earnings Season?,2017-05-03 12:28:13 +0000,http://articlefeeds.nasdaq.com/~r/nasdaq/symbols/~3/yntV9y0I1VE/what-lies-ahead-for-stericycle-srcl-this-earnings-season-cm783227,Waste management firm Stericycle Inc SRCL is scheduled to report first quarter 2017 results after the closing bell on May 4 In the last reported quarter adjusted earnings exceeded the Zacks Consensus Estimate by 7 cents The company has a mixed earnings surprise history with two beats and
BMRN,BMRN:UW,BBG000CZX7N1,BioMarin to Attend Two Upcoming Investor Conferences,2017-05-02 12:30:00 +0000,http://finance.yahoo.com/news/biomarin-attend-two-upcoming-investor-123000437.html?.tsrc=rss,"SAN RAFAEL, Calif., May 2, 2017 /PRNewswire/ -- BioMarin Pharmaceutical Inc. (NASDAQ: BMRN), today announced that Jean-Jacques Bienaimé , Chairman and Chief Executive Officer, will participate in Deutsche ..."
BMRN,BMRN:UW,BBG000CZX7N1,Agios Pharmaceuticals (AGIO) Q1 Earnings: What's in Store?,2017-05-01 16:31:30 +0000,http://articlefeeds.nasdaq.com/~r/nasdaq/symbols/~3/UEE1oOnqS3o/agios-pharmaceuticals-agio-q1-earnings-whats-in-store-cm782059,Agios Pharmaceuticals Inc AGIO is scheduled to report first quarter results on May 4 before market open Shares gained 19 1 so far this year while the Zacks classified Medical Products industry witnessed an increase of 14 3 Agios performance has been mixed with the company
BMRN,BMRN:UW,BBG000CZX7N1,6 FDA Events to Watch Out for in May 2017,2017-05-01 14:33:28 +0000,http://articlefeeds.nasdaq.com/~r/nasdaq/symbols/~3/veBBExn2k4I/6-fda-events-to-watch-out-for-in-may-2017-cm781882,The FDA which approved 22 treatments last year has given its approval to 16 drugs so far in 2017 including 4 in April Key approvals so far in 2017 include Roche s multiple sclerosis treatment Ocrevus Regeneron and Sanofi s eczema treatment Dupixent Tesaro s PARP inhibitor Zejula
BMRN,BMRN:UW,BBG000CZX7N1,BioMarin CEO says 'the system will have to determine' the...,2017-04-28 23:13:00 +0000,http://finance.yahoo.com/video/biomarin-ceo-says-system-determine-231300696.html?.tsrc=rss,Jim Cramer spoke with JJ Bienaimé for more on the company's newest drug that treats a very rare disease.
BMRN,BMRN:UW,BBG000CZX7N1,"BioMarin CEO says 'the system will have to determine' the worth of its new $702,000 drug",2017-04-28 22:58:40 +0000,http://finance.yahoo.com/r/1ab27563-60da-318a-acc0-58c5b3426330/104435807?__source=yahoo%7Cfinance%7Cheadline%7Cheadline%7Cstory&par=yahoo&doc=104435807&yptr=yahoo&.tsrc=rss,Jim Cramer spoke with JJ Bienaimé for more on the company's newest drug that treats a very rare disease.
BMRN,BMRN:UW,BBG000CZX7N1,Today's Research Reports on Biotech Stocks to Watch: Pacific Biosciences of California and BioMarin Pharmaceutical,2017-04-28 11:30:00 +0000,http://finance.yahoo.com/news/todays-research-reports-biotech-stocks-113000321.html?.tsrc=rss,"NEW YORK, NY / ACCESSWIRE / April 28, 2017 / BioMarin shares trended higher this week after the FDA approved the pharma giant's Brineura drug that treats a type of Batten disease. Brinuera is the first ..."
BMRN,BMRN:UW,BBG000CZX7N1,"BioMarin wins FDA approval for life-changing drug for kids — with a $700,000-per-year cost",2017-04-27 23:29:52 +0000,http://finance.yahoo.com/r/2cdcc2bd-5f06-3bae-b85e-50d9ade814aa/biomarin-bmrn-batten-disease-brineura-cln2.html?ana=yahoo&yptr=yahoo&.tsrc=rss,"Rare disease drug developer BioMarin Pharamceutical Inc. won regulatory approval Thursday of a drug that promises to change the course of a fatal childhood neurodegenerative disease.  San Rafael-based BioMarin's Brineura is the first drug approved by the Food and Drug Administration to treat children with CLN2, a form of Batten disease.  It took four years from BioMarin's first clinical trial of the drug to FDA approval, a relatively fast timeline in an industry that says drug development generally takes 10-plus years and more than $1 billion."
