BMRN,BMRN:UW,BBG000CZX7N1,Will Zoetis (ZTS) Disappoint Estimates This Earnings Season?,2017-02-11 00:17:17 +0000,http://articlefeeds.nasdaq.com/~r/nasdaq/symbols/~3/eAgKcVoxXHE/will-zoetis-zts-disappoint-estimates-this-earnings-season-cm746604,Zoetis Inc ZTS is scheduled to report fourth quarter and full year 2016 results on Feb 16 before the market opens The company has consistently beaten earnings expectations In fact Zoetis earnings surpassed expectations in each of the last four quarters with an average positive surprise
BMRN,BMRN:UW,BBG000CZX7N1,Perrigo Company (PRGO) Q4 Earnings: Disappointment in Store?,2017-02-10 16:21:19 +0000,http://articlefeeds.nasdaq.com/~r/nasdaq/symbols/~3/BW3UORxZllk/perrigo-company-prgo-q4-earnings-disappointment-in-store-cm746254,Perrigo Company plc PRGO is expected to report fourth quarter 2016 results this month Perrigo has a mixed track record as the company beat expectations in two of the last four quarters and missed the same in the other two Overall the company has an average negative earnings surprise of 1
BMRN,BMRN:UW,BBG000CZX7N1,Agios Pharmaceuticals (AGIO) Q4 Earnings: What's in Store?,2017-02-10 16:21:14 +0000,http://articlefeeds.nasdaq.com/~r/nasdaq/symbols/~3/d0Mb7ThaZ-A/agios-pharmaceuticals-agio-q4-earnings-whats-in-store-cm746246,Agios Pharmaceuticals Inc AGIO is scheduled to report fourth quarter and full year 2016 results on Feb 16 Agios shares gained 10 3 so far this year while the Zacks classified Medical Products industry witnessed an increase of 5 3 Agios performance has been far
BMRN,BMRN:UW,BBG000CZX7N1,Agios Pharmaceuticals (AGIO) Q4 Earnings: What's in Store?,2017-02-10 14:29:02 +0000,http://finance.yahoo.com/news/agios-pharmaceuticals-agio-q4-earnings-142902997.html,Agios Pharmaceuticals (AGIO) Q4 Earnings: What's in Store?
BMRN,BMRN:UW,BBG000CZX7N1,Perrigo Company (PRGO) Q4 Earnings: Disappointment in Store?,2017-02-10 14:28:02 +0000,http://finance.yahoo.com/news/perrigo-company-prgo-q4-earnings-142802893.html,Perrigo Company (PRGO) Q4 Earnings: Disappointment in Store?
BMRN,BMRN:UW,BBG000CZX7N1,Teva (TEVA) Q4 Earnings: What's in Store for the Stock?,2017-02-08 15:21:17 +0000,http://articlefeeds.nasdaq.com/~r/nasdaq/symbols/~3/0HOHTC-kiDs/teva-teva-q4-earnings-whats-in-store-for-the-stock-cm744860,Teva Pharmaceutical Industries Ltd TEVA will be reporting fourth quarter 2016 and full year earnings on Feb 13 before the market opens Last quarter the company delivered in line earnings This generic drug maker s shares have lost 11 3 so far this year while the Zacks classified
BMRN,BMRN:UW,BBG000CZX7N1,Gilead Sciences & Bristol Myers: Two Wrongs Make a Right?,2017-02-08 15:17:00 +0000,http://blogs.barrons.com/stockstowatchtoday/2017/02/08/gilead-sciences-bristol-myers-two-wrongs-make-a-right/?mod=yahoobarrons&ru=yahoo,Gilead Sciences & Bristol Myers: Two Wrongs Make a Right?
BMRN,BMRN:UW,BBG000CZX7N1,BioMarin to Attend Three Investor Conferences in 1Q17,2017-02-08 13:30:00 +0000,http://finance.yahoo.com/news/biomarin-attend-three-investor-conferences-133000450.html,"[PR Newswire] - SAN RAFAEL, Calif., Feb. 8, 2017 /PRNewswire/ -- BioMarin Pharmaceutical Inc. (NASDAQ: BMRN), today announced that Jean-Jacques Bienaimé , Chairman and Chief Executive Officer, will participate in the ..."
BMRN,BMRN:UW,BBG000CZX7N1,5 Great Biotech Stocks to Buy Now,2017-02-07 22:16:59 +0000,http://articlefeeds.nasdaq.com/~r/nasdaq/symbols/~3/jLjhvST47po/5-great-biotech-stocks-to-buy-now-cm744505,Through the second half of 2015 biotech stocks were the preferred choice of investors seeking aggressive growth options Even as the S amp P 500 gained around 50 from 2013 up to that point the likes of the iShares Nasdaq Biotechnology Index and the SPDR S amp P Biotech nearly tripled in
BMRN,BMRN:UW,BBG000CZX7N1,Your Guide To 2017's Emerging Pharmaceuticals Catalysts,2017-02-07 19:39:19 +0000,http://finance.yahoo.com/news/guide-2017s-emerging-pharmaceuticals-catalysts-193919266.html,Your Guide To 2017's Emerging Pharmaceuticals Catalysts
BMRN,BMRN:UW,BBG000CZX7N1,BioMarin sues to stop generic version of its $90K-a-year drug,2017-02-07 18:24:13 +0000,http://www.bizjournals.com/sanfrancisco/news/2017/02/06/biomarin-bmrn-dr-reddys-laboratories-rdy-kuvan-pku.html?ana=yahoo,BioMarin sues to stop generic version of its $90K-a-year drug
BMRN,BMRN:UW,BBG000CZX7N1,"BioMarin to Host Fourth Quarter and Full Year 2016 Financial Results Conference Call and Webcast on Thursday, February 23 at 4:30pm ET",2017-02-07 13:30:00 +0000,http://finance.yahoo.com/news/biomarin-host-fourth-quarter-full-133000452.html,"[PR Newswire] - SAN RAFAEL, Calif., Feb. 7, 2017 /PRNewswire/ -- BioMarin Pharmaceutical Inc. (NASDAQ: BMRN) today announced that Jean-Jacques Bienaimé, Chairman and Chief Executive Officer of BioMarin, will host a conference ..."
BMRN,BMRN:UW,BBG000CZX7N1,BioMarin's Hemophilia Candidate Included in PRIME Initiative,2017-02-02 17:36:03 +0000,http://articlefeeds.nasdaq.com/~r/nasdaq/symbols/~3/wi5nY45v7MA/biomarins-hemophilia-candidate-included-in-prime-initiative-cm742340,BioMarin Pharmaceutical Inc BMRN announced thatBMN 270 being evaluated for the treatment for severe hemophilia A has been granted access to Priority Medicines PRIME a regulatory initiative by the European Medicines Agency EMA For a candidate to be accepted under PRIME it has
BMRN,BMRN:UW,BBG000CZX7N1,BioMarin's Hemophilia Candidate Included in PRIME Initiative,2017-02-02 15:14:03 +0000,http://finance.yahoo.com/news/biomarins-hemophilia-candidate-included-prime-151403521.html,BioMarin's Hemophilia Candidate Included in PRIME Initiative
BMRN,BMRN:UW,BBG000CZX7N1,BioMarin Receives Access to Priority Medicines (PRIME) Regulatory Support from EMA for BMN 270 Gene Therapy in Hemophilia A,2017-02-01 21:15:00 +0000,http://finance.yahoo.com/news/biomarin-receives-access-priority-medicines-211500566.html,"[PR Newswire] - SAN RAFAEL, Calif., Feb. 1, 2017 /PRNewswire/ -- BioMarin Pharmaceutical Inc. (BMRN) announced today that the European Medicines Agency (EMA) has granted access to its Priority Medicines (PRIME) regulatory initiative for the company's investigational gene therapy treatment for severe hemophilia A, BMN 270. To be accepted for PRIME, an investigational therapy has to show its potential to benefit patients with unmet medical needs based on early clinical data. PRIME is a scheme to strengthen support to medicines that target an unmet medical need."
BMRN,BMRN:UW,BBG000CZX7N1,BioMarin Pharmaceutical (BMRN) Shares Cross Above 200 DMA,2017-02-01 18:32:31 +0000,http://articlefeeds.nasdaq.com/~r/nasdaq/symbols/~3/DukPw3PEXPA/biomarin-pharmaceutical-bmrn-shares-cross-above-200-dma-cm741705,In trading on Wednesday shares of BioMarin Pharmaceutical Inc Symbol BMRN crossed above their 200 day moving average of 88 32 changing hands as high as 89 15 per share BioMarin Pharmaceutical Inc shares are currently trading up about 0 3 on the day The chart below shows the one
BMRN,BMRN:UW,BBG000CZX7N1,4 Top Biotech Stocks With Big Upcoming Catalysts,2017-01-31 15:15:10 +0000,http://finance.yahoo.com/news/4-top-biotech-stocks-big-151510658.html,4 Top Biotech Stocks With Big Upcoming Catalysts
BMRN,BMRN:UW,BBG000CZX7N1,"BioMarin Pharmaceutical, Inc. breached its 50 day moving average in a Bullish Manner : BMRN-US : January 30, 2017",2017-01-30 12:24:37 +0000,http://www.capitalcube.com/blog/index.php/biomarin-pharmaceutical-inc-breached-its-50-day-moving-average-in-a-bullish-manner-bmrn-us-january-30-2017/,"BioMarin Pharmaceutical, Inc. breached its 50 day moving average in a Bullish Manner : BMRN-US : January 30, 2017"
BMRN,BMRN:UW,BBG000CZX7N1,Is BioMarin (BMRN) Well Poised for Growth in 2017?,2017-01-26 17:34:22 +0000,http://articlefeeds.nasdaq.com/~r/nasdaq/symbols/~3/5eLgf7DCyGg/is-biomarin-bmrn-well-poised-for-growth-in-2017-cm738794,We issued an updated research report on BioMarin Pharmaceutical Inc BMRN on Jan 25 BioMarin should continue to see growth in both its orphan disease drugs Vimizim and Kuvan in 2017 Vimizim sales continue to be driven by robust patient growth and penetration in additional markets
BMRN,BMRN:UW,BBG000CZX7N1,Is BioMarin (BMRN) Well Poised for Growth in 2017?,2017-01-26 15:04:03 +0000,http://finance.yahoo.com/news/biomarin-bmrn-well-poised-growth-150403580.html,Is BioMarin (BMRN) Well Poised for Growth in 2017?
BMRN,BMRN:UW,BBG000CZX7N1,Look Under The Hood: PXMG Has 10% Upside,2017-01-24 15:32:30 +0000,http://articlefeeds.nasdaq.com/~r/nasdaq/symbols/~3/v3OWFU83PkA/look-under-the-hood-pxmg-has-10-upside-cm737246,Looking at the underlying holdings of the ETFs in our coverage universe at ETF Channel we have compared the trading price of each holding against the average analyst 12 month forward target price and computed the weighted average implied analyst target price for the ETF itself For
BMRN,BMRN:UW,BBG000CZX7N1,"We’re in the year of the biotech buyout, and here are five prime targets",2017-01-23 20:21:48 +0000,http://www.marketwatch.com/News/Story/Story.aspx?guid=017E3E92-E0DC-11E6-A68E-C10141C44E92&siteid=yhoof2,"We’re in the year of the biotech buyout, and here are five prime targets"
BMRN,BMRN:UW,BBG000CZX7N1,Baird Has 4 Red-Hot Biotechs to Buy for 2017 With Huge Upside Potential,2017-01-19 13:40:50 +0000,http://finance.yahoo.com/news/baird-4-red-hot-biotechs-134050054.html,Baird Has 4 Red-Hot Biotechs to Buy for 2017 With Huge Upside Potential
BMRN,BMRN:UW,BBG000CZX7N1,"BioMarin Pharmaceutical, Inc. breached its 50 day moving average in a Bearish Manner : BMRN-US : January 18, 2017",2017-01-18 14:53:32 +0000,http://www.capitalcube.com/blog/index.php/biomarin-pharmaceutical-inc-breached-its-50-day-moving-average-in-a-bearish-manner-bmrn-us-january-18-2017/,"BioMarin Pharmaceutical, Inc. breached its 50 day moving average in a Bearish Manner : BMRN-US : January 18, 2017"
BMRN,BMRN:UW,BBG000CZX7N1,"Sarepta Opens Up About Duchenne Drug Launch, Allays Investors' Worst Fears",2017-01-10 15:33:00 +0000,https://www.thestreet.com/story/13948568/1/sarepta-opens-up-about-duchenne-drug-launch-allays-investors-worst-fears.html?puc=yahoo&cm_ven=YAHOO,"Sarepta Opens Up About Duchenne Drug Launch, Allays Investors' Worst Fears"
BMRN,BMRN:UW,BBG000CZX7N1,Top Stocks to Buy Now That the 21st Century Cures Act Has Passed,2017-01-10 14:39:05 +0000,http://www.fool.com/investing/2017/01/09/top-stocks-to-buy-now-that-the-21st-century-cures.aspx?source=yahoo-2&utm_campaign=article&utm_medium=feed&utm_source=yahoo-2,Top Stocks to Buy Now That the 21st Century Cures Act Has Passed
BMRN,BMRN:UW,BBG000CZX7N1,BioMarin Pharmaceutical Breaks Above 200-Day Moving Average - Bullish for BMRN,2017-01-09 18:49:47 +0000,http://articlefeeds.nasdaq.com/~r/nasdaq/symbols/~3/rnJ7CwdW86w/biomarin-pharmaceutical-breaks-above-200-day-moving-average-bullish-for-bmrn-cm731198,In trading on Monday shares of BioMarin Pharmaceutical Inc Symbol BMRN crossed above their 200 day moving average of 88 15 changing hands as high as 92 20 per share BioMarin Pharmaceutical Inc shares are currently trading up about 2 2 on the day The chart below shows the one
BMRN,BMRN:UW,BBG000CZX7N1,Top Stocks to Buy Now That the 21st Century Cures Act Has Passed,2017-01-09 15:52:29 +0000,http://articlefeeds.nasdaq.com/~r/nasdaq/symbols/~3/kMQaWvon3ZM/top-stocks-to-buy-now-that-the-21st-century-cures-act-has-passed-cm731004,Now that Washington has signed off on the 21st Century Cures Act deregulation streamlining and billions of additional research dollars could cause healthcare stocks to pop Do you own the stocks most likely to benefit In this clip from The Motley Fool s Industry
BMRN,BMRN:UW,BBG000CZX7N1,BioMarin CEO: Positive results for hemophilia treatment,2017-01-09 13:38:00 +0000,http://finance.yahoo.com/video/biomarin-ceo-positive-results-hemophilia-133800757.html,BioMarin CEO: Positive results for hemophilia treatment
BMRN,BMRN:UW,BBG000CZX7N1,Biomarin Pharmaceutical To Present At J.P. Morgan Conference; Webcast At 11:30AM,2017-01-09 10:31:00 +0000,http://articlefeeds.nasdaq.com/~r/nasdaq/symbols/~3/V73hNDrcT1M/biomarin-pharmaceutical-to-present-at-jp-morgan-conference-webcast-at-1130am-20170109-00692,Biomarin Pharmaceutical To Present At J.P. Morgan Conference; Webcast At 11:30AM
BMRN,BMRN:UW,BBG000CZX7N1,BioMarin Pharma cites positive results for hemophilia treatment,2017-01-09 02:19:18 +0000,http://finance.yahoo.com/news/biomarin-pharma-cites-positive-results-021918341.html,BioMarin Pharma cites positive results for hemophilia treatment
BMRN,BMRN:UW,BBG000CZX7N1,BioMarin to Provide Update to Proof-of-Concept Data for BMN 270 Gene Therapy in Hemophilia A at 35th Annual J.P. Morgan Healthcare Conference,2017-01-09 00:45:00 +0000,http://finance.yahoo.com/news/biomarin-proof-concept-data-bmn-004500614.html,"[PR Newswire] - SAN RAFAEL, Calif., Jan. 8, 2017 /PRNewswire/ -- BioMarin Pharmaceutical Inc. (NASDAQ:BMRN) announced today an update to its positive interim results of an open-label Phase 1/2 study of BMN 270, an investigational ..."
BMRN,BMRN:UW,BBG000CZX7N1,Could Sanofi Acquire BioMarin In Wake Of Amgen LDL Brouhaha?,2017-01-06 21:22:41 +0000,http://www.investors.com/news/technology/could-sanofi-acquire-biomarin-in-wake-of-amgen-ldl-brouhaha/,Could Sanofi Acquire BioMarin In Wake Of Amgen LDL Brouhaha?
BMRN,BMRN:UW,BBG000CZX7N1,Biotech Investing: 3 Bold Predictions for 2017,2017-01-06 15:55:41 +0000,http://www.fool.com/investing/2017/01/06/biotech-investing-3-bold-predictions-for-2017.aspx?source=yahoo-2&utm_campaign=article&utm_medium=feed&utm_source=yahoo-2,Biotech Investing: 3 Bold Predictions for 2017
BMRN,BMRN:UW,BBG000CZX7N1,Biotech Investing: 3 Bold Predictions for 2017,2017-01-06 14:40:32 +0000,http://articlefeeds.nasdaq.com/~r/nasdaq/symbols/~3/75sL-Uy4MWA/biotech-investing-3-bold-predictions-for-2017-cm730229,Making bold predictions actually isn t too hard to do Having them come true is another story altogether Nevertheless a new year is now upon us and I can t resist the urge to make a few bold predictions about the world of biotech investing in 2017 A handful of biotechs showed up in
BMRN,BMRN:UW,BBG000CZX7N1,Blog Coverage Affimed Join Hands with MD Anderson Cancer Center for Clinical Immuno-Oncology Development Collaboration,2017-01-05 13:15:00 +0000,http://finance.yahoo.com/news/blog-coverage-affimed-join-hands-131500393.html,"[Accesswire] - Upcoming AWS Coverage on BioMarin Pharmaceutical LONDON, UK / ACCESSWIRE / January 5, 2017 / Active Wall St. blog coverage looks at the headline from Affimed N.V. (NASDAQ: AFMD ) as the Company and The ..."
BMRN,BMRN:UW,BBG000CZX7N1,"The Zacks Analyst Blog Highlights: Sucampo Pharmaceuticals, Dr. Reddy's Laboratories, BioMarin Pharmaceutical and Repligen",2017-01-04 16:42:04 +0000,http://articlefeeds.nasdaq.com/~r/nasdaq/symbols/~3/4dVoICHOy0E/the-zacks-analyst-blog-highlights-sucampo-pharmaceuticals-dr-reddys-laboratories-biomarin-pharmaceutical-and-repligen-cm729418,For Immediate Release Chicago IL January 04 2017 Zacks com announces the list of stocks featured in the Analyst Blog Every day the Zacks Equity Research analysts discuss the latest news and events impacting stocks and the financial markets Stocks recently featured in the blog
BMRN,BMRN:UW,BBG000CZX7N1,"The Zacks Analyst Blog Highlights: Sucampo Pharmaceuticals, Dr. Reddy's Laboratories, BioMarin Pharmaceutical and Repligen",2017-01-04 14:30:02 +0000,http://finance.yahoo.com/news/zacks-analyst-blog-highlights-sucampo-143002818.html,"The Zacks Analyst Blog Highlights: Sucampo Pharmaceuticals, Dr. Reddy's Laboratories, BioMarin Pharmaceutical and Repligen"
BMRN,BMRN:UW,BBG000CZX7N1,"BioMarin Pharmaceutical, Inc. breached its 50 day moving average in a Bullish Manner : BMRN-US : January 4, 2017",2017-01-04 13:09:21 +0000,http://www.capitalcube.com/blog/index.php/biomarin-pharmaceutical-inc-breached-its-50-day-moving-average-in-a-bullish-manner-bmrn-us-january-4-2017/,"BioMarin Pharmaceutical, Inc. breached its 50 day moving average in a Bullish Manner : BMRN-US : January 4, 2017"
BMRN,BMRN:UW,BBG000CZX7N1,3 Overlooked Drug Stocks to Watch Out for in 2017,2017-01-03 15:01:49 +0000,http://articlefeeds.nasdaq.com/~r/nasdaq/symbols/~3/mAFvUeim7xQ/3-overlooked-drug-stocks-to-watch-out-for-in-2017-cm728634,2016 was a rough year for the medical sector especially biotech stocks with the NASDAQ Biotechnology index declining 19 1 during the year while the NYSE ARCA Pharmaceutical Index was down 9 7 The pharma biotech sector faced several headwinds last year including slow product launches fewer
BMRN,BMRN:UW,BBG000CZX7N1,3 Overlooked Drug Stocks to Watch Out for in 2017,2017-01-03 13:32:01 +0000,http://finance.yahoo.com/news/3-overlooked-drug-stocks-watch-133201454.html,3 Overlooked Drug Stocks to Watch Out for in 2017
BMRN,BMRN:UW,BBG000CZX7N1,BioMarin to Present at 35th Annual J.P. Morgan Healthcare Conference in San Francisco,2017-01-03 13:00:00 +0000,http://finance.yahoo.com/news/biomarin-present-35th-annual-j-130000899.html,"[PR Newswire] - SAN RAFAEL, Calif., Jan. 3, 2017 /PRNewswire/ -- BioMarin Pharmaceutical Inc. (NASDAQ: BMRN), today announced that Jean-Jacques Bienaimé , Chairman and Chief Executive Officer, will participate in the ..."
BMRN,BMRN:UW,BBG000CZX7N1,BioMarin (BMRN) Raised to Buy: Should You Add the Stock?,2016-12-29 16:57:19 +0000,http://articlefeeds.nasdaq.com/~r/nasdaq/symbols/~3/wdEK022OWF4/biomarin-bmrn-raised-to-buy-should-you-add-the-stock-cm727417,On Dec 28 Zacks Investment Research upgraded BioMarin Pharmaceutical Inc BMRN by one notch to a Zacks Rank 2 Buy Why the Upgrade BioMarin s shares have gained 3 8 since the company reported stellar results for the third quarter of 2016 on Oct 27 Moreover its year to date
BMRN,BMRN:UW,BBG000CZX7N1,BioMarin (BMRN) Raised to Buy: Should You Add the Stock?,2016-12-29 15:11:03 +0000,http://finance.yahoo.com/news/biomarin-bmrn-raised-buy-add-151103603.html,BioMarin (BMRN) Raised to Buy: Should You Add the Stock?
BMRN,BMRN:UW,BBG000CZX7N1,3 Precision Medicine Stocks to Buy in January,2016-12-27 20:07:34 +0000,http://www.fool.com/investing/2016/12/27/3-precision-medicine-stocks-to-buy-in-january.aspx?source=yahoo-2&utm_campaign=article&utm_medium=feed&utm_source=yahoo-2,3 Precision Medicine Stocks to Buy in January
BMRN,BMRN:UW,BBG000CZX7N1,Time for biotech to boom ... or bust?,2016-12-27 19:45:00 +0000,http://finance.yahoo.com/video/time-biotech-boom-bust-194500895.html,Time for biotech to boom ... or bust?
BMRN,BMRN:UW,BBG000CZX7N1,3 Precision Medicine Stocks to Buy in January,2016-12-27 13:57:59 +0000,http://articlefeeds.nasdaq.com/~r/nasdaq/symbols/~3/Egsu_sEbeRo/3-precision-medicine-stocks-to-buy-in-january-cm726145,Precision medicine The term might sound futuristic but the future has arrived The National Institutes of Health defines precision medicine as an emerging approach for disease treatment and prevention that takes into account individual variability in genes environment and
BMRN,BMRN:UW,BBG000CZX7N1,RBC Likes Large Cap Biotech Leaders for 2017,2016-12-22 13:25:48 +0000,http://247wallst.com/healthcare-business/2016/12/22/rbc-likes-large-cap-biotech-leaders-for-2017/,RBC Likes Large Cap Biotech Leaders for 2017
BMRN,BMRN:UW,BBG000CZX7N1,"BioMarin Pharmaceutical, Inc. – Value Analysis (NASDAQ:BMRN) : December 21, 2016",2016-12-21 14:35:54 +0000,http://www.capitalcube.com/blog/index.php/biomarin-pharmaceutical-inc-value-analysis-nasdaqbmrn-december-21-2016/,"BioMarin Pharmaceutical, Inc. – Value Analysis (NASDAQ:BMRN) : December 21, 2016"
BMRN,BMRN:UW,BBG000CZX7N1,"BioMarin Pharmaceutical, Inc. breached its 50 day moving average in a Bearish Manner : BMRN-US : December 20, 2016",2016-12-20 12:40:11 +0000,http://www.capitalcube.com/blog/index.php/biomarin-pharmaceutical-inc-breached-its-50-day-moving-average-in-a-bearish-manner-bmrn-us-december-20-2016/,"BioMarin Pharmaceutical, Inc. breached its 50 day moving average in a Bearish Manner : BMRN-US : December 20, 2016"
BMRN,BMRN:UW,BBG000CZX7N1,"BIOMARIN PHARMACEUTICAL INC Files SEC form 8-K, Entry into a Material Definitive Agreement, Change in Directors or Pr",2016-12-19 21:16:38 +0000,http://biz.yahoo.com/e/161219/bmrn8-k.html,"BIOMARIN PHARMACEUTICAL INC Files SEC form 8-K, Entry into a Material Definitive Agreement, Change in Directors or Pr"
BMRN,BMRN:UW,BBG000CZX7N1,3 Growth Stocks You Should Avoid in 2017,2016-12-15 17:58:37 +0000,http://articlefeeds.nasdaq.com/~r/nasdaq/symbols/~3/eoRuxQP5R04/3-growth-stocks-you-should-avoid-in-2017-cm722065,Image source Getty Images There s no sugar coating it Growth stocks have been the shining stars over value stocks since the Great Recession ended Although a Bank of America Merrill Lynch study found that value stocks have outperformed growth stocks over the past 90 years with
BMRN,BMRN:UW,BBG000CZX7N1,3 Growth Stocks You Should Avoid in 2017,2016-12-15 16:02:07 +0000,http://www.fool.com/investing/2016/12/15/3-growth-stocks-you-should-avoid-in-2017.aspx?source=yahoo-2&utm_campaign=article&utm_medium=feed&utm_source=yahoo-2,3 Growth Stocks You Should Avoid in 2017
BMRN,BMRN:UW,BBG000CZX7N1,Will Insurers Pay For Sarepta's DMD Drug?,2016-12-14 19:13:00 +0000,http://blogs.barrons.com/stockstowatchtoday/2016/12/14/will-insurers-pay-for-sareptas-dmd-drug/?mod=yahoobarrons&ru=yahoo,Will Insurers Pay For Sarepta's DMD Drug?
BMRN,BMRN:UW,BBG000CZX7N1,BioMarin Enrolls First Participant in Phase 3 Trial of Vosoritide for Treatment of Children with Achondroplasia,2016-12-12 13:29:00 +0000,http://finance.yahoo.com/news/biomarin-enrolls-first-participant-phase-132900693.html,"[GlobeNewswire] - SAN RAFAEL, Calif., Dec. 12, 2016-- BioMarin Pharmaceutical Inc. announced today that the company has initiated a global Phase 3 study for vosoritide, an analog of C-type Natriuretic Peptide, in children ..."
BMRN,BMRN:UW,BBG000CZX7N1,"BIOMARIN PHARMACEUTICAL INC Files SEC form 8-K, Change in Directors or Principal Officers, Financial Statements and E",2016-12-09 21:16:36 +0000,http://biz.yahoo.com/e/161209/bmrn8-k.html,"BIOMARIN PHARMACEUTICAL INC Files SEC form 8-K, Change in Directors or Principal Officers, Financial Statements and E"
BMRN,BMRN:UW,BBG000CZX7N1,[$$] Would Gilead Buy BioMarin?,2016-12-08 20:06:00 +0000,http://www.barrons.com/articles/would-gilead-buy-biomarin-1481227564?mod=yahoobarrons&ru=yahoo,[$$] Would Gilead Buy BioMarin?
BMRN,BMRN:UW,BBG000CZX7N1,Biomarin Pharma To Present At Citi Healthcare Conference; Webcast At 8:45 AM ET,2016-12-08 07:45:00 +0000,http://articlefeeds.nasdaq.com/~r/nasdaq/symbols/~3/f3wriGVKcuI/biomarin-pharma-to-present-at-citi-healthcare-conference-webcast-at-845-am-et-20161208-00278,Biomarin Pharma To Present At Citi Healthcare Conference; Webcast At 8:45 AM ET
BMRN,BMRN:UW,BBG000CZX7N1,Do Hedge Funds Love Agilent Technologies Inc (A)?,2016-12-07 12:33:58 +0000,http://www.insidermonkey.com/blog/do-hedge-funds-love-agilent-technologies-inc-a-499777/,Do Hedge Funds Love Agilent Technologies Inc (A)?
BMRN,BMRN:UW,BBG000CZX7N1,Hedge Funds Are Buying BioMarin Pharmaceutical Inc. (BMRN),2016-12-06 15:38:17 +0000,http://www.insidermonkey.com/blog/hedge-funds-are-buying-biomarin-pharmaceutical-inc-bmrn-499608/,Hedge Funds Are Buying BioMarin Pharmaceutical Inc. (BMRN)
BMRN,BMRN:UW,BBG000CZX7N1,7 of the Most Shocking Biotech Pipeline Blowups of 2016,2016-12-04 18:04:17 +0000,http://www.fool.com/investing/2016/12/04/7-of-the-most-shocking-biotech-pipeline-blowups-of.aspx?source=yahoo-2&utm_campaign=article&utm_medium=feed&utm_source=yahoo-2,7 of the Most Shocking Biotech Pipeline Blowups of 2016
BMRN,BMRN:UW,BBG000CZX7N1,"BIOMARIN PHARMACEUTICAL INC Files SEC form 8-K, Entry into a Material Definitive Agreement, Creation of a Direct Fina",2016-12-02 21:17:01 +0000,http://biz.yahoo.com/e/161202/bmrn8-k.html,"BIOMARIN PHARMACEUTICAL INC Files SEC form 8-K, Entry into a Material Definitive Agreement, Creation of a Direct Fina"
BMRN,BMRN:UW,BBG000CZX7N1,BioMarin Surging Beneath the Surface,2016-11-29 16:58:00 +0000,http://realmoney.thestreet.com/articles/11/29/2016/biomarin-surging-beneath-surface?puc=yahoo&cm_ven=YAHOO,BioMarin Surging Beneath the Surface
BMRN,BMRN:UW,BBG000CZX7N1,"Nasdaq 100 Movers: BMRN, NFLX",2016-11-29 16:54:17 +0000,http://articlefeeds.nasdaq.com/~r/nasdaq/symbols/~3/Orhc7QXLPGc/nasdaq-100-movers-bmrn-nflx-cm715113,In early trading on Tuesday shares of Netflix NFLX topped the list of the day s best performing components of the Nasdaq 100 index trading up 1 9 Year to date Netflix registers a 4 2 gain And the worst performing Nasdaq 100 component thus far on the day is BioMarin
BMRN,BMRN:UW,BBG000CZX7N1,Biomarin Pharmaceutical Inc (BMRN) CEO Jean Jacques Bienaime Sold $12.1 million of Shares,2016-11-24 00:15:03 +0000,http://finance.yahoo.com/news/biomarin-pharmaceutical-inc-bmrn-ceo-001503148.html,Biomarin Pharmaceutical Inc (BMRN) CEO Jean Jacques Bienaime Sold $12.1 million of Shares
BMRN,BMRN:UW,BBG000CZX7N1,"Market Close Report: NASDAQ Composite index closes at 5,380.68 down -5.67 points",2016-11-23 21:49:54 +0000,http://articlefeeds.nasdaq.com/~r/nasdaq/symbols/~3/Teh7U4JYR1A/market-close-report-nasdaq-composite-index-closes-at-538068-down-567-points-cm713552,Wednesday s session closes with the NASDAQ Composite Index at 5 380 68 The total shares traded for the NASDAQ was over 1 69 billion Wednesday s session closes with the NASDAQ Composite Index at 5 380 68 The total shares traded for the NASDAQ was over 1 69 billion Advancers stocks led
BMRN,BMRN:UW,BBG000CZX7N1,5 Biotech Stocks George Soros Is Buying,2016-11-23 15:29:28 +0000,http://www.fool.com/investing/2016/11/22/5-biotech-stocks-george-soros-is-buying.aspx?source=yahoo-2&utm_campaign=article&utm_medium=feed&utm_source=yahoo-2,5 Biotech Stocks George Soros Is Buying
