BMRN,BMRN:UW,BBG000CZX7N1,The Medicines Co. (MDCO) Q3 Loss Narrower than Expected,2016-10-27 16:46:40 +0000,http://articlefeeds.nasdaq.com/~r/nasdaq/symbols/~3/hoa1kLrNVSw/the-medicines-co-mdco-q3-loss-narrower-than-expected-cm699494,The Medicines Company MDCO reported a loss of 75 cents per share including the impact of share based compensation expenses in the third quarter of 2016 significantly narrower than both the Zacks Consensus Estimate of a loss of 1 38 and the year ago loss of 94 cents Meanwhile
BMRN,BMRN:UW,BBG000CZX7N1,"Celgene (CELG) Beats on Q3 Earnings, Raises '16 Outlook",2016-10-27 15:45:03 +0000,http://finance.yahoo.com/news/celgene-celg-beats-q3-earnings-154503140.html,"Celgene (CELG) Beats on Q3 Earnings, Raises '16 Outlook"
BMRN,BMRN:UW,BBG000CZX7N1,"Glaxo (GSK) Beats Q3 Earnings Estimates, Keeps 2016 View",2016-10-27 15:42:03 +0000,http://finance.yahoo.com/news/glaxo-gsk-beats-q3-earnings-154203289.html,"Glaxo (GSK) Beats Q3 Earnings Estimates, Keeps 2016 View"
BMRN,BMRN:UW,BBG000CZX7N1,"Bristol-Myers (BMY) Beats on Q3 Earnings, Ups 2016 View",2016-10-27 15:22:03 +0000,http://finance.yahoo.com/news/bristol-myers-bmy-beats-q3-152203873.html,"Bristol-Myers (BMY) Beats on Q3 Earnings, Ups 2016 View"
BMRN,BMRN:UW,BBG000CZX7N1,"Bayer (BAYRY) Beats on Q3 Earnings, Lifts 2016 Guidance",2016-10-27 14:45:36 +0000,http://articlefeeds.nasdaq.com/~r/nasdaq/symbols/~3/S9hgtkNstI8/bayer-bayry-beats-on-q3-earnings-lifts-2016-guidance-cm699409,Bayer AG s BAYRY third quarter 2016 core earnings increased 2 4 year over year to 1 73 per share approximately 1 93 Reported earnings were able to beat the Zacks Consensus Estimate of 1 80 Total sales in the third quarter improved 2 3 to 11 3 billion approximately 13 billion on
BMRN,BMRN:UW,BBG000CZX7N1,The Medicines Co. (MDCO) Q3 Loss Narrower than Expected,2016-10-27 14:33:02 +0000,http://finance.yahoo.com/news/medicines-co-mdco-q3-loss-143302841.html,The Medicines Co. (MDCO) Q3 Loss Narrower than Expected
BMRN,BMRN:UW,BBG000CZX7N1,ProQR Therapeutics (PRQR) Worth a Look: Stock Up 9.8%,2016-10-27 13:43:34 +0000,http://articlefeeds.nasdaq.com/~r/nasdaq/symbols/~3/y_fTw1q8pu4/proqr-therapeutics-prqr-worth-a-look-stock-up-98-cm699254,ProQR Therapeutics N V PRQR was a big mover last session as the company saw its shares rise nearly 10 on the day The move came on solid volume too with far more shares changing hands than in a normal session This reverses the recent trend for the company as the stock is now down nearly
BMRN,BMRN:UW,BBG000CZX7N1,ProQR Therapeutics (PRQR) Worth a Look: Stock Up 9.8%,2016-10-27 12:45:12 +0000,http://finance.yahoo.com/news/proqr-therapeutics-prqr-worth-look-124512661.html,ProQR Therapeutics (PRQR) Worth a Look: Stock Up 9.8%
BMRN,BMRN:UW,BBG000CZX7N1,Q3 2016 Biomarin Pharmaceutical Inc Earnings Release - Time Not Supplied,2016-10-27 11:07:08 +0000,http://biz.yahoo.com/research/earncal/20161027.html?t=bmrn,Q3 2016 Biomarin Pharmaceutical Inc Earnings Release - Time Not Supplied
BMRN,BMRN:UW,BBG000CZX7N1,10 Most Successful Innovative Companies in The World in 2016,2016-10-26 18:50:57 +0000,http://www.insidermonkey.com/blog/10-most-successful-innovative-companies-in-the-world-in-2016-482431/,10 Most Successful Innovative Companies in The World in 2016
BMRN,BMRN:UW,BBG000CZX7N1,Dr. Reddy's (RDY) Earnings & Revenues Decline Y/Y in Q2,2016-10-26 15:53:26 +0000,http://articlefeeds.nasdaq.com/~r/nasdaq/symbols/~3/GHhuVeh21MY/dr-reddys-rdy-earnings-revenues-decline-yy-in-q2-cm698533,Dr Reddy s Laboratories Ltd RDY reported second quarter fiscal 2017 earnings per American Depositary Share ADS of 27 cents down 57 1 year over year Moreover quarterly revenues declined 10 year over year to 539 million primarily due to lower contribution from all its
BMRN,BMRN:UW,BBG000CZX7N1,"Express Scripts (ESRX) Q3 Earnings in Line, Revenues Lag",2016-10-26 14:53:01 +0000,http://articlefeeds.nasdaq.com/~r/nasdaq/symbols/~3/HLdl7KafoLY/express-scripts-esrx-q3-earnings-in-line-revenues-lag-cm698574,Pharmacy benefit manager Express Scripts Holding Company ESRX posted third quarter 2016 earnings per share excluding special items of 1 74 in line with the Zacks Consensus Estimate Reported earnings were up 20 from the year ago period FindTheCompany Graphiq On a
BMRN,BMRN:UW,BBG000CZX7N1,"Vertex's (VRTX) Q3 Loss Wider than Expected, Sales Miss",2016-10-26 13:50:41 +0000,http://articlefeeds.nasdaq.com/~r/nasdaq/symbols/~3/ynaMS2__G10/vertexs-vrtx-q3-loss-wider-than-expected-sales-miss-cm698458,Vertex Pharmaceuticals Inc VRTX reported third quarter 2016 loss of 8 cents per share including the impact of stock based compensation expense wider than the Zacks Consensus Estimate of a loss of 6 cents However the loss was narrower than a loss of 40 cents reported in the year ago
BMRN,BMRN:UW,BBG000CZX7N1,"Express Scripts (ESRX) Q3 Earnings in Line, Revenues Lag",2016-10-26 13:17:01 +0000,http://finance.yahoo.com/news/express-scripts-esrx-q3-earnings-131701657.html,"Express Scripts (ESRX) Q3 Earnings in Line, Revenues Lag"
BMRN,BMRN:UW,BBG000CZX7N1,Ligand Partner Melinta Therapeutics Submits NDA for Baxdela,2016-10-25 22:24:52 +0000,http://articlefeeds.nasdaq.com/~r/nasdaq/symbols/~3/HNlZ2OxTG5Q/ligand-partner-melinta-therapeutics-submits-nda-for-baxdela-cm698250,Ligand Pharmaceuticals Incorporated LGND said its partner Melinta Therapeutics a private pharma company has submitted New Drug Applications NDAs to the FDA for its pipeline candidate Baxdela delafloxacin to treat serious bacterial infections Ligand Pharma and Melinta Therapeutics
BMRN,BMRN:UW,BBG000CZX7N1,Ligand Partner Melinta Therapeutics Submits NDA for Baxdela,2016-10-25 20:32:08 +0000,http://finance.yahoo.com/news/ligand-partner-melinta-therapeutics-submits-203208669.html,Ligand Partner Melinta Therapeutics Submits NDA for Baxdela
BMRN,BMRN:UW,BBG000CZX7N1,"Lilly (LLY) Misses on Q3 Earnings, Sales; Animal Health Hurts",2016-10-25 16:28:45 +0000,http://articlefeeds.nasdaq.com/~r/nasdaq/symbols/~3/fLETdGBg3aA/lilly-lly-misses-on-q3-earnings-sales-animal-health-hurts-cm697939,Eli Lilly and Company s LLY third quarter results were below expectations with both earnings and sales missing the Zacks Consensus Estimate The company revised certain elements of its 2016 outlook Shares declined 1 in pre market trading Earnings Miss Third quarter 2016
BMRN,BMRN:UW,BBG000CZX7N1,"Merck (MRK) Beats on Q3 Earnings & Revenues, Lifts View",2016-10-25 16:28:12 +0000,http://articlefeeds.nasdaq.com/~r/nasdaq/symbols/~3/UIXvyQoplXI/merck-mrk-beats-on-q3-earnings-revenues-lifts-view-cm697925,Merck amp Co Inc MRK reported third quarter 2016 earnings of 1 07 per share comfortably surpassing the Zacks Consensus Estimate of 98 cents and increasing approximately 12 from the year ago period FindTheCompany Graphiq Again revenues for the quarter were up 5
BMRN,BMRN:UW,BBG000CZX7N1,Inovio Stock Down on FDA Hold on VGX-3100 Phase III Study,2016-10-25 14:25:45 +0000,http://articlefeeds.nasdaq.com/~r/nasdaq/symbols/~3/idUNRrGc11A/inovio-stock-down-on-fda-hold-on-vgx-3100-phase-iii-study-cm697806,Inovio Pharmaceuticals Inc s INO shares plunged 16 4 after the company announced that the FDA has placed a clinical hold on the proposed phase III program on its lead pipeline candidate VGX 3100 We note that a clinical hold is a notification issued by the FDA to a sponsor of the
BMRN,BMRN:UW,BBG000CZX7N1,"Merck (MRK) Beats on Q3 Earnings & Revenues, Lifts View",2016-10-25 14:04:02 +0000,http://finance.yahoo.com/news/merck-mrk-beats-q3-earnings-140402772.html,"Merck (MRK) Beats on Q3 Earnings & Revenues, Lifts View"
BMRN,BMRN:UW,BBG000CZX7N1,Bristol-Myers's (BMY) Opdivo Under Priority Review by FDA,2016-10-24 16:27:02 +0000,http://articlefeeds.nasdaq.com/~r/nasdaq/symbols/~3/tEbTnB-ytRA/bristol-myerss-bmy-opdivo-under-priority-review-by-fda-cm697211,Bristol Myers Squibb Company BMY announced that its supplemental biologics license application sBLA for immuno oncology drug Opdivo has been accepted for priority review by the FDA The company is looking to expand Opdivo s label to include the treatment of locally advanced unresectable
BMRN,BMRN:UW,BBG000CZX7N1,Merck Gets FDA Approval for Investigational Drug Zinplava,2016-10-24 13:35:01 +0000,http://finance.yahoo.com/news/merck-gets-fda-approval-investigational-133501578.html,Merck Gets FDA Approval for Investigational Drug Zinplava
BMRN,BMRN:UW,BBG000CZX7N1,Top Health Care Earnings Coming Next Week,2016-10-23 14:35:30 +0000,http://247wallst.com/healthcare-business/2016/10/23/top-health-care-earnings-coming-next-week/,Top Health Care Earnings Coming Next Week
BMRN,BMRN:UW,BBG000CZX7N1,"Commit To Buy BioMarin Pharmaceutical At $65, Earn 8.6% Using Options",2016-10-21 17:25:01 +0000,http://articlefeeds.nasdaq.com/~r/nasdaq/symbols/~3/7uKcrS8Fjfw/commit-to-buy-biomarin-pharmaceutical-at-65-earn-86-using-options-cm696659,Investors considering a purchase of BioMarin Pharmaceutical Inc Symbol BMRN stock but tentative about paying the going market price of 83 08 share might benefit from considering selling puts among the alternative strategies at their disposal One interesting put contract in particular
BMRN,BMRN:UW,BBG000CZX7N1,"Roche (RHHBY) Misses Q3 Sales Estimates, 2016 View Intact",2016-10-21 14:02:56 +0000,http://articlefeeds.nasdaq.com/~r/nasdaq/symbols/~3/o-0m2t6pu3I/roche-rhhby-misses-q3-sales-estimates-2016-view-intact-cm696461,Roche Holding AG RHHBY reported sales of 12 79 billion CHF12 48 billion in the third quarter of 2016 compared to CHF11 94 billion 12 38 billion in the year ago comparable period The reported figure however missed the Zacks Consensus Estimate of 12 88 billion by a whisker
BMRN,BMRN:UW,BBG000CZX7N1,How The Parts Add Up: QUS Targets $69,2016-10-21 14:01:28 +0000,http://articlefeeds.nasdaq.com/~r/nasdaq/symbols/~3/7seZAO5YvHg/how-the-parts-add-up-qus-targets-69-cm696429,Looking at the underlying holdings of the ETFs in our coverage universe at ETF Channel we have compared the trading price of each holding against the average analyst 12 month forward target price and computed the weighted average implied analyst target price for the ETF itself For the
BMRN,BMRN:UW,BBG000CZX7N1,Alkermes Depression Candidate Positive in Phase III Study,2016-10-21 13:25:01 +0000,http://finance.yahoo.com/news/alkermes-depression-candidate-positive-phase-132501229.html,Alkermes Depression Candidate Positive in Phase III Study
BMRN,BMRN:UW,BBG000CZX7N1,BioMarin Could Reap $1.1 Billion In 2025 On 'Dwarfism' Drug: Analyst,2016-10-20 20:48:38 +0000,http://www.investors.com/news/technology/biomarin-could-reap-1-1-billion-in-2025-on-dwarfism-drug-analyst/,BioMarin Could Reap $1.1 Billion In 2025 On 'Dwarfism' Drug: Analyst
BMRN,BMRN:UW,BBG000CZX7N1,Alexion Graft-Versus-Host Disease Drug Wins Orphan Status,2016-10-20 17:27:20 +0000,http://articlefeeds.nasdaq.com/~r/nasdaq/symbols/~3/b4VrFi1OLFQ/alexion-graft-versus-host-disease-drug-wins-orphan-status-cm696084,Alexion Pharmaceuticals Inc ALXN announced that the FDA has granted orphan drug designation ODD to its pipeline candidate ALXN1007 for the treatment of acute graft versus host disease GVHD The FDA through its Office of Orphan Products Development grants this status to candidates
BMRN,BMRN:UW,BBG000CZX7N1,A Look At The Science Behind BioMarin Pharmaceutical Inc. (BMRN)’s Next Pivotal Candidate,2016-10-20 15:46:38 +0000,http://www.insidermonkey.com/blog/a-look-at-the-science-behind-biomarin-pharmaceutical-inc-bmrns-next-pivotal-candidate-482378/,A Look At The Science Behind BioMarin Pharmaceutical Inc. (BMRN)’s Next Pivotal Candidate
BMRN,BMRN:UW,BBG000CZX7N1,What's in Store for BioMarin (BMRN) This Earnings Season?,2016-10-20 15:28:57 +0000,http://articlefeeds.nasdaq.com/~r/nasdaq/symbols/~3/holgreg2CpE/whats-in-store-for-biomarin-bmrn-this-earnings-season-cm695926,BioMarin Pharmaceutical Inc BMRN is scheduled to report third quarter 2016 results on Oct 27 after the market closes In the last reported quarter the company had posted a positive surprise of 78 00 Let s see how things are shaping up for this announcement Factors Influencing
BMRN,BMRN:UW,BBG000CZX7N1,What's in Store for BioMarin (BMRN) This Earnings Season?,2016-10-20 13:56:01 +0000,http://finance.yahoo.com/news/whats-store-biomarin-bmrn-earnings-135601378.html,What's in Store for BioMarin (BMRN) This Earnings Season?
BMRN,BMRN:UW,BBG000CZX7N1,Eli Lilly Lartruvo Gets FDA Approval for Soft Tissue Sarcoma,2016-10-20 13:51:13 +0000,http://articlefeeds.nasdaq.com/~r/nasdaq/symbols/~3/3CwzFCuosCg/eli-lilly-lartruvo-gets-fda-approval-for-soft-tissue-sarcoma-cm695769,Eli Lilly and Company LLY announced that the FDA has granted accelerated approval to its pipeline candidate Lartruvo olaratumab injection 10 mg mL in combination with doxorubicin for the treatment of adult patients with advanced soft tissue sarcoma STS not amenable to curative
BMRN,BMRN:UW,BBG000CZX7N1,BioMarin Presents Vosoritide Data in Achondroplasia at American Society of Human Genetics (ASHG) 2016 Meeting,2016-10-19 21:01:00 +0000,http://finance.yahoo.com/news/biomarin-presents-vosoritide-data-achondroplasia-210100615.html,"[GlobeNewswire] - Highest Dose Shows Approximately 50% Increase in Mean Annualized Growth Velocity, Comparable with 15 µg/kg/day dose. Consistent Safety Profile at High Dose. Findings Support 15 µg/kg/day in Phase 3, Randomized ..."
BMRN,BMRN:UW,BBG000CZX7N1,How Much Return Could Alexion Offer over the Next 12 months?,2016-10-19 19:55:01 +0000,http://marketrealist.com/2016/10/how-much-return-could-alexion-offer-over-the-next-12-months/?utm_source=yahoo&utm_medium=feed,How Much Return Could Alexion Offer over the Next 12 months?
BMRN,BMRN:UW,BBG000CZX7N1,AstraZeneca's Hyperkalemia Drug NDA Resubmission Accepted,2016-10-19 15:49:50 +0000,http://articlefeeds.nasdaq.com/~r/nasdaq/symbols/~3/28CHthdi4rA/astrazenecas-hyperkalemia-drug-nda-resubmission-accepted-cm695337,AstraZeneca plc AZN announced that the FDA has accepted for review its complete re submission of the new drug application NDA for ZS 9 sodium zirconium cyclosilicate The company is looking to get ZS 9 approved for the treatment of hyperkalemia high potassium level in the blood
BMRN,BMRN:UW,BBG000CZX7N1,Precious Metal Outlook,2016-10-19 15:47:12 +0000,http://articlefeeds.nasdaq.com/~r/nasdaq/symbols/~3/CSIc-G8OY2o/precious-metal-outlook-cm694958,A stronger dollar sent gold prices falling on Friday The looming of a potential interest rate hike in December has weighed on precious metals Gold prices fell to 5 6 a troy ounce down over 6 to end the session Upbeat economic reports out of the United States on Wednesday led to
BMRN,BMRN:UW,BBG000CZX7N1,AstraZeneca's Hyperkalemia Drug NDA Resubmission Accepted,2016-10-19 13:56:01 +0000,http://finance.yahoo.com/news/astrazenecas-hyperkalemia-drug-nda-resubmission-135601402.html,AstraZeneca's Hyperkalemia Drug NDA Resubmission Accepted
BMRN,BMRN:UW,BBG000CZX7N1,The Medicines Co. Reports Positive Phase II Data on PCSK9si,2016-10-19 12:30:12 +0000,http://finance.yahoo.com/news/medicines-co-reports-positive-phase-123012474.html,The Medicines Co. Reports Positive Phase II Data on PCSK9si
BMRN,BMRN:UW,BBG000CZX7N1,3 Top Stocks for Your Roth IRA,2016-10-19 12:23:14 +0000,http://www.fool.com/investing/2016/10/19/3-top-stocks-for-your-roth-ira.aspx?source=yahoo-2&utm_campaign=article&utm_medium=feed&utm_source=yahoo-2,3 Top Stocks for Your Roth IRA
BMRN,BMRN:UW,BBG000CZX7N1,David Rolfe Comments on TreeHouse Foods,2016-10-18 22:47:08 +0000,http://articlefeeds.nasdaq.com/~r/nasdaq/symbols/~3/L5gTaso-y0o/david-rolfe-comments-on-treehouse-foods-cm694810,We initiated positions in TreeHouse Foods Inc NYSE THS during the third quarter TreeHouse is the largest private label food manufacturer and distributor in North America An aphorism in the private label industry is that a grocer is only as good as their private label As such
BMRN,BMRN:UW,BBG000CZX7N1,Vertex Not the Only Pharmaceutical to See Its Share Price Fall,2016-10-18 17:04:14 +0000,http://marketrealist.com/2016/10/vertex-not-the-only-pharmaceutical-to-see-its-share-price-fall/?utm_source=yahoo&utm_medium=feed,Vertex Not the Only Pharmaceutical to See Its Share Price Fall
BMRN,BMRN:UW,BBG000CZX7N1,J&J (JNJ) Outshines in Q3 Earnings on Strong Pharma Sales,2016-10-18 15:50:23 +0000,http://articlefeeds.nasdaq.com/~r/nasdaq/symbols/~3/ir8EQZrt_0A/jj-jnj-outshines-in-q3-earnings-on-strong-pharma-sales-cm694705,Johnson amp Johnson JNJ reported another strong quarter with both earnings and sales beating expectations Moreover the company raised the lower end of its earnings outlook for the year The healthcare giant s third quarter 2016 earnings came in at 1 68 per share beating the Zacks
BMRN,BMRN:UW,BBG000CZX7N1,J&J (JNJ) Outshines in Q3 Earnings on Strong Pharma Sales,2016-10-18 14:05:02 +0000,http://finance.yahoo.com/news/j-j-jnj-outshines-q3-140502774.html,J&J (JNJ) Outshines in Q3 Earnings on Strong Pharma Sales
BMRN,BMRN:UW,BBG000CZX7N1,Teva Trisenox Wins CHMP Nod for Expanded Use in Leukemia,2016-10-18 13:23:01 +0000,http://finance.yahoo.com/news/teva-trisenox-wins-chmp-nod-132301590.html,Teva Trisenox Wins CHMP Nod for Expanded Use in Leukemia
BMRN,BMRN:UW,BBG000CZX7N1,Biomarin Pharmaceutical Inc (BMRN) CEO Jean Jacques Bienaime Sold $5.6 million of Shares,2016-10-18 03:15:01 +0000,http://finance.yahoo.com/news/biomarin-pharmaceutical-inc-bmrn-ceo-031501928.html,Biomarin Pharmaceutical Inc (BMRN) CEO Jean Jacques Bienaime Sold $5.6 million of Shares
BMRN,BMRN:UW,BBG000CZX7N1,Tetraphase Begins Phase III Dosing of Antibiotic Candidate,2016-10-17 15:42:22 +0000,http://articlefeeds.nasdaq.com/~r/nasdaq/symbols/~3/ZgvIc9PgEhc/tetraphase-begins-phase-iii-dosing-of-antibiotic-candidate-cm694100,Tetraphase Pharmaceuticals TTPH announced that it has begun dosing in the phase III IGNITE4 study on its lead antibiotic candidate eravacycline IGNITE4 is evaluating the efficacy and safety of twice daily intravenous IV eravacycline compared to meropenem for the treatment of
BMRN,BMRN:UW,BBG000CZX7N1,Allergan's Belkyra Gets Swedish Approval for Double Chin,2016-10-17 14:44:49 +0000,http://articlefeeds.nasdaq.com/~r/nasdaq/symbols/~3/kJi3sB9iMvo/allergans-belkyra-gets-swedish-approval-for-double-chin-cm694040,Allergan plc AGN announced that its prescription medicine Belkyra deoxycholic acid has been granted marketing approval in Sweden for the treatment of moderate to severe fullness under the chin in adults commonly referred to as double chin Belkyra was added to Allergan s portfolio
BMRN,BMRN:UW,BBG000CZX7N1,Allergan's Belkyra Gets Swedish Approval for Double Chin,2016-10-17 12:57:12 +0000,http://finance.yahoo.com/news/allergans-belkyra-gets-swedish-approval-125712395.html,Allergan's Belkyra Gets Swedish Approval for Double Chin
BMRN,BMRN:UW,BBG000CZX7N1,Bristol-Myers Wins CHMP Nod for Opdivo Label Expansion,2016-10-17 12:44:12 +0000,http://finance.yahoo.com/news/bristol-myers-wins-chmp-nod-124412636.html,Bristol-Myers Wins CHMP Nod for Opdivo Label Expansion
BMRN,BMRN:UW,BBG000CZX7N1,PTC Therapeutics Getting Cold Shoulder From Regulators on Duchenne Drug Appeal,2016-10-17 12:32:00 +0000,https://www.thestreet.com/story/13855101/1/ptc-therapeutics-getting-cold-shoulder-from-regulators-on-duchenne-drug-appeal.html?puc=yahoo&cm_ven=YAHOO,PTC Therapeutics Getting Cold Shoulder From Regulators on Duchenne Drug Appeal
BMRN,BMRN:UW,BBG000CZX7N1,BioMarin Issues Encouraging Update on Hemophilia A Drug,2016-10-14 14:23:02 +0000,http://finance.yahoo.com/news/biomarin-issues-encouraging-hemophilia-drug-142302451.html,BioMarin Issues Encouraging Update on Hemophilia A Drug
BMRN,BMRN:UW,BBG000CZX7N1,Sunesis Submits Response to Questions on Leukemia Drug,2016-10-14 14:03:02 +0000,http://finance.yahoo.com/news/sunesis-submits-response-questions-leukemia-140302689.html,Sunesis Submits Response to Questions on Leukemia Drug
BMRN,BMRN:UW,BBG000CZX7N1,"OncoGenex Cancer Drug Fails in Phase III Study, Stock Down",2016-10-14 13:59:01 +0000,http://finance.yahoo.com/news/oncogenex-cancer-drug-fails-phase-135901809.html,"OncoGenex Cancer Drug Fails in Phase III Study, Stock Down"
BMRN,BMRN:UW,BBG000CZX7N1,UK Regulatory Agency Approves Continued Enrollment in BioMarin Phase 1/2 Study of BMN 270 in Hemophilia A,2016-10-13 20:20:04 +0000,http://www.publicnow.com/view/88C96B4A9FBFF6C9849FB58B868D7A234A539552,"[at noodls] - October 13, 2016 Phase 1/2 Study Expected to Resume by End of 2016 Requirement for Prophylactic Corticosteroids Removed SAN RAFAEL, Calif., Oct. 13, 2016 (GLOBE NEWSWIRE) -- BioMarin Pharmaceutical Inc. ..."
BMRN,BMRN:UW,BBG000CZX7N1,BMRN Crosses Below Key Moving Average Level,2016-10-13 19:42:26 +0000,http://articlefeeds.nasdaq.com/~r/nasdaq/symbols/~3/HYrrNSP4RUI/bmrn-crosses-below-key-moving-average-level-cm693116,In trading on Thursday shares of BioMarin Pharmaceutical Inc Symbol BMRN crossed below their 200 day moving average of 87 62 changing hands as low as 86 00 per share BioMarin Pharmaceutical Inc shares are currently trading down about 1 on the day The chart below shows the one
BMRN,BMRN:UW,BBG000CZX7N1,Supernus (SUPN) Reports Encouraging Data from ADHD Study,2016-10-13 18:25:06 +0000,http://finance.yahoo.com/news/supernus-supn-reports-encouraging-data-182506855.html,Supernus (SUPN) Reports Encouraging Data from ADHD Study
BMRN,BMRN:UW,BBG000CZX7N1,AMAG Issues Encouraging Updates on Makena & Feraheme,2016-10-13 15:43:14 +0000,http://articlefeeds.nasdaq.com/~r/nasdaq/symbols/~3/6Lp6BDxnNfY/amag-issues-encouraging-updates-on-makena-feraheme-cm692801,AMAG Pharmaceuticals Inc AMAG announced the achievement of key milestones with respect to its next generation development programs on Makena and Feraheme The company announced that it has initiated a randomized open label parallel definitive pharmacokinetic and the comparative pain
BMRN,BMRN:UW,BBG000CZX7N1,"Pardon Me, but I Have a Few Things to Say... Seattle Genetics, Biomarin, Sarepta, TG Therapeutics",2016-10-13 15:39:00 +0000,https://www.thestreet.com/story/13852472/1/pardon-me-but-i-have-a-few-things-to-say-seattle-genetics-biomarin-sarepta-tg-therapeutics.html?puc=yahoo&cm_ven=YAHOO,"Pardon Me, but I Have a Few Things to Say... Seattle Genetics, Biomarin, Sarepta, TG Therapeutics"
BMRN,BMRN:UW,BBG000CZX7N1,What Makes Vertex Pharmaceuticals (VRTX) a Strong Sell?,2016-10-13 14:16:02 +0000,http://finance.yahoo.com/news/makes-vertex-pharmaceuticals-vrtx-strong-141602998.html,What Makes Vertex Pharmaceuticals (VRTX) a Strong Sell?
BMRN,BMRN:UW,BBG000CZX7N1,AMAG Issues Encouraging Updates on Makena & Feraheme,2016-10-13 13:59:01 +0000,http://finance.yahoo.com/news/amag-issues-encouraging-updates-makena-135901072.html,AMAG Issues Encouraging Updates on Makena & Feraheme
BMRN,BMRN:UW,BBG000CZX7N1,"Market Close Report: NASDAQ Composite index closes at 5,239.02 down -7.77 points",2016-10-12 20:48:17 +0000,http://articlefeeds.nasdaq.com/~r/nasdaq/symbols/~3/KfYLVexERgk/market-close-report-nasdaq-composite-index-closes-at-523902-down-777-points-cm692601,Wednesday s session closes with the NASDAQ Composite Index at 5 239 02 The total shares traded for the NASDAQ was over 1 55 billion Declining stocks led advancers by 1 09 to 1 ratio There were 1351 advancers and 1475 decliners for the day On the NASDAQ Stock Exchange 18 stocks reached a 52
BMRN,BMRN:UW,BBG000CZX7N1,3 Biotechs Most Likely to Be Acquired,2016-10-12 11:28:03 +0000,http://www.fool.com/investing/2016/10/11/3-biotechs-most-likely-to-be-acquired.aspx?source=yahoo-2&utm_campaign=article&utm_medium=feed&utm_source=yahoo-2,3 Biotechs Most Likely to Be Acquired
BMRN,BMRN:UW,BBG000CZX7N1,3 Biotechs Most Likely to Be Acquired,2016-10-11 18:19:51 +0000,http://articlefeeds.nasdaq.com/~r/nasdaq/symbols/~3/tEgLZ4W6cao/3-biotechs-most-likely-to-be-acquired-cm691966,Image source Getty Images Mergers and acquisitions are a way of life in the biotech world Several big buyouts have taken place this year and it s only a matter of time before the industry is abuzz over the next one But which biotech stocks are most likely to be
BMRN,BMRN:UW,BBG000CZX7N1,Alexion Presents New Long-Term Phase III Data on Kanuma,2016-10-11 15:21:38 +0000,http://articlefeeds.nasdaq.com/~r/nasdaq/symbols/~3/RBoWQ9DXcKI/alexion-presents-new-long-term-phase-iii-data-on-kanuma-cm691774,Alexion Pharmaceuticals Inc ALXN announced that new long term data from an ongoing open label extension of the pivotal phase III ARISE study on Kanuma in children and adults suffering from lysosomal acid lipase deficiency LAL D were presented at the World Congress of
BMRN,BMRN:UW,BBG000CZX7N1,Catabasis Presents Data from DMD study on Edasalonexent,2016-10-11 15:21:36 +0000,http://articlefeeds.nasdaq.com/~r/nasdaq/symbols/~3/CgJmOAeHPw4/catabasis-presents-data-from-dmd-study-on-edasalonexent-cm691773,Catabasis Pharmaceuticals Inc CATB announced that it has presented results from the part A of the MoveDMD study phase I II on edasalonexent at the congress of the World Muscle Society Edasalonexent a molecule that inhibits a protein called NF kB is being developed for the treatment
BMRN,BMRN:UW,BBG000CZX7N1,"BioMarin to Host Third Quarter 2016 Financial Results Conference Call and Webcast on Thursday, October 27 at 4:30pm ET",2016-10-11 12:30:00 +0000,http://finance.yahoo.com/news/biomarin-host-third-quarter-2016-123000555.html,"[GlobeNewswire] - SAN RAFAEL, Calif., Oct. 11, 2016-- BioMarin Pharmaceutical Inc. today announced that Jean-Jacques Bienaimé, Chairman and Chief Executive Officer of BioMarin, will host a conference call and webcast on ..."
BMRN,BMRN:UW,BBG000CZX7N1,3 biotech breakouts,2016-10-10 21:42:00 +0000,http://finance.yahoo.com/video/3-biotech-breakouts-214200206.html,3 biotech breakouts
