DXCM,DXCM:UW,BBG000QTFGV1,"ETFs with exposure to DexCom, Inc. : May 18, 2017",2017-05-18 17:40:45 +0000,http://finance.yahoo.com/r/11ba58c8-ec91-339a-a182-ef7a925a42fd/etfs-with-exposure-to-dexcom-inc-may-18-2017?yptr=yahoo&.tsrc=rss,"Categories:  ETFs Yahoo FinanceClick here to see latest analysis ETFs with exposure to DexCom, Inc. Here are 5 ETFs with the largest exposure to DXCM-US. Comparing the performance and risk of DexCom, Inc. with the ETFs that have exposure to it gives us some ETF choices that could give us similar returns with lower volatility. Ticker Fund Name ... Read more
<b>(Read more...)</b>"
DXCM,DXCM:UW,BBG000QTFGV1,Cramer Remix: Here are the winners after Wednesday’s mark...,2017-05-17 23:17:00 +0000,https://finance.yahoo.com/video/cramer-remix-winners-wednesday-mark-231700193.html?.tsrc=rss,Jim Cramer broke down the market’s moves and which stocks could benefit after the market’s selloff.
DXCM,DXCM:UW,BBG000QTFGV1,Will Wearable Technology Make Us Healthier?,2017-05-16 14:17:18 +0000,http://articlefeeds.nasdaq.com/~r/nasdaq/symbols/~3/IpjezgmeCTQ/will-wearable-technology-make-us-healthier-cm789784,The potential to 160 improve how we treat patients with chronic diseases including diabetes 160 is a massive market opportunity 160 for wearable technology companies including Fitbit NYSE FIT Apple NASDAQ AAPL and 160 Alphabet NASDAQ
DXCM,DXCM:UW,BBG000QTFGV1,Will Wearable Technology Make Us Healthier?,2017-05-16 13:03:00 +0000,http://finance.yahoo.com/r/9fc4ec7b-7a3b-36d6-91d1-3291ecd6bacb/will-wearable-technology-make-us-healthier.aspx?yptr=yahoo&.tsrc=rss,"Medtronic, Fitbit, Apple, and other tech companies hope to combine wearable technology with data analytics to improve outcomes in important diseases such as diabetes."
DXCM,DXCM:UW,BBG000QTFGV1,Edited Transcript of DXCM earnings conference call or presentation 2-May-17 8:30pm GMT,2017-05-16 09:18:03 +0000,https://finance.yahoo.com/news/edited-transcript-dxcm-earnings-conference-034134509.html?.tsrc=rss,Q1 2017 DexCom Inc Earnings Call
DXCM,DXCM:UW,BBG000QTFGV1,Some Silicon Valley techies obsessively track their blood sugar -- and they don't have diabetes,2017-05-15 23:35:11 +0000,http://finance.yahoo.com/r/8c95f93b-d316-3ba5-bb9c-ffc42aa233e1/104461916?__source=yahoo%7Cfinance%7Cheadline%7Cheadline%7Cstory&par=yahoo&doc=104461916&yptr=yahoo&.tsrc=rss,"At Geoff Woo's start-up Nootrobox, almost every employee tracks their blood sugar levels throughout the day."
DXCM,DXCM:UW,BBG000QTFGV1,What's Alphabet Got to Do With Healthcare?,2017-05-15 17:17:58 +0000,http://articlefeeds.nasdaq.com/~r/nasdaq/symbols/~3/eY8MGZFfCkM/whats-alphabet-got-to-do-with-healthcare-cm789377,Alphabet NASDAQ GOOGL NASDAQ GOOG has a treasure trove of data at its fingertips and it s been more than willing to spend its financial firepower to take moonshots that could disrupt industries These moonshots include collaborations with healthcare companies
DXCM,DXCM:UW,BBG000QTFGV1,What&apos;s Alphabet Got to Do With Healthcare?,2017-05-15 15:42:00 +0000,http://finance.yahoo.com/r/d5a62bba-2f42-35fd-9f48-20fc08858773/whats-alphabet-got-to-do-with-healthcare.aspx?yptr=yahoo&.tsrc=rss,The tech titan is working on intriguing research that could improve healthcare for millions of people.
DXCM,DXCM:UW,BBG000QTFGV1,DexCom Announces Upcoming Conference Presentation,2017-05-15 12:00:00 +0000,https://finance.yahoo.com/news/dexcom-announces-upcoming-conference-presentation-120000234.html?.tsrc=rss,"DexCom, Inc. today announced that management will present an update on DexCom at the following upcoming investor conference:"
DXCM,DXCM:UW,BBG000QTFGV1,Why Apple Inc. (AAPL) Stock Can Count on the Apple Watch,2017-05-11 19:04:18 +0000,http://articlefeeds.nasdaq.com/~r/nasdaq/symbols/~3/zszWXKKIOmw/why-apple-inc-aapl-stock-can-count-on-the-apple-watch-cm788122,InvestorPlace Stock Market News Stock Advice amp Trading Tips Apple Inc s 160 NASDAQ AAPL Apple Watch was released in 2015 to much fanfare and analyst interaction The smartwatch has changed the market and absolutely dominated a growing industry The company doesn t
DXCM,DXCM:UW,BBG000QTFGV1,DexCom Prices Offering of $350 Million of 0.75% Convertible Senior Notes,2017-05-08 23:57:00 +0000,http://finance.yahoo.com/news/dexcom-prices-offering-350-million-235700970.html?.tsrc=rss,"DexCom, Inc. announced today the pricing of its offering of $350 million aggregate principal amount of 0.75% Convertible Senior Notes due 2022 in a private placement to qualified institutional buyers pursuant to Rule 144A under the Securities Act of 1933, as amended ."
DXCM,DXCM:UW,BBG000QTFGV1,DexCom Announces Proposed Offering of $300 Million of Convertible Senior Notes,2017-05-08 11:09:00 +0000,http://finance.yahoo.com/news/dexcom-announces-proposed-offering-300-110900037.html?.tsrc=rss,"DexCom, Inc. announced today that it intends to offer, subject to market conditions and other factors, $300 million aggregate principal amount of Convertible Senior Notes due 2022 in a private placement to qualified institutional buyers pursuant to Rule 144A under the Securities Act of 1933, as amended ."
DXCM,DXCM:UW,BBG000QTFGV1,"ETFs with exposure to DexCom, Inc. : May 5, 2017",2017-05-05 20:05:12 +0000,http://finance.yahoo.com/r/02a9315c-b8ab-3946-89dd-2eeae1d7a3fd/etfs-with-exposure-to-dexcom-inc-may-5-2017?yptr=yahoo&.tsrc=rss,"Categories:  ETFs Yahoo FinanceClick here to see latest analysis ETFs with exposure to DexCom, Inc. Here are 5 ETFs with the largest exposure to DXCM-US. Comparing the performance and risk of DexCom, Inc. with the ETFs that have exposure to it gives us some ETF choices that could give us similar returns with lower volatility. Ticker Fund Name ... Read more
<b>(Read more...)</b>"
DXCM,DXCM:UW,BBG000QTFGV1,Edited Transcript of DXCM earnings conference call or presentation 2-May-17 8:30pm GMT,2017-05-05 12:50:54 +0000,http://finance.yahoo.com/news/edited-transcript-dxcm-earnings-conference-034134509.html?.tsrc=rss,Q1 2017 DexCom Inc Earnings Call
DXCM,DXCM:UW,BBG000QTFGV1,"DexCom, Inc. :DXCM-US: Earnings Analysis: Q1, 2017 By the Numbers : May 4, 2017",2017-05-04 14:10:22 +0000,http://finance.yahoo.com/r/5d131060-3aaa-3964-ad76-ad689b67b754/dexcom-inc-dxcm-us-earnings-analysis-q1-2017-by-the-numbers-may-4-2017?yptr=yahoo&.tsrc=rss,"Categories:  Yahoo FinanceGet free summary analysis DexCom, Inc. reports financial results for the quarter ended March 31, 2017. We analyze the earnings along side the following peers of DexCom, Inc. – Edwards Lifesciences Corporation, West Pharmaceutical Services, Inc., Becton, Dickinson and Company, Tandem Diabetes Care, Inc., Quidel Corporation and Johnson & Johnson (EW-US, WST-US, BDX-US, TNDM-US, QDEL-US ... Read more
<b>(Read more...)</b>"
DXCM,DXCM:UW,BBG000QTFGV1,Dexcom G5® Mobile Continuous Glucose Monitoring (CGM) System now Compatible with Apple Watches in Europe,2017-05-04 08:00:00 +0000,http://finance.yahoo.com/news/dexcom-g5-mobile-continuous-glucose-080000064.html?.tsrc=rss,"EDINBURGH, Scotland, May 4, 2017 /PRNewswire/ -- By adding Apple Watch as another display device , E uropeans living with diabetes have even more options to view their glucose readings and alerts on Dexcom ..."
DXCM,DXCM:UW,BBG000QTFGV1,"DexCom, Inc. – Value Analysis (NASDAQ:DXCM) : May 3, 2017",2017-05-03 20:41:04 +0000,http://finance.yahoo.com/r/1388137b-ab49-35d1-b98e-050758fab2ac/dexcom-inc-value-analysis-nasdaqdxcm-may-3-2017?yptr=yahoo&.tsrc=rss,"Categories:  Fundamental Analysis Yahoo FinanceClick here to see latest analysis Capitalcube gives DexCom, Inc. a score of 31. Our analysis is based on comparing DexCom, Inc. with the following peers – Edwards Lifesciences Corporation, Echo Therapeutics, Inc., West Pharmaceutical Services, Inc., Becton, Dickinson and Company, Tandem Diabetes Care, Inc., Quidel Corporation, MGC Diagnostics Corporation, Medtronic plc, Johnson & Johnson ... Read more
<b>(Read more...)</b>"
DXCM,DXCM:UW,BBG000QTFGV1,Here's Why DexCom Stock Is Tanking Today,2017-05-03 19:52:10 +0000,http://articlefeeds.nasdaq.com/~r/nasdaq/symbols/~3/fKGzqOYE3ug/heres-why-dexcom-stock-is-tanking-today-cm783701,What happened After the company reported first quarter results that missed the mark shares of Dexcom NASDAQ DXCM 160 a medical device maker focused on diabetes fell 10 as of 11 55 p m EDT on Wednesday So what Here s a look at the headline numbers that are
DXCM,DXCM:UW,BBG000QTFGV1,Here&apos;s Why DexCom Stock Is Tanking Today,2017-05-03 16:40:58 +0000,http://finance.yahoo.com/r/bf8426ca-4bb8-37b1-a4a9-cfeb59c0cf81/heres-why-dexcom-stock-is-tanking-today.aspx?yptr=yahoo&.tsrc=rss,Shares dropped after the glucose-monitoring specialist&apos;s first-quarter revenue came up a bit short of expectations.
DXCM,DXCM:UW,BBG000QTFGV1,"DexCom (DXCM) Q1 Loss Narrower than Expected, Revenues Miss",2017-05-03 13:27:49 +0000,http://articlefeeds.nasdaq.com/~r/nasdaq/symbols/~3/nTJ_jXUBPho/dexcom-dxcm-q1-loss-narrower-than-expected-revenues-miss-cm783394,DexCom Inc DXCM reported a loss of 49 cents per share in the first quarter of 2017 narrower than the Zacks Consensus Estimate of a loss of 55 cents However the figure was wider than the loss of 23 cents reported in the year ago quarter Interestingly Dexcom posted a positive
DXCM,DXCM:UW,BBG000QTFGV1,"DexCom (DXCM) Q1 Loss Narrower than Expected, Revenues Miss",2017-05-03 12:41:12 +0000,http://finance.yahoo.com/news/dexcom-dxcm-q1-loss-narrower-124112299.html?.tsrc=rss,"DexCom Inc. (DXCM) reported a loss of 49 cents per share in the first quarter of 2017, narrower than the Zacks Consensus Estimate of a loss of 55 cents."
DXCM,DXCM:UW,BBG000QTFGV1,DexCom reports 1Q loss,2017-05-02 21:12:29 +0000,http://finance.yahoo.com/news/dexcom-reports-1q-loss-211229713.html?.tsrc=rss,"On a per-share basis, the San Diego-based company said it had a loss of 49 cents. The results beat Wall Street expectations. The average estimate of 12 analysts surveyed by Zacks Investment Research was ..."
DXCM,DXCM:UW,BBG000QTFGV1,"DexCom, Inc. Reports First Quarter 2017 Financial Results",2017-05-02 20:01:00 +0000,http://finance.yahoo.com/news/dexcom-inc-reports-first-quarter-200100811.html?.tsrc=rss,"DexCom, Inc. today reported its unaudited financial results as of and for the quarter ended March 31, 2017."
DXCM,DXCM:UW,BBG000QTFGV1,"DexCom, Inc. breached its 50 day moving average in a Bullish Manner : DXCM-US : May 2, 2017",2017-05-02 12:10:43 +0000,http://finance.yahoo.com/r/4566939a-fd12-3386-a4ee-b5b9e6f08b66/dexcom-inc-breached-its-50-day-moving-average-in-a-bullish-manner-dxcm-us-may-2-2017?yptr=yahoo&.tsrc=rss,"Categories:  ETFs Yahoo FinanceClick here to see latest analysis *Disclaimer : This is as of previous day’s closing price. Technical Indicators Below is a quick look at 5 technical indicators for DexCom, Inc.. More studies are available on the Technical Chart. Indicator Signal Closing Price above/below 50 Day Moving Average Bullish Closing Price above/below 200 Day Moving Average ... Read more
<b>(Read more...)</b>"
DXCM,DXCM:UW,BBG000QTFGV1,"Medical Product Q1 Earnings Due on May 2: BDX, DXCM & More",2017-05-01 16:31:35 +0000,http://articlefeeds.nasdaq.com/~r/nasdaq/symbols/~3/NbzTGLVmJ6E/medical-product-q1-earnings-due-on-may-2-bdx-dxcm-more-cm782064,The first quarter earnings season has gathered pace with results from 288 S amp P 500 members or 63 8 of the index s total market capitalization already out as of April 28 As per the latest Earnings Preview total earnings for these companies are up 13 7 from the same period last year
DXCM,DXCM:UW,BBG000QTFGV1,"Medical Product Q1 Earnings Due on May 2: BDX, DXCM & More",2017-05-01 14:17:02 +0000,http://finance.yahoo.com/news/medical-product-q1-earnings-due-141702376.html?.tsrc=rss,"The medical product sector shines bright at the moment owing to the prevalence of minimally invasive surgeries, liquid biopsy tests, and use of IT for ensuring quick and improved patient care among other things."
DXCM,DXCM:UW,BBG000QTFGV1,Sohn Investment Conference: Investing for good,2017-04-24 16:47:00 +0000,http://finance.yahoo.com/video/sohn-investment-conference-investing-good-164700790.html?.tsrc=rss,"CNBC's Melissa Lee speaks to Evan Sohn, Sohn Conference Foundation co-founder, and Marc Grow, 2016 Sohn Investment Idea Contest winner, about what to expect from the 2017 Sohn Investment Conference."
DXCM,DXCM:UW,BBG000QTFGV1,Alphabet and Apple: 2 of the Best Healthcare Stocks on the Market?,2017-04-22 17:03:11 +0000,http://articlefeeds.nasdaq.com/~r/nasdaq/symbols/~3/Cfz3UbigbTw/alphabet-and-apple-2-of-the-best-healthcare-stocks-on-the-market-cm777515,Every company is a healthcare company now At least that s what it seems like sometimes Both Apple NASDAQ AAPL and 160 Google parent Alphabet NASDAQ GOOG NASDAQ GOOGL 160 are working on technology to help manage diabetes and address other healthcare issues
DXCM,DXCM:UW,BBG000QTFGV1,Add Up The Parts: FXH Could Be Worth $68,2017-04-19 14:03:37 +0000,http://articlefeeds.nasdaq.com/~r/nasdaq/symbols/~3/DKnoyLHeJVA/add-up-the-parts-fxh-could-be-worth-68-cm775699,Looking at the underlying holdings of the ETFs in our coverage universe at ETF Channel we have compared the trading price of each holding against the average analyst 12 month forward target price and computed the weighted average implied analyst target price for the ETF itself For the
DXCM,DXCM:UW,BBG000QTFGV1,Dexcom Has a Big Ally if Apple Gets Into Its Corner of the Diabetes Market,2017-04-19 12:00:19 +0000,http://finance.yahoo.com/news/dexcom-big-ally-apple-gets-120019446.html?.tsrc=rss,"Apple may be exploring ways to monitor glucose levels, but Alphabet's efforts show it's a tough slog."
DXCM,DXCM:UW,BBG000QTFGV1,DexCom is Now Oversold (DXCM),2017-04-18 17:02:54 +0000,http://articlefeeds.nasdaq.com/~r/nasdaq/symbols/~3/s1Qb65h-fPw/dexcom-is-now-oversold-dxcm-cm775311,Legendary investor Warren Buffett advises to be fearful when others are greedy and be greedy when others are fearful One way we can try to measure the level of fear in a given stock is through a technical analysis indicator called the Relative Strength Index or RSI which measures momentum on
DXCM,DXCM:UW,BBG000QTFGV1,Dexcom adding 500 jobs in Mesa,2017-04-14 18:30:09 +0000,http://finance.yahoo.com/r/18d169d9-8a71-3ff5-ab85-74538268d8c0/dexcom-adding-500-jobs-in-mesa.html?ana=yahoo&yptr=yahoo&.tsrc=rss,"Dexcom Inc. (DXCM), a San Diego-based manufacturer of continuous glucose monitoring for patients with diabetes, has expanded into a new manufacturing facility in Mesa.  The 180,000-square-foot facility will support the company's global manufacturing operations and is projected to create more than 500 jobs over the next several years.  A ribbon-cutting ceremony is scheduled for April 25 at the new facility, 232 S. Dobson Road, Mesa, which is its second manufacturing plant."
DXCM,DXCM:UW,BBG000QTFGV1,Is Medtronic's Artificial Pancreas the Next Big Thing in Diabetes?,2017-04-13 20:55:41 +0000,http://articlefeeds.nasdaq.com/~r/nasdaq/symbols/~3/2wSCzuXfPDE/is-medtronics-artificial-pancreas-the-next-big-thing-in-diabetes-cm774026,Last fall Medtronic NYSE MDT won FDA approval of a closed loop system that automatically tracks blood sugar levels and delivers insulin as necessary The system is being heralded as a major advance in treating diabetes because it significantly reduces the need for finger
DXCM,DXCM:UW,BBG000QTFGV1,Is Medtronic&apos;s Artificial Pancreas the Next Big Thing in Diabetes?,2017-04-13 19:21:00 +0000,http://finance.yahoo.com/r/b30cf90c-3e0b-3cff-87f3-5f7cbf82e15b/is-medtronics-artificial-pancreas-the-next-big-thi.aspx?yptr=yahoo&.tsrc=rss,"Medtronic&apos;s MiniMed 670G could reduce the burden on Type 1 diabetes patients, as well as slow diabetes progression by keeping blood glucose levels on target."
DXCM,DXCM:UW,BBG000QTFGV1,Health care company Dexcom sees shares slip amid potential competition from Apple,2017-04-13 18:53:20 +0000,http://finance.yahoo.com/r/e93ae63f-b964-3e4b-9ddd-e90d75de700d/104402883?__source=yahoo%7Cfinance%7Cheadline%7Cheadline%7Cstory&par=yahoo&doc=104402883&yptr=yahoo&.tsrc=rss,"""Because it's Apple, it scares people,"" said Michael Weinstein of JPMorgan."
DXCM,DXCM:UW,BBG000QTFGV1,"DexCom, Inc. breached its 50 day moving average in a Bearish Manner : DXCM-US : April 10, 2017",2017-04-10 12:32:51 +0000,http://finance.yahoo.com/r/3d52dbb0-9e7b-3775-bf82-ff96e326ea92/dexcom-inc-breached-its-50-day-moving-average-in-a-bearish-manner-dxcm-us-april-10-2017?yptr=yahoo&.tsrc=rss,"Categories:  ETFs Yahoo FinanceClick here to see latest analysis *Disclaimer : This is as of previous day’s closing price. Technical Indicators Below is a quick look at 5 technical indicators for DexCom, Inc.. More studies are available on the Technical Chart. Indicator Signal Closing Price above/below 50 Day Moving Average Bearish Closing Price above/below 200 Day Moving Average ... Read more
<b>(Read more...)</b>"
DXCM,DXCM:UW,BBG000QTFGV1,3 Hot Stocks to Buy in April,2017-04-04 15:03:49 +0000,http://articlefeeds.nasdaq.com/~r/nasdaq/symbols/~3/Uz7-4252eeE/3-hot-stocks-to-buy-in-april-cm769482,It s natural for investors to shy away from buying high flying stocks However sometimes a stock takes off because of thesis changing news When that happens it can sometimes make sense to buy even after a stock has gone on a big run Dexcom NASDAQ DXCM Shopify
DXCM,DXCM:UW,BBG000QTFGV1,3 Hot Stocks to Buy in April,2017-04-04 12:48:00 +0000,http://finance.yahoo.com/r/ffce4948-15b2-36b2-8535-85cfaa2d7f01/3-hot-stocks-to-buy-in-march.aspx?yptr=yahoo&.tsrc=rss,"Dexcom, Shopify, and Portola Pharmaceuticals have been on an absolute tear in 2017. Here&apos;s why shareholders should expect the trend to continue."
DXCM,DXCM:UW,BBG000QTFGV1,DexCom (DXCM) Up 4.6% Since Earnings Report: Can It Continue?,2017-03-31 09:00:49 +0000,http://articlefeeds.nasdaq.com/~r/nasdaq/symbols/~3/E6LGEhw3NXM/dexcom-dxcm-up-46-since-earnings-report-can-it-continue-cm768105,A month has gone by since the last earnings report for DexCom Inc DXCM Shares have added about 4 6 in that time frame outperforming the market Will the recent positive trend continue leading up to the stock s next earnings release or is it due for a pullback Before we dive into
DXCM,DXCM:UW,BBG000QTFGV1,DexCom (DXCM) Up 4.6% Since Earnings Report: Can It Continue?,2017-03-31 07:50:07 +0000,http://finance.yahoo.com/news/dexcom-dxcm-4-6-since-075007967.html?.tsrc=rss,DexCom (DXCM) reported earnings 30 days ago. What's next for the stock? We take a look at earnings estimates for some clues.
DXCM,DXCM:UW,BBG000QTFGV1,DexCom (DXCM) Up 4.6% Since Earnings Report: Can It Continue?,2017-03-31 07:50:07 +0000,http://finance.yahoo.com/news/dexcom-dxcm-4-6-since-075007967.html,DexCom (DXCM) Up 4.6% Since Earnings Report: Can It Continue?
DXCM,DXCM:UW,BBG000QTFGV1,DexCom Gains as CMS Announces Criteria for G5 Mobile CGM,2017-03-27 15:03:49 +0000,http://articlefeeds.nasdaq.com/~r/nasdaq/symbols/~3/itsqW4NVcbE/dexcom-gains-as-cms-announces-criteria-for-g5-mobile-cgm-cm765826,The markets seem to be happy with South San Francisco CA based DexCom Inc DXCM The company s stock price rallied 4 8 to close at 82 62 yesterday following its announcement that the Centers for Medicare amp Medicaid Services CMS published an article clarifying the criteria for
DXCM,DXCM:UW,BBG000QTFGV1,DexCom Gains as CMS Announces Criteria for G5 Mobile CGM,2017-03-27 12:53:12 +0000,http://finance.yahoo.com/news/dexcom-gains-cms-announces-criteria-125312427.html,DexCom Gains as CMS Announces Criteria for G5 Mobile CGM
DXCM,DXCM:UW,BBG000QTFGV1,DexCom Gains as CMS Announces Criteria for G5 Mobile CGM,2017-03-27 12:53:12 +0000,http://finance.yahoo.com/news/dexcom-gains-cms-announces-criteria-125312427.html?.tsrc=rss,The Centers for Medicare & Medicaid Services published an article clarifying the criteria for coverage of its DexCom (DXCM) G5 Mobile CGM system for patients with diabetes and on intensive insulin therapy.
DXCM,DXCM:UW,BBG000QTFGV1,8:35 am Dexcom announces that the U.S. Centers for Medicare & Medicaid Services has published an article clarifying criteria for coverage and coding of the Dexcom G5 Mobile system,2017-03-26 12:35:00 +0000,http://finance.yahoo.com/news/inplay-briefing-com-055139997.html#dxcm,8:35 am Dexcom announces that the U.S. Centers for Medicare & Medicaid Services has published an article clarifying criteria for coverage and coding of the Dexcom G5 Mobile system
DXCM,DXCM:UW,BBG000QTFGV1,Medicare Announces Criteria Covering Dexcom G5 Mobile CGM for All People with Diabetes on Intensive Insulin Therapy,2017-03-24 12:30:00 +0000,http://finance.yahoo.com/news/medicare-announces-criteria-covering-dexcom-123000917.html,"[Business Wire] - DexCom, Inc. , the leader in continuous glucose monitoring for people with diabetes, is pleased to announce that the U.S. Centers for Medicare & Medicaid Services has published an article clarifying criteria for coverage and coding of the Dexcom G5 Mobile system, the only therapeutic CGM under this CMS classification."
DXCM,DXCM:UW,BBG000QTFGV1,Medicare Announces Criteria Covering Dexcom G5 Mobile CGM for All People with Diabetes on Intensive Insulin Therapy,2017-03-24 12:30:00 +0000,http://finance.yahoo.com/news/medicare-announces-criteria-covering-dexcom-123000917.html?.tsrc=rss,"DexCom, Inc. , the leader in continuous glucose monitoring for people with diabetes, is pleased to announce that the U.S. Centers for Medicare & Medicaid Services has published an article clarifying criteria for coverage and coding of the Dexcom G5 Mobile system, the only therapeutic CGM under this CMS classification."
DXCM,DXCM:UW,BBG000QTFGV1,"DexCom Schedules First Quarter 2017 Earnings Release and Conference Call for May 2, 2017 at 4:30 p.m. Eastern Time",2017-03-23 12:30:00 +0000,http://finance.yahoo.com/news/dexcom-schedules-first-quarter-2017-123000956.html,"[Business Wire] - DexCom, Inc. today announced that it plans to release its first quarter 2017 financial results after market close on Tuesday, May 2, 2017. Management will hold a conference call to review the company's first quarter 2017 performance starting at 4:30 p.m."
DXCM,DXCM:UW,BBG000QTFGV1,"DexCom Schedules First Quarter 2017 Earnings Release and Conference Call for May 2, 2017 at 4:30 p.m. Eastern Time",2017-03-23 12:30:00 +0000,http://finance.yahoo.com/news/dexcom-schedules-first-quarter-2017-123000956.html?.tsrc=rss,"DexCom, Inc. today announced that it plans to release its first quarter 2017 financial results after market close on Tuesday, May 2, 2017. Management will hold a conference call to review the company's first quarter 2017 performance starting at 4:30 p.m."
DXCM,DXCM:UW,BBG000QTFGV1,"DexCom, Inc. breached its 50 day moving average in a Bullish Manner : DXCM-US : March 20, 2017",2017-03-20 12:14:23 +0000,http://finance.yahoo.com/r/edd06148-6113-3046-b000-231e369c9c62/dexcom-inc-breached-its-50-day-moving-average-in-a-bullish-manner-dxcm-us-march-20-2017?yptr=yahoo&.tsrc=rss,"Categories:   ETFs Yahoo Finance Click here to see latest analysis *Disclaimer : This is as of previous day’s closing price. Technical Indicators Below is a quick look at 5 technical indicators for DexCom, Inc.. More studies are available on the Technical Chart. Indicator Signal Closing Price above/below 50 Day Moving Average Bullish Closing Price above/below 200 Day Moving Average ... Read more    
<b>(Read more...)</b>"
DXCM,DXCM:UW,BBG000QTFGV1,"DexCom, Inc. breached its 50 day moving average in a Bullish Manner : DXCM-US : March 20, 2017",2017-03-20 12:14:23 +0000,http://www.capitalcube.com/blog/index.php/dexcom-inc-breached-its-50-day-moving-average-in-a-bullish-manner-dxcm-us-march-20-2017/,"DexCom, Inc. breached its 50 day moving average in a Bullish Manner : DXCM-US : March 20, 2017"
DXCM,DXCM:UW,BBG000QTFGV1,3 Top Diabetes Care Stocks to Buy in 2017,2017-03-17 14:12:51 +0000,http://articlefeeds.nasdaq.com/~r/nasdaq/symbols/~3/QhfApQJGKOg/3-top-diabetes-care-stocks-to-buy-in-2017-cm762096,Nearly 30 million Americans have diabetes a condition where the body fails to properly metabolize sugar Left untreated that 160 sugar builds up in the bloodstream and the body which can lead to a number of 160 serious additional health problems such as 160 cardiovascular
DXCM,DXCM:UW,BBG000QTFGV1,3 Top Diabetes Care Stocks to Buy in 2017,2017-03-17 12:06:00 +0000,http://finance.yahoo.com/r/7c4b58e7-362e-3970-902e-c91908c7a4e3/3-top-diabetes-care-stocks-to-buy-in-2017.aspx?yptr=yahoo&.tsrc=rss,Looking to put money to work in this $322 billion market? Here are three stocks for you to consider.
DXCM,DXCM:UW,BBG000QTFGV1,3 Top Diabetes Care Stocks to Buy in 2017,2017-03-17 12:06:00 +0000,https://www.fool.com/investing/2017/03/17/3-top-diabetes-care-stocks-to-buy-in-2017.aspx,3 Top Diabetes Care Stocks to Buy in 2017
DXCM,DXCM:UW,BBG000QTFGV1,Post Earnings Coverage as DexCom's Q4 Top-line Surged 31%; Outshined Forecasts,2017-03-16 12:15:00 +0000,http://finance.yahoo.com/news/post-earnings-coverage-dexcoms-q4-121500379.html?.tsrc=rss,"Upcoming AWS Coverage on ICON Post-Earnings Results LONDON, UK / ACCESSWIRE / March 16, 2017 / Active Wall St. announces its post-earnings coverage on DexCom, Inc. (NASDAQ: DXCM ). The company reported ..."
DXCM,DXCM:UW,BBG000QTFGV1,Post Earnings Coverage as DexCom's Q4 Top-line Surged 31%; Outshined Forecasts,2017-03-16 12:15:00 +0000,http://finance.yahoo.com/news/post-earnings-coverage-dexcoms-q4-121500379.html,"[Accesswire] - Upcoming AWS Coverage on ICON Post-Earnings Results LONDON, UK / ACCESSWIRE / March 16, 2017 / Active Wall St. announces its post-earnings coverage on DexCom, Inc. (NASDAQ: DXCM ). The company reported ..."
