RESULT_COUNT: 582,PAGE_SIZE: 10000,CURRENT_PAGE: 1,TOTAL_PAGES: 1,API_CALL_CREDITS: 1
TICKER,FIGI_TICKER,FIGI,TITLE,PUBLICATION_DATE,URL,SUMMARY
HOLX,HOLX:UW,BBG000C3P591,How The Parts Add Up: QQXT Headed For $52,2017-10-20 14:09:18 +0000,http://articlefeeds.nasdaq.com/~r/nasdaq/symbols/~3/QtclIcoE6kE/how-the-parts-add-up-qqxt-headed-for-52-cm862458,Looking at the underlying holdings of the ETFs in our coverage universe at ETF Channel we have compared the trading price of each holding against the average analyst 12 month forward target price and computed the weighted average implied analyst target price for the ETF itself For the
HOLX,HOLX:UW,BBG000C3P591,See what the IHS Markit Score report has to say about Hologic Inc.,2017-10-20 12:06:04 +0000,https://finance.yahoo.com/news/see-ihs-markit-score-report-120604023.html?.tsrc=rss,"The last change in the short interest score occurred more than 1 month ago and implies that there has been little change in sentiment among investors who seek to profit from falling equity prices.  Index (PMI) data, output in the Healthcare sector is rising."
HOLX,HOLX:UW,BBG000C3P591,See what the IHS Markit Score report has to say about Hologic Inc.,2017-10-19 12:06:14 +0000,https://finance.yahoo.com/news/see-ihs-markit-score-report-120614218.html?.tsrc=rss,"The last change in the short interest score occurred more than 1 month ago and implies that there has been little change in sentiment among investors who seek to profit from falling equity prices.  Index (PMI) data, output in the Healthcare sector is rising."
HOLX,HOLX:UW,BBG000C3P591,See what the IHS Markit Score report has to say about Hologic Inc.,2017-10-18 12:07:44 +0000,https://finance.yahoo.com/news/see-ihs-markit-score-report-120744262.html?.tsrc=rss,"The last change in the short interest score occurred more than 1 month ago and implies that there has been little change in sentiment among investors who seek to profit from falling equity prices.  Index (PMI) data, output in the Healthcare sector is rising."
HOLX,HOLX:UW,BBG000C3P591,15 Cheap Stocks That Could Launch the 'Next Big Thing',2017-10-18 10:00:00 +0000,http://finance.yahoo.com/r/6869011f-4a02-3cba-87d3-9829a1361545/article.aspx?id=830259&SR=Yahoo&yptr=yahoo&.tsrc=rss,Take a look at Morningstar analysts' nine 'exponential technology' themes and some undervalued stocks poised to benefit from them.
HOLX,HOLX:UW,BBG000C3P591,How To Find Great Stocks: Why Some Cup Base Patterns Don't Form A Handle,2017-10-16 22:16:38 +0000,http://articlefeeds.nasdaq.com/~r/nasdaq/symbols/~3/OW6364WYYi4/how-to-find-great-stocks-why-some-cup-base-patterns-dont-form-a-handle-cm860300,Even the biggest stock market winners have to catch their breath at some point So one of the most common shapes etched during constructive price pullbacks is the cup with handle pattern But sometimes a dynamic moneymaker is in too much of a hurry to form a handle before
HOLX,HOLX:UW,BBG000C3P591,3 Plastic & Reconstructive Surgery Stocks Looking Good,2017-10-11 22:12:46 +0000,http://articlefeeds.nasdaq.com/~r/nasdaq/symbols/~3/lXO-Hp7ATF4/3-plastic-reconstructive-surgery-stocks-looking-good-cm858472,There was a time when plastic and reconstructive surgeries were performed only on serious burn cases or accidental injuries Now cosmetic surgery is de rigueur in many social circles Over the last few years the masses have been picking up this trend from eminent Hollywood celebrities
HOLX,HOLX:UW,BBG000C3P591,3 Plastic & Reconstructive Surgery Stocks Looking Good,2017-10-11 20:15:08 +0000,https://finance.yahoo.com/news/3-plastic-reconstructive-surgery-stocks-201508926.html?.tsrc=rss,Consider these three stocks for raking in grand returns from the fast-growing plastic and reconstructive surgery market.
HOLX,HOLX:UW,BBG000C3P591,Jerome Dodson Starts 5 New Positions in 3rd Quarter,2017-10-11 18:10:34 +0000,http://articlefeeds.nasdaq.com/~r/nasdaq/symbols/~3/Gc9nTLhxeqY/jerome-dodson-starts-5-new-positions-in-3rd-quarter-cm858360,Parnassus Fund manager Jerome Dodson Trades Portfolio seeks long term capital appreciation through securities with the following characteristics wide competitive advantages good management quality and relevancy over the long term Parnassus Fund managerJerome Dodson
HOLX,HOLX:UW,BBG000C3P591,Hologic's Panther Fusion Flu A/B/RSV Assay Gets FDA Approval,2017-10-06 15:47:47 +0000,http://articlefeeds.nasdaq.com/~r/nasdaq/symbols/~3/VwAHNvbNIsA/hologics-panther-fusion-flu-abrsv-assay-gets-fda-approval-cm856233,Hologic Inc HOLX announced the receipt of 510 k clearance from the FDA for Panther Fusion Flu A B RSV assay running on the new Panther Fusion system Following its CE mark approval earlier this year the latest FDA clearance can be treated as a major breakthrough for the company s
HOLX,HOLX:UW,BBG000C3P591,Hologic&apos;s Panther Fusion Flu A/B/RSV Assay Gets FDA Approval,2017-10-06 13:31:01 +0000,https://finance.yahoo.com/news/hologic-apos-panther-fusion-flu-133101591.html?.tsrc=rss,Hologic&apos;s (HOLX) receipt of FDA approval for Panther Fusion Flu A/B/RSV assay running on the new Panther Fusion system is likely to boost its Diagnostic segment.
HOLX,HOLX:UW,BBG000C3P591,Panther Fusion® Flu A/B/RSV Assay Now FDA Cleared on Hologic's New Panther Fusion® System,2017-10-05 20:01:00 +0000,https://finance.yahoo.com/news/panther-fusion-flu-b-rsv-200100356.html?.tsrc=rss,"The Panther Fusion is available as a full system or the Panther Fusion module can be attached to existing Panther systems in the field to extend testing capabilities.  Specifically, the Panther Fusion adds the capacity to run PCR (polymerase chain reaction) assays in addition to tests based on TMA (transcription-mediated amplification), the proprietary Hologic chemistry that powers the Company's Aptima® brand.  ""Consolidating testing remains a key focus of our clinical laboratory customers,"" said Tom West, president of the Diagnostic Solutions Division at Hologic."
HOLX,HOLX:UW,BBG000C3P591,Hologic Announces Pricing of Offering of $350 Million Aggregate Principal Amount of 4.375% Senior Notes Due 2025,2017-10-04 22:01:00 +0000,https://finance.yahoo.com/news/hologic-announces-pricing-offering-350-220100580.html?.tsrc=rss,"MARLBOROUGH, Mass., Oct. 4, 2017 /PRNewswire/ -- Hologic, Inc. (HOLX) announced today that it has priced its previously announced private offering of $350 million aggregate principal amount of 4.375% senior notes due 2025 at an issue price of $1,000 per $1,000.  The 2025 notes will be unsecured obligations of the Company and will be guaranteed by certain subsidiaries.  The offering is expected to close on October 10, 2017, subject to customary closing conditions.  Hologic intends to use the net proceeds of the offering and available cash, including funds from its new five-year secured credit agreement, to retire the Company's remaining convertible notes, including through repurchases or redemptions, when they become callable in December of 2017 and March of 2018.  The 2025 notes will not be registered under the Securities Act of 1933, as amended, or any state securities laws.  Unless so registered, the securities may not be offered or sold in the United States except pursuant to an exemption from, or in a transaction not subject to, the registration requirements of the Securities Act and applicable state securities laws.  The 2025 notes are being offered only to qualified institutional buyers in reliance on Rule 144A under the Securities Act, and outside the United States in accordance with Regulation S under the Securities Act."
HOLX,HOLX:UW,BBG000C3P591,"Hologic, Inc. -- Moody's assigns Ba3 to Hologic's senior unsecured bonds",2017-10-04 13:47:06 +0000,http://finance.yahoo.com/r/b5bd3973-1db7-3c29-b758-6141f53181eb/viewresearchdoc.aspx?docid=PR_373501&WT.mc_id=AM~WWFob29fRmluYW5jZV9TQl9SYXRpbmcgTmV3c19BbGxfRW5n~20171004_PR_373501&yptr=yahoo&.tsrc=rss,"Rating Action: Moody's assigns Ba3 to Hologic's senior unsecured bonds. Global Credit Research- 04 Oct 2017. New York, October 04, 2017-- Moody's Investors Service assigned a Ba3 rating to Hologic, Inc.' ..."
HOLX,HOLX:UW,BBG000C3P591,"Hologic, Inc. -- Moody's assigns Ba1 to Hologic's senior secured credit facility",2017-10-04 12:47:06 +0000,http://finance.yahoo.com/r/b25805af-8f0f-357c-993d-770b0ff068e2/viewresearchdoc.aspx?docid=PR_373443&WT.mc_id=AM~WWFob29fRmluYW5jZV9TQl9SYXRpbmcgTmV3c19BbGxfRW5n~20171004_PR_373443&yptr=yahoo&.tsrc=rss,"Rating Action: Moody's assigns Ba1 to Hologic's senior secured credit facility. Global Credit Research- 04 Oct 2017. New York, October 04, 2017-- Moody's Investors Service assigned a Ba1 rating to Hologic, ..."
HOLX,HOLX:UW,BBG000C3P591,Is Hologic Inc’s (HOLX) PE Ratio A Signal To Buy For Investors?,2017-10-04 12:16:12 +0000,https://finance.yahoo.com/news/hologic-inc-holx-pe-ratio-121612431.html?.tsrc=rss,"Hologic Inc (NASDAQ:HOLX) trades with a trailing P/E of 13.8x, which is lower than the industry average of 43.5x. While HOLX might seem like an attractive stock to buy, itRead More..."
HOLX,HOLX:UW,BBG000C3P591,Hologic Announces Offering of $350 Million of Senior Notes Due 2025,2017-10-04 11:02:00 +0000,https://finance.yahoo.com/news/hologic-announces-offering-350-million-110200779.html?.tsrc=rss,"MARLBOROUGH, Mass., Oct. 4, 2017 /PRNewswire/ -- Hologic, Inc. (HOLX) announced today that it has launched, subject to market and other conditions, a private offering of $350 million aggregate principal amount of senior notes due 2025.  Hologic intends to use the proceeds of the offering and available cash, including funds from its new five-year secured credit agreement, to retire the Company's remaining convertible notes, including through repurchases or redemptions, when they become callable in December of 2017 and March of 2018.  The 2025 notes will not be registered under the Securities Act of 1933, as amended, or any state securities laws.  Unless so registered, the securities may not be offered or sold in the United States except pursuant to an exemption from, or in a transaction not subject to, the registration requirements of the Securities Act and applicable state securities law.  The 2025 notes are being offered only to qualified institutional buyers in reliance on Rule 144A under the Securities Act, and outside the United States in accordance with Regulation S under the Securities Act."
HOLX,HOLX:UW,BBG000C3P591,Hologic Enters into Amended and Restated Five-Year Secured Credit Agreement,2017-10-04 11:02:00 +0000,https://finance.yahoo.com/news/hologic-enters-amended-restated-five-110200627.html?.tsrc=rss,"MARLBOROUGH, Mass., Oct. 4, 2017 /PRNewswire/ -- Hologic, Inc. (HOLX) announced today that the Company has entered into an amended and restated credit agreement consisting of a new, five-year $1.5 billion senior term loan and $1.5 billion revolving credit facility.  The new loan facilities mature on October 3, 2022, subject to adjustment in certain circumstances.  Borrowings initially bear interest at an annual rate of LIBOR + 1.50%, and may change based on Hologic's leverage ratio.  Prior to maturity, the Company will be required to make minimum principal payments on the new term loan in annualized amounts of $37.5 million in fiscal 2018, $75 million in fiscal 2019, $75 million in fiscal 2020, $112.5 million in fiscal 2021, and $150 million in fiscal 2022, with the balance due at maturity."
HOLX,HOLX:UW,BBG000C3P591,"Hologic to Announce Financial Results for the Fourth Quarter of Fiscal 2017 on Wednesday, November 8, 2017",2017-10-03 20:01:00 +0000,https://finance.yahoo.com/news/hologic-announce-financial-results-fourth-200100986.html?.tsrc=rss,"MARLBOROUGH, Mass. , Oct. 3, 2017 /PRNewswire/ -- Hologic, Inc. (Nasdaq: HOLX) announced today that the Company plans to release its financial results for the fourth quarter of fiscal 2017 on Wednesday, ..."
HOLX,HOLX:UW,BBG000C3P591,First Week of HOLX October 20th Options Trading,2017-10-03 16:57:22 +0000,http://articlefeeds.nasdaq.com/~r/nasdaq/symbols/~3/l9ZMQg1UDJg/first-week-of-holx-october-20th-options-trading-cm854655,Investors in Hologic Inc Symbol HOLX saw new options become available this week for the October 20th expiration At Stock Options Channel our YieldBoost formula has looked up and down the HOLX options chain for the new October 20th contracts and identified one put and one call contract
HOLX,HOLX:UW,BBG000C3P591,Hologic CEO: Next-gen mammograms improve patient experien...,2017-10-02 10:20:00 +0000,https://finance.yahoo.com/video/hologic-ceo-next-gen-mammograms-102000318.html?.tsrc=rss,"Steve MacMillan, Hologic CEO talks about the quest to find improved detection and treatment for breast cancer."
HOLX,HOLX:UW,BBG000C3P591,"Hologic, Inc. (Nasdaq: HOLX) to Ring The Nasdaq Stock Market Opening Bell",2017-09-29 15:06:47 +0000,https://finance.yahoo.com/news/hologic-inc-nasdaq-holx-ring-150647166.html?.tsrc=rss,"What: Hologic, Inc., an innovative medical technology company primarily focused on improving women's health and well-being through early detection and treatment, will visit the Nasdaq MarketSite in Times ..."
HOLX,HOLX:UW,BBG000C3P591,Hologic CEO Steve MacMillan to Ring Nasdaq Opening Bell on October 2 to Kick Off Breast Cancer Awareness Month,2017-09-29 12:07:00 +0000,https://finance.yahoo.com/news/hologic-ceo-steve-macmillan-ring-120700519.html?.tsrc=rss,"Trailblazing Company Behind the Genius™ 3D Mammography™ Exam Celebrates Year of Innovations in Breast Health MARLBOROUGH, Mass. , Sept. 29, 2017 /PRNewswire/ -- Hologic, Inc. (Nasdaq: HOLX) announced today ..."
HOLX,HOLX:UW,BBG000C3P591,"ETFs with exposure to Hologic, Inc. : September 28, 2017",2017-09-28 14:14:04 +0000,http://finance.yahoo.com/r/55021435-94b1-380b-95c8-ca186bc0e571/etfs-with-exposure-to-hologic-inc-september-28-2017?yptr=yahoo&.tsrc=rss,"Categories:  ETFs Yahoo FinanceClick here to see latest analysis ETFs with exposure to Hologic, Inc. Here are 5 ETFs with the largest exposure to HOLX-US. Comparing the performance and risk of Hologic, Inc. with the ETFs that have exposure to it gives us some ETF choices that could give us similar returns with lower volatility. Ticker Fund Name ... Read more
<b>(Read more...)</b>"
HOLX,HOLX:UW,BBG000C3P591,"Hologic, Inc. :HOLX-US: Earnings Analysis: Q3, 2017 By the Numbers : September 27, 2017",2017-09-27 13:01:42 +0000,http://finance.yahoo.com/r/86af2846-abdc-3a49-98e2-05572d20b593/hologic-inc-holx-us-earnings-analysis-q3-2017-by-the-numbers-september-27-2017?yptr=yahoo&.tsrc=rss,"Categories:  Yahoo FinanceGet free summary analysis Hologic, Inc. reports financial results for the quarter ended June 30, 2017. We analyze the earnings along side the following peers of Hologic, Inc. – Becton, Dickinson and Company (BDX-US) that have also reported for this period. Highlights Summary numbers: Revenues of USD 806.10 million, Net Earnings of USD 59.50 million. ... Read more
<b>(Read more...)</b>"
HOLX,HOLX:UW,BBG000C3P591,Hologic Receives FDA 510(k) Clearance to Market SculpSure® for Non-Invasive Body Contouring (Lipolysis) of the Submental Area (Under the Chin),2017-09-27 12:00:00 +0000,https://finance.yahoo.com/news/hologic-receives-fda-510-k-120000764.html?.tsrc=rss,"MARLBOROUGH, Mass., Sept. 27, 2017 /PRNewswire/ -- Hologic, Inc. (HOLX) announced today that the U.S. Food and Drug Administration (FDA) has granted an expanded FDA 510(k) clearance for Cynosure's non-invasive body contouring product, SculpSure®.  The state-of-the-art body contouring laser treatment is now cleared to treat a double chin (also known as the submental area), marking the product's sixth cleared body treatment area."
HOLX,HOLX:UW,BBG000C3P591,Hologic Introduces a More Comfortable Mammogram with the Launch of the SmartCurve™ Breast Stabilization System,2017-09-26 12:07:00 +0000,https://finance.yahoo.com/news/hologic-introduces-more-comfortable-mammogram-120700240.html?.tsrc=rss,"For years, women have reported avoiding regular mammograms due in large part to the fear of discomfort associated with breast compression.  In fact, a recent survey of 10,000 women found that fear of physical discomfort was the top reason cited for avoiding a mammogram by women who never had one.5 With this in mind, Hologic's research and development team, led by Tracy Accardi, Global Vice President of Research and Development, set out to reduce breast pain without compromising image quality or exam accuracy."
HOLX,HOLX:UW,BBG000C3P591,"New USPSTF Draft Cervical Cancer Screening Recommendations Are a Step Back for Women's Health, Would Put Lives at Risk",2017-09-14 12:11:00 +0000,https://finance.yahoo.com/news/uspstf-draft-cervical-cancer-screening-121100710.html?.tsrc=rss,"MARLBOROUGH, Mass. , Sept. 14, 2017 /PRNewswire/ -- Hologic, Inc. (Nasdaq: HOLX) is deeply concerned that the United States Preventive Services Task Force (USPSTF) did not include a grade for co-testing ..."
HOLX,HOLX:UW,BBG000C3P591,"Western Digital and Hologic skid; Centene, Nordstrom climb",2017-09-13 20:43:33 +0000,https://finance.yahoo.com/news/western-digital-hologic-skid-centene-204333820.html?.tsrc=rss,"Stocks that moved substantially or traded heavily on Wednesday: Centene Corp., up $7.28 to $98.16 The health insurer and Medicaid coverage provider will expand into New York by buying Fidelis Care for ..."
HOLX,HOLX:UW,BBG000C3P591,"Nasdaq 100 Movers: WDC, JD",2017-09-13 15:35:57 +0000,http://articlefeeds.nasdaq.com/~r/nasdaq/symbols/~3/OC08J4uwOqc/nasdaq-100-movers-wdc-jd-cm845061,In early trading on Wednesday shares of JD com JD topped the list of the day s best performing components of the Nasdaq 100 index trading up 3 1 Year to date JD com registers a 75 5 gain And the worst performing Nasdaq 100 component thus far on the day is Western Digital
HOLX,HOLX:UW,BBG000C3P591,How The Parts Add Up: QUS Headed For $80,2017-09-13 14:39:19 +0000,http://articlefeeds.nasdaq.com/~r/nasdaq/symbols/~3/LbyHsNpJPx8/how-the-parts-add-up-qus-headed-for-80-cm845115,Looking at the underlying holdings of the ETFs in our coverage universe at ETF Channel we have compared the trading price of each holding against the average analyst 12 month forward target price and computed the weighted average implied analyst target price for the ETF itself For the
HOLX,HOLX:UW,BBG000C3P591,"Market Close Report: Historical high reached as NASDAQ Composite Index closes at 6,454.28.",2017-09-12 20:48:48 +0000,http://articlefeeds.nasdaq.com/~r/nasdaq/symbols/~3/_1RLeuHpnR0/market-close-report-historical-high-reached-as-nasdaq-composite-index-closes-at-645428-cm844615,Tuesday s session closes with the NASDAQ Composite Index reaching a historical high The index closed at 6 454 28 up 22 02 for the day The index had a previous high 6435 33065 on 09 01 2017 The total shares traded for the NASDAQ was over 1 72 billion Tuesday s session closes with the
HOLX,HOLX:UW,BBG000C3P591,Hologic To Present At Morgan Stanley's Conference; Webcast At 9:55 AM ET,2017-09-11 08:56:00 +0000,http://articlefeeds.nasdaq.com/~r/nasdaq/symbols/~3/5FtvDvsdFJ8/hologic-to-present-at-morgan-stanleys-conference-webcast-at-955-am-et-20170911-00605,Hologic To Present At Morgan Stanley's Conference; Webcast At 9:55 AM ET
HOLX,HOLX:UW,BBG000C3P591,Hologic (HOLX) Down 11.1% Since Earnings Report: Can It Rebound?,2017-09-11 08:50:15 +0000,http://articlefeeds.nasdaq.com/~r/nasdaq/symbols/~3/d6n2I-WOaY4/hologic-holx-down-111-since-earnings-report-can-it-rebound-cm843455,More than a has gone by since the last earnings report for Hologic Inc HOLX Shares have lost about 11 1 in that time frame underperforming the market Will the recent negative trend continue leading up to the stock s next earnings release or is it due for a breakout Before we dive
HOLX,HOLX:UW,BBG000C3P591,Hologic (HOLX) Down 11.1% Since Earnings Report: Can It Rebound?,2017-09-11 06:16:06 +0000,https://finance.yahoo.com/news/hologic-holx-down-11-1-061606403.html?.tsrc=rss,Hologic (HOLX) reported earnings more than a month ago. What&apos;s next for the stock? We take a look at earnings estimates for some clues.
HOLX,HOLX:UW,BBG000C3P591,"GMAC Commercial Mortgage Securities, Inc. Series 2003-C1 -- Moody's Affirms Five Classes of GMACC 2003-C1",2017-09-08 21:24:08 +0000,http://finance.yahoo.com/r/11edbc8f-0284-3406-9903-aa640aaa6e6c/viewresearchdoc.aspx?docid=PR_372388&WT.mc_id=AM~WWFob29fRmluYW5jZV9TQl9SYXRpbmcgTmV3c19BbGxfRW5n~20170908_PR_372388&yptr=yahoo&.tsrc=rss,Rating Action: Moody's Affirms Five Classes of GMACC 2003- C1. Global Credit Research- 08 Sep 2017. Approximately $10.4 Million of Structured Securities Affected.
HOLX,HOLX:UW,BBG000C3P591,"Hologic (HOLX) Launches Brevera, Progresses in Breast Health",2017-09-05 15:54:07 +0000,http://articlefeeds.nasdaq.com/~r/nasdaq/symbols/~3/3lmQllTzJfA/hologic-holx-launches-brevera-progresses-in-breast-health-cm841012,Hologic Inc HOLX has moved a step forward within its core Breast Health business with another new product added to its kitty The company has announced to have commercially launched the Brevera breast biopsy system with CorLumina imaging technology in the United States Per the company
HOLX,HOLX:UW,BBG000C3P591,"Hologic (HOLX) Launches Brevera, Progresses in Breast Health",2017-09-05 13:51:01 +0000,https://finance.yahoo.com/news/hologic-holx-launches-brevera-progresses-135101396.html?.tsrc=rss,Hologic&apos;s (HOLX) Brevera real-time breast biopsy and verification system holds great potential to enhance workflow and patient experience.
HOLX,HOLX:UW,BBG000C3P591,Hologic Announces Availability of New Brevera® Breast Biopsy System with CorLumina® Imaging Technology,2017-08-31 12:00:00 +0000,https://finance.yahoo.com/news/hologic-announces-availability-brevera-breast-120000471.html?.tsrc=rss,"MARLBOROUGH, Mass., Aug. 31, 2017 /PRNewswire/ -- Hologic, Inc. (HOLX) today announced U.S. commercial availability of the Brevera® breast biopsy system with CorLumina® imaging technology, a groundbreaking real-time breast biopsy and verification system that enhances workflow, improves the patient experience and streamlines the entire biopsy process from start to finish.  The first-of-its-kind Brevera system is designed to increase biopsy accuracy with real-time imaging that delivers valuable information at the point of care, enabling clinicians to make informed decisions with confidence.  The Brevera system is the world's first and only breast biopsy solution to combine tissue acquisition, real-time imaging, sample verification and advanced post-biopsy handling in one, integrated system."
HOLX,HOLX:UW,BBG000C3P591,"Kahn Brothers Curbs Hologic, Citigroup, Pfizer Postitions, Exits GE",2017-08-30 17:35:30 +0000,https://finance.yahoo.com/news/kahn-brothers-curbs-hologic-citigroup-173530302.html?.tsrc=rss,The firm's 9 largest sales for the 2nd quarter
HOLX,HOLX:UW,BBG000C3P591,See what the IHS Markit Score report has to say about Hologic Inc.,2017-08-29 12:06:37 +0000,https://finance.yahoo.com/news/see-ihs-markit-score-report-120637674.html?.tsrc=rss,"The last change in the short interest score occurred more than 1 month ago and implies that there has been little change in sentiment among investors who seek to profit from falling equity prices.  Over the last one-month, outflows of investor capital in ETFs holding HOLX totaled $7.61 billion."
HOLX,HOLX:UW,BBG000C3P591,Hologic Enters Oversold Territory (HOLX),2017-08-28 21:48:59 +0000,http://articlefeeds.nasdaq.com/~r/nasdaq/symbols/~3/YSSWn-zpV8M/hologic-enters-oversold-territory-holx-cm838187,Legendary investor Warren Buffett advises to be fearful when others are greedy and be greedy when others are fearful One way we can try to measure the level of fear in a given stock is through a technical analysis indicator called the Relative Strength Index or RSI which measures momentum on
HOLX,HOLX:UW,BBG000C3P591,See what the IHS Markit Score report has to say about Hologic Inc.,2017-08-28 12:06:33 +0000,https://finance.yahoo.com/news/see-ihs-markit-score-report-120633474.html?.tsrc=rss,"The last change in the short interest score occurred more than 1 month ago and implies that there has been little change in sentiment among investors who seek to profit from falling equity prices.  Index (PMI) data, output in the Healthcare sector is rising."
HOLX,HOLX:UW,BBG000C3P591,7 Cutting-Edge Healthcare Stocks to Buy,2017-08-22 23:38:24 +0000,http://articlefeeds.nasdaq.com/~r/nasdaq/symbols/~3/ce1vT1zYMYg/7-cutting-edge-healthcare-stocks-to-buy-cm835710,InvestorPlace Stock Market News Stock Advice amp Trading Tips While pharmaceutical companies may be the first ones to come to mind when you think of healthcare investing medical technology is at the forefront of innovation in far more areas than just consumable drugs And these
HOLX,HOLX:UW,BBG000C3P591,"After Hours Most Active for Aug 22, 2017 :  CPN, CRM, QQQ, KO, AAPL, SBUX, T, MU, TGT, XOM, CSCO, HOLX",2017-08-22 20:57:51 +0000,http://articlefeeds.nasdaq.com/~r/nasdaq/symbols/~3/OhLEmYJQpa4/after-hours-most-active-for-aug-22-2017-cpn-crm-qqq-ko-aapl-sbux-t-mu-tgt-xom-csco-holx-cm835660,The NASDAQ 100 After Hours Indicator is up 26 to 5 873 59 The total After hours volume is currently 41 901 385 shares traded The following are the most active stocks for the after hours session Calpine Corporation CPN is 0 0572 at 14 84 with 1 591 088 shares
HOLX,HOLX:UW,BBG000C3P591,See what the IHS Markit Score report has to say about Hologic Inc.,2017-08-17 12:07:25 +0000,https://finance.yahoo.com/news/see-ihs-markit-score-report-120645876.html?.tsrc=rss,"The last change in the short interest score occurred more than 1 month ago and implies that there has been little change in sentiment among investors who seek to profit from falling equity prices.  Index (PMI) data, output in the Healthcare sector is rising."
