HOLX,HOLX:UW,BBG000C3P591,Wright Medical (WMGI) Posts Wider-than-Expected Loss in Q1,2017-05-05 12:21:12 +0000,http://finance.yahoo.com/news/wright-medical-wmgi-posts-wider-122112846.html?.tsrc=rss,"Wright Medical Group N.V. (WMGI) reported adjusted loss of 9 cents per share in the first quarter of 2017, wider than the Zacks Consensus Estimate of a loss of 8 cents."
HOLX,HOLX:UW,BBG000C3P591,"PerkinElmer (PKI) Tops Q1 Earnings Estimates, FY17 View Up",2017-05-05 12:19:12 +0000,http://finance.yahoo.com/news/perkinelmer-pki-tops-q1-earnings-121912978.html?.tsrc=rss,"PerkinElmer Inc (PKI) reported first-quarter 2017 adjusted earnings of 55 cents per share, marginally beating the Zacks Consensus Estimate by a penny."
HOLX,HOLX:UW,BBG000C3P591,"athenahealth (ATHN) Earnings, Revenues Miss Estimates in Q1",2017-05-04 14:42:02 +0000,http://finance.yahoo.com/news/athenahealth-athn-earnings-revenues-miss-144202904.html?.tsrc=rss,athenahealth Inc. (ATHN) reported adjusted earnings of 10 cents per share in the first quarter of fiscal 2017.
HOLX,HOLX:UW,BBG000C3P591,"Bruker (BRKR) Q1 Earnings Meet, Revenues Beat Estimates",2017-05-04 14:16:10 +0000,http://articlefeeds.nasdaq.com/~r/nasdaq/symbols/~3/zkLcTBc3r9s/bruker-brkr-q1-earnings-meet-revenues-beat-estimates-cm784163,Bruker Corporation BRKR reported adjusted earnings per share EPS of 19 cents in the first quarter of 2017 lower than the year ago figure by 9 5 Adjusted EPS were in line with the Zacks Consensus Estimate Excluding one time adjustments Bruker reported net income of 21 6 million or
HOLX,HOLX:UW,BBG000C3P591,"AmerisourceBergen (ABC) Beats on Q2 Earnings, Lags Revenues",2017-05-04 13:00:01 +0000,http://finance.yahoo.com/news/amerisourcebergen-abc-beats-q2-earnings-130001424.html?.tsrc=rss,"AmerisourceBergen Corporation (ABC) posted adjusted earnings of $1.77 per share in the second quarter of fiscal 2017, beating the Zacks Consensus Estimate of $1.71 and increasing 5.4% on a year-over-year basis."
HOLX,HOLX:UW,BBG000C3P591,Cardiovascular Systems (CSII) Swings to Earnings in Q3,2017-05-04 12:57:12 +0000,http://finance.yahoo.com/news/cardiovascular-systems-csii-swings-earnings-125712846.html?.tsrc=rss,"Cardiovascular Systems, Inc. (CSII) reported adjusted earnings per share of 3 cents in third-quarter fiscal 2017, reflecting a massive improvement from the year-ago quarter&apos;s adjusted loss of 47 cents."
HOLX,HOLX:UW,BBG000C3P591,"Bruker (BRKR) Q1 Earnings Meet, Revenues Beat Estimates",2017-05-04 12:54:12 +0000,http://finance.yahoo.com/news/bruker-brkr-q1-earnings-meet-125412067.html?.tsrc=rss,"Bruker Corporation (BRKR) reported adjusted earnings per share (EPS) of 19 cents in the first quarter of 2017, lower than the year-ago figure by 9.5%."
HOLX,HOLX:UW,BBG000C3P591,"QIAGEN (QGEN) Beats Q1 Earnings Estimates, Retains View",2017-05-03 19:54:18 +0000,http://articlefeeds.nasdaq.com/~r/nasdaq/symbols/~3/2sQH9qoaHqw/qiagen-qgen-beats-q1-earnings-estimates-retains-view-cm783747,QIAGEN 160 N V 160 QGEN reported first quarter 2017 adjusted earnings per share considering restructuring expenses as one time item of 22 cents up 15 8 year over year The reported figure was ahead of the Zacks Consensus Estimate by a penny At constant exchange rate or CER the
HOLX,HOLX:UW,BBG000C3P591,"DaVita (DVA) Earnings Miss Estimates, Revenues Beat in Q1",2017-05-03 19:53:40 +0000,http://articlefeeds.nasdaq.com/~r/nasdaq/symbols/~3/gbfu2vrWrbo/davita-dva-earnings-miss-estimates-revenues-beat-in-q1-cm783734,DaVita Inc DVA reported first quarter 2017 adjusted operating earnings of 79 cents per share that missed the Zacks Consensus Estimate of 82 cents Also earnings declined from 92 cents in the year ago quarter Total revenue increased from 3 58 billion year over year to approximately 3
HOLX,HOLX:UW,BBG000C3P591,"DaVita (DVA) Earnings Miss Estimates, Revenues Beat in Q1",2017-05-03 14:00:02 +0000,http://finance.yahoo.com/news/davita-dva-earnings-miss-estimates-140002196.html?.tsrc=rss,DaVita Inc. (DVA) reported first-quarter 2017 adjusted operating earnings of 79 cents per share that missed the Zacks Consensus Estimate of 82 cents.
HOLX,HOLX:UW,BBG000C3P591,"Myriad Genetics (MYGN) Tops Q3 Earnings & Sales, Tweaks View",2017-05-03 13:27:59 +0000,http://articlefeeds.nasdaq.com/~r/nasdaq/symbols/~3/DVRZUo_vKd8/myriad-genetics-mygn-tops-q3-earnings-sales-tweaks-view-cm783396,Myriad Genetics Inc MYGN reported adjusted earnings per share EPS of 27 cents in the third quarter of fiscal 2017 down 34 year over year However adjusted EPS beat the Zacks Consensus Estimate by 12 5 and surpassed the company s guided range of 23 25 cents Including one time
HOLX,HOLX:UW,BBG000C3P591,"DexCom (DXCM) Q1 Loss Narrower than Expected, Revenues Miss",2017-05-03 12:41:12 +0000,http://finance.yahoo.com/news/dexcom-dxcm-q1-loss-narrower-124112299.html?.tsrc=rss,"DexCom Inc. (DXCM) reported a loss of 49 cents per share in the first quarter of 2017, narrower than the Zacks Consensus Estimate of a loss of 55 cents."
HOLX,HOLX:UW,BBG000C3P591,"Myriad Genetics (MYGN) Tops Q3 Earnings & Sales, Tweaks View",2017-05-03 12:40:12 +0000,http://finance.yahoo.com/news/myriad-genetics-mygn-tops-q3-124012392.html?.tsrc=rss,"Myriad Genetics Inc. (MYGN) reported adjusted earnings per share (EPS) of 27 cents in the third quarter of fiscal 2017, down 34% year over year."
HOLX,HOLX:UW,BBG000C3P591,"Amedisys (AMED) Beats on Q1 Earnings, Revenues Meet Mark",2017-05-03 12:07:12 +0000,http://finance.yahoo.com/news/amedisys-amed-beats-q1-earnings-120712855.html?.tsrc=rss,"Amedisys Inc. (AMED) reported adjusted earnings from continuing operations of 47 cents per share in the first quarter of 2017, up 42.4% year over year."
HOLX,HOLX:UW,BBG000C3P591,"CVS Health (CVS) Q1 Earnings Beat Estimates, Decrease Y/Y",2017-05-02 16:29:56 +0000,http://articlefeeds.nasdaq.com/~r/nasdaq/symbols/~3/V_cuv6GXoTk/cvs-health-cvs-q1-earnings-beat-estimates-decrease-yy-cm782741,CVS Health Corporation CVS reported first quarter 2017 adjusted earnings per share EPS of 1 17 down 0 8 year over year However the quarter s adjusted EPS exceeded the Zacks Consensus Estimate of 1 10 by 6 4 Earnings performance was dull year over year on disappointing Retail
HOLX,HOLX:UW,BBG000C3P591,"Ecolab (ECL) Q1 Earnings Miss Estimates, Revenues In Line",2017-05-02 14:35:02 +0000,http://finance.yahoo.com/news/ecolab-ecl-q1-earnings-miss-143502750.html?.tsrc=rss,"Ecolab Inc. (ECL) reported first-quarter 2017 adjusted earnings (excluding special gains, charges and tax items) of 80 cents per share, which missed the Zacks Consensus Estimate of 81 cents."
HOLX,HOLX:UW,BBG000C3P591,"Becton, Dickinson (BDX) Q2 Earnings Beat, Increase Y/Y",2017-05-02 14:09:02 +0000,http://finance.yahoo.com/news/becton-dickinson-bdx-q2-earnings-140902942.html?.tsrc=rss,"Becton, Dickinson and Company (BDX), popularly known as BD, reported second-quarter fiscal 2017 earnings of $2.30 per share, which beat the Zacks Consensus Estimate of $2.23 and increased 5.5% on a year-over-year basis."
HOLX,HOLX:UW,BBG000C3P591,"Luminex (LMNX) Tops Q1 Earnings, Revenue Guidance Raised",2017-05-02 13:13:01 +0000,http://finance.yahoo.com/news/luminex-lmnx-tops-q1-earnings-131301089.html?.tsrc=rss,"Luminex Corporation (LMNX) reported earnings of 27 cents per share in the first quarter of 2017, surpassing the Zacks Consensus Estimate of adjusted earnings of 8 cents per share by a massive 237.5%."
HOLX,HOLX:UW,BBG000C3P591,Hill-Rom (HRC) Beats Earnings & Revenue Estimates in Q2,2017-05-01 16:32:00 +0000,http://articlefeeds.nasdaq.com/~r/nasdaq/symbols/~3/FV5-unUPkiI/hill-rom-hrc-beats-earnings-revenue-estimates-in-q2-cm782085,Hill Rom Holdings Inc HRC reported second quarter fiscal 2017 adjusted earnings per share EPS of 88 cents up 23 9 from the year ago quarter Not only did adjusted earnings surpass the Zacks Consensus Estimate of 79 cents the figure also exceeded the company s projected range of 77
HOLX,HOLX:UW,BBG000C3P591,"Cardinal Health (CAH) Q3 Earnings Beat Estimates, Rise Y/Y",2017-05-01 15:01:03 +0000,http://finance.yahoo.com/news/cardinal-health-cah-q3-earnings-150103782.html?.tsrc=rss,"Cardinal Health Inc. (CAH) reported third-quarter fiscal 2017 adjusted earnings of $1.53 per share, which beat the Zacks Consensus Estimate of $1.46 and increased 7% on a year-over-year basis."
HOLX,HOLX:UW,BBG000C3P591,Hill-Rom (HRC) Beats Earnings & Revenue Estimates in Q2,2017-05-01 13:59:01 +0000,http://finance.yahoo.com/news/hill-rom-hrc-beats-earnings-135901070.html?.tsrc=rss,"Hill-Rom Holdings, Inc. (HRC) reported second-quarter fiscal 2017 adjusted earnings per share (EPS) of 88 cents, up 23.9% from the year-ago quarter."
HOLX,HOLX:UW,BBG000C3P591,"Accuray (ARAY) Incurs Loss in Q3, Revenues Miss Estimates",2017-05-01 13:38:01 +0000,http://finance.yahoo.com/news/accuray-aray-incurs-loss-q3-133801191.html?.tsrc=rss,"Accuray Inc.(ARAY) reported a loss of 6 cents per share in the third quarter of fiscal 2017, comparing unfavorably with the Zacks Consensus Estimate of earnings of a penny."
HOLX,HOLX:UW,BBG000C3P591,Is a Surprise in Store for Hologic (HOLX) in Q2 Earnings?,2017-05-01 11:33:11 +0000,http://finance.yahoo.com/news/surprise-store-hologic-holx-q2-113311960.html?.tsrc=rss,"Hologic Inc. (HOLX) is slated to report second-quarter fiscal 2017 financial results on May 10, after the closing bell."
HOLX,HOLX:UW,BBG000C3P591,athenahealth (ATHN) Misses on Earnings & Revenues in Q1,2017-04-28 15:32:14 +0000,http://articlefeeds.nasdaq.com/~r/nasdaq/symbols/~3/O575S7Y25Nw/athenahealth-athn-misses-on-earnings-revenues-in-q1-cm781138,athenahealth Inc ATHN reported adjusted earnings of 10 cents per share in the first quarter of fiscal 2017 which missed the Zacks Consensus Estimate by a penny In fact the figure declined almost 9 on a year over year basis The Watertown MA based maker of billing and medical
HOLX,HOLX:UW,BBG000C3P591,Align Technology (ALGN) Beats on Q1 Earnings and Revenues,2017-04-28 13:31:01 +0000,http://finance.yahoo.com/news/align-technology-algn-beats-q1-133101520.html?.tsrc=rss,"Align Technology Inc. (ALGN) reported adjusted earnings per share (EPS) of 85 cents in the first quarter of 2017, up 70% from 50 cents posted in the year-ago quarter."
HOLX,HOLX:UW,BBG000C3P591,athenahealth (ATHN) Misses on Earnings & Revenues in Q1,2017-04-28 13:03:01 +0000,http://finance.yahoo.com/news/athenahealth-athn-misses-earnings-revenues-130301148.html?.tsrc=rss,"athenahealth Inc. (ATHN) reported adjusted earnings of 10 cents per share in the first quarter of fiscal 2017, which missed the Zacks Consensus Estimate by a penny."
HOLX,HOLX:UW,BBG000C3P591,Chemed's (CHE) Earnings and Revenues Beat Estimates in Q1,2017-04-27 14:29:31 +0000,http://articlefeeds.nasdaq.com/~r/nasdaq/symbols/~3/F3UFBpZ6NLs/chemeds-che-earnings-and-revenues-beat-estimates-in-q1-cm780306,Chemed Corp s CHE first quarter 2017 adjusted earnings per share EPS considering stock based compensation expense and related tax benefit as a regular one were 1 92 as compared to the year ago adjusted EPS figure of 1 52 up 26 3 year over year The figure also surpassed the
HOLX,HOLX:UW,BBG000C3P591,Chemed&apos;s (CHE) Earnings and Revenues Beat Estimates in Q1,2017-04-27 13:03:01 +0000,http://finance.yahoo.com/news/chemed-apos-che-earnings-revenues-130301418.html?.tsrc=rss,"Chemed Corp.&apos;s (CHE) first-quarter 2017 adjusted earnings per share (EPS) (considering stock-based compensation expense and related tax benefit as a regular one) were $1.92, as compared to the year-ago adjusted EPS figure of $1.52, up 26.3% year over year."
HOLX,HOLX:UW,BBG000C3P591,Varian Medical (VAR) Beats on Earnings and Revenues in Q2,2017-04-27 12:45:12 +0000,http://finance.yahoo.com/news/varian-medical-var-beats-earnings-124512250.html?.tsrc=rss,"Varian Medical Systems, Inc. (VAR) reported adjusted earnings of 89 cents per share in the second quarter of fiscal 2017, which beat the Zacks Consensus Estimate by a penny."
HOLX,HOLX:UW,BBG000C3P591,Pacific Biosciences (PACB) Q1 Loss Wider than Estimated,2017-04-27 12:41:12 +0000,http://finance.yahoo.com/news/pacific-biosciences-pacb-q1-loss-124112710.html?.tsrc=rss,Pacific Biosciences of California Inc. (PACB) reported a loss of 26 cents per share in the first quarter of 2017. The figure is 3 cents wider than the Zacks Consensus Estimate.
HOLX,HOLX:UW,BBG000C3P591,"Baxter International (BAX) Q1 Earnings Beat, FY17 View Up",2017-04-26 13:35:01 +0000,http://finance.yahoo.com/news/baxter-international-bax-q1-earnings-133501749.html?.tsrc=rss,"Baxter International Inc. (BAX) reported first-quarter 2017 adjusted earnings of 58 cents per share, which surpassed the Zacks Consensus Estimate by 7 cents and was way better than the year-ago figure of 36 cents."
HOLX,HOLX:UW,BBG000C3P591,Baxter Launches Drug Library Guide for Smart Infusion System,2017-04-21 11:54:11 +0000,http://finance.yahoo.com/news/baxter-launches-drug-library-guide-115411009.html?.tsrc=rss,Baxter International Inc. (BAX) recently introduced an infusion system drug library guide to help clinicians identify potential errors in the infusion process during intravenous treatment.
HOLX,HOLX:UW,BBG000C3P591,"Intuitive Surgical: Q1 Solid, Procedures Likely to Slow Ddown",2017-04-21 11:45:11 +0000,http://finance.yahoo.com/news/intuitive-surgical-q1-solid-procedures-114511055.html?.tsrc=rss,"On Apr 21, we issued an updated research report on Sunnyvale-based Intuitive Surgical (ISRG) -- manufacturer of the da Vinci surgical system (an advanced robot-assisted surgical system) and related instruments and accessories."
HOLX,HOLX:UW,BBG000C3P591,"Quest Diagnostics (DGX) Tops Q1 Earnings, Raises '17 View",2017-04-20 16:04:58 +0000,http://articlefeeds.nasdaq.com/~r/nasdaq/symbols/~3/jqMdR9P3Mho/quest-diagnostics-dgx-tops-q1-earnings-raises-17-view-cm776414,Quest Diagnostics DGX first quarter 2017 adjusted earnings per share EPS of 1 33 came in 13 7 ahead of the Zacks Consensus Estimate and exceeded the year ago number by 17 7 Adjusted EPS in the reported quarter excludes charges related to restructuring and integration retirement
HOLX,HOLX:UW,BBG000C3P591,"Quest Diagnostics (DGX) Tops Q1 Earnings, Raises &apos;17 View",2017-04-20 14:18:02 +0000,http://finance.yahoo.com/news/quest-diagnostics-dgx-tops-q1-141802017.html?.tsrc=rss,Quest Diagnostics&apos; (DGX) first-quarter 2017 adjusted earnings per share (EPS) of $1.33 came in 13.7% ahead of the Zacks Consensus Estimate.
HOLX,HOLX:UW,BBG000C3P591,"Abbott (ABT) Tops Q1 Earnings on Strong EPD, Medical Device",2017-04-19 17:04:54 +0000,http://articlefeeds.nasdaq.com/~r/nasdaq/symbols/~3/_3yGlHXgclI/abbott-abt-tops-q1-earnings-on-strong-epd-medical-device-cm775937,Abbott Laboratories ABT reported first quarter 2017 adjusted earnings from continuing operations of 48 cents per share 11 6 higher than the Zacks Consensus Estimate and up 17 1 year over year Reported earnings for the quarter came in at 22 cents per share way ahead of the year ago number
HOLX,HOLX:UW,BBG000C3P591,Intuitive Surgical (ISRG) Beats on Q1 Earnings & Revenues,2017-04-19 15:08:19 +0000,http://articlefeeds.nasdaq.com/~r/nasdaq/symbols/~3/qstaeV8qD6I/intuitive-surgical-isrg-beats-on-q1-earnings-revenues-cm775790,Intuitive Surgical Inc ISRG posted adjusted earnings of 4 67 per share in the first quarter of 2017 crushing the Zacks Consensus Estimate of 3 97 on stellar revenue growth Also the figure improved 27 2 on a year over year basis Interestingly over the past four trailing quarters
HOLX,HOLX:UW,BBG000C3P591,Intuitive Surgical (ISRG) Beats on Q1 Earnings & Revenues,2017-04-19 12:47:12 +0000,http://finance.yahoo.com/news/intuitive-surgical-isrg-beats-q1-124712117.html?.tsrc=rss,"Intuitive Surgical Inc.(ISRG) posted adjusted earnings of $4.67 per share in the first quarter of 2017, crushing the Zacks Consensus Estimate of $3.97 on stellar revenue growth."
HOLX,HOLX:UW,BBG000C3P591,Mazor (MZOR) Gets FDA Clearance For Mazor X Align Software,2017-04-17 12:51:12 +0000,http://finance.yahoo.com/news/mazor-mzor-gets-fda-clearance-125112480.html?.tsrc=rss,"Mazor Robotics Ltd. (MZOR), recently announced that it has received the FDA clearance for its Mazor X Align software."
HOLX,HOLX:UW,BBG000C3P591,Quality Systems (QSII) to Acquire Entrada for $34 Million,2017-04-13 15:39:03 +0000,http://finance.yahoo.com/news/quality-systems-qsii-acquire-entrada-153903834.html?.tsrc=rss,"Quality Systems, Inc. announced that it has entered into a deal to acquire Entrada, Inc. for $34 million."
HOLX,HOLX:UW,BBG000C3P591,Mazor Robotics (MZOR) Catches Eye: Stock Moves Up 10.2%,2017-04-13 12:35:12 +0000,http://finance.yahoo.com/news/mazor-robotics-mzor-catches-eye-123512442.html?.tsrc=rss,"Mazor Robotics Ltd. (MZOR) moved big last session, as its shares rose over 10% on the day."
HOLX,HOLX:UW,BBG000C3P591,Hologic (HOLX) Up 3.9% Since Earnings Report: Can It Continue?,2017-04-13 11:10:11 +0000,http://finance.yahoo.com/news/hologic-holx-3-9-since-111011081.html?.tsrc=rss,Hologic (HOLX) reported earnings 30 days ago. What&apos;s next for the stock? We take a look at earnings estimates for some clues.
HOLX,HOLX:UW,BBG000C3P591,Hologic faces U.S. patent lawsuit over menstrual bleeding device,2017-04-12 17:44:22 +0000,http://finance.yahoo.com/news/hologic-faces-u-patent-lawsuit-174422750.html?.tsrc=rss,"Medical device maker Hologic Inc  has been hit with a lawsuit alleging its product for  treating heavy menstrual bleeding infringes patented technology  developed by start-up Minerva Surgical Inc, court papers show.  Minerva filed a complaint in federal court in San Francisco  on Tuesday saying it may seek an injunction blocking U.S. sales  of Hologic's NovaSure Advanced system which began in February.  Minerva's rival device won pre-market approval from the U.S.  Food and Drug Administration in July 2015, but has yet to be  launched."
HOLX,HOLX:UW,BBG000C3P591,Allscripts' (MDRX) dbMotion Solution Available Through Azure,2017-04-12 15:58:23 +0000,http://articlefeeds.nasdaq.com/~r/nasdaq/symbols/~3/TyVu4BOQ0Mk/allscripts-mdrx-dbmotion-solution-available-through-azure-cm773259,Renowned information technology and service provider to healthcare organizations Allscripts Healthcare Solutions Inc MDRX announced that dbMotion Solution will be now available through Microsoft Corporation s MSFT cloud computing service Azure Notably dbMotion Solution is
HOLX,HOLX:UW,BBG000C3P591,Allscripts&apos; (MDRX) dbMotion Solution Available Through Azure,2017-04-12 13:53:01 +0000,http://finance.yahoo.com/news/allscripts-apos-mdrx-dbmotion-solution-135301263.html?.tsrc=rss,"Allscripts Healthcare Solutions, Inc. (MDRX), announced that dbMotion Solution will be now available through Microsoft Corporation&apos;s (MSFT) cloud computing service Azure."
HOLX,HOLX:UW,BBG000C3P591,Accuray TomoTherapy System Starts Cancer Treatment in Africa,2017-04-12 11:33:11 +0000,http://finance.yahoo.com/news/accuray-tomotherapy-system-starts-cancer-113311216.html?.tsrc=rss,"Accuray Inc. (ARAY) recently announced that the Radiotherapy and Medical Oncology Center of Sidi Abdellah, Algeria has finally initiated cancer treatment with the company&apos;s flagship TomoTherapy system."
HOLX,HOLX:UW,BBG000C3P591,ResMed's Study Results for Central Sleep Apnea Hold Promise,2017-04-11 22:55:40 +0000,http://articlefeeds.nasdaq.com/~r/nasdaq/symbols/~3/XC_hC8rZe3s/resmeds-study-results-for-central-sleep-apnea-hold-promise-cm772996,Medical device company ResMed Inc RMD recently sponsored a study which shows potential treatment of obstructive sleep apnea OSA in patients with untreated central sleep apnea CSA According to the study CSA patients are more responsive toward adaptive servo ventilation ASV therapy
HOLX,HOLX:UW,BBG000C3P591,ResMed&apos;s Study Results for Central Sleep Apnea Hold Promise,2017-04-11 20:17:08 +0000,http://finance.yahoo.com/news/resmed-apos-study-results-central-201708161.html?.tsrc=rss,ResMed Inc. (RMD) recently sponsored a study which shows potential treatment of obstructive sleep apnea (OSA) in patients with untreated central sleep apnea (CSA).
HOLX,HOLX:UW,BBG000C3P591,athenahealth (ATHN) Allies with CoverMyMeds for Faster ePA,2017-04-11 13:42:01 +0000,http://finance.yahoo.com/news/athenahealth-athn-allies-covermymeds-faster-134201852.html?.tsrc=rss,athenahealth Inc. (ATHN) recently entered into a strategic partnership with CoverMyMeds.
HOLX,HOLX:UW,BBG000C3P591,"DaVita Banks on Acquisitions, Escalating Expenses a Concern",2017-04-11 13:27:01 +0000,http://finance.yahoo.com/news/davita-banks-acquisitions-escalating-expenses-132701050.html?.tsrc=rss,"On Apr 10, we issued an updated research report Denver, CO-based DaVita HealthCare Partners Inc. (DVA), a leading provider of dialysis services in the U.S. to patients suffering from chronic kidney failure."
HOLX,HOLX:UW,BBG000C3P591,Masimo (MASI) Launches Root Platform with Kite Trademark,2017-04-11 13:26:01 +0000,http://finance.yahoo.com/news/masimo-masi-launches-root-platform-132601984.html?.tsrc=rss,"Irvine, CA-based Masimo Corporation (MASI) announced full market release of the Root monitoring platform with a Kite trademark (a supplementary display system)."
HOLX,HOLX:UW,BBG000C3P591,"3 Charts Are Bullish on Hologic, So What Does That Tell You?",2017-04-10 19:52:00 +0000,http://finance.yahoo.com/r/384396a1-3094-3cd7-be24-10775b4fcc0d/3-charts-are-bullish-hologic-so-what-does-tell-you?puc=yahoo&cm_ven=YAHOO&yptr=yahoo&.tsrc=rss,Stock is set to break out to the upside
HOLX,HOLX:UW,BBG000C3P591,AngioDynamics (ANGO) Prices 2.5M Secondary Share Offering,2017-04-10 14:06:02 +0000,http://finance.yahoo.com/news/angiodynamics-ango-prices-2-5m-140602884.html?.tsrc=rss,"AngioDynamics, Inc. (ANGO) announced that it has priced its underwritten public offering of 2.35 million shares of common stock."
HOLX,HOLX:UW,BBG000C3P591,"ABIOMED (ABMD) Banks on Impella Platform, Forex a Concern",2017-04-10 13:57:29 +0000,http://articlefeeds.nasdaq.com/~r/nasdaq/symbols/~3/tpQpLTTJmUw/abiomed-abmd-banks-on-impella-platform-forex-a-concern-cm771941,On Apr 7 we issued an updated research report on Danvers MA based ABIOMED Inc ABMD a leading medical product developer The stock currently carries a Zacks Rank 3 Hold We believe that robust demand for the Impella product line will continue to drive ABIOMED s top line over the
HOLX,HOLX:UW,BBG000C3P591,"ABIOMED (ABMD) Banks on Impella Platform, Forex a Concern",2017-04-10 12:09:12 +0000,http://finance.yahoo.com/news/abiomed-abmd-banks-impella-platform-120912942.html?.tsrc=rss,"On Apr 7, we issued an updated research report on Danvers, MA-based ABIOMED, Inc. (ABMD), a leading medical product developer."
HOLX,HOLX:UW,BBG000C3P591,"Hill-Rom's Innovations Make Surgeries More Safe, Accurate",2017-04-07 22:54:48 +0000,http://articlefeeds.nasdaq.com/~r/nasdaq/symbols/~3/pkyT6D6A-Ng/hill-roms-innovations-make-surgeries-more-safe-accurate-cm771653,Global medical technology company Hill Rom Holdings Inc HRC recently demonstrated the impact of surgical patient positioning on skin and nerve pressure related injuries The company also displayed its latest technologies and solutions for surgeries at the educational seminar at AORN
HOLX,HOLX:UW,BBG000C3P591,"Hill-Rom&apos;s Innovations Make Surgeries More Safe, Accurate",2017-04-07 20:35:08 +0000,http://finance.yahoo.com/news/hill-rom-apos-innovations-surgeries-203508951.html?.tsrc=rss,"Hill-Rom Holdings, Inc. (HRC) recently demonstrated the impact of surgical patient positioning on skin and nerve pressure-related injuries."
HOLX,HOLX:UW,BBG000C3P591,Omnicell's Aesynt Buyout Looks Promising amid Several Woes,2017-04-07 15:59:22 +0000,http://articlefeeds.nasdaq.com/~r/nasdaq/symbols/~3/bvG43KYcsRY/omnicells-aesynt-buyout-looks-promising-amid-several-woes-cm771423,On Apr 6 we issued an updated research report on Mountain View CA based Omnicell Inc OMCL The company develops and markets end to end automation solutions for the medication use process Over the last three months Omnicell s shares traded above the Zacks categorized Medical Info
HOLX,HOLX:UW,BBG000C3P591,Medidata & TESARO Win CARE 'Clinical Partnership' Award,2017-04-07 15:59:10 +0000,http://articlefeeds.nasdaq.com/~r/nasdaq/symbols/~3/btmgQkvwIys/medidata-tesaro-win-care-clinical-partnership-award-cm771419,Headquartered in NY Medidata Solutions Inc MDSO a worldwide producer of cloud based solutions for life sciences recently announced the receipt of the Clinical Partnership of the Year award at the second annual Clinical and Research Excellence CARE Awards courtesy of its
HOLX,HOLX:UW,BBG000C3P591,athenahealth Now a Strong Buy: Should You Add the Stock?,2017-04-07 15:58:20 +0000,http://articlefeeds.nasdaq.com/~r/nasdaq/symbols/~3/EDep7XXTCZQ/athenahealth-now-a-strong-buy-should-you-add-the-stock-cm771402,On Apr 5 athenahealth ATHN was raised to a Zacks Rank 1 Strong Buy Headquartered in Watertown MA athenahealth provides exclusive services that manage administrative duties of medical providers through its cloud based network The estimate revision trend for the company is pretty
HOLX,HOLX:UW,BBG000C3P591,"PetMed Faces Concerns over New Order Sales, Competition",2017-04-07 15:58:08 +0000,http://articlefeeds.nasdaq.com/~r/nasdaq/symbols/~3/iyl8nMt95HI/petmed-faces-concerns-over-new-order-sales-competition-cm771394,On Apr 6 we issued an updated research report on Pompano Beach FL based PetMed Express Inc PETS The company operating as 1 800 PetMeds is a leading nationwide pet pharmacy PetMed s shares started going downhill post the mixed fiscal third quarter results with earnings missing the
HOLX,HOLX:UW,BBG000C3P591,"PetMed Faces Concerns over New Order Sales, Competition",2017-04-07 13:37:01 +0000,http://finance.yahoo.com/news/petmed-faces-concerns-over-order-133701303.html?.tsrc=rss,"On Apr 6, we issued an updated research report on Pompano Beach, FL-based PetMed Express, Inc. (PETS)."
