HOLX,HOLX:UW,BBG000C3P591,Hologic (HOLX) Receives PMA for Aptima HIV-1 Quant Assay,2017-01-04 15:41:40 +0000,http://articlefeeds.nasdaq.com/~r/nasdaq/symbols/~3/cwHC3-qtyfg/hologic-holx-receives-pma-for-aptima-hiv-1-quant-assay-cm729204,Diagnostic instruments major Hologic Inc HOLX recently announced the receipt of the FDA s Premarket Approval PMA for its Aptima HIV 1 Quant assay This viral load monitoring assay falls under the company s Diagnostic Solutions division It is a nucleic acid amplification test for
HOLX,HOLX:UW,BBG000C3P591,Hologic (HOLX) Receives PMA for Aptima HIV-1 Quant Assay,2017-01-04 13:39:01 +0000,http://finance.yahoo.com/news/hologic-holx-receives-pma-aptima-133901772.html,Hologic (HOLX) Receives PMA for Aptima HIV-1 Quant Assay
HOLX,HOLX:UW,BBG000C3P591,"AGRX Fails To SECURE Investor Confidence, ITEK Hit Hard, CBAY Rises On Kowa Deal",2017-01-04 01:55:00 +0000,http://articlefeeds.nasdaq.com/~r/nasdaq/symbols/~3/EQUoX5n_LN8/agrx-fails-to-secure-investor-confidence-itek-hit-hard-cbay-rises-on-kowa-deal-20170104-00025,"AGRX Fails To SECURE Investor Confidence, ITEK Hit Hard, CBAY Rises On Kowa Deal"
HOLX,HOLX:UW,BBG000C3P591,FDA Grants PMA Approval for Hologic's Aptima® HIV-1 Quant Assay,2017-01-03 13:13:09 +0000,http://www.publicnow.com/view/DF18348D7CE423B0B2C13FBD9E440CA132C20205,"[at noodls] - --High-performing HIV viral load test now available alongside broad women's health menu on the fully automated Panther® system-- MARLBOROUGH, Mass., Jan. 3, 2017/PRNewswire / -- Hologic, Inc. (Nasdaq: ..."
HOLX,HOLX:UW,BBG000C3P591,FDA Grants PMA Approval for Hologic's Aptima® HIV-1 Quant Assay,2017-01-03 13:00:00 +0000,http://finance.yahoo.com/news/fda-grants-pma-approval-hologics-130000656.html,"[PR Newswire] - MARLBOROUGH, Mass., Jan. 3, 2017 /PRNewswire/ -- Hologic, Inc. (Nasdaq: HOLX) announced today that the U.S. Food and Drug Administration (FDA) has granted PMA approval for the Company's HIV-1 viral load ..."
HOLX,HOLX:UW,BBG000C3P591,FDA Grants PMA Approval For Hologic's Aptima HIV-1 Quant Assay,2017-01-03 08:12:00 +0000,http://articlefeeds.nasdaq.com/~r/nasdaq/symbols/~3/eMcVWKsTGQ0/fda-grants-pma-approval-for-hologics-aptima-hiv1-quant-assay-20170103-00354,FDA Grants PMA Approval For Hologic's Aptima HIV-1 Quant Assay
HOLX,HOLX:UW,BBG000C3P591,"Commit To Purchase Hologic At $33, Earn 3.5% Using Options",2016-12-28 17:59:17 +0000,http://articlefeeds.nasdaq.com/~r/nasdaq/symbols/~3/Y8VKdzZ9BK0/commit-to-purchase-hologic-at-33-earn-35-using-options-cm727042,Investors considering a purchase of Hologic Inc Symbol HOLX shares but tentative about paying the going market price of 40 08 share might benefit from considering selling puts among the alternative strategies at their disposal One interesting put contract in particular is the January
HOLX,HOLX:UW,BBG000C3P591,Stock picks and pans for 2017,2016-12-21 19:04:00 +0000,http://finance.yahoo.com/video/stock-picks-pans-2017-190400412.html,Stock picks and pans for 2017
HOLX,HOLX:UW,BBG000C3P591,Hologic to Present at the 35th Annual J.P. Morgan Healthcare Conference,2016-12-20 21:01:00 +0000,http://finance.yahoo.com/news/hologic-present-35th-annual-j-210100118.html,"[PR Newswire] - MARLBOROUGH, Mass., Dec. 20, 2016 /PRNewswire/ -- Hologic, Inc. (Nasdaq: HOLX) announced today that the Company will present at the 35 th Annual J.P. Morgan Healthcare Conference in San Francisco on January ..."
HOLX,HOLX:UW,BBG000C3P591,"Piper Jaffray's 2017 S&P 500 target: 2,424",2016-12-19 17:09:00 +0000,http://finance.yahoo.com/video/piper-jaffrays-2017-p-500-170900428.html,"Piper Jaffray's 2017 S&P 500 target: 2,424"
HOLX,HOLX:UW,BBG000C3P591,Hologic (HOLX) to Divest Blood Screening Business to Grifols,2016-12-19 13:57:56 +0000,http://articlefeeds.nasdaq.com/~r/nasdaq/symbols/~3/Z-PcK8hbfYc/hologic-holx-to-divest-blood-screening-business-to-grifols-cm723127,To focus more on its core business Hologic Inc HOLX recently inked a deal to divest its stake in the blood screening business Per the terms of the agreement the company will sell off its share to its long time commercial partner in blood screening business Grifols GRFS for gross
HOLX,HOLX:UW,BBG000C3P591,Hologic (HOLX) to Divest Blood Screening Business to Grifols,2016-12-19 12:46:12 +0000,http://finance.yahoo.com/news/hologic-holx-divest-blood-screening-124612429.html,Hologic (HOLX) to Divest Blood Screening Business to Grifols
HOLX,HOLX:UW,BBG000C3P591,Amy Wendell Elected to Hologic Board of Directors,2016-12-16 13:18:08 +0000,http://www.publicnow.com/view/890A6E0BBF24A71B4E4290E5B77C5BB28AA72F00,"[at noodls] - MARLBOROUGH, Mass., Dec. 16, 2016/PRNewswire / -- Hologic, Inc. (Nasdaq: HOLX) announced today that Amy Wendellhas been elected to the Company's Board of Directors, effective December 14. Ms. Wendell also ..."
HOLX,HOLX:UW,BBG000C3P591,"HOLOGIC INC Files SEC form 8-K, Change in Directors or Principal Officers, Financial Statements and Exhibits",2016-12-16 13:04:17 +0000,http://biz.yahoo.com/e/161216/holx8-k.html,"HOLOGIC INC Files SEC form 8-K, Change in Directors or Principal Officers, Financial Statements and Exhibits"
HOLX,HOLX:UW,BBG000C3P591,Hologic Still A Buy After Getting 'Lofty' Price For Blood-Screening Unit,2016-12-15 21:42:12 +0000,http://www.investors.com/news/technology/hologic-in-buy-zone-after-divesting-slowing-blood-screening-unit/,Hologic Still A Buy After Getting 'Lofty' Price For Blood-Screening Unit
HOLX,HOLX:UW,BBG000C3P591,Hologic Hits 52-Week High on Q4 Earnings & Solid Prospects,2016-12-15 16:01:36 +0000,http://articlefeeds.nasdaq.com/~r/nasdaq/symbols/~3/JH7N-I2gmME/hologic-hits-52-week-high-on-q4-earnings-solid-prospects-cm721862,Share price of Bedford MA based Hologic Inc HOLX reached a new 52 week high of 41 01 on Dec 14 finally closing a tad lower at 40 79 The stock rallied 5 4 year to date and added roughly 4 6 over the past one year The stock has a market cap of 11 4 billion 160 Over the last six
HOLX,HOLX:UW,BBG000C3P591,​Hologic sells out-of-state blood screening business for $1.85B,2016-12-15 16:00:45 +0000,http://www.bizjournals.com/boston/news/2016/12/15/hologic-sells-out-of-state-blood-screening.html?ana=yahoo,​Hologic sells out-of-state blood screening business for $1.85B
HOLX,HOLX:UW,BBG000C3P591,Hologic Hits 52-Week High on Q4 Earnings & Solid Prospects,2016-12-15 14:01:02 +0000,http://finance.yahoo.com/news/hologic-hits-52-week-high-140102603.html,Hologic Hits 52-Week High on Q4 Earnings & Solid Prospects
HOLX,HOLX:UW,BBG000C3P591,"HOLOGIC INC Files SEC form 8-K, Entry into a Material Definitive Agreement, Regulation FD Disclosure, Financial State",2016-12-15 11:03:25 +0000,http://biz.yahoo.com/e/161215/holx8-k.html,"HOLOGIC INC Files SEC form 8-K, Entry into a Material Definitive Agreement, Regulation FD Disclosure, Financial State"
HOLX,HOLX:UW,BBG000C3P591,Spain's Grifols says aims to refinance debt after $1.85 bln Hologic deal,2016-12-15 09:51:27 +0000,http://finance.yahoo.com/news/spains-grifols-says-aims-refinance-095127629.html,"[Reuters] - Spain's Grifols, which said late on Wednesday it would buy U.S. medical device maker Hologic Inc's side of their joint venture blood screening business for $1.85 billion, expects to refinance its debt once the deal is completed, its Chief Financing Officer said on Thursday. The Spanish company aims to get its net debt gearing down to three times earnings before interest, tax, depreciation and amortisation within a couple of years compared with 4.3 times after completing the acquisition, which is being financed by a $1.7 billion term loan. At the end of September the company's reported net debt stood at $3.99 billion, 3.3 times its EBITDA."
HOLX,HOLX:UW,BBG000C3P591,Spain's Grifols plans to refinance debt in first quarter 2017 after Hologic buy,2016-12-15 08:29:13 +0000,http://sg.finance.yahoo.com/news/spains-grifols-plans-refinance-debt-082913270.html,Spain's Grifols plans to refinance debt in first quarter 2017 after Hologic buy
HOLX,HOLX:UW,BBG000C3P591,Spain's Grifols plans to refinance debt in Q1 2017 after Hologic buy,2016-12-15 08:27:31 +0000,http://finance.yahoo.com/news/spains-grifols-plans-refinance-debt-082731058.html,"[Reuters] - Spain's Grifols, which on Wednesday said it would buy U.S. Hologic Inc's assets in their blood screening joint venture, will refinance its net debt in the first quarter of next year, its Chief Financing Officer said on Thursday. ""Assuming the market is okay ... we're convinced that we could go to the market and refinance our debt in the first quarter,"" Grifol's Chief Financing Officer Alfredo Arroyo told Reuters on Thursday."
HOLX,HOLX:UW,BBG000C3P591,Hologic Agrees to Sell Blood Screening Business to Grifols for $1.85B,2016-12-15 00:14:00 +0000,https://www.thestreet.com/story/13926549/1/hologic-agrees-to-sell-blood-screening-business-to-grifols-for-1-85b.html?puc=yahoo&cm_ven=YAHOO,Hologic Agrees to Sell Blood Screening Business to Grifols for $1.85B
HOLX,HOLX:UW,BBG000C3P591,Hologic To Sell Blood Screening Business To Grifols For $1.85 Bln,2016-12-14 23:01:00 +0000,http://articlefeeds.nasdaq.com/~r/nasdaq/symbols/~3/UjWquzWAoS8/hologic-to-sell-blood-screening-business-to-grifols-for-185-bln-20161214-01129,Hologic To Sell Blood Screening Business To Grifols For $1.85 Bln
HOLX,HOLX:UW,BBG000C3P591,Grifols to buy Hologic's stake in blood screening JV for $1.85 billion,2016-12-14 22:33:36 +0000,http://sg.finance.yahoo.com/news/grifols-buy-hologics-stake-blood-215226582.html,Grifols to buy Hologic's stake in blood screening JV for $1.85 billion
HOLX,HOLX:UW,BBG000C3P591,"After Hours: Diamondback Energy, Yahoo, United Tech, Hologic, Athenahealth, Pier One",2016-12-14 22:19:00 +0000,http://www.investors.com/news/after-hours-diamondback-energy-yahoo-hologic-athenahealth-pier-one/,"After Hours: Diamondback Energy, Yahoo, United Tech, Hologic, Athenahealth, Pier One"
HOLX,HOLX:UW,BBG000C3P591,Hologic to sell stake in blood screening unit for $1.85 bln,2016-12-14 21:43:10 +0000,http://www.marketwatch.com/News/Story/Story.aspx?guid=A9397F60-5C6A-4466-B0CC-3C5E72545A60&siteid=yhoof2,Hologic to sell stake in blood screening unit for $1.85 bln
HOLX,HOLX:UW,BBG000C3P591,"Grifols agrees to acquire Hologic's share of NAT donor screening unit for USD 1,850 million",2016-12-14 21:15:00 +0000,http://finance.yahoo.com/news/grifols-agrees-acquire-hologics-share-211500589.html,"[PR Newswire] - BARCELONA, Spain, Dec. 14, 2016 /PRNewswire/ -- Grifols entered into an agreement to acquire Hologic's (Nasdaq: HOLX) interest in their existing joint-business under which Grifols owns all customer facing ..."
HOLX,HOLX:UW,BBG000C3P591,Hologic to Divest Blood Screening Business to Partner Grifols for $1.85 Billion,2016-12-14 21:01:00 +0000,http://finance.yahoo.com/news/hologic-divest-blood-screening-business-210100450.html,"[PR Newswire] - MARLBOROUGH, Mass., Dec. 14, 2016 /PRNewswire/ -- Hologic, Inc. (HOLX) has entered into a definitive agreement to sell its share of its blood screening business to long-time commercial partner, Grifols (MCE: GRF, MCE: GRF.P and NASDAQ: GRFS), for gross proceeds of $1.85 billion in cash, the Company announced today. The transaction has been approved by the boards of directors of both companies."
HOLX,HOLX:UW,BBG000C3P591,Grifols To Buy Hologic's NAT Donor Screening Unit For $1.85 Bln,2016-12-14 17:07:00 +0000,http://articlefeeds.nasdaq.com/~r/nasdaq/symbols/~3/Kb8KmTR2IwQ/grifols-to-buy-hologics-nat-donor-screening-unit-for-185-bln-20161214-01005,Grifols To Buy Hologic's NAT Donor Screening Unit For $1.85 Bln
HOLX,HOLX:UW,BBG000C3P591,"New High Analysis: Tile Shop, Hologic, Citrix Systems Near Buy Points",2016-12-13 21:34:21 +0000,http://www.investors.com/stock-lists/new-highs/new-high-analysis-tile-shop-hologic-citrix-systems-near-buy-points/,"New High Analysis: Tile Shop, Hologic, Citrix Systems Near Buy Points"
HOLX,HOLX:UW,BBG000C3P591,"ETFs with exposure to Hologic, Inc. : December 13, 2016",2016-12-13 17:59:55 +0000,http://www.capitalcube.com/blog/index.php/etfs-with-exposure-to-hologic-inc-december-13-2016/,"ETFs with exposure to Hologic, Inc. : December 13, 2016"
HOLX,HOLX:UW,BBG000C3P591,Whole Foods (WFM) Will No Longer be Part of Nasdaq-100,2016-12-12 16:00:12 +0000,http://articlefeeds.nasdaq.com/~r/nasdaq/symbols/~3/LGK-GH-u9Qc/whole-foods-wfm-will-no-longer-be-part-of-nasdaq-100-cm719993,As a result of the annual re ranking of the NASDAQ 100 index Whole Foods Market Inc WFM will cease to be part of the same The change will be effective from Dec 19 2016 The rebalancing is carried out every year in December During the course NASDAQ evaluates its components compares
HOLX,HOLX:UW,BBG000C3P591,Bed Bath and Beyond (BBBY) Loses its Place in Nasdaq-100,2016-12-12 15:00:48 +0000,http://articlefeeds.nasdaq.com/~r/nasdaq/symbols/~3/ThmKqscOBgM/bed-bath-and-beyond-bbby-loses-its-place-in-nasdaq-100-cm719952,The NASDAQ 100 Index a pool of 100 of the largest domestic and international non financial companies listed on The Nasdaq Stock Market based on market capitalization as part of its annual re ranking process has decided to remove Bed Bath amp Beyond Inc BBBY This decision will take
HOLX,HOLX:UW,BBG000C3P591,Annual Changes to the NASDAQ-100 Index,2016-12-10 01:00:00 +0000,http://finance.yahoo.com/news/annual-changes-nasdaq-100-index-010000347.html,"[GlobeNewswire] - NEW YORK, Dec. 09, 2016-- Nasdaq today announced the results of the annual re-ranking of the NASDAQ-100 Index ®, which will become effective prior to market open on Monday, December 19, 2016.. The following ..."
HOLX,HOLX:UW,BBG000C3P591,Hedge Funds Are Crazy About SL Green Realty Corp (SLG),2016-12-07 12:02:35 +0000,http://www.insidermonkey.com/blog/hedge-funds-are-crazy-about-sl-green-realty-corp-slg-499783/,Hedge Funds Are Crazy About SL Green Realty Corp (SLG)
HOLX,HOLX:UW,BBG000C3P591,"What This Metric Says About Hologic, Inc. (HOLX)",2016-12-04 22:08:07 +0000,http://www.insidermonkey.com/blog/what-this-metric-says-about-hologic-inc-holx-491782/,"What This Metric Says About Hologic, Inc. (HOLX)"
HOLX,HOLX:UW,BBG000C3P591,"Hologic, Inc. breached its 50 day moving average in a Bearish Manner : HOLX-US : December 2, 2016",2016-12-02 12:46:46 +0000,http://www.capitalcube.com/blog/index.php/hologic-inc-breached-its-50-day-moving-average-in-a-bearish-manner-holx-us-december-2-2016/,"Hologic, Inc. breached its 50 day moving average in a Bearish Manner : HOLX-US : December 2, 2016"
HOLX,HOLX:UW,BBG000C3P591,Post Earnings Coverage as Medtronic Adjusted EPS Grows 15%,2016-12-01 13:15:00 +0000,http://finance.yahoo.com/news/post-earnings-coverage-medtronic-adjusted-131500151.html,"[Accesswire] - Upcoming AWS Coverage on Hologic Post-Earnings Results LONDON, UK / ACCESSWIRE / December 1, 2016 / Active Wall St. announces its post-earnings coverage on Medtronic PLC (NYSE: MDT ). The company released ..."
HOLX,HOLX:UW,BBG000C3P591,Hologic To Present At Piper Jaffray Healthcare Conference; Webcast At 9:00 AM ET,2016-11-30 08:00:00 +0000,http://articlefeeds.nasdaq.com/~r/nasdaq/symbols/~3/sFidYd6OhwM/hologic-to-present-at-piper-jaffray-healthcare-conference-webcast-at-900-am-et-20161130-00349,Hologic To Present At Piper Jaffray Healthcare Conference; Webcast At 9:00 AM ET
HOLX,HOLX:UW,BBG000C3P591,Hedge Funds Aren’t Crazy About Discovery Communications Inc. (DISCK) Anymore,2016-11-30 06:28:02 +0000,http://www.insidermonkey.com/blog/hedge-funds-arent-crazy-about-discovery-communications-inc-disck-anymore-494678/,Hedge Funds Aren’t Crazy About Discovery Communications Inc. (DISCK) Anymore
HOLX,HOLX:UW,BBG000C3P591,"HOLOGIC INC Files SEC form 8-K, Change in Directors or Principal Officers",2016-11-28 21:09:25 +0000,http://biz.yahoo.com/e/161128/holx8-k.html,"HOLOGIC INC Files SEC form 8-K, Change in Directors or Principal Officers"
HOLX,HOLX:UW,BBG000C3P591,Cramer: These deals will happen before year-end,2016-11-28 17:56:00 +0000,http://finance.yahoo.com/video/cramer-deals-happen-end-175600606.html,Cramer: These deals will happen before year-end
HOLX,HOLX:UW,BBG000C3P591,Is LKQ Corporation (LKQ) Right For Your Portfolio?,2016-11-26 01:14:23 +0000,http://www.insidermonkey.com/blog/is-lkq-corporation-lkq-right-for-your-portfolio-491969/,Is LKQ Corporation (LKQ) Right For Your Portfolio?
HOLX,HOLX:UW,BBG000C3P591,Hologic to Showcase Award-Winning Breast Screening and Interventional Solutions at RSNA 2016,2016-11-25 13:00:00 +0000,http://finance.yahoo.com/news/hologic-showcase-award-winning-breast-130000875.html,"[PR Newswire] - MARLBOROUGH, Mass., Nov. 25, 2016 /PRNewswire/ -- Hologic, Inc. (Nasdaq: HOLX) will highlight its portfolio of innovative, award-winning breast cancer screening and interventional products, including the ..."
HOLX,HOLX:UW,BBG000C3P591,"ETFs with exposure to Hologic, Inc. : November 23, 2016",2016-11-23 18:05:08 +0000,http://www.capitalcube.com/blog/index.php/etfs-with-exposure-to-hologic-inc-november-23-2016/,"ETFs with exposure to Hologic, Inc. : November 23, 2016"
HOLX,HOLX:UW,BBG000C3P591,"Hologic, Inc. :HOLX-US: Earnings Analysis: 2016 By the Numbers : November 22, 2016",2016-11-22 13:38:23 +0000,http://www.capitalcube.com/blog/index.php/hologic-inc-holx-us-earnings-analysis-2016-by-the-numbers-november-22-2016/,"Hologic, Inc. :HOLX-US: Earnings Analysis: 2016 By the Numbers : November 22, 2016"
HOLX,HOLX:UW,BBG000C3P591,American Society for Radiation Oncology (ASTRO) Publishes New Evidence-Based Consensus Statement on Accelerated Partial Breast Irradiation (APBI),2016-11-18 17:00:05 +0000,http://www.publicnow.com/view/B533E21FDD454E18CC34186A975F300B1CC80776,"[at noodls] - --Hologic Applauds ASTRO for Expanding Patient Access to More Targeted, Less Time-Consuming Breast Cancer Treatment Options-- MARLBOROUGH, Mass., November 18, 2016 /PRNewswire / -- Hologic Inc. (Nasdaq: ..."
HOLX,HOLX:UW,BBG000C3P591,Hologic To Participate In Canaccord Genuity Medical Forum At 1:00 PM ET,2016-11-17 12:00:00 +0000,http://articlefeeds.nasdaq.com/~r/nasdaq/symbols/~3/ts8PhDTzJNY/hologic-to-participate-in-canaccord-genuity-medical-forum-at-100-pm-et-20161117-00857,Hologic To Participate In Canaccord Genuity Medical Forum At 1:00 PM ET
HOLX,HOLX:UW,BBG000C3P591,"HOLOGIC INC Files SEC form 10-K, Annual Report",2016-11-17 11:27:10 +0000,http://biz.yahoo.com/e/161117/holx10-k.html,"HOLOGIC INC Files SEC form 10-K, Annual Report"
HOLX,HOLX:UW,BBG000C3P591,Hologic To Present At Stifel 2016 Healthcare Conference; Webcast At 2:15 PM ET,2016-11-16 13:15:00 +0000,http://articlefeeds.nasdaq.com/~r/nasdaq/symbols/~3/VgncnSiXBYY/hologic-to-present-at-stifel-2016-healthcare-conference-webcast-at-215-pm-et-20161116-00925,Hologic To Present At Stifel 2016 Healthcare Conference; Webcast At 2:15 PM ET
HOLX,HOLX:UW,BBG000C3P591,Hologic Obtains European CE Mark for Aptima® Assay to Detect Herpes Simplex Virus 1 & 2,2016-11-15 13:18:06 +0000,http://www.publicnow.com/view/8BCADA61F3FD8AD947645F9B0CEF30AB0561BA6B,"[at noodls] - --Highly Accurate HSV Test Now Available Alongside Women's Health Menu on the Fully Automated Panther System-- MARLBOROUGH, Mass. (November 15, 2016) - Hologic, Inc. (Nasdaq: HOLX) announced today that ..."
HOLX,HOLX:UW,BBG000C3P591,Hologic Launches Next-Generation NovaSure® ADVANCED Global Endometrial Ablation System to Enhance the Treatment of Abnormal Uterine Bleeding,2016-11-14 13:07:05 +0000,http://www.publicnow.com/view/205A75BCC7F963702BD3A022FC201EE263C7408E,"[at noodls] - --Smaller 6mm Diameter and Other Product Enhancements are Designed to Increase Patient Comfort and Improve Physician Ease-of-Use-- MARLBOROUGH, Mass. November 14, 2016 -- Hologic, Inc. (Nasdaq: HOLX) today ..."
HOLX,HOLX:UW,BBG000C3P591,Hologic Obtains Canadian Approval for Aptima® Hepatitis C and B Quant Assays,2016-11-10 18:21:12 +0000,http://www.publicnow.com/view/007FF3719C4A5579BB569A95FB87B411B6822C2C,"[at noodls] - --Highly Accurate Viral Load Tests Complete Virology Offering in Canada and Complement Women's Health Menu on the Fully Automated Panther System-- MARLBOROUGH, MA (November 10, 2016) - Hologic, Inc. (Nasdaq: ..."
HOLX,HOLX:UW,BBG000C3P591,[$$] Siemens: healthy cynicism,2016-11-10 17:42:39 +0000,"http://www.ft.com/cms/s/19d35c12-a75b-11e6-8b69-02899e8bd9d1,s01=1.html?ftcamp=traffic/partner/feed_headline/us_yahoo/auddev","[at Financial Times] - Why announce that a business is to be separately listed but provide no detail on timing, free float or method of separation? Perhaps to engineer a share price pop. If that was the intention, it certainly ..."
HOLX,HOLX:UW,BBG000C3P591,Hologic Obtains Canadian Approval for Aptima® Hepatitis C and B Quant Assays,2016-11-10 13:00:00 +0000,http://finance.yahoo.com/news/hologic-obtains-canadian-approval-aptima-130000899.html,[CNW Group] - Hologic Obtains Canadian Approval for Aptima® Hepatitis C and B Quant Assays
HOLX,HOLX:UW,BBG000C3P591,"HOLOGIC INC Files SEC form 8-K, Other Events, Financial Statements and Exhibits",2016-11-09 21:20:56 +0000,http://biz.yahoo.com/e/161109/holx8-k.html,"HOLOGIC INC Files SEC form 8-K, Other Events, Financial Statements and Exhibits"
HOLX,HOLX:UW,BBG000C3P591,Hologic Announces Upcoming Put Option and Notice of Redemption of 2.00% Convertible Exchange Senior Notes Due 2037,2016-11-09 21:11:28 +0000,http://www.publicnow.com/view/A36539A2E6117B5E64EC226DAFEE74E1849B8FF1,"[at noodls] - MARLBOROUGH, Mass., Nov. 9, 2016/PRNewswire / -- Hologic, Inc. (Nasdaq: HOLX) announced today that holders of the 2.00% Convertible Exchange Senior Notes due 2037 (CUSIP No. 436440 AB7) issued November ..."
HOLX,HOLX:UW,BBG000C3P591,5 Healthcare Stocks Kahn Brothers Is Bullish On,2016-11-08 13:44:21 +0000,http://www.insidermonkey.com/blog/5-healthcare-stocks-kahn-brothers-is-bullish-on-485758/,5 Healthcare Stocks Kahn Brothers Is Bullish On
HOLX,HOLX:UW,BBG000C3P591,"Hologic, Inc. breached its 50 day moving average in a Bullish Manner : HOLX-US : November 8, 2016",2016-11-08 12:59:00 +0000,http://www.capitalcube.com/blog/index.php/hologic-inc-breached-its-50-day-moving-average-in-a-bullish-manner-holx-us-november-8-2016/,"Hologic, Inc. breached its 50 day moving average in a Bullish Manner : HOLX-US : November 8, 2016"
HOLX,HOLX:UW,BBG000C3P591,Hologic to Webcast Presentations at Upcoming Investor Conferences,2016-11-07 21:20:32 +0000,http://www.publicnow.com/view/9F4451CE62D19C6B0270B37AC1B1DCD7DC80782F,"[at noodls] - MARLBOROUGH, Mass., Nov. 7, 2016/PRNewswire / -- Hologic, Inc. (Nasdaq: HOLX) announced today that the Company will present at three upcoming investor conferences: The Stifel 2016 Healthcare Conference ..."
HOLX,HOLX:UW,BBG000C3P591,"ETF’s with exposure to Hologic, Inc. : November 7, 2016",2016-11-07 17:31:15 +0000,http://www.capitalcube.com/blog/index.php/etfs-with-exposure-to-hologic-inc-november-7-2016/,"ETF’s with exposure to Hologic, Inc. : November 7, 2016"
HOLX,HOLX:UW,BBG000C3P591,11 improving health-care companies whose stocks are loved by analysts,2016-11-04 18:17:59 +0000,http://www.marketwatch.com/News/Story/Story.aspx?guid=B5AB84B4-9BA5-11E6-A1F3-C7B5B4B04643&siteid=yhoof2,11 improving health-care companies whose stocks are loved by analysts
HOLX,HOLX:UW,BBG000C3P591,"Hologic, Inc. :HOLX-US: Earnings Analysis: Q4, 2016 By the Numbers : November 4, 2016",2016-11-04 14:20:57 +0000,http://www.capitalcube.com/blog/index.php/hologic-inc-holx-us-earnings-analysis-q4-2016-by-the-numbers-november-4-2016/,"Hologic, Inc. :HOLX-US: Earnings Analysis: Q4, 2016 By the Numbers : November 4, 2016"
HOLX,HOLX:UW,BBG000C3P591,Seegene and Hologic Form Worldwide Collaboration to Develop High Multiplex Molecular Diagnostic Assays,2016-11-04 13:00:00 +0000,http://finance.yahoo.com/news/seegene-hologic-form-worldwide-collaboration-130000383.html,"[PR Newswire] - SEOUL, South Korea, Nov. 4, 2016 /PRNewswire/ -- Seegene Inc. (096530.KQ) today announced it has entered into a worldwide collaboration agreement with Hologic (Nasdaq: HOLX) to develop and supply high ..."
HOLX,HOLX:UW,BBG000C3P591,Icahn Told Me Activism No Longer Needed at Hologic: CEO,2016-11-03 21:39:03 +0000,http://finance.yahoo.com/video/icahn-told-activism-no-longer-213903821.html,Icahn Told Me Activism No Longer Needed at Hologic: CEO
HOLX,HOLX:UW,BBG000C3P591,"Hologic (HOLX) Tops Q4 Earnings, Revenues; Issues '17 View",2016-11-03 13:10:23 +0000,http://articlefeeds.nasdaq.com/~r/nasdaq/symbols/~3/MRoEF6i_LsA/hologic-holx-tops-q4-earnings-revenues-issues-17-view-cm703069,Hologic Inc HOLX reported fourth quarter fiscal 2016 adjusted earnings per share EPS of 52 cents up 20 9 year over year Adjusted EPS also beat the Zacks Consensus Estimate by 4 and exceeded the company guidance of 49 50 cents Management believes the company s additional
HOLX,HOLX:UW,BBG000C3P591,"Hologic (HOLX) Tops Q4 Earnings, Revenues; Issues '17 View",2016-11-03 11:09:11 +0000,http://finance.yahoo.com/news/hologic-holx-tops-q4-earnings-110911959.html,"Hologic (HOLX) Tops Q4 Earnings, Revenues; Issues '17 View"
HOLX,HOLX:UW,BBG000C3P591,Edited Transcript of HOLX earnings conference call or presentation 2-Nov-16 8:30pm GMT,2016-11-03 01:14:38 +0000,http://finance.yahoo.com/news/edited-transcript-holx-earnings-conference-011438719.html,Edited Transcript of HOLX earnings conference call or presentation 2-Nov-16 8:30pm GMT
HOLX,HOLX:UW,BBG000C3P591,Hologic tops Street 4Q forecasts,2016-11-02 21:05:52 +0000,http://sg.finance.yahoo.com/news/hologic-tops-street-4q-forecasts-210552151.html,Hologic tops Street 4Q forecasts
HOLX,HOLX:UW,BBG000C3P591,Hologic Announces Financial Results for Fourth Quarter of Fiscal 2016,2016-11-02 20:10:42 +0000,http://www.publicnow.com/view/DCE7098AE0FAD25405ED77972EA9B5E1C1F7B7C6,"[at noodls] - - GAAP Diluted EPS of $0.33 Increases 266.7%, Non-GAAP Diluted EPS of $0.52 Increases 20.9% - - In Fiscal 2017, Company Expects Mid-Single-Digit Revenue Growth, EPS Growth Roughly Double this Rate - MARLBOROUGH, ..."
