HOLX,HOLX:UW,BBG000C3P591,Hologic (HOLX) Up 3.5% Since Earnings Report: Can It Continue?,2017-06-14 09:31:09 +0000,https://finance.yahoo.com/news/hologic-holx-3-5-since-093109910.html?.tsrc=rss,Hologic (HOLX) reported earnings 30 days ago. What&apos;s next for the stock? We take a look at earnings estimates for some clues.
HOLX,HOLX:UW,BBG000C3P591,Hologic To Participate In Goldman Sachs Healthcare Conference At 11:00 AM ET,2017-06-13 10:00:00 +0000,http://articlefeeds.nasdaq.com/~r/nasdaq/symbols/~3/1sAN6w9Umec/hologic-to-participate-in-goldman-sachs-healthcare-conference-at-1100-am-et-20170613-00770,Hologic To Participate In Goldman Sachs Healthcare Conference At 11:00 AM ET
HOLX,HOLX:UW,BBG000C3P591,Hologic Wins FDA Approval for Genius 3D Mammography Exam,2017-06-08 16:32:20 +0000,http://articlefeeds.nasdaq.com/~r/nasdaq/symbols/~3/UWfsrkUxuKE/hologic-wins-fda-approval-for-genius-3d-mammography-exam-cm800684,A leading player in the field of women s health Hologic Inc HOLX continues to expand its Breast and Skeletal Health business through innovation and product development As a major breakthrough the company has declared the receipt of FDA approval for its Genius 160 3D Mammography 160
HOLX,HOLX:UW,BBG000C3P591,Hologic Wins FDA Approval for Genius 3D Mammography Exam,2017-06-08 13:52:01 +0000,https://finance.yahoo.com/news/hologic-wins-fda-approval-genius-135201718.html?.tsrc=rss,"Hologic, Inc. (HOLX) continues to expand its Breast and Skeletal Health business through innovation and product development."
HOLX,HOLX:UW,BBG000C3P591,FDA Approves Hologic's Genius™ 3D Mammography™ Exam as the Only Mammogram Superior for Women with Dense Breasts*,2017-06-07 12:00:00 +0000,https://finance.yahoo.com/news/fda-approves-hologics-genius-3d-120000407.html?.tsrc=rss,"The Genius exam has been commercially available in the United States since 2011, and the newly approved physician labeling is based on clinical studies proving that the exam improves invasive breast cancer detection while reducing unnecessary recalls among women of all breast densities, including those with dense breasts.  Between 40 and 50 percent of women ages 40 to 74 have dense breasts.2,3 Density is only identifiable on a mammogram or other imaging modalities, and reflects how much fibrous or glandular tissue is in the breast."
HOLX,HOLX:UW,BBG000C3P591,FDA Oks Hologic's Genius 3D Mammography Exam As Superior To 2D Mammography,2017-06-07 08:14:00 +0000,http://articlefeeds.nasdaq.com/~r/nasdaq/symbols/~3/P6r1SkM74n4/fda-oks-hologics-genius-3d-mammography-exam-as-superior-to-2d-mammography-20170607-00444,FDA Oks Hologic's Genius 3D Mammography Exam As Superior To 2D Mammography
HOLX,HOLX:UW,BBG000C3P591,Hologic To Present At Jefferies Healthcare Conference; Webcast At 8:30 AM ET,2017-06-06 07:30:00 +0000,http://articlefeeds.nasdaq.com/~r/nasdaq/symbols/~3/FzrvmQ9qHZ8/hologic-to-present-at-jefferies-healthcare-conference-webcast-at-830-am-et-20170606-00329,Hologic To Present At Jefferies Healthcare Conference; Webcast At 8:30 AM ET
HOLX,HOLX:UW,BBG000C3P591,"ETFs with exposure to Hologic, Inc. : June 2, 2017",2017-06-02 18:12:36 +0000,http://finance.yahoo.com/r/a72eebcf-993c-34d4-9877-e402328cefa0/etfs-with-exposure-to-hologic-inc-june-2-2017?yptr=yahoo&.tsrc=rss,"Categories:  ETFs Yahoo FinanceClick here to see latest analysis ETFs with exposure to Hologic, Inc. Here are 5 ETFs with the largest exposure to HOLX-US. Comparing the performance and risk of Hologic, Inc. with the ETFs that have exposure to it gives us some ETF choices that could give us similar returns with lower volatility. Ticker Fund Name ... Read more
<b>(Read more...)</b>"
HOLX,HOLX:UW,BBG000C3P591,"Hologic, Inc. :HOLX-US: Earnings Analysis: Q2, 2017 By the Numbers : June 1, 2017",2017-06-01 13:38:00 +0000,http://finance.yahoo.com/r/03872f42-9397-35b2-bfb6-ee0160088ea7/hologic-inc-holx-us-earnings-analysis-q2-2017-by-the-numbers-june-1-2017?yptr=yahoo&.tsrc=rss,"Categories:  Yahoo FinanceGet free summary analysis Hologic, Inc. reports financial results for the quarter ended March 31, 2017. We analyze the earnings along side the following peers of Hologic, Inc. – Thermo Fisher Scientific Inc., Becton, Dickinson and Company, C. R. Bard, Inc., Boston Scientific Corporation, Abbott Laboratories, Johnson & Johnson, Quest Diagnostics Incorporated, General Electric Company ... Read more
<b>(Read more...)</b>"
HOLX,HOLX:UW,BBG000C3P591,Post Earnings Coverage as Hologic's Q2 Results Outperformed Expectations,2017-05-26 12:15:00 +0000,https://finance.yahoo.com/news/post-earnings-coverage-hologics-q2-121500328.html?.tsrc=rss,"Upcoming AWS Coverage on Masimo Post-Earnings Results LONDON, UK / ACCESSWIRE / May 26, 2017 / Active Wall St. announces its post-earnings coverage on Hologic, Inc. (NASDAQ: HOLX ). The Company announced ..."
HOLX,HOLX:UW,BBG000C3P591,"Hologic, Inc. breached its 50 day moving average in a Bullish Manner : HOLX-US : May 26, 2017",2017-05-26 12:14:15 +0000,http://finance.yahoo.com/r/711f455b-c55e-3c3d-b663-712ec0390909/hologic-inc-breached-its-50-day-moving-average-in-a-bullish-manner-holx-us-may-26-2017?yptr=yahoo&.tsrc=rss,"Categories:  ETFs Yahoo FinanceClick here to see latest analysis *Disclaimer : This is as of previous day’s closing price. Technical Indicators Below is a quick look at 5 technical indicators for Hologic, Inc.. More studies are available on the Technical Chart. Indicator Signal Closing Price above/below 50 Day Moving Average Bullish Closing Price above/below 200 Day Moving Average ... Read more
<b>(Read more...)</b>"
HOLX,HOLX:UW,BBG000C3P591,Halyard Health (HYH) Expands CORGRIP System Product Line,2017-05-23 17:14:27 +0000,http://articlefeeds.nasdaq.com/~r/nasdaq/symbols/~3/ngHfyF3lEGQ/halyard-health-hyh-expands-corgrip-system-product-line-cm793407,Alpharetta GA based Halyard Health HYH a leading medical technology company recently announced the expansion of its CORGRIP Nasogastric Nasointestinal NG NI Tube Retention System product line Per the announcement the company introduced CORGRIP compatible for use with sump tubes up to
HOLX,HOLX:UW,BBG000C3P591,Envision (EVHC) Acquires Gwinnett Emergency Specialists,2017-05-23 17:14:12 +0000,http://articlefeeds.nasdaq.com/~r/nasdaq/symbols/~3/8ZJpZyz00js/envision-evhc-acquires-gwinnett-emergency-specialists-cm793403,Envision Healthcare Corporation EVHC a provider of physician led outsourced medical services to consumers hospitals and healthcare systems in the U S recently announced the acquisition of Gwinnett Emergency Specialists P C Stock Performance The price performance of
HOLX,HOLX:UW,BBG000C3P591,Hologic (HOLX) Poised on Balanced Growth Amid Currency Woes,2017-05-23 16:17:40 +0000,http://articlefeeds.nasdaq.com/~r/nasdaq/symbols/~3/5Xcl-rGFBRE/hologic-holx-poised-on-balanced-growth-amid-currency-woes-cm793352,On May 23 we issued an updated research report on Bedford MA based Hologic Inc HOLX a provider of diagnostics medical imaging systems and surgical products which caters to the healthcare needs of women The company currently carries a Zacks Rank 3 Hold Hologic
HOLX,HOLX:UW,BBG000C3P591,Envision (EVHC) Acquires Gwinnett Emergency Specialists,2017-05-23 15:17:03 +0000,https://finance.yahoo.com/news/envision-evhc-acquires-gwinnett-emergency-151703293.html?.tsrc=rss,"Envision Healthcare Corporation (EVHC) announced the acquisition of Gwinnett Emergency Specialists, P.C."
HOLX,HOLX:UW,BBG000C3P591,Halyard Health (HYH) Expands CORGRIP System Product Line,2017-05-23 15:10:03 +0000,https://finance.yahoo.com/news/halyard-health-hyh-expands-corgrip-151003542.html?.tsrc=rss,"Halyard Health (HYH), a leading medical technology company, recently announced the expansion of its CORGRIP Nasogastric/Nasointestinal Tube Retention System product line."
HOLX,HOLX:UW,BBG000C3P591,Hologic (HOLX) Poised on Balanced Growth Amid Currency Woes,2017-05-23 13:56:01 +0000,https://finance.yahoo.com/news/hologic-holx-poised-balanced-growth-135601432.html?.tsrc=rss,"On May 23, we issued an updated research report on Bedford, MA-based Hologic Inc. (HOLX)."
HOLX,HOLX:UW,BBG000C3P591,Hologic To Present At UBS Global Healthcare Conference; Webcast At 11:30 AM ET,2017-05-23 10:30:00 +0000,http://articlefeeds.nasdaq.com/~r/nasdaq/symbols/~3/MdWfFijAH1g/hologic-to-present-at-ubs-global-healthcare-conference-webcast-at-1130-am-et-20170523-00849,Hologic To Present At UBS Global Healthcare Conference; Webcast At 11:30 AM ET
HOLX,HOLX:UW,BBG000C3P591,Integra Lifesciences Hits 52-Week High on Product Launches,2017-05-22 20:13:49 +0000,http://articlefeeds.nasdaq.com/~r/nasdaq/symbols/~3/Ds87wVwzfyE/integra-lifesciences-hits-52-week-high-on-product-launches-cm792889,Share price of Plainsboro NJ based 160 Integra Lifesciences Corporation IART reached a new 52 week high of 47 50 on May 19 finally closing a tad lower at 47 39 The company gained 7 9 over the past three months much better than the S amp P 500 s 0 7 over the same period Average
HOLX,HOLX:UW,BBG000C3P591,Integra Lifesciences Hits 52-Week High on Product Launches,2017-05-22 17:55:05 +0000,https://finance.yahoo.com/news/integra-lifesciences-hits-52-week-175505099.html?.tsrc=rss,"Share price of Plainsboro NJ-based Integra Lifesciences Corporation (IART) reached a new 52-week high of $47.50 on May 19, finally closing a tad lower at $47.39."
HOLX,HOLX:UW,BBG000C3P591,Quest Diagnostics Poised on Solid Q1 Results Despite Woes,2017-05-22 14:16:30 +0000,http://articlefeeds.nasdaq.com/~r/nasdaq/symbols/~3/kuyXNK4yYv0/quest-diagnostics-poised-on-solid-q1-results-despite-woes-cm792489,On May 22 we issued an updated research report on Quest Diagnostics Inc DGX a major commercial laboratory services provider The stock currently carries a Zacks Rank 3 Hold Quest Diagnostics has significantly outperformed the Zacks categorized Medical Outpatient and Home
HOLX,HOLX:UW,BBG000C3P591,"Quality Systems (QSII) Beats Q4 Earnings, Issues FY18 View",2017-05-22 13:14:40 +0000,http://articlefeeds.nasdaq.com/~r/nasdaq/symbols/~3/Kkl2LjQau0w/quality-systems-qsii-beats-q4-earnings-issues-fy18-view-cm792526,Irvine CA based Quality Systems Inc QSII reported fourth quarter fiscal 2017 adjusted earnings of 18 cents per share exceeding the Zacks Consensus Estimate by a penny Earnings remained flat on a year over year basis Coming to fourth quarter revenues Quality Systems posted revenues
HOLX,HOLX:UW,BBG000C3P591,Intuitive Surgical at 52-Week High: What's Driving the Stock?,2017-05-22 13:14:33 +0000,http://articlefeeds.nasdaq.com/~r/nasdaq/symbols/~3/pQJ7RXke_c8/intuitive-surgical-at-52-week-high-whats-driving-the-stock-cm792522,Share price of Sunnyvale CA based Intuitive Surgical Inc ISRG scaled a new 52 week high of 874 54 on May 19 eventually closing a bit lower at 870 33 The company has gained 38 5 over the past one year much better than the S amp P 500 s 16 3 Average volume of shares traded over the
HOLX,HOLX:UW,BBG000C3P591,Quest Diagnostics Poised on Solid Q1 Results Despite Woes,2017-05-22 12:35:12 +0000,https://finance.yahoo.com/news/quest-diagnostics-poised-solid-q1-123512139.html?.tsrc=rss,"On May 22, we issued an updated research report on Quest Diagnostics, Inc. (DGX), a major commercial laboratory services provider."
HOLX,HOLX:UW,BBG000C3P591,Intuitive Surgical at 52-Week High: What&apos;s Driving the Stock?,2017-05-22 11:52:11 +0000,https://finance.yahoo.com/news/intuitive-surgical-52-week-high-115211950.html?.tsrc=rss,"Share price of Sunnyvale, CA-based Intuitive Surgical Inc (ISRG) scaled a new 52-week high of $874.54 on May 19, eventually closing a bit lower at $870.33."
HOLX,HOLX:UW,BBG000C3P591,"Quality Systems (QSII) Beats Q4 Earnings, Issues FY18 View",2017-05-22 11:48:11 +0000,https://finance.yahoo.com/news/quality-systems-qsii-beats-q4-114811327.html?.tsrc=rss,"Irvine, CA-based Quality Systems Inc. (QSII) reported fourth-quarter fiscal 2017 adjusted earnings of 18 cents per share, exceeding the Zacks Consensus Estimate by a penny. Earnings remained flat on a year-over-year basis."
HOLX,HOLX:UW,BBG000C3P591,Halyard Health-Sustainable Solutions Ink License Agreement,2017-05-19 16:15:58 +0000,http://articlefeeds.nasdaq.com/~r/nasdaq/symbols/~3/V-AHjaRcYt4/halyard-health-sustainable-solutions-ink-license-agreement-cm791981,Alpharetta GA based Halyard Health HYH a leading medical technology company recently announced a new license and supply agreement with Sustainable Solutions The license agreement is aimed at converting recycled HALYARD Wrap into an environment friendly product for healthcare facilities
HOLX,HOLX:UW,BBG000C3P591,"McKesson (MCK) Beats Earnings Estimate in Q4, Revenues Miss",2017-05-19 16:15:52 +0000,http://articlefeeds.nasdaq.com/~r/nasdaq/symbols/~3/6IBv8FWgi1A/mckesson-mck-beats-earnings-estimate-in-q4-revenues-miss-cm791980,McKesson Corporation MCK reported fourth quarter fiscal 2017 ended Mar 31 2017 earnings of 3 39 per share beating the Zacks Consensus Estimate of 3 04 Earnings also came above the year ago figure of 2 44 Revenues improved 4 year over year to 48 7 billion but failed to meet
HOLX,HOLX:UW,BBG000C3P591,Medtronic (MDT) RESOLUTE ONYX Meets Primary Study Endpoint,2017-05-19 16:12:27 +0000,http://articlefeeds.nasdaq.com/~r/nasdaq/symbols/~3/0mF1tyB5mO0/medtronic-mdt-resolute-onyx-meets-primary-study-endpoint-cm791925,One of the world s largest medical technology services and solutions companies Medtronic plc MDT recently announced favorable outcome on its Resolute Onyx Drug Eluting Stent DES In a late breaking trial session at the EuroPCR the company revealed that Resolute Onyx DES met its
HOLX,HOLX:UW,BBG000C3P591,"Hill Rom Impresses with Q2 Results, Strategic Initiatives",2017-05-19 15:17:56 +0000,http://articlefeeds.nasdaq.com/~r/nasdaq/symbols/~3/vX7Iexckhuk/hill-rom-impresses-with-q2-results-strategic-initiatives-cm791877,On May 18 we issued an updated research report on Hill Rom Holdings Inc HRC The stock currently has a Zacks Rank 2 Buy Hill Rom posted stellar second quarter fiscal 2017 results with earnings and revenues exceeding the respective Zacks Consensus Estimate The company saw
HOLX,HOLX:UW,BBG000C3P591,Medtronic (MDT) RESOLUTE ONYX Meets Primary Study Endpoint,2017-05-19 14:19:02 +0000,https://finance.yahoo.com/news/medtronic-mdt-resolute-onyx-meets-141902815.html?.tsrc=rss,Medtronic plc (MDT) recently announced favorable outcome on its Resolute Onyx Drug-Eluting Stent.
HOLX,HOLX:UW,BBG000C3P591,Mazor Robotics at a 52-Week High: What's Driving the Stock?,2017-05-19 14:15:53 +0000,http://articlefeeds.nasdaq.com/~r/nasdaq/symbols/~3/nB7aXZDarRU/mazor-robotics-at-a-52-week-high-whats-driving-the-stock-cm791890,Shares of Israel based developer of robotic technology and products Mazor Robotics Ltd MZOR rallied to a new 52 week high of 45 64 on May 18 eventually closing a little lower at 42 68 This represents a strong one year return of about 185 much better than the S amp P 500 s return
HOLX,HOLX:UW,BBG000C3P591,"McKesson (MCK) Beats Earnings Estimate in Q4, Revenues Miss",2017-05-19 13:47:01 +0000,https://finance.yahoo.com/news/mckesson-mck-beats-earnings-estimate-134701850.html?.tsrc=rss,"McKesson Corporation (MCK) reported fourth-quarter fiscal 2017 earnings of $3.39 per share, beating the Zacks Consensus Estimate of $3.04."
HOLX,HOLX:UW,BBG000C3P591,Halyard Health-Sustainable Solutions Ink License Agreement,2017-05-19 13:46:01 +0000,https://finance.yahoo.com/news/halyard-health-sustainable-solutions-ink-134601989.html?.tsrc=rss,Halyard Health (HYH) announced a new license and supply agreement with Sustainable Solutions. The license agreement is aimed at converting recycled HALYARD Wrap into an environment friendly product for healthcare facilities.
HOLX,HOLX:UW,BBG000C3P591,"Hill Rom Impresses with Q2 Results, Strategic Initiatives",2017-05-19 13:00:01 +0000,https://finance.yahoo.com/news/hill-rom-impresses-q2-results-130001737.html?.tsrc=rss,"On May 18, we issued an updated research report on Hill Rom Holdings, Inc. (HRC)."
HOLX,HOLX:UW,BBG000C3P591,Mazor Robotics at a 52-Week High: What&apos;s Driving the Stock?,2017-05-19 12:54:12 +0000,https://finance.yahoo.com/news/mazor-robotics-52-week-high-125412150.html?.tsrc=rss,"Shares of Israel-based developer of robotic technology and products, Mazor Robotics Ltd. (MZOR), rallied to a new 52-week high of $45.64 on May 18."
HOLX,HOLX:UW,BBG000C3P591,Exactech (EXAC) Gets FDA Approval for ExactechGPS Application,2017-05-18 17:13:14 +0000,http://articlefeeds.nasdaq.com/~r/nasdaq/symbols/~3/yEKvYfqMuoc/exactech-exac-gets-fda-approval-for-exactechgps-application-cm791365,Gainesville FL based Exactech Inc EXAC recently announced that it has received clearance from the U S Food and Drug Administration to market its proprietary ExactechGPS Shoulder Application in US For the past three months Exactech has been trading above the Zacks categorized
HOLX,HOLX:UW,BBG000C3P591,Medtronic's MyCareLink Data on Older Patients Found Positive,2017-05-18 15:17:20 +0000,http://articlefeeds.nasdaq.com/~r/nasdaq/symbols/~3/nCl5G9zHr3Q/medtronics-mycarelink-data-on-older-patients-found-positive-cm791196,Leading medical device player Medtronic plc MDT recently released favorable data on its app based remote cardiac monitoring The study which was presented at the Heart Rhythm 2017 evaluated 5 595 patients with Medtronic pacemakers who were assigned a MyCareLink Smart app based remote
HOLX,HOLX:UW,BBG000C3P591,Boston Scientific's Symetis Buyout Boosts Structural Heart,2017-05-18 15:16:36 +0000,http://articlefeeds.nasdaq.com/~r/nasdaq/symbols/~3/YF9lP6Jp6RY/boston-scientifics-symetis-buyout-boosts-structural-heart-cm791173,Medical device major Boston Scientific Corporation BSX recently completed the acquisition of Switzerland based Symetis SA The buyout valued at 435 million in upfront cash should fortify Boston Scientific s structural heart business in Europe We note that Symetis is a privately
HOLX,HOLX:UW,BBG000C3P591,Exactech (EXAC) Gets FDA Approval for ExactechGPS Application,2017-05-18 14:54:02 +0000,https://finance.yahoo.com/news/exactech-exac-gets-fda-approval-145402594.html?.tsrc=rss,Exactech Inc. (EXAC) recently announced that it has received clearance from the U.S. Food and Drug Administration to market its proprietary ExactechGPS Shoulder Application in US.
HOLX,HOLX:UW,BBG000C3P591,Boston Scientific&apos;s Symetis Buyout Boosts Structural Heart,2017-05-18 13:32:01 +0000,https://finance.yahoo.com/news/boston-scientific-apos-symetis-buyout-133201174.html?.tsrc=rss,Boston Scientific Corporation (BSX) recently completed the acquisition of Switzerland-based Symetis SA.
HOLX,HOLX:UW,BBG000C3P591,Medtronic&apos;s MyCareLink Data on Older Patients Found Positive,2017-05-18 13:28:01 +0000,https://finance.yahoo.com/news/medtronic-apos-mycarelink-data-older-132801980.html?.tsrc=rss,Medtronic plc (MDT) recently released favorable data on its app-based remote cardiac monitoring.
HOLX,HOLX:UW,BBG000C3P591,"Halyard Health Announces New Drainage System, Stock Down",2017-05-18 11:31:11 +0000,https://finance.yahoo.com/news/halyard-health-announces-drainage-system-113111609.html?.tsrc=rss,"Halyard Health (HYH), a leading medical technology company, recently announced the availability of the Halyard Enteral Drainage System, a significant addition to the company&apos;s comprehensive portfolio of enteral feeding products."
HOLX,HOLX:UW,BBG000C3P591,Eaton Vance Worldwide Health Sciences Fund Adds 4 Companies,2017-05-17 20:30:57 +0000,https://finance.yahoo.com/news/eaton-vance-worldwide-health-sciences-203057093.html?.tsrc=rss,Health care fund reports quarterly portfolio
HOLX,HOLX:UW,BBG000C3P591,Boston Scientific Hits a 52-Week High on Solid Prospects,2017-05-17 13:25:01 +0000,https://finance.yahoo.com/news/boston-scientific-hits-52-week-132501382.html?.tsrc=rss,"Share price of Natick, MA-based Boston Scientific Corporation (BSX) reached a new 52-week high of $26.76 on May 16, eventually closing a bit lower at $26.48."
HOLX,HOLX:UW,BBG000C3P591,"Abbott Lab Well Poised on Strong EPD, St. Jude Integration",2017-05-17 13:17:01 +0000,https://finance.yahoo.com/news/abbott-lab-well-poised-strong-131701428.html?.tsrc=rss,"On May 17, we issued an updated research report on Abbott Laboratories (ABT)."
HOLX,HOLX:UW,BBG000C3P591,"Genomic Health Q1 Results Weak, Cancer Test Business Strong",2017-05-17 13:01:01 +0000,https://finance.yahoo.com/news/genomic-health-q1-results-weak-130101331.html?.tsrc=rss,"On May 16, we issued an updated research report on Redwood City, CA-based Genomic Health Inc. (GHDX)."
HOLX,HOLX:UW,BBG000C3P591,Edwards Lifesciences SAPIEN 3 Heart Valve Data Positive,2017-05-17 12:59:12 +0000,https://finance.yahoo.com/news/edwards-lifesciences-sapien-3-heart-125912946.html?.tsrc=rss,Edwards Lifesciences Corporation (EW) recently unveiled positive one-year data on its SAPIEN 3 transcatheter heart valve.
HOLX,HOLX:UW,BBG000C3P591,Blog Coverage: Boston Scientific Completes Symetis Acquisition; Views TAVI Portfolio Expansion through the Agreement,2017-05-17 12:15:00 +0000,https://finance.yahoo.com/news/blog-coverage-boston-scientific-completes-121500175.html?.tsrc=rss,"Upcoming AWS Coverage on Hologic Post-Earnings Results LONDON, UK / ACCESSWIRE / May 17, 2017 / Active Wall St. blog coverage looks at the headline from Boston Scientific Corp. (NYSE: BSX ) as the Company ..."
HOLX,HOLX:UW,BBG000C3P591,Edited Transcript of HOLX earnings conference call or presentation 10-May-17 8:30pm GMT,2017-05-17 09:10:53 +0000,https://finance.yahoo.com/news/edited-transcript-holx-earnings-conference-030649876.html?.tsrc=rss,Q2 2017 Hologic Inc Earnings Call
HOLX,HOLX:UW,BBG000C3P591,Charles J. Dockendorff Elected to Hologic Board of Directors,2017-05-16 20:01:00 +0000,https://finance.yahoo.com/news/charles-j-dockendorff-elected-hologic-200100881.html?.tsrc=rss,"MARLBOROUGH, Mass., May 16, 2017 /PRNewswire/ -- Hologic, Inc. (HOLX) announced today that Charles J. Dockendorff has been elected to the Company's Board of Directors, effective immediately.  Mr. Dockendorff also was appointed to the Company's Audit and Finance Committee."
HOLX,HOLX:UW,BBG000C3P591,Evolent Health (EVH) Prices 7M Follow-On Share Offering,2017-05-16 17:16:26 +0000,http://articlefeeds.nasdaq.com/~r/nasdaq/symbols/~3/SAiNF4QL5RU/evolent-health-evh-prices-7m-follow-on-share-offering-cm790029,Arlington VA based Evolent Health Inc EVH recently announced the pricing of its follow on public offering of 7 5 million shares of Class A common stock at 24 65 per share The company provides integrated value based care platform to health systems and physician organizations
HOLX,HOLX:UW,BBG000C3P591,"Hologic, Inc. – Value Analysis (NASDAQ:HOLX) : May 16, 2017",2017-05-16 17:11:08 +0000,http://finance.yahoo.com/r/a13bb9f6-970b-3e2a-b627-6924a7bcd9ab/hologic-inc-value-analysis-nasdaqholx-may-16-2017?yptr=yahoo&.tsrc=rss,"Categories:  Fundamental Analysis Yahoo FinanceClick here to see latest analysis Capitalcube gives Hologic, Inc. a score of 50. Our analysis is based on comparing Hologic, Inc. with the following peers – Thermo Fisher Scientific Inc., Becton, Dickinson and Company, C. R. Bard, Inc., Boston Scientific Corporation, Abbott Laboratories, Johnson & Johnson, Quest Diagnostics Incorporated, General Electric Company and Royal ... Read more
<b>(Read more...)</b>"
HOLX,HOLX:UW,BBG000C3P591,Genomic Health's (GHDX) Oncotype DX GPS Test Data Positive,2017-05-16 16:20:55 +0000,http://articlefeeds.nasdaq.com/~r/nasdaq/symbols/~3/4BoGJSpCB0E/genomic-healths-ghdx-oncotype-dx-gps-test-data-positive-cm790001,Genomic Health Inc GHDX a global cancer company recently presented positive results for its Oncotype DX Genomic Prostate Score GPS test The test was conducted at Oakland CA based integrated managed care consortium Kaiser Permanente The findings confirmed that the GPS test as
HOLX,HOLX:UW,BBG000C3P591,Evolent Health (EVH) Prices 7M Follow-On Share Offering,2017-05-16 15:15:03 +0000,https://finance.yahoo.com/news/evolent-health-evh-prices-7m-151503066.html?.tsrc=rss,"Evolent Health, Inc. (EVH) recently announced the pricing of its follow-on public offering of 7.5 million shares of Class A common stock at $24.65 per share."
HOLX,HOLX:UW,BBG000C3P591,"Thermo Fisher (TMO) to Buy Patheon, Expand in Biopharma",2017-05-16 14:22:16 +0000,http://articlefeeds.nasdaq.com/~r/nasdaq/symbols/~3/YS4mBWKz45A/thermo-fisher-tmo-to-buy-patheon-expand-in-biopharma-cm789803,Thermo Fisher Scientific Inc TMO a leading scientific instrument maker recently agreed to acquire Netherlands based Patheon N V PTHN The latter is a global provider of high quality drug solutions to pharmaceutical and biopharma sectors On completion of the deal Pantheon will become
HOLX,HOLX:UW,BBG000C3P591,"Teleflex to Introduce Arrow AC3 Optimus at EuroPCR, Paris",2017-05-16 14:21:36 +0000,http://articlefeeds.nasdaq.com/~r/nasdaq/symbols/~3/JYeJ61N7TmY/teleflex-to-introduce-arrow-ac3-optimus-at-europcr-paris-cm789924,Based in Wayne PA Teleflex Inc TFX a global provider of medical technologies recently announced plans to introduce Arrow AC3 Optimus Intra Aortic Balloon Pump IABP and a complex Percutaneous coronary intervention PCI product portfolio at the European Association for
HOLX,HOLX:UW,BBG000C3P591,Genomic Health&apos;s (GHDX) Oncotype DX GPS Test Data Positive,2017-05-16 13:41:01 +0000,https://finance.yahoo.com/news/genomic-health-apos-ghdx-oncotype-134101086.html?.tsrc=rss,"Genomic Health, Inc. (GHDX), a global cancer company, recently presented positive results for its Oncotype DX Genomic Prostate Score (GPS) test."
