MMSI,MMSI:UW,BBG000C435Z4,"Merit Medical Acquires Products From Argon Medical Devices and Catheter Connections, Inc.",2017-02-06 14:25:00 +0000,http://finance.yahoo.com/news/merit-medical-acquires-products-argon-142500510.html,"[GlobeNewswire] - SOUTH JORDAN, Utah, Feb. 06, 2017-- Merit Medical Systems, Inc., a leading manufacturer and marketer of proprietary disposable devices used primarily in cardiology, radiology and endoscopy, announced today ..."
MMSI,MMSI:UW,BBG000C435Z4,"Merit Medical Systems, Inc. breached its 50 day moving average in a Bearish Manner : MMSI-US : January 25, 2017",2017-01-25 13:47:31 +0000,http://www.capitalcube.com/blog/index.php/merit-medical-systems-inc-breached-its-50-day-moving-average-in-a-bearish-manner-mmsi-us-january-25-2017/,"Merit Medical Systems, Inc. breached its 50 day moving average in a Bearish Manner : MMSI-US : January 25, 2017"
MMSI,MMSI:UW,BBG000C435Z4,Merit Medical to Present at J.P. Morgan Healthcare Conference,2016-12-19 14:25:00 +0000,http://finance.yahoo.com/news/merit-medical-present-j-p-142500390.html,"[GlobeNewswire] - SOUTH JORDAN, Utah, Dec. 19, 2016-- Merit Medical Systems, Inc., a leading manufacturer and marketer of proprietary disposable devices used in interventional, diagnostic and therapeutic procedures, particularly ..."
MMSI,MMSI:UW,BBG000C435Z4,"ETFs with exposure to Merit Medical Systems, Inc. : December 12, 2016",2016-12-12 19:37:49 +0000,http://www.capitalcube.com/blog/index.php/etfs-with-exposure-to-merit-medical-systems-inc-december-12-2016/,"ETFs with exposure to Merit Medical Systems, Inc. : December 12, 2016"
MMSI,MMSI:UW,BBG000C435Z4,Merit Medical Hits 52-Week High: What's Driving the Stock?,2016-12-12 16:58:39 +0000,http://articlefeeds.nasdaq.com/~r/nasdaq/symbols/~3/9RY_F9MMFkA/merit-medical-hits-52-week-high-whats-driving-the-stock-cm720128,Share price of South Jordan UT based Merit Medical Systems Inc MMSI reached a fresh 52 week high of 26 80 on Dec 9 finally closing a tad lower at 26 60 Currently Merit Medical carries a Zacks Rank 3 Hold Among the major positives the stock rallied 43 9 over the past one
MMSI,MMSI:UW,BBG000C435Z4,Merit Medical Hits 52-Week High: What's Driving the Stock?,2016-12-12 14:53:02 +0000,http://finance.yahoo.com/news/merit-medical-hits-52-week-145302543.html,Merit Medical Hits 52-Week High: What's Driving the Stock?
MMSI,MMSI:UW,BBG000C435Z4,"Is Merit Medical Systems, Inc. (MMSI) A Good Stock To Buy?",2016-12-05 11:14:48 +0000,http://www.insidermonkey.com/blog/is-merit-medical-systems-inc-mmsi-a-good-stock-to-buy-2-497803/,"Is Merit Medical Systems, Inc. (MMSI) A Good Stock To Buy?"
MMSI,MMSI:UW,BBG000C435Z4,"ETFs with exposure to Merit Medical Systems, Inc. : November 22, 2016",2016-11-22 17:19:52 +0000,http://www.capitalcube.com/blog/index.php/etfs-with-exposure-to-merit-medical-systems-inc-november-22-2016/,"ETFs with exposure to Merit Medical Systems, Inc. : November 22, 2016"
MMSI,MMSI:UW,BBG000C435Z4,"Merit Medical Systems, Inc. breached its 50 day moving average in a Bullish Manner : MMSI-US : November 21, 2016",2016-11-21 12:09:29 +0000,http://www.capitalcube.com/blog/index.php/merit-medical-systems-inc-breached-its-50-day-moving-average-in-a-bullish-manner-mmsi-us-november-21-2016/,"Merit Medical Systems, Inc. breached its 50 day moving average in a Bullish Manner : MMSI-US : November 21, 2016"
MMSI,MMSI:UW,BBG000C435Z4,"MERIT MEDICAL SYSTEMS INC Files SEC form 10-Q, Quarterly Report",2016-11-09 21:01:19 +0000,http://biz.yahoo.com/e/161109/mmsi10-q.html,"MERIT MEDICAL SYSTEMS INC Files SEC form 10-Q, Quarterly Report"
MMSI,MMSI:UW,BBG000C435Z4,Merit Medical Receives 510(k) Clearance for the SwiftNINJA™ Steerable Microcatheter,2016-11-07 14:34:16 +0000,http://www.publicnow.com/view/9BF278B95DC54C6563187E6CEE061E47FDA1B282,"[at noodls] - SOUTH JORDAN, Utah, Nov. 07, 2016 (GLOBE NEWSWIRE) -- Merit Medical Systems, Inc. (NASDAQ:MMSI), a leading manufacturer and marketer of proprietary disposable devices used in interventional, diagnostic ..."
MMSI,MMSI:UW,BBG000C435Z4,"ETF’s with exposure to Merit Medical Systems, Inc. : November 2, 2016",2016-11-02 17:59:32 +0000,http://www.capitalcube.com/blog/index.php/etfs-with-exposure-to-merit-medical-systems-inc-november-2-2016/,"ETF’s with exposure to Merit Medical Systems, Inc. : November 2, 2016"
MMSI,MMSI:UW,BBG000C435Z4,Merit Medical to Present at Four Conferences in November,2016-11-01 20:01:00 +0000,http://finance.yahoo.com/news/merit-medical-present-four-conferences-200100321.html,"[GlobeNewswire] - Needham– November 10 Jefferies– November 16 Canaccord Genuity– November 17 Piper Jaffray– November 30. SOUTH JORDAN, Utah, Nov. 01, 2016-- Merit Medical Systems, Inc., a leading manufacturer and marketer ..."
MMSI,MMSI:UW,BBG000C435Z4,"Merit Medical Systems, Inc. :MMSI-US: Earnings Analysis: Q3, 2016 By the Numbers : October 31, 2016",2016-10-31 14:50:51 +0000,http://www.capitalcube.com/blog/index.php/merit-medical-systems-inc-mmsi-us-earnings-analysis-q3-2016-by-the-numbers-october-31-2016/,"Merit Medical Systems, Inc. :MMSI-US: Earnings Analysis: Q3, 2016 By the Numbers : October 31, 2016"
MMSI,MMSI:UW,BBG000C435Z4,Oversold Conditions For Merit Medical Systems,2016-10-27 21:43:06 +0000,http://articlefeeds.nasdaq.com/~r/nasdaq/symbols/~3/xo0ciVlWu6s/oversold-conditions-for-merit-medical-systems-cm699824,Legendary investor Warren Buffett advises to be fearful when others are greedy and be greedy when others are fearful One way we can try to measure the level of fear in a given stock is through a technical analysis indicator called the Relative Strength Index or RSI which measures momentum on
MMSI,MMSI:UW,BBG000C435Z4,Edited Transcript of MMSI earnings conference call or presentation 26-Oct-16 9:00pm GMT,2016-10-27 03:43:27 +0000,http://finance.yahoo.com/news/edited-transcript-mmsi-earnings-conference-034327162.html,Edited Transcript of MMSI earnings conference call or presentation 26-Oct-16 9:00pm GMT
MMSI,MMSI:UW,BBG000C435Z4,Merit Medical beats 3Q profit forecasts,2016-10-26 21:19:22 +0000,http://sg.finance.yahoo.com/news/merit-medical-beats-3q-profit-211922777.html,Merit Medical beats 3Q profit forecasts
MMSI,MMSI:UW,BBG000C435Z4,"MERIT MEDICAL SYSTEMS INC Files SEC form 8-K, Results of Operations and Financial Condition, Regulation FD Disclosure",2016-10-26 20:48:02 +0000,http://biz.yahoo.com/e/161026/mmsi8-k.html,"MERIT MEDICAL SYSTEMS INC Files SEC form 8-K, Results of Operations and Financial Condition, Regulation FD Disclosure"
MMSI,MMSI:UW,BBG000C435Z4,"Merit Medical Reports Sales Up 15.3% for the Quarter Ended September 30, 2016",2016-10-26 20:15:17 +0000,http://www.publicnow.com/view/E3534DC939B9F154BB3ECA40D2252A5B9D43944A,"[at noodls] - Q3 revenue of $157.0 million ($158.1 million on a comparable, constant currency basis), up 15.3% as reported (up 16.1% on a comparable, constant currency basis) over Q3 2015 Q3 core revenue up 8.9% over ..."
MMSI,MMSI:UW,BBG000C435Z4,Q3 2016 Merit Medical Systems Inc Earnings Release - After Market Close,2016-10-26 11:07:04 +0000,http://biz.yahoo.com/research/earncal/20161026.html?t=mmsi,Q3 2016 Merit Medical Systems Inc Earnings Release - After Market Close
MMSI,MMSI:UW,BBG000C435Z4,What's in Store for Merit Medical (MMSI) in Q3 Earnings?,2016-10-25 13:27:42 +0000,http://articlefeeds.nasdaq.com/~r/nasdaq/symbols/~3/_F6s19yOtSM/whats-in-store-for-merit-medical-mmsi-in-q3-earnings-cm697749,Headquartered in South Jordan Utah Merit Medical Systems Inc MMSI is set to report third quarter 2016 results on Oct 26 Last quarter the company posted earnings of 26 cents per share which surpassed the Zacks Consensus Estimate by 2 cents Notably on an average Merit Medical beat
MMSI,MMSI:UW,BBG000C435Z4,"Medical Product Earnings to Watch on Oct 26: BSX, LH & More",2016-10-25 13:27:01 +0000,http://articlefeeds.nasdaq.com/~r/nasdaq/symbols/~3/0PMKtV08tJs/medical-product-earnings-to-watch-on-oct-26-bsx-lh-more-cm697731,The Q3 earnings season is in full swing with 116 S amp P 500 members as per the latest Earnings Preview report having released their quarterly numbers as of Oct 21 Reported earnings are up 3 3 year over year on a 1 8 increase in revenues The beat ratio is 80 2 for earnings and 62 9
MMSI,MMSI:UW,BBG000C435Z4,"Medical Product Earnings to Watch on Oct 26: BSX, LH & More",2016-10-25 12:22:12 +0000,http://finance.yahoo.com/news/medical-product-earnings-watch-oct-122212857.html,"Medical Product Earnings to Watch on Oct 26: BSX, LH & More"
MMSI,MMSI:UW,BBG000C435Z4,What's in Store for Merit Medical (MMSI) in Q3 Earnings?,2016-10-25 11:54:11 +0000,http://finance.yahoo.com/news/whats-store-merit-medical-mmsi-115411246.html,What's in Store for Merit Medical (MMSI) in Q3 Earnings?
MMSI,MMSI:UW,BBG000C435Z4,"MERIT MEDICAL SYSTEMS INC Files SEC form 8-K, Other Events",2016-10-21 21:24:10 +0000,http://biz.yahoo.com/e/161021/mmsi8-k.html,"MERIT MEDICAL SYSTEMS INC Files SEC form 8-K, Other Events"
MMSI,MMSI:UW,BBG000C435Z4,Merit Medical Completes Enrollment in EVOLVE Study,2016-10-19 13:38:06 +0000,http://www.publicnow.com/view/15C337B344D1493655E792C6CCE3D4F3EA77F97E,"[at noodls] - SOUTH JORDAN, Utah, Oct. 19, 2016 (GLOBE NEWSWIRE) -- Merit Medical Systems, Inc. (NASDAQ:MMSI), a leading manufacturer and marketer of proprietary disposable devices used primarily in cardiology, radiology ..."
MMSI,MMSI:UW,BBG000C435Z4,Merit Medical Launches Super HeRO™ and HeRO™ Ally Products,2016-10-18 20:08:06 +0000,http://www.publicnow.com/view/C4E2D4DCBA9048B439D58238D3E68B0416FA6E65,"[at noodls] - SOUTH JORDAN, Utah, Oct. 18, 2016 (GLOBE NEWSWIRE) -- Merit Medical Systems, Inc. (NASDAQ:MMSI), a leading manufacturer and marketer of proprietary disposable devices used primarily in cardiology, radiology ..."
MMSI,MMSI:UW,BBG000C435Z4,"Merit Medical Systems, Inc. breached its 50 day moving average in a Bearish Manner : MMSI-US : October 17, 2016",2016-10-17 12:47:26 +0000,http://www.capitalcube.com/blog/index.php/merit-medical-systems-inc-breached-its-50-day-moving-average-in-a-bearish-manner-mmsi-us-october-17-2016/,"Merit Medical Systems, Inc. breached its 50 day moving average in a Bearish Manner : MMSI-US : October 17, 2016"
MMSI,MMSI:UW,BBG000C435Z4,"Merit Medical Systems to Announce Third Quarter Results on October 26, 2016",2016-10-04 13:48:06 +0000,http://www.publicnow.com/view/FE1747D73D4EC602F4844B4CD17E86A0D4F7B73C,"[at noodls] - SOUTH JORDAN, Utah, Oct. 04, 2016 (GLOBE NEWSWIRE) -- Merit Medical Systems, Inc. (NASDAQ:MMSI), a leading manufacturer and marketer of proprietary disposable devices used primarily in cardiology, radiology ..."
MMSI,MMSI:UW,BBG000C435Z4,"Merit Medical Systems, Inc. – Value Analysis (NASDAQ:MMSI) : September 28, 2016",2016-09-28 14:34:23 +0000,http://www.capitalcube.com/blog/index.php/merit-medical-systems-inc-value-analysis-nasdaqmmsi-september-28-2016/,"Merit Medical Systems, Inc. – Value Analysis (NASDAQ:MMSI) : September 28, 2016"
MMSI,MMSI:UW,BBG000C435Z4,"Merit Medical Systems, Inc. breached its 50 day moving average in a Bearish Manner : MMSI-US : September 27, 2016",2016-09-27 12:32:21 +0000,http://www.capitalcube.com/blog/index.php/merit-medical-systems-inc-breached-its-50-day-moving-average-in-a-bearish-manner-mmsi-us-september-27-2016/,"Merit Medical Systems, Inc. breached its 50 day moving average in a Bearish Manner : MMSI-US : September 27, 2016"
MMSI,MMSI:UW,BBG000C435Z4,"Henry Schein (HSIC) Grows Through Acquisitions, Runs Risks",2016-09-26 15:25:31 +0000,http://articlefeeds.nasdaq.com/~r/nasdaq/symbols/~3/qn4Q2oH1DJk/henry-schein-hsic-grows-through-acquisitions-runs-risks-cm684472,On Sep 22 we issued an updated research report on Melville NY based Henry Schein Inc HSIC a leading distributor of health care products and services across the globe We are disappointed by Henry Schein s guidance cut for 2016 EPS Also foreign currency fluctuations and
MMSI,MMSI:UW,BBG000C435Z4,"Henry Schein (HSIC) Grows Through Acquisitions, Runs Risks",2016-09-26 13:04:01 +0000,http://finance.yahoo.com/news/henry-schein-hsic-grows-acquisitions-130401052.html,"Henry Schein (HSIC) Grows Through Acquisitions, Runs Risks"
MMSI,MMSI:UW,BBG000C435Z4,"LabCorp: Strong Fundamentals, Sequenom Buyout Raise Hope",2016-09-23 14:24:09 +0000,http://articlefeeds.nasdaq.com/~r/nasdaq/symbols/~3/4CFkG5708FA/labcorp-strong-fundamentals-sequenom-buyout-raise-hope-cm683681,On Sep 20 2016 we issued an updated research report on Laboratory Corporation of America Holdings LH or LabCorp a leading independent clinical laboratory company It is currently working on portfolio expansion The company is more focused on the high margin esoteric testing business to
MMSI,MMSI:UW,BBG000C435Z4,Medtronic (MDT): Valiant Captivia Data Positive at Three Years,2016-09-23 14:23:53 +0000,http://articlefeeds.nasdaq.com/~r/nasdaq/symbols/~3/PhQQMceh90Y/medtronic-mdt-valiant-captivia-data-positive-at-three-years-cm683673,Medtronic plc MDT recently unveiled favorable three year clinical outcome demonstrating the durability and clinical efficacy of its Valiant Captivia Thoracic Stent Graft System in patients with acute complicated Type B aortic dissection This development should help Medtronic further
MMSI,MMSI:UW,BBG000C435Z4,Medtronic (MDT): Valiant Captivia Data Positive at Three Years,2016-09-23 12:43:12 +0000,http://finance.yahoo.com/news/medtronic-mdt-valiant-captivia-data-124312150.html,Medtronic (MDT): Valiant Captivia Data Positive at Three Years
MMSI,MMSI:UW,BBG000C435Z4,"MERIT MEDICAL SYSTEMS INC Files SEC form 8-K/A, Financial Statements and Exhibits",2016-09-21 20:09:24 +0000,http://biz.yahoo.com/e/160921/mmsi8-k_a.html,"MERIT MEDICAL SYSTEMS INC Files SEC form 8-K/A, Financial Statements and Exhibits"
MMSI,MMSI:UW,BBG000C435Z4,Align Technology: Invisalign Growth Continues Globally,2016-09-21 14:24:46 +0000,http://articlefeeds.nasdaq.com/~r/nasdaq/symbols/~3/EF6C-VnCLOA/align-technology-invisalign-growth-continues-globally-cm682500,On Sep 20 2016 we issued an updated research report on California based Align Technology Inc ALGN a developer of aligner therapy intra oral scanners and CAD CAM computer aided design and computer aided manufacturing digital services Currently Align carries a Zacks Rank 2
MMSI,MMSI:UW,BBG000C435Z4,Merit Medical Receives 510(K) Clearance for the Elation® Pulmonary Dilation Balloon,2016-09-07 13:49:06 +0000,http://www.publicnow.com/view/683C8049FDF89AC9C463811E7C3E7ADC0717D64A,"[at noodls] - SOUTH JORDAN, Utah, Sept. 07, 2016 (GLOBE NEWSWIRE) -- Merit Medical Systems, Inc. (NASDAQ:MMSI), a leading manufacturer and marketer of proprietary disposable devices used in interventional, diagnostic ..."
MMSI,MMSI:UW,BBG000C435Z4,"Henry Schein Poised on Strategic Buyouts, Pricing Hurts",2016-09-01 13:22:54 +0000,http://articlefeeds.nasdaq.com/~r/nasdaq/symbols/~3/IBSZH-2T6Nw/henry-schein-poised-on-strategic-buyouts-pricing-hurts-cm673277,On Sep 1 we issued an updated research report on Melville NY based Henry Schein Inc HSIC a leading distributor of health care products and services across the globe The company currently carries a Zacks Rank 3 Hold Henry Schein stands to gain from several trends in its end
MMSI,MMSI:UW,BBG000C435Z4,Merit Medical to Present at Five Conferences,2016-08-25 13:25:00 +0000,http://finance.yahoo.com/news/merit-medical-present-five-conferences-132500495.html,"[GlobeNewswire] - Wells Fargo– September 7 Barrington- September 8 CL King– September 12 Morgan Stanley– September 13 Credit Suisse– September 14. SOUTH JORDAN, Utah, Aug. 25, 2016-- Merit Medical Systems, Inc., a leading ..."
MMSI,MMSI:UW,BBG000C435Z4,Merit Medical (MMSI) Now a Strong Buy on Estimate Revisions,2016-08-24 10:47:26 +0000,http://articlefeeds.nasdaq.com/~r/nasdaq/symbols/~3/sItiYTwfhWw/merit-medical-mmsi-now-a-strong-buy-on-estimate-revisions-cm668967,"On Aug 23, Zacks Investment Research raised Merit Medical Systems Inc.MMSI to a Zacks Rank #1 (Strong Buy) on estimate revisions.Why the Upgrade?  The upgrade was primarily driven by estimate revisions over the last 30 days."
MMSI,MMSI:UW,BBG000C435Z4,Merit Medical (MMSI) Now a Strong Buy on Estimate Revisions,2016-08-23 14:00:02 +0000,http://finance.yahoo.com/news/merit-medical-mmsi-now-strong-140002632.html,Merit Medical (MMSI) Now a Strong Buy on Estimate Revisions
MMSI,MMSI:UW,BBG000C435Z4,Endologix's Ovation Alto System Treats First Patients,2016-08-22 14:47:38 +0000,http://articlefeeds.nasdaq.com/~r/nasdaq/symbols/~3/ePWW8QD9vLE/endologixs-ovation-alto-system-treats-first-patients-cm668356,"Medical device manufacturer, Endologix, Inc.ELGX recently announced the treatment of the first two abdominal aortic aneurysms (""AAA"") patients with its yet to be released Ovation Alto Abdominal Stent Graft System. Notably, the Ovation Alto Abdominal Stent Graft"
MMSI,MMSI:UW,BBG000C435Z4,Endologix's Ovation Alto System Treats First Patients,2016-08-22 13:00:01 +0000,http://finance.yahoo.com/news/endologixs-ovation-alto-system-treats-130001666.html,Endologix's Ovation Alto System Treats First Patients
MMSI,MMSI:UW,BBG000C435Z4,"Merit Medical Systems, Inc. :MMSI-US: Earnings Analysis: Q2, 2016 By the Numbers : August 9, 2016",2016-08-09 16:04:46 +0000,http://www.capitalcube.com/blog/index.php/merit-medical-systems-inc-mmsi-us-earnings-analysis-q2-2016-by-the-numbers-august-9-2016/,"Merit Medical Systems, Inc. :MMSI-US: Earnings Analysis: Q2, 2016 By the Numbers : August 9, 2016"
MMSI,MMSI:UW,BBG000C435Z4,"MERIT MEDICAL SYSTEMS INC Files SEC form 10-Q, Quarterly Report",2016-08-08 21:28:20 +0000,http://biz.yahoo.com/e/160808/mmsi10-q.html,"MERIT MEDICAL SYSTEMS INC Files SEC form 10-Q, Quarterly Report"
MMSI,MMSI:UW,BBG000C435Z4,"PerkinElmer (PKI) Beats Q2 Earnings, FY16 View Maintained",2016-08-05 21:15:25 +0000,http://articlefeeds.nasdaq.com/~r/nasdaq/symbols/~3/Y_szknFb5ew/perkinelmer-pki-beats-q2-earnings-fy16-view-maintained-cm661317,"PerkinElmer IncPKI reported second quarter 2016 earnings of 67 cents per share, which beat the Zacks Consensus Estimate by a penny. Additionally, the figure was better than the management's guided range of 65 66 cents. Earnings also increased 11.7%"
MMSI,MMSI:UW,BBG000C435Z4,"DENTSPLY (XRAY) Beats Q2 Earnings, FY16 View Maintained",2016-08-05 21:14:54 +0000,http://articlefeeds.nasdaq.com/~r/nasdaq/symbols/~3/8diCuUhteEE/dentsply-xray-beats-q2-earnings-fy16-view-maintained-cm661351,"DENTSPLY SIRONA Inc.XRAY reported adjusted earnings of 76 cents per share in the second quarter of 2016, which beat the Zacks Consensus Estimate by 6 cents. Earnings improved 4.1% on a year over year basis, primarily driven by strong"
MMSI,MMSI:UW,BBG000C435Z4,"Becton, Dickinson (BDX) Tops Q3 Earnings, FY16 View Up",2016-08-04 14:58:55 +0000,http://articlefeeds.nasdaq.com/~r/nasdaq/symbols/~3/qpudug_9--A/becton-dickinson-bdx-tops-q3-earnings-fy16-view-up-cm660301,"Becton, Dickinson and CompanyBDX , popularly known as BD, reported third quarter fiscal 2016 earnings of $2.35 per share, which beat the Zacks Consensus Estimate by 16 cents and surged 19.5% on currency neutral basis.Quarter Details At comparable currency"
MMSI,MMSI:UW,BBG000C435Z4,"Cardinal Health (CAH) Tops Q4 Earnings, '17 View Impressive",2016-08-02 22:56:32 +0000,http://articlefeeds.nasdaq.com/~r/nasdaq/symbols/~3/S4TSuPHe0ms/cardinal-health-cah-tops-q4-earnings-17-view-impressive-cm659210,"Cardinal Health Inc. CAH reported fourth quarter fiscal 2016 adjusted earnings of $1.14 per share, which beat the Zacks Consensus Estimate by a penny and increased 14% on a year over year basis. The upside was driven by 14%"
MMSI,MMSI:UW,BBG000C435Z4,Merit Medical to Present at Two Conferences,2016-08-01 13:41:02 +0000,http://www.publicnow.com/view/6B196D51CDF1631D005E800E70EC65252FEB893D,"[at noodls] - Canaccord Genuity - August 11 Wedbush - August 17 SOUTH JORDAN, Utah, Aug. 01, 2016 (GLOBE NEWSWIRE) -- Merit Medical Systems, Inc. (NASDAQ:MMSI), a leading manufacturer and marketer of proprietary disposable ..."
MMSI,MMSI:UW,BBG000C435Z4,Merit Medical downgraded by Barrington Research,2016-07-28 15:09:48 +0000,http://finance.yahoo.com/q/ud?s=MMSI,Merit Medical downgraded by Barrington Research
MMSI,MMSI:UW,BBG000C435Z4,"MERIT MEDICAL SYSTEMS INC Files SEC form 8-K/A, Regulation FD Disclosure, Financial Statements and Exhibits",2016-07-28 10:02:20 +0000,http://biz.yahoo.com/e/160728/mmsi8-k_a.html,"MERIT MEDICAL SYSTEMS INC Files SEC form 8-K/A, Regulation FD Disclosure, Financial Statements and Exhibits"
MMSI,MMSI:UW,BBG000C435Z4,Edited Transcript of MMSI earnings conference call or presentation 27-Jul-16 9:00pm GMT,2016-07-28 03:42:47 +0000,http://finance.yahoo.com/news/edited-transcript-mmsi-earnings-conference-034247329.html,Edited Transcript of MMSI earnings conference call or presentation 27-Jul-16 9:00pm GMT
MMSI,MMSI:UW,BBG000C435Z4,Merit Medical tops Street 2Q forecasts,2016-07-27 21:17:44 +0000,http://sg.finance.yahoo.com/news/merit-medical-tops-street-2q-211744001.html,Merit Medical tops Street 2Q forecasts
MMSI,MMSI:UW,BBG000C435Z4,Merit Medical Systems Inc Earnings Call scheduled for 5:00 pm ET today,2016-07-27 21:00:00 +0000,http://biz.yahoo.com/cc/8/152778.html,Merit Medical Systems Inc Earnings Call scheduled for 5:00 pm ET today
MMSI,MMSI:UW,BBG000C435Z4,"MERIT MEDICAL SYSTEMS INC Files SEC form 8-K, Results of Operations and Financial Condition, Change in Directors or P",2016-07-27 20:45:01 +0000,http://biz.yahoo.com/e/160727/mmsi8-k.html,"MERIT MEDICAL SYSTEMS INC Files SEC form 8-K, Results of Operations and Financial Condition, Change in Directors or P"
MMSI,MMSI:UW,BBG000C435Z4,"Merit Medical Reports Sales Up 9.4% for the Quarter Ended June 30, 2016",2016-07-27 20:28:11 +0000,http://www.publicnow.com/view/C08310B39003760C26D1870D0DE88780BB4E536B,"[at noodls] - Q2 revenue of $151.1 million ($151.7 million in constant currency), up 9.4% as reported, up 9.9% on a comparable, constant currency basis, over Q2 2015 YTD revenue of $289.1 million ($291.7 million in ..."
MMSI,MMSI:UW,BBG000C435Z4,Merit Medical Systems Q2 16 Earnings Conference Call At 5:00 PM ET,2016-07-27 15:00:00 +0000,http://articlefeeds.nasdaq.com/~r/nasdaq/symbols/~3/BPNzetxyALc/merit-medical-systems-q2-16-earnings-conference-call-at-500-pm-et-20160727-01101,Merit Medical Systems Q2 16 Earnings Conference Call At 5:00 PM ET
MMSI,MMSI:UW,BBG000C435Z4,Marvell Technology Group Q1 17 Earnings Conference Call At 4:45 PM ET,2016-07-27 15:00:00 +0000,http://articlefeeds.nasdaq.com/~r/nasdaq/symbols/~3/4XZ_EfRDFuE/marvell-technology-group-q1-17-earnings-conference-call-at-445-pm-et-20160727-01102,Marvell Technology Group Q1 17 Earnings Conference Call At 4:45 PM ET
MMSI,MMSI:UW,BBG000C435Z4,Q2 2016 Merit Medical Systems Inc Earnings Release - After Market Close,2016-07-27 11:07:05 +0000,http://biz.yahoo.com/research/earncal/20160727.html?t=mmsi,Q2 2016 Merit Medical Systems Inc Earnings Release - After Market Close
MMSI,MMSI:UW,BBG000C435Z4,Merit Medical Announces Appointment of New Director,2016-07-26 20:18:11 +0000,http://www.publicnow.com/view/330D9E20EA6FB45FCDC7F78A7DD3E543D78EE9AE,"[at noodls] - SOUTH JORDAN, Utah, July 26, 2016 (GLOBE NEWSWIRE) -- Merit Medical Systems, Inc. (NASDAQ:MMSI), a leading manufacturer and marketer of proprietary disposable medical devices used in interventional, diagnostic ..."
MMSI,MMSI:UW,BBG000C435Z4,Why Cryolife Inc's Shares Turned Hot Today,2016-07-26 18:23:38 +0000,http://articlefeeds.nasdaq.com/~r/nasdaq/symbols/~3/ZX8sv0cu-Pg/why-cryolife-incs-shares-turned-hot-today-cm655042,On X aortic heart valve. Image source  CryoLife  What  CryoLife (NYSE  CRY) is up 14% at 12 30 p.m. EDT after reporting second quarter earnings and increasing its 2016 guidance Tuesday.
MMSI,MMSI:UW,BBG000C435Z4,Why Cryolife Inc's Shares Turned Hot Today,2016-07-26 17:04:00 +0000,http://www.fool.com/investing/2016/07/26/why-cryolife-incs-shares-were-hot-today.aspx?source=yahoo-2&utm_campaign=article&utm_medium=feed&utm_source=yahoo-2,Why Cryolife Inc's Shares Turned Hot Today
MMSI,MMSI:UW,BBG000C435Z4,"Dental Stock Earnings Queued Up for Jul 27: MCK, LH & More",2016-07-26 14:28:52 +0000,http://articlefeeds.nasdaq.com/~r/nasdaq/symbols/~3/k0Oc1di8KKg/dental-stock-earnings-queued-up-for-jul-27-mck-lh-more-cm654856,"The current week (Jul 25 29) will be witness to a plethora of earnings releases as most of the bigwigs are lined up to report their quarterly numbers. Almost 1000 companies are slated to report their financial numbers, including"
MMSI,MMSI:UW,BBG000C435Z4,"Dental Stock Earnings Queued Up for Jul 27: MCK, LH & More",2016-07-26 12:55:12 +0000,http://finance.yahoo.com/news/dental-stock-earnings-queued-jul-125512658.html,"Dental Stock Earnings Queued Up for Jul 27: MCK, LH & More"
MMSI,MMSI:UW,BBG000C435Z4,"ETF’s with exposure to Merit Medical Systems, Inc. : July 21, 2016",2016-07-21 18:15:32 +0000,http://www.capitalcube.com/blog/index.php/etfs-with-exposure-to-merit-medical-systems-inc-july-21-2016/,"ETF’s with exposure to Merit Medical Systems, Inc. : July 21, 2016"
MMSI,MMSI:UW,BBG000C435Z4,Street Talk: Big analyst calls,2016-07-19 18:24:00 +0000,http://finance.yahoo.com/video/street-talk-big-analyst-calls-182400245.html,Street Talk: Big analyst calls
MMSI,MMSI:UW,BBG000C435Z4,"Merit Medical Systems to Announce Second Quarter Results on July 27, 2016",2016-07-14 13:28:07 +0000,http://www.publicnow.com/view/8B741505395D3FBC47C49B2E0AC4FB3E82B17811,"[at noodls] - SOUTH JORDAN, Utah, July 14, 2016 (GLOBE NEWSWIRE) -- Merit Medical Systems, Inc. (NASDAQ:MMSI), a leading manufacturer and marketer of proprietary disposable devices used primarily in cardiology, radiology ..."
