MYL,MYL:UW,BBG000BPQMX8,Mylan CEO infuriates lawmakers at hearing on EpiPen costs,2016-09-22 07:30:00 +0000,http://sg.finance.yahoo.com/news/mylan-ceo-infuriates-lawmakers-hearing-073000673.html,Mylan CEO infuriates lawmakers at hearing on EpiPen costs
MYL,MYL:UW,BBG000BPQMX8,Mylan CEO Faces Tough Questioning in Congressional EpiPen Hearing,2016-09-22 04:38:25 +0000,http://www.wsj.com/articles/mylan-ceo-to-shift-blame-on-epipen-pricing-at-house-hearing-1474466910?ru=yahoo?mod=yahoo_itp,Mylan CEO Faces Tough Questioning in Congressional EpiPen Hearing
MYL,MYL:UW,BBG000BPQMX8,PRESS DIGEST - Wall Street Journal - Sept 22,2016-09-22 04:16:56 +0000,http://finance.yahoo.com/news/press-digest-wall-street-journal-041656292.html,"[Reuters] - The following are the top stories in the Wall Street Journal. - The U.S. Federal Reserve left short-term interest rates unchanged Wednesday but signaled it still expected to raise them before year-end, reaching a temporary truce among officials divided over when to withdraw financial stimulus from the economy. - Mylan NV Chief Executive Heather Bresch faced tough questioning Wednesday from Republicans and Democrats in Congress probing price increases for the EpiPen allergy treatment."
MYL,MYL:UW,BBG000BPQMX8,Generic EpiPen delays are surprising: Investor,2016-09-22 03:31:00 +0000,http://finance.yahoo.com/video/generic-epipen-delays-surprising-investor-033100703.html,Generic EpiPen delays are surprising: Investor
MYL,MYL:UW,BBG000BPQMX8,Mylan CEO defends EpiPen cost to angry lawmakers,2016-09-22 01:34:37 +0000,http://sg.finance.yahoo.com/news/mylan-ceo-set-defend-epipen-073745457.html,Mylan CEO defends EpiPen cost to angry lawmakers
MYL,MYL:UW,BBG000BPQMX8,Mylan CEO Bresch Grilled On Capitol Hill Over EpiPen Debacle,2016-09-22 00:32:00 +0000,http://www.forbes.com/sites/emilywillingham/2016/09/21/mylan-ceo-bresch-grilled-on-capitol-hill-over-epipen-debacle/?utm_source=yahoo&utm_medium=partner&utm_campaign=yahootix&partner=yahootix,Mylan CEO Bresch Grilled On Capitol Hill Over EpiPen Debacle
MYL,MYL:UW,BBG000BPQMX8,Mylan CEO was not unfairly targeted: Analyst,2016-09-21 23:57:00 +0000,http://finance.yahoo.com/video/mylan-ceo-not-unfairly-targeted-235700866.html,Mylan CEO was not unfairly targeted: Analyst
MYL,MYL:UW,BBG000BPQMX8,[$$] Mylan chief comes under fire over cost of EpiPen,2016-09-21 22:49:56 +0000,"http://www.ft.com/cms/s/64f0cb22-8040-11e6-bc52-0c7211ef3198,s01=1.html?ftcamp=traffic/partner/feed_headline/us_yahoo/auddev","[at Financial Times] - Mylan was accused of raising the price of its EpiPen allergy injection by almost 5,000 per cent since 2007 so its executives could get ""filthy rich"" at the expense of American taxpayers during ..."
MYL,MYL:UW,BBG000BPQMX8,"Free-Market Republicans Turn on Mylan, Say EpiPen Went Too Far",2016-09-21 22:42:41 +0000,http://finance.yahoo.com/news/free-market-republicans-turn-mylan-224241313.html,"Free-Market Republicans Turn on Mylan, Say EpiPen Went Too Far"
MYL,MYL:UW,BBG000BPQMX8,Mylan's First Date With Congress Proves 'Painful',2016-09-21 22:39:00 +0000,https://www.thestreet.com/story/13748130/1/mylan-ceo-grilled-by-congress-over-salary-epipen-programs.html?puc=yahoo&cm_ven=YAHOO,Mylan's First Date With Congress Proves 'Painful'
MYL,MYL:UW,BBG000BPQMX8,Mylan CEO: EpiPen $608 Price Was 'Fair',2016-09-21 22:20:52 +0000,http://www.marketwatch.com/News/Story/Story.aspx?guid=F66D6E58-13A5-4F50-BE34-51B8FC89BC3D&siteid=yhoof2,Mylan CEO: EpiPen $608 Price Was 'Fair'
MYL,MYL:UW,BBG000BPQMX8,Rep. Duckworth Questions Mylan CEO on EpiPen Sales to Schools,2016-09-21 22:12:52 +0000,http://www.marketwatch.com/News/Story/Story.aspx?guid=BB8D599C-A4D6-4DDB-B31B-6F99582DFF6D&siteid=yhoof2,Rep. Duckworth Questions Mylan CEO on EpiPen Sales to Schools
MYL,MYL:UW,BBG000BPQMX8,The Latest: EpiPen price hike linked to Medicare drug issue,2016-09-21 22:03:31 +0000,http://finance.yahoo.com/news/latest-mylan-ceo-defends-epipen-prices-194028597--finance.html,The Latest: EpiPen price hike linked to Medicare drug issue
MYL,MYL:UW,BBG000BPQMX8,The Latest: EpiPen price hike linked to Medicare drug issue,2016-09-21 21:52:25 +0000,http://sg.finance.yahoo.com/news/latest-mylan-ceo-defends-epipen-193940260.html,The Latest: EpiPen price hike linked to Medicare drug issue
MYL,MYL:UW,BBG000BPQMX8,Lawmakers blast Mylan CEO over 'sickening' EpiPen price hikes,2016-09-21 21:48:01 +0000,http://finance.yahoo.com/news/u-lawmakers-grill-mylan-ceo-195952222.html,[Reuters] - U.S. lawmakers on Wednesday blasted Mylan NV Chief Executive Heather Bresch for sharply increasing prices for the EpiPen emergency allergy treatment at a congressional hearing in which Republicans and ...
MYL,MYL:UW,BBG000BPQMX8,U.S. lawmakers blast Mylan CEO over 'sickening' EpiPen price hikes,2016-09-21 21:44:33 +0000,http://finance.yahoo.com/news/u-lawmakers-grill-mylan-ceo-202331862.html,"[Reuters] - U.S. lawmakers on Wednesday blasted Mylan NV Chief Executive Heather Bresch for sharply increasing prices for the EpiPen emergency allergy treatment at a congressional hearing in which Republicans and Democrats questioned the reasons behind rising U.S. drug costs. The House Committee on Oversight and Government Reform called Bresch to testify in the wake of public outrage over EpiPen, whose list price has risen to $600 for a pair of the devices compared with $100 in 2007. At several points, they cut off Bresch's efforts to explain the intricacies of U.S. pharmaceutical pricing, including how health insurers and other payers take a percentage of treatment sales."
MYL,MYL:UW,BBG000BPQMX8,Congressman: 'Hard to Believe' Mylan Makes Only $50 Profit on Each EpiPen,2016-09-21 21:06:34 +0000,http://finance.yahoo.com/news/congressman-hard-believe-mylan-only-210635756.html,Congressman: 'Hard to Believe' Mylan Makes Only $50 Profit on Each EpiPen
MYL,MYL:UW,BBG000BPQMX8,"'Cheap Shot' to Bring Her Mother Into EpiPen Controversy, Mylan (MYL) CEO Says",2016-09-21 20:59:00 +0000,https://www.thestreet.com/story/13747832/1/cheap-shot-to-bring-her-mother-into-epipen-controversy-mylan-myl-ceo-says.html?puc=yahoo&cm_ven=YAHOO,"'Cheap Shot' to Bring Her Mother Into EpiPen Controversy, Mylan (MYL) CEO Says"
MYL,MYL:UW,BBG000BPQMX8,Mylan (MYL) CEO Bresch Grilled by Rep. Cummings at Hearing,2016-09-21 20:53:00 +0000,https://www.thestreet.com/story/13748105/1/mylan-myl-ceo-bresch-grilled-by-rep-cummings-at-hearing.html?puc=yahoo&cm_ven=YAHOO,Mylan (MYL) CEO Bresch Grilled by Rep. Cummings at Hearing
MYL,MYL:UW,BBG000BPQMX8,Mylan CEO: We provide many schools with free EpiPens,2016-09-21 20:50:00 +0000,http://finance.yahoo.com/video/mylan-ceo-many-schools-free-205000213.html,Mylan CEO: We provide many schools with free EpiPens
MYL,MYL:UW,BBG000BPQMX8,"Mylan's EpiPen 'greed is astounding ... sickening and disgusting,' rep says",2016-09-21 20:41:42 +0000,http://www.cnbc.com/id/103958516?__source=yahoo%7cfinance%7cheadline%7cheadline%7cstory&par=yahoo&doc=103958516,"Mylan's EpiPen 'greed is astounding ... sickening and disgusting,' rep says"
MYL,MYL:UW,BBG000BPQMX8,Mylan CEO: 'Considerable less' profit from generic,2016-09-21 20:41:00 +0000,http://finance.yahoo.com/video/mylan-ceo-considerable-less-profit-204100234.html,Mylan CEO: 'Considerable less' profit from generic
MYL,MYL:UW,BBG000BPQMX8,"Elizabeth Warren had one question for the maker of EpiPen, and the CEO couldn't answer it at all",2016-09-21 20:25:00 +0000,http://finance.yahoo.com/news/elizabeth-warren-had-one-maker-202500658.html,"Elizabeth Warren had one question for the maker of EpiPen, and the CEO couldn't answer it at all"
MYL,MYL:UW,BBG000BPQMX8,"The newest pharma villain Novum is charging $9,561 for a tube of skin cream",2016-09-21 20:17:34 +0000,http://qz.com/787306/mylan-isnt-the-only-company-accused-of-price-gauging-novum-has-jacked-up-the-price-of-its-aloquin-skin-cream/?utm_source=YPL,"The newest pharma villain Novum is charging $9,561 for a tube of skin cream"
MYL,MYL:UW,BBG000BPQMX8,Mylan CEO: Generic version lowers price to patient,2016-09-21 20:01:00 +0000,http://finance.yahoo.com/video/mylan-ceo-generic-version-lowers-200100115.html,Mylan CEO: Generic version lowers price to patient
MYL,MYL:UW,BBG000BPQMX8,Mylan CEO: My compensation in 'middle' vs. peers,2016-09-21 19:58:00 +0000,http://finance.yahoo.com/video/mylan-ceo-compensation-middle-vs-195800443.html,Mylan CEO: My compensation in 'middle' vs. peers
MYL,MYL:UW,BBG000BPQMX8,U.S. lawmakers grill Mylan CEO over EpiPen steep price increases,2016-09-21 19:56:27 +0000,http://finance.yahoo.com/news/u-lawmakers-grill-mylan-ceo-195627330.html,"[Reuters] - U.S. lawmakers on Wednesday blasted steep price increases for Mylan's EpiPen emergency allergy treatment as they grilled the company's Chief Executive Heather Bresch at a congressional hearing. The House Committee on Oversight and Government Reform called Bresch to testify after the company raised the list price for a pair of EpiPens to $600 compared with $100 in 2007, when it acquired the product. ""After Mylan takes our punches they'll fly back to their mansions in their private jets and laugh all the way to the bank,"" Cummings said."
MYL,MYL:UW,BBG000BPQMX8,Cummings: We've lost chance to get information needed,2016-09-21 19:50:00 +0000,http://finance.yahoo.com/video/cummings-weve-lost-chance-information-195000002.html,Cummings: We've lost chance to get information needed
MYL,MYL:UW,BBG000BPQMX8,Mylan CEO grilled on EpiPen profits,2016-09-21 19:46:00 +0000,http://finance.yahoo.com/video/mylan-ceo-grilled-epipen-profits-194600109.html,Mylan CEO grilled on EpiPen profits
MYL,MYL:UW,BBG000BPQMX8,Mylan CEO: Cheap shot to bring my mother into this,2016-09-21 19:44:00 +0000,http://finance.yahoo.com/video/mylan-ceo-cheap-shot-bring-194400060.html,Mylan CEO: Cheap shot to bring my mother into this
MYL,MYL:UW,BBG000BPQMX8,Mylan Blasted for Raising EpiPen Prices to Get ‘Filthy Rich’,2016-09-21 19:16:45 +0000,http://www.bloomberg.com/news/articles/2016-09-21/mylan-criticized-on-profits-and-pay-at-house-oversight-hearing?cmpid=yhoo.headline,Mylan Blasted for Raising EpiPen Prices to Get ‘Filthy Rich’
MYL,MYL:UW,BBG000BPQMX8,"Apple Inc. (AAPL), Mylan NV (MYL) & More: Here’s Why These Stocks Register Significant Intraday Moves",2016-09-21 18:31:09 +0000,http://www.insidermonkey.com/blog/apple-inc-aapl-mylan-nv-myl-more-heres-why-these-stocks-register-significant-intraday-moves-476098/,"Apple Inc. (AAPL), Mylan NV (MYL) & More: Here’s Why These Stocks Register Significant Intraday Moves"
MYL,MYL:UW,BBG000BPQMX8,'YOU ASKED FOR IT' — Congress railed on the maker of EpiPen,2016-09-21 17:58:50 +0000,http://finance.yahoo.com/news/live-mylan-ceo-heather-bresch-175850921.html,'YOU ASKED FOR IT' — Congress railed on the maker of EpiPen
MYL,MYL:UW,BBG000BPQMX8,The CEO blame game,2016-09-21 17:30:00 +0000,http://finance.yahoo.com/video/ceo-blame-game-173000320.html,The CEO blame game
MYL,MYL:UW,BBG000BPQMX8,Things look even worse for Mylan CEO Heather Bresch as she heads to Capitol Hill,2016-09-21 17:02:50 +0000,http://www.marketwatch.com/News/Story/Story.aspx?guid=C4002B0E-7FFE-11E6-B992-12CB1D91A4CA&siteid=yhoof2,Things look even worse for Mylan CEO Heather Bresch as she heads to Capitol Hill
MYL,MYL:UW,BBG000BPQMX8,[$$] Mylan CEO to Shift Blame on EpiPen Pricing at Hearing,2016-09-21 15:34:51 +0000,http://www.wsj.com/articles/mylan-ceo-to-shift-blame-on-epipen-pricing-at-house-hearing-1474466910?mod=yahoo_hs,[$$] Mylan CEO to Shift Blame on EpiPen Pricing at Hearing
MYL,MYL:UW,BBG000BPQMX8,2 questions EpiPen's maker desperately wants America to forget while it faces Congress,2016-09-21 15:22:00 +0000,http://finance.yahoo.com/news/2-questions-epipens-maker-desperately-152200827.html,2 questions EpiPen's maker desperately wants America to forget while it faces Congress
MYL,MYL:UW,BBG000BPQMX8,EpiPen Controversy: Mylan's Tough Week Just Keeps Getting Grimmer,2016-09-21 15:18:00 +0000,https://www.thestreet.com/story/13747125/1/epipen-controversy-mylan-s-tough-week-just-keeps-getting-grimmer.html?puc=yahoo&cm_ven=YAHOO,EpiPen Controversy: Mylan's Tough Week Just Keeps Getting Grimmer
MYL,MYL:UW,BBG000BPQMX8,Mylan (MYL) CEO Faces Hearing After Wells Fargo CEO Blasted by Senate,2016-09-21 14:52:00 +0000,https://www.thestreet.com/story/13747340/1/mylan-myl-ceo-faces-hearing-after-wells-fargo-ceo-blasted-by-senate.html?puc=yahoo&cm_ven=YAHOO,Mylan (MYL) CEO Faces Hearing After Wells Fargo CEO Blasted by Senate
MYL,MYL:UW,BBG000BPQMX8,Bill George on Mylan CEO: Showed very little empathy for ...,2016-09-21 14:14:00 +0000,http://finance.yahoo.com/video/bill-george-mylan-ceo-showed-141400224.html,Bill George on Mylan CEO: Showed very little empathy for ...
MYL,MYL:UW,BBG000BPQMX8,Mylan CEO Bresch steps into the Congressional spotlight,2016-09-21 14:10:11 +0000,http://www.bizjournals.com/bizjournals/news/2016/09/21/mylan-ceo-bresch-steps-into-the-congressional.html?ana=yahoo,Mylan CEO Bresch steps into the Congressional spotlight
MYL,MYL:UW,BBG000BPQMX8,Mylan CEO to defend EpiPen price hikes before Congress,2016-09-21 13:51:52 +0000,http://www.bizjournals.com/pittsburgh/news/2016/09/21/mylan-ceo-to-defend-epipen-price-hikes-before.html?ana=yahoo,Mylan CEO to defend EpiPen price hikes before Congress
MYL,MYL:UW,BBG000BPQMX8,Here's what to expect when the CEO of EpiPen-maker Mylan testifies before Congress,2016-09-21 13:43:36 +0000,http://finance.yahoo.com/news/heres-expect-ceo-epipen-maker-134336066.html,Here's what to expect when the CEO of EpiPen-maker Mylan testifies before Congress
MYL,MYL:UW,BBG000BPQMX8,What to Expect When Mylan CEO Appears Before House Committee,2016-09-21 12:07:00 +0000,https://www.thestreet.com/story/13746359/1/what-to-expect-when-mylan-ceo-bresch-appears-before-house-committee.html?puc=yahoo&cm_ven=YAHOO,What to Expect When Mylan CEO Appears Before House Committee
MYL,MYL:UW,BBG000BPQMX8,Mylan CEO Heather Bresch prepares to testify,2016-09-21 12:02:00 +0000,http://finance.yahoo.com/video/mylan-drug-pricing-hearing-120200876.html,Mylan CEO Heather Bresch prepares to testify
MYL,MYL:UW,BBG000BPQMX8,5 Things You Must Know Before the Market Opens Wednesday,2016-09-21 11:55:00 +0000,https://www.thestreet.com/story/13745121/1/5-things-you-must-know-before-the-market-opens-wednesday.html?puc=yahoo&cm_ven=YAHOO,5 Things You Must Know Before the Market Opens Wednesday
MYL,MYL:UW,BBG000BPQMX8,Mylan CEO Faces Tough Questioning in EpiPen Hearing,2016-09-21 10:35:00 +0000,http://articlefeeds.nasdaq.com/~r/nasdaq/symbols/~3/1kW6pAZhodM/mylan-ceo-faces-tough-questioning-in-epipen-hearing-20160921-01033,Mylan CEO Faces Tough Questioning in EpiPen Hearing
MYL,MYL:UW,BBG000BPQMX8,Mylan CEO to be grilled on Capitol Hill,2016-09-21 10:05:00 +0000,http://finance.yahoo.com/video/mylan-ceo-grilled-hill-100500523.html,Mylan CEO to be grilled on Capitol Hill
MYL,MYL:UW,BBG000BPQMX8,Mylan CEO to testify at drug pricing hearing,2016-09-21 09:16:00 +0000,http://finance.yahoo.com/video/mylan-ceo-testify-drug-pricing-091600381.html,Mylan CEO to testify at drug pricing hearing
MYL,MYL:UW,BBG000BPQMX8,"[$$] Drugmaker raises price of acne cream to $10,000 a tube",2016-09-21 08:54:46 +0000,"http://www.ft.com/cms/s/7c184d2e-7eac-11e6-bc52-0c7211ef3198,s01=1.html?ftcamp=traffic/partner/feed_headline/us_yahoo/auddev","[at Financial Times] - A US drugmaker producing skin creams for common conditions such as acne and eczema has raised the price of two of its treatments to almost $10,000 a tube in the latest instance of ""gouging"" in ..."
MYL,MYL:UW,BBG000BPQMX8,Senate Republicans seek probe of Mylan EpiPen oversight,2016-09-20 22:31:36 +0000,http://finance.yahoo.com/news/west-virginia-investigating-mylan-over-164531614.html,"[Reuters] - Mylan NV faced new scrutiny over price hikes for its anti-allergy EpiPen on Tuesday, with U.S. lawmakers calling for a probe of oversight of the company's rebates to government healthcare plans, while West Virginia said it was investigating whether Mylan defrauded its Medicaid department. Mylan is grappling with a growing backlash from U.S. consumers, lawmakers and prosecutors over EpiPen prices, which have risen from about $100 in 2007 to more than $600 for a pair of the devices. The EpiPen delivers a dose of epinephrine, an antidote to a severe and potentially deadly allergic reaction to anything from nuts to bee stings."
MYL,MYL:UW,BBG000BPQMX8,Mylan CEO defends EpiPen prices,2016-09-20 22:28:32 +0000,http://finance.yahoo.com/news/mylan-ceo-defends-epipen-prices-215156333--finance.html,Mylan CEO defends EpiPen prices
MYL,MYL:UW,BBG000BPQMX8,Mylan CEO defends EpiPen prices,2016-09-20 22:28:19 +0000,http://sg.finance.yahoo.com/news/mylan-ceo-defends-epipen-prices-215148576.html,Mylan CEO defends EpiPen prices
MYL,MYL:UW,BBG000BPQMX8,Mylan CEO's Mother Pushed Schools to Buy EpiPens,2016-09-20 22:22:19 +0000,http://articlefeeds.nasdaq.com/~r/nasdaq/symbols/~3/MfrkB1e08RM/mylan-ceos-mother-pushed-schools-to-buy-epipens-cm682331,Gayle Manchin former First Lady of West Virginia and mother of embattled Mylan MYL CEO Heather Bresch may have used her position as head of the National Association of State Boards of Education to encourage states to require schools to buy EpiPens according to a new report from USA
MYL,MYL:UW,BBG000BPQMX8,"Mylan CEO Regrets Patient Blowback, But Not Expanded EpiPen Use",2016-09-20 21:52:52 +0000,http://www.bloomberg.com/news/articles/2016-09-20/mylan-ceo-regrets-patient-blowback-but-not-expanded-epipen-use?cmpid=yhoo.headline,"Mylan CEO Regrets Patient Blowback, But Not Expanded EpiPen Use"
MYL,MYL:UW,BBG000BPQMX8,EpiPen price outrage — Mylan's new problems as CEO girds for congressional grilling,2016-09-20 21:17:59 +0000,http://www.cnbc.com/id/103955350?__source=yahoo%7cfinance%7cheadline%7cheadline%7cstory&par=yahoo&doc=103955350,EpiPen price outrage — Mylan's new problems as CEO girds for congressional grilling
MYL,MYL:UW,BBG000BPQMX8,Mylan shares languish at low valuation as EpiPen hearing nears,2016-09-20 20:59:54 +0000,http://finance.yahoo.com/news/mylan-shares-languish-low-valuation-182414834.html,"[Reuters] - Shares of Mylan NV are trading at historically low valuations as the company's chief executive officer is set to face a congressional grilling on Wednesday over the price of its EpiPen emergency allergy treatment. The stock is trading at 7.5 times estimated earnings for the next 12 months, holding near its lowest in at least 30 years and well below its five-year average of 11 times, according to Thomson Reuters Datastream. Since late August, when the EpiPen price increases came into the spotlight, Mylan shares have fallen about 15 percent."
MYL,MYL:UW,BBG000BPQMX8,"West Virginia Investigating EpiPen Maker Mylan for Medicaid Fraud, Antitrust Violations",2016-09-20 20:29:33 +0000,http://finance.yahoo.com/news/west-virginia-investigating-epipen-maker-202933335.html,"West Virginia Investigating EpiPen Maker Mylan for Medicaid Fraud, Antitrust Violations"
MYL,MYL:UW,BBG000BPQMX8,Mylan CEO's Mother Pushed Schools to Buy EpiPens,2016-09-20 20:14:08 +0000,http://finance.yahoo.com/news/mylan-ceos-mother-pushed-schools-201408278.html,Mylan CEO's Mother Pushed Schools to Buy EpiPens
MYL,MYL:UW,BBG000BPQMX8,EpiPen's maker has another problem on its hands,2016-09-20 19:59:00 +0000,http://finance.yahoo.com/news/epipens-maker-another-problem-hands-195900884.html,EpiPen's maker has another problem on its hands
MYL,MYL:UW,BBG000BPQMX8,Medicare EpiPen spending outpaces prescription growth: Kaiser report,2016-09-20 19:27:00 +0000,http://finance.yahoo.com/news/medicare-epipen-spending-outpaces-prescription-192700430.html,"[Reuters] - U.S. government spending on Mylan Inc's EpiPen in the Medicare program for seniors and the disabled rose 1,151 percent from 2007 through 2014, while the number of EpiPen users grew 164 percent, the Kaiser Family Foundation said on Tuesday in an analysis. The spending figure excludes after-market manufacturer rebates that Mylan paid to the private insurers who manage the Medicare Part D program for pharmacy drugs on behalf of the government, it said. In 2007, when Mylan purchased EpiPen, the Medicare program spent $7 million on the product for 79,980 users, Kaiser said."
MYL,MYL:UW,BBG000BPQMX8,Medicare EpiPen spending outpaces prescription growth -Kaiser report,2016-09-20 19:20:47 +0000,http://finance.yahoo.com/news/medicare-epipen-spending-outpaces-prescription-192047595.html,"[Reuters] - U.S. government spending on Mylan Inc's EpiPen in the Medicare program for seniors and the disabled rose 1,151 percent from 2007 through 2014, while the number of EpiPen users grew 164 percent, the Kaiser Family Foundation said on Tuesday in an analysis. The spending figure excludes after-market manufacturer rebates that Mylan paid to the private insurers who manage the Medicare Part D program for pharmacy drugs on behalf of the government, it said. In 2007, when Mylan purchased EpiPen, the Medicare program spent $7 million on the product for 79,980 users, Kaiser said."
MYL,MYL:UW,BBG000BPQMX8,U.S. Senate finance committee asks for Mylan EpiPen rebate investigation,2016-09-20 18:56:20 +0000,http://finance.yahoo.com/news/u-senate-finance-committee-asks-185620448.html,"[Reuters] - The U.S. Senate Finance Committee on Tuesday said it had asked the U.S. Department of Health and Human Services to investigate the rebates to state Medicaid programs for Mylan Inc's EpiPen treatment. Mylan, ..."
MYL,MYL:UW,BBG000BPQMX8,The EpiPen pricing scandal just got even more complicated for the CEO and her family at the heart of it,2016-09-20 18:32:37 +0000,http://finance.yahoo.com/news/epipen-pricing-scandal-just-got-183237723.html,The EpiPen pricing scandal just got even more complicated for the CEO and her family at the heart of it
MYL,MYL:UW,BBG000BPQMX8,Mylan (MYL) Stock Up Despite West Virginia EpiPen Fraud Investigation,2016-09-20 17:41:00 +0000,https://www.thestreet.com/story/13746229/1/mylan-myl-stock-up-despite-west-virginia-epipen-fraud-investigation.html?puc=yahoo&cm_ven=YAHOO,Mylan (MYL) Stock Up Despite West Virginia EpiPen Fraud Investigation
MYL,MYL:UW,BBG000BPQMX8,West Virginia AG subpoenas Mylan over EpiPen price hike,2016-09-20 16:43:05 +0000,http://sg.finance.yahoo.com/news/west-virginia-ag-subpoenas-mylan-164305496.html,West Virginia AG subpoenas Mylan over EpiPen price hike
MYL,MYL:UW,BBG000BPQMX8,Mylan Investigations Mount as West Virginia Opens Fraud Probe,2016-09-20 16:14:28 +0000,http://www.bloomberg.com/news/articles/2016-09-20/mylan-epipen-files-sought-as-west-virginia-opens-fraud-probe?cmpid=yhoo.headline,Mylan Investigations Mount as West Virginia Opens Fraud Probe
MYL,MYL:UW,BBG000BPQMX8,West Virginia investigating Mylan over EpiPen pricing,2016-09-20 15:53:30 +0000,http://finance.yahoo.com/news/west-virginia-investigating-mylan-over-155330331.html,[Reuters] - The state of West Virginia is investigating whether Mylan NV violated antitrust laws or defrauded the state's Medicaid program in connection with its EpiPen device. West Virginia Attorney General Patrick ...
MYL,MYL:UW,BBG000BPQMX8,West Virginia has taken a huge shot at the maker of the EpiPen,2016-09-20 15:11:59 +0000,http://finance.yahoo.com/news/west-virginia-taken-huge-shot-151159768.html,West Virginia has taken a huge shot at the maker of the EpiPen
MYL,MYL:UW,BBG000BPQMX8,Mylan Documents Sought as W.V. Opens Case Probing Medicaid Fraud,2016-09-20 15:00:54 +0000,http://www.bloomberg.com/news/articles/2016-09-20/mylan-accused-of-medicaid-fraud-by-west-virginia-over-epipen-itblyl44?cmpid=yhoo.headline,Mylan Documents Sought as W.V. Opens Case Probing Medicaid Fraud
MYL,MYL:UW,BBG000BPQMX8,Mylan Investors Should Be Asking Where (And Who) Robert Coury Is,2016-09-20 13:11:40 +0000,http://finance.yahoo.com/news/mylan-investors-asking-where-robert-131140087.html,Mylan Investors Should Be Asking Where (And Who) Robert Coury Is
MYL,MYL:UW,BBG000BPQMX8,Lessons on managing a corporate crisis: Jack Welch,2016-09-20 11:50:00 +0000,http://finance.yahoo.com/video/lessons-managing-corporate-crisis-jack-115000773.html,Lessons on managing a corporate crisis: Jack Welch
MYL,MYL:UW,BBG000BPQMX8,Man Behind EpiPen Gambit Stays Away as Mylan CEO Faces Congress,2016-09-20 09:00:00 +0000,http://www.bloomberg.com/news/articles/2016-09-20/man-behind-epipen-gambit-stays-away-as-mylan-ceo-faces-congress?cmpid=yhoo.headline,Man Behind EpiPen Gambit Stays Away as Mylan CEO Faces Congress
MYL,MYL:UW,BBG000BPQMX8,A Generic EpiPen Might Not Be Your Best Option,2016-09-20 08:08:15 +0000,http://finance.yahoo.com/news/generic-epipen-might-not-best-200752497.html,A Generic EpiPen Might Not Be Your Best Option
MYL,MYL:UW,BBG000BPQMX8,Wells Fargo and Mylan should have 'smelled something was wrong': Walter Isaacson,2016-09-19 15:47:44 +0000,http://www.cnbc.com/id/103950875?__source=yahoo%7cfinance%7cheadline%7cheadline%7cstory&par=yahoo&doc=103950875,Wells Fargo and Mylan should have 'smelled something was wrong': Walter Isaacson
MYL,MYL:UW,BBG000BPQMX8,Implied IBLN Analyst Target Price: $28,2016-09-19 14:20:39 +0000,http://articlefeeds.nasdaq.com/~r/nasdaq/symbols/~3/wXQklMlPLuA/implied-ibln-analyst-target-price-28-cm681167,Looking at the underlying holdings of the ETFs in our coverage universe at ETF Channel we have compared the trading price of each holding against the average analyst 12 month forward target price and computed the weighted average implied analyst target price for the ETF itself For
MYL,MYL:UW,BBG000BPQMX8,"Mylan (MYL), Wells Fargo CEOs to Testify This Week",2016-09-19 14:16:00 +0000,https://www.thestreet.com/story/13744014/1/mylan-myl-wells-fargo-ceos-to-testify-this-week.html?puc=yahoo&cm_ven=YAHOO,"Mylan (MYL), Wells Fargo CEOs to Testify This Week"
