MYL,MYL:UW,BBG000BPQMX8,My Top Ten Healthcare Quotes For 2016,2016-12-19 02:59:00 +0000,http://www.forbes.com/sites/danmunro/2016/12/18/top-ten-healthcare-quotes-for-2016/?utm_source=yahoo&utm_medium=partner&utm_campaign=yahootix&partner=yahootix,My Top Ten Healthcare Quotes For 2016
MYL,MYL:UW,BBG000BPQMX8,[$$] Mylan Launches Cheaper Generic EpiPen Alternative,2016-12-17 04:10:00 +0000,http://www.wsj.com/articles/mylan-launches-cheaper-generic-epipen-alternative-1481896300?ru=yahoo?mod=yahoo_itp,[$$] Mylan Launches Cheaper Generic EpiPen Alternative
MYL,MYL:UW,BBG000BPQMX8,Business Highlights,2016-12-16 22:43:26 +0000,http://sg.finance.yahoo.com/news/business-highlights-224326638.html,Business Highlights
MYL,MYL:UW,BBG000BPQMX8,Mylan launching generic EpiPen,2016-12-16 21:52:00 +0000,http://finance.yahoo.com/video/mylan-launching-generic-epipen-215200291.html,Mylan launching generic EpiPen
MYL,MYL:UW,BBG000BPQMX8,Mylan Launching Cheaper EpiPen Generic Amid Drug Pricing Saga,2016-12-16 21:06:43 +0000,http://www.investors.com/news/technology/mylan-launching-cheaper-epipen-generic-amid-drug-pricing-saga/,Mylan Launching Cheaper EpiPen Generic Amid Drug Pricing Saga
MYL,MYL:UW,BBG000BPQMX8,How Does Mylan's $300 EpiPen Compare To Other Generics?,2016-12-16 18:26:37 +0000,http://finance.yahoo.com/news/does-mylans-300-epipen-compare-182637812.html,How Does Mylan's $300 EpiPen Compare To Other Generics?
MYL,MYL:UW,BBG000BPQMX8,"Mylan’s cheaper EpiPen finally available next week, months later than promised",2016-12-16 16:58:08 +0000,http://www.marketwatch.com/News/Story/Story.aspx?guid=095CAFDE-C397-11E6-BB09-47C32D1B660C&siteid=yhoof2,"Mylan’s cheaper EpiPen finally available next week, months later than promised"
MYL,MYL:UW,BBG000BPQMX8,"After harsh light, a cheaper version of EpiPen from Mylan",2016-12-16 16:52:43 +0000,http://sg.finance.yahoo.com/news/mylan-launches-cheaper-version-epipen-135758082.html,"After harsh light, a cheaper version of EpiPen from Mylan"
MYL,MYL:UW,BBG000BPQMX8,Disney's 'Rogue One' hits theaters; Adobe earnings top estimates; Mylan launches generic EpiPen,2016-12-16 16:52:31 +0000,http://finance.yahoo.com/news/disneys-rogue-one-hits-theaters-adobe-earnings-top-estimates-mylan-launches-generic-epipen-165231623.html,Disney's 'Rogue One' hits theaters; Adobe earnings top estimates; Mylan launches generic EpiPen
MYL,MYL:UW,BBG000BPQMX8,[$$] Generic Drug Price-Fixing Case May Grow in Scope,2016-12-16 16:51:00 +0000,http://www.barrons.com/articles/generic-drug-price-fixing-case-may-grow-in-scope-1481907074?mod=yahoobarrons&ru=yahoo,[$$] Generic Drug Price-Fixing Case May Grow in Scope
MYL,MYL:UW,BBG000BPQMX8,Jim Cramer on Mylan's New Generic EpiPen,2016-12-16 16:01:00 +0000,http://www.thestreet.com/video/13928995/jim-cramer-on-mylan-s-new-generic-epipen.html?puc=yahoov&cm_ven=YAHOOV,Jim Cramer on Mylan's New Generic EpiPen
MYL,MYL:UW,BBG000BPQMX8,Mylan to start selling cheaper EpiPen next week,2016-12-16 15:36:00 +0000,http://finance.yahoo.com/video/mylan-start-selling-cheaper-epipen-153600032.html,Mylan to start selling cheaper EpiPen next week
MYL,MYL:UW,BBG000BPQMX8,Mylan to Start Selling Generic Verisons of EpiPens at Half Price,2016-12-16 15:26:00 +0000,http://www.thestreet.com/video/13928864/mylan-to-start-selling-generic-verisons-of-epipens-at-half-price.html?puc=yahoov&cm_ven=YAHOOV,Mylan to Start Selling Generic Verisons of EpiPens at Half Price
MYL,MYL:UW,BBG000BPQMX8,"20 States Sue Teva, Mylan & Other Drug Companies for Price Fixing",2016-12-16 15:01:13 +0000,http://articlefeeds.nasdaq.com/~r/nasdaq/symbols/~3/v83RDLUqEq8/20-states-sue-teva-mylan-other-drug-companies-for-price-fixing-cm722378,Just a day after the first charges were filed by the U S Department of Justice DoJ Antitrust Division in an investigation related to generic drug pricing Read more Generic Stocks Feel Pricing Heat 1st Charges Filed in DoJ Antitrust Probe New York Attorney General A G Eric
MYL,MYL:UW,BBG000BPQMX8,Mylan Shares Up on Generic EpiPen Launch,2016-12-16 14:42:00 +0000,https://www.thestreet.com/story/13928797/1/mylan-shares-up-on-generic-epipen-launch.html?puc=yahoo&cm_ven=YAHOO,Mylan Shares Up on Generic EpiPen Launch
MYL,MYL:UW,BBG000BPQMX8,Mylan launches first generic version of EpiPen,2016-12-16 14:40:11 +0000,http://www.bizjournals.com/pittsburgh/news/2016/12/16/mylan-launches-first-generic-version-of-epipen.html?ana=yahoo,Mylan launches first generic version of EpiPen
MYL,MYL:UW,BBG000BPQMX8,Mylan launches EpiPen generic at $300 per two-pack,2016-12-16 14:33:12 +0000,http://finance.yahoo.com/news/mylan-launches-epipen-generic-more-133601032.html,Mylan launches EpiPen generic at $300 per two-pack
MYL,MYL:UW,BBG000BPQMX8,The $300 generic EpiPen is here,2016-12-16 14:10:02 +0000,http://finance.yahoo.com/news/300-generic-epipen-141002946.html,The $300 generic EpiPen is here
MYL,MYL:UW,BBG000BPQMX8,Mylan's first generic EpiPen launches at less than half the cost of branded version,2016-12-16 13:37:49 +0000,http://www.marketwatch.com/News/Story/Story.aspx?guid=D4564F04-5DFC-47D6-A6C1-8D13CBB63820&siteid=yhoof2,Mylan's first generic EpiPen launches at less than half the cost of branded version
MYL,MYL:UW,BBG000BPQMX8,Mylan launches EpiPen generic at more than 50 pct discount,2016-12-16 13:14:27 +0000,http://finance.yahoo.com/news/mylan-launches-epipen-generic-more-131427378.html,Mylan launches EpiPen generic at more than 50 pct discount
MYL,MYL:UW,BBG000BPQMX8,Myan announces generic version of EpiPen,2016-12-16 13:08:00 +0000,http://finance.yahoo.com/video/myan-announces-generic-version-epipen-130800454.html,Myan announces generic version of EpiPen
MYL,MYL:UW,BBG000BPQMX8,"Mylan Launches the First Generic for EpiPen® (epinephrine injection, USP) Auto-Injector as an Authorized Generic",2016-12-16 13:01:00 +0000,http://finance.yahoo.com/news/mylan-launches-first-generic-epipen-130100066.html,"[PR Newswire] - HERTFORDSHIRE, England and PITTSBURGH, Dec. 16, 2016 /PRNewswire/ -- Mylan N.V. (NASDAQ, TASE: MYL) today announced the launch of the authorized generic for EpiPen® (epinephrine injection, USP) Auto-Injector at a wholesale acquisition cost (WAC) of $300 per epinephrine injection, USP two-pack, which is more than 50% lower than the WAC of EpiPen 2-Pak® Auto-Injectors. The authorized generic, which will reach pharmacies starting next week, has the same drug formulation and device functionality as EpiPen Auto-Injector, a product that has been on the market for nearly 30 years, and is administered in the same way."
MYL,MYL:UW,BBG000BPQMX8,"20 States Sue Teva, Mylan & Other Drug Companies for Price Fixing",2016-12-16 12:34:12 +0000,http://finance.yahoo.com/news/20-states-sue-teva-mylan-123412271.html,"20 States Sue Teva, Mylan & Other Drug Companies for Price Fixing"
MYL,MYL:UW,BBG000BPQMX8,Mass. joins lawsuit alleging widespread price-fixing in generic drug industry,2016-12-16 12:10:08 +0000,http://www.bizjournals.com/boston/news/2016/12/15/mass-joins-lawsuit-alleging-widespread-price.html?ana=yahoo,Mass. joins lawsuit alleging widespread price-fixing in generic drug industry
MYL,MYL:UW,BBG000BPQMX8,Mylan Launches Authorized Generic For EpiPen Auto-Injector - Quick Facts,2016-12-16 08:12:00 +0000,http://articlefeeds.nasdaq.com/~r/nasdaq/symbols/~3/fJVp7mK-cJ4/mylan-launches-authorized-generic-for-epipen-autoinjector--quick-facts-20161216-00226,Mylan Launches Authorized Generic For EpiPen Auto-Injector - Quick Facts
MYL,MYL:UW,BBG000BPQMX8,PRESS DIGEST- New York Times business news - Dec 16,2016-12-16 05:52:58 +0000,http://finance.yahoo.com/news/press-digest-york-times-business-055258745.html,"[Reuters] - The following are the top stories on the New York Times business pages. - Facebook Inc said on Thursday that it had begun a series of experiments to limit misinformation on its site. The tests include making it easier for its 1.8 billion members to report fake news, and creating partnerships with external fact-checking organizations to help it indicate when articles are false."
MYL,MYL:UW,BBG000BPQMX8,"Mylan, Teva Among 6 Pharmas Sued In Alleged Price-Fixing Scheme",2016-12-15 21:43:11 +0000,http://www.investors.com/news/technology/mylan-teva-among-6-pharmas-sued-in-alleged-price-fixing-scheme/,"Mylan, Teva Among 6 Pharmas Sued In Alleged Price-Fixing Scheme"
MYL,MYL:UW,BBG000BPQMX8,"U.S. states sue Mylan, Teva, others for fixing drug prices",2016-12-15 19:06:32 +0000,http://finance.yahoo.com/news/u-states-sue-mylan-teva-164431362.html,"[Reuters] - Two years after high generic drug prices became a public controversy, legal cases are starting to land. Twenty states filed a lawsuit Thursday against Mylan NV , Teva Pharmaceuticals and four other generic drug makers, saying they conspired over steak dinners and ""girls nights out"" on pricing of two common generic drugs, according to a copy of the complaint."
MYL,MYL:UW,BBG000BPQMX8,Allergan CEO: Need to shift industry from treatments to cures,2016-12-15 14:11:29 +0000,http://finance.yahoo.com/video/allergan-ceo-shift-industry-treatments-141129642.html,Allergan CEO: Need to shift industry from treatments to cures
MYL,MYL:UW,BBG000BPQMX8,"Generic Stocks Feel Pricing Heat, 1st Charges Filed in DoJ Antitrust Probe",2016-12-15 13:59:18 +0000,http://articlefeeds.nasdaq.com/~r/nasdaq/symbols/~3/_orgWFweJ98/generic-stocks-feel-pricing-heat-1st-charges-filed-in-doj-antitrust-probe-cm721758,Key generic drugmakers saw their shares sliding on news that the first charges have been brought by the antitrust division in the investigation related to generic drug pricing The Department of Justice DoJ said that two former senior executives Jeffrey Glazer the erstwhile CEO of a
MYL,MYL:UW,BBG000BPQMX8,"Generic Stocks Feel Pricing Heat, 1st Charges Filed in DoJ Antitrust Probe",2016-12-15 12:18:12 +0000,http://finance.yahoo.com/news/generic-stocks-feel-pricing-heat-121812979.html,"Generic Stocks Feel Pricing Heat, 1st Charges Filed in DoJ Antitrust Probe"
MYL,MYL:UW,BBG000BPQMX8,"Mylan NV is trading above its 50 day moving average : MYL-US : December 15, 2016",2016-12-15 07:01:42 +0000,http://www.capitalcube.com/blog/index.php/mylan-nv-is-trading-above-its-50-day-moving-average-myl-us-december-15-2016/,"Mylan NV is trading above its 50 day moving average : MYL-US : December 15, 2016"
MYL,MYL:UW,BBG000BPQMX8,Federal prosecutors accuse execs of fixing drug prices,2016-12-14 22:05:49 +0000,http://sg.finance.yahoo.com/news/federal-prosecutors-accuse-execs-fixing-195717523.html,Federal prosecutors accuse execs of fixing drug prices
MYL,MYL:UW,BBG000BPQMX8,"Health Care Sector Update for 12/14/2016: LCI,ENDP,MYL,VCEL,TROV",2016-12-14 21:36:24 +0000,http://articlefeeds.nasdaq.com/~r/nasdaq/symbols/~3/GMjIalcmuz8/health-care-sector-update-for-12142016-lciendpmylvceltrov-cm721565,Top Health Care StocksTop Health Care Stocks JNJ 0 82 JNJ 0 82 PFE 0 06 PFE 0 06 MRK 1 60 MRK 1 60 ABT 0 10 ABT 0 10 AMGN 0 24 AMGN 0 24 Health care stocks were lower just before today s closing bell with the NYSE Health Care Index falling about 0 5 while shares of health
MYL,MYL:UW,BBG000BPQMX8,"DOJ Charges Pharma Execs With Price-Fixing; Teva, Mylan Stocks Fall",2016-12-14 21:22:02 +0000,http://www.investors.com/news/technology/doj-charges-pharma-execs-with-price-fixing-teva-mylan-stocks-topple/,"DOJ Charges Pharma Execs With Price-Fixing; Teva, Mylan Stocks Fall"
MYL,MYL:UW,BBG000BPQMX8,DOJ Files Charges in Generic Drug Price-Fixing Investigation,2016-12-14 17:51:00 +0000,https://www.thestreet.com/story/13925956/1/doj-files-charges-in-generic-drug-fixing-investigation.html?puc=yahoo&cm_ven=YAHOO,DOJ Files Charges in Generic Drug Price-Fixing Investigation
MYL,MYL:UW,BBG000BPQMX8,"Mylan NV – Value Analysis (NASDAQ:MYL) : December 14, 2016",2016-12-14 15:59:48 +0000,http://www.capitalcube.com/blog/index.php/mylan-nv-value-analysis-nasdaqmyl-december-14-2016/,"Mylan NV – Value Analysis (NASDAQ:MYL) : December 14, 2016"
MYL,MYL:UW,BBG000BPQMX8,"S&P 500 Movers: URBN, MYL",2016-12-13 16:58:04 +0000,http://articlefeeds.nasdaq.com/~r/nasdaq/symbols/~3/Y0jy0fzHNhY/sp-500-movers-urbn-myl-cm720738,In early trading on Tuesday shares of Mylan MYL topped the list of the day s best performing components of the S amp P 500 index trading up 3 5 Year to date Mylan has lost about 28 9 of its value And the worst performing S amp P 500 component thus far on the day is
MYL,MYL:UW,BBG000BPQMX8,"Nasdaq 100 Movers: ALXN, MYL",2016-12-13 16:57:53 +0000,http://articlefeeds.nasdaq.com/~r/nasdaq/symbols/~3/OXSN-E8oIis/nasdaq-100-movers-alxn-myl-cm720734,In early trading on Tuesday shares of Mylan MYL topped the list of the day s best performing components of the Nasdaq 100 index trading up 3 1 Year to date Mylan has lost about 29 2 of its value And the worst performing Nasdaq 100 component thus far on the day is
MYL,MYL:UW,BBG000BPQMX8,Eli Lilly and Express Scripts Announce Program to Lower Insulin Prices to Avoid Mylan-Like Uproar,2016-12-13 14:53:00 +0000,https://www.thestreet.com/story/13923886/1/eli-lilly-and-express-scripts-announce-program-to-lower-insulin-prices-to-avoid-mylan-like-uproar.html?puc=yahoo&cm_ven=YAHOO,Eli Lilly and Express Scripts Announce Program to Lower Insulin Prices to Avoid Mylan-Like Uproar
MYL,MYL:UW,BBG000BPQMX8,"Mylan NV breached its 50 day moving average in a Bullish Manner : MYL-US : December 13, 2016",2016-12-13 12:17:18 +0000,http://www.capitalcube.com/blog/index.php/mylan-nv-breached-its-50-day-moving-average-in-a-bullish-manner-myl-us-december-13-2016/,"Mylan NV breached its 50 day moving average in a Bullish Manner : MYL-US : December 13, 2016"
MYL,MYL:UW,BBG000BPQMX8,How PACCAR Inc (PCAR) Stacks Up Against Its Peers,2016-12-10 23:15:57 +0000,http://www.insidermonkey.com/blog/how-paccar-inc-pcar-stacks-up-against-its-peers-500898/,How PACCAR Inc (PCAR) Stacks Up Against Its Peers
MYL,MYL:UW,BBG000BPQMX8,"MYLAN 72 HOUR DEADLINE ALERT: Approximately 72 Hours Remain; Former Louisiana Attorney General and Kahn Swick & Foti, LLC Remind Investors of Deadline in Class Action Lawsuit against Mylan N.V. – MYL",2016-12-10 03:50:00 +0000,http://finance.yahoo.com/news/mylan-72-hour-deadline-alert-035000068.html,"[Business Wire] - Kahn Swick & Foti, LLC and KSF partner, the former Attorney General of Louisiana, Charles C. Foti, Jr., remind investors with large financial interests that they have only until December 12, 2016 to file lead plaintiff applications in a securities class action lawsuit against Mylan N.V."
MYL,MYL:UW,BBG000BPQMX8,5 Stocks That Got Run Over By the Trump Train,2016-12-09 22:57:09 +0000,http://articlefeeds.nasdaq.com/~r/nasdaq/symbols/~3/lAg6ASH3PRk/5-stocks-that-got-run-over-by-the-trump-train-cm719618,It seems the Trump rally is in no hurry to fade away U S stocks enjoyed their best day since the election on Wednesday and gained on Thursday as investors continued to exit bonds and enter the equity markets Speculation that the new administration would bring about tax cuts introduce
MYL,MYL:UW,BBG000BPQMX8,"Week In Review: Trump Talks, Stocks Hit Highs, Amazon Is A Go",2016-12-09 21:17:00 +0000,http://www.investors.com/news/week-in-review-trump-talks-stocks-hits-high-amazon-is-a-go/,"Week In Review: Trump Talks, Stocks Hit Highs, Amazon Is A Go"
MYL,MYL:UW,BBG000BPQMX8,"Pharma Stock Roundup: Drug Pricing Heat Back on Sector, Endo, Mylan, AZN to Cut Jobs",2016-12-09 13:28:01 +0000,http://finance.yahoo.com/news/pharma-stock-roundup-drug-pricing-132801721.html,"Pharma Stock Roundup: Drug Pricing Heat Back on Sector, Endo, Mylan, AZN to Cut Jobs"
MYL,MYL:UW,BBG000BPQMX8,Allergan Says Dissapointed In PTAB's Decision On RESTASIS Patents,2016-12-09 00:01:00 +0000,http://articlefeeds.nasdaq.com/~r/nasdaq/symbols/~3/DORB_yJb9Yk/allergan-says-dissapointed-in-ptabs-decision-on-restasis-patents-20161209-00003,Allergan Says Dissapointed In PTAB's Decision On RESTASIS Patents
MYL,MYL:UW,BBG000BPQMX8,5 Drug Stocks to Avoid as Trump Vows to Lower Drug Prices,2016-12-08 22:57:11 +0000,http://articlefeeds.nasdaq.com/~r/nasdaq/symbols/~3/YofTRa5XzCU/5-drug-stocks-to-avoid-as-trump-vows-to-lower-drug-prices-cm718932,For those who thought that the pharma biotech sector is in for an extraordinary run after Donald Trump s unexpected victory his latest vow to crack down on excessive drug price hikes comes as a bolt from the blue This year has been fraught with headwinds for the pharma biotech sector
MYL,MYL:UW,BBG000BPQMX8,"Left: Pharma are the new banks, banks are the new pharma",2016-12-08 22:33:00 +0000,http://finance.yahoo.com/video/left-pharma-banks-banks-pharma-223300069.html,"Left: Pharma are the new banks, banks are the new pharma"
MYL,MYL:UW,BBG000BPQMX8,"Market Close Report: Historical high reached as NASDAQ Composite Index closes at 5,417.36.",2016-12-08 21:48:03 +0000,http://articlefeeds.nasdaq.com/~r/nasdaq/symbols/~3/lXELnFm_Y6Q/market-close-report-historical-high-reached-as-nasdaq-composite-index-closes-at-541736-cm718930,Thursday s session closes with the NASDAQ Composite Index reaching a historical high The index closed at 5 417 36 up 23 6 for the day The index first reached the 5000 mark on 11 25 2016 The total shares traded for the NASDAQ was over 2 21 billion Thursday s session closes with the
MYL,MYL:UW,BBG000BPQMX8,5 Drug Stocks to Avoid as Trump Vows to Lower Drug Prices,2016-12-08 21:19:09 +0000,http://finance.yahoo.com/news/5-drug-stocks-avoid-trump-211909752.html,5 Drug Stocks to Avoid as Trump Vows to Lower Drug Prices
MYL,MYL:UW,BBG000BPQMX8,"Should You Invest in St. Jude Medical, Inc. (STJ)?",2016-12-08 18:26:32 +0000,http://www.insidermonkey.com/blog/should-you-invest-in-st-jude-medical-inc-stj-490145/,"Should You Invest in St. Jude Medical, Inc. (STJ)?"
MYL,MYL:UW,BBG000BPQMX8,Pfizer (PFE) Fined for Price Hike of Anti-Epilepsy Drug in UK,2016-12-08 16:57:54 +0000,http://articlefeeds.nasdaq.com/~r/nasdaq/symbols/~3/MAimRKI2pk4/pfizer-pfe-fined-for-price-hike-of-anti-epilepsy-drug-in-uk-cm718656,Leading pharma company Pfizer Inc PFE was levied a fine of 107 million 84 2 million by the Competition and Markets Authority CMA of the UK upon finding that it had violated competition laws by charging excessive and unfair prices for its anti epilepsy drug phenytoin sodium capsules
MYL,MYL:UW,BBG000BPQMX8,"Mylan (MYL) Stock Falls on Restructuring Plans, Layoffs",2016-12-08 16:01:32 +0000,http://articlefeeds.nasdaq.com/~r/nasdaq/symbols/~3/tZcGu2iAt1A/mylan-myl-stock-falls-on-restructuring-plans-layoffs-cm718589,In an 8 K filing generic drug maker Mylan N V MYL revealed restructuring programs in certain locations in an attempt to streamline its operations globally as it focuses on the integration of acquired businesses The company expects to cut less than 10 of its global workforce marking the
MYL,MYL:UW,BBG000BPQMX8,Pfizer (PFE) Fined for Price Hike of Anti-Epilepsy Drug in UK,2016-12-08 15:08:03 +0000,http://finance.yahoo.com/news/pfizer-pfe-fined-price-hike-150803342.html,Pfizer (PFE) Fined for Price Hike of Anti-Epilepsy Drug in UK
MYL,MYL:UW,BBG000BPQMX8,Should Biotech Investors Worry About Donald Trump?,2016-12-08 15:01:05 +0000,http://articlefeeds.nasdaq.com/~r/nasdaq/symbols/~3/kPsuChBg-A8/should-biotech-investors-worry-about-donald-trump-cm718499,The biotech sector got a major wake up call yesterday President elect Donald Trump does not like price increases Biotech stocks which enjoy huge profit margins under current law had jumped 9 the day after Trump s election reflecting relief that the price controls that Hillary Clinton
MYL,MYL:UW,BBG000BPQMX8,Bulls targeting specific drug names,2016-12-08 14:02:06 +0000,http://finance.yahoo.com/news/bulls-targeting-specific-drug-names-140206441.html,Bulls targeting specific drug names
MYL,MYL:UW,BBG000BPQMX8,"Mylan (MYL) Stock Falls on Restructuring Plans, Layoffs",2016-12-08 14:00:02 +0000,http://finance.yahoo.com/news/mylan-myl-stock-falls-restructuring-140002346.html,"Mylan (MYL) Stock Falls on Restructuring Plans, Layoffs"
MYL,MYL:UW,BBG000BPQMX8,Trump Presidency Could Offer New Challenges for Shaky Drug Sector,2016-12-08 13:45:00 +0000,https://www.thestreet.com/story/13918106/1/trump-presidency-could-offer-new-challenges-for-shaky-drug-sector.html?puc=yahoo&cm_ven=YAHOO,Trump Presidency Could Offer New Challenges for Shaky Drug Sector
MYL,MYL:UW,BBG000BPQMX8,"DEADLINE ALERT: Brower Piven Notifies Shareholders of Upcoming Deadline In Class Action Lawsuit And Urges Those With Losses In Excess of $100,000 From Investment In Mylan N.V. To Contact The Firm - MYL",2016-12-08 11:00:00 +0000,http://finance.yahoo.com/news/deadline-alert-brower-piven-notifies-110000394.html,"[GlobeNewswire] - STEVENSON, Md., Dec. 08, 2016-- The securities litigation law firm of Brower Piven, A Professional Corporation, announces that a class action lawsuit has been commenced in the United States District Court ..."
MYL,MYL:UW,BBG000BPQMX8,"Trump Targets Drug Prices And Apple, Seeks '5 Minutes' With Offshoring Firms",2016-12-07 21:33:10 +0000,http://www.investors.com/news/time-person-of-the-year-trump-wants-lower-drug-costs-yuge-apple-factory/,"Trump Targets Drug Prices And Apple, Seeks '5 Minutes' With Offshoring Firms"
MYL,MYL:UW,BBG000BPQMX8,Mylan Nose-Dives On Plan To Slash 10% Of Workforce Following M&A,2016-12-07 21:21:16 +0000,http://www.investors.com/news/technology/mylan-nosedives-on-plan-to-slash-10-of-workforce-following-ma/,Mylan Nose-Dives On Plan To Slash 10% Of Workforce Following M&A
MYL,MYL:UW,BBG000BPQMX8,Drug Stocks Topple On Donald Trump's Pledge To Bring Down Drug Prices,2016-12-07 21:12:13 +0000,http://www.investors.com/research/ibd-industry-themes/biotechs-topple-on-donald-trumps-pledge-to-bring-down-drug-prices/,Drug Stocks Topple On Donald Trump's Pledge To Bring Down Drug Prices
MYL,MYL:UW,BBG000BPQMX8,"Trump Vows to Slash Drug Prices, Sends Biotech Stocks Lower",2016-12-07 20:56:14 +0000,http://articlefeeds.nasdaq.com/~r/nasdaq/symbols/~3/Y0IMqD-bOGE/trump-vows-to-slash-drug-prices-sends-biotech-stocks-lower-cm718245,The post election biotech honeymoon is over Shares of the iShares Nasdaq Biotechnology ETF IBB are down more than 3 6 in morning trading Wednesday following a new warning from President elect Donald Trump that he will indeed be targeting high drug prices Immediately following the election
MYL,MYL:UW,BBG000BPQMX8,Trump Talk Moves Market Again — Who Is It This Time?,2016-12-07 19:32:17 +0000,http://finance.yahoo.com/video/trump-talk-moves-market-again-193217316.html,Trump Talk Moves Market Again — Who Is It This Time?
MYL,MYL:UW,BBG000BPQMX8,Drug pressure deja vu?,2016-12-07 17:07:00 +0000,http://finance.yahoo.com/video/drug-pressure-deja-vu-170700183.html,Drug pressure deja vu?
MYL,MYL:UW,BBG000BPQMX8,"S&P 500 Movers: MYL, WDC",2016-12-07 16:57:59 +0000,http://articlefeeds.nasdaq.com/~r/nasdaq/symbols/~3/WuUZmMWzcGg/sp-500-movers-myl-wdc-cm718039,In early trading on Wednesday shares of Western Digital WDC topped the list of the day s best performing components of the S amp P 500 index trading up 4 5 Year to date Western Digital registers a 11 2 gain And the worst performing S amp P 500 component thus far on the day
MYL,MYL:UW,BBG000BPQMX8,"Nasdaq 100 Movers: INCY, WDC",2016-12-07 16:57:50 +0000,http://articlefeeds.nasdaq.com/~r/nasdaq/symbols/~3/tjgLo_Ew2So/nasdaq-100-movers-incy-wdc-cm718035,In early trading on Wednesday shares of Western Digital WDC topped the list of the day s best performing components of the Nasdaq 100 index trading up 5 0 Year to date Western Digital registers a 11 6 gain And the worst performing Nasdaq 100 component thus far on the day is
MYL,MYL:UW,BBG000BPQMX8,Bernie Sanders' 'Trump Proposal' To Lower Drug Prices Blocked By Senate Republicans,2016-12-07 16:13:01 +0000,http://finance.yahoo.com/news/bernie-sanders-trump-proposal-lower-161301621.html,Bernie Sanders' 'Trump Proposal' To Lower Drug Prices Blocked By Senate Republicans
MYL,MYL:UW,BBG000BPQMX8,The Worst American Stocks of 2016,2016-12-07 15:58:07 +0000,http://articlefeeds.nasdaq.com/~r/nasdaq/symbols/~3/kXUuVSAE4Tg/the-worst-american-stocks-of-2016-cm717934,Image credit Getty Images All things considered it s been a pretty good year to be an investor in American stocks The S amp P 500 has returned 10 2 including dividends But that s the average there are plenty of stocks that have suffered substantial losses in 2016 All three
MYL,MYL:UW,BBG000BPQMX8,Trump Vs. Clinton: Who's Had A Bigger Market Impact With Their Tweets?,2016-12-07 15:03:26 +0000,http://finance.yahoo.com/news/trump-vs-clinton-whos-had-150326417.html,Trump Vs. Clinton: Who's Had A Bigger Market Impact With Their Tweets?
MYL,MYL:UW,BBG000BPQMX8,"Mylan To Restructure Global Operations, To Affect Less Than 10% Of Workforce",2016-12-07 14:56:33 +0000,http://finance.yahoo.com/news/mylan-restructure-global-operations-affect-145633615.html,"Mylan To Restructure Global Operations, To Affect Less Than 10% Of Workforce"
MYL,MYL:UW,BBG000BPQMX8,The Worst American Stocks of 2016,2016-12-07 14:22:05 +0000,http://www.fool.com/investing/2016/12/07/the-worst-american-stocks-of-2016.aspx?source=yahoo-2&utm_campaign=article&utm_medium=feed&utm_source=yahoo-2,The Worst American Stocks of 2016
MYL,MYL:UW,BBG000BPQMX8,Epipen maker Mylan says may cut jobs,2016-12-07 13:37:24 +0000,http://finance.yahoo.com/news/epipen-maker-mylan-says-may-133724914.html,Epipen maker Mylan says may cut jobs
MYL,MYL:UW,BBG000BPQMX8,"MYLAN N.V. Files SEC form 8-K, Costs Associated with Exit or Disposal Activities",2016-12-07 13:13:34 +0000,http://biz.yahoo.com/e/161207/myl8-k.html,"MYLAN N.V. Files SEC form 8-K, Costs Associated with Exit or Disposal Activities"
MYL,MYL:UW,BBG000BPQMX8,Mylan looking to cut up to 10 percent of global workforce,2016-12-07 02:29:49 +0000,http://www.bizjournals.com/pittsburgh/news/2016/12/06/mylan-looking-to-cut-up-to-10-percent-of-global.html?ana=yahoo,Mylan looking to cut up to 10 percent of global workforce
