MYL,MYL:UW,BBG000BPQMX8,Theravance/Mylan Presents Phase III Data on COPD Candidate,2017-05-24 16:34:36 +0000,http://articlefeeds.nasdaq.com/~r/nasdaq/symbols/~3/ULdFkogK2Ik/theravancemylan-presents-phase-iii-data-on-copd-candidate-cm793966,Theravance Biopharma Inc TBPH along with its partner Mylan MYL recently announced the presentation of additional efficacy and safety data from two pivotal phase III studies evaluating its key late stage pipeline candidate revefenacin TD 4208 The presentation was made at the
MYL,MYL:UW,BBG000BPQMX8,Theravance/Mylan Presents Phase III Data on COPD Candidate,2017-05-24 14:27:02 +0000,https://finance.yahoo.com/news/theravance-mylan-presents-phase-iii-142702977.html?.tsrc=rss,"Theravance Biopharma, Inc. (TBPH) and partner Mylan recently announced the presentation of additional efficacy and safety data from two pivotal phase III studies evaluating its key pipeline candidate, revefenacin (TD-4208)."
MYL,MYL:UW,BBG000BPQMX8,"Mylan NV breached its 50 day moving average in a Bullish Manner : MYL-US : May 24, 2017",2017-05-24 12:13:59 +0000,http://finance.yahoo.com/r/b0b25b47-1902-3c78-af89-d34e24544fd8/mylan-nv-breached-its-50-day-moving-average-in-a-bullish-manner-myl-us-may-24-2017?yptr=yahoo&.tsrc=rss,"Categories:  ETFs Yahoo FinanceClick here to see latest analysis *Disclaimer : This is as of previous day’s closing price. Technical Indicators Below is a quick look at 5 technical indicators for Mylan NV. More studies are available on the Technical Chart. Indicator Signal Closing Price above/below 50 Day Moving Average Bullish Closing Price above/below 200 Day Moving Average ... Read more
<b>(Read more...)</b>"
MYL,MYL:UW,BBG000BPQMX8,"Market Close Report: NASDAQ Composite index closes at 6,138.71 up 5.09 points",2017-05-23 20:48:38 +0000,http://articlefeeds.nasdaq.com/~r/nasdaq/symbols/~3/45nBgg_am4U/market-close-report-nasdaq-composite-index-closes-at-613871-up-509-points-cm793575,Tuesday s session closes with the NASDAQ Composite Index at 6 138 71 The total shares traded for the NASDAQ was over 1 73 billion Tuesday s session closes with the NASDAQ Composite Index at 6 138 71 The total shares traded for the NASDAQ was over 1 73 billion Advancers stocks led declining
MYL,MYL:UW,BBG000BPQMX8,"Notable Tuesday Option Activity: ISRG, MYL, DAL",2017-05-23 19:12:48 +0000,http://articlefeeds.nasdaq.com/~r/nasdaq/symbols/~3/0mzCVyq9dy8/notable-tuesday-option-activity-isrg-myl-dal-cm793505,Looking at options trading activity among components of the S amp P 500 index there is noteworthy activity today in Intuitive Surgical Inc Symbol ISRG where a total volume of 1 753 contracts has been traded thus far today a contract volume which is representative of approximately 175
MYL,MYL:UW,BBG000BPQMX8,Theravance Biopharma and Mylan Report Additional Phase 3 Data for Revefenacin (TD-4208) in Several Presentations at 2017 ATS,2017-05-23 13:15:00 +0000,https://finance.yahoo.com/news/theravance-biopharma-mylan-report-additional-131500334.html?.tsrc=rss,"DUBLIN, HERTFORDSHIRE, England and PITTSBURGH, May 23, 2017 /PRNewswire/ -- Theravance Biopharma, Inc. (TBPH) (""Theravance Biopharma"") and Mylan N.V. (NASDAQ, TASE: MYL) (""Mylan"") today announced the presentation of additional efficacy and safety data from the three-month, pivotal Phase 3 studies of revefenacin (TD-4208) at the American Thoracic Society (ATS) International Conference in Washington, D.C.  Revefenacin is an investigational long-acting muscarinic antagonist (LAMA) and a proposed once-daily, nebulized bronchodilator in development for the treatment of chronic obstructive pulmonary disease (COPD).  Researchers presented new data from the completed three-month Phase 3 studies, which included more than 1,250 patients with moderate to very severe COPD, in two separate presentations at the 2017 ATS meeting."
MYL,MYL:UW,BBG000BPQMX8,Theravance Biopharma and Mylan Report Additional Phase 3 Data for Revefenacin (TD-4208) in Several Presentations at 2017 ATS,2017-05-23 13:15:00 +0000,https://finance.yahoo.com/news/theravance-biopharma-mylan-report-additional-131500354.html?.tsrc=rss,"DUBLIN and HERTFORDSHIRE, United Kingdom and PITTSBURGH, May 23, 2017 /PRNewswire/ -- Theravance Biopharma, Inc. (TBPH) (""Theravance Biopharma"") and Mylan N.V. (NASDAQ, TASE: MYL) (""Mylan"") today announced the presentation of additional efficacy and safety data from the three-month, pivotal Phase 3 studies of revefenacin (TD-4208) at the American Thoracic Society (ATS) International Conference in Washington, D.C.  Revefenacin is an investigational long-acting muscarinic antagonist (LAMA) and a proposed once-daily, nebulized bronchodilator in development for the treatment of chronic obstructive pulmonary disease (COPD).  Researchers presented new data from the completed three-month Phase 3 studies, which included more than 1,250 patients with moderate to very severe COPD, in two separate presentations at the 2017 ATS meeting."
MYL,MYL:UW,BBG000BPQMX8,"It's Easy To Be Skeptical Of Mylan, But Don't Ignore This Pending PDUFA Date",2017-05-22 16:25:45 +0000,https://finance.yahoo.com/news/easy-skeptical-mylan-dont-ignore-162545056.html?.tsrc=rss,"Commenting on Mylan N.V. (NASDAQ: MYL ), Barclays said there's understandably reason to be skeptical that the company will win approval for its generic version of Copaxone now after years of promises. ..."
MYL,MYL:UW,BBG000BPQMX8,Mylan Stock Gains Following Barclays Upgrade,2017-05-22 14:47:00 +0000,http://finance.yahoo.com/r/3013107d-4117-345e-a21c-512c32f7c5fc/mylan-stock-gains-following-barclays-upgrade.html?puc=yahoo&cm_ven=YAHOO&yptr=yahoo&.tsrc=rss,The firm upgraded Mylan to 'overweight' from 'equal weight.'
MYL,MYL:UW,BBG000BPQMX8,Mylan To Present At UBS Global Healthcare Conference; Webcast At 2:30 PM ET,2017-05-22 13:30:00 +0000,http://articlefeeds.nasdaq.com/~r/nasdaq/symbols/~3/OW5wnD1OzlQ/mylan-to-present-at-ubs-global-healthcare-conference-webcast-at-230-pm-et-20170522-00908,Mylan To Present At UBS Global Healthcare Conference; Webcast At 2:30 PM ET
MYL,MYL:UW,BBG000BPQMX8,"John Paulson Sells VMware, Hewlett Packard, Several Other Holdings",2017-05-20 17:11:28 +0000,http://articlefeeds.nasdaq.com/~r/nasdaq/symbols/~3/dhoa6c2rkCk/john-paulson-sells-vmware-hewlett-packard-several-other-holdings-cm792291,John Paulson Trades Portfolio manages a portfolio composed of 97 stocks that is valued at 7 5 billion During the first quarter the guru sold shares of the following stocks John Paulson Trades Portfolio manages a portfolio composed of 97 stocks that is valued at 7 5
MYL,MYL:UW,BBG000BPQMX8,Mylan N.V. -- Moody's assigns Baa3 to Mylan's euro notes offering; stable outlook,2017-05-17 12:41:06 +0000,http://finance.yahoo.com/r/3c6e25df-fa16-3689-a9e4-7fa777050802/viewresearchdoc.aspx?docid=PR_366745&WT.mc_id=AM~WWFob29fRmluYW5jZTQyX1NCX0NWX1JhdGluZ19OZXdzX0FsbF9Fbmc=~20170517_PR_366745&yptr=yahoo&.tsrc=rss,"Rating Action: Moody's assigns Baa3 to Mylan's euro notes offering; stable outlook. Global Credit Research- 17 May 2017. New York, May 17, 2017-- Moody's Investors Service assigned a Baa3 rating to the ..."
MYL,MYL:UW,BBG000BPQMX8,Theravance Biopharma and Mylan to Present Additional Data for Revefenacin (TD-4208) in Several Presentations at 2017 ATS,2017-05-17 12:30:00 +0000,https://finance.yahoo.com/news/theravance-biopharma-mylan-present-additional-123000952.html?.tsrc=rss,"DUBLIN and HERTFORDSHIRE, England and PITTSBURGH, May 17, 2017 /PRNewswire/ -- Theravance Biopharma, Inc. (TBPH) (""Theravance Biopharma"") and Mylan N.V. (NASDAQ, TASE: MYL) (""Mylan"") today announced that data from several studies of revefenacin (TD-4208) will be presented at the American Thoracic Society (ATS) International Conference, which is being held in Washington, D.C., May 19-24, 2017."
MYL,MYL:UW,BBG000BPQMX8,Mylan Honors National Women's Health Week to Empower Women to Take Control of Their Health,2017-05-16 14:14:00 +0000,https://finance.yahoo.com/news/mylan-honors-national-womens-health-141400551.html?.tsrc=rss,"HERTFORDSHIRE, England and PITTSBURGH, May 16, 2017 /PRNewswire/ -- Mylan N.V. (NASDAQ, TASE: MYL) today joins the U.S. Department of Health and Human Services (HHS) Office on Women's Health in recognizing the 18th annual National Women's Health Week.  This year's goal is to empower women to make their health a priority and take steps to help improve their health.  Mylan CEO Heather Bresch commented, ""As a global healthcare and leading generics company, Mylan is focused on creating better health for a better world by making healthcare accessible to everyone."
MYL,MYL:UW,BBG000BPQMX8,Third Time Is Not the Charm for PPG as Azko Nobel Rejects Another Offer,2017-05-16 13:18:31 +0000,http://articlefeeds.nasdaq.com/~r/nasdaq/symbols/~3/Y01nOHAZgys/third-time-is-not-the-charm-for-ppg-as-azko-nobel-rejects-another-offer-cm789702,PPG Industries NYSE PPG has apparently taken to heart the old saying If at first you don t succeed try try again in its pursuit of coatings specialist Akzo Nobel NASDAQOTH AKZOY The suitor has now made three offers to acquire its rival the most recent for 28
MYL,MYL:UW,BBG000BPQMX8,3 Top Healthcare Stocks to Buy Now,2017-05-16 13:17:53 +0000,http://articlefeeds.nasdaq.com/~r/nasdaq/symbols/~3/0MY7CFTznkI/3-top-healthcare-stocks-to-buy-now-cm789686,What industry should experience solid demand even if the economy takes a downturn What industry represents nearly one fifth of the U S economy and is growing rapidly 160 What industry should experience growing demand over the long run because of unstoppable demographic trends
MYL,MYL:UW,BBG000BPQMX8,3 Top Healthcare Stocks to Buy Now,2017-05-16 12:04:00 +0000,http://finance.yahoo.com/r/c3ccc8c3-0413-3308-911b-47991ac2c7be/3-top-healthcare-stocks-to-buy-now.aspx?yptr=yahoo&.tsrc=rss,"Here&apos;s what makes Alexion Pharmaceuticals, Edwards Lifesciences, and Mylan great healthcare stocks for the long term."
MYL,MYL:UW,BBG000BPQMX8,EpiPens can stay potent for years after they expire,2017-05-13 16:19:02 +0000,http://finance.yahoo.com/r/093d1e4a-e327-3979-ac97-7a9f8d55fcc8/Story.aspx?guid=0E085756-34E2-11E7-B0D1-949E1A52BC8A&siteid=yhoof2&yptr=yahoo&.tsrc=rss,Experts caution that patients should still regularly refill their prescriptions.
MYL,MYL:UW,BBG000BPQMX8,Tepper's Appaloosa Trims Bets on Pharmaceuticals,2017-05-12 21:19:38 +0000,http://finance.yahoo.com/r/2dc2a4a8-b255-34e8-8134-364a112f6695/appaloosa0512?mod=yahoo_hs&yptr=yahoo&.tsrc=rss,David Tepper's Appaloosa Management trimmed its wagers on pharmaceutical companies in the first quarter and sold out of retailer J.C. Penney.
MYL,MYL:UW,BBG000BPQMX8,Health: EpiPen maker accused of overcharging for asthma drug,2017-05-12 14:40:13 +0000,http://finance.yahoo.com/r/0b2c5c5a-3296-3f52-a009-f126ca9e15dd/health-epipen-maker-accused-of-overcharging-for.html?ana=yahoo&yptr=yahoo&.tsrc=rss,"A lawsuit filed Thursday by the Self-Insured Schools of California accuses EpiPen manufacturer Mylan and Sun Pharmaceutical Industries of conspiring to charge higher prices for a generic asthma medication, Axios reported, the second time this year the company has been accused of price gouging.  In April, Mylan (NASDAQ-MYL) was named in a class-action  racketeering lawsuit that alleged the skyrocketing price of the EpiPen, used by patients to mitigate severe allergic reactions, was the result of Mylan paying rebates for pharmacies' benefit.  In September 2016, Mylan CEO Heather Bresch defended both her company ’s  EpiPen pricing and her $18 million salary when she testified before a House Oversight and Government Reform Committee hearing."
MYL,MYL:UW,BBG000BPQMX8,"Teva (TEVA) Q1 Earnings In Line, Sales Lag as Copaxone Falls",2017-05-12 14:07:03 +0000,http://articlefeeds.nasdaq.com/~r/nasdaq/symbols/~3/aS3gg3JZRig/teva-teva-q1-earnings-in-line-sales-lag-as-copaxone-falls-cm788375,Teva Pharmaceutical Industries Ltd TEVA reported first quarter 2017 earnings of 1 03 per share including equity compensation expenses which was in line with the Zacks Consensus Estimate The year ago adjusted earnings were 1 18 per share Revenues of 5 63 billion missed the
MYL,MYL:UW,BBG000BPQMX8,Why prescription drug prices keep going up,2017-05-12 13:31:59 +0000,http://finance.yahoo.com/news/prescription-drug-prices-keep-going-133159672.html?.tsrc=rss,Prices of prescription drugs have skyrocketed in recent years. Here&apos;s a look at why.
MYL,MYL:UW,BBG000BPQMX8,"Pharma Stock Roundup: Mylan, Teva Q1 Earnings, Roche Drug Misses in Pivotal Study",2017-05-12 12:49:12 +0000,http://finance.yahoo.com/news/pharma-stock-roundup-mylan-teva-124912888.html?.tsrc=rss,"While companies like Mylan (MYL), Allergan and Teva reported Q1 results this week, several companies provided updates on their cancer drugs."
MYL,MYL:UW,BBG000BPQMX8,Edited Transcript of MYL earnings conference call or presentation 10-May-17 2:00pm GMT,2017-05-11 20:30:55 +0000,http://finance.yahoo.com/news/edited-transcript-myl-earnings-conference-123048698.html?.tsrc=rss,Q1 2017 Mylan NV Earnings Call
MYL,MYL:UW,BBG000BPQMX8,"Thursday Sector Leaders: Healthcare, Materials",2017-05-11 20:00:46 +0000,http://articlefeeds.nasdaq.com/~r/nasdaq/symbols/~3/CSfgxCKULwA/thursday-sector-leaders-healthcare-materials-cm788096,Looking at the sectors faring best as of midday Thursday shares of Healthcare companies are outperforming other sectors losing just 0 1 Within that group Mylan NV Symbol MYL and Becton Dickinson amp Co Symbol BDX are two large stocks leading the way showing a gain of 3 1 and 2
MYL,MYL:UW,BBG000BPQMX8,"Nasdaq 100 Movers: SYMC, MYL",2017-05-11 16:04:46 +0000,http://articlefeeds.nasdaq.com/~r/nasdaq/symbols/~3/cQHtwvmnV7k/nasdaq-100-movers-symc-myl-cm787901,In early trading on Thursday shares of Mylan MYL topped the list of the day s best performing components of the Nasdaq 100 index trading up 1 7 Year to date Mylan registers a 1 9 gain And the worst performing Nasdaq 100 component thus far on the day is Symantec SYMC
MYL,MYL:UW,BBG000BPQMX8,"Company News for May 11, 2017",2017-05-11 16:04:21 +0000,http://articlefeeds.nasdaq.com/~r/nasdaq/symbols/~3/Kx9KHdpjSIg/company-news-for-may-11-2017-cm787835,160 160 160 Shares of Mylan N V MYL gained 0 5 after the company posted first quarter 2017 earnings of 0 93 per share up from 0 76 reported in the year ago quarter 160 160 160 Yelp Inc s YELP shares tanked 18 4 after the company reported first quarter 2017
MYL,MYL:UW,BBG000BPQMX8,"Company News for May 11, 2017",2017-05-11 14:10:02 +0000,http://finance.yahoo.com/news/company-news-may-11-2017-141002028.html?.tsrc=rss,"Companies in the News are: MYL,YELP,EA,WEN"
MYL,MYL:UW,BBG000BPQMX8,EpiPen price hike was ‘intentional’: AllergyKids Founder,2017-05-10 20:59:30 +0000,http://finance.yahoo.com/video/epipen-price-hike-intentional-allergykids-205930577.html?.tsrc=rss,AllergyKids Foudner Robyn O’Brien on Mylan Chairman’s big payday of 97.6 million during the EpiPen price hike controversy.
MYL,MYL:UW,BBG000BPQMX8,"Mylan (MYL) Beats on Q1 Earnings, Revenues Miss Estimates",2017-05-10 20:03:50 +0000,http://articlefeeds.nasdaq.com/~r/nasdaq/symbols/~3/F_6v_ezJ1uU/mylan-myl-beats-on-q1-earnings-revenues-miss-estimates-cm787448,Mylan N V MYL reported first quarter 2017 results wherein earnings of 93 cents per share beat the Zacks Consensus Estimate by a penny and was up from 76 cents reported in the year ago quarter We note that shares of Mylan have outperformed the Zacks categorized Medical Generic
MYL,MYL:UW,BBG000BPQMX8,Mylan Q1 Revenue Falls Short Of Views As EpiPen Sales Decline,2017-05-10 20:01:01 +0000,http://finance.yahoo.com/r/456e5339-8c4e-3dde-900d-98c09fd4889e/mylan-q1-revenue-falls-short-as-epipen-sales-decline?src=A00220&yptr=yahoo&.tsrc=rss,Mylan reported adjusted income of 93 cents a share on revenue of $2.72 billion for the first quarter. Analysts modeled earnings of 93 cents a share on sales of $2.84 billion.
MYL,MYL:UW,BBG000BPQMX8,Mylan disagrees with FDA over generic Advair delay,2017-05-10 19:26:01 +0000,http://finance.yahoo.com/news/epipen-maker-mylans-profit-surges-114218313.html?.tsrc=rss,"Mylan President Rajiv Malik said the FDA was asking it to comply with standards set out in draft guidance the agency issued, but that it believes it is not required to do so.  An FDA spokeswoman declined to comment, saying she was prohibited by law from discussing a pending application.  Mylan made the comments while reporting first-quarter earnings, in which it flagged declining sales for emergency allergy treatment EpiPen but said it will still meet previously announced earnings targets for the year."
MYL,MYL:UW,BBG000BPQMX8,Mylan edges past profit estimates,2017-05-10 19:22:05 +0000,https://www.yahoo.com/news/mylan-edges-past-profit-estimates-192205979.html?.tsrc=rss,"EpiPen maker Mylan reported a first-quarter profit that edged past expectations, helped by demand for products of Meda, a Swedish company it bought earlier. Fred Katayama reports."
MYL,MYL:UW,BBG000BPQMX8,"Noteworthy Wednesday Option Activity: BLK, KSS, MYL",2017-05-10 19:01:15 +0000,http://articlefeeds.nasdaq.com/~r/nasdaq/symbols/~3/cl_lF-uJHSI/noteworthy-wednesday-option-activity-blk-kss-myl-cm787380,Looking at options trading activity among components of the S amp P 500 index there is noteworthy activity today in BlackRock Inc Symbol BLK where a total volume of 2 295 contracts has been traded thus far today a contract volume which is representative of approximately 229 500
MYL,MYL:UW,BBG000BPQMX8,Better Buy: GlaxoSmithKline vs. Johnson & Johnson,2017-05-10 18:03:59 +0000,http://articlefeeds.nasdaq.com/~r/nasdaq/symbols/~3/OuDHx88rOyA/better-buy-glaxosmithkline-vs-johnson-johnson-cm787352,The stocks of big pharmaceutical companies are usually not very exciting but that s just fine for savvy investors who value safe dividends and the fact that these stocks often outperform the market in downturns GlaxoSmithKline NYSE GSK and Johnson amp Johnson NYSE JNJ
MYL,MYL:UW,BBG000BPQMX8,Mylan NV (MYL) Ekes Out Q1 Earnings Beat Despite EpiPen Sales Decline,2017-05-10 18:01:31 +0000,http://articlefeeds.nasdaq.com/~r/nasdaq/symbols/~3/ngkGtYSF3dE/mylan-nv-myl-ekes-out-q1-earnings-beat-despite-epipen-sales-decline-cm787390,InvestorPlace Stock Market News Stock Advice amp Trading Tips Mylan NV SWX MYL gave investors a shot in the arm today delivering Q1 results 160 just above expectations even as MYL s EpiPen sales fell Source Shutterstock Mylan said Q1 2017 net income was 160 66
MYL,MYL:UW,BBG000BPQMX8,"Mylan (MYL) Beats on Q1 Earnings, Revenues Miss Estimates",2017-05-10 17:27:05 +0000,http://finance.yahoo.com/news/mylan-myl-beats-q1-earnings-172705598.html?.tsrc=rss,Mylan&apos;s (MYL) first-quarter results beat on earnings but missed the top line due to a decline in EpiPen sales.
MYL,MYL:UW,BBG000BPQMX8,Acquisitions Drive Mylan N.V. Revenue and Earnings Higher in Q1,2017-05-10 16:04:20 +0000,http://articlefeeds.nasdaq.com/~r/nasdaq/symbols/~3/0sXJK7evY_U/acquisitions-drive-mylan-nv-revenue-and-earnings-higher-in-q1-cm787211,Everything looked great when Mylan N V NASDAQ MYL reported its quarterly results in March The drugmaker 160 enjoyed a tremendous fourth quarter with revenue and earnings soaring thanks in large part to its 2016 acquisitions Mylan announced its first quarter 2017
MYL,MYL:UW,BBG000BPQMX8,Mylan Unhappy With FDA Standards for Asthma Drug,2017-05-10 15:56:00 +0000,http://finance.yahoo.com/r/11089238-5b7b-36cf-98ac-0bc429ec9a0e/mylan-isn-t-happy-with-fda-standards-for-asthma-drug.html?puc=yahoo&cm_ven=YAHOO&yptr=yahoo&.tsrc=rss,Earlier this year the FDA sent Mylan a letter saying it would not approve its drug.
MYL,MYL:UW,BBG000BPQMX8,Mylan’s EpiPen sales have taken a hit,2017-05-10 15:46:41 +0000,http://finance.yahoo.com/r/f22ca939-efb0-3452-808c-0e4475eec7ab/Story.aspx?guid=1A745210-357D-11E7-8780-25CF199941A8&siteid=yhoof2&yptr=yahoo&.tsrc=rss,"Mylan is offering a cheaper version of the treatment, and new competition has further affected earnings."
MYL,MYL:UW,BBG000BPQMX8,Mylan says disagrees with FDA over generic Advair delay,2017-05-10 15:37:50 +0000,http://finance.yahoo.com/news/mylan-says-disagrees-fda-over-153750712.html?.tsrc=rss,"Drugmaker Mylan Inc , which is trying to launch a generic form of GlaxoSmithKline's Advair asthma treatment, on Wednesday said it is in disagreement with the U.S. Food and Drug Administration over the ..."
MYL,MYL:UW,BBG000BPQMX8,"I'm Losing Money on Mylan, but I'm Not Selling",2017-05-10 15:03:00 +0000,http://articlefeeds.nasdaq.com/~r/nasdaq/symbols/~3/-z3bLSg7U7c/im-losing-money-on-mylan-but-im-not-selling-cm787100,Mylan Inc NASDAQ MYL is one of the world s biggest drugmakers and it s also one of Fool contributor Todd Campbell s worst performing stock picks The company s EpiPen fiasco and worries over investigations into generic drug pricing have sent shares falling but
MYL,MYL:UW,BBG000BPQMX8,Mylan Q1 Revenue Falls Short Of Views As EpiPen Sales Decline,2017-05-10 14:51:01 +0000,http://finance.yahoo.com/r/413995ff-d9d7-3f32-b559-472a5086baf6/mylan-q1-revenue-falls-short-as-epipen-sales-decline-branch?src=A00220&yptr=yahoo&.tsrc=rss,Mylan reported adjusted income of 93 cents a share on revenue of $2.72 billion for the first quarter. Analysts modeled earnings of 93 cents a share on sales of $2.84 billion.
MYL,MYL:UW,BBG000BPQMX8,Acquisitions Drive Mylan N.V. Revenue and Earnings Higher in Q1,2017-05-10 14:23:00 +0000,http://finance.yahoo.com/r/188c5860-2323-37da-8b58-92300e779149/acquisitions-drive-mylan-nv-revenue-and-earnings-h.aspx?yptr=yahoo&.tsrc=rss,"The drugmaker enjoys strong gains internationally thanks to its Meda acquisition, but faces some headwinds in North America."
MYL,MYL:UW,BBG000BPQMX8,Mylan (MYL) Tops on Q1 Earnings,2017-05-10 14:06:07 +0000,http://articlefeeds.nasdaq.com/~r/nasdaq/symbols/~3/r6TSNdY4vhI/mylan-myl-tops-on-q1-earnings-cm787043,Mylan N V MYL is a global pharmaceutical company with a well established generics business as well as a presence in specialty pharmaceuticals The company s business model includes the development manufacturing and marketing of branded and generic drugs as well as active
MYL,MYL:UW,BBG000BPQMX8,"Mylan 1Q profit surges on acquisitions, tops forecasts",2017-05-10 14:01:57 +0000,http://finance.yahoo.com/news/mylan-beats-1q-profit-forecasts-114226209.html?.tsrc=rss,Mylan Inc. reported a surge in first-quarter profit as acquisitions helped boost revenue and offset declining sales of its EpiPen allergy treatment. The generic drug developer reported a four-fold jump ...
MYL,MYL:UW,BBG000BPQMX8,"I&apos;m Losing Money on Mylan, but I&apos;m Not Selling",2017-05-10 13:45:00 +0000,http://finance.yahoo.com/r/a626a7a2-8337-3857-96b3-db395369d03c/im-losing-money-on-mylan-but-im-not-selling.aspx?yptr=yahoo&.tsrc=rss,"Despite challenges, the reason for my buying Mylan hasn&apos;t changed."
MYL,MYL:UW,BBG000BPQMX8,"Mylan edges past profit estimates, backs 2017 forecast",2017-05-10 13:31:14 +0000,http://finance.yahoo.com/news/epipen-maker-mylans-profit-edges-121227943.html?.tsrc=rss,"Generic drug maker Mylan NV on  Wednesday reported a first-quarter profit that edged past  expectations, helped by demand for products it gained through  the acquisition of Swedish drugmaker Meda.  Shares of the EpiPen maker rose 2.3 percent to $38.87 in  early trading after Mylan also backed its full-year forecast.  Mylan's forecast for 2017 profit and revenue, which it first  announced in March, was in sharp contrast to downbeat  expectations from rivals despite prolonged pressure and scrutiny  on pricing for generic drugs in the United States."
MYL,MYL:UW,BBG000BPQMX8,Hikma Shares Slide Amid Speculation of FDA Ruling on Generic Advair,2017-05-10 13:16:00 +0000,http://finance.yahoo.com/r/7ca9c5e3-525f-37f2-8485-2f4612da1cc5/hikma-shares-slide-amid-speculation-of-fda-ruling-on-generic-advair.html?puc=yahoo&cm_ven=YAHOO&yptr=yahoo&.tsrc=rss,Hikma Pharmaceuticals fell sharply in London ahead of a crucial decision by the U.S. Food & Drug Administration on whether to approve its generic Advair asthma treatment.
MYL,MYL:UW,BBG000BPQMX8,"Pre-Market Most Active for May 10, 2017 :  WSTC, NVDA, AUO, YELP, MYL, ANF, MT, OPK, SKX, AAPL, INN, ARRY",2017-05-10 13:01:00 +0000,http://articlefeeds.nasdaq.com/~r/nasdaq/symbols/~3/Uo9lhulF7D4/pre-market-most-active-for-may-10-2017-wstc-nvda-auo-yelp-myl-anf-mt-opk-skx-aapl-inn-arry-cm787015,The NASDAQ 100 Pre Market Indicator is up 2 74 to 5 681 05 The total Pre Market volume is currently 9 197 629 shares traded The following are the most active stocks for the pre market session West Corporation WSTC is 0 98 at 23 13 with 4 579 964 shares traded
MYL,MYL:UW,BBG000BPQMX8,Investor Network: Mylan N.V. to Host Earnings Call,2017-05-10 12:45:00 +0000,http://finance.yahoo.com/news/investor-network-mylan-n-v-124500358.html?.tsrc=rss,"NEW YORK, NY / ACCESSWIRE / May 10, 2017 / Mylan N.V. (NASDAQ: MYL ) will be discussing their earnings results in their Q1 Earnings Call to be held May 10, 2017 at 10:00 AM Eastern Time. To listen to the ..."
MYL,MYL:UW,BBG000BPQMX8,US STOCKS-Wall St to open slightly lower after Comey sacked,2017-05-10 12:44:16 +0000,http://finance.yahoo.com/news/us-stocks-wall-st-open-124416841.html?.tsrc=rss,"U.S. stocks looked set to open slightly  lower on Wednesday after President Donald Trump's firing of his  FBI chief set off a political storm that could make passage of  his pro-growth plans more difficult.  Also weighing on sentiment were a couple of disappointing  quarterly earnings from companies, including Dow component Walt  Disney."
MYL,MYL:UW,BBG000BPQMX8,Mylan Revenue Jumps 24%,2017-05-10 12:41:00 +0000,http://finance.yahoo.com/r/b361af91-d625-3312-b2f3-ebbb74272be8/mylan-revenue-jumps-24.html?puc=yahoo&cm_ven=YAHOO&yptr=yahoo&.tsrc=rss,"Mylan CEO Heather Bresch says the first quarter marks ""a great start."""
