RESULT_COUNT: 256,PAGE_SIZE: 10000,CURRENT_PAGE: 1,TOTAL_PAGES: 1,API_CALL_CREDITS: 1
TICKER,FIGI_TICKER,FIGI,TITLE,PUBLICATION_DATE,URL,SUMMARY
STE,STE:US,BBG008FCJZ83,"STERIS to Announce Fiscal 2018 Second Quarter Financial Results on November 1, 2017",2017-10-18 12:02:02 +0000,https://finance.yahoo.com/news/steris-announce-fiscal-2018-second-120202477.html?.tsrc=rss,"LEICESTER, U.K.  - October 18, 2017- STERIS plc (NYSE: STE) (""STERIS"" or the ""Company"") announced today that it will host a conference call to discuss its fiscal 2018 second quarter ..."
STE,STE:US,BBG008FCJZ83,"ETFs with exposure to STERIS Plc : October 16, 2017",2017-10-16 13:59:57 +0000,http://finance.yahoo.com/r/d4f4fb6d-851a-376e-a86f-7163647c1576/etfs-with-exposure-to-steris-plc-october-16-2017?yptr=yahoo&.tsrc=rss,"Categories:  ETFs Yahoo FinanceClick here to see latest analysis ETFs with exposure to STERIS Plc Here are 5 ETFs with the largest exposure to STE-US. Comparing the performance and risk of STERIS Plc with the ETFs that have exposure to it gives us some ETF choices that could give us similar returns with lower volatility. Ticker Fund Name ... Read more
<b>(Read more...)</b>"
STE,STE:US,BBG008FCJZ83,5 MedTech Momentum Picks Investors Will Love,2017-10-13 13:27:01 +0000,https://finance.yahoo.com/news/5-medtech-momentum-picks-investors-132701600.html?.tsrc=rss,"In a volatile political environment, seasoned investors should focus on momentum stocks as winning bets to tide over the uncertainty."
STE,STE:US,BBG008FCJZ83,See what the IHS Markit Score report has to say about Steris PLC.,2017-10-13 12:05:01 +0000,https://finance.yahoo.com/news/see-ihs-markit-score-report-120501403.html?.tsrc=rss,"The last change in the short interest score occurred more than 1 month ago and implies that there has been little change in sentiment among investors who seek to profit from falling equity prices.  Index (PMI) data, output in the Healthcare sector is rising."
STE,STE:US,BBG008FCJZ83,"The Zacks Analyst Blog Highlights: IDEXX Laboratories, Steris, K2M Group Holdings, Tandem Diabetes Care and Intersect ENT",2017-10-11 12:32:12 +0000,https://finance.yahoo.com/news/zacks-analyst-blog-highlights-idexx-123212680.html?.tsrc=rss,"The Zacks Analyst Blog Highlights: IDEXX Laboratories, Steris, K2M Group Holdings, Tandem Diabetes Care and Intersect ENT"
STE,STE:US,BBG008FCJZ83,5 MedTech Stocks for Stellar Returns in Q3,2017-10-10 20:59:08 +0000,https://finance.yahoo.com/news/5-medtech-stocks-stellar-returns-205908297.html?.tsrc=rss,Here we take a sneak peek into two burning issues that are likely to impact the quarterly numbers in the MedTech fraternity.
STE,STE:US,BBG008FCJZ83,4 Top Growth Picks as MedTech Battle Rages On,2017-10-10 20:53:08 +0000,https://finance.yahoo.com/news/4-top-growth-picks-medtech-205308972.html?.tsrc=rss,Trump&apos;s Obamacare replacement saga has made growth picks great opportunities for investors in MedTech sector.
STE,STE:US,BBG008FCJZ83,"XLP, EVX: Big ETF Outflows",2017-10-10 16:13:40 +0000,http://articlefeeds.nasdaq.com/~r/nasdaq/symbols/~3/7oX8OltTE4g/xlp-evx-big-etf-outflows-cm857539,Looking at units outstanding versus one week prior within the universe of ETFs covered at ETF Channel the biggest outflow was seen in the Consumer Staples Select Sector SPDR Fund where 14 700 000 units were destroyed or a 9 1 decrease week over week Among the largest underlying components
STE,STE:US,BBG008FCJZ83,"ETFs with exposure to STERIS Plc : October 3, 2017",2017-10-03 15:37:25 +0000,http://finance.yahoo.com/r/b914bcb8-fe51-3afb-94a2-11e26895ade6/etfs-with-exposure-to-steris-plc-october-3-2017?yptr=yahoo&.tsrc=rss,"Categories:  ETFs Yahoo FinanceClick here to see latest analysis ETFs with exposure to STERIS Plc Here are 5 ETFs with the largest exposure to STE-US. Comparing the performance and risk of STERIS Plc with the ETFs that have exposure to it gives us some ETF choices that could give us similar returns with lower volatility. Ticker Fund Name ... Read more
<b>(Read more...)</b>"
STE,STE:US,BBG008FCJZ83,"STERIS Plc :STE-US: Earnings Analysis: Q1, 2018 By the Numbers : October 2, 2017",2017-10-02 12:59:11 +0000,http://finance.yahoo.com/r/9d0173e1-2184-3ba0-b160-b4d54ca839a1/steris-plc-ste-us-earnings-analysis-q1-2018-by-the-numbers-october-2-2017?yptr=yahoo&.tsrc=rss,"Categories:  Yahoo FinanceGet free summary analysis STERIS Plc reports financial results for the quarter ended June 30, 2017. We analyze the earnings along side the following peers of STERIS Plc – Cantel Medical Corp. (CMD-US) that have also reported for this period. Highlights Summary numbers: Revenues of USD 607.96 million, Net Earnings of USD 58.08 million. Gross ... Read more
<b>(Read more...)</b>"
STE,STE:US,BBG008FCJZ83,When Should You Sell Steris Plc (STE)?,2017-09-29 19:02:10 +0000,https://finance.yahoo.com/news/sell-steris-plc-ste-190210133.html?.tsrc=rss,"Steris Plc (NYSE:STE) is currently trading at a trailing P/E of 62.5x, which is higher than the industry average of 42.6x. While this makes STE appear like a stock toRead More..."
STE,STE:US,BBG008FCJZ83,"STERIS (STE) Rides on Organic Growth, Stiff Contest a Threat",2017-09-26 15:57:08 +0000,http://articlefeeds.nasdaq.com/~r/nasdaq/symbols/~3/yiB-WRmS984/steris-ste-rides-on-organic-growth-stiff-contest-a-threat-cm851053,On Sep 25 we issued an updated research report on STERIS plc 160 STE a manufacturer and marketer of infection prevention decontamination microbial reduction along with surgical and gastrointestinal support products and services The company currently carries a Zacks Rank 3 Hold
STE,STE:US,BBG008FCJZ83,"STERIS (STE) Rides on Organic Growth, Stiff Contest a Threat",2017-09-26 13:38:01 +0000,https://finance.yahoo.com/news/steris-ste-rides-organic-growth-133801841.html?.tsrc=rss,"STERIS&apos; (STE) consistent strong organic all-segment growth performance impresses investors. Additionally, growth in free cash flow reserve denotes the company&apos;s solid cash position."
STE,STE:US,BBG008FCJZ83,"STERIS Plc : STE-US: Dividend Analysis : August 29th, 2017 (record date) : By the numbers : September 21, 2017",2017-09-21 20:12:46 +0000,http://finance.yahoo.com/r/a5751ae5-3027-30bb-80f6-323b909b4da0/steris-plc-ste-us-dividend-analysis-august-29th-2017-record-date-by-the-numbers-september-21-2017?yptr=yahoo&.tsrc=rss,"Categories:  Yahoo FinanceGet free summary analysis Our analysis is based on comparing STERIS Plc with the following peers – Hill-Rom Holdings, Inc., Stryker Corporation, Cantel Medical Corp., Invacare Corporation, Thermo Fisher Scientific Inc., Owens & Minor, Inc., Ecolab Inc., CONMED Corporation, 3M Company and Johnson & Johnson (HRC-US, SYK-US, CMD-US, IVC-US, TMO-US, OMI-US, ECL-US, CNMD-US, MMM-US and ... Read more
<b>(Read more...)</b>"
STE,STE:US,BBG008FCJZ83,How Much Higher Can Medtech Climb As Investors Flee Pharma?,2017-09-14 21:36:23 +0000,http://finance.yahoo.com/r/e8ad7a1d-7bac-3e74-ab02-d054dabc81ca/how-much-higher-can-medtech-climb-as-investors-flee-pharma?src=A00220&yptr=yahoo&.tsrc=rss,"Intuitive Surgical, Varian and Steris are helping the medtech sector to hit multiyear highs, but the sector is facing soft utilization and volumes, hinting at a potential downturn."
STE,STE:US,BBG008FCJZ83,See what the IHS Markit Score report has to say about Steris PLC.,2017-09-14 12:05:59 +0000,https://finance.yahoo.com/news/see-ihs-markit-score-report-120559982.html?.tsrc=rss,"The last change in the short interest score occurred more than 1 month ago and implies that there has been little change in sentiment among investors who seek to profit from falling equity prices.  Index (PMI) data, output in the Healthcare sector is rising."
STE,STE:US,BBG008FCJZ83,See what the IHS Markit Score report has to say about Steris PLC.,2017-09-12 12:07:27 +0000,https://finance.yahoo.com/news/see-ihs-markit-score-report-120727308.html?.tsrc=rss,"The last change in the short interest score occurred more than 1 month ago and implies that there has been little change in sentiment among investors who seek to profit from falling equity prices.  Index (PMI) data, output in the Healthcare sector is rising."
STE,STE:US,BBG008FCJZ83,See what the IHS Markit Score report has to say about Steris PLC.,2017-09-11 12:04:05 +0000,https://finance.yahoo.com/news/see-ihs-markit-score-report-120405189.html?.tsrc=rss,"The last change in the short interest score occurred more than 1 month ago and implies that there has been little change in sentiment among investors who seek to profit from falling equity prices.  Index (PMI) data, output in the Healthcare sector is rising."
STE,STE:US,BBG008FCJZ83,See what the IHS Markit Score report has to say about Steris PLC.,2017-09-07 12:06:15 +0000,https://finance.yahoo.com/news/see-ihs-markit-score-report-120615050.html?.tsrc=rss,"The last change in the short interest score occurred more than 1 month ago and implies that there has been little change in sentiment among investors who seek to profit from falling equity prices.  Index (PMI) data, output in the Healthcare sector is rising."
STE,STE:US,BBG008FCJZ83,Earnings Review and Free Research Report: Steris Reported Strong Results with Growth in Net Income and Earnings,2017-08-29 11:40:00 +0000,https://finance.yahoo.com/news/earnings-review-free-research-report-114000486.html?.tsrc=rss,"Research Desk Line-up: Medtronic Post Earnings Coverage LONDON, UK / ACCESSWIRE / August 29, 2017 / Pro-Trader Daily has just published a free post-earnings coverage on Steris PLC (NYSE: STE ), which can ..."
STE,STE:US,BBG008FCJZ83,"STERIS plc (STE) Ex-Dividend Date Scheduled for August 25, 2017",2017-08-24 13:17:52 +0000,http://articlefeeds.nasdaq.com/~r/nasdaq/symbols/~3/Pit-zhh789Q/steris-plc-ste-ex-dividend-date-scheduled-for-august-25-2017-cm836398,STERIS plc STE will begin trading ex dividend on August 25 2017 A cash dividend payment of 0 31 per share is scheduled to be paid on September 28 2017 Shareholders who purchased STE prior to the ex dividend date are eligible for the cash dividend payment This represents an 10
STE,STE:US,BBG008FCJZ83,Stryker (SYK) to Gain From Solid Portfolio and Acquisitions,2017-08-21 12:38:23 +0000,http://articlefeeds.nasdaq.com/~r/nasdaq/symbols/~3/_B5zs4OXtYw/stryker-syk-to-gain-from-solid-portfolio-and-acquisitions-cm834470,On Aug 18 we issued an updated research report on Kalamazoo MI based Stryker Corporation SYK one of the largest medical device companies in the global orthopedic market The company currently has a Zacks Rank 2 Buy Stryker had an impressive run on the bourse over the last three
STE,STE:US,BBG008FCJZ83,Stryker (SYK) to Gain From Solid Portfolio and Acquisitions,2017-08-21 10:58:10 +0000,https://finance.yahoo.com/news/stryker-syk-gain-solid-portfolio-105810098.html?.tsrc=rss,"Stryker&apos;s (SYK) diverse product portfolio alongside acquisition-driven strategy would continue to boost growth prospects. However, competition in the Chinese market raise concern."
STE,STE:US,BBG008FCJZ83,Here's Why You Should Invest in IDEXX Laboratories (IDXX) Now,2017-08-17 15:43:40 +0000,http://articlefeeds.nasdaq.com/~r/nasdaq/symbols/~3/kk69VvWhOv4/heres-why-you-should-invest-in-idexx-laboratories-idxx-now-cm833329,IDEXX Laboratories Inc 160 IDXX a leading manufacturer of products and services primarily for the companion animal veterinary has rallied 9 1 over the last six months beating the S amp P 500 s 5 3 gain The stock has a market cap of 13 55 billion The company s five year
STE,STE:US,BBG008FCJZ83,Here&apos;s Why You Should Invest in IDEXX Laboratories (IDXX) Now,2017-08-17 13:25:01 +0000,https://finance.yahoo.com/news/apos-why-invest-idexx-laboratories-132501478.html?.tsrc=rss,"IDEXX Laboratories (IDXX) rides high on strength across all segments, with significant contributions from the Companion Animal Group business. Moreover, a raised guidance buoys optimism."
STE,STE:US,BBG008FCJZ83,"Haemonetics Plasma Arm Grows Strong, Blood Center Sluggish",2017-08-16 15:40:09 +0000,http://articlefeeds.nasdaq.com/~r/nasdaq/symbols/~3/tLMCYkFVaPs/haemonetics-plasma-arm-grows-strong-blood-center-sluggish-cm832796,On Aug 16 we issued an updated research report on Haemonetics Corporation HAE a Braintree MA based leading provider of blood management solutions to customers encompassing blood and plasma collectors hospitals and health care providers globally The stock currently carries a Zacks Rank
STE,STE:US,BBG008FCJZ83,Here's Why Investors Should Buy Align Technology (ALGN) Now,2017-08-16 15:38:56 +0000,http://articlefeeds.nasdaq.com/~r/nasdaq/symbols/~3/v6gT-QdDwBQ/heres-why-investors-should-buy-align-technology-algn-now-cm832776,California based Align Technology Inc ALGN the designer and manufacturer of Invisalign System has rallied 28 4 over the last three months ahead of the S amp P 500 s 4 5 gain The stock has a market cap of 14 26 billion The company s five year historical growth rate is also favorable
STE,STE:US,BBG008FCJZ83,Here&apos;s Why Investors Should Buy Align Technology (ALGN) Now,2017-08-16 13:53:01 +0000,https://finance.yahoo.com/news/apos-why-investors-buy-align-135301508.html?.tsrc=rss,Align Technology (ALGN) continues to ride high on robust growth in the Invisalign space.
STE,STE:US,BBG008FCJZ83,"Haemonetics Plasma Arm Grows Strong, Blood Center Sluggish",2017-08-16 13:40:01 +0000,https://finance.yahoo.com/news/haemonetics-plasma-arm-grows-strong-134001657.html?.tsrc=rss,"Haemonetics (HAE) registers strong top-line growth, banking on Plasma, TEG, hemostasis management as well as a strong cash position. Blood Center drag continues."
STE,STE:US,BBG008FCJZ83,Varian (VAR) Rides on Oncology and Proton Therapy Businesses,2017-08-16 13:38:37 +0000,http://articlefeeds.nasdaq.com/~r/nasdaq/symbols/~3/ZlM-86CdrIA/varian-var-rides-on-oncology-and-proton-therapy-businesses-cm832729,On Aug 14 we issued an updated research report on Palo Alto CA based Varian Medical Systems Inc VAR The company is the world s leading provider of radiotherapy radiosurgery proton therapy and brachytherapy for treating cancer and other medical conditions Varian Medical had
STE,STE:US,BBG008FCJZ83,Varian (VAR) Rides on Oncology and Proton Therapy Businesses,2017-08-16 12:22:12 +0000,https://finance.yahoo.com/news/varian-var-rides-oncology-proton-122212367.html?.tsrc=rss,"Varian Medical&apos;s (VAR) oncology and Proton therapy business&apos; growth prospects remain impressive. However, competition in the radiotherapy space raise concern."
STE,STE:US,BBG008FCJZ83,"Civitas Solutions (CIVI) Q3 Earnings Beat, Revenues Miss",2017-08-15 15:42:24 +0000,http://articlefeeds.nasdaq.com/~r/nasdaq/symbols/~3/H2N3HPxggQg/civitas-solutions-civi-q3-earnings-beat-revenues-miss-cm832225,Civitas Solutions Inc CIVI reported third quarter fiscal 2017 adjusted earnings per share EPS from continuing operations of 20 cents surpassing the Zacks Consensus Estimate by a penny Adjusted earnings improved 53 8 year over year primarily on strong sales growth from the company
STE,STE:US,BBG008FCJZ83,"Civitas Solutions (CIVI) Q3 Earnings Beat, Revenues Miss",2017-08-15 13:15:01 +0000,https://finance.yahoo.com/news/civitas-solutions-civi-q3-earnings-131501298.html?.tsrc=rss,"Civitas Solutions (CIVI) gains on strength in Post-Acute Specialty Rehabilitation Services and Adult Day Health services in Q3. However, tweaked full-year 2017 guidance signals dull prospects."
STE,STE:US,BBG008FCJZ83,Featured Company News - Intuitive Surgical Splits Stock in Three for One Ratio,2017-08-15 11:00:00 +0000,https://finance.yahoo.com/news/featured-company-news-intuitive-surgical-110000216.html?.tsrc=rss,"Research Desk Line-up: Steris Post Earnings Coverage LONDON, UK / ACCESSWIRE / August 15, 2017 / Pro-Trader Daily takes a look at the latest corporate events and news making the headlines for Intuitive ..."
STE,STE:US,BBG008FCJZ83,"STERIS (STE) Banks on Organic Growth, Competition Intense",2017-08-14 16:38:47 +0000,http://articlefeeds.nasdaq.com/~r/nasdaq/symbols/~3/E4YhW3Cq7yY/steris-ste-banks-on-organic-growth-competition-intense-cm831759,On Aug 14 we issued an updated research report on Ohio based 160 STERIS plc 160 STE a manufacturer and marketer of infection prevention decontamination microbial reduction along with surgical and gastrointestinal support products and services The company currently carries a Zacks
STE,STE:US,BBG008FCJZ83,Myriad Genetics (MYGN) Grows on Higher Cancer Test Volumes,2017-08-14 16:38:40 +0000,http://articlefeeds.nasdaq.com/~r/nasdaq/symbols/~3/pfEwW8TCFn4/myriad-genetics-mygn-grows-on-higher-cancer-test-volumes-cm831757,On Aug 11 we issued an updated research report on Salt Lake City UT based molecular diagnostics provider 160 Myriad Genetics Inc MYGN The company currently carries a Zacks Rank 3 Hold For the past three months Myriad has been trading above the broader industry The company
STE,STE:US,BBG008FCJZ83,Myriad Genetics (MYGN) Grows on Higher Cancer Test Volumes,2017-08-14 14:18:02 +0000,https://finance.yahoo.com/news/myriad-genetics-mygn-grows-higher-141802610.html?.tsrc=rss,"Myriad Genetics (MYGN) rides high on strength in Molecular Diagnostics with significant contributions from GeneSight. Also, hereditary cancer testing continues to witness sequential growth."
STE,STE:US,BBG008FCJZ83,"STERIS (STE) Banks on Organic Growth, Competition Intense",2017-08-14 14:15:02 +0000,https://finance.yahoo.com/news/steris-ste-banks-organic-growth-141502532.html?.tsrc=rss,STERIS&apos; (STE) cost structure is likely to be enhanced through recent organizational changes.
STE,STE:US,BBG008FCJZ83,Edited Transcript of STE earnings conference call or presentation 8-Aug-17 2:00pm GMT,2017-08-13 11:56:16 +0000,https://finance.yahoo.com/news/edited-transcript-ste-earnings-conference-192118190.html?.tsrc=rss,Q1 2018 STERIS plc Earnings Call
STE,STE:US,BBG008FCJZ83,OPKO Health (OPK) Posts Narrower-than-Estimated Loss in Q2,2017-08-11 12:37:38 +0000,http://articlefeeds.nasdaq.com/~r/nasdaq/symbols/~3/S8huJc49YrM/opko-health-opk-posts-narrower-than-estimated-loss-in-q2-cm830739,OPKO Health Inc OPK reported loss of 4 cents per share in the second quarter of 2017 as against earnings of 2 cents a year ago However in the reported quarter the loss was narrower than the Zacks Consensus Estimate of a loss of 5 cents Revenues In the second quarter OPKO
STE,STE:US,BBG008FCJZ83,"BioScrip (BIOS) Gains on CORE Initiatives, Competition Rife",2017-08-11 12:37:26 +0000,http://articlefeeds.nasdaq.com/~r/nasdaq/symbols/~3/RDSWkI3ub3A/bioscrip-bios-gains-on-core-initiatives-competition-rife-cm830735,On Aug 10 we issued an updated research report on Elmsford NY based 160 BioScrip Inc BIOS The company is a leading Infusion Service provider and strives to deliver cost effective programs to patients The stock currently has a Zacks Rank 2 Buy Over the last three months BioScrip
STE,STE:US,BBG008FCJZ83,See what the IHS Markit Score report has to say about Steris PLC.,2017-08-11 12:04:46 +0000,https://finance.yahoo.com/news/see-ihs-markit-score-report-120446381.html?.tsrc=rss,"Additionally, this was an improvement in sentiment as investors who seek to profit from falling equity prices reduced their short positions on August 2.  Index (PMI) data, output in the Healthcare sector is rising."
STE,STE:US,BBG008FCJZ83,"BioScrip (BIOS) Gains on CORE Initiatives, Competition Rife",2017-08-11 10:44:10 +0000,https://finance.yahoo.com/news/bioscrip-bios-gains-core-initiatives-104410477.html?.tsrc=rss,The company achieved annualized supply chain improvement since the acquisition of Home Solutions.
STE,STE:US,BBG008FCJZ83,OPKO Health (OPK) Posts Narrower-than-Estimated Loss in Q2,2017-08-11 10:30:10 +0000,https://finance.yahoo.com/news/opko-health-opk-posts-narrower-103010368.html?.tsrc=rss,"OPKO Health (OPK) posted lackluster Q2 numbers due to rising operating expenses owing to investment associated to the launch of RAYALDEE, and consistent investment in the pharmaceutical pipeline."
STE,STE:US,BBG008FCJZ83,"IHS Markit Score downgrades Steris PLC to 64 out of 100, ranking positively in only one out of three available IHS Markit categories.",2017-08-10 12:04:49 +0000,https://finance.yahoo.com/news/ihs-markit-score-downgrades-steris-120449579.html?.tsrc=rss,"Additionally, this was an improvement in sentiment as investors who seek to profit from falling equity prices reduced their short positions on August 2.  Index (PMI) data, output in the Healthcare sector is rising."
STE,STE:US,BBG008FCJZ83,"STERIS (STE) Beats on Q1 Earnings & Revenues, Margins Up",2017-08-09 20:36:50 +0000,http://articlefeeds.nasdaq.com/~r/nasdaq/symbols/~3/5Htu10DnuzQ/steris-ste-beats-on-q1-earnings-revenues-margins-up-cm829786,STERIS Plc STE reported first quarter fiscal 2018 adjusted earnings per share EPS of 85 cents up 7 6 from the year ago quarter This adjusted EPS figure also surpassed the Zacks Consensus Estimate of 80 cents On a reported basis the quarter s EPS came in at 68 cents up 21 4 year
STE,STE:US,BBG008FCJZ83,"STERIS (STE) Beats on Q1 Earnings & Revenues, Margins Up",2017-08-09 18:10:06 +0000,https://finance.yahoo.com/news/steris-ste-beats-q1-earnings-181006044.html?.tsrc=rss,STERIS&apos; (STE) organic growth performance was strong across most segments in Q1. Robust cash position was another upside.
STE,STE:US,BBG008FCJZ83,STE Crosses Above Average Analyst Target,2017-08-09 14:36:14 +0000,http://articlefeeds.nasdaq.com/~r/nasdaq/symbols/~3/ccGwp-NZKuw/ste-crosses-above-average-analyst-target-cm829339,In recent trading shares of Steris plc Symbol STE have crossed above the average analyst 12 month target price of 86 25 changing hands for 86 70 share When a stock reaches the target an analyst has set the analyst logically has two ways to react downgrade on valuation or re adjust
STE,STE:US,BBG008FCJZ83,See what the IHS Markit Score report has to say about Steris PLC.,2017-08-09 12:04:49 +0000,https://finance.yahoo.com/news/see-ihs-markit-score-report-120449557.html?.tsrc=rss,"Additionally, this was an improvement in sentiment as investors who seek to profit from falling equity prices reduced their short positions on August 2.  Index (PMI) data, output in the Healthcare sector is rising."
STE,STE:US,BBG008FCJZ83,Steris beats Street 1Q forecasts,2017-08-08 21:51:48 +0000,https://finance.yahoo.com/news/steris-beats-street-1q-forecasts-132018399.html?.tsrc=rss,"The Leicester, Britain-based company said it had net income of 68 cents per share. Earnings, adjusted for non-recurring costs, were 85 cents per share. The results exceeded Wall Street expectations. The ..."
STE,STE:US,BBG008FCJZ83,"Daily Dividend Report: STE, LRCX, PRGO, TSCO, DLR",2017-08-08 17:33:59 +0000,http://articlefeeds.nasdaq.com/~r/nasdaq/symbols/~3/V07QWax9c3E/daily-dividend-report-ste-lrcx-prgo-tsco-dlr-cm828880,Steris Board of Directors has authorized a 0 03 increase in its quarterly interim dividend to 0 31 per share The dividend is payable September 28 2017 to shareholders of record at the close of business on August 29 2017 Lam Research today announced that its Board of Directors
STE,STE:US,BBG008FCJZ83,Investor Network: STERIS plc to Host Earnings Call,2017-08-08 11:25:00 +0000,https://finance.yahoo.com/news/investor-network-steris-plc-host-112500438.html?.tsrc=rss,"NEW YORK, NY / ACCESSWIRE / August 8, 2017 / STERIS plc (NYSE: STE ) will be discussing their earnings results in their Q1 Earnings Call to be held on Tuesday, August 8, 2017 at 10:00 AM Eastern Time. ..."
STE,STE:US,BBG008FCJZ83,STERIS Announces Financial Results for Fiscal 2018 First Quarter,2017-08-08 10:01:01 +0000,https://finance.yahoo.com/news/steris-announces-financial-results-fiscal-100101552.html?.tsrc=rss,First quarter as reported revenue declines 5% due to divestitures First quarter constant currency organic revenue increases 6% As reported EPS grows 21% and adjusted EPS grows 8% Board approves double-digit ...
STE,STE:US,BBG008FCJZ83,"Med-Product Stocks Aug 8 Earnings Roster: HSIC, AGIO & More",2017-08-07 15:42:31 +0000,http://articlefeeds.nasdaq.com/~r/nasdaq/symbols/~3/Xiyp8_RO5jw/med-product-stocks-aug-8-earnings-roster-hsic-agio-more-cm828085,We are at the last lap of Q2 earnings season and per the Earnings Preview till Aug 4 around 420 S amp P 500 members 86 7 of the Index s total market cap have reported their quarterly numbers Putting together these results we can see that the pace of earnings and revenue growth is
STE,STE:US,BBG008FCJZ83,"Med-Product Stocks Aug 8 Earnings Roster: HSIC, AGIO & More",2017-08-07 13:34:01 +0000,https://finance.yahoo.com/news/med-product-stocks-aug-8-133401746.html?.tsrc=rss,"Long-term tailwinds including M&A, emerging markets, positive demographic trends and new product innovation might bode well for the medical device industry."
STE,STE:US,BBG008FCJZ83,"ETFs with exposure to STERIS Plc : August 4, 2017",2017-08-04 01:31:34 +0000,http://finance.yahoo.com/r/74435818-92d7-3122-a8c1-c7e3deeb1f45/etfs-with-exposure-to-steris-plc-august-4-2017?yptr=yahoo&.tsrc=rss,"Categories:  ETFs Yahoo FinanceClick here to see latest analysis ETFs with exposure to STERIS Plc Here are 5 ETFs with the largest exposure to STE-US. Comparing the performance and risk of STERIS Plc with the ETFs that have exposure to it gives us some ETF choices that could give us similar returns with lower volatility. Ticker Fund Name ... Read more
<b>(Read more...)</b>"
STE,STE:US,BBG008FCJZ83,"STERIS to Announce Fiscal 2018 First Quarter Financial Results on August 8, 2017",2017-07-25 21:55:05 +0000,https://finance.yahoo.com/news/steris-announce-fiscal-2018-first-215505386.html?.tsrc=rss,"LEICESTER, U.K.  - July 25, 2017- STERIS plc (NYSE: STE) (""STERIS"" or the ""Company"") announced today that it will host a conference call to discuss its fiscal 2018 first quarter financial ..."
