STE,STE:US,BBG008FCJZ83,Edited Transcript of STE earnings conference call or presentation 7-Feb-17 3:00pm GMT,2017-02-07 18:36:46 +0000,http://finance.yahoo.com/news/edited-transcript-ste-earnings-conference-183646622.html?.tsrc=rss,Q3 2017 STERIS plc Earnings Call
STE,STE:US,BBG008FCJZ83,Steris (STE) Shares Cross Below 200 DMA,2017-02-07 17:17:46 +0000,http://articlefeeds.nasdaq.com/~r/nasdaq/symbols/~3/sFj3XVR4Lv4/steris-ste-shares-cross-below-200-dma-cm744250,In trading on Tuesday shares of Steris plc Symbol STE crossed below their 200 day moving average of 69 42 changing hands as low as 65 91 per share Steris plc shares are currently trading down about 6 3 on the day The chart below shows the one year performance of STE shares versus its
STE,STE:US,BBG008FCJZ83,STERIS plc Earnings Call scheduled for 10:00 am ET today,2017-02-07 15:00:00 +0000,http://biz.yahoo.com/cc/5/155245.html,STERIS plc Earnings Call scheduled for 10:00 am ET today
STE,STE:US,BBG008FCJZ83,Q3 2017 STERIS plc Earnings Release - Before Market Open,2017-02-07 12:07:05 +0000,http://biz.yahoo.com/research/earncal/20170207.html?t=ste,Q3 2017 STERIS plc Earnings Release - Before Market Open
STE,STE:US,BBG008FCJZ83,"STERIS PLC Files SEC form 8-K, Results of Operations and Financial Condition, Financial Statements and Exhibits",2017-02-07 11:32:13 +0000,http://biz.yahoo.com/e/170207/ste8-k.html,"STERIS PLC Files SEC form 8-K, Results of Operations and Financial Condition, Financial Statements and Exhibits"
STE,STE:US,BBG008FCJZ83,Steris reports 3Q loss,2017-02-07 11:24:32 +0000,http://sg.finance.yahoo.com/news/steris-reports-3q-loss-112432796.html,Steris reports 3Q loss
STE,STE:US,BBG008FCJZ83,Steris reports 3Q loss,2017-02-07 11:24:32 +0000,http://finance.yahoo.com/news/steris-reports-3q-loss-112432298.html?.tsrc=rss,"On a per-share basis, the Leicester, Britain-based company said it had a loss of 6 cents. Earnings, adjusted for asset impairment costs and non-recurring costs, came to 98 cents per share. The results ..."
STE,STE:US,BBG008FCJZ83,STERIS plc Announces Financial Results for Fiscal 2017 Third Quarter,2017-02-07 11:02:02 +0000,http://finance.yahoo.com/news/steris-plc-announces-financial-results-110202629.html?.tsrc=rss,Third quarter revenue growth of 5% as currency continues to be a headwind As reported operating income declines $21 million on goodwill impairment Adjusted operating margin improves 200 basis points Company ...
STE,STE:US,BBG008FCJZ83,STERIS plc Announces Financial Results for Fiscal 2017 Third Quarter,2017-02-07 11:02:02 +0000,http://finance.yahoo.com/news/steris-plc-announces-financial-results-110202629.html,[GlobeNewswire] - Third quarter revenue growth of 5% as currency continues to be a headwind As reported operating income declines $21 million on goodwill impairment Adjusted operating margin improves 200 basis points Company ...
STE,STE:US,BBG008FCJZ83,Steris Q3 Results Miss View; Cuts FY Outlook,2017-02-07 08:02:00 +0000,http://articlefeeds.nasdaq.com/~r/nasdaq/symbols/~3/f7KMEddt_jc/steris-q3-results-miss-view-cuts-fy-outlook-20170207-00613,Steris Q3 Results Miss View; Cuts FY Outlook
STE,STE:US,BBG008FCJZ83,Blog Coverage Second Sight Wins Reimbursement Approval for Argus II Retinal Prosthesis System,2017-02-03 13:15:00 +0000,http://finance.yahoo.com/news/blog-coverage-second-sight-wins-131500595.html,"[Accesswire] - Upcoming AWS Coverage on STERIS Post-Earnings Results LONDON, UK / ACCESSWIRE / February 3, 2017 / Active Wall St. blog coverage looks at the headline from Second Sight Medical Products, Inc. (NASDAQ: ..."
STE,STE:US,BBG008FCJZ83,Blog Coverage Second Sight Wins Reimbursement Approval for Argus II Retinal Prosthesis System,2017-02-03 13:15:00 +0000,http://finance.yahoo.com/news/blog-coverage-second-sight-wins-131500595.html?.tsrc=rss,"Upcoming AWS Coverage on STERIS Post-Earnings Results LONDON, UK / ACCESSWIRE / February 3, 2017 / Active Wall St. blog coverage looks at the headline from Second Sight Medical Products, Inc. (NASDAQ: ..."
STE,STE:US,BBG008FCJZ83,"STERIS PLC Files SEC form 8-K, Entry into a Material Definitive Agreement, Creation of a Direct Financial Obligation",2017-01-26 21:32:29 +0000,http://biz.yahoo.com/e/170126/ste8-k.html,"STERIS PLC Files SEC form 8-K, Entry into a Material Definitive Agreement, Creation of a Direct Financial Obligation"
STE,STE:US,BBG008FCJZ83,"STERIS plc to Announce Fiscal 2017 Third Quarter Financial Results on February 7, 2017",2017-01-23 21:31:01 +0000,http://finance.yahoo.com/news/steris-plc-announce-fiscal-2017-213101206.html,"[GlobeNewswire] - LEICESTER, U.K. - January 23, 2017- STERIS plc (NYSE: STE) (""STERIS"" or the ""Company"") announced today that it will host a conference call to discuss its fiscal 2017 third quarter ..."
STE,STE:US,BBG008FCJZ83,"STERIS plc to Announce Fiscal 2017 Third Quarter Financial Results on February 7, 2017",2017-01-23 21:31:01 +0000,http://finance.yahoo.com/news/steris-plc-announce-fiscal-2017-213101206.html?.tsrc=rss,"LEICESTER, U.K.  - January 23, 2017- STERIS plc (NYSE: STE) (""STERIS"" or the ""Company"") announced today that it will host a conference call to discuss its fiscal 2017 third quarter ..."
STE,STE:US,BBG008FCJZ83,"STERIS Plc : STE-US: Dividend Analysis : November 23rd, 2016 (record date) : By the numbers : January 23, 2017",2017-01-23 15:25:37 +0000,http://finance.yahoo.com/r/916961a6-9fb5-3fb4-b4f3-16d65d773bfc/steris-plc-ste-us-dividend-analysis-november-23rd-2016-record-date-by-the-numbers-january-23-2017?yptr=yahoo&.tsrc=rss,"Categories:   Yahoo Finance Get free summary analysis Our analysis is based on comparing STERIS Plc with the following peers – Hill-Rom Holdings, Inc., Stryker Corporation, Cantel Medical Corp., Invacare Corporation, Thermo Fisher Scientific Inc., Owens & Minor, Inc., Johnson & Johnson, CONMED Corporation, Ecolab Inc. and 3M Company (HRC-US, SYK-US, CMD-US, IVC-US, TMO-US, OMI-US, JNJ-US, CNMD-US, ECL-US and ... Read more    
<b>(Read more...)</b>"
STE,STE:US,BBG008FCJZ83,"STERIS Plc : STE-US: Dividend Analysis : November 23rd, 2016 (record date) : By the numbers : January 23, 2017",2017-01-23 15:25:37 +0000,http://www.capitalcube.com/blog/index.php/steris-plc-ste-us-dividend-analysis-november-23rd-2016-record-date-by-the-numbers-january-23-2017/,"STERIS Plc : STE-US: Dividend Analysis : November 23rd, 2016 (record date) : By the numbers : January 23, 2017"
STE,STE:US,BBG008FCJZ83,U.S. FTC Chairwoman Ramirez to step down,2017-01-13 16:31:43 +0000,http://finance.yahoo.com/news/u-ftc-chairwoman-ramirez-step-163143037.html,"[Reuters] - U.S. Federal Trade Commission chairwoman Edith Ramirez will step down after more than three years as chairwoman and six at the agency, the FTC said on Friday. Ramirez, who was on the Harvard Law Review ..."
STE,STE:US,BBG008FCJZ83,U.S. FTC Chairwoman Ramirez to step down,2017-01-13 16:31:43 +0000,http://finance.yahoo.com/news/u-ftc-chairwoman-ramirez-step-163143037.html?.tsrc=rss,"U.S. Federal Trade Commission chairwoman Edith Ramirez will step down after more than three years as chairwoman and six at the agency, the FTC said on Friday. Ramirez, who was on the Harvard Law Review ..."
STE,STE:US,BBG008FCJZ83,"The Zacks Analyst Blog Highlights: Wells Fargo, Danaher, Colgate-Palmolive, STERIS and Aetna",2016-12-30 17:01:46 +0000,http://articlefeeds.nasdaq.com/~r/nasdaq/symbols/~3/6AQrDrhy4UE/the-zacks-analyst-blog-highlights-wells-fargo-danaher-colgate-palmolive-steris-and-aetna-cm727979,For Immediate Release Chicago IL December 30 2016 Zacks com announces the list of stocks featured in the Analyst Blog Every day the Zacks Equity Research analysts discuss the latest news and events impacting stocks and the financial markets Stocks recently featured in the blog
STE,STE:US,BBG008FCJZ83,"The Zacks Analyst Blog Highlights: Wells Fargo, Danaher, Colgate-Palmolive, STERIS and Aetna",2016-12-30 14:30:02 +0000,http://finance.yahoo.com/news/zacks-analyst-blog-highlights-wells-143002774.html,"The Zacks Analyst Blog Highlights: Wells Fargo, Danaher, Colgate-Palmolive, STERIS and Aetna"
STE,STE:US,BBG008FCJZ83,"Top Research Reports for December 29, 2016",2016-12-29 23:57:56 +0000,http://articlefeeds.nasdaq.com/~r/nasdaq/symbols/~3/yDcX0JyI9UE/top-research-reports-for-december-29-2016-cm727707,Thursday December 29 2016 Today s Research Daily features new research reports on 16 major stocks including Wells Fargo WFC Danaher DHR and Colgate Palmolive CL Shares of Buy rated Wells Fargo have gained 1 8 year to date underperforming the Zacks Banks Major Regional sector
STE,STE:US,BBG008FCJZ83,"Top Research Reports for December 29, 2016",2016-12-29 21:43:09 +0000,http://finance.yahoo.com/news/top-research-reports-december-29-214309471.html,"Top Research Reports for December 29, 2016"
STE,STE:US,BBG008FCJZ83,"Top Research Reports for December 29, 2016",2016-12-29 21:43:09 +0000,http://finance.yahoo.com/news/top-research-reports-december-29-214309471.html?.tsrc=rss,"Top Research Reports for December 29, 2016"
STE,STE:US,BBG008FCJZ83,"STERIS Plc – Value Analysis (NYSE:STE) : December 14, 2016",2016-12-14 16:13:38 +0000,http://finance.yahoo.com/r/8ad29071-42d5-38d3-8d71-7e06326c1954/steris-plc-value-analysis-nyseste-december-14-2016?yptr=yahoo&.tsrc=rss,"Categories:   Fundamental Analysis Yahoo Finance Click here to see latest analysis Capitalcube gives STERIS Plc a score of 63. Our analysis is based on comparing STERIS Plc with the following peers – Hill-Rom Holdings, Inc., Stryker Corporation, Cantel Medical Corp., Invacare Corporation, Thermo Fisher Scientific Inc., Owens & Minor, Inc., Ecolab Inc., CONMED Corporation, Johnson & Johnson and 3M Company ... Read more    
<b>(Read more...)</b>"
STE,STE:US,BBG008FCJZ83,"STERIS Plc – Value Analysis (NYSE:STE) : December 14, 2016",2016-12-14 16:13:38 +0000,http://www.capitalcube.com/blog/index.php/steris-plc-value-analysis-nyseste-december-14-2016/,"STERIS Plc – Value Analysis (NYSE:STE) : December 14, 2016"
STE,STE:US,BBG008FCJZ83,"STERIS Plc breached its 50 day moving average in a Bullish Manner : STE-US : December 13, 2016",2016-12-13 12:16:17 +0000,http://www.capitalcube.com/blog/index.php/steris-plc-breached-its-50-day-moving-average-in-a-bullish-manner-ste-us-december-13-2016/,"STERIS Plc breached its 50 day moving average in a Bullish Manner : STE-US : December 13, 2016"
STE,STE:US,BBG008FCJZ83,"STERIS Plc breached its 50 day moving average in a Bullish Manner : STE-US : December 13, 2016",2016-12-13 12:16:17 +0000,http://finance.yahoo.com/r/1b0adc8d-a0a0-3911-a79d-9c32829e901c/steris-plc-breached-its-50-day-moving-average-in-a-bullish-manner-ste-us-december-13-2016?yptr=yahoo&.tsrc=rss,"Categories:   ETFs Yahoo Finance Click here to see latest analysis *Disclaimer : This is as of previous day’s closing price. Technical Indicators Below is a quick look at 5 technical indicators for STERIS Plc. More studies are available on the Technical Chart. Indicator Signal Closing Price above/below 50 Day Moving Average Bullish Closing Price above/below 200 Day Moving Average ... Read more    
<b>(Read more...)</b>"
STE,STE:US,BBG008FCJZ83,Is STERIS Plc (STE) A Good Stock To Buy?,2016-12-12 14:42:16 +0000,http://www.insidermonkey.com/blog/is-steris-plc-ste-a-good-stock-to-buy-501068/,Is STERIS Plc (STE) A Good Stock To Buy?
STE,STE:US,BBG008FCJZ83,"Steris Poor Q2 Disappoints, Synergy Health Raises Hope",2016-12-08 18:56:25 +0000,http://articlefeeds.nasdaq.com/~r/nasdaq/symbols/~3/2sFXf_Af6CM/steris-poor-q2-disappoints-synergy-health-raises-hope-cm718789,On Dec 7 we issued an updated research report on OH based STERIS plc STE a manufacturer and marketer of infection prevention decontamination microbial reduction along with surgical and gastrointestinal support products and services The company currently carries a Zacks Rank 3
STE,STE:US,BBG008FCJZ83,"Steris Poor Q2 Disappoints, Synergy Health Raises Hope",2016-12-08 16:59:04 +0000,http://finance.yahoo.com/news/steris-poor-q2-disappoints-synergy-165904034.html,"Steris Poor Q2 Disappoints, Synergy Health Raises Hope"
STE,STE:US,BBG008FCJZ83,The Math Shows JKH Can Go To $180,2016-12-01 15:17:28 +0000,http://articlefeeds.nasdaq.com/~r/nasdaq/symbols/~3/-N8g_3S15Qk/the-math-shows-jkh-can-go-to-180-cm716231,Looking at the underlying holdings of the ETFs in our coverage universe at ETF Channel we have compared the trading price of each holding against the average analyst 12 month forward target price and computed the weighted average implied analyst target price for the ETF itself For the
STE,STE:US,BBG008FCJZ83,Coverage initiated on Steris by Goldman,2016-11-30 11:43:18 +0000,http://finance.yahoo.com/q/ud?s=STE,Coverage initiated on Steris by Goldman
STE,STE:US,BBG008FCJZ83,"STERIS (STE): Q2 Results Disappoint, Acquisitions Bode Well",2016-11-25 16:06:28 +0000,http://articlefeeds.nasdaq.com/~r/nasdaq/symbols/~3/wigob5vTBCw/steris-ste-q2-results-disappoint-acquisitions-bode-well-cm713964,On Nov 23 we issued an updated research report on OH based STERIS plc STE a manufacturer and marketer of infection prevention decontamination microbial reduction and surgical and gastrointestinal support products and services The company currently carries a Zacks Rank 4 Sell
STE,STE:US,BBG008FCJZ83,"STERIS (STE): Q2 Results Disappoint, Acquisitions Bode Well",2016-11-25 13:40:01 +0000,http://finance.yahoo.com/news/steris-ste-q2-results-disappoint-134001578.html,"STERIS (STE): Q2 Results Disappoint, Acquisitions Bode Well"
STE,STE:US,BBG008FCJZ83,"Billionaire John Paulson’s Most Bullish Q3 Moves: Biogen (BIIB), eBay Inc. (EBAY) & More",2016-11-21 15:46:14 +0000,http://www.insidermonkey.com/blog/billionaire-john-paulsons-most-bullish-q3-moves-biogen-biib-ebay-inc-ebay-more-488668/,"Billionaire John Paulson’s Most Bullish Q3 Moves: Biogen (BIIB), eBay Inc. (EBAY) & More"
STE,STE:US,BBG008FCJZ83,"STERIS plc (STE) Ex-Dividend Date Scheduled for November 21, 2016",2016-11-18 14:19:52 +0000,http://articlefeeds.nasdaq.com/~r/nasdaq/symbols/~3/K0cO0OQ15KE/steris-plc-ste-ex-dividend-date-scheduled-for-november-21-2016-cm711118,STERIS plc STE will begin trading ex dividend on November 21 2016 A cash dividend payment of 0 28 per share is scheduled to be paid on December 21 2016 Shareholders who purchased STE prior to the ex dividend date are eligible for the cash dividend payment This represents an 12
STE,STE:US,BBG008FCJZ83,Half Year 2016 Stewart & Wight PLC Earnings Release - Time Not Supplied,2016-11-17 12:07:06 +0000,http://biz.yahoo.com/research/earncal/20161117.html?t=ste,Half Year 2016 Stewart & Wight PLC Earnings Release - Time Not Supplied
STE,STE:US,BBG008FCJZ83,"STERIS PLC Files SEC form 8-K/A, Results of Operations and Financial Condition, Financial Statements and Exhibits",2016-11-08 21:56:23 +0000,http://biz.yahoo.com/e/161108/ste8-k_a.html,"STERIS PLC Files SEC form 8-K/A, Results of Operations and Financial Condition, Financial Statements and Exhibits"
STE,STE:US,BBG008FCJZ83,"STERIS PLC Files SEC form 10-Q, Quarterly Report",2016-11-08 21:51:18 +0000,http://biz.yahoo.com/e/161108/ste10-q.html,"STERIS PLC Files SEC form 10-Q, Quarterly Report"
STE,STE:US,BBG008FCJZ83,"ETF’s with exposure to STERIS Plc : November 4, 2016",2016-11-04 17:06:16 +0000,http://www.capitalcube.com/blog/index.php/etfs-with-exposure-to-steris-plc-november-4-2016/,"ETF’s with exposure to STERIS Plc : November 4, 2016"
STE,STE:US,BBG008FCJZ83,"Steris (STE) Misses on Q2 Earnings and Sales, Cuts View",2016-11-04 14:14:37 +0000,http://articlefeeds.nasdaq.com/~r/nasdaq/symbols/~3/lCVsXYiTqE4/steris-ste-misses-on-q2-earnings-and-sales-cuts-view-cm704060,Steris Plc STE reported second quarter fiscal 2017 adjusted earnings per share EPS of 89 cents up 7 2 year over year The adjusted EPS figure however missed the Zacks Consensus Estimate by a penny Double digit revenue growth and a lower than expected effective tax rate primarily drove
STE,STE:US,BBG008FCJZ83,"Steris (STE) Misses on Q2 Earnings and Sales, Cuts View",2016-11-04 13:14:01 +0000,http://finance.yahoo.com/news/steris-ste-misses-q2-earnings-131401556.html,"Steris (STE) Misses on Q2 Earnings and Sales, Cuts View"
STE,STE:US,BBG008FCJZ83,"STERIS Plc :STE-US: Earnings Analysis: Q2, 2017 By the Numbers : November 3, 2016",2016-11-03 13:52:28 +0000,http://www.capitalcube.com/blog/index.php/steris-plc-ste-us-earnings-analysis-q2-2017-by-the-numbers-november-3-2016/,"STERIS Plc :STE-US: Earnings Analysis: Q2, 2017 By the Numbers : November 3, 2016"
STE,STE:US,BBG008FCJZ83,Welch Capital’s Must-Buy Healthcare Stocks,2016-11-02 21:22:50 +0000,http://www.insidermonkey.com/blog/welch-capitals-must-buy-healthcare-stocks-484621/,Welch Capital’s Must-Buy Healthcare Stocks
STE,STE:US,BBG008FCJZ83,Edited Transcript of STE earnings conference call or presentation 2-Nov-16 2:00pm GMT,2016-11-02 15:30:41 +0000,http://finance.yahoo.com/news/edited-transcript-ste-earnings-conference-153041456.html,Edited Transcript of STE earnings conference call or presentation 2-Nov-16 2:00pm GMT
STE,STE:US,BBG008FCJZ83,Steris misses Street 2Q forecasts,2016-11-02 13:16:39 +0000,http://sg.finance.yahoo.com/news/steris-misses-street-2q-forecasts-131639208.html,Steris misses Street 2Q forecasts
STE,STE:US,BBG008FCJZ83,Q2 2017 STERIS plc Earnings Release - Before Market Open,2016-11-02 11:07:06 +0000,http://biz.yahoo.com/research/earncal/20161102.html?t=ste,Q2 2017 STERIS plc Earnings Release - Before Market Open
STE,STE:US,BBG008FCJZ83,"STERIS PLC Files SEC form 8-K, Results of Operations and Financial Condition, Financial Statements and Exhibits",2016-11-02 10:31:52 +0000,http://biz.yahoo.com/e/161102/ste8-k.html,"STERIS PLC Files SEC form 8-K, Results of Operations and Financial Condition, Financial Statements and Exhibits"
STE,STE:US,BBG008FCJZ83,"6:18 am Steris misses by $0.01, misses on revs; reaffirms FY17 EPS guidance & lowers FY17 revenue guidance",2016-11-02 10:18:00 +0000,http://finance.yahoo.com/news/inplay-briefing-com-055139997.html#ste,"6:18 am Steris misses by $0.01, misses on revs; reaffirms FY17 EPS guidance & lowers FY17 revenue guidance"
STE,STE:US,BBG008FCJZ83,STERIS plc Announces Financial Results for Fiscal 2017 Second Quarter,2016-11-02 10:10:08 +0000,http://www.publicnow.com/view/35737378D61D2F465A181DD231C5082386305CA3,[at noodls] - Second quarter revenue growth of 32% Synergy Health integration and cost synergies ahead of plan Full year outlook for total revenue growth of 19-20% Full year organic revenue growth rate and earnings ...
STE,STE:US,BBG008FCJZ83,STERIS plc Announces Financial Results for Fiscal 2017 Second Quarter,2016-11-02 10:01:01 +0000,http://finance.yahoo.com/news/steris-plc-announces-financial-results-100101719.html,[GlobeNewswire] - Second quarter revenue growth of 32% Synergy Health integration and cost synergies ahead of plan Full year outlook for total revenue growth of 19-20% Full year organic revenue growth rate and earnings ...
STE,STE:US,BBG008FCJZ83,Steris Q2 17 Earnings Conference Call At 10:00 AM ET,2016-11-02 09:01:00 +0000,http://articlefeeds.nasdaq.com/~r/nasdaq/symbols/~3/wfc2wrsBfZs/steris-q2-17-earnings-conference-call-at-1000-am-et-20161102-01175,Steris Q2 17 Earnings Conference Call At 10:00 AM ET
STE,STE:US,BBG008FCJZ83,STERIS Q2 Profit Misses Estimates; Organic Revenue Up 3% - Quick Facts,2016-11-02 07:12:00 +0000,http://articlefeeds.nasdaq.com/~r/nasdaq/symbols/~3/zHzsQS0ReYU/steris-q2-profit-misses-estimates-organic-revenue-up-3--quick-facts-20161102-01618,STERIS Q2 Profit Misses Estimates; Organic Revenue Up 3% - Quick Facts
STE,STE:US,BBG008FCJZ83,"Medical Instrument Stock Earnings on Nov 2: HOLX, MASI & More",2016-11-01 13:17:01 +0000,http://articlefeeds.nasdaq.com/~r/nasdaq/symbols/~3/KUAqnZ0hVyg/medical-instrument-stock-earnings-on-nov-2-holx-masi-more-cm701520,We are in the middle of the third quarter earnings season with 291 S amp P 500 members 58 2 of the total index having released their quarterly numbers as of Oct 28 After five consecutive quarters of earnings declines for the S amp P 500 index the quarterly reports so far have
STE,STE:US,BBG008FCJZ83,"Medical Instrument Stock Earnings on Nov 2: HOLX, MASI & More",2016-11-01 11:32:11 +0000,http://finance.yahoo.com/news/medical-instrument-stock-earnings-nov-113211723.html,"Medical Instrument Stock Earnings on Nov 2: HOLX, MASI & More"
STE,STE:US,BBG008FCJZ83,"STERIS plc to Announce Fiscal 2017 Second Quarter Financial Results on November 2, 2016",2016-10-20 20:39:05 +0000,http://www.publicnow.com/view/BEFF1C7B5BB0898DCC5A7FFF6C606A117440ADB0,"[at noodls] - LEICESTER, U.K. - October 20, 2016- STERIS plc (NYSE: STE) ('STERIS' or the 'Company') announced today that it will host a conference call to discuss its fiscal 2017 second quarter financial results at ..."
STE,STE:US,BBG008FCJZ83,"STERIS Plc breached its 50 day moving average in a Bearish Manner : STE-US : October 10, 2016",2016-10-10 12:39:36 +0000,http://www.capitalcube.com/blog/index.php/steris-plc-breached-its-50-day-moving-average-in-a-bearish-manner-ste-us-october-10-2016/,"STERIS Plc breached its 50 day moving average in a Bearish Manner : STE-US : October 10, 2016"
STE,STE:US,BBG008FCJZ83,4 Mid-Cap Stocks to Maximize Your Profits,2016-10-07 13:36:00 +0000,http://www.thestreet.com/video/13844817/4-mid-cap-stocks-to-maximize-your-profits.html?puc=yahoov&cm_ven=YAHOOV,4 Mid-Cap Stocks to Maximize Your Profits
STE,STE:US,BBG008FCJZ83,Villere: We look for small-cap 'undiscovered gems',2016-10-06 19:50:00 +0000,http://finance.yahoo.com/video/villere-look-small-cap-undiscovered-195000775.html,Villere: We look for small-cap 'undiscovered gems'
STE,STE:US,BBG008FCJZ83,Analysts Forecast 14% Upside For IYH,2016-09-27 15:23:06 +0000,http://articlefeeds.nasdaq.com/~r/nasdaq/symbols/~3/sG_pQgaEPlA/analysts-forecast-14-upside-for-iyh-cm685262,Looking at the underlying holdings of the ETFs in our coverage universe at ETF Channel we have compared the trading price of each holding against the average analyst 12 month forward target price and computed the weighted average implied analyst target price for the ETF itself For the
STE,STE:US,BBG008FCJZ83,"Stocks Higher As S&P 500 Reaches Key Level, Amazon Hits New High",2016-09-22 18:31:25 +0000,http://www.investors.com/market-trend/stock-market-today/stocks-higher-as-sp-500-reaches-key-level-amazon-hits-new-high/,"Stocks Higher As S&P 500 Reaches Key Level, Amazon Hits New High"
STE,STE:US,BBG008FCJZ83,"STERIS Plc – Value Analysis (NYSE:STE) : September 15, 2016",2016-09-15 15:45:28 +0000,http://www.capitalcube.com/blog/index.php/steris-plc-value-analysis-nyseste-september-15-2016/,"STERIS Plc – Value Analysis (NYSE:STE) : September 15, 2016"
STE,STE:US,BBG008FCJZ83,"STERIS Plc breached its 50 day moving average in a Bearish Manner : STE-US : September 14, 2016",2016-09-14 12:49:45 +0000,http://www.capitalcube.com/blog/index.php/steris-plc-breached-its-50-day-moving-average-in-a-bearish-manner-ste-us-september-14-2016/,"STERIS Plc breached its 50 day moving average in a Bearish Manner : STE-US : September 14, 2016"
STE,STE:US,BBG008FCJZ83,Notable Two Hundred Day Moving Average Cross - STE,2016-09-13 21:46:44 +0000,http://articlefeeds.nasdaq.com/~r/nasdaq/symbols/~3/01ZtXuTVT2E/notable-two-hundred-day-moving-average-cross-ste-cm679072,In trading on Tuesday shares of Steris plc Symbol STE crossed below their 200 day moving average of 69 92 changing hands as low as 69 62 per share Steris plc shares are currently trading off about 1 6 on the day The chart below shows the one year performance of STE shares versus its
STE,STE:US,BBG008FCJZ83,Largest Insider Trades of the Week,2016-09-10 16:29:43 +0000,http://articlefeeds.nasdaq.com/~r/nasdaq/symbols/~3/2udXiRcD6t8/largest-insider-trades-of-the-week-cm677391,The All in One Screener can be used to find insider buys and sells over the last week by clicking on the Insiders tab and changing the settings for All Insider Buying to duration to September 6 and September 6 and All Insider Sales to 5 According to
STE,STE:US,BBG008FCJZ83,STERIS Poised on Synergy Health Addition amid Currency Woes,2016-09-08 15:21:22 +0000,http://articlefeeds.nasdaq.com/~r/nasdaq/symbols/~3/8IZ4ujSDo0E/steris-poised-on-synergy-health-addition-amid-currency-woes-cm676172,On Sep 8 we issued an updated research report on OH based STERIS plc STE a manufacturer and marketer of infection prevention decontamination microbial reduction along with surgical and gastrointestinal support products and services The company currently carries a Zacks Rank 3 Hold
STE,STE:US,BBG008FCJZ83,STERIS Poised on Synergy Health Addition amid Currency Woes,2016-09-08 13:18:01 +0000,http://finance.yahoo.com/news/steris-poised-synergy-health-addition-131801645.html,STERIS Poised on Synergy Health Addition amid Currency Woes
STE,STE:US,BBG008FCJZ83,"STERIS PLC Files SEC form 8-K, Regulation FD Disclosure",2016-09-01 20:32:35 +0000,http://biz.yahoo.com/e/160901/ste8-k.html,"STERIS PLC Files SEC form 8-K, Regulation FD Disclosure"
STE,STE:US,BBG008FCJZ83,"STERIS Plc : STE-US: Dividend Analysis : August 30th, 2016 (record date) : By the numbers : September 1, 2016",2016-09-01 15:11:33 +0000,http://www.capitalcube.com/blog/index.php/steris-plc-ste-us-dividend-analysis-august-30th-2016-record-date-by-the-numbers-september-1-2016/,"STERIS Plc : STE-US: Dividend Analysis : August 30th, 2016 (record date) : By the numbers : September 1, 2016"
STE,STE:US,BBG008FCJZ83,5 Dividend Stocks Increasing Payouts – MO INTU STE MLM MGEE,2016-08-30 05:11:28 +0000,http://articlefeeds.nasdaq.com/~r/nasdaq/symbols/~3/6qOkiM-6P_A/5-dividend-stocks-increasing-payouts-mo-intu-ste-mlm-mgee-cm671957,"Global markets largely treaded water last week in anticipation of Federal Reserve Chair Janet Yellen's speech on Friday, which indicated that the case for raising interest rates"
