TARO,TARO:US,BBG000H2ZMR0,Glancy Prongay & Murray Announces the Filing of a Securities Class Action on Behalf of Taro Pharmaceutical Industries Ltd. Investors and Encourages Investors to Contact the Firm,2016-12-08 15:30:00 +0000,http://finance.yahoo.com/news/glancy-prongay-murray-announces-filing-153000120.html,"[Business Wire] - Glancy Prongay & Murray LLP announces that a class action lawsuit has been filed on behalf of investors who purchased Taro Pharmaceutical Industries Ltd. securities between July 3, 2014 and September 9, 2016, inclusive ."
TARO,TARO:US,BBG000H2ZMR0,"NWBO To Leave Nasdaq, Voyager Cruises Ahead, Watch Out For REGN",2016-12-08 02:21:00 +0000,http://articlefeeds.nasdaq.com/~r/nasdaq/symbols/~3/Ao8ZbZv78_c/nwbo-to-leave-nasdaq-voyager-cruises-ahead-watch-out-for-regn-20161208-00038,"NWBO To Leave Nasdaq, Voyager Cruises Ahead, Watch Out For REGN"
TARO,TARO:US,BBG000H2ZMR0,"TARO SHAREHOLDER ALERT: The Law Offices of Vincent Wong Reminds Investors of a Class Action Involving Taro Pharmaceutical Industries Ltd. and a Lead Plaintiff Deadline of December 27, 2016",2016-12-07 15:49:00 +0000,http://finance.yahoo.com/news/taro-shareholder-alert-law-offices-154900344.html,[Business Wire] - The Law Offices of Vincent Wong announce that a class action lawsuit has been commenced in the USDC for the Southern District of New York on behalf of investors who purchased Taro Pharmaceutical Industries Ltd.
TARO,TARO:US,BBG000H2ZMR0,"Kessler Topaz Meltzer & Check, LLP Reminds Taro Pharmaceutical Industries Ltd. Shareholders of Important Deadline in Class Action Lawsuit",2016-12-07 15:05:00 +0000,http://finance.yahoo.com/news/kessler-topaz-meltzer-check-llp-150500255.html,"[Accesswire] - RADNOR, PA / ACCESSWIRE / December 7, 2016 / The law firm of Kessler Topaz Meltzer & Check, LLP announces that a shareholder class action lawsuit has been filed in the United States District Court for ..."
TARO,TARO:US,BBG000H2ZMR0,"SHAREHOLDER ALERT - Bronstein, Gewirtz & Grossman, LLC Reminds Investors of Class Action Against Taro Pharmaceutical Industries Ltd. (TARO) and Lead Plaintiff Deadline - December 26, 2016",2016-12-06 15:04:00 +0000,http://finance.yahoo.com/news/shareholder-alert-bronstein-gewirtz-grossman-150400589.html,"[Accesswire] - NEW YORK, NY / ACCESSWIRE / December 6, 2016 / Bronstein, Gewirtz & Grossman, LLC reminds investors that a class action lawsuit has been filed against Taro Pharmaceutical Industries Ltd. (""Taro"" ..."
TARO,TARO:US,BBG000H2ZMR0,Taro Pharmaceutical Industries Ltd. (TARO): Are Hedge Funds Right To Fear This Stock?,2016-12-05 20:18:55 +0000,http://www.insidermonkey.com/blog/taro-pharmaceutical-industries-ltd-taro-are-hedge-funds-right-to-fear-this-stock-499068/,Taro Pharmaceutical Industries Ltd. (TARO): Are Hedge Funds Right To Fear This Stock?
TARO,TARO:US,BBG000H2ZMR0,EQUITY ALERT: Rosen Law Firm Announces Filing of Securities Class Action Lawsuit Against Taro Pharmaceutical Industries Ltd. - TARO,2016-12-02 23:27:17 +0000,http://finance.yahoo.com/news/equity-alert-rosen-law-firm-232717210.html,"[GlobeNewswire] - NEW YORK, Dec. 02, 2016-- Rosen Law Firm, a global investor rights law firm, announces the filing of a class action lawsuit on behalf of purchasers of Taro Pharmaceutical Industries Ltd. securities from ..."
TARO,TARO:US,BBG000H2ZMR0,"TARO INVESTOR ALERT: The Law Offices of Vincent Wong Reminds Investors of a Class Action Involving Taro Pharmaceutical Industries Ltd. and a Lead Plaintiff Deadline of December 27, 2016",2016-12-02 16:33:00 +0000,http://finance.yahoo.com/news/taro-investor-alert-law-offices-163300697.html,"[PR Newswire] - NEW YORK, Dec. 2, 2016 /PRNewswire/ -- The Law Offices of Vincent Wong announce that a class action lawsuit has been commenced in the USDC for the Southern District of New York on behalf of investors who ..."
TARO,TARO:US,BBG000H2ZMR0,"5:09 pm Taro Pharm appointed Abhay Gandhi as Interim CEO effective Jan 1, 2017",2016-12-01 22:09:00 +0000,http://finance.yahoo.com/news/inplay-briefing-com-055139997.html#taro,"5:09 pm Taro Pharm appointed Abhay Gandhi as Interim CEO effective Jan 1, 2017"
TARO,TARO:US,BBG000H2ZMR0,Taro Announces Appointment of Interim CEO,2016-12-01 22:05:00 +0000,http://finance.yahoo.com/news/taro-announces-appointment-interim-ceo-220500385.html,"[Business Wire] - Taro Pharmaceutical Industries Ltd. announced today that its Board of Directors has appointed Mr. Abhay Gandhi to the position of Interim Chief Executive Officer, effective January 1, 2017."
TARO,TARO:US,BBG000H2ZMR0,Taro Pharma Appoints Abhay Gandhi As Interim CEO,2016-12-01 20:48:00 +0000,http://articlefeeds.nasdaq.com/~r/nasdaq/symbols/~3/F7FAQmfcJNA/taro-pharma-appoints-abhay-gandhi-as-interim-ceo-20161201-01364,Taro Pharma Appoints Abhay Gandhi As Interim CEO
TARO,TARO:US,BBG000H2ZMR0,"ETFs with exposure to Taro Pharmaceutical Industries Ltd. : November 29, 2016",2016-11-29 19:25:28 +0000,http://www.capitalcube.com/blog/index.php/etfs-with-exposure-to-taro-pharmaceutical-industries-ltd-november-29-2016/,"ETFs with exposure to Taro Pharmaceutical Industries Ltd. : November 29, 2016"
TARO,TARO:US,BBG000H2ZMR0,Is Packaging Corp Of America (PKG) A Good Stock To Buy?,2016-11-29 18:36:40 +0000,http://www.insidermonkey.com/blog/is-packaging-corp-of-america-pkg-a-good-stock-to-buy-2-494858/,Is Packaging Corp Of America (PKG) A Good Stock To Buy?
TARO,TARO:US,BBG000H2ZMR0,Important Deadline Reminder For Taro Pharmaceutical Industries Ltd. Shareholders,2016-11-29 16:00:00 +0000,http://finance.yahoo.com/news/important-deadline-reminder-taro-pharmaceutical-160000728.html,"[Accesswire] - RADNOR, PA / ACCESSWIRE / November 29, 2016 / The law firm of Kessler Topaz Meltzer & Check, LLP reminds Taro Pharmaceutical Industries Ltd. (NYSE: TARO) (""Taro"" or the ""Company"") shareholders ..."
TARO,TARO:US,BBG000H2ZMR0,"SHAREHOLDER ALERT: Levi & Korsinsky, LLP Reminds Shareholders of Taro Pharmaceutical Industries Ltd. of a Class Action Lawsuit and a Lead Plaintiff Deadline of December 27, 2016",2016-11-28 15:12:00 +0000,http://finance.yahoo.com/news/shareholder-alert-levi-korsinsky-llp-151200431.html,"[Business Wire] - The following statement is being issued by Levi & Korsinsky, LLP:"
TARO,TARO:US,BBG000H2ZMR0,"SHAREHOLDER ALERT - Bronstein, Gewirtz & Grossman, LLC Reminds Investors of Class Action Against Taro Pharmaceutical Industries Ltd. (TARO) and Lead Plaintiff Deadline December 26, 2016",2016-11-28 15:03:00 +0000,http://finance.yahoo.com/news/shareholder-alert-bronstein-gewirtz-grossman-150300014.html,"[Accesswire] - NEW YORK, NY / ACCESSWIRE / November 28, 2016 / Bronstein, Gewirtz & Grossman, LLC reminds investors that a class action lawsuit has been filed against Taro Pharmaceutical Industries Ltd. (""Taro"" ..."
TARO,TARO:US,BBG000H2ZMR0,"Taro Pharmaceutical Industries Ltd. breached its 50 day moving average in a Bullish Manner : TARO-US : November 28, 2016",2016-11-28 12:19:21 +0000,http://www.capitalcube.com/blog/index.php/taro-pharmaceutical-industries-ltd-breached-its-50-day-moving-average-in-a-bullish-manner-taro-us-november-28-2016/,"Taro Pharmaceutical Industries Ltd. breached its 50 day moving average in a Bullish Manner : TARO-US : November 28, 2016"
TARO,TARO:US,BBG000H2ZMR0,"TARO SHAREHOLDER ALERT BY FORMER LOUISIANA ATTORNEY GENERAL: KAHN SWICK & FOTI, LLC REMINDS INVESTORS WITH LOSSES IN EXCESS OF $100,000 of Lead Plaintiff Deadline in Class Action Lawsuit Against Taro Pharmaceutical Industries Ltd. - TARO",2016-11-26 03:07:00 +0000,http://finance.yahoo.com/news/taro-shareholder-alert-former-louisiana-030700068.html,"[PR Newswire] - NEW ORLEANS, Nov. 25, 2016 /PRNewswire/ -- Kahn Swick & Foti, LLC (""KSF"") and KSF partner, the former Attorney General of Louisiana, Charles C. Foti, Jr., remind investors that they have until ..."
TARO,TARO:US,BBG000H2ZMR0,"DEADLINE ALERT: Brower Piven Alerts Shareholders Of Approaching Deadline In Class Action Lawsuit And Encourages Those With Losses In Excess Of $100,000 From Investment In Taro Pharmaceutical Industries Ltd. To Contact The Firm",2016-11-25 21:13:00 +0000,http://finance.yahoo.com/news/deadline-alert-brower-piven-alerts-211300403.html,"[Business Wire] - The securities litigation law firm of Brower Piven, A Professional Corporation, announces that a class action lawsuit has been commenced in the United States District Court for the Southern District of New York on behalf of purchasers of Taro Pharmaceutical Industries Ltd."
TARO,TARO:US,BBG000H2ZMR0,"Health Care Sector Update for 11/25/2016: TARO,IPCI,MCUR",2016-11-25 18:04:25 +0000,http://articlefeeds.nasdaq.com/~r/nasdaq/symbols/~3/nsTWi0lPbl0/health-care-sector-update-for-11252016-taroipcimcur-cm714034,Top Health Care StocksTop Health Care Stocks JNJ 0 83 JNJ 0 83 PFE 0 62 PFE 0 62 MRK 0 36 MRK 0 36 ABT 1 07 ABT 1 07 AMGN 0 45 AMGN 0 45 Health care stocks were higher in afternoon trading with the NYSE Health Care Index jumping out to a 0 7 gain while shares of health
TARO,TARO:US,BBG000H2ZMR0,Taro Announces New $250 Million Share Repurchase Authorization,2016-11-23 22:36:08 +0000,http://www.publicnow.com/view/B73CC86FA42EC6CE2E1B861E6559E8D3DDF8DF3C,"[at noodls] - HAWTHORNE, N.Y.--(BUSINESS WIRE)--Nov. 23, 2016-- Taro Pharmaceutical Industries Ltd. (NYSE:TARO) announced today that its Board of Directors has approved a new $250 million share repurchase authorization ..."
TARO,TARO:US,BBG000H2ZMR0,"TARO SHAREHOLDER ALERT: The Law Offices of Vincent Wong Reminds Investors of a Class Action Involving Taro Pharmaceutical Industries Ltd. and a Lead Plaintiff Deadline of December 27, 2016",2016-11-23 15:55:00 +0000,http://finance.yahoo.com/news/taro-shareholder-alert-law-offices-155500688.html,[Business Wire] - The Law Offices of Vincent Wong announce that a class action lawsuit has been commenced in the USDC for the Southern District of New York on behalf of investors who purchased Taro Pharmaceutical Industries Ltd.
TARO,TARO:US,BBG000H2ZMR0,"SHAREHOLDER ALERT - Bronstein, Gewirtz & Grossman, LLC Reminds Investors of Class Action Against Taro Pharmaceutical Industries Ltd. (TARO) and Lead Plaintiff Deadline: December 26, 2016",2016-11-23 15:02:00 +0000,http://finance.yahoo.com/news/shareholder-alert-bronstein-gewirtz-grossman-150200976.html,"[Accesswire] - NEW YORK, NY / ACCESSWIRE / November 23, 2016 / Bronstein, Gewirtz & Grossman, LLC reminds investors that a class action lawsuit has been filed against Taro Pharmaceutical Industries Ltd. (""Taro"" ..."
TARO,TARO:US,BBG000H2ZMR0,IMPORTANT SHAREHOLDER ALERT: Lundin Law PC Announces Securities Class Action Lawsuit against Taro Pharmaceutical Industries Ltd. and Reminds Investors with Losses to Contact the Firm,2016-11-22 17:10:00 +0000,http://finance.yahoo.com/news/important-shareholder-alert-lundin-law-171000170.html,"[Accesswire] - LOS ANGELES, CA / ACCESSWIRE / November 22, 2016 / Lundin Law PC , a shareholder rights firm, announces a class action lawsuit against Taro Pharmaceutical Industries (""Taro"" or the ""Company"") ..."
TARO,TARO:US,BBG000H2ZMR0,"Kessler Topaz Meltzer & Check, LLP Announces Shareholder Lawsuit Filed Against Taro Pharmaceutical Industries Ltd.",2016-11-22 15:55:00 +0000,http://finance.yahoo.com/news/kessler-topaz-meltzer-check-llp-155500826.html,"[GlobeNewswire] - RADNOR, Pa., Nov. 22, 2016-- The law firm of Kessler Topaz Meltzer & Check, LLP announces that a shareholder class action lawsuit has been filed against Taro Pharmaceutical Industries Ltd. on behalf of ..."
TARO,TARO:US,BBG000H2ZMR0,Taro Announces Appointment of New CEO and New Board Member Nominations,2016-11-22 13:44:14 +0000,http://www.publicnow.com/view/B32DB328CCF7A53DB4C1704CAA35DE0EA95063D3,"[at noodls] - HAWTHORNE, N.Y.--(BUSINESS WIRE)--Nov. 22, 2016-- Taro Pharmaceutical Industries Ltd. (NYSE: TARO) ('Taro' or the 'Company') announced today the appointment of Mr. Uday Baldota as Chief Executive Officer ..."
TARO,TARO:US,BBG000H2ZMR0,"SHAREHOLDER ALERT: Brower Piven Encourages Investors Who Have Losses In Excess Of $100,000 From Investment In Taro Pharmaceutical Industries Ltd To Contact Brower Piven Before The Lead Plaintiff Deadline In Class Action Lawsuit – TARO",2016-11-19 04:45:00 +0000,http://finance.yahoo.com/news/shareholder-alert-brower-piven-encourages-044500810.html,"[GlobeNewswire] - STEVENSON, Md., Nov. 18, 2016-- The securities litigation law firm of Brower Piven, A Professional Corporation, announces that a class action lawsuit has been commenced in the United States District Court ..."
TARO,TARO:US,BBG000H2ZMR0,IMPORTANT SHAREHOLDER ALERT: Khang & Khang LLP Announces Securities Class Action Lawsuit against Taro Pharmaceutical Industries Ltd. and Reminds Investors with Losses to Contact the Firm,2016-11-18 18:04:00 +0000,http://finance.yahoo.com/news/important-shareholder-alert-khang-khang-180400931.html,"[Accesswire] - IRVINE, CA / ACCESSWIRE / November 18, 2016 / Khang & Khang LLP (the ""Firm"") announces a class action lawsuit against Taro Pharmaceutical Industries Ltd. (""Taro"" or the ""Company"") ..."
TARO,TARO:US,BBG000H2ZMR0,"TARO INVESTOR ALERT: The Law Offices of Vincent Wong Reminds Investors of a Class Action Involving Taro Pharmaceutical Industries Ltd. and a Lead Plaintiff Deadline of December 27, 2016",2016-11-18 16:26:17 +0000,http://finance.yahoo.com/news/taro-investor-alert-law-offices-162617444.html,"[GlobeNewswire] - NEW YORK, Nov. 18, 2016-- The Law Offices of Vincent Wong announce that a class action lawsuit has been commenced in the USDC for the Southern District of New York on behalf of investors who purchased ..."
TARO,TARO:US,BBG000H2ZMR0,SHAREHOLDER ALERT: Class Action Lawsuit Filed Against Taro Pharmaceutical Industries Ltd. -- TARO,2016-11-18 16:00:00 +0000,http://finance.yahoo.com/news/shareholder-alert-class-action-lawsuit-160000203.html,"[Accesswire] - RADNOR, PA / ACCESSWIRE / November 18, 2016 / The law firm of Kessler Topaz Meltzer & Check, LLP alerts Taro Pharmaceutical Industries Ltd. (NYSE: TARO) (""Taro"" or the ""Company"") shareholders ..."
TARO,TARO:US,BBG000H2ZMR0,NYPD Union Goes After Drug Prices Amid DOJ Pharma Probe,2016-11-17 16:00:00 +0000,http://www.bloomberg.com/news/articles/2016-11-17/nypd-union-goes-after-drug-prices-amid-doj-pharma-investigation?cmpid=yhoo.headline,NYPD Union Goes After Drug Prices Amid DOJ Pharma Probe
TARO,TARO:US,BBG000H2ZMR0,IMPORTANT INVESTOR ALERT: Lundin Law PC Announces Securities Class Action Lawsuit against Taro Pharmaceutical Industries Ltd. and Reminds Investors with Losses to Contact the Firm,2016-11-16 21:40:00 +0000,http://finance.yahoo.com/news/important-investor-alert-lundin-law-214000376.html,"[Accesswire] - LOS ANGELES, CA / ACCESSWIRE / November 16, 2016 / Lundin Law PC , a shareholder rights firm, announces a class action lawsuit against Taro Pharmaceutical Industries (""Taro"" or the ""Company"") ..."
TARO,TARO:US,BBG000H2ZMR0,TARO LOSS ALERT: Rosen Law Reminds Taro Pharmaceutical Industries Ltd. Investors of Important Deadline in Class Action Filed by Firm - TARO,2016-11-16 19:20:29 +0000,http://finance.yahoo.com/news/taro-loss-alert-rosen-law-192029892.html,"[GlobeNewswire] - NEW YORK, Nov. 16, 2016-- Rosen Law Firm, a global investor rights law firm, reminds purchasers of Taro Pharmaceutical Industries Ltd. securities from July 3, 2014 through September 9, 2016, both dates ..."
TARO,TARO:US,BBG000H2ZMR0,IMPORTANT INVESTOR ALERT: Khang & Khang LLP Announces Securities Class Action Lawsuit against Taro Pharmaceutical Industries Ltd. and Reminds Investors with Losses to Contact the Firm,2016-11-16 16:50:00 +0000,http://finance.yahoo.com/news/important-investor-alert-khang-khang-165000624.html,"[Accesswire] - IRVINE, CA / ACCESSWIRE / November 16, 2016 / Khang & Khang LLP (the ""Firm"") announces a class action lawsuit against Taro Pharmaceutical Industries Ltd. (""Taro"" or the ""Company"") ..."
TARO,TARO:US,BBG000H2ZMR0,"SHAREHOLDER ALERT - Bronstein, Gewirtz & Grossman, LLC Reminds Investors of Class Action Against Taro Pharmaceutical Industries Ltd. (TARO) & Lead Plaintiff Deadline: December 26, 2016",2016-11-16 15:10:00 +0000,http://finance.yahoo.com/news/shareholder-alert-bronstein-gewirtz-grossman-151000911.html,"[GlobeNewswire] - NEW YORK, Nov. 16, 2016-- Attorney Advertising-- Bronstein, Gewirtz & Grossman, LLC reminds investors that a class action lawsuit has been filed against Taro Pharmaceutical Industries Ltd. and certain ..."
TARO,TARO:US,BBG000H2ZMR0,EQUITY ALERT: Lundin Law PC Announces Securities Class Action Lawsuit against Taro Pharmaceutical Industries Ltd. and Encourages Investors with Losses to Contact the Firm,2016-11-15 21:31:00 +0000,http://finance.yahoo.com/news/equity-alert-lundin-law-pc-213100535.html,"[Accesswire] - LOS ANGELES, CA / ACCESSWIRE / November 15, 2016 / Lundin Law PC , a shareholder rights firm, announces a class action lawsuit against Taro Pharmaceutical Industries (""Taro"" or the ""Company"") ..."
TARO,TARO:US,BBG000H2ZMR0,Shareholder Class Action Filed Against Taro Pharmaceutical Industries Ltd. - TARO,2016-11-15 18:06:00 +0000,http://finance.yahoo.com/news/shareholder-class-action-filed-against-180600721.html,"[PR Newswire] - RADNOR, Pa., Nov. 15, 2016 /PRNewswire/ -- The law firm of Kessler Topaz Meltzer & Check, LLP announces that a shareholder class action lawsuit has been filed against Taro Pharmaceutical Industries Ltd. (TARO) (""Taro"" or the ""Company"") on behalf of purchasers of the Company's securities between July 3, 2014 and September 9, 2016, inclusive (the ""Class Period""). Investors who purchased Taro securities during the Class Period may, no later than December 26, 2016, petition the Court to be appointed as a lead plaintiff representative of the class. For additional information or to learn how to participate in this action please visit https://www.ktmc.com/new-cases/taro-pharmaceutical-industries-ltd#join. Taro shareholders who wish to discuss this action and their legal options are encouraged to contact Kessler Topaz Meltzer & Check, LLP (Darren J. Check, Esq., D. Seamus Kaskela, Esq."
TARO,TARO:US,BBG000H2ZMR0,EQUITY ALERT: Khang & Khang LLP Announces Securities Class Action Lawsuit against Taro Pharmaceutical Industries Ltd. and Encourages Investors with Losses to Contact the Firm,2016-11-14 21:30:00 +0000,http://finance.yahoo.com/news/equity-alert-khang-khang-llp-213000830.html,"[Accesswire] - IRVINE, CA / ACCESSWIRE / November 14, 2016 / Khang & Khang LLP (the ""Firm"") announces a class action lawsuit against Taro Pharmaceutical Industries Ltd. (""Taro"" or the ""Company"") ..."
TARO,TARO:US,BBG000H2ZMR0,"INVESTOR ALERT: Levi & Korsinsky, LLP Reminds Shareholders of Taro Pharmaceutical Industries Ltd. of a Class Action Lawsuit and a Lead Plaintiff Deadline of December 27, 2016 – TARO",2016-11-14 20:02:49 +0000,http://finance.yahoo.com/news/investor-alert-levi-korsinsky-llp-200249788.html,"[GlobeNewswire] - NEW YORK, Nov. 14, 2016-- The following statement is being issued by Levi & Korsinsky, LLP:. To: All persons or entities who purchased or otherwise acquired securities of Taro Pharmaceutical Industries ..."
TARO,TARO:US,BBG000H2ZMR0,SHAREHOLDER ALERT: Lundin Law PC Announces Securities Class Action Lawsuit against Taro Pharmaceutical Industries Ltd. and Encourages Investors with Losses to Contact the Firm,2016-11-12 13:46:00 +0000,http://finance.yahoo.com/news/shareholder-alert-lundin-law-pc-134600374.html,"[Accesswire] - LOS ANGELES, CA / ACCESSWIRE / November 12, 2016 / Lundin Law PC , a shareholder rights firm, announces a class action lawsuit against Taro Pharmaceutical Industries (""Taro"" or the ""Company"") ..."
TARO,TARO:US,BBG000H2ZMR0,"TARO SHAREHOLDER ALERT BY FORMER LOUISIANA ATTORNEY GENERAL: KAHN SWICK & FOTI, LLC REMINDS INVESTORS WITH LOSSES IN EXCESS OF $100,000 of Lead Plaintiff Deadline in Class Action Lawsuit Against Taro Pharmaceutical Industries Ltd. - TARO",2016-11-12 03:07:00 +0000,http://finance.yahoo.com/news/taro-shareholder-alert-former-louisiana-030700952.html,"[Marketwired] - Kahn Swick & Foti, LLC and KSF partner, the former Attorney General of Louisiana, Charles C. Foti, Jr., remind investors that they have until December 26, 2016 to file lead plaintiff applications in a ..."
TARO,TARO:US,BBG000H2ZMR0,"Taro Pharmaceutical Industries Ltd.: Gathering momentum, can it sustain its performance?",2016-11-11 20:34:12 +0000,http://www.capitalcube.com/blog/index.php/taro-pharmaceutical-industries-ltd-gathering-momentum-can-it-sustain-its-performance/,"Taro Pharmaceutical Industries Ltd.: Gathering momentum, can it sustain its performance?"
TARO,TARO:US,BBG000H2ZMR0,INVESTOR ALERT: Khang & Khang LLP Announces Securities Class Action Lawsuit Against Taro Pharmaceutical Industries Ltd. and Encourages Investors with Losses to Contact the Firm,2016-11-10 19:32:00 +0000,http://finance.yahoo.com/news/investor-alert-khang-khang-llp-193200241.html,"[Accesswire] - IRVINE, CA / ACCESSWIRE / November 10, 2016 / Khang & Khang LLP (the ""Firm"") announces a class action lawsuit against Taro Pharmaceutical Industries Ltd. (""Taro"" or the ""Company"") ..."
TARO,TARO:US,BBG000H2ZMR0,"SHAREHOLDER ALERT - Bronstein, Gewirtz & Grossman, LLC Notifies Investors of Class Action Against Taro Pharmaceutical Industries Ltd. (TARO) & Lead Plaintiff Deadline: December 26, 2016",2016-11-10 15:09:00 +0000,http://finance.yahoo.com/news/shareholder-alert-bronstein-gewirtz-grossman-150900344.html,"[Accesswire] - NEW YORK, NY / ACCESSWIRE / November 10, 2016 / Bronstein, Gewirtz & Grossman, LLC notifies investors that a class action lawsuit has been filed against Taro Pharmaceutical Industries Ltd. (""Taro"" ..."
TARO,TARO:US,BBG000H2ZMR0,"Taro Pharmaceutical Industries Ltd. :TARO-US: Earnings Analysis: Q2, 2017 By the Numbers : November 10, 2016",2016-11-10 14:39:06 +0000,http://www.capitalcube.com/blog/index.php/taro-pharmaceutical-industries-ltd-taro-us-earnings-analysis-q2-2017-by-the-numbers-november-10-2016/,"Taro Pharmaceutical Industries Ltd. :TARO-US: Earnings Analysis: Q2, 2017 By the Numbers : November 10, 2016"
TARO,TARO:US,BBG000H2ZMR0,Edited Transcript of TARO earnings conference call or presentation 9-Nov-16 1:30pm GMT,2016-11-10 02:07:15 +0000,http://finance.yahoo.com/news/edited-transcript-taro-earnings-conference-020715847.html,Edited Transcript of TARO earnings conference call or presentation 9-Nov-16 1:30pm GMT
TARO,TARO:US,BBG000H2ZMR0,INVESTOR ALERT: Lundin Law PC Announces Securities Class Action Lawsuit against Taro Pharmaceutical Industries Ltd. and Encourages Investors with Losses to Contact the Firm,2016-11-09 22:47:00 +0000,http://finance.yahoo.com/news/investor-alert-lundin-law-pc-224700906.html,"[Accesswire] - LOS ANGELES, CA / ACCESSWIRE / November 9, 2016 / Lundin Law PC , a shareholder rights firm, announces a class action lawsuit against Taro Pharmaceutical Industries (""Taro"" or the ""Company"") ..."
TARO,TARO:US,BBG000H2ZMR0,"SHAREHOLDER ALERT: Levi & Korsinsky, LLP Notifies Shareholders of Taro Pharmaceutical Industries Ltd. of a Class Action Lawsuit and a Lead Plaintiff Deadline of December 27, 2016 - TARO",2016-11-09 19:40:00 +0000,http://finance.yahoo.com/news/shareholder-alert-levi-korsinsky-llp-194000770.html,"[Accesswire] - NEW YORK, NY / ACCESSWIRE / November 9, 2016 / The following statement is being issued by Levi & Korsinsky, LLP: To: All persons or entities who purchased or otherwise acquired securities of Taro Pharmaceutical ..."
TARO,TARO:US,BBG000H2ZMR0,Taro Pharmaceutical Industries Ltd Earnings Call scheduled for 8:30 am ET today,2016-11-09 13:30:00 +0000,http://biz.yahoo.com/cc/3/154693.html,Taro Pharmaceutical Industries Ltd Earnings Call scheduled for 8:30 am ET today
TARO,TARO:US,BBG000H2ZMR0,Taro posts 2Q profit,2016-11-08 22:39:27 +0000,http://sg.finance.yahoo.com/news/taro-posts-2q-profit-223927635.html,Taro posts 2Q profit
TARO,TARO:US,BBG000H2ZMR0,"Taro Provides Results for September 30, 2016",2016-11-08 22:39:06 +0000,http://www.publicnow.com/view/345D9B20A2484C2962F4CB9C139C127825E95EB3,"[at noodls] - HAWTHORNE, N.Y.--(BUSINESS WIRE)--Nov. 8, 2016-- Taro Pharmaceutical Industries Ltd. (NYSE:TARO) ('Taro' or the 'Company') today provided unaudited financial results for the three and six months ended ..."
TARO,TARO:US,BBG000H2ZMR0,Q2 2017 Taro Pharmaceutical Industries Ltd Earnings Release - After Market Close,2016-11-08 12:07:09 +0000,http://biz.yahoo.com/research/earncal/20161108.html?t=taro,Q2 2017 Taro Pharmaceutical Industries Ltd Earnings Release - After Market Close
TARO,TARO:US,BBG000H2ZMR0,"Teva, Allergan, Mylan Rally Following Sell-Off On DOJ Antitrust Probe",2016-11-04 20:24:10 +0000,http://www.investors.com/news/technology/teva-allergan-mylan-rally-following-sell-off-on-doj-antitrust-probe/,"Teva, Allergan, Mylan Rally Following Sell-Off On DOJ Antitrust Probe"
TARO,TARO:US,BBG000H2ZMR0,SHAREHOLDER ALERT: Khang & Khang LLP Announces Securities Class Action Lawsuit against Taro Pharmaceutical Industries Ltd. and Encourages Investors with Losses to Contact the Firm,2016-11-04 15:10:00 +0000,http://finance.yahoo.com/news/shareholder-alert-khang-khang-llp-151000776.html,"[Accesswire] - IRVINE, CA / ACCESSWIRE / November 4, 2016 / Khang & Khang LLP (the ""Firm"") announces a class action lawsuit against Taro Pharmaceutical Industries Ltd. (""Taro"" or the ""Company"") ..."
TARO,TARO:US,BBG000H2ZMR0,"INVESTOR ALERT: Levi & Korsinsky, LLP Notifies Shareholders of Taro Pharmaceutical Industries Ltd. of Commencement of a Class Action Lawsuit and a Lead Plaintiff Deadline of December 27, 2016 -- TARO",2016-11-04 14:13:12 +0000,http://finance.yahoo.com/news/investor-alert-levi-korsinsky-llp-141312143.html,"[Marketwired] - The following statement is being issued by Levi & Korsinsky, LLP: To: All persons or entities who purchased or otherwise acquired securities of Taro Pharmaceutical Industries Ltd. between July 3, 2014 ..."
