TARO,TARO:US,BBG000H2ZMR0,[$$] Generic-Drug Firms Face Possible Collusion Charges,2016-11-04 03:57:43 +0000,http://www.wsj.com/articles/generic-drug-makers-shares-drop-on-report-of-possible-probe-1478209036?ru=yahoo?mod=yahoo_itp,"[at The Wall Street Journal] - Federal prosecutors, after a lengthy probe, are nearing possible criminal charges for price-collusion in the generic-drug industry, according to a person familiar with the matter."
TARO,TARO:US,BBG000H2ZMR0,"ACHN Tanks, INNL''s Acts Fail, LCI In The Crosshair Of Law, ONCE Loses Its Spark",2016-11-04 03:44:00 +0000,http://articlefeeds.nasdaq.com/~r/nasdaq/symbols/~3/WBMAZAXetGU/achn-tanks-innls-acts-fail-lci-in-the-crosshair-of-law-once-loses-its-spark-20161104-00065,"ACHN Tanks, INNL''s Acts Fail, LCI In The Crosshair Of Law, ONCE Loses Its Spark"
TARO,TARO:US,BBG000H2ZMR0,Generic Drug Firms Face Possible Collusion Charges -- WSJ,2016-11-04 02:47:00 +0000,http://articlefeeds.nasdaq.com/~r/nasdaq/symbols/~3/78-5RUwZImE/generic-drug-firms-face-possible-collusion-charges--wsj-20161104-00491,Generic Drug Firms Face Possible Collusion Charges -- WSJ
TARO,TARO:US,BBG000H2ZMR0,Taro Pharmaceutical Industries Enters Oversold Territory (TARO),2016-11-03 22:08:05 +0000,http://articlefeeds.nasdaq.com/~r/nasdaq/symbols/~3/YUyXUZkghjE/taro-pharmaceutical-industries-enters-oversold-territory-taro-cm703692,Legendary investor Warren Buffett advises to be fearful when others are greedy and be greedy when others are fearful One way we can try to measure the level of fear in a given stock is through a technical analysis indicator called the Relative Strength Index or RSI which measures momentum on
TARO,TARO:US,BBG000H2ZMR0,[$$] Generic-Drug Makers' Shares Drop on Report of Possible Probe,2016-11-03 21:59:32 +0000,http://www.wsj.com/articles/generic-drug-makers-shares-drop-on-report-of-possible-probe-1478209036?mod=yahoo_hs,[$$] Generic-Drug Makers' Shares Drop on Report of Possible Probe
TARO,TARO:US,BBG000H2ZMR0,Generic-Drug Firms Face Possible Collusion Charges -- 1st update,2016-11-03 20:57:00 +0000,http://articlefeeds.nasdaq.com/~r/nasdaq/symbols/~3/-bOvVSAKTss/genericdrug-firms-face-possible-collusion-charges--1st-update-20161103-01236,Generic-Drug Firms Face Possible Collusion Charges -- 1st update
TARO,TARO:US,BBG000H2ZMR0,Generic-Drug Firms Face Possible Collusion Charges,2016-11-03 17:55:00 +0000,http://articlefeeds.nasdaq.com/~r/nasdaq/symbols/~3/q_BrV9vSKks/genericdrug-firms-face-possible-collusion-charges-20161103-01241,Generic-Drug Firms Face Possible Collusion Charges
TARO,TARO:US,BBG000H2ZMR0,Generic Drug Firms Face Possible Collusion Charges,2016-11-03 17:55:00 +0000,http://articlefeeds.nasdaq.com/~r/nasdaq/symbols/~3/Kn4Mp2kihCw/generic-drug-firms-face-possible-collusion-charges-20161103-01234,Generic Drug Firms Face Possible Collusion Charges
TARO,TARO:US,BBG000H2ZMR0,Generic-Drug Makers' Shares Drop on Report of Possible Probe,2016-11-03 17:52:00 +0000,http://articlefeeds.nasdaq.com/~r/nasdaq/symbols/~3/Qi3HbUrZ900/genericdrug-makers-shares-drop-on-report-of-possible-probe-20161103-01235,Generic-Drug Makers' Shares Drop on Report of Possible Probe
TARO,TARO:US,BBG000H2ZMR0,Generic-Drug Makers' Shares Drop on Report of Possible Probe,2016-11-03 17:52:00 +0000,http://articlefeeds.nasdaq.com/~r/nasdaq/symbols/~3/fpYzXktG2Rc/genericdrug-makers-shares-drop-on-report-of-possible-probe-20161103-01152,Generic-Drug Makers' Shares Drop on Report of Possible Probe
TARO,TARO:US,BBG000H2ZMR0,Generic-Drug Makers'' Shares Drop on Report of Possible Probe,2016-11-03 17:52:00 +0000,http://articlefeeds.nasdaq.com/~r/nasdaq/symbols/~3/hdznyXa-NO0/genericdrug-makers-shares-drop-on-report-of-possible-probe-20161103-01155,Generic-Drug Makers'' Shares Drop on Report of Possible Probe
TARO,TARO:US,BBG000H2ZMR0,DOJ Looking Into Possible Price Collusion in Generic Drug Sector -Bloomberg,2016-11-03 15:53:00 +0000,http://articlefeeds.nasdaq.com/~r/nasdaq/symbols/~3/a_8Tr5zcdTE/doj-looking-into-possible-price-collusion-in-generic-drug-sector-bloomberg-20161103-02025,DOJ Looking Into Possible Price Collusion in Generic Drug Sector -Bloomberg
TARO,TARO:US,BBG000H2ZMR0,IMPORTANT EQUITY ALERT: Lundin Law PC Announces Securities Class Action Lawsuit against Taro Pharmaceutical Industries Ltd. and Encourages Investors with Losses to Contact the Firm,2016-11-03 15:30:00 +0000,http://finance.yahoo.com/news/important-equity-alert-lundin-law-153000842.html,"[Accesswire] - LOS ANGELES, CA / ACCESSWIRE / November 3, 2016 / Lundin Law PC , a shareholder rights firm, announces the filing of a class action lawsuit against Taro Pharmaceutical Industries (""Taro"" or the ..."
TARO,TARO:US,BBG000H2ZMR0,Glancy Prongay & Murray LLP Commences Investigation on Behalf of Taro Pharmaceutical Industries Ltd.,2016-11-03 14:30:00 +0000,http://finance.yahoo.com/news/glancy-prongay-murray-llp-commences-143000489.html,[Business Wire] - Glancy Prongay & Murray LLP announces an investigation on behalf of Taro Pharmaceutical Industries Ltd. concerning the Company and its officers’ possible violations of federal securities laws.
TARO,TARO:US,BBG000H2ZMR0,IMPORTANT EQUITY ALERT: Khang & Khang LLP Announces Securities Class Action Lawsuit against Taro Pharmaceutical Industries Ltd. and Encourages Investors with Losses to Contact the Firm,2016-11-03 14:16:00 +0000,http://finance.yahoo.com/news/important-equity-alert-khang-khang-141600532.html,"[Accesswire] - IRVINE, CA / ACCESSWIRE / November 3, 2016 / Khang & Khang LLP (the ""Firm"") announces the filing of a class action lawsuit against Taro Pharmaceutical Industries Ltd. (""Taro"" or the ..."
TARO,TARO:US,BBG000H2ZMR0,"INVESTOR ALERT: Brower Piven Encourages Shareholders Who Have Losses In Excess Of $100,000 From Investment In Taro Pharmaceutical Industries Ltd. To Contact Brower Piven Before The Lead Plaintiff Deadline In Class Action Lawsuit",2016-11-03 12:00:00 +0000,http://finance.yahoo.com/news/investor-alert-brower-piven-encourages-120000039.html,"[Business Wire] - The securities litigation law firm of Brower Piven, A Professional Corporation, announces that a class action lawsuit has been commenced in the United States District Court for the Southern District of New York on behalf of purchasers of Taro Pharmaceutical Industries Ltd."
TARO,TARO:US,BBG000H2ZMR0,IMPORTANT SHAREHOLDER ALERT: Lundin Law PC Announces Securities Class Action Lawsuit against Taro Pharmaceutical Industries Ltd. and Encourages Investors with Losses to Contact the Firm,2016-11-02 21:36:00 +0000,http://finance.yahoo.com/news/important-shareholder-alert-lundin-law-213600146.html,"[Accesswire] - LOS ANGELES, CA / ACCESSWIRE / November 2, 2016 / Lundin Law PC , a shareholder rights firm, announces a class action lawsuit has been filed against Taro Pharmaceutical Industries (""Taro"" or ..."
TARO,TARO:US,BBG000H2ZMR0,EQUITY ALERT: Rosen Law Firm Announces Filing of Securities Class Action Lawsuit Against Taro Pharmaceutical Industries Ltd. - TARO,2016-11-02 20:29:00 +0000,http://finance.yahoo.com/news/equity-alert-rosen-law-firm-202900882.html,"[Business Wire] - Rosen Law Firm, a global investor rights law firm, announces the filing of a class action lawsuit on behalf of purchasers of Taro Pharmaceutical Industries Ltd. securities from July 3, 2014 through September 9, 2016, both dates inclusive ."
TARO,TARO:US,BBG000H2ZMR0,IMPORTANT INVESTOR ALERT: Khang & Khang LLP Announces Securities Class Action Lawsuit against Taro Pharmaceutical Industries Ltd. and Encourages Investors with Losses to Contact the Firm,2016-11-02 15:58:00 +0000,http://finance.yahoo.com/news/important-investor-alert-khang-khang-155800122.html,"[Accesswire] - IRVINE, CA / ACCESSWIRE / November 2, 2016 / Khang & Khang LLP (the ""Firm"") announces the filing of a class action lawsuit against Taro Pharmaceutical Industries Ltd. (""Taro"" or the ..."
TARO,TARO:US,BBG000H2ZMR0,"SHAREHOLDER ALERT: Bronstein, Gewirtz & Grossman, LLC Notifies Investors of Class Action Against Taro Pharmaceutical Industries Ltd. (TARO) & Lead Plaintiff Deadline: December 26, 2016",2016-11-02 14:03:00 +0000,http://finance.yahoo.com/news/shareholder-alert-bronstein-gewirtz-grossman-140300989.html,"[Accesswire] - NEW YORK, NY / ACCESSWIRE / November 2, 2016 / Bronstein, Gewirtz & Grossman, LLC notifies investors that a class action lawsuit has been filed against Taro Pharmaceutical Industries Ltd. (""Taro"" ..."
TARO,TARO:US,BBG000H2ZMR0,Gurus' Stocks With Low P/E Ratios,2016-10-31 21:45:14 +0000,http://finance.yahoo.com/news/gurus-stocks-low-p-e-214514992.html,Gurus' Stocks With Low P/E Ratios
TARO,TARO:US,BBG000H2ZMR0,"Taro to Announce Second Quarter Results on November 8, 2016",2016-10-31 21:07:00 +0000,http://finance.yahoo.com/news/taro-announce-second-quarter-results-210700656.html,"[Business Wire] - Taro Pharmaceutical Industries Ltd. announced today that it plans to release its financial results for the quarter and six months ended September 30, 2016, on Tuesday, November 8, 2016."
TARO,TARO:US,BBG000H2ZMR0,IMPORTANT INVESTOR ALERT: Lundin Law PC Announces Securities Class Action Lawsuit against Taro Pharmaceutical Industries Ltd. and Encourages Investors with Losses to Contact the Firm,2016-10-31 17:12:00 +0000,http://finance.yahoo.com/news/important-investor-alert-lundin-law-171200502.html,"[Accesswire] - LOS ANGELES, CA / ACCESSWIRE / October 31, 2016 / Lundin Law PC , a shareholder rights firm, announces a class action lawsuit has been filed against Taro Pharmaceutical Industries (""Taro"" or ..."
TARO,TARO:US,BBG000H2ZMR0,"TARO SHAREHOLDER ALERT: The Law Offices of Vincent Wong Notifies Investors of Commencement of a Class Action Involving Taro Pharmaceutical Industries Ltd. and a Lead Plaintiff Deadline of December 27, 2016",2016-10-31 16:35:36 +0000,http://finance.yahoo.com/news/taro-shareholder-alert-law-offices-163536374.html,"[GlobeNewswire] - NEW YORK, Oct. 31, 2016-- The Law Offices of Vincent Wong announce that a class action lawsuit has been commenced in the USDC for the Southern District of New York on behalf of investors who purchased ..."
TARO,TARO:US,BBG000H2ZMR0,"SHAREHOLDER ALERT: Bronstein, Gewirtz & Grossman, LLC Notifies Investors of Class Action Against Taro Pharmaceutical Industries Ltd. (TARO) & Lead Plaintiff Deadline: December 26, 2016",2016-10-31 14:10:00 +0000,http://finance.yahoo.com/news/shareholder-alert-bronstein-gewirtz-grossman-141000022.html,"[GlobeNewswire] - NEW YORK, Oct. 31, 2016-- Attorney Advertising-- Bronstein, Gewirtz & Grossman, LLC notifies investors that a class action lawsuit has been filed against Taro Pharmaceutical Industries Ltd. and certain ..."
TARO,TARO:US,BBG000H2ZMR0,IMPORTANT SHAREHOLDER ALERT: Khang & Khang LLP Announces Securities Class Action Lawsuit Against Taro Pharmaceutical Industries Ltd. and Encourages Investors with Losses to Contact the Firm,2016-10-29 03:06:00 +0000,http://finance.yahoo.com/news/important-shareholder-alert-khang-khang-030600585.html,"[Accesswire] - IRVINE, CA / ACCESSWIRE / October 28, 2016 / Khang & Khang LLP (the ""Firm"") announces the filing of a class action lawsuit against Taro Pharmaceutical Industries Ltd. (""Taro"" or the ..."
TARO,TARO:US,BBG000H2ZMR0,"TARO SHAREHOLDER ALERT BY FORMER LOUISIANA ATTORNEY GENERAL: KAHN SWICK & FOTI, LLC REMINDS INVESTORS WITH LOSSES IN EXCESS OF $100,000 of Lead Plaintiff Deadline in Class Action Lawsuit Against Taro Pharmaceutical Industries Ltd. – TARO",2016-10-29 02:07:00 +0000,http://finance.yahoo.com/news/taro-shareholder-alert-former-louisiana-020700737.html,"[GlobeNewswire] - NEW ORLEANS, Oct. 28, 2016-- Kahn Swick & Foti, LLC and KSF partner, the former Attorney General of Louisiana, Charles C. Foti, Jr., remind investors that they have until December 26, 2016 to file lead ..."
TARO,TARO:US,BBG000H2ZMR0,IMPORTANT SHAREHOLDER ALERT: Lundin Law PC Announces Securities Class Action Lawsuit against Taro Pharmaceutical Industries Ltd. and Encourages Investors with Losses to Contact the Firm,2016-10-29 01:37:00 +0000,http://finance.yahoo.com/news/important-shareholder-alert-lundin-law-013700345.html,"[Business Wire] - Lundin Law PC, a shareholder rights firm, announces a class action lawsuit has been filed against Taro Pharmaceutical Industries concerning possible violations of federal securities laws between July 3, 2014 and September 9, 2016 ."
TARO,TARO:US,BBG000H2ZMR0,"Lifshitz & Miller Law Firm Announces Investigation of Advaxis, Inc., Banc of California, Inc., Biogen Inc., Franklin Resources, Inc., Juniper Pharmaceuticals, Inc., Opus Bank, Taro Pharmaceutical Industries Ltd., and Tyson Foods, Inc.",2016-10-28 17:15:00 +0000,http://finance.yahoo.com/news/lifshitz-miller-law-firm-announces-171500113.html,"[PR Newswire] - NEW YORK, Oct. 28, 2016 /PRNewswire/ -- Advaxis, Inc. (ADXS) Lifshitz & Miller announces investigation on behalf of ADXS investors. The investigation concerns whether over 1.5 million stock options were ..."
TARO,TARO:US,BBG000H2ZMR0,IMPORTANT SHAREHOLDER ALERT: Khang & Khang LLP Announces Securities Class Action Lawsuit against Taro Pharmaceutical Industries Ltd. and Encourages Investors with Losses to Contact the Firm,2016-10-28 03:45:00 +0000,http://finance.yahoo.com/news/important-shareholder-alert-khang-khang-034500517.html,"[Business Wire] - Khang & Khang LLP announces the filing of a class action lawsuit against Taro Pharmaceutical Industries Ltd. . Investors, who purchased or otherwise acquired shares between July 3, 2014 and September 9, 2016 inclusive , are encouraged to contact the Firm before the December 27, 2016 lead plaintiff motion deadline."
TARO,TARO:US,BBG000H2ZMR0,"SHAREHOLDER ALERT: Brower Piven Notifies Investors of Class Action Lawsuit And Encourages Those Who Have Losses In Excess Of $100,000 From Investment In Taro Pharmaceutical Industries Ltd. To Contact Brower Piven Before The Lead Plaintiff D",2016-10-28 01:20:00 +0000,http://finance.yahoo.com/news/shareholder-alert-brower-piven-notifies-012000342.html,"[GlobeNewswire] - STEVENSON, Md., Oct. 27, 2016-- The securities litigation law firm of Brower Piven, A Professional Corporation, announces that a class action lawsuit has been commenced in the United States District Court ..."
TARO,TARO:US,BBG000H2ZMR0,INVESTOR ALERT: Goldberg Law PC Announces Securities Class Action Lawsuit against Taro Pharmaceutical Industries Ltd. and Encourages Investors with Losses to Contact the Firm,2016-10-27 19:44:00 +0000,http://finance.yahoo.com/news/investor-alert-goldberg-law-pc-194400561.html,"[Business Wire] - Goldberg Law PC, a national shareholder rights litigation firm, announces a class action lawsuit has been filed against Taro Pharmaceutical Industries Ltd. ."
TARO,TARO:US,BBG000H2ZMR0,Robbins Arroyo LLP: Taro Pharmaceutical Industries Ltd. (TARO) Misled Shareholders According to a Recently Filed Class Action,2016-10-27 18:25:00 +0000,http://finance.yahoo.com/news/robbins-arroyo-llp-taro-pharmaceutical-182500625.html,[Business Wire] - Shareholder rights law firm Robbins Arroyo LLP announces that a class action complaint was filed against Taro Pharmaceutical Industries Ltd. in the U.S. District Court for the Southern District of New York.
TARO,TARO:US,BBG000H2ZMR0,The Law Offices of Howard G. Smith Announces the Filing of a Securities Class Action on Behalf of Taro Pharmaceutical Industries Ltd. Investors and Encourages Investors to Contact the Firm,2016-10-27 14:30:00 +0000,http://finance.yahoo.com/news/law-offices-howard-g-smith-143000347.html,"[Business Wire] - Law Offices of Howard G. Smith announces that a class action lawsuit has been filed on behalf of investors who purchased Taro Pharmaceutical Industries Ltd. securities between July 3, 2014 and September 9, 2016, inclusive ."
TARO,TARO:US,BBG000H2ZMR0,"SHAREHOLDER ALERT: Bronstein, Gewirtz & Grossman, LLC Notifies Investors of Class Action Against Taro Pharmaceutical Industries Ltd. (TARO) & Lead Plaintiff Deadline: December 26, 2016",2016-10-27 14:15:00 +0000,http://finance.yahoo.com/news/shareholder-alert-bronstein-gewirtz-grossman-141500577.html,"[PR Newswire] - NEW YORK, Oct. 27, 2016 /PRNewswire/ -- Attorney Advertising -- Bronstein, Gewirtz & Grossman, LLC notifies investors that a class action lawsuit has been filed against Taro Pharmaceutical Industries Ltd. ..."
TARO,TARO:US,BBG000H2ZMR0,IMPORTANT INVESTOR ALERT: Khang & Khang LLP Announces Securities Class Action Lawsuit against Taro Pharmaceutical Industries Ltd. and Encourages Investors with Losses to Contact the Firm,2016-10-27 04:56:00 +0000,http://finance.yahoo.com/news/important-investor-alert-khang-khang-045600370.html,"[Business Wire] - Khang & Khang LLP announces the filing of a class action lawsuit against Taro Pharmaceutical Industries Ltd. . Investors, who purchased or otherwise acquired shares between July 3, 2014 and September 9, 2016 inclusive , are encouraged to contact the Firm before the December 27, 2016 lead plaintiff motion deadline."
TARO,TARO:US,BBG000H2ZMR0,"TARO SHAREHOLDER ALERT by Former Louisiana Attorney General: Kahn Swick & Foti, LLC Reminds Investors with Losses in Excess of $100,000 of Lead Plaintiff Deadline in Class Action Lawsuit Against Taro Pharmaceutical Industries Ltd. – TARO",2016-10-27 02:07:00 +0000,http://finance.yahoo.com/news/taro-shareholder-alert-former-louisiana-020700796.html,"[Business Wire] - Kahn Swick & Foti, LLC and KSF partner, the former Attorney General of Louisiana, Charles C. Foti, Jr., remind investors that they have until December 26, 2016 to file lead plaintiff applications in a securities class action lawsuit against Taro Pharmaceutical Industries Ltd."
TARO,TARO:US,BBG000H2ZMR0,6 Undervalued Stocks Trading Below the Peter Lynch Value,2016-10-26 23:25:10 +0000,http://finance.yahoo.com/news/6-undervalued-stocks-trading-below-232510710.html,6 Undervalued Stocks Trading Below the Peter Lynch Value
TARO,TARO:US,BBG000H2ZMR0,IMPORTANT INVESTOR ALERT: Lundin Law PC Announces Securities Class Action Lawsuit against Taro Pharmaceutical Industries Ltd. and Encourages Investors with Losses to Contact the Firm,2016-10-26 22:37:00 +0000,http://finance.yahoo.com/news/important-investor-alert-lundin-law-223700895.html,"[Business Wire] - Lundin Law PC, a shareholder rights firm, announces a class action lawsuit has been filed against Taro Pharmaceutical Industries concerning possible violations of federal securities laws between July 3, 2014 and September 9, 2016 ."
TARO,TARO:US,BBG000H2ZMR0,"SHAREHOLDER ALERT: Levi & Korsinsky, LLP Notifies Shareholders of Taro Pharmaceutical Industries Ltd. of a Class Action Lawsuit and a Lead Plaintiff Deadline of December 27, 2016 – TARO",2016-10-26 18:10:53 +0000,http://finance.yahoo.com/news/shareholder-alert-levi-korsinsky-llp-181053134.html,"[GlobeNewswire] - NEW YORK, Oct. 26, 2016-- The following statement is being issued by Levi & Korsinsky, LLP:. To: All persons or entities who purchased or otherwise acquired securities of Taro Pharmaceutical Industries ..."
TARO,TARO:US,BBG000H2ZMR0,SHAREHOLDER ALERT: Goldberg Law PC Announces Securities Class Action Lawsuit against Taro Pharmaceutical Industries Ltd. and Encourages Investors with Losses to Contact the Firm,2016-10-25 21:39:00 +0000,http://finance.yahoo.com/news/shareholder-alert-goldberg-law-pc-213900950.html,"[Business Wire] - Goldberg Law PC, a national shareholder rights litigation firm, announces that a class action lawsuit has been filed against Taro Pharmaceutical Industries Ltd. ."
TARO,TARO:US,BBG000H2ZMR0,EQUITY ALERT: Rosen Law Firm Files Securities Class Action Lawsuit Against Taro Pharmaceutical Industries Ltd. - TARO,2016-10-25 20:03:00 +0000,http://finance.yahoo.com/news/equity-alert-rosen-law-firm-200300723.html,"[PR Newswire] - NEW YORK, Oct. 25, 2016 /PRNewswire/ -- Rosen Law Firm, a global investor rights law firm, announces that it has filed a class action lawsuit on behalf of purchasers of Taro Pharmaceutical Industries Ltd. ..."
TARO,TARO:US,BBG000H2ZMR0,"INO Slips On Clinical Hold, MRK Gets FDA Nod, Be All Ears For AKAO",2016-10-25 03:29:00 +0000,http://articlefeeds.nasdaq.com/~r/nasdaq/symbols/~3/-zhnSBzNTVg/ino-slips-on-clinical-hold-mrk-gets-fda-nod-be-all-ears-for-akao-20161025-00106,"INO Slips On Clinical Hold, MRK Gets FDA Nod, Be All Ears For AKAO"
TARO,TARO:US,BBG000H2ZMR0,Vanda Settles Fanapt Patent Litigation With Taro,2016-10-24 23:13:00 +0000,http://articlefeeds.nasdaq.com/~r/nasdaq/symbols/~3/ctn3LIdxQx4/vanda-settles-fanapt-patent-litigation-with-taro-20161024-01054,Vanda Settles Fanapt Patent Litigation With Taro
TARO,TARO:US,BBG000H2ZMR0,INVESTOR ALERT: Khang & Khang LLP Announces an Investigation of Taro Pharmaceutical Industries Ltd. and Encourages Investors with Losses to Contact the Firm,2016-10-20 19:28:00 +0000,http://finance.yahoo.com/news/investor-alert-khang-khang-llp-192800845.html,[Business Wire] - Khang & Khang LLP announces that it is investigating claims against Taro Pharmaceutical Industries Ltd. concerning possible violations of federal securities laws.
TARO,TARO:US,BBG000H2ZMR0,"SHAREHOLDER ALERT: Levi & Korsinsky, LLP Announces an Investigation Involving Possible Securities Fraud Violations by Taro Pharmaceutical Industries Ltd. and Certain Officers and Directors",2016-10-20 18:25:00 +0000,http://finance.yahoo.com/news/shareholder-alert-levi-korsinsky-llp-182500446.html,"[Business Wire] - Levi & Korsinsky, LLP announces that it has commenced an investigation of Taro Pharmaceutical Industries Ltd. concerning possible violations of federal securities laws by the Company and/or certain of its officers and directors."
TARO,TARO:US,BBG000H2ZMR0,SHAREHOLDER ALERT: Pomerantz Law Firm Investigates Claims On Behalf of Investors of Taro Pharmaceutical Industries Ltd. - TARO,2016-10-20 17:54:00 +0000,http://finance.yahoo.com/news/shareholder-alert-pomerantz-law-firm-175400055.html,"[PR Newswire] - NEW YORK, Oct. 20, 2016 /PRNewswire/ -- Pomerantz LLP is investigating claims on behalf of investors of Taro Pharmaceutical Industries Ltd. (""Taro"" or the ""Company"") (NYSE: TARO) (ISIN: ..."
TARO,TARO:US,BBG000H2ZMR0,IMPORTANT INVESTOR ALERT: Lundin Law PC Announces an Investigation of Taro Pharmaceutical Industries Ltd. and Advises Investors with Losses to Contact the Firm,2016-10-20 17:50:00 +0000,http://finance.yahoo.com/news/important-investor-alert-lundin-law-175000576.html,"[Business Wire] - Lundin Law PC, a shareholder rights firm, announces that it is investigating claims against Taro Pharmaceutical Industries Ltd. concerning possible violations of federal securities laws."
TARO,TARO:US,BBG000H2ZMR0,INVESTOR ALERT: Investigation of Taro Pharmaceutical Industries Ltd. Announced by Law Offices of Howard G. Smith,2016-10-20 16:08:00 +0000,http://finance.yahoo.com/news/investor-alert-investigation-taro-pharmaceutical-160800147.html,[Business Wire] - Law Offices of Howard G. Smith announces an investigation on behalf of investors of Taro Pharmaceutical Industries Ltd. concerning the Company and its officers’ possible violations of federal securities laws.
TARO,TARO:US,BBG000H2ZMR0,INVESTOR ALERT: Goldberg Law PC Announces an Investigation of Taro Pharmaceutical Industries Ltd. and Advises Investors with Losses to Contact the Firm,2016-10-20 15:13:00 +0000,http://finance.yahoo.com/news/investor-alert-goldberg-law-pc-151300936.html,[Business Wire] - Goldberg Law PC announces that it is investigating Taro Pharmaceutical Industries Ltd. concerning possible violations of federal securities laws.
TARO,TARO:US,BBG000H2ZMR0,"SHAREHOLDER ALERT: Bronstein, Gewirtz & Grossman, LLC Announces Investigation of Taro Pharmaceutical Industries Ltd. (TARO)",2016-10-20 14:20:00 +0000,http://finance.yahoo.com/news/shareholder-alert-bronstein-gewirtz-grossman-142000688.html,"[PR Newswire] - NEW YORK, Oct. 20, 2016 /PRNewswire/ -- Bronstein, Gewirtz & Grossman, LLC is investigating potential claims on behalf of purchasers of the securities of Taro Pharmaceutical Industries Ltd. (""Taro"" ..."
TARO,TARO:US,BBG000H2ZMR0,SHAREHOLDER ALERT: Khang & Khang LLP Announces an Investigation of Taro Pharmaceutical Industries Ltd. and Encourages Investors with Losses to Contact the Firm,2016-10-20 01:19:00 +0000,http://finance.yahoo.com/news/shareholder-alert-khang-khang-llp-011900607.html,[Business Wire] - Khang & Khang LLP announces that it is investigating claims against Taro Pharmaceutical Industries Ltd. concerning possible violations of federal securities laws.
TARO,TARO:US,BBG000H2ZMR0,EQUITY ALERT: Rosen Law Firm Announces Investigation of Securities Claims Against Taro Pharmaceutical Industries Ltd. - TARO,2016-10-20 00:12:00 +0000,http://finance.yahoo.com/news/equity-alert-rosen-law-firm-001200724.html,"[Business Wire] - Rosen Law Firm, a global investor rights law firm, announces it is investigating potential securities claims on behalf of shareholders of Taro Pharmaceutical Industries Ltd. resulting from allegations that Taro Pharmaceutical may have issued materially misleading business information to the investing public."
TARO,TARO:US,BBG000H2ZMR0,"ETF’s with exposure to Taro Pharmaceutical Industries Ltd. : October 14, 2016",2016-10-14 15:16:17 +0000,http://www.capitalcube.com/blog/index.php/etfs-with-exposure-to-taro-pharmaceutical-industries-ltd-october-14-2016/,"ETF’s with exposure to Taro Pharmaceutical Industries Ltd. : October 14, 2016"
TARO,TARO:US,BBG000H2ZMR0,The Man Behind India's Best Stock Faces His Biggest Test,2016-10-12 21:00:00 +0000,http://www.bloomberg.com/news/articles/2016-10-12/m-a-artist-behind-india-s-best-stock-now-faces-his-greatest-test?cmpid=yhoo.headline,The Man Behind India's Best Stock Faces His Biggest Test
