TARO,TARO:US,BBG000H2ZMR0,"ETFs with exposure to Taro Pharmaceutical Industries Ltd. : April 5, 2017",2017-04-05 21:32:31 +0000,http://finance.yahoo.com/r/d4fbaddc-0fdf-32d2-9aea-bca476bfac7f/etfs-with-exposure-to-taro-pharmaceutical-industries-ltd-april-5-2017?yptr=yahoo&.tsrc=rss,"Categories:  ETFs Yahoo FinanceClick here to see latest analysis ETFs with exposure to Taro Pharmaceutical Industries Ltd. Here are 5 ETFs with the largest exposure to TARO-US. Comparing the performance and risk of Taro Pharmaceutical Industries Ltd. with the ETFs that have exposure to it gives us some ETF choices that could give us similar returns with lower ... Read more
<b>(Read more...)</b>"
TARO,TARO:US,BBG000H2ZMR0,3 Drug Stocks With Some of the Highest Profit Margins,2017-03-17 16:07:08 +0000,http://articlefeeds.nasdaq.com/~r/nasdaq/symbols/~3/mKe55hzAWcY/3-drug-stocks-with-some-of-the-highest-profit-margins-cm762233,Investors have an absolute smorgasbord of choices when it comes to the biotech and pharmaceutical industries There are in total well over 300 publicly traded drugmakers to consider investing in Of course many of those drugmakers somewhere near 90 are also losing money The
TARO,TARO:US,BBG000H2ZMR0,3 Drug Stocks With Some of the Highest Profit Margins,2017-03-17 15:03:00 +0000,http://finance.yahoo.com/r/34208e0d-ff90-3cfe-8693-3269431d8eb0/3-drug-stocks-with-some-of-the-highest-profit-marg.aspx?yptr=yahoo&.tsrc=rss,These drugmakers really know how to maximize every dollar they receive in sales!
TARO,TARO:US,BBG000H2ZMR0,3 Drug Stocks With Some of the Highest Profit Margins,2017-03-17 15:03:00 +0000,https://www.fool.com/investing/2017/03/17/3-drug-stocks-with-some-of-the-highest-profit-marg.aspx,3 Drug Stocks With Some of the Highest Profit Margins
TARO,TARO:US,BBG000H2ZMR0,iShares MSCI EAFE Growth ETF Experiences Big Outflow,2017-03-15 16:08:29 +0000,http://articlefeeds.nasdaq.com/~r/nasdaq/symbols/~3/QqtsEAeJlEI/ishares-msci-eafe-growth-etf-experiences-big-outflow-cm761107,Looking today at week over week shares outstanding changes among the universe of ETFs covered at ETF Channel one standout is the iShares MSCI EAFE Growth ETF Symbol EFG where we have detected an approximate 54 3 million dollar outflow that s a 2 1 decrease week over week from 37 600
TARO,TARO:US,BBG000H2ZMR0,Taro Pharmaceutical Industries (TARO) Shares Cross Above 200 DMA,2017-03-01 17:13:09 +0000,http://articlefeeds.nasdaq.com/~r/nasdaq/symbols/~3/RQwibTJBkYs/taro-pharmaceutical-industries-taro-shares-cross-above-200-dma-cm754859,In trading on Wednesday shares of Taro Pharmaceutical Industries Ltd Symbol TARO crossed above their 200 day moving average of 120 58 changing hands as high as 122 31 per share Taro Pharmaceutical Industries Ltd shares are currently trading up about 1 2 on the day The chart below
TARO,TARO:US,BBG000H2ZMR0,"Gainers & Losers Of The Day: EYEG, BLPH, VSAR, MNTA, AMPH...",2017-02-21 19:50:00 +0000,http://articlefeeds.nasdaq.com/~r/nasdaq/symbols/~3/Gda4OqtvtOg/gainers--losers-of-the-day-eyeg-blph-vsar-mnta-amph-20170221-01881,"Gainers & Losers Of The Day: EYEG, BLPH, VSAR, MNTA, AMPH..."
TARO,TARO:US,BBG000H2ZMR0,"Taro Pharmaceutical Industries Ltd. :TARO-US: Earnings Analysis: Q3, 2017 By the Numbers : February 13, 2017",2017-02-13 14:18:14 +0000,http://www.capitalcube.com/blog/index.php/taro-pharmaceutical-industries-ltd-taro-us-earnings-analysis-q3-2017-by-the-numbers-february-13-2017/,"Taro Pharmaceutical Industries Ltd. :TARO-US: Earnings Analysis: Q3, 2017 By the Numbers : February 13, 2017"
TARO,TARO:US,BBG000H2ZMR0,"Taro Pharmaceutical Industries Ltd. :TARO-US: Earnings Analysis: Q3, 2017 By the Numbers : February 13, 2017",2017-02-13 14:18:14 +0000,http://finance.yahoo.com/r/dce3ef08-0c56-3753-a356-42d427e0a0cd/taro-pharmaceutical-industries-ltd-taro-us-earnings-analysis-q3-2017-by-the-numbers-february-13-2017?yptr=yahoo&.tsrc=rss,"Categories:   Yahoo Finance Get free summary analysis Taro Pharmaceutical Industries Ltd. reports financial results for the quarter ended December 31, 2016. We analyze the earnings along side the following peers of Taro Pharmaceutical Industries Ltd. – Pfizer Inc., Merck & Co., Inc., Johnson & Johnson, GlaxoSmithKline plc Sponsored ADR and Novartis AG Sponsored ADR (PFE-US, MRK-US, JNJ-US, GSK-US ... Read more    
<b>(Read more...)</b>"
TARO,TARO:US,BBG000H2ZMR0,Taro Pharma 3Q Net $140M Versus $189M Last Year,2017-02-10 15:32:00 +0000,http://www.investopedia.com/news/taro-pharma-stock-drops-reduced-3q-profit-taro/?partner=YahooSA,Taro Pharma 3Q Net $140M Versus $189M Last Year
TARO,TARO:US,BBG000H2ZMR0,Taro Pharma 3Q Net $140M Versus $189M Last Year,2017-02-10 15:32:00 +0000,http://finance.yahoo.com/r/a7451415-7667-3fca-8d7e-035174ab0f31/taro-pharma-stock-drops-reduced-3q-profit-taro?partner=YahooSA&yptr=yahoo&.tsrc=rss,Taro Pharmaceutical's third-quarter earnings and sales fell compared to last year.
TARO,TARO:US,BBG000H2ZMR0,Taro posts 3Q profit,2017-02-10 00:51:36 +0000,http://finance.yahoo.com/news/taro-posts-3q-profit-005136071.html?.tsrc=rss,"On a per-share basis, the Haifa Bay, Israel-based company said it had net income of $3.42. The drug maker posted revenue of $220.4 million in the period. Taro shares have climbed almost 1 percent since ..."
TARO,TARO:US,BBG000H2ZMR0,Taro posts 3Q profit,2017-02-10 00:51:36 +0000,http://sg.finance.yahoo.com/news/taro-posts-3q-profit-005136067.html,Taro posts 3Q profit
TARO,TARO:US,BBG000H2ZMR0,"Taro Provides Results for December 31, 2016",2017-02-09 22:05:00 +0000,http://finance.yahoo.com/news/taro-provides-results-december-31-220500795.html,"[Business Wire] - Taro Pharmaceutical Industries Ltd. today provided unaudited financial results for the three and nine months ended December 31, 2016."
TARO,TARO:US,BBG000H2ZMR0,"Taro Provides Results for December 31, 2016",2017-02-09 22:05:00 +0000,http://finance.yahoo.com/news/taro-provides-results-december-31-220500795.html?.tsrc=rss,"Taro Pharmaceutical Industries Ltd. today provided unaudited financial results for the three and nine months ended December 31, 2016."
TARO,TARO:US,BBG000H2ZMR0,Q3 2017 Taro Pharmaceutical Industries Ltd Earnings Release - After Market Close,2017-02-09 12:07:06 +0000,http://biz.yahoo.com/research/earncal/20170209.html?t=taro,Q3 2017 Taro Pharmaceutical Industries Ltd Earnings Release - After Market Close
TARO,TARO:US,BBG000H2ZMR0,"Gainers & Losers Of The Day: MNTA, BLCM, VSAR, TENX, DMTX...",2017-01-31 23:33:00 +0000,http://articlefeeds.nasdaq.com/~r/nasdaq/symbols/~3/VCATEAIBluI/gainers--losers-of-the-day-mnta-blcm-vsar-tenx-dmtx-20170131-01699,"Gainers & Losers Of The Day: MNTA, BLCM, VSAR, TENX, DMTX..."
TARO,TARO:US,BBG000H2ZMR0,"Taro to Announce Third Quarter Results on February 9, 2017",2017-01-31 22:17:00 +0000,http://finance.yahoo.com/news/taro-announce-third-quarter-results-221700929.html?.tsrc=rss,"Taro Pharmaceutical Industries Ltd. announced today that it plans to release its financial results for the quarter and nine months ended December 31, 2016, after the close of market on Thursday, February 9, 2017."
TARO,TARO:US,BBG000H2ZMR0,"Taro to Announce Third Quarter Results on February 9, 2017",2017-01-31 22:17:00 +0000,http://finance.yahoo.com/news/taro-announce-third-quarter-results-221700929.html,"[Business Wire] - Taro Pharmaceutical Industries Ltd. announced today that it plans to release its financial results for the quarter and nine months ended December 31, 2016, after the close of market on Thursday, February 9, 2017."
TARO,TARO:US,BBG000H2ZMR0,Perrigo's (PRGO) Generic Version of Topicort Okayed by FDA,2017-01-25 17:35:27 +0000,http://articlefeeds.nasdaq.com/~r/nasdaq/symbols/~3/mPc_hHbnnzs/perrigos-prgo-generic-version-of-topicort-okayed-by-fda-cm738113,Perrigo Company plc PRGO recently announced that the FDA has approved its first to file AB rated generic version of Taro Pharmaceuticals USA Inc s TARO Topicort spray 0 25 desoximetasone topical spray 0 25 indicated for the treatment of plaque psoriasis in patients of 18 years or
TARO,TARO:US,BBG000H2ZMR0,Perrigo's (PRGO) Generic Version of Topicort Okayed by FDA,2017-01-25 15:26:03 +0000,http://finance.yahoo.com/news/perrigos-prgo-generic-version-topicort-152603949.html,Perrigo's (PRGO) Generic Version of Topicort Okayed by FDA
TARO,TARO:US,BBG000H2ZMR0,Perrigo's (PRGO) Generic Version of Topicort Okayed by FDA,2017-01-25 15:26:03 +0000,http://finance.yahoo.com/news/perrigos-prgo-generic-version-topicort-152603949.html?.tsrc=rss,"Perrigo Company plc (PRGO) recently announced that the FDA has approved its first-to-file AB rated generic version of Taro Pharmaceuticals's Topicort spray, 0.25% indicated for the treatment of plaque psoriasis in patients of 18 years or above."
TARO,TARO:US,BBG000H2ZMR0,"Gainers & Losers Of The Day: CATB, MCUR, BIOC, SSH, ZYNEâ€¦",2017-01-19 20:17:00 +0000,http://articlefeeds.nasdaq.com/~r/nasdaq/symbols/~3/dyddD7IfBA0/gainers--losers-of-the-day-catb-mcur-bioc-ssh-zyne%C3%A2%C2%A6-20170119-01587,"Gainers & Losers Of The Day: CATB, MCUR, BIOC, SSH, ZYNEâ€¦"
TARO,TARO:US,BBG000H2ZMR0,"Taro Pharmaceutical Industries Ltd. – Value Analysis (NYSE:TARO) : January 13, 2017",2017-01-13 16:09:28 +0000,http://www.capitalcube.com/blog/index.php/taro-pharmaceutical-industries-ltd-value-analysis-nysetaro-january-13-2017/,"Taro Pharmaceutical Industries Ltd. – Value Analysis (NYSE:TARO) : January 13, 2017"
TARO,TARO:US,BBG000H2ZMR0,"Taro Pharmaceutical Industries Ltd. – Value Analysis (NYSE:TARO) : January 13, 2017",2017-01-13 16:09:28 +0000,http://finance.yahoo.com/r/c01d1a83-0196-3f29-8932-d001520c3fa8/taro-pharmaceutical-industries-ltd-value-analysis-nysetaro-january-13-2017?yptr=yahoo&.tsrc=rss,"Categories:   Fundamental Analysis Yahoo Finance Click here to see latest analysis Capitalcube gives Taro Pharmaceutical Industries Ltd. a score of 88. Our analysis is based on comparing Taro Pharmaceutical Industries Ltd. with the following peers – Mylan N.V., Pfizer Inc., Merck & Co., Inc., Valeant Pharmaceuticals International Inc, Johnson & Johnson, Teva Pharmaceutical Industries Limited Sponsored ADR, GlaxoSmithKline plc Sponsored ... Read more    
<b>(Read more...)</b>"
TARO,TARO:US,BBG000H2ZMR0,"Taro Pharmaceutical Industries Ltd. breached its 50 day moving average in a Bearish Manner : TARO-US : January 12, 2017",2017-01-12 12:56:37 +0000,http://finance.yahoo.com/r/a738c961-ef01-3f8b-8630-46dd28c257f0/taro-pharmaceutical-industries-ltd-breached-its-50-day-moving-average-in-a-bearish-manner-taro-us-january-12-2017?yptr=yahoo&.tsrc=rss,"Categories:   ETFs Yahoo Finance Click here to see latest analysis *Disclaimer : This is as of previous day’s closing price. Technical Indicators Below is a quick look at 5 technical indicators for Taro Pharmaceutical Industries Ltd.. More studies are available on the Technical Chart. Indicator Signal Closing Price above/below 50 Day Moving Average Bearish Closing Price above/below 200 Day ... Read more    
<b>(Read more...)</b>"
TARO,TARO:US,BBG000H2ZMR0,"Taro Pharmaceutical Industries Ltd. breached its 50 day moving average in a Bearish Manner : TARO-US : January 12, 2017",2017-01-12 12:56:37 +0000,http://www.capitalcube.com/blog/index.php/taro-pharmaceutical-industries-ltd-breached-its-50-day-moving-average-in-a-bearish-manner-taro-us-january-12-2017/,"Taro Pharmaceutical Industries Ltd. breached its 50 day moving average in a Bearish Manner : TARO-US : January 12, 2017"
TARO,TARO:US,BBG000H2ZMR0,"Gainers & Losers Of The Day: ACST, APRI, SBBP, NVDQ, NVCR",2017-01-11 23:21:00 +0000,http://articlefeeds.nasdaq.com/~r/nasdaq/symbols/~3/PEG7oGKemHs/gainers--losers-of-the-day-acst-apri-sbbp-nvdq-nvcr-20170111-00936,"Gainers & Losers Of The Day: ACST, APRI, SBBP, NVDQ, NVCR"
TARO,TARO:US,BBG000H2ZMR0,"TARO 72 HOUR DEADLINE ALERT: Approximately 72 Hours Remain; Former Louisiana Attorney General and Kahn Swick & Foti, LLC Remind Investors of Deadline in Class Action Lawsuit against Taro Pharmaceutical Industries Ltd. – TARO",2016-12-24 03:50:00 +0000,http://finance.yahoo.com/news/taro-72-hour-deadline-alert-035000545.html?.tsrc=rss,"Kahn Swick & Foti, LLC and KSF partner, the former Attorney General of Louisiana, Charles C. Foti, Jr., remind investors with large financial interests that they have only until December 26, 2016 to file lead plaintiff applications in a securities class action lawsuit against Taro Pharmaceutical Industries Ltd."
TARO,TARO:US,BBG000H2ZMR0,"TARO 72 HOUR DEADLINE ALERT: Approximately 72 Hours Remain; Former Louisiana Attorney General and Kahn Swick & Foti, LLC Remind Investors of Deadline in Class Action Lawsuit against Taro Pharmaceutical Industries Ltd. – TARO",2016-12-24 03:50:00 +0000,http://finance.yahoo.com/news/taro-72-hour-deadline-alert-035000545.html,"[Business Wire] - Kahn Swick & Foti, LLC and KSF partner, the former Attorney General of Louisiana, Charles C. Foti, Jr., remind investors with large financial interests that they have only until December 26, 2016 to file lead plaintiff applications in a securities class action lawsuit against Taro Pharmaceutical Industries Ltd."
TARO,TARO:US,BBG000H2ZMR0,"IONS Scripts History, PTLA Gets FDA Date, Strongbridge Slumps, NEOT On Watch",2016-12-23 22:54:00 +0000,http://articlefeeds.nasdaq.com/~r/nasdaq/symbols/~3/S7zA7XycUqc/ions-scripts-history-ptla-gets-fda-date-strongbridge-slumps-neot-on-watch-20161223-00490,"IONS Scripts History, PTLA Gets FDA Date, Strongbridge Slumps, NEOT On Watch"
TARO,TARO:US,BBG000H2ZMR0,"Health Care Sector Update for 12/23/2016: MYGN,DPRX,SBBP,TARO",2016-12-23 21:17:02 +0000,http://articlefeeds.nasdaq.com/~r/nasdaq/symbols/~3/z2HUSWsZGbY/health-care-sector-update-for-12232016-mygndprxsbbptaro-cm725875,Top Health Care StocksTop Health Care Stocks JNJ 0 32 JNJ 0 32 PFE 0 17 PFE 0 17 MRK 0 27 MRK 0 27 ABT 0 30 ABT 0 30 AMGN 0 59 AMGN 0 59 Health care stocks outpaced all other sectors by a considerable margin today with the NYSE Health Care Index holding on to a 0 5 advance
TARO,TARO:US,BBG000H2ZMR0,"Health Care Sector Update for 12/23/2016: SBBP,TARO,DPRX,PRAN",2016-12-23 19:17:02 +0000,http://articlefeeds.nasdaq.com/~r/nasdaq/symbols/~3/M0A0Mq9htqM/health-care-sector-update-for-12232016-sbbptarodprxpran-cm725828,Top Health Care StocksTop Health Care Stocks JNJ 0 34 JNJ 0 34 PFE 0 25 PFE 0 25 MRK 0 39 MRK 0 39 ABT 0 07 ABT 0 07 AMGN 0 44 AMGN 0 44 Health care stocks were easily outpacing all other sectors Friday with the NYSE Health Care Index jumping out to a 0 4 advance while shares
TARO,TARO:US,BBG000H2ZMR0,"INVESTOR ALERT: Levi & Korsinsky, LLP Reminds Shareholders of Taro Pharmaceutical Industries Ltd. of Commencement of a Class Action Lawsuit and a Lead Plaintiff Deadline of December 27, 2016 - TARO",2016-12-23 14:45:00 +0000,http://finance.yahoo.com/news/investor-alert-levi-korsinsky-llp-144500244.html,"[PR Newswire] - NEW YORK, Dec. 23, 2016 /PRNewswire/ -- The following statement is being issued by Levi & Korsinsky, LLP: To: All persons or entities who purchased or otherwise acquired securities of Taro Pharmaceutical ..."
TARO,TARO:US,BBG000H2ZMR0,"INVESTOR ALERT: Levi & Korsinsky, LLP Reminds Shareholders of Taro Pharmaceutical Industries Ltd. of Commencement of a Class Action Lawsuit and a Lead Plaintiff Deadline of December 27, 2016 - TARO",2016-12-23 14:45:00 +0000,http://finance.yahoo.com/news/investor-alert-levi-korsinsky-llp-144500244.html?.tsrc=rss,"NEW YORK, Dec. 23, 2016 /PRNewswire/ -- The following statement is being issued by Levi & Korsinsky, LLP: To: All persons or entities who purchased or otherwise acquired securities of Taro Pharmaceutical ..."
TARO,TARO:US,BBG000H2ZMR0,Taro Announces Sale of U.S. Rights to Keveyis® to Strongbridge Biopharma plc,2016-12-23 13:38:07 +0000,http://www.publicnow.com/view/EB0581D031F215B091850C6D9896BBB4F92D196C,"[at noodls] - HAWTHORNE, N.Y.--(BUSINESS WIRE)--Dec. 23, 2016-- Taro Pharmaceutical Industries Ltd. (NYSE:TARO) ('Taro' or the 'Company') today announced the sale of U.S. rights to Keveyis® (dichlorphenamide) to Strongbridge ..."
TARO,TARO:US,BBG000H2ZMR0,Taro Announces Sale of U.S. Rights to Keveyis® to Strongbridge Biopharma plc,2016-12-23 13:29:00 +0000,http://finance.yahoo.com/news/taro-announces-sale-u-rights-132900826.html?.tsrc=rss,"Taro Pharmaceutical Industries Ltd. today announced the sale of U.S. rights to Keveyis® to Strongbridge Biopharma plc , a global commercial-stage biopharmaceutical company focused on the development and commercialization of therapies for rare diseases with significant unmet need."
TARO,TARO:US,BBG000H2ZMR0,GPM Reminds Investors of the December 27th Deadline in the Class Action Lawsuit Against Taro Pharmaceutical Industries Ltd. and Encourages Investors to Contact the Firm,2016-12-20 19:25:00 +0000,http://finance.yahoo.com/news/gpm-reminds-investors-december-27th-192500328.html,"[Business Wire] - Glancy Prongay & Murray LLP reminds investors of the December 27, 2016 deadline to file a lead plaintiff motion in the class action lawsuit filed on behalf of investors who purchased or otherwise acquired Taro Pharmaceutical Industries, Inc."
TARO,TARO:US,BBG000H2ZMR0,GPM Reminds Investors of the December 27th Deadline in the Class Action Lawsuit Against Taro Pharmaceutical Industries Ltd. and Encourages Investors to Contact the Firm,2016-12-20 19:25:00 +0000,http://finance.yahoo.com/news/gpm-reminds-investors-december-27th-192500328.html?.tsrc=rss,"Glancy Prongay & Murray LLP reminds investors of the December 27, 2016 deadline to file a lead plaintiff motion in the class action lawsuit filed on behalf of investors who purchased or otherwise acquired Taro Pharmaceutical Industries, Inc."
TARO,TARO:US,BBG000H2ZMR0,"DEADLINE ALERT: Brower Piven Notifies Shareholders of Upcoming Deadline In Class Action Lawsuit And Urges Those With Losses In Excess of $100,000 From Investment In Taro Pharmaceutical Industries Ltd To Contact The Firm - TARO",2016-12-20 19:04:50 +0000,http://finance.yahoo.com/news/deadline-alert-brower-piven-notifies-190450116.html,"[GlobeNewswire] - STEVENSON, Md., Dec. 20, 2016-- The securities litigation law firm of Brower Piven, A Professional Corporation, announces that a class action lawsuit has been commenced in the United States District Court ..."
TARO,TARO:US,BBG000H2ZMR0,Impax Searches for a New CEO,2016-12-20 15:55:00 +0000,https://www.thestreet.com/story/13932722/1/impax-searches-for-a-new-ceo.html?puc=yahoo&cm_ven=YAHOO,Impax Searches for a New CEO
TARO,TARO:US,BBG000H2ZMR0,"TARO INVESTOR ALERT: The Law Offices of Vincent Wong Reminds Investors of a Class Action Involving Taro Pharmaceutical Industries Ltd. and a Lead Plaintiff Deadline of December 27, 2016",2016-12-20 14:53:40 +0000,http://finance.yahoo.com/news/taro-investor-alert-law-offices-145340460.html,"[GlobeNewswire] - NEW YORK, Dec. 20, 2016-- The Law Offices of Vincent Wong announce that a class action lawsuit has been commenced in the USDC for the Southern District of New York on behalf of investors who purchased ..."
TARO,TARO:US,BBG000H2ZMR0,TARO NOTICE: Rosen Law Reminds Taro Pharmaceutical Industries Ltd. Investors of Important December 27 Deadline in Class Action Filed by Firm - TARO,2016-12-19 17:53:09 +0000,http://finance.yahoo.com/news/taro-notice-rosen-law-reminds-175309755.html,"[GlobeNewswire] - NEW YORK, Dec. 19, 2016-- Rosen Law Firm, a global investor rights law firm, reminds purchasers of Taro Pharmaceutical Industries Ltd. securities from July 3, 2014 through September 9, 2016, both dates ..."
TARO,TARO:US,BBG000H2ZMR0,SHAREHOLDER REMINDER: Deadline in Class Action Lawsuit Filed Against Taro Pharmaceutical Industries Ltd. - TARO,2016-12-19 15:30:00 +0000,http://finance.yahoo.com/news/shareholder-reminder-deadline-class-action-153000587.html,"[Accesswire] - RADNOR, PA / ACCESSWIRE / December 19, 2016 / The law firm of Kessler Topaz Meltzer & Check, LLP reminds Taro Pharmaceutical Industries Ltd. (NYSE: TARO) (""Taro"" or the ""Company"") shareholders ..."
TARO,TARO:US,BBG000H2ZMR0,SHAREHOLDER REMINDER: Deadline in Class Action Lawsuit Filed Against Taro Pharmaceutical Industries Ltd. - TARO,2016-12-19 15:30:00 +0000,http://finance.yahoo.com/news/shareholder-reminder-deadline-class-action-153000587.html?.tsrc=rss,"RADNOR, PA / ACCESSWIRE / December 19, 2016 / The law firm of Kessler Topaz Meltzer & Check, LLP reminds Taro Pharmaceutical Industries Ltd. (NYSE: TARO) (""Taro"" or the ""Company"") shareholders ..."
TARO,TARO:US,BBG000H2ZMR0,"DEADLINE ALERT: Bronstein, Gewirtz & Grossman, LLC Reminds Investors of Class Action Against Taro Pharmaceutical Industries Ltd. (TARO) and Lead Plaintiff Deadline - December 26, 2016",2016-12-19 15:10:00 +0000,http://finance.yahoo.com/news/deadline-alert-bronstein-gewirtz-grossman-151000562.html,"[GlobeNewswire] - NEW YORK, Dec. 19, 2016-- Attorney Advertising-- Bronstein, Gewirtz & Grossman, LLC reminds investors that a class action lawsuit has been filed against Taro Pharmaceutical Industries Ltd. and certain ..."
TARO,TARO:US,BBG000H2ZMR0,Sun Pharma: Credit Suisse Downgrades On Generic Drug Industry Price Fixing Investigation,2016-12-19 04:08:00 +0000,http://blogs.barrons.com/asiastocks/2016/12/18/sun-pharma-credit-suisse-downgrades-after-doj-filed-first-price-fixing-charges/?mod=yahoobarrons&ru=yahoo,Sun Pharma: Credit Suisse Downgrades On Generic Drug Industry Price Fixing Investigation
TARO,TARO:US,BBG000H2ZMR0,"SHAREHOLDER ALERT: Levi & Korsinsky, LLP Reminds Shareholders of Taro Pharmaceutical Industries Ltd. of a Class Action Lawsuit and a Lead Plaintiff Deadline of December 27, 2016 – TARO",2016-12-16 16:07:33 +0000,http://finance.yahoo.com/news/shareholder-alert-levi-korsinsky-llp-160733211.html,"[GlobeNewswire] - NEW YORK, Dec. 16, 2016-- The following statement is being issued by Levi & Korsinsky, LLP:. To: All persons or entities who purchased or otherwise acquired securities of Taro Pharmaceutical Industries ..."
TARO,TARO:US,BBG000H2ZMR0,"SHAREHOLDER REMINDER: Kessler Topaz Meltzer & Check, LLP Announces Deadline in Class Action Lawsuit Filed Against Taro Pharmaceutical Industries Ltd.",2016-12-15 15:45:00 +0000,http://finance.yahoo.com/news/shareholder-reminder-kessler-topaz-meltzer-154500615.html,"[Business Wire] - The law firm of Kessler Topaz Meltzer & Check, LLP reminds Taro Pharmaceutical Industries Ltd. shareholders that a class action lawsuit has been filed on behalf of purchasers of the Company’s securities between July 3, 2014 and September 9, 2016, inclusive ."
TARO,TARO:US,BBG000H2ZMR0,December 27 Deadline Alert: Law Offices of Howard G. Smith Reminds Taro Pharmaceutical Industries Ltd. Investors of Upcoming Lead Plaintiff Deadline,2016-12-14 19:10:00 +0000,http://finance.yahoo.com/news/december-27-deadline-alert-law-191000833.html,"[Business Wire] - Law Offices of Howard G. Smith reminds investors of the upcoming December 27, 2016 deadline to file a lead plaintiff motion in the class action filed on behalf of a class of investors who purchased Taro Pharmaceutical Industries, Inc."
TARO,TARO:US,BBG000H2ZMR0,DOJ Files Charges in Generic Drug Price-Fixing Investigation,2016-12-14 17:51:00 +0000,https://www.thestreet.com/story/13925956/1/doj-files-charges-in-generic-drug-fixing-investigation.html?puc=yahoo&cm_ven=YAHOO,DOJ Files Charges in Generic Drug Price-Fixing Investigation
TARO,TARO:US,BBG000H2ZMR0,"DEADLINE ALERT: Bronstein, Gewirtz & Grossman, LLC Reminds Investors of Class Action Against Taro Pharmaceutical Industries Ltd. (TARO) and Lead Plaintiff Deadline - December 26, 2016",2016-12-12 15:06:00 +0000,http://finance.yahoo.com/news/deadline-alert-bronstein-gewirtz-grossman-150600962.html,"[Accesswire] - NEW YORK, NY / ACCESSWIRE / December 12, 2016 / Bronstein, Gewirtz & Grossman, LLC reminds investors that a class action lawsuit has been filed against Taro Pharmaceutical Industries Ltd. (""Taro"" ..."
TARO,TARO:US,BBG000H2ZMR0,"INVESTOR ALERT: Levi & Korsinsky, LLP Reminds Shareholders of Taro Pharmaceutical Industries Ltd. of a Class Action Lawsuit and a Lead Plaintiff Deadline of December 27, 2016",2016-12-12 15:03:00 +0000,http://finance.yahoo.com/news/investor-alert-levi-korsinsky-llp-150300157.html,"[Business Wire] - The following statement is being issued by Levi & Korsinsky, LLP:"
TARO,TARO:US,BBG000H2ZMR0,"TARO SHAREHOLDER ALERT BY FORMER LOUISIANA ATTORNEY GENERAL: KAHN SWICK & FOTI, LLC REMINDS INVESTORS WITH LOSSES IN EXCESS OF $100,000 of Lead Plaintiff Deadline in Class Action Lawsuit Against Taro Pharmaceutical Industries Ltd. – TARO",2016-12-10 03:50:00 +0000,http://finance.yahoo.com/news/taro-shareholder-alert-former-louisiana-035000122.html,"[GlobeNewswire] - NEW ORLEANS, Dec. 09, 2016-- Kahn Swick & Foti, LLC and KSF partner, the former Attorney General of Louisiana, Charles C. Foti, Jr., remind investors that they have until December 26, 2016 to file lead ..."
TARO,TARO:US,BBG000H2ZMR0,"SHAREHOLDER ALERT: Bronstein, Gewirtz & Grossman, LLC Reminds Investors of Class Action Against Taro Pharmaceutical Industries Ltd. (TARO) and Lead Plaintiff Deadline - December 26, 2016",2016-12-09 15:05:00 +0000,http://finance.yahoo.com/news/shareholder-alert-bronstein-gewirtz-grossman-150500520.html,"[Accesswire] - NEW YORK, NY / ACCESSWIRE / December 9, 2016 / Bronstein, Gewirtz & Grossman, LLC reminds investors that a class action lawsuit has been filed against Taro Pharmaceutical Industries Ltd. (""Taro"" ..."
