RESULT_COUNT: 274,PAGE_SIZE: 10000,CURRENT_PAGE: 1,TOTAL_PAGES: 1,API_CALL_CREDITS: 1
TICKER,FIGI_TICKER,FIGI,TITLE,PUBLICATION_DATE,URL,SUMMARY
TARO,TARO:US,BBG000H2ZMR0,"Taro Pharmaceutical Industries Ltd. breached its 50 day moving average in a Bearish Manner : TARO-US : October 19, 2017",2017-10-19 12:15:43 +0000,http://finance.yahoo.com/r/ff0079ad-ef15-3ce0-ae8d-d1f6b8aaf04d/taro-pharmaceutical-industries-ltd-breached-its-50-day-moving-average-in-a-bearish-manner-taro-us-october-19-2017?yptr=yahoo&.tsrc=rss,"Categories:  ETFs Yahoo FinanceGet full CapitalCube analysis *Disclaimer : This is as of previous day’s closing price. Technical Indicators Below is a quick look at 5 technical indicators for Taro Pharmaceutical Industries Ltd.. More studies are available on the Technical Chart. Indicator Signal Closing Price above/below 50 Day Moving Average Bearish Closing Price above/below 200 Day Moving Average ... Read more
<b>(Read more...)</b>"
TARO,TARO:US,BBG000H2ZMR0,Validea Benjamin Graham Strategy Daily Upgrade Report - 10/19/2017,2017-10-19 08:49:03 +0000,http://articlefeeds.nasdaq.com/~r/nasdaq/symbols/~3/EHyCBz6Ow6k/validea-benjamin-graham-strategy-daily-upgrade-report-10192017-cm861728,The following are today s upgrades for Validea s Value Investor model based on the published strategy of Benjamin Graham This deep value methodology screens for stocks that have low P B and P E ratios along with low debt and solid long term earnings growth The following are today s upgrades
TARO,TARO:US,BBG000H2ZMR0,See what the IHS Markit Score report has to say about Taro Pharmaceutical Industries Ltd.,2017-10-17 12:05:09 +0000,https://finance.yahoo.com/news/see-ihs-markit-score-report-120509149.html?.tsrc=rss,Taro Pharmaceutical Industries Ltd NYSE:TARO
TARO,TARO:US,BBG000H2ZMR0,See what the IHS Markit Score report has to say about Taro Pharmaceutical Industries Ltd.,2017-10-06 12:02:34 +0000,https://finance.yahoo.com/news/see-ihs-markit-score-report-120234797.html?.tsrc=rss,Taro Pharmaceutical Industries Ltd NYSE:TARO
TARO,TARO:US,BBG000H2ZMR0,Does Taro Pharmaceutical Industries Ltd’s (TARO) PE Ratio Signal A Buying Opportunity?,2017-09-29 17:52:12 +0000,https://finance.yahoo.com/news/does-taro-pharmaceutical-industries-ltd-175212178.html?.tsrc=rss,"Taro Pharmaceutical Industries Ltd (NYSE:TARO) is trading with a trailing P/E of 11.4x, which is lower than the industry average of 23.4x. While this makes TARO appear like a greatRead More..."
TARO,TARO:US,BBG000H2ZMR0,TARO Crosses Above Key Moving Average Level,2017-09-25 21:47:42 +0000,http://articlefeeds.nasdaq.com/~r/nasdaq/symbols/~3/F7MPobtX6dg/taro-crosses-above-key-moving-average-level-cm850654,In trading on Monday shares of Taro Pharmaceutical Industries Ltd Symbol TARO crossed above their 200 day moving average of 110 39 changing hands as high as 111 25 per share Taro Pharmaceutical Industries Ltd shares are currently trading up about 1 3 on the day The chart below shows
TARO,TARO:US,BBG000H2ZMR0,"Taro Pharmaceutical Industries Ltd. breached its 50 day moving average in a Bullish Manner : TARO-US : September 22, 2017",2017-09-22 12:05:30 +0000,http://finance.yahoo.com/r/0de75523-0db2-3179-9fbc-808e386eb7af/taro-pharmaceutical-industries-ltd-breached-its-50-day-moving-average-in-a-bullish-manner-taro-us-september-22-2017?yptr=yahoo&.tsrc=rss,"Categories:  ETFs Yahoo FinanceGet full CapitalCube analysis *Disclaimer : This is as of previous day’s closing price. Technical Indicators Below is a quick look at 5 technical indicators for Taro Pharmaceutical Industries Ltd.. More studies are available on the Technical Chart. Indicator Signal Closing Price above/below 50 Day Moving Average Bullish Closing Price above/below 200 Day Moving Average ... Read more
<b>(Read more...)</b>"
TARO,TARO:US,BBG000H2ZMR0,"ETFs with exposure to Taro Pharmaceutical Industries Ltd. : September 14, 2017",2017-09-14 23:10:23 +0000,http://finance.yahoo.com/r/4a4b2083-a5e2-3ee2-9dee-6c23826d188a/etfs-with-exposure-to-taro-pharmaceutical-industries-ltd-september-14-2017?yptr=yahoo&.tsrc=rss,"Categories:  ETFs Yahoo FinanceClick here to see latest analysis ETFs with exposure to Taro Pharmaceutical Industries Ltd. Here are 5 ETFs with the largest exposure to TARO-US. Comparing the performance and risk of Taro Pharmaceutical Industries Ltd. with the ETFs that have exposure to it gives us some ETF choices that could give us similar returns with lower ... Read more
<b>(Read more...)</b>"
TARO,TARO:US,BBG000H2ZMR0,"Taro Pharmaceutical Industries Ltd. :TARO-US: Earnings Analysis: Q1, 2018 By the Numbers : September 13, 2017",2017-09-13 15:40:04 +0000,http://finance.yahoo.com/r/34f518d5-376c-38c2-903c-1a7a4c020ef0/taro-pharmaceutical-industries-ltd-taro-us-earnings-analysis-q1-2018-by-the-numbers-september-13-2017?yptr=yahoo&.tsrc=rss,"Categories:  Yahoo FinanceGet free summary analysis Taro Pharmaceutical Industries Ltd. reports financial results for the quarter ended June 30, 2017. We analyze the earnings along side the following peers of Taro Pharmaceutical Industries Ltd. – Mylan N.V., Valeant Pharmaceuticals International Inc, Merck & Co., Inc., Pfizer Inc., Johnson & Johnson, Teva Pharmaceutical Industries Limited Sponsored ADR, GlaxoSmithKline ... Read more
<b>(Read more...)</b>"
TARO,TARO:US,BBG000H2ZMR0,See what the IHS Markit Score report has to say about Taro Pharmaceutical Industries Ltd.,2017-09-12 12:04:30 +0000,https://finance.yahoo.com/news/see-ihs-markit-score-report-120430204.html?.tsrc=rss,Taro Pharmaceutical Industries Ltd NYSE:TARO
TARO,TARO:US,BBG000H2ZMR0,See what the IHS Markit Score report has to say about Taro Pharmaceutical Industries Ltd.,2017-09-11 12:04:40 +0000,https://finance.yahoo.com/news/see-ihs-markit-score-report-120440066.html?.tsrc=rss,Short interest is low for TARO with fewer than 5% of shares on loan.  The last change in the short interest score occurred more than 1 month ago and implies that there has been little change in sentiment among investors who seek to profit from falling equity prices.
TARO,TARO:US,BBG000H2ZMR0,Strong Offense and Defense Necessary to Prepare for Market Downturns,2017-09-07 14:48:41 +0000,http://articlefeeds.nasdaq.com/~r/nasdaq/symbols/~3/ojXANdCCwUM/strong-offense-and-defense-necessary-to-prepare-for-market-downturns-cm842153,As the September 7th kick off of this year s National Football League season approaches we re reminded of the importance of both strong offensive and defensive lines of players The same argument holds true in terms of a winning investment portfolio Building a resilient well performing
TARO,TARO:US,BBG000H2ZMR0,Taro Announces Joining of CEO,2017-09-01 20:05:00 +0000,https://finance.yahoo.com/news/taro-announces-joining-ceo-200500432.html?.tsrc=rss,"Taro Pharmaceutical Industries Ltd. announced today that Mr. Uday Baldota has joined the Company as its Chief Executive Officer effective August 28, 2017."
TARO,TARO:US,BBG000H2ZMR0,Featured Company News - Dr. Reddy's Laboratories Announces the Out-Licensing of DFD-06 to Encore Dermatology,2017-08-24 11:40:00 +0000,https://finance.yahoo.com/news/featured-company-news-dr-reddys-114000797.html?.tsrc=rss,"Research Desk Line-up: Taro Pharma Industries Post Earnings Coverage LONDON, UK / ACCESSWIRE / August 24, 2017 / Pro-Trader Daily takes a look at the latest corporate events and news making the headlines ..."
TARO,TARO:US,BBG000H2ZMR0,"Investors, the Trigger is Not Your Friend",2017-08-22 14:37:11 +0000,http://articlefeeds.nasdaq.com/~r/nasdaq/symbols/~3/GgyWwpLaAjk/investors-the-trigger-is-not-your-friend-cm835214,It seems that financial advisers like individual investors can fall prey to impulsive investment decision making And it can hurt their clients pocketbooks It seems that financial advisers like individual investors can fall prey to impulsive investment decision making And it can hurt
TARO,TARO:US,BBG000H2ZMR0,"Taro Pharmaceutical Industries Ltd. – Value Analysis (NYSE:TARO) : August 21, 2017",2017-08-21 23:34:00 +0000,http://finance.yahoo.com/r/8d867503-aaa0-338a-a2fd-3302ac38820c/taro-pharmaceutical-industries-ltd-value-analysis-nysetaro-august-21-2017?yptr=yahoo&.tsrc=rss,"Categories:  Fundamental Analysis Yahoo FinanceClick here to see latest analysis Capitalcube gives Taro Pharmaceutical Industries Ltd. a score of 75. Our analysis is based on comparing Taro Pharmaceutical Industries Ltd. with the following peers – Mylan N.V., Valeant Pharmaceuticals International Inc, Merck & Co., Inc., Pfizer Inc., Johnson & Johnson, Teva Pharmaceutical Industries Limited Sponsored ADR, GlaxoSmithKline plc Sponsored ... Read more
<b>(Read more...)</b>"
TARO,TARO:US,BBG000H2ZMR0,See what the IHS Markit Score report has to say about Taro Pharmaceutical Industries Ltd.,2017-08-21 12:02:43 +0000,https://finance.yahoo.com/news/see-ihs-markit-score-report-120243051.html?.tsrc=rss,Short interest is low for TARO with fewer than 5% of shares on loan.  The net inflows of $1.04 billion over the last one-month into ETFs that hold TARO are among the lowest of the last year and appear to be slowing.
TARO,TARO:US,BBG000H2ZMR0,See what the IHS Markit Score report has to say about Taro Pharmaceutical Industries Ltd.,2017-08-14 12:01:39 +0000,https://finance.yahoo.com/news/see-ihs-markit-score-report-120139382.html?.tsrc=rss,"Short interest is low for TARO with fewer than 5% of shares on loan.  Additionally, this was an improvement in sentiment as investors who seek to profit from falling equity prices reduced their short positions on August 10.  The net inflows of $1.59 billion over the last one-month into ETFs that hold TARO are not among the highest of the last year and have been slowing."
TARO,TARO:US,BBG000H2ZMR0,See what the IHS Markit Score report has to say about Taro Pharmaceutical Industries Ltd.,2017-08-12 12:03:17 +0000,https://finance.yahoo.com/news/see-ihs-markit-score-report-120243329.html?.tsrc=rss,Short interest is moderate for TARO with between 5 and 10% of shares outstanding currently on loan.  The net inflows of $1.66 billion over the last one-month into ETFs that hold TARO are not among the highest of the last year and have been slowing.
TARO,TARO:US,BBG000H2ZMR0,"IHS Markit Score upgrades Taro Pharmaceutical Industries Ltd to 71 out of 100, despite ranking positively in only one IHS Markit category.",2017-08-10 12:03:39 +0000,https://finance.yahoo.com/news/ihs-markit-score-upgrades-taro-120339004.html?.tsrc=rss,Short interest is low for TARO with fewer than 5% of shares on loan.  The net inflows of $1.28 billion over the last one-month into ETFs that hold TARO are not among the highest of the last year and have been slowing.
TARO,TARO:US,BBG000H2ZMR0,Taro posts 1Q profit,2017-08-09 19:16:04 +0000,https://finance.yahoo.com/news/taro-posts-1q-profit-090349532.html?.tsrc=rss,"On a per-share basis, the Haifa Bay, Israel-based company said it had net income of $1.35. The drug maker posted revenue of $161.3 million in the period. Taro shares have increased nearly 4 percent since ..."
TARO,TARO:US,BBG000H2ZMR0,Oversold Conditions For Taro Pharmaceutical Industries (TARO),2017-08-09 17:38:11 +0000,http://articlefeeds.nasdaq.com/~r/nasdaq/symbols/~3/BFNZFfMUigc/oversold-conditions-for-taro-pharmaceutical-industries-taro-cm829625,Legendary investor Warren Buffett advises to be fearful when others are greedy and be greedy when others are fearful One way we can try to measure the level of fear in a given stock is through a technical analysis indicator called the Relative Strength Index or RSI which measures momentum on
TARO,TARO:US,BBG000H2ZMR0,"Taro Pharmaceutical Industries Ltd. breached its 50 day moving average in a Bearish Manner : TARO-US : August 9, 2017",2017-08-09 13:22:49 +0000,http://finance.yahoo.com/r/25f559e5-348b-3267-9d22-480fafb5b5bb/taro-pharmaceutical-industries-ltd-breached-its-50-day-moving-average-in-a-bearish-manner-taro-us-august-9-2017?yptr=yahoo&.tsrc=rss,"Categories:  ETFs Yahoo FinanceGet full CapitalCube analysis *Disclaimer : This is as of previous day’s closing price. Technical Indicators Below is a quick look at 5 technical indicators for Taro Pharmaceutical Industries Ltd.. More studies are available on the Technical Chart. Indicator Signal Closing Price above/below 50 Day Moving Average Bearish Closing Price above/below 200 Day Moving Average ... Read more
<b>(Read more...)</b>"
TARO,TARO:US,BBG000H2ZMR0,Validea Benjamin Graham Strategy Daily Upgrade Report - 8/9/2017,2017-08-09 08:33:32 +0000,http://articlefeeds.nasdaq.com/~r/nasdaq/symbols/~3/BCoTkPrkYgQ/validea-benjamin-graham-strategy-daily-upgrade-report-892017-cm829163,The following are today s upgrades for Validea s Value Investor model based on the published strategy of Benjamin Graham This deep value methodology screens for stocks that have low P B and P E ratios along with low debt and solid long term earnings growth The following are today s upgrades
TARO,TARO:US,BBG000H2ZMR0,"Sensex, Nifty Extend Losses For Third Day",2017-08-09 07:00:00 +0000,http://articlefeeds.nasdaq.com/~r/nasdaq/symbols/~3/qKiAd19O50E/sensex-nifty-extend-losses-for-third-day-20170809-00451,"Sensex, Nifty Extend Losses For Third Day"
TARO,TARO:US,BBG000H2ZMR0,Taro Provides Results for Quarter Ended June 2017,2017-08-08 22:48:00 +0000,https://finance.yahoo.com/news/taro-provides-results-quarter-ended-224800342.html?.tsrc=rss,"Taro Pharmaceutical Industries Ltd. today provided unaudited financial results for the quarter ended June 30, 2017."
TARO,TARO:US,BBG000H2ZMR0,TARO Crosses Below Key Moving Average Level,2017-08-08 21:36:09 +0000,http://articlefeeds.nasdaq.com/~r/nasdaq/symbols/~3/Ftd7CM7pMqQ/taro-crosses-below-key-moving-average-level-cm829077,In trading on Tuesday shares of Taro Pharmaceutical Industries Ltd Symbol TARO crossed below their 200 day moving average of 110 30 changing hands as low as 109 56 per share Taro Pharmaceutical Industries Ltd shares are currently trading down about 3 3 on the day The chart below
TARO,TARO:US,BBG000H2ZMR0,"Gainers & Losers Of Aug.2: ONCE, ILMN, XENT, NOVN, FLKS...",2017-08-02 22:00:00 +0000,http://articlefeeds.nasdaq.com/~r/nasdaq/symbols/~3/9F0Ot6PnVn8/gainers--losers-of-aug2-once-ilmn-xent-novn-flks-20170802-02061,"Gainers & Losers Of Aug.2: ONCE, ILMN, XENT, NOVN, FLKS..."
TARO,TARO:US,BBG000H2ZMR0,"Taro to Announce First Quarter Results on August 8, 2017",2017-08-02 12:00:00 +0000,https://finance.yahoo.com/news/taro-announce-first-quarter-results-120000235.html?.tsrc=rss,"Taro Pharmaceutical Industries Ltd. announced today that it plans to release its financial results for the quarter ended June 30, 2017, after the close of market on Tuesday, August 8, 2017."
TARO,TARO:US,BBG000H2ZMR0,"Gainers & Losers Of July 31: SBBP, AKCA, ACRX, ICPT, ZYNE...",2017-07-31 22:54:00 +0000,http://articlefeeds.nasdaq.com/~r/nasdaq/symbols/~3/DnLgQw23eVk/gainers--losers-of-july-31-sbbp-akca-acrx-icpt-zyne-20170731-01572,"Gainers & Losers Of July 31: SBBP, AKCA, ACRX, ICPT, ZYNE..."
TARO,TARO:US,BBG000H2ZMR0,[$$] In Hot Pursuit of Indian Growth Stocks,2017-07-14 01:02:00 +0000,http://finance.yahoo.com/r/1ef57f63-9d53-370a-979c-323b24bffc9d/in-hot-pursuit-of-indian-growth-stocks-1499994146?mod=yahoobarrons&ru=yahoo&yptr=yahoo&.tsrc=rss,"Former police superintendent Sunil Asnani is on the patrol for growth stocks in India.  Prior to managing Matthews Asia’s $130 million India strategy, Asnani worked on the beat in the southern Indian state of Kerala.  The market is one of Asia’s priciest, while there are concerns about corporate governance and bad assets in the banking system persist."
TARO,TARO:US,BBG000H2ZMR0,"ETFs with exposure to Taro Pharmaceutical Industries Ltd. : July 12, 2017",2017-07-12 19:00:04 +0000,http://finance.yahoo.com/r/72b0b7a9-c2e4-3753-9e92-24a38abc7971/etfs-with-exposure-to-taro-pharmaceutical-industries-ltd-july-12-2017?yptr=yahoo&.tsrc=rss,"Categories:  ETFs Yahoo FinanceClick here to see latest analysis ETFs with exposure to Taro Pharmaceutical Industries Ltd. Here are 5 ETFs with the largest exposure to TARO-US. Comparing the performance and risk of Taro Pharmaceutical Industries Ltd. with the ETFs that have exposure to it gives us some ETF choices that could give us similar returns with lower ... Read more
<b>(Read more...)</b>"
TARO,TARO:US,BBG000H2ZMR0,"ETFs with exposure to Taro Pharmaceutical Industries Ltd. : June 27, 2017",2017-06-27 19:48:57 +0000,http://finance.yahoo.com/r/16934860-78e4-3d31-ba2d-3351e6f53383/etfs-with-exposure-to-taro-pharmaceutical-industries-ltd-june-27-2017?yptr=yahoo&.tsrc=rss,"Categories:  ETFs Yahoo FinanceClick here to see latest analysis ETFs with exposure to Taro Pharmaceutical Industries Ltd. Here are 5 ETFs with the largest exposure to TARO-US. Comparing the performance and risk of Taro Pharmaceutical Industries Ltd. with the ETFs that have exposure to it gives us some ETF choices that could give us similar returns with lower ... Read more
<b>(Read more...)</b>"
TARO,TARO:US,BBG000H2ZMR0,"Taro Pharmaceutical Industries Ltd. :TARO-US: Earnings Analysis: Q4, 2017 By the Numbers : June 26, 2017",2017-06-26 14:43:46 +0000,http://finance.yahoo.com/r/cd3b2a1c-fa55-3d26-a693-776cf976fff2/taro-pharmaceutical-industries-ltd-taro-us-earnings-analysis-q4-2017-by-the-numbers-june-26-2017?yptr=yahoo&.tsrc=rss,"Categories:  Yahoo FinanceGet free summary analysis Taro Pharmaceutical Industries Ltd. reports financial results for the quarter ended March 31, 2017. We analyze the earnings along side the following peers of Taro Pharmaceutical Industries Ltd. – Mylan N.V., Pfizer Inc., Merck & Co., Inc., Valeant Pharmaceuticals International Inc, Teva Pharmaceutical Industries Limited Sponsored ADR, GlaxoSmithKline plc Sponsored ADR, ... Read more
<b>(Read more...)</b>"
TARO,TARO:US,BBG000H2ZMR0,The Long Case For Taro Pharmaceutical,2017-06-22 22:20:28 +0000,http://articlefeeds.nasdaq.com/~r/nasdaq/symbols/~3/vq8cOU9r0MA/the-long-case-for-taro-pharmaceutical-cm807125,By Alessandro Villadei ByAlessandro Villadei Target Price and Rationale Target Price and RationaleTarget Price and Rationale Taro Pharmaceutical TARO is a recommended buy with a price target of 175 Taro Pharmaceutical TARO is a recommended buy with a price target of 175
TARO,TARO:US,BBG000H2ZMR0,"Taro Annual Report on Form 20-F Available for Fiscal Year Ended March 31, 2017",2017-06-22 11:30:00 +0000,https://finance.yahoo.com/news/taro-annual-report-form-20-113000892.html?.tsrc=rss,"Taro Pharmaceutical Industries Ltd. announced that its Annual Report on Form 20-F for the fiscal year ended March 31, 2017, filed with the Securities and Exchange Commission , is available within the Investor Relations section of Taro’s website at www.taro.com."
TARO,TARO:US,BBG000H2ZMR0,"Taro Pharmaceutical Industries Ltd. breached its 50 day moving average in a Bullish Manner : TARO-US : June 21, 2017",2017-06-21 12:08:07 +0000,http://finance.yahoo.com/r/e54280f2-76ae-3d5b-873b-13d304c378cb/taro-pharmaceutical-industries-ltd-breached-its-50-day-moving-average-in-a-bullish-manner-taro-us-june-21-2017?yptr=yahoo&.tsrc=rss,"Categories:  ETFs Yahoo FinanceGet full CapitalCube analysis *Disclaimer : This is as of previous day’s closing price. Technical Indicators Below is a quick look at 5 technical indicators for Taro Pharmaceutical Industries Ltd.. More studies are available on the Technical Chart. Indicator Signal Closing Price above/below 50 Day Moving Average Bullish Closing Price above/below 200 Day Moving Average ... Read more
<b>(Read more...)</b>"
TARO,TARO:US,BBG000H2ZMR0,"Gainers & Losers Of June 14: OMER, EPZM, ALXN, SBBP, GBT...",2017-06-14 21:57:00 +0000,http://articlefeeds.nasdaq.com/~r/nasdaq/symbols/~3/0TN-bpW7JaQ/gainers--losers-of-june-14-omer-epzm-alxn-sbbp-gbt-20170614-01310,"Gainers & Losers Of June 14: OMER, EPZM, ALXN, SBBP, GBT..."
TARO,TARO:US,BBG000H2ZMR0,Oversold Conditions For Taro Pharmaceutical Industries (TARO),2017-05-24 21:30:34 +0000,http://articlefeeds.nasdaq.com/~r/nasdaq/symbols/~3/YUcuoNcD0ng/oversold-conditions-for-taro-pharmaceutical-industries-taro-cm794191,Legendary investor Warren Buffett advises to be fearful when others are greedy and be greedy when others are fearful One way we can try to measure the level of fear in a given stock is through a technical analysis indicator called the Relative Strength Index or RSI which measures momentum on
TARO,TARO:US,BBG000H2ZMR0,Edited Transcript of TARO earnings conference call or presentation 23-May-17 12:00pm GMT,2017-05-24 21:09:34 +0000,https://finance.yahoo.com/news/edited-transcript-taro-earnings-conference-181220092.html?.tsrc=rss,Q4 2017 Taro Pharmaceutical Industries Ltd Earnings Call
TARO,TARO:US,BBG000H2ZMR0,"Perrigo, Taro Show Perils of Failure to Branch in Branded Drugs",2017-05-23 20:05:00 +0000,http://finance.yahoo.com/r/b38ce077-c704-3787-b75f-61f9cf2b6074/perrigo-taro-show-perils-of-failure-to-branch-in-branded-drugs.html?puc=yahoo&cm_ven=YAHOO&yptr=yahoo&.tsrc=rss,The latest earnings from two of the largest generic drug makers show how important it is for generic firms to have their own stable of higher-margin branded products.
TARO,TARO:US,BBG000H2ZMR0,Taro posts 4Q profit,2017-05-22 22:56:30 +0000,https://finance.yahoo.com/news/taro-posts-4q-profit-225630889.html?.tsrc=rss,"On a per-share basis, the Haifa Bay, Israel-based company said it had profit of $2.05. The drug maker posted revenue of $196.4 million in the period. For the year, the company reported profit of $456.4 ..."
TARO,TARO:US,BBG000H2ZMR0,"Taro Provides Results for Year Ended March 31, 2017",2017-05-22 22:41:00 +0000,https://finance.yahoo.com/news/taro-provides-results-ended-march-224100274.html?.tsrc=rss,"Taro Pharmaceutical Industries Ltd. today provided unaudited financial results for the quarter and fiscal year ended March 31, 2017."
TARO,TARO:US,BBG000H2ZMR0,"Taro to Announce Results for Year Ended March 31, 2017 on May 22, 2017",2017-05-15 22:55:00 +0000,https://finance.yahoo.com/news/taro-announce-results-ended-march-225500545.html?.tsrc=rss,"Taro Pharmaceutical Industries Ltd. announced today that it plans to release its financial results for the fiscal year ended March 31, 2017, on Monday, May 22, 2017."
TARO,TARO:US,BBG000H2ZMR0,"Taro Pharmaceutical Industries Ltd. breached its 50 day moving average in a Bearish Manner : TARO-US : May 15, 2017",2017-05-15 13:14:57 +0000,http://finance.yahoo.com/r/a476059b-6934-3b8e-af19-c7cd399ea165/taro-pharmaceutical-industries-ltd-breached-its-50-day-moving-average-in-a-bearish-manner-taro-us-may-15-2017?yptr=yahoo&.tsrc=rss,"Categories:  ETFs Yahoo FinanceClick here to see latest analysis *Disclaimer : This is as of previous day’s closing price. Technical Indicators Below is a quick look at 5 technical indicators for Taro Pharmaceutical Industries Ltd.. More studies are available on the Technical Chart. Indicator Signal Closing Price above/below 50 Day Moving Average Bearish Closing Price above/below 200 Day ... Read more
<b>(Read more...)</b>"
TARO,TARO:US,BBG000H2ZMR0,"Taro Pharmaceutical Industries Ltd. breached its 50 day moving average in a Bearish Manner : TARO-US : May 4, 2017",2017-05-04 12:55:10 +0000,http://finance.yahoo.com/r/35016539-d334-3d62-a5ae-1b8c012ef212/taro-pharmaceutical-industries-ltd-breached-its-50-day-moving-average-in-a-bearish-manner-taro-us-may-4-2017?yptr=yahoo&.tsrc=rss,"Categories:  ETFs Yahoo FinanceClick here to see latest analysis *Disclaimer : This is as of previous day’s closing price. Technical Indicators Below is a quick look at 5 technical indicators for Taro Pharmaceutical Industries Ltd.. More studies are available on the Technical Chart. Indicator Signal Closing Price above/below 50 Day Moving Average Bearish Closing Price above/below 200 Day ... Read more
<b>(Read more...)</b>"
TARO,TARO:US,BBG000H2ZMR0,"Taro Pharmaceutical Industries Ltd. – Value Analysis (NYSE:TARO) : April 25, 2017",2017-04-25 20:34:52 +0000,http://finance.yahoo.com/r/00c48b14-c885-3d93-96a8-699b36e05267/taro-pharmaceutical-industries-ltd-value-analysis-nysetaro-april-25-2017?yptr=yahoo&.tsrc=rss,"Categories:  Fundamental Analysis Yahoo FinanceClick here to see latest analysis Capitalcube gives Taro Pharmaceutical Industries Ltd. a score of 84. Our analysis is based on comparing Taro Pharmaceutical Industries Ltd. with the following peers – Mylan N.V., Pfizer Inc., Merck & Co., Inc., Valeant Pharmaceuticals International Inc, Johnson & Johnson, Teva Pharmaceutical Industries Limited Sponsored ADR, GlaxoSmithKline plc Sponsored ... Read more
<b>(Read more...)</b>"
TARO,TARO:US,BBG000H2ZMR0,"Taro Pharmaceutical Industries Ltd. breached its 50 day moving average in a Bearish Manner : TARO-US : April 24, 2017",2017-04-24 12:43:02 +0000,http://finance.yahoo.com/r/747b38c1-9069-338d-8cd7-75729f695f04/taro-pharmaceutical-industries-ltd-breached-its-50-day-moving-average-in-a-bearish-manner-taro-us-april-24-2017?yptr=yahoo&.tsrc=rss,"Categories:  ETFs Yahoo FinanceClick here to see latest analysis *Disclaimer : This is as of previous day’s closing price. Technical Indicators Below is a quick look at 5 technical indicators for Taro Pharmaceutical Industries Ltd.. More studies are available on the Technical Chart. Indicator Signal Closing Price above/below 50 Day Moving Average Bearish Closing Price above/below 200 Day ... Read more
<b>(Read more...)</b>"
TARO,TARO:US,BBG000H2ZMR0,"Gainers & Losers Of Apr.19: SNGX, IMGN, CBLI, SSH, AKTX...",2017-04-19 20:37:00 +0000,http://articlefeeds.nasdaq.com/~r/nasdaq/symbols/~3/DYS8iDXcwPk/gainers--losers-of-apr19-sngx-imgn-cbli-ssh-aktx-20170419-01430,"Gainers & Losers Of Apr.19: SNGX, IMGN, CBLI, SSH, AKTX..."
